basepk,hid,speechdate,pid,opid,speakeroldname,speakerposition,maintopic,subtopic,subsubtopic,speechtext,speakerparty,speakerriding,speakername,speakerurl
4768517,ca.proc.d.2019-02-04.10467868,2019-02-04,4c0122f7-7958-4cbd-b99e-9d70a4dca1e8,230115,"Mr. Pierre-Luc Dusseault (Sherbrooke, NDP)",,Government Orders,Business of Supply,Opposition Motion—Taxes,"Mr. Speaker, it is a pleasure for me to rise today to speak to the Conservative opposition motion.
I feel as though I am dreaming. It was only last Tuesday that the Conservatives moved another motion on taxes. Today is Monday, February 4, and we have a motion before us that deals with basically the same subject, does pretty much the same thing and will probably have the same outcome. When you do the same thing twice, you often get the same outcome.
Still, I find it strange that the Conservatives have moved another motion about taxes. Its purpose is definitely to scare us and to scare Canadians. It also contains several paragraphs, from (a) to (k). It says things like “would have cost up to $2,000 per household”; “up to $2,000”; “up to $225”—we are talking about tax credits here—“up to $560 per student”; “up to $85 per worker”; “could cost up to $1,000”; “as high as $5,000 in the future”.
Note the conditional tense used here. Paragraphs (j) and (k) even state, “this government tried to tax”. The Conservatives are using the same old scare tactics; they claim that the government tried to do certain things so as to justify today's motion, but the Liberal government has already rejected these claims.
The Conservatives are once again resorting to their old scare tactics, but the real driver behind this motion is the Conservatives' fiscal policy, which is out of touch with reality. They want to resurrect their fiscal policy, a policy that did not work for Canada during their decade in government. They cut taxes on big corporations and multinationals from 22% to 15%, which failed to yield the results expected by prominent neo-liberal economists who say that cutting taxes boosts economic activity. The Conservatives' fiscal policy, which is based on theories like that, clearly did not produce the desired results.
 Currently, Canadians' debt levels are among the highest in the world. Hundreds of thousands of Canadians are on the verge of bankruptcy, one paycheque away from financial disaster. There is also a severe national housing crisis that requires concrete measures. I raised that subject last week in the debate on the NDP's opposition motion.
We rarely have an opportunity to move a motion for all MPs to vote on. When people in our party have that opportunity, we raise important issues that matter to Canadians' everyday lives. We do not engage in fearmongering to score political points. When NDP members have a chance to move an opposition motion, we take it very seriously. We develop real policies and real proposals. We do not just jot things down on the back of a napkin just for the sake of putting something out there and triggering a debate on taxes. I am curious about what the Conservatives are trying to accomplish here, but, just like last Tuesday's motion, I do not think this one will amount to much.
Last week's motion asked for taxes never to be increased again in Canada, and today's motion says substantially the same thing. At the end of the motion, it says that the House should “call on the Prime Minister to provide written confirmation that the government will not further raise any taxes on Canadians”. It does not mention any specific time limit, circumstance or taxpayer. That is the main reason why the NDP will be opposing this motion.
I said it last week, and I will say it again today: in 2019, we cannot tie our hands by promising not to raise taxes on anyone, under any circumstances and for an unspecified amount of time. 
 That would not be responsible, yet the Conservatives are doing it anyway. However, we know all too well that the Conservatives are not fiscally responsible. Let us not forget that they added $150 billion to the public debt when they were in government. In any case, one of the main reasons we are against this motion is that we must not tie our hands today, February 4, 2019, by promising not to raise taxes for an indefinite period.
The NDP has options. We have the courage to say that we can raise taxes, that we can get more taxes from the richest citizens, who are currently not paying their fair share. It is important to have the courage to say that in this debate. As I was saying earlier, under the Conservatives, big multinational corporations got their taxes cut from 22% to 15%. That did not yield the desired economic results. It did not confirm the theory of trickle-down economics, which is that tax cuts for big multinationals trickle down and benefit everyone.
On the contrary, large multinationals, the banks in particular, are pocketing record profits, while people are sleeping on the street right outside their doors. Every year they pocket more and more money, and the government gives them tax breaks. They stash their money away without putting it back into the economy. The figures show that the large profits stashed away by large multinationals lie dormant and are not reinvested into the economy. The money does not trickle down to benefit the vast majority of Canadians. This is a reality that seems to be lost on the Conservatives, who are forever caught up in their tax-cuts-for-everyone ideology. 
I apologize for repeating myself, but this topic is so similar. Last week I spoke of the need to understand that taxes serve a purpose in our society and in the world. They allow the public to receive services. Everyone contributes to a common pot so that everyone can then receive quality services. We are fortunate in Canada to have quality public services that are accessible and affordable, and ideally, sometimes even free.
In fact, taxpayers paid for these services. Having everyone contribute their share to a pooled fund is a way for society to organize itself and ensure that we can get decent services. Once again, the Conservatives do not seem to grasp the concept of people helping each other. In a community, we can pool our resources to ensure that as many people as possible can benefit.
When we look at the real cost of public services, we see that the majority of people get more services and money than they pay into the pooled fund. That is how we make society inclusive and give everyone an equal opportunity to succeed. That is why we must go even further. The NDP thinks we must go even further to give everyone an equal opportunity. Those who have the means should contribute more to this pooled fund to serve as many people as possible as well as those who need it most, in other words, the less fortunate.
That being said, I would be remiss if I did not mention the failures of the Liberal government, which has done nothing to improve the situation since taking office. This is a Conservative motion, but unfortunately, we have to admit that the Liberal government has failed to take action to address serious crises, particularly the housing crisis, which I mentioned earlier. The government has been ignoring the housing crisis, but immediate, concrete action needs to be taken. The government is doing a little but certainly not enough to properly address such a crisis.
Let's talk about the Liberal government's poor choices. Governing is all about making choices, making decisions. The most recent example is the government's decision to buy an oil pipeline. The Liberals bought the pipeline for $4.5 billion U.S. when the Parliamentary Budget Officer's assessment shows that they could have gotten a lower price. That was a choice that the government made. Rather than investing in Canadians and the housing crisis, the government would rather invest in a 60-year-old pipeline and its expansion, which, according to the Parliamentary Budget Officer, could cost up to $10 billion to $12 billion more.
That is the reality of the choices the Liberals are making. They decided to invest in a pipeline rather than in the well-being of Canadians.",New Democratic Party,Sherbrooke,Pierre-Luc Dusseault,http://www.parl.gc.ca/Parliamentarians/en/members/pierre-luc-dusseault(230115)
4768518,ca.proc.d.2019-02-04.10467876,2019-02-04,f2313477-3104-468f-9384-a371bedc7d09,237034,"Mr. Robert Kitchen (Souris—Moose Mountain, CPC)",,Government Orders,Business of Supply,Opposition Motion—Taxes,"Mr. Speaker, earlier in the debate today the parliamentary secretary made a comment about how the Liberals are in place to grow the economy for everyone, yet everyone does not seem to include everyone in my riding and other parts of Canada, because the Liberals are killing the oil and gas sector. They are killing pipelines. 
The hon. member is well aware of the carbon tax and how it will be $20 a tonne on April 1 and will go up to $50 a tonne and will go even higher after that. We are continually asking the present government what that figure will be, but it refuses to give that answer. 
I would like to hear from the member how he feels that is going to affect his constituency and his constituents in creating jobs and how he feels it is going to affect the economy. ",Conservative,Souris—Moose Mountain,Robert Gordon Kitchen,http://www.parl.gc.ca/Parliamentarians/en/members/robert-gordon-kitchen(237034)
4768519,ca.proc.d.2019-02-04.10467878,2019-02-04,4c0122f7-7958-4cbd-b99e-9d70a4dca1e8,230115,Mr. Pierre-Luc Dusseault,,Government Orders,Business of Supply,Opposition Motion—Taxes,"Mr. Speaker, I thank my colleague for his question, which is on another one of the Conservatives' favourite topics, the carbon tax. We are really doing the rounds, talking about all their favourite subjects, from taxes and the carbon tax to balanced budgets. We will have covered virtually all the Conservative bases by talking about those three topics.
With regard to the carbon tax, I think it is important to point out that, in the jurisdictions where it has already been introduced, people have been receiving some form of compensation, such as rebates. I think compensation is necessary, which is what the government is currently planning.
Last week the Minister of Environment and Climate Change said that Canadians will receive $307 from the government. That number is interesting. It proves that the Liberals expect the carbon tax to have economic repercussions.
Compensation is obviously necessary, since those most in need are going to be compensated. On top of that, we are going to reach the policy objective, which is reducing greenhouse gas emissions.
I hope all parliamentarians would agree that we need to reduce greenhouse gas emissions. The world's foremost economists are saying that a carbon tax is a good way to reduce greenhouse gas emissions. Why not introduce such a tax and provide compensation for those who need it?",New Democratic Party,Sherbrooke,Pierre-Luc Dusseault,http://www.parl.gc.ca/Parliamentarians/en/members/pierre-luc-dusseault(230115)
4768520,ca.proc.d.2019-02-04.10467880,2019-02-04,b078667f-922f-4979-a4c6-311e7bdc4068,229499,"Mrs. Celina Caesar-Chavannes (Whitby, Lib.)",,Government Orders,Business of Supply,Opposition Motion—Taxes,"Mr. Speaker, I agree. Here we are with another opposition day motion talking about taxes, so it is a little like groundhog day for the Conservatives. I also agree with him about the Conservatives' fearmongering with this motion. It seems to be a repeat of things they are accustomed to doing. 
As my hon. colleague looks through this long list of cancelled tax credits in the motion, I am sure he and his constituents are aware that they would have had to have been able to afford these programs in order to receive the tax credit. With our Canada child benefit, our national poverty strategy and our national housing strategy, we are taking a holistic approach to ensuring Canadians are well off. Would he not agree that programs like the Canada child benefit ensure that Canadians have more money in their pockets and that it is not only a better strategy than the Conservative one, but one that allows them to choose what they want to do for their children with the money? ",Liberal,Whitby,Celina Caesar-Chavannes,http://www.parl.gc.ca/Parliamentarians/en/members/celina-caesar-chavannes(229499)
4768521,ca.proc.d.2019-02-04.10467882,2019-02-04,4c0122f7-7958-4cbd-b99e-9d70a4dca1e8,230115,Mr. Pierre-Luc Dusseault,,Government Orders,Business of Supply,Opposition Motion—Taxes,"Mr. Speaker, I thank my colleague for her intervention. I also thank her for raising the matter of non-refundable tax credits, something the Conservatives are obsessed with, especially when it comes to public transit and children's fitness and arts tax credits.
The members across the way seem to forget that you have to pay taxes in order to get non-refundable tax credits. I would remind the Conservatives that the least fortunate Canadians need these non-refundable tax credits the most. However, those Canadians cannot get these tax credits because those who are better off are the ones who pay taxes. When the Conservatives talk about these tax credits, they fail to mention that these are non-refundable tax credits.
They need to face the facts. The numbers speak for themselves: those who benefit from these tax credits are mainly, but not exclusively, the wealthy. This policy was endorsed by several economists who reviewed the use of non-refundable tax credits. It is time to have another debate on why we should make these tax credits refundable.",New Democratic Party,Sherbrooke,Pierre-Luc Dusseault,http://www.parl.gc.ca/Parliamentarians/en/members/pierre-luc-dusseault(230115)
4768522,ca.proc.d.2019-02-04.10467884,2019-02-04,4437c848-d8c7-4a39-a948-1539969f3a90,234764,"Ms. Marilyn Gladu (Sarnia—Lambton, CPC)",,Government Orders,Business of Supply,Opposition Motion—Taxes,"Mr. Speaker, I am pleased to be here today to speak to the opposition motion. I will be sharing my time with the hon. member for Edmonton Manning.
Today I will be talking about the taxes that the Liberals have increased, their adverse effects, and the future.
To start, let us talk about the taxes that the Liberals have raised. 
Since they came into power in 2015, the Liberals have made continual attempts to raise taxes on Canadians and on small businesses. Overall, middle-class Canadians are paying over $800 more in taxes. How did we get there? 
First of all, a lot of the tax credits that were in place under the previous government were removed. We need only to look at how much that cost. Let us think of the fitness tax credit, which was $1,200 per child. A family with two or three children could have received $3,600 right there. The education and tuition tax credits were also removed. I remember having two children in university, and the amount received then was $5,000 per child. We are talking about thousands of dollars in taxes there. When the credit is removed, it essentially means that taxes are being increased.
There were many Canadians who were taking advantage of income splitting, and depending on their income, that could be as much as $12,000 or $13,000.
If we add up the number of things that were taken away, it could be as much as $20,000. 
For all the Liberals' talk about adding back a child benefit and how a family with young children would get $5,400 each, a family with no young children but with kids in university would be much worse off. We see that in the data that shows that 46% of Canadians are within $200 of insolvency every month. That is the result of the Liberal government continually squeezing them.
The Liberals have tried to squeeze Canadians in other ways, such as trying to raise taxes on health and dental benefits. We sounded the alarm and were able to get them to walk back on that. They tried to put some taxes in place on small businesses that would have caused undue circumstances. They tried to tax the passive income in corporations at 73%, which clearly resulted in outrage and an outcry from Canadians. We were able to get the Liberals to walk that back.
This is important because it follows the principle that we talked about in science about boiling the frog. If we gradually raise the temperature one degree at a time, the frog will eventually die because it does not realize that it is getting into really hot water. That essentially is what has happened under the Liberals: They have increased taxes so many times that now the whole country is in hot water. Canadians are really struggling to afford to live, and that is even before we count in the carbon tax and the impact it will have.
We do not know exactly how much impact the carbon tax will have, because the open and transparent Liberal government has not disclosed that information to Canadians. The Liberals have said they will give Canadians $300 back at the end of the year and have asked Canadians to trust them that this is the amount it is going to cost. Depending on where we live in this country, if we think about an increase of 11¢ a litre on gasoline for the current carbon pricing and we think about the increase to the cost of home heating and the cost of groceries, we recognize that it is going to be more than $300. The government is really getting more money than it is going to give back, which is in essence a tax increase as well.
We know it is not going to stop there. We know that after the next election, the government is going to continue to increase this carbon tax because it is a cash grab. Documents show that this tax will increase by a factor of six. It could cost Canadians $3,000 to $5,000 a year. Let us think of what that would do to families that are already precariously on the brink.
There have been many negative impacts. I talked about the impact on Canadians, but the impact on small and medium-sized businesses is something that we are seeing in my riding, where businesses are either closing up or moving to the United States because of the tax advantages there versus operating in Canada.
What did we really get for all of the cash that the government is taking out of the pockets of Canadians? A lot of that money has not been of benefit to Canadians. Let us think about the $15 billion that the Liberals took from the municipalities that was supposed to be for their roads and bridges but was put into an infrastructure bank that has benefited nobody. What about the $1 billion the government is spending on allowing illegal immigrants to come into the country, paying to put them up in hotels for the four years needed to process them because of the backlog?
We have seen the government's many trips around the world. There was the disastrous India trip, the China trip, the Davos trip. People were flying all over the place, with 183 people going to COP 21, where the government is spending billions of Canadians' dollars with no real benefit to Canadians. 
Of course, there were millions of dollars spent on the Canada food guide so we could all know that we should drink water and enjoy our food, which was a huge revelation to many, I am sure. 
It seems that tax increases keep coming, and the government is not being open with Canadians about what they can expect after the next election, should we be unfortunate enough to have the Liberals remain in power.
We know that more taxes are coming. We know the Liberals tried to put in place a tax on health and dental benefits, and they will try to put it in place again. They will again increase the carbon tax. They will again reach into the pockets of small businesses, because the government has a spending problem. They are spending way more than they promised. They promised small deficits of $10 billion for three years and a return to a balanced budget this year. Here we are in 2019, and the budget is not balanced. 
We cannot believe the promises made by the current government. It has a track record, depending on whether we go to the TrudeauMeter or a promise tracker, of keeping 25% of their promises, so Canadians should definitely keep that in mind as we look to the election and see what might be coming down the road.
Let us talk about the future. We know that tough times are ahead. Economists are predicting that we are approaching recession conditions, and growth has certainly slowed. After glowing accolades and the Prime Minister singing about the victories of his government, all of a sudden we see that growth is grinding to a halt and that there are concerns of a recession. Here we are with more debt than anyone could manage, and there is no end in sight. That will certainly cause us to pay more interest on the deficit and keep us from doing other things. 
Let us think about the $40 billion that was transferred to the provinces for health care. We know we have an aging population and a rise in chronic disease, so we definitely need more money in the health care system, but that $40 billion that we could be putting on top of our existing transfer payments is going toward paying interest to wealthy bankers and investors. I do not think that was the intent.
Clearly, the government has been wasting taxpayers' dollars. It has been raising taxes on taxpayers and it will keep doing that as we move toward the election and it is not going to be open and transparent about it. Liberals clearly do not intend to tell Canadians the real story, and that is why Conservatives moved this motion today: to make sure Canadians are informed about what has already taken place and what they can expect in the future.",Conservative,Sarnia—Lambton,Marilyn Gladu,http://www.parl.gc.ca/Parliamentarians/en/members/marilyn-gladu(234764)
4768523,ca.proc.d.2019-02-04.10467889,2019-02-04,b078667f-922f-4979-a4c6-311e7bdc4068,229499,"Mrs. Celina Caesar-Chavannes (Whitby, Lib.)",,Government Orders,Business of Supply,Opposition Motion—Taxes,"Mr. Speaker, my hon. colleague said that Canada is in hot water. I want to get a sense from her of the exact temperature of that water, because it seems we are doing pretty well. We have the lowest employment in decades, which means Canadians are working. In fact, with our investments, Canadian businesses have helped create over 800,000 new jobs.
My hon. colleague went on to talk about the Canada child benefit. In her riding of Sarnia—Lambton specifically, over 8,600 payments have been made through the Canada child benefit. There are 16,000 children in her riding who have received these payments. I know my hon. colleagues on the other side are heckling, but I am sure the parents of these children appreciate having this money, an average of $600 per month.
The record of this government is that our investments in Canadians have allowed them to create jobs, put more money in their pockets and ensure they have a better quality of life.",Liberal,Whitby,Celina Caesar-Chavannes,http://www.parl.gc.ca/Parliamentarians/en/members/celina-caesar-chavannes(229499)
4768524,ca.proc.d.2019-02-04.10467892,2019-02-04,4437c848-d8c7-4a39-a948-1539969f3a90,234764,Ms. Marilyn Gladu,,Government Orders,Business of Supply,Opposition Motion—Taxes,"Mr. Speaker, the member asked about the temperature of the water in Canada. Well, let us talk about it. When 46% of Canadians are within $200 of insolvency every month, the fact that they are working is great, but the fact that they cannot make ends meet is not great. She also referenced the number of people who have received the child benefit in my riding. The reality is that if we give somebody $6,400 and take away $7,200, they are $800 worse off. That is the situation that has happened under the current government. It has increased taxes more than what it has given back.",Conservative,Sarnia—Lambton,Marilyn Gladu,http://www.parl.gc.ca/Parliamentarians/en/members/marilyn-gladu(234764)
4768525,ca.proc.d.2019-02-04.10467894,2019-02-04,,,,,Government Orders,Business of Supply,Opposition Motion—Taxes,"Mr. Speaker, first, I want to acknowledge my colleague for speaking French at the beginning of her speech. She did a great job, and I think it is important to acknowledge that.
The figures she mentioned come from the Fraser Institute. However, she left out some important details. The Canada child benefit was not taken into account in this analysis. The Canada child benefit has made a huge difference back home. People tell me they are getting an extra $2,000, tax free. This is a lot.
She also forgot to mention that during nine of the 10 years that the Harper government was in power, that government ran significant deficits. One of these deficits was among the largest in modern Canadian history. It was $56 billion for a single year. The Conservatives added $150 billion to the deficit during this period.
The Canada child benefit is having a positive impact on our families and has helped thousands of children out of poverty, so why did she and her party vote against this important measure introduced by our government?",,,"Mr. Rémi Massé (Parliamentary Secretary to the Minister of Innovation, Science and Economic Development, Lib.)",
