basepk,hid,speechdate,pid,opid,speakeroldname,speakerposition,maintopic,subtopic,subsubtopic,speechtext,speakerparty,speakerriding,speakername,speakerurl
4768700,ca.proc.d.2019-02-04.10468945,2019-02-04,634edc34-ea0d-406f-ade1-eeec6c5bad04,234552,"Mr. Adam Vaughan (Parliamentary Secretary to the Minister of Families, Children and Social Development (Housing and Urban Affairs), Lib.)",,Government Orders,Business of Supply,Opposition Motion—Taxes,"Madam Speaker, I will be sharing my time with the member for Louis-Hébert. 
I am thankful for the opportunity to speak today about our government's significant enhancements to the betterment of Canadians from coast to coast to coast. 
It is important when we look at the country we are building to note the difference between the two parties that are sharing this debate with great vigour today. One party simply builds balance sheets, and that is it. We see that they are not even very good balance sheets when we look at that party's historic record. The other party is focused on building the strength of Canadians, their communities, and by extension, the country as a whole. 
Our investments over the last three years, since the last election and in our first few budgets, really show where we are making a difference in the lives of Canadians. For example, the Canada child benefit, the improvements to the Canada pension plan, the investments in housing and infrastructure are all about not just building capacity in the lives of ordinary Canadians and Canadians who have real and determined needs, but also about making sure the communities they reside in also get stronger and in turn build a strong economy with new jobs that employ Canadians as we move forward together. 
In fact, Canadians have been given the opportunity over the last three years to produce well over 800,000 jobs through investments we have made. That is because the dollars are getting out the door, contrary to some of the criticisms we may hear from the opposite side. They know as well as we do that the government pays the invoices on completed projects. We do not simply mail cheques to municipalities and say “Go build something.” We pay what is expended, as opposed to what is projected. That is one of the ways we apply good fiscal management to the infrastructure dollars. 
It also means, however, that it appears that a lot of dollars have not been spent, when in fact those dollars are being spent in communities right across the country, including in my riding, where we have literally billions of dollars being spent in infrastructure being developed in partnership with the previous provincial government and our municipal partners. 
We also have financed this by taking steps to make the tax system more equitable. Yes, we can listen to the talking points of the American-funded Fraser Institute and we can do math that has only half the equation, which is a terrible way to do a balance sheet, but the reality is that we have lowered taxes on Canadians and raised them on some who are more affluent as part of building a social contract to deliver greater capacity to the government and also greater fairness to Canadians right across the country. Since 2015, as a result of these very careful investments, we have the lowest unemployment rate in 40 years. 
We often hear the Conservatives say the best social policy is a job, and while I do not think a job is a social policy but a function of good economic investment and stewardship, the reality is that when 800,000 more Canadians are working than when they were in charge, that is good news. Only a Conservative could see that as bad, but somehow that is the negativity we encounter from the opposite side. 
We have also seen in the past three years that Canada has one of the fastest-growing economies in the G7. Again this is directly due to some of our investments. In fact, the World Bank has looked at the Canada child benefit. We made it tax free so that we do not send money to Canadians and then claw it back. This makes it much more robust and makes sure Canadians get it as a right, as opposed to having to go through a very complicated application process. 
We are renewing and enrolling people automatically and using Service Canada to look for those gaps where people are not receiving the proper benefit. In doing so, we have invested substantial dollars into the economy. These are substantial dollars that have supported Canadian families in building good, strong, resilient kids as we move forward. 
This has caused enormous economic growth in the country. In fact, because it is delivered in ways that are equal right across the country and in low-income communities, the investment into families has generated economic activities in those communities. When families have more to spend on supporting their families and their children, we see the corner store do better. We see the Canadian Tire down the street do better. We see people starting to invest in the local businesses on the main street. Then those main street businesses have the capacity to hire more people. This is one of the ways we stimulate positive economic growth. We have done that, and it is good policy. 
My fear is that the party opposite wants to roll the clock back to Stephen Harper's days, when the only tax credits Canadians could get were boutique tax credits that required them to have the money to spend up front and then perhaps they would get a little back a year later. That kind of policy benefited affluent families, but it left low-income families at the side of the hockey rink, not watching their kids play. It left students who could not afford their books to begin with having to rely on skipping the purchase of all the books required for university and college courses. It was a reactionary approach to economic development. More importantly, it left low-income Canadians outside the conversation about how to better their families.
As I said, the Canada child benefit is one of the reasons why we are most optimistic about our plan and one of the ways that we measure our success, because of the number of kids that have been lifted out of poverty, which is a good thing for everybody but most importantly for those children.
We know that it is expensive to raise children. Healthy food, warm clothing and winter boots are not cheap. We know that when we can deliver those dollars and they are delivered tax free, parents do not have to worry about the taxman coming at the end of the year to claim the money back.
We also know that as we introduced the Canada child benefit the most important thing was that, in modelling that program, we modelled it with the other social programs to make sure that new dollars arriving in the front door of a family that had needs were not being clawed out the back door by other governments. We think this is also important. If we are going to make social investments, they should not displace other levels of government programs from making a difference. They need to be layered into people's lives and make a real difference.
The other thing that is important is the way in which we have done things like rolling back the age of retirement. We know this is going to prevent hundreds of thousands of Canadian seniors from falling into poverty, but then we have also looked at the impact that gender has as people age. We know that men die sooner than most women. We know that men often carry the pension and often carry a lot of wealth because of past inequities in our system. We know that if we do not specifically address single seniors, the predominance of them being women, with special top-ups, we cannot alleviate seniors' poverty either. 
The increase to the guaranteed income supplement is one of those investments that targets specific Canadians in specific ways and makes their lives that much better and easier. We are proud of those investments. We will not back away from them as we move forward as a country together.
The other thing I am most proud of is the investment in housing: $5.7 billion has been invested since we took office. We know that the previous government was walking away from housing, literally in places like Alberta, pulling subsidies from seniors' residences or rent geared to income, suggesting that they could pay their own subsidies. Somehow the poor were going to subsidize the poor in some sort of assistance. 
We have restored and tripled those subsidies with transfers to the provinces. We have doubled the amount of money being spent on homeless individuals and this investment of $5.7 billion has in broad numbers been invested almost one million times in Canadian households across the country. Close to 15,000 new units are being built and close to 150,000 have been repaired, keeping people in housing that is safe and secure. As well subsidies for close to 700,000, almost 800,000, Canadians have now been delivered on a month-by-month basis, making sure they have the dollars to pay the rent and stay housed. 
The cost of not doing things, the cost of only focusing with a very narrow intent on the balance sheet means that we miss the opportunity to support Canadians in very dynamic ways that prevent poverty. We know from every study that has been done that the cost of poverty has a huge impact on educational outcomes and has an impact on Canadians supporting themselves as they grow older. 
We also know that as we de-house people or cut housing support, it has a huge impact on the health care system. Housing is one of the most important determinants of health. When we can make these investments, not only do we employ people fixing and building the housing, but we give people a place to call home and that prevents them from falling into harm's way and in particular prevents costs accruing to the health care system, which is one of the most cost-intensive parts of the federal budget.
These programs that we have stepped up with and invested in have created not only the strong economic growth, not only the strong job numbers, but they have also been investments in ways to prevent other costs from accruing to the government. If we were to cut away these supports, it would be penny-wise, but perhaps pound foolish, as the old saying goes. In other words, cutting away these sorts of supports has a negative impact on Canadians from coast to coast to coast.
The Conservatives brag and campaign on a series of pledges that they wish to go back to the days of Stephen Harper, when we had low growth and high unemployment, when there was still $150 billion added to the deficit and there was the failure by that government, despite repeated promises, to balance the budget. They only did it by selling GM shares. That is like selling the furniture to pay the rent. When we hear proud proclamations that they want to go back to those times, I can only say that this government is committed not to doing that. 
Canadians will have a choice in the next election. Canadians can decide between a party that knows the price of everything but the value of nothing, or they can choose a party that sits down with Canadians from coast to coast to coast; examines the regional differences in this country, the economic differences in this country, the opportunities that support can provide; and understands that when we grow the economy and the capacity to pay debt and keep the GDP ratio as low as we have, good things happen. Canadians are working and healthy.",Liberal,Spadina—Fort York,Adam Vaughan,http://www.parl.gc.ca/Parliamentarians/en/members/adam-vaughan(234552)
4768701,ca.proc.d.2019-02-04.10469067,2019-02-04,bd2068aa-74c7-430a-bdf5-6f17b14ca140,218228,"Mr. Tom Kmiec (Calgary Shepard, CPC)",,Government Orders,Business of Supply,Opposition Motion—Taxes,"Madam Speaker, a parliamentary secretary is a representative of Her Majesty's government and the words he or she speaks, whether inside or outside the House, carry a lot of weight. They are a representation of what the Government of Canada believes. The parliamentary secretary made a very ill-advised tweet on the weekend, calling for the Premier of Ontario, Doug Ford, to be whacked.
I invite the parliamentary secretary to reflect on his minister's mandate letter that states, “Canadians expect us, in our work, to reflect the values we all embrace: inclusion, honesty, hard work, fiscal prudence, and generosity of spirit.” I am going give the parliamentary secretary a chance to apologize to the premier and all Canadians for his ill-advised comments.",Conservative,Calgary Shepard,Tom Kmiec,http://www.parl.gc.ca/Parliamentarians/en/members/tom-kmiec(218228)
4768702,ca.proc.d.2019-02-04.10469079,2019-02-04,634edc34-ea0d-406f-ade1-eeec6c5bad04,234552,Mr. Adam Vaughan,,Government Orders,Business of Supply,Opposition Motion—Taxes,"Madam Speaker, I know the Conservatives like to cut things. I did not realize they had cut their sense of humour. The reference was made to Whac-A-Mole. It was made to a cartoon. If they choose to take the words deliberately out of context, it fits a pattern.
I made a statement later in the day when people were clearly taking the word “whack” to mean what the member opposite thinks it means. It cannot only mean one thing. I obviously said political violence has no place in this country and my words were not meant to incite violence in any way, shape or form. It was in reference to a cartoon of Whac-A-Mole. It is a popular game at many arcades and the idea was that the Ford government in Ontario was floating so many cuts so simultaneously that the only real way to deal with it was to deal with the government at election time by beating the government at the polls. 
When I say “beat it at the polls”, I am not, again, inciting violence.",Liberal,Spadina—Fort York,Adam Vaughan,http://www.parl.gc.ca/Parliamentarians/en/members/adam-vaughan(234552)
4768703,ca.proc.d.2019-02-04.10469090,2019-02-04,d32cbf2b-5b28-4698-ba39-c1ac2f736c3e,234563,"Mr. Joël Lightbound (Parliamentary Secretary to the Minister of Finance, Lib.)",,Government Orders,Business of Supply,Opposition Motion—Taxes,"Madam Speaker, I would simply like to ask my esteemed colleague, who knows a lot about housing, if he can explain his vision for the national housing strategy and the impact it could have in communities across the country. If this is of particular interest to Quebec, I would be interested in hearing his comments on this matter. ",Liberal,Louis-Hébert,Joël Lightbound,http://www.parl.gc.ca/Parliamentarians/en/members/joel-lightbound(234563)
4768704,ca.proc.d.2019-02-04.10469099,2019-02-04,634edc34-ea0d-406f-ade1-eeec6c5bad04,234552,Mr. Adam Vaughan,,Government Orders,Business of Supply,Opposition Motion—Taxes,"Madam Speaker, the national housing strategy builds on the $5.7 billion we have invested in the first budget when we took office and now adds $40 billion on top of that $5.7 billion over the next 10 years. It really reprofiles a package of housing programs that deal with everything from building housing to repairing house to subsidizing people in housing and also provides supports for the people who need supports to stay in housing.
The great thing about housing is that we have to build it in the communities where people live. If there are housing needs in certain ridings, regardless of whether they are rural ridings, urban ridings, coastal ridings or northern ridings, the investments land and employ local tradespeople in those communities. It builds good, strong economies. It also builds capacity in towns that might be struggling for population growth, but the other thing it does is that it locks stability into people's lives and allows the other investments we make to social programs to be much more effective. It cuts costs for government as well, in terms of health care and the criminal justice system. Well-housed people do not cause problems for government because they succeed and support themselves.
It is a great tool for building a strong economy. It is a great tool for building strong economies right across the country in every single community. I am very proud of the investments we have made because they are making a difference in Canadians' lives from coast to coast to coast.",Liberal,Spadina—Fort York,Adam Vaughan,http://www.parl.gc.ca/Parliamentarians/en/members/adam-vaughan(234552)
4768705,ca.proc.d.2019-02-04.10469120,2019-02-04,4abeb9b5-279b-4117-9e04-b8901d9ccc53,224216,"Mr. Francis Scarpaleggia (Lac-Saint-Louis, Lib.)",,Government Orders,Business of Supply,Opposition Motion—Taxes,"Madam Speaker, the member mentioned that investing in housing saves money. I remember when I was on the public safety committee a few years ago, I heard a story about a gentleman who lived on the street. He had a disability. He was acting out quite a bit and it was costing the Calgary police force hundreds of thousands of dollars to respond to incidents created by this gentleman. One day they found him a place to live and no more interventions were required. I want to underscore that what the hon. member is saying is true and fact in reality.",Liberal,Lac-Saint-Louis,Francis Scarpaleggia,http://www.parl.gc.ca/Parliamentarians/en/members/francis-scarpaleggia(224216)
4768706,ca.proc.d.2019-02-04.10469130,2019-02-04,634edc34-ea0d-406f-ade1-eeec6c5bad04,234552,Mr. Adam Vaughan,,Government Orders,Business of Supply,Opposition Motion—Taxes,"We know this, Madam Speaker. When we support Canadians and give them the platform to succeed, they do not just thrive; they exceed expectations. That is the 850,000-plus jobs we have seen created since we took office. That is the growing and strong economy that has led the G7 in growth over the three years we have been in office.
We also know that we mitigate social harm by making good, smart social investments in housing, in transit and in making sure that climate change has resistance and resiliency strategies. 
When we protect our communities and our families and invest in children, we get resilient kids, strong families, better communities and a strong Canada.",Liberal,Spadina—Fort York,Adam Vaughan,http://www.parl.gc.ca/Parliamentarians/en/members/adam-vaughan(234552)
4768707,ca.proc.d.2019-02-04.10469138,2019-02-04,d32cbf2b-5b28-4698-ba39-c1ac2f736c3e,234563,"Mr. Joël Lightbound (Parliamentary Secretary to the Minister of Finance, Lib.)",,Government Orders,Business of Supply,Opposition Motion—Taxes,"Madam Speaker, I am pleased to have the opportunity to speak to the motion moved by my Conservative Party colleague today, but I do not know where to begin addressing this motion riddled with misinformation.
Canadians made a choice in 2015. They supported a plan to invest in the economy, strengthen and grow the middle class, and provide real help to the people working hard to join the middle class. We came in determined to help hardworking Canadians share in the benefits that come from a strong and growing economy, and that is exactly what we have done.
That is why our government's first action was to ask the wealthiest Canadians to pay more tax so that we could cut taxes for the middle class. We asked the wealthiest 1% to pay a bit more tax so that we could lower taxes for the vast majority of Canadians. As a result of these tax cuts, over nine million middle-class Canadians have more money in their pockets. They can save more, invest or buy what they need.
Instead of offering tax credits to millionaire families, our government created the Canada child benefit, or CCB, which is a more generous tax-free benefit designed for the families that need it most. Thanks to the CCB, nine out of 10 Canadian families are getting more money than under the previous government. This benefit has lifted hundreds of thousands of children across Canada out of poverty. In my riding, as in every riding, this benefit has made a huge difference in the lives of many families in need.
 As a result of the tax cut and measures like the Canada child benefit, a typical middle-class family of four is receiving, on average, about $2,000 more each year to help with the cost of raising children, save for the future, and help grow the economy for the benefit of everyone. That is $2,000 more than that family was receiving in 2015, under the previous government.
This completely contradicts the misinformation presented in the motion moved by the member for Carleton, which is based on a study that falls apart under closer scrutiny. Naturally, since the Fraser Institute does not take the Canada child benefit into account, it is hard for it to come up with reliable figures.
 The fact is that most Canadians are paying a lower effective tax rate under our government than they did under the previous government. Individuals are paying less, single-earner families are paying less, two-earner families are paying less, and single mothers are paying a lot less. The only Canadians who are paying more are the wealthiest 1%, so that we could lower taxes for the middle class.
 A typical middle-class family of four is receiving on average about $2,000 more each year. That money is changing those families' lives. For example, it is helping them put healthy food on the table, clothe themselves, prepare for back to school, and buy warm clothes for winter.
 Moreover, in the fall of 2017, the government introduced measures to help low-income workers, and this led to the creation of the Canada workers benefit, or CWB, in budget 2018, and I am very proud of that. The CWB is basically an enhanced, more generous and more accessible version of the former working income tax benefit. Beginning in 2019, the CWB has made it possible for low-income workers to keep more money in their pockets. This new measure will also encourage a larger number of workers to secure and keep jobs while providing real assistance to more than two million hard-working Canadians.
We also recognize that small businesses are key, vital drivers of the Canadian economy. Small businesses provide 70% of all private sector jobs in Canada. That is why, in January 2018, our government lowered the small business tax rate to 10%. In January of this year, we lowered it again to 9%. The combined federal, provincial and territorial average tax rate on small businesses is now 12.2%—by far the lowest rate in the G7.
Consumer confidence remains strong and corporate profit margins are good, which opens the door to other investments that could lead to the creation of more meaningful, better-paying jobs for Canadians.
Our efforts to build a more just and equitable society where we give more back to the middle class have helped make Canada's one of the fastest-growing economies in the G7.
Over the past three years, through their hard work, Canadians have created over 800,000 new jobs, most of which are full-time jobs. As a result, our unemployment rate is the lowest it has been in over 40 years.
Our government is also committed to advancing gender equality, which will support long-term growth in Canadian businesses. The costs of the unequal participation of men and women in the economy are not only moral but also economic. The studies are clear on that.
We also signed new trade agreements, which will create more economic opportunities for Canadian businesses in the years to come. Canada is making historic investments in infrastructure, innovation, science and research. Budget 2018 included the biggest new investment in science in Canadian history. We are also making investments in skills development and training to ensure that Canadians have the skills they need to succeed in the labour market.
The policies and measures that we put in place are in keeping with the commitments that we made during the election campaign and the course of our mandate. We have taken concrete measures for Canadians. These measures were the right thing to do to create new jobs and lay the groundwork for long-term prosperity for Canadians.",Liberal,Louis-Hébert,Joël Lightbound,http://www.parl.gc.ca/Parliamentarians/en/members/joel-lightbound(234563)
4768708,ca.proc.d.2019-02-04.10469247,2019-02-04,4437c848-d8c7-4a39-a948-1539969f3a90,234764,"Ms. Marilyn Gladu (Sarnia—Lambton, CPC)",,Government Orders,Business of Supply,Opposition Motion—Taxes,"Madam Speaker, I would like to talk about some of the impacts that the Liberals' policies have had, because it is clear they are very out of touch with what is going on in the country. We know that 46% of Canadians are within $200 of insolvency. We know that small and medium-sized businesses are struggling. Some of them are shutting down. Many of them are moving to the States because of the lack of competitive environment here. 
The member sings the song like he is the band playing on the Titanic. Could he please update the House on why he is not in touch with what is really happening and the struggles that Canadians are facing?",Conservative,Sarnia—Lambton,Marilyn Gladu,http://www.parl.gc.ca/Parliamentarians/en/members/marilyn-gladu(234764)
