basepk,hid,speechdate,pid,opid,speakeroldname,speakerposition,maintopic,subtopic,subsubtopic,speechtext,speakerparty,speakerriding,speakername,speakerurl
4771851,ca.proc.d.2019-02-27.10513765,2019-02-27,fc9a44ff-23e0-45df-8ec4-a9cccefa71e1,234403,"Hon. Ed Fast (Abbotsford, CPC)",,Private Members' Business,Mennonite Heritage Week,," moved: 
 That, in the opinion of the House, the government should recognize the contributions that Canadian Mennonites have made to building Canadian society, their history of hope and perseverance, the richness of the Mennonite culture, their role in promoting peace and justice both at home and abroad, and the importance of educating and reflecting upon Mennonite heritage for future generations, by declaring the second week of September as Mennonite Heritage Week. 
Mr. Speaker, I rise in the House today to speak to my own motion that would establish the second week of September as Mennonite heritage week.
Why Mennonite heritage week? First, this is an opportunity for the Government of Canada to recognize the contributions that Mennonites have made in building our great country. The Mennonite community is incredibly diverse and has invested heavily in building a community that is tolerant and prosperous, where we care for one another and are generous with each other.
Let me start off by talking about who the Mennonites are. We are an understated and unassuming hard-working group of people. We try to stay out of trouble. We serve our communities. We serve our country and our fellow human beings.
It goes without saying that our modern Canada was built by immigrants, many of them fleeing war, strife, persecution and economic devastation. We are all proud of the men and women, and their families, who have risked everything to leave their homes elsewhere around the world and come to Canada to build a new life. The Mennonites are among those people groups who came to find a refuge in Canada. Their history and reputation for peacemaking, creativity and hard work speak to the hope and opportunity that Canada has always offered to the world.
I am a descendant of those people who fled fierce persecution in Europe and in Russia, and risked everything to move a vast distance to an unfamiliar land for an uncertain future. That risk was rewarded as my ancestors settled in an immeasurably rich land and became part of a community that is built, and continues to build, what is arguably the most desirable country in the world.
I am immensely proud of my Mennonite heritage and propose the motion to honour the role that Canada's Mennonites have played in building the foundation of the country we know and love today.
Who are the Mennonites? We have our roots within the Anabaptist movement that occurred in German- and Dutch-speaking parts of central Europe during the Protestant Reformation. The most distinguishing theological feature of the Anabaptists was their rejection of infant baptism and their firm belief in what is called the believer's baptism, namely baptism of adults who profess faith in Jesus Christ and his work on the cross.
This foundational element of faith ensured that the Anabaptists were persecuted by the church and government authorities of the day, both Catholic and Protestant. Many Mennonites were tortured for their faith and sent to their deaths. Despite strong persecution, the Anabaptist movement spread quickly across western Europe, primarily along the Rhine River.
Another key tenet of the Anabaptist confession is a commitment to non-violence and that included resisting all military service. This resulted in many smaller groups of Anabaptists being destroyed because of their conviction that all violence, even when used to defend themselves, was against God's teachings.
In the early days of the Anabaptist movement, a priest left the Catholic church after his brother and his companions were attacked and killed because of their Anabaptist faith and their refusal to defend themselves. This priest became a respected leader within the Anabaptist movement and became so influential that many Anabaptists began carrying his name. His name was Menno Simons and today we call the people that followed him the Mennonites.
In addition to their distinctive faith perspective, the consistent theme across the history of the Mennonite people has been their persecution. In fact, whether it was in Germany, the Netherlands, Prussia or even Russia, these industrious people have travelled much of the western world looking for a safe place to call their home.
Due to the severe persecution faced by the Mennonites, they were forced to flee their homes and seek refuge elsewhere in the world.
 Some fled immediately to the United States, where they found freedom to practise their faith without interference from state authorities. Of these, a number of groups ended up migrating to Canada and establishing communities in our country, primarily in Ontario. Other persecuted Mennonites first fled to Prussia, seeking freedom to practise their faith and live in peace.
Then in the 1770s, Catherine the Great invited the Mennonites to resettle in Russia, promising them land and the right not to participate in military service. Therefore, many Mennonites moved to Russia, establishing communities and colonies cross western Russia, successfully farming previously infertile land and becoming successful business people. In fact, my great grandfather Cornelius Martens was among those who built and operated a large machinery factory in the town of Millerovo, a community in Russia that still exists and of which my brother and I have been made honorary citizens.
For 150 years, the Mennonites prospered and lived in peace in Russia. Then everything changed. By the end of the 19th century, in other words, the end of the 1800s, and beginning of the 20th century, the flames of revolution were beginning to be fanned across Russia and the Mennonites felt less and less welcome in their adopted country. More and more of them were again leaving their homes and seeking refuge in a place that would offer peace and freedom. That place was Canada.
As Bolshevism and Communism inflicted more and more horrors upon Russia, thousands upon thousands of Mennonites fled their adopted home and landed in Canada, first settling in the inhospitable prairie provinces and then in British Columbia and Ontario. They worked hard, they cared for their families and communities and made the difficult sacrifices, which is the hallmark of immigrant life.
 At the very heart of their communities was their church and their faith. Different Mennonite denominations sprang up across our country, including the Mennonite Brethren, Mennonite Church Canada as it is now known, the Amish, the Old Order Mennonite church, the Holdeman Church of God in Christ and others. At the heart of each were the core tenets of faith in Christ, a belief in the adult believers baptism and a commitment to non-resistance and peacemaking. 
Let me talk about the Mennonites today.
 Since their journey to Canada, Mennonites have become an indispensable part of the Canadian fabric, distinguishing themselves in a broad range of endeavours, from the arts to the sciences, from sports to politics, from business to music and everything in between.
 Indeed, the Canadian Mennonite community has done more than just promote outstanding human values. It has also given Canada not one, not two but innumerable talented athletes, including, for example, five-time Olympic medalist, speed skater Cindy Klassen.
 Other Mennonite athletes of note include NHL players such as Jonathan Toews, Dustin Penner, Robyn Regehr, James Reimer and former St. Louis Blues great, Garry Unger. There are many others either in the NHL today or formerly in the NHL.
 There are also football players such as former CFLers John Pankratz and Matthias Goossen.
 There are other notable Mennonites who have left their mark on Canadian society, including authors David Bergen, who is a Giller Prize winner, and Miriam Toews, a best-selling author and winner of the 2004 Governor General's Literary Award. That list also includes Canadian conductors Howard Dyck and Glen Fast, and well-known artist Gathie Falk, whose artwork hangs in Canada's embassy in Washington, D.C. Incidentally, Gathie Falk was one of my Sunday school teachers when I was a young child.
Members might be surprised to know that there are at least 15 members on this side of the House who trace their roots back to the Mennonites.
The history of the Mennonites and their ability to constructively contribute to building a tolerant, welcoming, healthy and prosperous Canadian society stands as a testament to the fact that our Mennonite values are Canadian values. They are values such as compassion and loving each other, including the vulnerable and marginalized. They are values such as hard work, forbearance, forgiveness, reconciliation and peacemaking. These, as well as other values such as thrift and generosity, are the values that arise out of our Mennonite faith. Maybe that is why the Mennonite MPs in the House are on this side, not that side.
However, I digress. These values I have articulated were strung out of the Mennonite culture and faith, a deep, abiding faith in God and his providence. Throughout Mennonite history, those values have been tested within the crucible of persecution, conflict, war and famine. We would do well as a country to reflect upon that history and the values that have sustained the Mennonites, as a guide to direct us as we stand on guard for the true north, strong and free, our wonderful country called Canada. 
Therefore, by dedicating the second week of September to our Mennonite community, we are not just highlighting one people group's history. We are highlighting the refuge that Canada has provided to so many people groups, vulnerable people groups around the world, persecuted people groups. We can be very proud of that legacy that Canada has left behind. 
I talked about the Mennonites fleeing persecution in Europe and finding new places all over the world. I mentioned the United States and Canada. However, today we find Mennonites in places like Paraguay, Uruguay and Brazil. Do members know that the largest population of Mennonites is actually found in Africa? Africans have very much embraced the faith values that Mennonites have espoused for so many years. 
I want to wind up by saying that I am very proud to be a Mennonite. I am very proud of our country for embracing the Mennonites. I am pleased that we have a motion today that will declare that every second week in September will be known as Mennonite heritage week.",Conservative,Abbotsford,Ed Fast,http://www.parl.gc.ca/Parliamentarians/en/members/ed-fast(234403)
4771852,ca.proc.d.2019-02-27.10513978,2019-02-27,3da57866-49d8-42d1-9f5b-c78561f67c9d,215963,"Mr. Sukh Dhaliwal (Surrey—Newton, Lib.)",,Private Members' Business,Mennonite Heritage Week,,"Mr. Speaker, I would like to congratulate the hon. member for Abbotsford for bringing this motion forward and for being proud of his heritage. I come from a Sikh heritage. We all come from different heritages and bring those values to Canada, but we are all proud Canadians. In fact, if there is one historic Sikh site outside of Pakistan and India, it is in the hon. member's own riding. 
However, some Canadians have raised concerns as to why motions such as this, that seek to designate a Mennonite or Sikh heritage month or day, are important. Therefore, I would like to ask the hon. member why motions such as this are important, should be brought here and should be respected.",Liberal,Surrey—Newton,Sukh Dhaliwal,http://www.parl.gc.ca/Parliamentarians/en/members/sukh-dhaliwal(215963)
4771853,ca.proc.d.2019-02-27.10513999,2019-02-27,fc9a44ff-23e0-45df-8ec4-a9cccefa71e1,234403,Hon. Ed Fast,,Private Members' Business,Mennonite Heritage Week,,"Mr. Speaker, these kinds of motions allow us to celebrate the diversity of our country. I note that my home riding of Abbotsford, which I proudly represent, is known for being a community where large Sikh, Mennonite and Dutch populations, as well as many other people, all live in harmony together. These kinds of motions allow us to re-emphasize for Canadians how fortunate we are to live in a country like this, where we celebrate that diversity, live with each other in peace and learn from each other. That is a great thing to celebrate.",Conservative,Abbotsford,Ed Fast,http://www.parl.gc.ca/Parliamentarians/en/members/ed-fast(234403)
4771854,ca.proc.d.2019-02-27.10514006,2019-02-27,ea197684-00f6-458f-a46b-5bea7db6f7f3,240374,"Mr. Daniel Blaikie (Elmwood—Transcona, NDP)",,Private Members' Business,Mennonite Heritage Week,,"Mr. Speaker, one of the great contributions of Mennonites in Canada has been some of the outstanding work they do sponsoring refugees to come to Canada and supporting them once they are here. I wonder if the member would like to speak a bit about that work. ",New Democratic Party,Elmwood—Transcona,Daniel Blaikie,http://www.parl.gc.ca/Parliamentarians/en/members/daniel-blaikie(240374)
4771855,ca.proc.d.2019-02-27.10514015,2019-02-27,fc9a44ff-23e0-45df-8ec4-a9cccefa71e1,234403,Hon. Ed Fast,,Private Members' Business,Mennonite Heritage Week,,"Mr. Speaker, that is a great question from the member for Elmwood—Transcona. I know he has a lot of Mennonites living in his riding as well. 
Mennonites banded together to form an organization called the Mennonite Central Committee, which was actually able to be an agent for bringing the persecuted Mennonites from Europe and Russia to Canada in the first place. It was agents of that wonderful service that allowed us to settle in this wonderful country we call Canada. 
MCC and Mennonite congregations across Canada have been very active, as my colleague knows, in sponsoring refugees from war-torn places around the world, focusing on the most marginalized and vulnerable refugees. We have them in our own church. Some very good friends of mine are refugees from Iraq. We are working with them to bring their children to Canada. They faced immense persecution there. They have now landed in the community of Abbotsford and are finding that community welcoming and supportive. They still face challenges, as all immigrant families do, finding jobs and trying to find housing. These are big challenges, but they are up to the challenge, as most immigrants have been who have come to Canada and have built this amazing country. ",Conservative,Abbotsford,Ed Fast,http://www.parl.gc.ca/Parliamentarians/en/members/ed-fast(234403)
4771856,ca.proc.d.2019-02-27.10514048,2019-02-27,07cf5767-802c-406c-92a7-7dc92af79b40,229526,"Mr. Kevin Lamoureux (Parliamentary Secretary to the Leader of the Government in the House of Commons, Lib.)",,Private Members' Business,Mennonite Heritage Week,,"Mr. Speaker, this might be the third or possibly even the fourth time I have had the opportunity to talk about a heritage week and heritage month. I, for one, truly believe in Canada's diversity, which, as our Prime Minister has often said, is one of our greatest strengths.
 That is amplified when we attend Winnipeg during the summer months of Folklorama, where we see a cultural smorgasbord of sorts, of all different ethnic groups sharing their heritage with the broader community in a very real and tangible way. On that note, this is a very special year for Folklorama because it is the 50th anniversary. I want to recognize that and applaud all of those individuals who have made this one of the most successful multicultural and diversity events in North America. It has been truly an amazing effort by a lot of wonderful people and highlights just how diversified Canada really and truly is.
In terms of the motion that has been brought forward by my colleague across the way, it makes reference to the Mennonite community. It is a community that I am very familiar with. Although I might not be of Mennonite heritage, personally, at times I might question that because of my father and the engagement he had with the Mennonite community. He was a great consumer of many Mennonite products, in particular agricultural products over the years when I was fairly young and growing up. I have had the opportunity to also experience first-hand as an adult many of the exchanges that have taken place, again, based on commerce. A number of years back, in the 1990s, I was able to get a bit better sense of the Mennonite community, when I started to get engaged in the whole issue of leadership within political parties and reaching out and so forth.
I would like to share a few thoughts and then talk about diversity.
As the member indicated, the Mennonite community is fairly well dispersed in Canada, but I want to talk about the Manitoba Mennonite community. In and around the time of Confederation, we had Mennonites. Russian Mennonites who were in Ukraine came to Canada in and around the 1870 to 1875 era and settled in southern Manitoba. Interesting enough, we see that some of the healthiest communities today in rural Manitoba are found where our Mennonite community has been second to no other, in terms of the driving force of the economic and social development of that area of the province.
Obviously, the Mennonite community has grown considerably over the years and has had significant influence on all aspects of our society. One of the questions asked was in regard to the Mennonite heritage community and the fine work that it does as a non-profit agency. We continue to hear on an annual basis of the charitable works that are done from within our Mennonite community, again arguably second to no other.
Earlier I was talking about the issue of trade and I want to draw the connection. One of the first tours I had of a really large farm operation was on a Mennonite-run hog farm. I walked into a massive barn that had about 10,000 hogs in it and the first thing I saw was computers. The computers controlled the feedings, which ultimately controlled the weight and determined when a pig was ready to go to market.
By my using this as an example, members get an appreciation of what the member for Abbotsford was been referring to. The work ethic of the Mennonite community is truly amazing. In many ways, Mennonites have been pioneers in what we are today. I do not think we can really underestimate their contributions to Canada's diversity.
Our diversity continues to grow every day, as our heritage is enriched through immigration on a daily basis. However, on many different fronts, our Mennonite community has brought wonderful attributes to Canada's heritage.
On many occasions I have had the opportunity to have exchanges with members of the community. They have a very high sense of pride in their Mennonite heritage. It was nothing but an absolute delight. Whether in my riding of Winnipeg North, which may not have as high a concentration of Mennonites as in the Kildonan area, or in southern Manitoba, the community has definitely had an impact.
The member for Abbotsford was asked an important question by my colleague on why we recognized heritage weeks, months or days. I will attempt to answer that question in my own words.
We need to have an appreciation for one of Canada's greatest strengths, which is our diversity. By having these heritage days, weeks or months, we provide an opportunity for individuals, whether inside or outside the chamber, to appeal to the broader community to recognize or host a special event.
Let me give members three examples. Last fall, the House passed a motion to have a heritage month for our Filipino community in Canada, which occurs in the month of June. We also had a motion for Sikh heritage last fall, which I believe is currently in the Senate. That is to recognize Sikh heritage in the month of April. Today, we are talking about recognizing Mennonite heritage in the second week of September. Those three communities provide so much to our society.
 As members of Parliament, we can encourage school boards, provincial levels of government or businesses in our communities to present awards and to do things that heighten awareness. I have always believed we should not ask people who become Canadian citizens to forget about their homelands. We, in fact, like to encourage them to use their home, their country and their grouping to grow Canada's heritage.
I will be hosting a heritage month. I will be giving out medallions. I will take a look at what role I might be able to play. Why? It is because the member for Abbotsford has taken the time to recognize a really important community and he wants to ensure there is a heightened sense of public awareness, public pride and individual pride in our communities. We are Canadian but we are Mennonite Canadians in many ways. We need to know our roots.
That is why I applaud the member for bringing this forward and I look forward to the ongoing debate.",Liberal,Winnipeg North,Kevin Lamoureux,http://www.parl.gc.ca/Parliamentarians/en/members/kevin-lamoureux(229526)
