basepk,hid,speechdate,pid,opid,speakeroldname,speakerposition,maintopic,subtopic,subsubtopic,speechtext,speakerparty,speakerriding,speakername,speakerurl
4768478,ca.proc.d.2019-02-04.10467574,2019-02-04,50a18bf1-9be3-4563-b657-6af367453ba0,217254,"Mr. Charlie Angus (Timmins—James Bay, NDP)",,Private Members' Business,National Suicide Prevention Action Plan,," moved:
 That, in the opinion of the House the government should: (a) establish a national suicide prevention action plan, including among its provisions (i) commitment to the actions and resources required to establish culturally appropriate community-based suicide prevention programs as articulated by representative organizations of the Inuit, First Nations, and Métis peoples, (ii) establishment of national guidelines for best practices in suicide prevention based on evidence of effectiveness in a Canadian context, (iii) the creation of a national public health monitoring program for the prevention of suicide and identification of groups at elevated risk, (iv) creation of programs to identify, and to attempt to fill, gaps in knowledge relating to suicide and its prevention, including timely and accurate statistical data, (v) development of tools to promote responsible and safe reporting of suicide and its prevention by media, (vi) establishment of national standards for the training of persons engaged in suicide prevention, whose contact with potentially vulnerable populations provides an opportunity to identify at-risk individuals and direct them to appropriate assessment and treatment, (vii) creation of a national online hub providing essential information and guides to accessing services, in English, French, selected Indigenous languages, and other languages spoken widely in Canada for suicidal individuals, their families and friends, people bereaved by a loved one’s suicide, workplaces and other stakeholders concerned with suicide prevention, (viii) conducting within 18 months comprehensive analyses of high-risk groups of people, and the risk factors specific to each such group, the degree to which child sexual abuse and other forms of childhood abuse and neglect have an impact on suicidal behaviour, the barriers to Canadians accessing appropriate and adequate health, wellness and recovery services, including substance use, addiction and bereavement services, the funding arrangements required to provide the treatment, education, professional training and other supports required to prevent suicide and assist those bereaved by a loved one’s suicide, the use of culturally appropriate suicide prevention activities and best practices, the role that social media plays with respect to suicide and suicide prevention, means to reduce stigma associated with being a consumer of mental health, bereavement and other associated services, and ways in which society can reduce access to means and methods for people to harm themselves; and (b) report to Parliament annually on preparations for and implementation of the national action plan for suicide prevention, including data on progress over the previous year, and a comprehensive statistical overview of suicide in Canada for the same year. 
Mr. Speaker, I am proud to rise today for my first intervention in the new House to move a motion on the need to establish a national suicide prevention action plan. This motion presents an opportunity for members of Parliament to work together and do what it takes to resolve Canada's suicide crisis.
I want to say at the beginning of my speech how honoured I am to be rising in this new chamber, this new Parliament, that was smudged by Claudette Commanda of the Algonquin nation, the first time in any legislature in any nation. We begin this new Parliament with a sense of hope and commitment to making change. I take very seriously my opportunity to speak on a matter as important as this.
I think back to one of the first debates we had in this 42nd Parliament, not a debate but a common discussion, during the Attawapiskat suicide crisis in 2012. It was a powerful moment for this Parliament because members came together. The problem is that the deaths continue, and good words alone will not change the reality unless we come together to recognize the role that the federal government has to play.
There is an example that shows that it is possible for Canada to find a solution. Twenty years ago, Quebec established a provincial plan to reduce the rate of suicide among Quebeckers, and the outcome was extraordinary. This plan reduced the number of suicides in Quebec by 40%. Imagine the positive impact a similar plan established by the Parliament of Canada could have at the national level.
Suicide touches every one of us. It touches all our communities. It touches across age groups, across race. I come at this issue from the experience I have seen in the communities of the far north, through one horrific crisis after another, and realizing that without the support of a coherent strategy, children have needlessly died, and will continue to die, unless we change.
 I was recently at Northern Lights Secondary School in James Bay. I walked into that school, and I saw a school of hope. I saw young people engaged. I saw them playing music. I could feel it in the halls, that sense of determination and of a future. I remember being there 10 years ago in the middle of the suicide crisis. I saw the trauma on the faces of the first responders and the families, because children were dying, not singly but in twos and threes. At that time, there was no one from the federal or provincial governments, no departments, helping out.
Ron Pate, who was the principal, said he would keep the school open all night long, every night. He said he was not going to lose another child on his watch. Those words have stayed with me ever since.
What kind of nation sits back and does nothing while its young people lose hope? What kind of nation chooses to clip the wings of its youth?
What kind of nation sits back as young people are dying and does not send in all the support necessary and learn the lessons so that we can change this? How is it possible that we can have these patterns again and again without putting in place a coherent response?
Again, from my region and the region that I represent, where we have seen some of the highest suicide rates in the world, I have seen the potential of young people to transform this nation. Every time we lose a young person, we are losing the future of our nation.
We have lost Sheridan Hookimaw, Deandra Anderson, Chantel Fox, Jenera Roundsky, Jolynn Winter, Azraya Kokopenace, Emily Ellison, Amy Owen, Kanina Sue Turtle, all in the last few years. I want their names on the record, because those children were loved.
We are here to tell their families and their community that they did not die in vain. We have an obligation to work together for young people like Amy Owen, who wrote on Facebook that life was so hard she could not go on, at age 12. That is not the Canada that I want to be in, and that is not the Canada any of us want to be in. We, as a Parliament, can make a difference.
We have models, but we need to first of all establish a community-based response that is culturally understanding of the various realities in our country. The last thing we need is another Health Canada program with posters. That will not change anything. We need to be empowering and ensure that the grassroots organizations, cultural organizations, indigenous organizations are at the table to say what they need, because they know what works. That would be a big step along the way of making change.
We also need to develop national evidence-based best practices. We do not have to invent rocket science here. There are mental health organizations and indigenous organizations that know what needs to be done, but they need a willing partner.
We need to raise awareness about how coverage of suicide in the media is dealt with. It is said that suicide rates increased 10% in the United States after the death of Robin Williams. We need to talk about media. We also need to talk about bereavement in families who are left on their own and have no one to talk to.
 The fundamental difference between suicide and other health crises is that suicide is like a psychic shock wave. It goes through a family, a community, a school, and its lingering effects are for life. We have seen this particularly in the far northern communities when we do not respond with a coherent strategy. That psychic shock wave has echo effects, so we start to see, especially in young people, imitative behaviours that are incredibly destructive.
We need a national online resource hub, in multiple languages, to reach people. That is something that the federal government could do. We need to have a set of national training standards for people who are engaged in suicide prevention work and those who want to know how to help, so that we have better protocols and it is easier to access those protocols.
The other thing is that we need a coherent set of numbers. If I said that 11 people are dying every day in car accidents, we would say that is terrible, that people should drive more safely because 4,000 plus people die every year. We use those numbers about suicide. However, what if we started to point out that we had the evidence that they are not dying at random, that there are pressure points? If we said in a car accident case that a number of people died at one crosswalk, we would go there to find out what was wrong. 
Without the statistical evidence and a coherent strategy, we do not know where to put the resources in place. For example, I was shocked in my research that the highest numbers we were coming across were in middle-age men. Why is that? No one was talking about that. I know that when a mill shuts down or a factory shuts down, people anecdotally will say, yes, and then they started to die. If we identified the risk in advance, we could start to reach out to those men and have the programs in place, so that those who are losing their jobs in times of transition are not on their own. This is what evidence gives us. Evidence gives us a focus to move forward, and that is something that the federal government can do.
I have been at this business in Parliament, and honoured to do this, for many years. One thing I have come to realize is that the government members get up, hug us, and say it is a wonderful motion and dear to their hearts and then nothing ever happens. This is why the motion calls on the federal government to do a regular progress report to Parliament. 
If we have the progress report on the numbers on issues of identifying factors such as child sexual abuse, if the government is obligated to present to Parliament an annual report, then we can begin to see how we are making a difference and if we are making a difference. Where we are not making a difference, we can start to ask why.
That was the real beauty of the Quebec model. It began to say it could change things by identifying where the problems were and putting resources there. We are the only G7 country without a national suicide action plan. It astounds me that in some regions of Canada we have the highest suicide rates in the world, yet every time a number of young people die the best we get is a tweet from a minister saying that it is a tragedy. It is not a tragedy; it is preventable.
I saw this in the Attawapiskat crisis. We saw it in Neskantaga and La Loche. We have seen it again and again. A tragedy is when a child walks out and gets hit by a bus. However, when a pattern is repeated again and again, we have to ask ourselves what is causing that pattern. What are the numbers?
For example, in the far north, we did not have the on-the-ground proactive teams that limited and diminished the risks to young people. We did not have access to mental health services. We did not have any understanding or any way to find out whether child sexual abuse was a factor. We needed that in each of these cases.
We have gathered support across this country. The Canadian Association for Suicide Prevention has been doing incredible work on this. For years, it has been asking for this strategy. The Canadian Medical Association supports it, as well as the regional Chiefs of Ontario, the Canadian Indigenous Nurses Association and the Canadian Nurses Association.
I want to pay special tribute to Inuit Tapiriit Kanatami, ITK, and its president Natan Obed, who established a plan for the Inuit. ITK is getting really good statistics so it can start to identify the problems.
I want to give a special thanks to Jack Hicks, who has been one of the front-line advocates for getting a strategy for suicide prevention. He approached my office during the horrific suicide crisis in Wapekeka, when we lost Chantel Fox, Jolyn Winter and Jenera Roundsky. The trauma of those deaths led to numerous other young women dying in that far north of Treaty 9. Jack asked us why we were not putting in place this national strategy. We were overwhelmed and dealing reactively, and he said that it was time Parliament acted proactively.
Therefore, I come to my colleagues across the political spectrum saying that as legislators, as adults, as parents, as the people who are supposed to be the voice of Canada, we need to start talking about how we address this horrific crisis that is causing so much pain and devastation. For any person we lose, we are losing the future of our nation. I look into the eyes of young people and ask myself how they can give up. How can they not believe that this nation is there for them? If we are not there for them, we have failed. 
This is our opportunity. In the dying days of a Parliament that has been pretty fractious, one that has perhaps not lived up to what Canadians expected of it, we can do something that says that, together, we are going to put people first and start to talk about how to deal with the horrifying crisis of suicide.",New Democratic Party,Timmins—James Bay,Charlie Angus,http://www.parl.gc.ca/Parliamentarians/en/members/charlie-angus(217254)
4768479,ca.proc.d.2019-02-04.10467580,2019-02-04,f60ef5d8-8e71-4953-bc1b-a8ea4749a18e,235608,"Mr. Michel Picard (Montarville, Lib.)",,Private Members' Business,National Suicide Prevention Action Plan,,"Mr. Speaker, I applaud my colleague from Timmins—James Bay for his speech and for his dedication to this sensitive issue that concerns all of us.
I would like to ask him to take a few minutes to tell us more about the progress report based on new figures. What would be the point of that report? I was under the impression that we already have a number of organizations working on those issues. Is that not enough?
Are there not concrete, practical approaches, such as education and sports, that we should be focusing on that would help us achieve better results? ",Liberal,Montarville,Michel Picard,http://www.parl.gc.ca/Parliamentarians/en/members/michel-picard(235608)
4768480,ca.proc.d.2019-02-04.10467582,2019-02-04,50a18bf1-9be3-4563-b657-6af367453ba0,217254,Mr. Charlie Angus,,Private Members' Business,National Suicide Prevention Action Plan,,"Mr. Speaker, I have a great deal of respect for my colleague. We are both members of the Standing Committee on Access to Information, Privacy and Ethics.
His question is an important one, and I do want to make it clear that extraordinary work is being done to reduce suicide risks.
Provincial and territorial authorities are responsible for meeting their citizens' health care needs. The federal government is responsible for the health care needs of indigenous communities, soldiers and veterans. The federal government also has to work with the provinces to create a national plan for things like statistics and to figure out the best way to respond to this crisis.",New Democratic Party,Timmins—James Bay,Charlie Angus,http://www.parl.gc.ca/Parliamentarians/en/members/charlie-angus(217254)
4768481,ca.proc.d.2019-02-04.10467585,2019-02-04,4437c848-d8c7-4a39-a948-1539969f3a90,234764,"Ms. Marilyn Gladu (Sarnia—Lambton, CPC)",,Private Members' Business,National Suicide Prevention Action Plan,,"Mr. Speaker, I would like to thank my colleague, the member for Timmins—James Bay, for bringing the motion forward.
In my riding of Sarnia—Lambton, suicide is occurring at an epidemic rate. As recently as Friday, I was at an eating disorder awareness week kickoff, where a young girl gave testimony that one in five young girls with an eating disorder commits suicide. I would love to see that included in the study.
I am also very interested in those who suffer sexual trauma. I hope that when the member brings this forward, people will look at those who have had sexual trauma in the past and at the penalties that are happening. In my riding, we just heard that another 13-year-old girl was raped and the perpetrator received months in jail, not years. This girl will be high risk for suicide. I hope that is addressed in the member's motion.",Conservative,Sarnia—Lambton,Marilyn Gladu,http://www.parl.gc.ca/Parliamentarians/en/members/marilyn-gladu(234764)
4768482,ca.proc.d.2019-02-04.10467587,2019-02-04,50a18bf1-9be3-4563-b657-6af367453ba0,217254,"Mr. Charlie Angus (Timmins—James Bay, NDP)",,Private Members' Business,National Suicide Prevention Action Plan,,"Mr. Speaker, certainly the point she made about eating disorders is shocking. I had never heard that.
That is why we need to be gathering the statistics to find out where the pressure points are. Once we know that, we can start to look at possible solutions.
In terms of the issue of sexual abuse, I was involved in one horrific suicide crisis. I remember calling in to the police and asking if we had numbers and if we knew whether it was a factor. An officer said he did not have the resources and that he did not know. I was calling the child advocate, asking if we knew. I was told we do not have the resources. Everyone was on the lookout, but we did not know.
We must realize the importance of saying, proactively, that there are communities that have suffered higher levels, especially regarding intergenerational trauma. We have seen the intergenerational trauma of residential schools. We can start to see these factors. Once we start putting that in place, then we will know where the proactive resources should be going.",New Democratic Party,Timmins—James Bay,Charlie Angus,http://www.parl.gc.ca/Parliamentarians/en/members/charlie-angus(217254)
4768483,ca.proc.d.2019-02-04.10467591,2019-02-04,6da8653f-692f-4bbc-acb2-86e088f0d60d,219035,"Mr. Pierre Nantel (Longueuil—Saint-Hubert, NDP)",,Private Members' Business,National Suicide Prevention Action Plan,,"Mr. Speaker, I would like to thank my colleague for his longstanding dedication to these important issues. As members know, he has repeatedly tried to rally us all to this cause.
Does he think it is possible to gather data about what led to such despair, to these fatal acts, and to show that the health care system lacks professionals and family doctors? 
Bit by bit, our health care system is becoming a two-tier system, and we do not even realize it. Because of this system, have-not families may not get a diagnosis, and I suspect this problem is even worse in Canada's north.",New Democratic Party,Longueuil—Saint-Hubert,Pierre Nantel,http://www.parl.gc.ca/Parliamentarians/en/members/pierre-nantel(219035)
4768484,ca.proc.d.2019-02-04.10467593,2019-02-04,50a18bf1-9be3-4563-b657-6af367453ba0,217254,Mr. Charlie Angus,,Private Members' Business,National Suicide Prevention Action Plan,,"Mr. Speaker, inadequate access to mental health services is a critical issue. The lack of resources must be addressed in order to prevent suicide. 
There is a lack of resources in major urban centres, and the situation is brutal in the Far North. When I speak with officials following a suicide crisis, I ask them about the mental health services that exist for young people in those communities. They always tell me that programs and services do exist. That is false. When we look at the causes of a crisis, we routinely find the problem of inadequate access to mental health services. It is unacceptable.",New Democratic Party,Timmins—James Bay,Charlie Angus,http://www.parl.gc.ca/Parliamentarians/en/members/charlie-angus(217254)
