basepk,hid,speechdate,pid,opid,speakeroldname,speakerposition,maintopic,subtopic,subsubtopic,speechtext,speakerparty,speakerriding,speakername,speakerurl
4768637,ca.proc.d.2019-02-04.10468243,2019-02-04,5d3dfa7b-f157-4019-ac2a-4dab0cb15f92,213961,"Hon. Bill Morneau (Minister of Finance, Lib.)",,Oral Questions,Interests of Quebec,,"Mr. Speaker, we are going to continue with our approach. It is clearly a good way to improve the lives of middle-class Canadians across the country. 
In Quebec in particular, the economy is now growing and the unemployment rate is very low. That means our approach and the approach of the Quebec government are working well together. This is a great situation for Quebec.",Liberal,Toronto Centre,Bill Morneau,http://www.parl.gc.ca/Parliamentarians/en/members/bill-morneau(213961)
4768638,ca.proc.d.2019-02-04.10468245,2019-02-04,5848c1f7-b3d9-4dd3-af1c-019e0a321f7a,217311,"Mr. Erin Weir (Regina—Lewvan, CCF)",,Oral Questions,Transportation,,"Mr. Speaker, when asked last week about Greyhound pulling out of B.C., the Minister of Transport said, “We are working with the provinces.... We will be there if they request us to help them on a cost-sharing basis.”
The Saskatchewan Transportation Company has been shut down and sold off. Is the federal government also offering to share the cost of restoring needed bus service in our province?",Independent,Regina—Lewvan,Erin Weir,http://www.parl.gc.ca/Parliamentarians/en/members/erin-weir(217311)
4768639,ca.proc.d.2019-02-04.10468248,2019-02-04,bc2e82f3-02f1-46e2-b9be-7d5f04ddddc9,214106,"Hon. Marc Garneau (Minister of Transport, Lib.)",,Oral Questions,Transportation,,"Mr. Speaker, as we said last November, we are there to help, on a cost-sharing basis, those provinces that are willing to invest in providing some of the routes that have been abandoned by Greyhound and that have not been taken up by other companies in the private sector.
That applies to all the four western provinces. We are there because we realize that certain people depend on the bus service; they have no other alternative. We will be there.",Liberal,Notre-Dame-de-Grâce—Westmount,Marc Garneau,http://www.parl.gc.ca/Parliamentarians/en/members/marc-garneau(214106)
4768640,ca.proc.d.2019-02-04.10468254,2019-02-04,3176068f-62ee-4b2f-aacd-1131201c6db1,214707,The Speaker,,Oral Questions,Transportation,,The hon. member for Louis-Saint-Laurent on a point of order.,Liberal,Halifax West,Geoff Regan,http://www.parl.gc.ca/Parliamentarians/en/members/geoff-regan(214707)
4768641,ca.proc.d.2019-02-04.10468255,2019-02-04,e277e13e-59ec-425f-a957-eb5e54d8cb62,217679,Mr. Gérard Deltell,,Oral Questions,Transportation,,"Mr. Speaker, you will find the unanimous consent of the House to table the following document: the Liberal Party platform from 2015. Page 76 talks about returning to a balanced budget in 2019.",Conservative,Louis-Saint-Laurent,Gérard Deltell,http://www.parl.gc.ca/Parliamentarians/en/members/gerard-deltell(217679)
4768642,ca.proc.d.2019-02-04.10468256,2019-02-04,3176068f-62ee-4b2f-aacd-1131201c6db1,214707,The Speaker,,Oral Questions,Transportation,,Is there unanimous consent?,Liberal,Halifax West,Geoff Regan,http://www.parl.gc.ca/Parliamentarians/en/members/geoff-regan(214707)
4768643,ca.proc.d.2019-02-04.p5759286,2019-02-04,,,,intervention,Oral Questions,Transportation,," Agreed.
 No.",,,Some hon. members,
4768644,ca.proc.d.2019-02-04.p5759288,2019-02-04,3176068f-62ee-4b2f-aacd-1131201c6db1,214707,The Speaker,,Oral Questions,Transportation,, The hon. member for Bellechasse—Les Etchemins—Lévis on a point of order.,Liberal,Halifax West,Geoff Regan,http://www.parl.gc.ca/Parliamentarians/en/members/geoff-regan(214707)
4768645,ca.proc.d.2019-02-04.10468257,2019-02-04,22a96405-bed6-45e9-811a-69d055416803,234948,Hon. Steven Blaney,,Oral Questions,Transportation,,"Mr. Speaker, during question period, I mentioned the report of the Standing Committee on National Defence, which gives 14 reasons why the Liberals should immediately award the Davie shipyard a contract to build the Obelix. I am seeking unanimous consent, in the spirit of transparency, to table this important report for taxpayers, for the Navy and for the Davie workers.",Conservative,Bellechasse—Les Etchemins—Lévis,Steven Blaney,http://www.parl.gc.ca/Parliamentarians/en/members/steven-blaney(234948)
4768646,ca.proc.d.2019-02-04.10468258,2019-02-04,3176068f-62ee-4b2f-aacd-1131201c6db1,214707,The Speaker,,Oral Questions,Transportation,,Is there unanimous consent?,Liberal,Halifax West,Geoff Regan,http://www.parl.gc.ca/Parliamentarians/en/members/geoff-regan(214707)
4768647,ca.proc.d.2019-02-04.p5759291,2019-02-04,,,,intervention,Oral Questions,Transportation,," Agreed.
 No.",,,Some hon. members,
4768648,ca.proc.d.2019-02-04.10468259,2019-02-04,ad4032f2-6bb1-497b-b146-f321cfb71ba9,218016,Hon. Pierre Poilievre,,Oral Questions,Transportation,,"Mr. Speaker, it is important for us to keep our promises in both official languages so that I think you will find unanimous consent to allow me to table in the House of Commons the Liberal Party platform showing that the budget will be balanced in the year 2019, which is this year.",Conservative,Carleton,Pierre Poilievre,http://www.parl.gc.ca/Parliamentarians/en/members/pierre-poilievre(218016)
4768649,ca.proc.d.2019-02-04.10468261,2019-02-04,3176068f-62ee-4b2f-aacd-1131201c6db1,214707,The Speaker,,Oral Questions,Transportation,,Is there unanimous consent?,Liberal,Halifax West,Geoff Regan,http://www.parl.gc.ca/Parliamentarians/en/members/geoff-regan(214707)
4768650,ca.proc.d.2019-02-04.p5759295,2019-02-04,,,,intervention,Oral Questions,Transportation,," Agreed.
 No.",,,Some hon. members,
4768651,ca.proc.d.2019-02-04.10468268,2019-02-04,,,,,Oral Questions,Michael Ferguson,,"Mr. Speaker, fellow parliamentarians, House of Commons staff and honoured guests, I rise today in sorrow to pay tribute to Auditor General Michael Ferguson, a dedicated and honourable public servant who died too soon this weekend. He was just 60 years old. 
Over the past seven years, Mr. Ferguson was a tireless champion of a transparent, open government that is accountable to all Canadians. He never wavered in his mission, even in recent months as he fought cancer.
During my time as minister of health and later as minister of indigenous services, I quickly came to know him as a man dedicated to helping the most vulnerable citizens, particularly in the context of justice and equality for indigenous peoples.
A son of New Brunswick, Michael Ferguson devoted his life to public service. His career serving the people of New Brunswick took him from comptroller of the provincial books to Auditor General of New Brunswick, and then deputy minister of Finance and secretary to the Board of Management. Along the way, he spent time as the president of the New Brunswick Institute of Chartered Accountants and spent three years on the province's Public Sector Accounting Board before being elected to the Fellowship of the New Brunswick Institute of Chartered Accountants. 
In November 2011 Mr. Ferguson was appointed to be Canada's Auditor General, just the 14th person to told the position since Confederation, following in the footsteps of the formidable Sheila Fraser.
Diligent, dedicated and humble, he was a model public servant. All Canadians owe him a debt of gratitude.
As Auditor General, his office examined such foundational issues as rail safety, tax collection, access to health services for remote first nations communities, food protection, cybersecurity and military procurement. 
All governments must be open to outside critique. Michael Ferguson was able to focus on the granular details of government while also recognizing systemic issues. He was always striving to make us better as a government and as a country.
Michael Ferguson helped strengthen our democracy and maintain the integrity that Canadians expect from our public institutions.
Two days ago, he passed away surrounded by his wife Georgina and sons Malcolm and Geoffrey.
 He is gone too soon, but we know that his was a life well lived.
On behalf of the Government of Canada and all Canadians, I offer our deepest condolences to Mr. Ferguson's family, friends and colleagues.",,,"Hon. Jane Philpott (President of the Treasury Board and Minister of Digital Government, Lib.)",
4768652,ca.proc.d.2019-02-04.10468272,2019-02-04,831322ab-9fa6-437e-92ba-1b4525f8242d,216505,"Mr. Pat Kelly (Calgary Rocky Ridge, CPC)",,Oral Questions,Michael Ferguson,,"Mr. Speaker, I too join the President of the Treasury Board and rise to pay tribute to an extraordinary public servant who dedicated his entire professional working life to making Canada a better place. I offer my deepest condolences on the passing of Auditor General Michael Ferguson, who succumbed to cancer and passed away this past Saturday surrounded by his family.
Michael Ferguson had a distinguished career, serving the Province of New Brunswick in several senior roles prior to being appointed Auditor General of Canada in 2011 by then prime minister Stephen Harper. Michael Ferguson quickly established his reputation for tough, thorough audits. Over successive governments, he never shied away from bringing the failures of government departments and agencies to Parliament's attention.
When Michael Ferguson appeared as a witness at a committee meeting, Canadians knew that a very bright light was about to be shone into the corners of their government and that accountability would be demanded. He made no attempt to sugar-coat the facts. His reports and committee testimony were delivered without passion or rhetoric; the strong terms he used to describe failures of government were always presented factually, and he was never afraid to be exact and precise regardless of the topic or possible consequences for the government of the day. He leaves a legacy of forcing governments, and indeed all public servants, to constantly improve in order to serve Canadians. 
He will be missed by the thousands of public servants from across Canada who want to deliver the best service that they can to Canadians. He will be missed by the dedicated staff at the Office of the Auditor General. He will be missed by all parliamentarians, and in particular by my colleagues from the Standing Committee on Public Accounts. He will be missed by all Canadians who demand accountability from their government.
To his wife and sons, I extend my deepest sympathies. On behalf of the Conservative opposition, our condolences, thoughts and prayers are with them.",Conservative,Calgary Rocky Ridge,Pat Kelly,http://www.parl.gc.ca/Parliamentarians/en/members/pat-kelly(216505)
4768653,ca.proc.d.2019-02-04.10468274,2019-02-04,d3b34b92-4b9c-4beb-9c3b-dd6146fb8b2c,238220,"Mr. David Christopherson (Hamilton Centre, NDP)",,Oral Questions,Michael Ferguson,,"Mr. Speaker, I rise in the House today to pay tribute to a friend and Canada's Auditor General, Michael Ferguson. 
Canada has lost an exemplary public servant. On behalf of the NDP and myself, I want to begin by expressing my sincere condolences to Michael's family and his colleagues at the Office of the Auditor General. 
A true professional who understood the importance that oversight has on the performance of government, Michael was a leader in the field of auditing and highly respected across Canada and around the world. 
I would like to begin my short remarks by reading quotes from Michael Ferguson to us, to Parliament. This is actually from a report entitled “A Message from the Auditor General” in 2016. This is Michael talking to us.
 I believe that the Office of the Auditor General of Canada is uniquely equipped to support Parliament in its oversight role. Indeed, in our work, it does not matter who sits on which side of the House of Commons. Our business is to examine the activities and programs of government, and to provide parliamentarians with impartial information about what is working and what is not. 
The report goes on:
 Despite those good outcomes, I believe that government could get more value from our audits if it used them differently—if departments and agencies focused on becoming more productive and put more emphasis on what they are delivering. After all, in one way or another, everything that government does is intended to serve Canadians. As such, government should “do service well,” to benefit Canadians, both individually and collectively. 
That “do service well” was a main theme that he instilled in the current public accounts committee: the idea that at the end of the day, all of the measuring, all of the performance audits, all of the accountability are about Canadians receiving the service that they are entitled to. That is what Michael was all about.
I was actually the chair of the public accounts committee during the transition from Sheila Fraser to Michael Ferguson. I am going to be honest with colleagues: the only thing that was on my mind when Sheila's term was up was who on earth and where on earth were we going to find anybody who could fill Sheila Fraser's shoes. I mean, Sheila was a force of nature. The world knew about the work that Sheila Fraser did.
Then along came this name. I had met him at Canadian Council of Public Accounts meetings, but I did not really know him. He was a long drink of water named Michael Ferguson, the Auditor General from New Brunswick. He did not speak French, which was a problem politically. He did not speak French at that time, as my friend from Quebec is emphasizing. 
I think the important end of that story is that he made commitments to ensure that he was as fluent as he needed to be in our second official language, our equal official language, and from all accounts he did that. It was another commitment that he kept when he made it to Canadians. 
However, those things were working a bit against him, as members can imagine, given the politics of the day, and I did not really know where to go. I had heard he was pretty good, but we had this French problem, and what were we going to do?
 Then I got a phone call from Sheila. I knew Sheila well. We worked together for seven years on the public accounts committee. I do not think I am betraying any confidences at this point now, given where we are. She said to me, “Look, David, I know that there is the issue around the French, and you have to deal with that. I won't speak to that. That's not my role, but I am here, David, to say that if you believe that I have any credibility and you respect my word as the former auditor general of Canada, then please do everything you can to make sure Michael Ferguson becomes the next auditor general.” 
Boy, did she have that right. Michael Ferguson was our auditor general. By the time Michael was done, Michael was the people's auditor. The people in Canada knew that they had a friend, an ally, in Michael Ferguson, just as they had with Sheila Fraser, and that his sole purpose was to provide accountability and transparency regardless of what party was in power, knowing the importance of working with a non-partisan public accounts committee. 
Those who have served on it know that it is a special calling. One does not perform the same way one does on other committees. One's job is to leave one's membership card at the door, go in and deal with the Auditor General's report findings as a parliamentarian. That is what Michael was about. He was about making sure the system worked for Canadians. 
In closing, I would like to quote Michael. He said:
 Parliamentary committees play a crucial role in challenging departments. I believe that there is an important role for parliamentary committees, whether those of the House of Commons or the Senate, to use our audit reports not just to understand what has happened, but also to make sure that changes take place. Committees should invite departments and agencies to appear before them multiple times, until it is evident that they have made the changes needed to improve their services to people. 
 In a few years, when this government is at the end of its current mandate and I am nearing the end of mine, I wonder if I will find myself repeating these words, or if I will be able to talk about real improvements in government services built around people. 
I thank Mike for everything he has done for our country. He has left behind an incredible legacy and challenged us to do service better. It is now up to us, colleagues, to rise to that occasion. ",New Democratic Party,Hamilton Centre,David Christopherson,http://www.parl.gc.ca/Parliamentarians/en/members/david-christopherson(238220)
4768654,ca.proc.d.2019-02-04.10468279,2019-02-04,3176068f-62ee-4b2f-aacd-1131201c6db1,214707,The Speaker,,Oral Questions,Michael Ferguson,,Does the member for Bécancour—Nicolet—Saurel have the unanimous consent of the House to add his remarks?,Liberal,Halifax West,Geoff Regan,http://www.parl.gc.ca/Parliamentarians/en/members/geoff-regan(214707)
4768655,ca.proc.d.2019-02-04.p5759334,2019-02-04,,,,intervention,Oral Questions,Michael Ferguson,, Agreed.,,,Some hon. members,
4768656,ca.proc.d.2019-02-04.10468280,2019-02-04,4b9cf7c8-d5db-4efa-a24e-c26afde48cc3,214090,"Mr. Louis Plamondon (Bécancour—Nicolet—Saurel, BQ)",,Oral Questions,Michael Ferguson,,"Mr. Speaker, Canadians' confidence in our institutions is largely based on the diligence of those who occupy the highest offices. Those individuals have a duty to be exemplary and above reproach. Auditor General Michael Ferguson lived up to that expectation right up until his death, which we were shocked and saddened to learn of today.
On behalf of the Bloc Québécois, I want to offer my condolences to his family, friends and colleagues.
Mr. Ferguson showed a great deal of respect for the French language. When he was appointed as Auditor General, he did not speak French, but he immediately committed to learning it. Just a year later, he kept that promise when, much to his credit, he delivered his first report in both official languages, demonstrating a very respectable knowledge of French. By so doing, he showed that he understood his responsibilities as Auditor General.
Mr. Ferguson was also known for the quality of his work. He submitted comprehensive, targeted reports that were always relevant. The Bloc Québécois always had a very good relationship with the Office of the Auditor General of Canada and always appreciated Mr. Ferguson's attention to detail, objectivity and warmth.
In closing, Mr. Speaker, I would like to leave Mr. Ferguson's family and friends with a quote by the great French author Alexandre Dumas, who said: 
 Those whom we love and lose are no longer where they were before. They are now wherever we are. 
",Bloc Québécois,Bécancour—Nicolet—Saurel,Louis Plamondon,http://www.parl.gc.ca/Parliamentarians/en/members/louis-plamondon(214090)
4768657,ca.proc.d.2019-02-04.10468282,2019-02-04,3176068f-62ee-4b2f-aacd-1131201c6db1,214707,The Speaker,,Oral Questions,Michael Ferguson,,"There have been discussions among representatives of all the parties in the House, and I understand that there is unanimous consent to observe a moment of silence in memory of Michael Ferguson, Auditor General of Canada.
I invite the House to rise and observe a moment of silence.
[A moment of silence observed]",Liberal,Halifax West,Geoff Regan,http://www.parl.gc.ca/Parliamentarians/en/members/geoff-regan(214707)
4768658,ca.proc.d.2019-02-04.10468286,2019-02-04,a2d5c8bf-d42e-4b53-be9e-70af2a6fe169,217370,"Mr. Mark Strahl (Chilliwack—Hope, CPC)",,Routine Proceedings,Business of Supply,,"Mr. Speaker, if you seek it, I believe you will find unanimous consent for the following motion:
 That, at the conclusion of today's debate on the opposition motion in the name of the member for Carleton, all questions necessary to dispose of the motion be deemed put and a recorded division deemed requested and deferred until Tuesday, February 5, 2019, at the expiry of the time provided for Oral Questions. 
",Conservative,Chilliwack—Hope,Mark Strahl,http://www.parl.gc.ca/Parliamentarians/en/members/mark-strahl(217370)
4768659,ca.proc.d.2019-02-04.10468288,2019-02-04,3176068f-62ee-4b2f-aacd-1131201c6db1,214707,The Speaker,,Routine Proceedings,Business of Supply,,Does the hon. member have the unanimous consent of the House to propose the motion?,Liberal,Halifax West,Geoff Regan,http://www.parl.gc.ca/Parliamentarians/en/members/geoff-regan(214707)
4768660,ca.proc.d.2019-02-04.p5759347,2019-02-04,,,,intervention,Routine Proceedings,Business of Supply,, Agreed.,,,Some hon. members,
4768661,ca.proc.d.2019-02-04.p5759348,2019-02-04,3176068f-62ee-4b2f-aacd-1131201c6db1,214707,The Speaker,,Routine Proceedings,Business of Supply,, The House has heard the terms of the motion. Is it the pleasure of the House to adopt the motion?,Liberal,Halifax West,Geoff Regan,http://www.parl.gc.ca/Parliamentarians/en/members/geoff-regan(214707)
4768662,ca.proc.d.2019-02-04.p5759349,2019-02-04,,,,intervention,Routine Proceedings,Business of Supply,, Agreed.,,,Some hon. members,
4768663,ca.proc.d.2019-02-04.p3,2019-02-04,3176068f-62ee-4b2f-aacd-1131201c6db1,214707,The Speaker,,Routine Proceedings,Business of Supply,, (Motion agreed to) ,Liberal,Halifax West,Geoff Regan,http://www.parl.gc.ca/Parliamentarians/en/members/geoff-regan(214707)
4768664,ca.proc.d.2019-02-04.10468443,2019-02-04,3176068f-62ee-4b2f-aacd-1131201c6db1,214707,The Speaker,,Routine Proceedings,Petitions,Palliative Care,"I must say to the hon. member for Chatham-Kent—Leamington that today is my wife's birthday, and she was born in Chatham.",Liberal,Halifax West,Geoff Regan,http://www.parl.gc.ca/Parliamentarians/en/members/geoff-regan(214707)
4768665,ca.proc.d.2019-02-04.10468289,2019-02-04,6dfe3b54-024b-432d-bc01-7f89da30b7cd,239943,"Mr. Dave Van Kesteren (Chatham-Kent—Leamington, CPC)",,Routine Proceedings,Petitions,Palliative Care,"Mr. Speaker, she is a very lucky woman to be able to lay claim to that birthplace. Please convey my best wishes on her birthday. She is a very young woman.
I have a number of petitions, quite a stack actually.
 Back in the 41st Parliament, the House of Commons unanimously passed a motion calling for the government to create a national strategy on palliative care to ensure that every Canadian has access to high-quality palliative care at their end of life. As such, this petition is calling on Parliament to establish that national strategy on palliative care.",Conservative,Chatham-Kent—Leamington,Dave Van Kesteren,http://www.parl.gc.ca/Parliamentarians/en/members/dave-van-kesteren(239943)
4768666,ca.proc.d.2019-02-04.10468296,2019-02-04,8826a32c-2e29-49be-b6e2-c1f10363639b,218836,"Ms. Irene Mathyssen (London—Fanshawe, NDP)",,Routine Proceedings,Petitions,Navigable Waters,"Mr. Speaker, I have a petition from a number of constituents who are calling on the Parliament of Canada to support protections for the Thames River system.
The Conservative government stripped environmental regulations covered in the Navigable Waters Protection Act and thousands of rivers were left vulnerable, particularly heritage rivers like the Thames. Despite the Liberal government promising to reinstate the environmental protections that were gutted, it did not.
The petitioners are calling on the Government of Canada to support my Bill C-355, which commits government to prioritizing the protection of the Thames River by amending the Navigation Protection Act.",New Democratic Party,London—Fanshawe,Irene Mathyssen,http://www.parl.gc.ca/Parliamentarians/en/members/irene-mathyssen(218836)
4768667,ca.proc.d.2019-02-04.10468310,2019-02-04,07cf5767-802c-406c-92a7-7dc92af79b40,229526,"Mr. Kevin Lamoureux (Parliamentary Secretary to the Leader of the Government in the House of Commons, Lib.)",,Routine Proceedings,Questions on the Order Paper,,"Mr. Speaker, I would ask that all questions be allowed to stand.",Liberal,Winnipeg North,Kevin Lamoureux,http://www.parl.gc.ca/Parliamentarians/en/members/kevin-lamoureux(229526)
4768668,ca.proc.d.2019-02-04.p5759358,2019-02-04,3176068f-62ee-4b2f-aacd-1131201c6db1,214707,The Speaker,,Routine Proceedings,Questions on the Order Paper,, Is that agreed?,Liberal,Halifax West,Geoff Regan,http://www.parl.gc.ca/Parliamentarians/en/members/geoff-regan(214707)
4768669,ca.proc.d.2019-02-04.p5759359,2019-02-04,,,,intervention,Routine Proceedings,Questions on the Order Paper,, Agreed.,,,Some hon. members,
