basepk,hid,speechdate,pid,opid,speakeroldname,speakerposition,maintopic,subtopic,subsubtopic,speechtext,speakerparty,speakerriding,speakername,speakerurl
4697787,ca.proc.d.2017-02-10.9365615,2017-02-10,9225dd6b-e672-44d5-8bb7-c634b7e72f2e,216900,Hon. Michelle Rempel,,Government Orders,Canada-Ukraine Free Trade Agreement Implementation Act,,"Mr. Speaker, my colleague has my deep respect for his passion and commitment to moving the yardstick forward on this issue.
What a timely question. We are in an era when there is a movement toward protectionism and isolationism when it comes to trade, and that should concern the global community. When I think about where humanity has come since the end of World War II, we have had decades of peace in Europe, which for the entire history of our species, virtually, had been at war. While there could be improvements in the EU in terms of its efficacy or its scope, the reality is that the European Union has, through economic growth, through the development of infrastructure, brought economic opportunity and hope to regions of the world that had been at war.
My colleague talked about Ukraine being removed from that network that was designed to provide stability and economic growth. That would absolutely be an act of aggression, because we know that economic opportunity and stability creates peace. It would absolutely be the worst thing to isolate a country and its people from the opportunities that are created. I would protest that. Any of us would. It is wrong. This agreement is a step in the right direction for the international community. It is the antithesis of that behaviour.
As we stand here and debate this trade agreement, it is important to put it in the global context of this protectionist desire. My colleague opposite so beautifully talked about what the benefits of trade can do. It is more than just the exchange of goods. It is the development of economic opportunity and peace.",Conservative,Calgary Nose Hill,Michelle Rempel,http://www.parl.gc.ca/MembersOfParliament/ProfileMP.aspx?Key=216900&Language=E
4697788,ca.proc.d.2017-02-10.9365621,2017-02-10,5848c1f7-b3d9-4dd3-af1c-019e0a321f7a,217311,"Mr. Erin Weir (Regina—Lewvan, NDP)",,Government Orders,Canada-Ukraine Free Trade Agreement Implementation Act,,"Mr. Speaker, one of the reasons the NDP is happy to support this trade agreement, in contrast to the Canada-Europe deal, is that it does not contain investor-state provisions that would allow foreign investors to directly challenge our democratic laws, regulations, and policies through special, secretive commercial tribunals, as opposed to the regular Canadian court system that all other Canadians, and indeed foreigners, would have access to in this country.
I wonder if the member for Calgary Nose Hill could explain to the House why the Conservatives think it is important to include investor-state provisions in CETA.",New Democratic Party,Regina—Lewvan,Erin Weir,http://www.parl.gc.ca/MembersOfParliament/ProfileMP.aspx?Key=217311&Language=E
4697789,ca.proc.d.2017-02-10.9365623,2017-02-10,9225dd6b-e672-44d5-8bb7-c634b7e72f2e,216900,Hon. Michelle Rempel,,Government Orders,Canada-Ukraine Free Trade Agreement Implementation Act,,"Mr. Speaker, I think there is a larger question here. The world has gone crazy in terms of how political affiliation relates to a party's political, ideological position on trade.
I look at the some of the discussion being had with our neighbours to the south, and I become very concerned about the thickening of borders and the desire to remove or step out of free trade agreements. The reality is, we are two generations removed from conflict in the western world. For a large part, that is due to the fact that we have opened our borders to trade. We have opened our borders to the exchange of goods and ideas. To me, that is a very positive thing. That is what creates economic stability, that is what creates economic opportunity, and that allows for peace.
 I find it very weird that the NDP, which in the last Parliament did support the EU free trade agreement, has reversed its position. It is now almost reflective of the new American government's position on trade. I find that very strange.
I look forward to further debate on that.",Conservative,Calgary Nose Hill,Michelle Rempel,http://www.parl.gc.ca/MembersOfParliament/ProfileMP.aspx?Key=216900&Language=E
4697790,ca.proc.d.2017-02-10.9365629,2017-02-10,115aadf7-f4d7-4c9d-9537-860cf864ad0c,220019,"Mrs. Salma Zahid (Scarborough Centre, Lib.)",,Statements By Members,Scarborough,,"Mr. Speaker, last week in Scarborough, we had more proof that Canadians are one community united against violence and hate. On a chilly Saturday evening, over 100 community members came together to stand in solidarity with the victims of the Quebec City terror attack and their families, and sent a message of unity and love. I thank the members for Scarborough North, Scarborough—Rouge Park, and Scarborough—Guildwood for joining us, as well as our provincial and municipal colleagues. 
We were led in prayer by members of faith leaders from the Muslim, Christian, Hindu, and Buddhist communities. Also, on Saturday afternoon, the youth committee at the Scarborough Muslim Association brought the community together in prayer. Our future is in good hands with these youth.
 While this attack has chilled the Muslim community, we are warmed by the love and support of our fellow Canadians. Truly, a Canadian is a Canadian is a Canadian.",Liberal,Scarborough Centre,Salma Zahid,http://www.parl.gc.ca/MembersOfParliament/ProfileMP.aspx?Key=220019&Language=E
4697791,ca.proc.d.2017-02-10.9365632,2017-02-10,f6937160-f4b0-4abd-b74a-a24349b6c2b0,216690,"Mr. Brad Trost (Saskatoon—University, CPC)",,Statements By Members,Elim Church,,"Mr. Speaker, I rise today to celebrate 100th anniversary of ministry for Elim Church in Saskatoon. From its early beginnings as a small prayer meeting in a home, the church has grown to be one of the largest churches in Saskatchewan. Elim is multi-generational, multicultural, and is one of the most ethnically diverse congregations in Saskatoon.
 Over the years, Elim has made a priority of caring for its community through its extensive volunteer work. Elim operates a senior's home, provides language training, and sponsors refugee families. In the past year, it has sponsored two refugee families and anticipates a third family's arrival soon. Annually, it provides tens of thousands of dollars to help those who are marginalized, both in Saskatoon and around the world. Elim seeks to be a beacon of light as a Christian community on the journey to become more like Jesus. 
Congratulations Elim, for 100 years of giving hope and help to every life that it has touched. ",Conservative,Saskatoon—University,Bradley Trost,http://www.parl.gc.ca/MembersOfParliament/ProfileMP.aspx?Key=216690&Language=E
4697792,ca.proc.d.2017-02-10.9365637,2017-02-10,7ee20ab9-2d43-420c-8027-f6403cb498a2,229567,"Mr. Emmanuel Dubourg (Bourassa, Lib.)",,Statements By Members,Black History Month,,"Mr. Speaker, on February 6, we launched Black History Month at the Canadian Museum of History. 
I thank the Prime Minister for attending and for his warmly received speech. I also want to thank the Minister of Canadian Heritage, all my colleagues in the House from all parties, senators, and the hundreds of people from coast to coast who came all this way to mark the contribution of African-Canadians.
This year, Viola Desmond was chosen to be featured on Canada's $10 bill in recognition of her influence on the civil rights movement. We are also paying tribute to Mathieu Da Costa on the 2017 Canada Post stamp.
Diversity is our wealth. It is one of Canada's greatest assets. It is essential to our country's prosperity.",Liberal,Bourassa,Emmanuel Dubourg,http://www.parl.gc.ca/MembersOfParliament/ProfileMP.aspx?Key=229567&Language=E
4697793,ca.proc.d.2017-02-10.9365641,2017-02-10,2b91ab47-7930-4848-ad6e-fde1a50a9569,217294,"Ms. Rachel Blaney (North Island—Powell River, NDP)",,Statements By Members,Texada Quarrying,,"Mr. Speaker, today I rise in support of the locked-out workers at Texada Quarrying on Texada Island.
 The Texada Quarrying is a profitable operation, owned by a multinational firm, LafargeHolcim. On October 17, the company locked out more than 60 workers after unsuccessful contract negotiations. Since that time, locked-out workers and their families have lived through a difficult holiday season and long winter.
 It may come as a surprise to some members of the House that workers affected by labour disputes are not eligible for employment insurance. This simply does not make sense in the case of companies locking out workers.
 New Democrats know that we must improve the employment insurance system so that it better meets the needs of working people in this changing economy. I believe it is high time for us to amend the El Act so that workers affected by lockouts can access employment insurance benefits, the benefits workers have paid into for decades in some cases.",New Democratic Party,North Island—Powell River,Rachel Blaney,http://www.parl.gc.ca/MembersOfParliament/ProfileMP.aspx?Key=217294&Language=E
4697794,ca.proc.d.2017-02-10.9365644,2017-02-10,86fed1de-3861-4448-8242-ad414073ef2e,220085,"Ms. Joyce Murray (Vancouver Quadra, Lib.)",,Statements By Members,Henry Charles,,"Mr. Speaker, I am honoured to stand in the House today to remember Musqueam Elder Henry Charles who passed away January 28 early in the morning. 
Henry Charles was a member of the Musqueam Band. He grew up on traditional territorial lands, adjacent to the University of British Columbia, that were home to the strong, united Musqueam people for thousands of years. 
 Henry Charles was a pioneer in recognizing the importance of preserving Hun'qumi'num', the local Musqueam language. As a native historian, storyteller, and official Musqueam speaker and greeter, Mr. Charles's effort to preserve and revitalize his traditional language celebrates his community's unique world view and preserves its traditional knowledge for future generations. He forged connections between storyteller and listeners that promoted literacy, the love of language, and intercultural understanding and appreciation between indigenous and non-indigenous people alike.
 Beloved husband, father, grandfather, Henry was an exemplary elder and he will be dearly missed by all.",Liberal,Vancouver Quadra,Joyce Murray,http://www.parl.gc.ca/MembersOfParliament/ProfileMP.aspx?Key=220085&Language=E
4697795,ca.proc.d.2017-02-10.9365648,2017-02-10,62c4052f-dd41-418a-9b5b-1715c0baa84d,217083,"Mr. Kelly McCauley (Edmonton West, CPC)",,Statements By Members,Edmonton,,"Mr. Speaker, I rise today to pay tribute to the stars of Edmonton. Not to Connor McDavid, though I am very happy to have him wearing an Oilers jersey, I want to pay tribute instead to the many charities and organizations, especially in my riding of Edmonton West, that tirelessly serve our citizens. 
They are organizations like the Maier Centre for Autism, where they are leading the country with new ways of helping children with autism and their families; the Elves Special Needs Society, where they help the disabled live their lives with love and dignity; Kids On Track, where they mentor children at risk, to be future leaders; and Goodwill Alberta, training and employing the disadvantaged and the disabled so that they can enjoy full lives and look forward to a better future.
These and too many others to mention in just a minute are what make Edmonton and my riding of Edmonton West the heart of our city. I thank them and all their many volunteers and supporters for all they do day after day for the love and care of their fellow Edmontonians.
Yes, we do have Connor McDavid, but we have many greater stars in Edmonton.",Conservative,Edmonton West,Kelly McCauley,http://www.parl.gc.ca/MembersOfParliament/ProfileMP.aspx?Key=217083&Language=E
4697796,ca.proc.d.2017-02-10.9365657,2017-02-10,6025d38f-3695-4037-8221-3f4cb652936b,218940,"Mr. Bill Casey (Cumberland—Colchester, Lib.)",,Statements By Members,Sierra Leone,,"Mr. Speaker, on January 15, 1792, 15 ships filled with African Nova Scotians set sail from Halifax for the west coast of Africa in order to establish a new country called “Sierra Leone”. Most of these African Nova Scotians were former slaves who had fled America for Nova Scotia and were now hoping for a new life in Africa. These hardy souls established what is today Freetown, the capital city of Sierra Leone.
 There are still homes in Freetown built the same way they were in Nova Scotia in 1792. There are still streets with Nova Scotia names. People can still name the Nova Scotia towns where their ancestors once lived. The amazing thing to me is that I knew nothing about this significant piece of Nova Scotia history until I visited Sierra Leone a few years ago on a parliamentary mission with the Speaker. I urge those who are interested in this incredible story to go to the Internet and search out “Nova Scotia settlers”, and this amazing story will unfold before their very eyes.",Liberal,Cumberland—Colchester,Bill Casey,http://www.parl.gc.ca/MembersOfParliament/ProfileMP.aspx?Key=218940&Language=E
4697797,ca.proc.d.2017-02-10.9365660,2017-02-10,f8911e4d-f080-4ac8-94b1-74a18979c811,215938,"Mr. Francis Drouin (Glengarry—Prescott—Russell, Lib.)",,Statements By Members,Court Challenges Program,,"Mr. Speaker, I want to congratulate the Minister of Canadian Heritage and the Minister of Justice on restoring and modernizing the court challenges program. This important program allows Canadians to be heard when it comes to defining their rights and freedoms.
As the member of Parliament for a riding with the highest proportion of francophones outside Quebec, I am pleased with this announcement. Fifteen years ago, on February 1, 2002, the Franco-Ontarian community almost lost the only francophone university hospital in Ontario, the Montfort Hospital. Were it not for the court challenges program, the movement could not have stopped the Conservative government from closing this institution that is so essential to the development of the francophone community.
In 2006, the Conservative government decided to cut this program. It took one prime minister Trudeau to establish the program and another to restore it.
The modernized court challenges program reflects our government's commitment to better protecting human rights and official languages rights.
On behalf of minority language communities, thank you.",Liberal,Glengarry—Prescott—Russell,Francis Drouin,http://www.parl.gc.ca/MembersOfParliament/ProfileMP.aspx?Key=215938&Language=E
4697798,ca.proc.d.2017-02-10.9365663,2017-02-10,bb27e38b-4887-48e1-b182-ba18b39d411b,218159,"Mr. Gordon Brown (Leeds—Grenville—Thousand Islands and Rideau Lakes, CPC)",,Statements By Members,Greg Hinton,,"Mr. Speaker, I rise today to pay tribute to, and to pay condolences to the family, friends, and colleagues of, Greg Hinton, vice-president and general manager of Bell Media Radio, Brockville and Kingston. He died January 24 after a two-year battle with cancer.
Greg was instrumental in the continued success of radio stations in those two communities. Over his 30-year career, he demonstrated a deep commitment to the broadcasting business and his communities. He helped grow talented people who are serving across Canada today. In Brockville, he kept the city's only two local radio stations, JRFM and BOB FM, intensely community focused. In Kingston, his leadership has maintained one station at number one in the market, while growing a second station.
As well as his busy career, Greg was focused on helping his communities, and lent his enthusiastic support to many causes. He is survived by his wife Allison; daughters Jessica, Lyla, and Ivy; and son Joshua. He will be missed.",Conservative,Leeds—Grenville—Thousand Islands and Rideau Lakes,Gord Brown,http://www.parl.gc.ca/MembersOfParliament/ProfileMP.aspx?Key=218159&Language=E
4697799,ca.proc.d.2017-02-10.9365667,2017-02-10,ddcc96da-5bcf-4069-9cd6-da8f76df8b89,219919,"Mr. Stéphane Lauzon (Argenteuil—La Petite-Nation, Lib.)",,Statements By Members,The 51st Canadian Ski Marathon,,"Mr. Speaker, the 51st Canadian ski marathon will take place this weekend in the beautiful riding of Argenteuil—La Petite-Nation.
 This event is North America's longest and oldest Nordic ski tour. The legendary Herman Smith-Johannsen, better known as Jack Rabbit, participated in this marathon until the age of 105.
Participants of all ages can ski up to 160 kilometres between Lachute and Gatineau, passing through Montebello. This marathon is not a competition. There are no winners or losers. The main goal is personal achievement.
Skiers can participate individually or as a team and choose among five categories, one of which allows them to set their own goals and select which sections of the course they want to complete.
I would like to thank Frédéric Ménard and his team, as well as the many volunteers. Without them this event would not be possible. ",Liberal,Argenteuil—La Petite-Nation,Stéphane Lauzon,http://www.parl.gc.ca/MembersOfParliament/ProfileMP.aspx?Key=219919&Language=E
4697800,ca.proc.d.2017-02-10.9365670,2017-02-10,28d83c5f-3291-48a5-844c-0cc8b786fb15,229491,"Mrs. Sherry Romanado (Longueuil—Charles-LeMoyne, Lib.)",,Statements By Members,Jacques Nadeau,,"Mr. Speaker, I rise today to pay tribute to Sergeant Jacques Nadeau who passed away on February 2 at the age of 95.
Sergeant Nadeau was fighting with his regiment, the Fusiliers Mont-Royal, on August 19, 1942, in Dieppe when he was captured. He was finally freed in 1945 and continued to serve in the Canadian Armed Forces until he retired in 1971. 
I want to offer my sincere condolences to his family and friends. Sergeant Nadeau also had a family of comrades, the Fusiliers, and those who were with him in Dieppe that day. He lost a friend there, Robert Boulanger.
This year, we are commemorating the 75th anniversary of the Dieppe raid, and we will always remember those who fought in that battle by land, air, and sea.
Thank you, Sergeant Nadeau.",Liberal,Longueuil—Charles-LeMoyne,Sherry Romanado,http://www.parl.gc.ca/MembersOfParliament/ProfileMP.aspx?Key=229491&Language=E
4697801,ca.proc.d.2017-02-10.9365674,2017-02-10,f2313477-3104-468f-9384-a371bedc7d09,216633,"Mr. Robert Kitchen (Souris—Moose Mountain, CPC)",,Statements By Members,Ski Day,,"Mr. Speaker, next Wednesday, February 15, is not only Flag Day but also ski day on the Hill. 
 This wonderful event provides an opportunity for parliamentarians to come together and recognize the importance of physical activity for Canadians, while enjoying some cross country skiing and other winter activities. 
Ski day on the Hill is also a fun way to raise awareness about National Health and Fitness Day, which takes place this year on June 3. I encourage all communities across Canada to proclaim National Health and Fitness Day and join us in making Canada the fittest nation on earth.
 I would also like to thank Senator Nancy Greene Raine for her tireless work in putting this event together, and for her continued advocacy and promotion of physical health for Canadians.
As the critic for sport, I invite all Canadians to bundle up, head outside, and get active in whatever way works best for them. For those of us sitting long hours in these seats, I encourage members to get up off their behinds and join me in taking one activity off their ParticipACTION 150 Play List.",Conservative,Souris—Moose Mountain,Robert Gordon Kitchen,http://www.parl.gc.ca/MembersOfParliament/ProfileMP.aspx?Key=216633&Language=E
4697802,ca.proc.d.2017-02-10.9365678,2017-02-10,bc4bee2d-993a-4485-a436-4b45cb6553da,229524,"Ms. Yvonne Jones (Labrador, Lib.)",,Statements By Members,lnuit-Crown Partnership,,"Mr. Speaker, I was proud to be in Iqaluit yesterday with the Prime Minister, ministers of our government and Inuit leaders as we signed a declaration to create the lnuit-Crown partnership. This establishes a new chapter between Inuit and the Government of Canada. It includes the implementation of the Inuit land claims agreements, social development, and reconciliation between Inuit and the government. 
As the new lnuit-Crown relationship moves forward, immediate action will be taken to address painful memories of the past, including relocations and the treatment of Inuit during the tuberculosis epidemic of the 1940s and the 1960s, including the many relocations from their historic communities and villages.
It will address the dark decades of residential schools and work together with Inuit to advance the strategy on reducing suicide and building stronger communities together.
 The Inuit Nunangat declaration demonstrates the shared commitment of the renewed lnuit-Crown relationship between Inuit, Tapiriit and Kanatami and the Government of Canada, and it underscores the common goal of creating prosperity for all Inuit, which benefits all Canadians.
This is a proud and historic moment.",Liberal,Labrador,Yvonne Jones,http://www.parl.gc.ca/MembersOfParliament/ProfileMP.aspx?Key=229524&Language=E
4697803,ca.proc.d.2017-02-10.9365681,2017-02-10,eb417798-95f7-45a0-b1e9-ca3a6526d4db,217270,"Mr. Alistair MacGregor (Cowichan—Malahat—Langford, NDP)",,Statements By Members,Child Poverty,,"Mr. Speaker, in November last year, the BC Child and Youth Advocacy Coalition released its B.C. child poverty report, which shows the growing income inequality among B.C. families that have one in five of our children living in poverty, a statistic that has not changed in two decades.
 In my own riding of Cowichan—Malahat—Langford, the city of Duncan is highlighted as having the highest child poverty rate of 31% for an urban area in B.C. These are not alternative facts; they are a damning indictment of policy failures from successive Liberal and Conservative governments.
 In fact, it was just recently that the Liberals shamefully voted against the creation of a national poverty reduction strategy.
It is a sad state of affairs when a country as wealthy as Canada continues to display these kinds of statistics. My colleagues and I in the NDP will never rest so long as poverty and inequality continue to exist in Canada.",New Democratic Party,Cowichan—Malahat—Langford,Alistair MacGregor,http://www.parl.gc.ca/MembersOfParliament/ProfileMP.aspx?Key=217270&Language=E
4697804,ca.proc.d.2017-02-10.9365685,2017-02-10,775ebcdb-4561-4bd0-8c84-d14531f2c726,216812,"Mr. John Nater (Perth—Wellington, CPC)",,Statements By Members,All Senior Care Seniors Games,,"Mr. Speaker, I am pleased to rise today to mark the All Senior Care Seniors Games. This is a yearly event held in early February at ASC Living Centres across Canada. 
There are two such retirement homes in my riding of Perth—Wellington: Cedarcroft Place and McCarthy Place Retirement Residence.
 Today marks the closing ceremonies of this year's seniors games, and across Canada residents and community members will be gathering to mark and celebrate the successes of our senior citizens. 
Events include, walking the hallways, Wii bowling, billiards and bocce, Wii golf, shuffleboard and various card games. The ASC Senior Games are an opportunity for all residents to participate and socialize, no matter the activity level.
Healthy aging is important as our population ages, and the All Senior Care Senior Games help our senior citizens exercise their bodies and minds.
 I would like to thank all the organizers at the All Senior Care Seniors Games on a successful year, and congratulate those who participated.",Conservative,Perth—Wellington,John Nater,http://www.parl.gc.ca/MembersOfParliament/ProfileMP.aspx?Key=216812&Language=E
4697805,ca.proc.d.2017-02-10.9365688,2017-02-10,002b9ee7-5ecd-4727-96bb-ca4d1e06766d,216100,"Mr. Ali Ehsassi (Willowdale, Lib.)",,Statements By Members,Court Challenges Program,,"Mr. Speaker, it is an honour to rise today to congratulate the Ministers of Canadian Heritage and Justice for their inspired announcement this week to reinstate and modernize the landmark court challenges program. While this instrumental program was unceremoniously shuttered by the previous government, I am proud that our government has fulfilled another campaign promise, and restored this vital tool for equality and justice. 
From helping clarify Métis-Crown relations in the landmark Daniels ruling to playing a vital role in the long legal struggle for same-sex rights and marriage equality, the court challenges program is a uniquely Canadian program that has repeatedly ensured we, as a society, fulfill our loftiest ideals and aspirations.
 Our government is committed to helping Canadians better define their rights and freedoms enshrined in the charter. I am particularly proud of the fact that the modernized court challenges program will significantly reduce the systemic barriers to justice that many in our society, whether they be first nations, youth, immigrant communities, or the working class, too often face.",Liberal,Willowdale,Ali Ehsassi,http://www.parl.gc.ca/MembersOfParliament/ProfileMP.aspx?Key=216100&Language=E
