basepk,hid,speechdate,pid,opid,speakeroldname,speakerposition,maintopic,subtopic,subsubtopic,speechtext,speakerparty,speakerriding,speakername,speakerurl
4697866,ca.proc.d.2017-02-10.9365870,2017-02-10,e44116f8-75a8-4ca6-9ba5-fe968dbd42b0,229498,"Mr. Sean Casey (Parliamentary Secretary to the Minister of Canadian Heritage, Lib.)",,Oral Questions,Justice,,"Mr. Speaker, our government is committed to protecting human rights and official languages rights. In the context of the cross-country consultations on official languages, Canadians highlighted the importance of ensuring access to the legal system, which is why we reinstated the court challenges program, a program that has made a real difference in the lives of Canadians.
In order to get the program up and running right away, it was important to do it in the way that it has been done. The possibility of enshrining it into law is one that could be considered at a later date. However, in order to get these rights available to be supported, it has been necessary to do it in the way that it has been done.",Liberal,Charlottetown,Sean Casey,http://www.parl.gc.ca/MembersOfParliament/ProfileMP.aspx?Key=229498&Language=E
4697867,ca.proc.d.2017-02-10.9365873,2017-02-10,363e30d6-e47b-4c39-91ad-667deb63009c,219399,"Ms. Sheila Malcolmson (Nanaimo—Ladysmith, NDP)",,Oral Questions,Canadian Coast Guard,,"Mr. Speaker, the Liberals have been promising action on solving the abandoned vessel problem since they first took office. Coastal communities are tired of waiting. Boats are still sinking. We need a strong system to stop oil spills on our coast.
 It is time that this ship sails, and it is time that the Coast Guard receives the resources and the broader mandate it needs to do its job. When will the government float this boat and take action on solutions to protect B.C.'s coast?",New Democratic Party,Nanaimo—Ladysmith,Sheila Malcolmson,http://www.parl.gc.ca/MembersOfParliament/ProfileMP.aspx?Key=219399&Language=E
4697868,ca.proc.d.2017-02-10.9365875,2017-02-10,44647433-13cb-467e-8632-d49b131d5bb6,223727,"Hon. Dominic LeBlanc (Minister of Fisheries, Oceans and the Canadian Coast Guard, Lib.)",,Oral Questions,Canadian Coast Guard,,"Mr. Speaker, that almost sounds like a planted question. It gives me an opportunity to tell the member that this ship sailed, in fact in November.
 When our Prime Minister was in British Columbia, I was in St. John's, Newfoundland. We announced a historic investment in the Canadian Coast Guard in partnership with Transport Canada.
 Our oceans protection program is one of the most innovative and complete packages ever announced to protect marine ecosystems, to ensure that in the event of an oil spill all of the resources are on site and available to clean it up quickly and, more important, to prevent it. I know that member will want to celebrate this with us.",Liberal,Beauséjour,Dominic LeBlanc,http://www.parl.gc.ca/MembersOfParliament/ProfileMP.aspx?Key=223727&Language=E
4697869,ca.proc.d.2017-02-10.9365877,2017-02-10,24b3616f-1e8d-4fd3-9420-0a3d7ab8b6d3,216428,"Mr. Todd Doherty (Cariboo—Prince George, CPC)",,Oral Questions,Health,,"Mr. Speaker, since introducing my private member's bill, Bill C-211, I have heard from hundreds, if not thousands, of individuals who are in the fight of their lives. There is no standard diagnosis or care for PTSD that is consistent from the east coast to the west coast. Our first responders, our veterans, and our firefighters, who have sacrificed so much for our country, are not receiving the proper care and support needed to deal with PTSD.
Lives are at stake. My simple question is this. Can we count on the Prime Minister and his Liberal caucus to support Bill C-211 when it is voted on at second reading, yes or no?",Conservative,Cariboo—Prince George,Todd Doherty,http://www.parl.gc.ca/MembersOfParliament/ProfileMP.aspx?Key=216428&Language=E
4697870,ca.proc.d.2017-02-10.9365880,2017-02-10,897d99d9-377d-43a8-81be-27a22174136e,229484,"Mr. Jean Rioux (Parliamentary Secretary to the Minister of National Defence, Lib.)",,Oral Questions,Health,,"Mr. Speaker, indeed, taking care of our troops is very important. The Canadian Armed Forces are determined to improve treatment for soldiers suffering from PTSD. The CAF recently invested $2.65 million over four years in state-of-the-art brain imagery technology that will contribute to mental health research.
Military personnel are encouraged to seek help for their symptoms at any time. They are also subject to individual medical testing to screen for signs of PTSD, among others.",Liberal,Saint-Jean,Jean Rioux,http://www.parl.gc.ca/MembersOfParliament/ProfileMP.aspx?Key=229484&Language=E
4697871,ca.proc.d.2017-02-10.9365883,2017-02-10,9225dd6b-e672-44d5-8bb7-c634b7e72f2e,216900,"Hon. Michelle Rempel (Calgary Nose Hill, CPC)",,Oral Questions,"Immigration, Refugees and Citizenship",,"Mr. Speaker, why has the government ended the practice of prioritizing persecuted Iranian LGBT as refugees to Canada?",Conservative,Calgary Nose Hill,Michelle Rempel,http://www.parl.gc.ca/MembersOfParliament/ProfileMP.aspx?Key=216900&Language=E
4697872,ca.proc.d.2017-02-10.9365885,2017-02-10,e321e85f-f1c1-4482-bf16-f640eb41e9f9,229219,"Hon. Ahmed Hussen (Minister of Immigration, Refugees and Citizenship, Lib.)",,Oral Questions,"Immigration, Refugees and Citizenship",,"Mr. Speaker, this year we welcomed 40,000 refugees. That includes 25,000 resettled refugees, which is double what the previous government brought.
 We take seriously our refugee commitment to ensure that it is compassionate and focused on the most vulnerable people. We work very closely with the UN refugee agency and private sponsors to continue to identify the most vulnerable, and that obviously includes members of the LGBTQ2 community.",Liberal,York South—Weston,Ahmed Hussen,http://www.parl.gc.ca/MembersOfParliament/ProfileMP.aspx?Key=229219&Language=E
4697873,ca.proc.d.2017-02-10.9365887,2017-02-10,9225dd6b-e672-44d5-8bb7-c634b7e72f2e,216900,"Hon. Michelle Rempel (Calgary Nose Hill, CPC)",,Oral Questions,"Immigration, Refugees and Citizenship",,"Mr. Speaker, LGBT in Iran are beaten, tortured, and executed, all while being sanctioned under the law, simply for who they are and for whom they love. To me, that is the definition of the most vulnerable.
 The minister did not answer the question. The minister used the talking point of 25,000 Syrian refugees. I am talking about the practice of allowing and prioritizing Iranian LGBT refugees coming to Canada. Why are the Liberals turning their backs on the most vulnerable, and no talking points, please?",Conservative,Calgary Nose Hill,Michelle Rempel,http://www.parl.gc.ca/MembersOfParliament/ProfileMP.aspx?Key=216900&Language=E
4697874,ca.proc.d.2017-02-10.9365891,2017-02-10,e321e85f-f1c1-4482-bf16-f640eb41e9f9,229219,"Hon. Ahmed Hussen (Minister of Immigration, Refugees and Citizenship, Lib.)",,Oral Questions,"Immigration, Refugees and Citizenship",,"Mr. Speaker, we will take no lessons from the previous government when it comes to identifying, welcoming and being compassionate to those most vulnerable, as well as refugees in need of resettlement. We work very closely with the UN refugee agency to ensure that we continue to identify those in the most need for resettlement, which obviously includes members of the LGBTQ2 community.",Liberal,York South—Weston,Ahmed Hussen,http://www.parl.gc.ca/MembersOfParliament/ProfileMP.aspx?Key=229219&Language=E
4697875,ca.proc.d.2017-02-10.9365893,2017-02-10,3a81a21a-bec2-40b4-aae5-d554237ba474,219862,"Ms. Anita Vandenbeld (Ottawa West—Nepean, Lib.)",,Oral Questions,International Development,,"Mr. Speaker, the Federation of Canadian Municipalities recently announced a support project for towns in Jordan exposed to migratory pressures in the wake of the Syrian conflict.
Can the minister tell the House how the government is helping these towns cope with what has become one of the largest migratory crises ever witnessed?",Liberal,Ottawa West—Nepean,Anita Vandenbeld,http://www.parl.gc.ca/MembersOfParliament/ProfileMP.aspx?Key=219862&Language=E
4697876,ca.proc.d.2017-02-10.9365897,2017-02-10,6e685d19-e124-452d-b395-5deedc595b4c,213943,"Hon. Marie-Claude Bibeau (Minister of International Development and La Francophonie, Lib.)",,Oral Questions,International Development,,"Mr. Speaker, we believe in the importance of developing local capacity, including developing the capacity of nearby governments. Our government is supporting the towns in developing countries that are welcoming tens of thousands of refugees in order to help them maintain stability in their region.
The Federation of Canadian Municipalities project in Jordan will help a dozen municipalities manage their public services including by advancing and involving women in leadership. ",Liberal,Compton—Stanstead,Marie-Claude Bibeau,http://www.parl.gc.ca/MembersOfParliament/ProfileMP.aspx?Key=213943&Language=E
4697877,ca.proc.d.2017-02-10.9365900,2017-02-10,AD6E8838-A6D5-4D6D-94F7-25180A163C59,227983,"Mr. Glen Motz (Medicine Hat—Cardston—Warner, CPC)",,Oral Questions,Justice,,"Mr. Speaker, the Conservatives support tougher sentences and penalties for human trafficking.
 Through Bill C-38, the Liberals are shamelessly attempting to remove consecutive sentencing for human trafficking offenders. They are delaying taking action to combat this serious issue. We know the Liberals' track record of putting offenders ahead of the rights of victims. The minister claims to be compassionate for vulnerable people.
When will the minister take concrete action to empower survivors of human trafficking and protect victims?",Conservative,Medicine Hat—Cardston—Warner,Glen Motz,http://www.parl.gc.ca/MembersOfParliament/ProfileMP.aspx?Key=227983&Language=E
4697878,ca.proc.d.2017-02-10.9365903,2017-02-10,0e1edc18-5616-4f5c-b9bd-535059ec8040,219856,"Mr. Bill Blair (Parliamentary Secretary to the Minister of Justice and Attorney General of Canada, Lib.)",,Oral Questions,Justice,,"Mr. Speaker, our government is very committed to ensuring that we do the right thing to protect victims and to combat human trafficking, the victims of which are among society's most vulnerable.
The bill introduced by the Minister of Justice yesterday would give law enforcement and prosecutors new tools to investigate and prosecute certain human trafficking offences that could be particularly difficult to prove. It would also strengthen Canada's criminal law and respond to trafficking of persons in a manner that would be consistent with the charter.
Bill C-38 would bring into force private member's Bill C-452, with amendments, to better protect victims, while at the same time ensuring consistency with the Charter of Rights and Freedoms.",Liberal,Scarborough Southwest,Bill Blair,http://www.parl.gc.ca/MembersOfParliament/ProfileMP.aspx?Key=219856&Language=E
4697879,ca.proc.d.2017-02-10.9365907,2017-02-10,8bd1a4d2-ee35-4f33-b21f-79e81c6d3b76,219101,"Mr. William Amos (Pontiac, Lib.)",,Oral Questions,Arts and Culture,,"Mr. Speaker, after Juno Award nominees were announced this week, fans of Canadian music are gearing up for an awesome party in Ottawa on April 2.
However, let us not forget that, once again, Canadian artists are also well-represented among the nominees for the 59th annual Grammy Awards taking place this Sunday in Los Angeles. Indeed, Canadian artists have started from the bottom and now they are here, across the world, from Montreal to Hong Kong, from Bangkok to Babylon. From hip-hop to Indie rock, folk, jazz, and country, to pop chart toppers, Canada is known for the diversity of its homegrown talent.
Could the government provide the members of the House with an update on the state of Canadian recording artists on the international scene?",Liberal,Pontiac,William Amos,http://www.parl.gc.ca/MembersOfParliament/ProfileMP.aspx?Key=219101&Language=E
4697880,ca.proc.d.2017-02-10.9365913,2017-02-10,e44116f8-75a8-4ca6-9ba5-fe968dbd42b0,229498,"Mr. Sean Casey (Parliamentary Secretary to the Minister of Canadian Heritage, Lib.)",,Oral Questions,Arts and Culture,,"Mr. Speaker, I would like to thank the music lover from Pontiac for that question.
Canada has a reputation for itself when it comes to music. Members might ask “What Do You Mean?” Well, Drake, Justin Bieber, and The Weeknd are in the top 10 global recording artists of 2016. The world is saying, “Canada, baby, I like your style”.
When it comes to our music roster, we have a “really big team”, and we should go “tell your friends” about it. Our government is proud to “take care” of our recording artists. We have no reason to be “Sorry” for our dominance of the music charts, and look forward to more success in 2017.",Liberal,Charlottetown,Sean Casey,http://www.parl.gc.ca/MembersOfParliament/ProfileMP.aspx?Key=229498&Language=E
4697881,ca.proc.d.2017-02-10.9365915,2017-02-10,f8ea336f-74b1-413f-a222-1943aef1b58d,217352,"Mr. David Yurdiga (Fort McMurray—Cold Lake, CPC)",,Oral Questions,Sealing Industry,,"Mr. Speaker, the selling of sealskins has been an important economic driver for remote Inuit communities for hundreds of years.
Through media campaigns and false information, activists have destroyed the international market for sealskins, dealing a crippling blow to those communities, which already face the highest rates for poverty and unemployment in the country.
The European Union's 2008 ban on sealskin products was extremely damaging. When the Prime Minister addresses the European Parliament next week, will he demand that it drop the ban and stand up for Inuit communities?",Conservative,Fort McMurray—Cold Lake,David Yurdiga,http://www.parl.gc.ca/MembersOfParliament/ProfileMP.aspx?Key=217352&Language=E
4697882,ca.proc.d.2017-02-10.9365919,2017-02-10,44647433-13cb-467e-8632-d49b131d5bb6,223727,"Hon. Dominic LeBlanc (Minister of Fisheries, Oceans and the Canadian Coast Guard, Lib.)",,Oral Questions,Sealing Industry,,"Mr. Speaker, we, too, share his support for the Canadian sealing industry, for the Inuit communities, for fishers from all parts of the country who have in fact benefited from a sustainable and appropriate harvest of seals.
We think Canadian seal products are among the best in the world. It is a humane hunt that is conducted in many parts of the country, and has been for decades. We will always tell the world about the importance of a sustainable seal hunt. I thank the member for an opportunity to remind the House of our support for the seal hunt.",Liberal,Beauséjour,Dominic LeBlanc,http://www.parl.gc.ca/MembersOfParliament/ProfileMP.aspx?Key=223727&Language=E
4697883,ca.proc.d.2017-02-10.9365921,2017-02-10,e39c6a4d-cac9-4e3e-b8d5-528f15a76519,214282,"Mr. Mario Beaulieu (La Pointe-de-l'Île, BQ)",,Oral Questions,Public Safety,,"Mr. Speaker, Yassine Aber was supposed to go to Boston yesterday with the Université de Sherbrooke's Vert et Or team for a track meet. American border guards interrogated him for six hours about his religion and his parents' Moroccan origins, then turned him back.
When the Prime Minister meets with Donald Trump on Monday, what will he do to make sure that no Quebecker is treated as a second-class citizen just because his name is Yassine?",Bloc Québécois,La Pointe-de-l'Île,Mario Beaulieu,http://www.parl.gc.ca/MembersOfParliament/ProfileMP.aspx?Key=214282&Language=E
4697884,ca.proc.d.2017-02-10.9365925,2017-02-10,0fd242c0-71bc-4c1b-a4e4-609a396eca76,229494,"Mr. Mark Holland (Parliamentary Secretary to the Minister of Public Safety and Emergency Preparedness, Lib.)",,Oral Questions,Public Safety,,"Mr. Speaker, I share the concern of the member opposite. Let me assure him that we will work to ensure that all Canadians receive fair and proper treatment.
 I would encourage members of the House, if there is an incident that they become aware of that causes them concern, to bring it to our attention. Obviously, a number of these issues are emerging. We will take a look at the situation. We will be happy to get back to the member. Again, I appreciate him bringing it to our attention.",Liberal,Ajax,Mark Holland,http://www.parl.gc.ca/MembersOfParliament/ProfileMP.aspx?Key=229494&Language=E
4697885,ca.proc.d.2017-02-10.9365927,2017-02-10,f45e86b7-f192-4692-9889-6b57283fc3b0,224178,"Mr. Gabriel Ste-Marie (Joliette, BQ)",,Oral Questions,International Trade,,"Mr. Speaker, let me tell you what the Prime Minister will do about it: not a thing.
This morning, against the backdrop of the Prime Minister's upcoming visit to Washington, Agropur expressed concern that our dairy producers could be used as a bargaining chip in trade negotiations with Donald Trump. The co-operative has every reason to be concerned.
The government has been in power for over a year, but it has not settled any of these issues with the United States. Its strategy for defending our interests boils down to this: do nothing. Do nothing about diafiltered milk. Do nothing about softwood lumber.
Can the government confirm that it will keep doing what it has been doing since the start to protect us, in other words, nothing?",Bloc Québécois,Joliette,Gabriel Ste-Marie,http://www.parl.gc.ca/MembersOfParliament/ProfileMP.aspx?Key=224178&Language=E
4697886,ca.proc.d.2017-02-10.9365931,2017-02-10,eed67a03-db05-4376-89b3-8e038fa83728,229507,"Hon. Andrew Leslie (Parliamentary Secretary to the Minister of Foreign Affairs (Canada-U.S. Relations), Lib.)",,Oral Questions,International Trade,,"Mr. Speaker, rest assured that our government will continue to stand up for Quebec farmers and producers and their families.
Our government will always protect the interests of Canadians and Quebeckers, their jobs, and our products. We will staunchly defend our national economic interests, and we will continue to promote Canadian values.",Liberal,Orléans,Andrew Leslie,http://www.parl.gc.ca/MembersOfParliament/ProfileMP.aspx?Key=229507&Language=E
4697887,ca.proc.d.2017-02-10.9365934,2017-02-10,9e05a099-6a0b-4fe2-9e9b-0a8b91b7807b,214054,"Ms. Monique Pauzé (Repentigny, BQ)",,Oral Questions,Foreign Affairs,,"Mr. Speaker, as we speak, an anti-democracy trial is being held in Spain. 
Artur Mas, the former Catalan prime minister, could face a 10-year ban on holding public office for holding a referendum on independence, and the speaker of Catalan's parliament, Carme Forcadell, faces charges for allowing the parliament to vote on this issue. They are guilty of allowing debate. 
Will the federal government remind the Spanish government that all peoples, including the Catalan people, have the right to self-determination and that it considers this political trial against Catalan separatists to be unacceptable?",Bloc Québécois,Repentigny,Monique Pauzé,http://www.parl.gc.ca/MembersOfParliament/ProfileMP.aspx?Key=214054&Language=E
4697888,ca.proc.d.2017-02-10.9365937,2017-02-10,22a6ff7d-fc39-47b2-8003-a016329ed224,229490,"Mr. Matt DeCourcey (Parliamentary Secretary to the Minister of Foreign Affairs, Lib.)",,Oral Questions,Foreign Affairs,,"Mr. Speaker, I thank the hon. member for her question.
As in any situation, our officials are in contact with their counterparts around the world. This government remains firm in its position that we must promote human rights around the world and we make that known in every one of our conversations with our international counterparts.",Liberal,Fredericton,Matt DeCourcey,http://www.parl.gc.ca/MembersOfParliament/ProfileMP.aspx?Key=229490&Language=E
4697889,ca.proc.d.2017-02-10.9365939,2017-02-10,3c3175ff-595b-4f50-a58d-b41cd7b5b100,214600,"Hon. Hunter Tootoo (Nunavut, Ind.)",,Oral Questions,The Environment,,"Mr. Speaker, my question is for the Minister of Environment and Climate Change. The climate change accord was signed this past December by Nunavut's premier, Peter Taptuna. As a territory, Nunavut relies heavily on carbon fuel for air transportation and is 100% reliant on diesel energy. In addition, it is no secret that Nunavut has the highest cost of living, unemployment, and poverty in the country.
 In recognition of Nunavut's unique circumstances, will the minister ensure that carbon pricing will not increase the cost of living for Nunavummiut and work with the territory to ensure cost neutrality?",Independent,Nunavut,Hunter Tootoo,http://www.parl.gc.ca/MembersOfParliament/ProfileMP.aspx?Key=214600&Language=E
4697890,ca.proc.d.2017-02-10.9365942,2017-02-10,cee27afa-cdf8-4e99-ab22-22290f86aa3a,214082,"Hon. Catherine McKenna (Minister of Environment and Climate Change, Lib.)",,Oral Questions,The Environment,,"Mr. Speaker, I would like to thank the member from Nunavut for his question and for his advocacy on behalf of Nunavummiut. 
The Prime Minister was in Iqaluit this week. Our government is very committed to working with the Government of Nunavut to ensure we tackle climate change. In no place have we seen greater impacts of climate change than in the north, where hunters are falling through the ice because they can no longer tell the thickness. 
We need to be doing more. We are committed to working with the government in pricing pollution to ensure that all revenues are returned to the Government of Nunavut, and that we design a solution that works for the people of the north. ",Liberal,Ottawa Centre,Catherine McKenna,http://www.parl.gc.ca/MembersOfParliament/ProfileMP.aspx?Key=214082&Language=E
4697891,ca.proc.d.2017-02-10.9365943,2017-02-10,02c2cb20-f27d-46a5-8e78-ab4b405bf07b,214864,The Deputy Speaker,,Oral Questions,The Environment,,"Before we conclude question period for today, I would just like to remind all hon. members of the conventions we use in the House pertaining to directing members' questions, comments, and or remarks to the Chair.
 This is a long-established convention that we use in the House and it avoids hon. members getting to the point of expressing their comments in the second person; that is to say using the word “you” and directing comments directly across the aisle. This helps to keep the comportment of the chamber on track. Let us say that there is enough controversy at times that we do not need to use those extra measures to provoke disorder in the House. ",Conservative,Simcoe North,Bruce Stanton,http://www.parl.gc.ca/MembersOfParliament/ProfileMP.aspx?Key=214864&Language=E
4697892,ca.proc.d.2017-02-10.9365944,2017-02-10,AD6E8838-A6D5-4D6D-94F7-25180A163C59,227983,"Mr. Glen Motz (Medicine Hat—Cardston—Warner, CPC)",,Oral Questions,Points of Order,Question Period,"Mr. Speaker, I rise on a point of order. I would like to offer the House an apology. During my question to the Minister of Justice, my iPad was in front of me, which has an “I support the oil sands” sticker. It was not meant as a prop, and I apologize to the House.",Conservative,Medicine Hat—Cardston—Warner,Glen Motz,http://www.parl.gc.ca/MembersOfParliament/ProfileMP.aspx?Key=227983&Language=E
4697893,ca.proc.d.2017-02-10.9365947,2017-02-10,02c2cb20-f27d-46a5-8e78-ab4b405bf07b,214864,The Deputy Speaker,,Oral Questions,Points of Order,Question Period,"I thank the hon. member for his notice to the House in that regard. For the benefit of all other members, props are prohibited in the House for that purpose.",Conservative,Simcoe North,Bruce Stanton,http://www.parl.gc.ca/MembersOfParliament/ProfileMP.aspx?Key=214864&Language=E
4697894,ca.proc.d.2017-02-10.9365954,2017-02-10,72e2a81c-f40c-4c0f-8be0-09a9e61254c3,219070,"Hon. Robert Nault (Kenora, Lib.)",,Routine Proceedings,Interparliamentary Delegations,,"Mr. Speaker, pursuant to Standing Order 34(1), I have the honour to present to the House, in both official languages, a report to the Canadian section of the ParlAmericas respecting its participation at the 41st board of directors meeting at the 13th plenary assembly of the ParlAmericas held in Mexico City, Mexico, from December 5 to 7, 2016. ",Liberal,Kenora,Bob Nault,http://www.parl.gc.ca/MembersOfParliament/ProfileMP.aspx?Key=219070&Language=E
4697895,ca.proc.d.2017-02-10.9365956,2017-02-10,6025d38f-3695-4037-8221-3f4cb652936b,218940,"Mr. Bill Casey (Cumberland—Colchester, Lib.)",,Routine Proceedings,Committees of the House,Health,"Mr. Speaker, it is my honour and pleasure to present, in both official languages, the seventh report of the Standing Committee on Health in relation to Bill C-37, an act to amend the Controlled Drugs and Substances Act and to make related amendments to other acts. The committee has studied the bill and has decided to report the bill back to the House with amendments.
At this time, I want to thank all members of the health committee who worked diligently to get this through in an appropriate time. Although there were some philosophical differences, everyone appreciated the sense of urgency and helped to get the bill through. I want to thank all members from all parties for their co-operation on this bill. We think that this bill will save lives.",Liberal,Cumberland—Colchester,Bill Casey,http://www.parl.gc.ca/MembersOfParliament/ProfileMP.aspx?Key=218940&Language=E
