basepk,hid,speechdate,pid,opid,speakeroldname,speakerposition,maintopic,subtopic,subsubtopic,speechtext,speakerparty,speakerriding,speakername,speakerurl
4697929,ca.proc.d.2017-02-10.p4743001,2017-02-10,02c2cb20-f27d-46a5-8e78-ab4b405bf07b,214864,The Deputy Speaker,,Government Orders,Canada-Ukraine Free Trade Agreement Implementation Act,, All those opposed will please say nay.,Conservative,Simcoe North,Bruce Stanton,http://www.parl.gc.ca/MembersOfParliament/ProfileMP.aspx?Key=214864&Language=E
4697930,ca.proc.d.2017-02-10.p4743002,2017-02-10,,,,intervention,Government Orders,Canada-Ukraine Free Trade Agreement Implementation Act,, Nay.,,,Some hon. members,
4697931,ca.proc.d.2017-02-10.p4743003,2017-02-10,02c2cb20-f27d-46a5-8e78-ab4b405bf07b,214864,The Deputy Speaker,,Government Orders,Canada-Ukraine Free Trade Agreement Implementation Act,," In my opinion the yeas have it.
 And five or more members having risen: 
 Pursuant to Standing Order 45, the recorded division stands deferred until Monday, February 13, at the ordinary hour of daily adjournment. ",Conservative,Simcoe North,Bruce Stanton,http://www.parl.gc.ca/MembersOfParliament/ProfileMP.aspx?Key=214864&Language=E
4697932,ca.proc.d.2017-02-10.9366103,2017-02-10,b0010e40-d2c6-4a8e-a518-447721affc15,215946,Ms. Filomena Tassi,,Government Orders,Canada-Ukraine Free Trade Agreement Implementation Act,,"Mr. Speaker, there have been discussions among the whips and pursuant to Standing Order 45 (7) I ask that the recorded division on the third reading of Bill C-31, an act to implement the Free Trade Agreement between Canada and Ukraine currently scheduled for Monday, February 13 be deferred to Tuesday, February 14, at the expiry of the time provided for oral questions.",Liberal,Hamilton West—Ancaster—Dundas,Filomena Tassi,http://www.parl.gc.ca/MembersOfParliament/ProfileMP.aspx?Key=215946&Language=E
4697933,ca.proc.d.2017-02-10.9366104,2017-02-10,02c2cb20-f27d-46a5-8e78-ab4b405bf07b,214864,The Deputy Speaker,,Government Orders,Canada-Ukraine Free Trade Agreement Implementation Act,,Accordingly the recorded division is further deferred to Tuesday at the conclusion of oral questions.,Conservative,Simcoe North,Bruce Stanton,http://www.parl.gc.ca/MembersOfParliament/ProfileMP.aspx?Key=214864&Language=E
4697934,ca.proc.d.2017-02-10.9366105,2017-02-10,b0010e40-d2c6-4a8e-a518-447721affc15,215946,Ms. Filomena Tassi,,Government Orders,Canada-Ukraine Free Trade Agreement Implementation Act,,"Mr. Speaker, if you seek it, I believe you will find the consent of the House to see the clock as 1:30 p.m., so we may commence with private members' hour.",Liberal,Hamilton West—Ancaster—Dundas,Filomena Tassi,http://www.parl.gc.ca/MembersOfParliament/ProfileMP.aspx?Key=215946&Language=E
4697935,ca.proc.d.2017-02-10.9366106,2017-02-10,02c2cb20-f27d-46a5-8e78-ab4b405bf07b,214864,The Deputy Speaker,,Government Orders,Canada-Ukraine Free Trade Agreement Implementation Act,,Is it agreed? ,Conservative,Simcoe North,Bruce Stanton,http://www.parl.gc.ca/MembersOfParliament/ProfileMP.aspx?Key=214864&Language=E
4697936,ca.proc.d.2017-02-10.p4743010,2017-02-10,,,,intervention,Government Orders,Canada-Ukraine Free Trade Agreement Implementation Act,, Agreed. ,,,Some hon. members,
4697937,ca.proc.d.2017-02-10.9366123,2017-02-10,02c2cb20-f27d-46a5-8e78-ab4b405bf07b,214864,The Deputy Speaker,,Government Orders,Canada-Ukraine Free Trade Agreement Implementation Act,,The House will now proceed to the consideration of private members' business as listed on today's order paper.,Conservative,Simcoe North,Bruce Stanton,http://www.parl.gc.ca/MembersOfParliament/ProfileMP.aspx?Key=214864&Language=E
4697938,ca.proc.d.2017-02-10.9366111,2017-02-10,aa58e8f5-4a46-4c79-8e97-b9ebe28c9d9a,218472,"Hon. Peter Van Loan (York—Simcoe, CPC)",,Private Members' Business,Income Tax Act,," moved that Bill C-323, An Act to amend the Income Tax Act (rehabilitation of historic property), be read the second time and referred to a committee. 
Mr. Speaker, as one walks the streets of London, the quartiers of Paris, the piazzas of Rome, one stands in awe. The buildings speak to us, of great artists and philosophers who lived within, of revolutions staged there that changed the world, of the growth and advance of societies and cultures that those buildings mark.
We look at that built heritage in those great cities, not just for its own intrinsic beauty but because those buildings tell stories, of people, of history, of that place, and of who we are. We may be living in the here and now, but the built heritage informs us of the many twists and turns of humanity that brought us here.
Built heritage matters. It is important. It tells us who we are and why. It is no surprise then that the great places of the world are defined by their built heritage, and that is what people come to see. It informs and it inspires.
It is the same in Canada. We are debating this bill seeking to protect Canada's built heritage while we are inside Canada's most iconic building. We more than most can appreciate the meaning that the very special sense of this place gives to the tremendous honour we have in serving in the House of Commons.
Our built heritage here, all around us, reminds us of our past, our founding Fathers of Confederation, the Inuit and aboriginal peoples who first made this home, the trappers, the railway, the industries, the farmers and labourers who built the economy. All of those are literally carved into this building. The stone and the wood too speak to our lands and our forests. We have all around us a tangible example of why preserving our built heritage matters.
Bill C-323 seeks to preserve and protect our country's important historic built form by encouraging its restoration. The bill would do this through two simple devices. The first element is a 20% tax credit for spending on the restoration of historic buildings. The second element is an accelerated three year capital cost writeoff for the rest of the restoration cost.
The policy rationale behind the bill is simple. There is strong public interest in encouraging the preservation and restoration of significant historic buildings. However, the cost to individual owners is much higher than the alternative of demolition and new construction. When we ask private owners to preserve historic buildings through a heritage designation, we are asking them to deliver an important public benefit, but we are asking those private citizens to bear the full high cost of delivering this, something from which we all benefit. Through the tax credit and the accelerated writeoff, we are proposing to provide a modest measure to offset some of the privately borne costs of restoring important buildings in our communities.
Too often the economic burden creates an incentive to demolish. We just witnessed that with last month's demolition of the 110-year-old Beaux Arts Bank of Montreal building at Yonge and Roselawn in Toronto. Although plans had been designed to incorporate restoration of the heritage building into a new development, at the end of the day, the owners chose to demolish instead, resulting in much unhappiness in the surrounding community.
This bill would help to change those calculations and give property owners a reason to do what is right not just for their interests, but in the community's interest.
This is not a partisan initiative. It crosses party lines. I want to thank the Liberal members for Cloverdale—Langley City and from Kingston and the Islands for their help with this proposal. 
The bill is based upon a policy initiative that was under development under both Conservative and Liberal governments. It relies upon work done within Parks Canada in anticipation of such a tax credit proposal, including the development of the national register of historic places.
I appeal to all members of the House to consider the bill in that non-partisan spirit as a genuine effort we can all support to make our communities better places to live.
It is important to observe that the reach of this tax credit is managed. Not every old building in Canada will be eligible. Only buildings on the national register of historic sites will qualify. These are generally the most important of the buildings that receive heritage designation under provincial or territorial law. 
The bill would also give the minister the power to extend the credit to all heritage designated properties in a province or territory, but that is a decision that will belong to the minister. This protection would ensure that the cost to the public purse of the credit would remain manageable and it would prevent any abuse aimed at taking inappropriate advantage of the new tax credit.
The bill would also ensure that the taxpayers' exposure is controlled in another way. Only costs directly related to restoration of the heritage features would be eligible. A professional licensed architect would have to certify both those costs and that the work is done in accordance with the “Standards and Guidelines for the Conservation of Historic Places in Canada”, a document prepared by Parks Canada in anticipation of exactly an initiative like this bill. The structure of how the credit works would also eliminate the need to create any new bureaucracy to manage the program, further minimizing any costs to the public purse.
 In fact, the annual impact on federal finances of this program applied to historic properties all across Canada will still be but a tiny fraction of the $3-billion cost of the restoration of the Parliament buildings currently under way.
The support for the bill is strong. The National Trust for Canada, a national non-profit organization committed to working to save historic places in Canada, has urged support for the bill. 
 In the 30 years between 1970 and 2000, Canada lost more than 20 per cent of its historic building stock, and losses continue apace.... [Bill C-323] would transform the economic fundamentals for renewing historic places, with spin-off effects including the creation of more skilled jobs and less environmental impact and waste than new construction. 
The Royal Architectural Institute of Canada supports the bill, and notes that:
 Policies that promote preservation and re-use of historic properties have demonstrated huge economic returns on investment through job retention and creation, tourism, and enhanced property values. 
Heritage Winnipeg notes the similarity of the bill to the heritage restoration tax credit south of the border, which they call a great U.S. success story with a 40-year track record. Bill C-323 “presents an historic opportunity”, they note. 
Montreal Mosaic, a partnership of non-profit community organizations, calls for support of the bill based on its economic, environmental and historic benefits.
Heritage B.C. says this is something the heritage community has wanted for a long time:
 It's consistent with our goals to preserve cultural heritage. It seeks to do that by creating an incentive to rehabilitate heritage buildings rather than to replace them. 
Right here in this city, Heritage Ottawa says it strongly supports Bill C-323.
All across the country, municipal councils, the folks who are on the front lines, are balancing private property rights against the public interest in preserving built heritage, and they have to struggle with those very difficult decisions. One after another, those municipal councils are passing resolutions endorsing the bill.
When we think of the places we love to visit around the world, built heritage figures prominently. From the French Quarter in New Orleans to the Great Wall of China, from the Taj Mahal in India to the castles of Prague. The same is true in Canada. From the Grande Allée in Quebec City to Stephen Avenue in Calgary, from Peake's Wharf in Charlottetown to the distillery district in Toronto, we are drawn to these beautiful, story-filled places, and it is their historic buildings that define them. They become the places people go to visit, to learn, to shop, and to dine. 
This demonstrates that we value and enjoy the historic buildings and the environment they create. It is where we want to be, and of course, the bill has the potential to aid the restoration of our historic buildings, not just in our big cities. It can lead to the rescue and restoration of important elements of Canada's built heritage in all parts of our country, in rural hamlets and small towns, and occasionally even places in our wilderness. Our history can come to life everywhere.
In Canada, however, we have been the victim of twin arguments that lead people to undervalue our history and our built heritage. First is the traditional student's lament, that Canadian history is boring. In fact, nothing could be farther from the truth. Certainly, our body count falls far short of that of the old world, and we lack the marketing hype of the history of our American neighbours, but Canada's stories are more intriguing than most, drawing in strands from the European and the U.S. experience as input into the history we have made in building this unique and wonderful country, more near to perfect than any other, I would argue.
Indeed, most of those who have grown to know and love our country's history have travelled that path guided by heritage buildings that were the gateways to the stories of the past. 
Think of them: the tower on Signal Hill looking out over the Atlantic Ocean, the place where so many explorers came as they opened up this continent; Province House in Charlottetown, Prince Edward Island, the cradle of our Confederation. We think of the Citadelle in Quebec and the old walls of Quebec City that stood witness to the battle on the Plains of Abraham, which changed our destiny here in the North American continent; and, of course, in Halifax Pier 21, which welcomed so many who came to build this country. There is the Old Port of Montreal, which spoke to the burgeoning growth of a Canadian economy. There is Fort George in Niagara-on-the-Lake that bore witness to the battles of the War of 1812, which determined our destiny as a separate people here on the North American continent, different from our neighbours to the south.
One can go to the railway station in Winnipeg, and others across the country, to learn and understand the tremendous role that railways played in the binding together and the building of this country, and the growth of our economies, both rural and urban. When one goes to the Palliser Hotel in Calgary, one sees the dynamism of that city and the promise it held for the future; and, of course, the old Hotel Vancouver, and so many other buildings there, speaks to the tremendous other side of Canada's history.
Again, built form is the core of it all. Indeed, built form tells us who we are and where we came from, and that is what inspires those who love history.
The other argument is that we are a young country and thus lack history and any built heritage worthy of preservation. Never mind the list I gave, that certainly is not true. With four centuries of history comes 400 years of built heritage, and we have had none of it wiped out in the carpet bombing of a world war, as has happened in other places. 
Canada is filled with built heritage treasures, but we keep losing them. For example, Toronto has seen other losses recently, including the demolition of the iconic Stollerys building frontage at Yonge and Bloor; incidentally, once the men's wear business owned by a former member of this House for a Spadina riding. The beautiful Empress Hotel at the corner of Yonge and Gould was also recently lost.
The great architect and author, Eric Arthur, in his 1964 book, Toronto, No Mean City, lamented, “In the march of progress, we have ruthlessly destroyed almost all our older architecture..”. His books documented beautiful treasures of buildings that were lost to the wrecker's ball. One can only wistfully dream of what character that city would exude had some of those jewels survived. As he said, “surely no city in the world with a background of three hundred years does so little to make that background known”.
While the generations that preceded us have allowed much of our story to be lost, with this bill we have the opportunity to bestow a gift to future generations. That is the gift of seeing, knowing, and understanding where they came from, the roots of their communities as reflected in a preserved and restored built heritage.
As we celebrate the 150th anniversary of Confederation, Bill C-323 presents us with an opportunity to make Canada's history, in the form of its built heritage, an enduring legacy to benefit Canadians for years to come. It is a fitting year to adopt this policy, which is perhaps long overdue, but which would deliver lasting benefits for generations to come. The 150th anniversary of Confederation is indeed an opportunity for us to focus, both on that past, but on how we can tie that past to the future for the generations to come, how we can make that meaning of all that Canada is meaningful forever. Preserving our built heritage is a big part of that.
I have several other private member's bills. I selected to proceed with this one. I have two others that dealt specifically with Canada's built heritage, other important historical buildings that are at some risk. One is the birthplace of John Diefenbaker, a place in Neustadt, Ontario, which I thought would be most appropriate to have purchased and acquired and run as a museum for the benefit of all Canadians. Indeed, former Prime Minister Harper made that commitment under the previous government. Sadly, that appears not to be happening. That building is at risk and may forever be lost.
Another that I believe should be a museum is the summer home of John A. Macdonald in Rivière-du-Loup, a place that hosted cabinet meetings. People talk about the “winter White House” in Mar-a-Lago right now. The home in Rivière-du-Loup was the “summer 24 Sussex” before there even was a 24 Sussex. That is where the government operated for some time during the summers.
Fortunately, that has been saved by a group of benevolent citizens through something called Canadian Heritage of Quebec. By contract, it runs it as a bed and breakfast, but its existence is precarious. It is not only something that could benefit from a tax credit such as this but something that is worthy of even greater support.
I chose to proceed with this bill, because it has the potential to benefit properties all across Canada. To help protect that built heritage for our future generations, to help us know ourselves and our history much better, I urge all members of the House to support it.",Conservative,York—Simcoe,Peter Van Loan,http://www.parl.gc.ca/MembersOfParliament/ProfileMP.aspx?Key=218472&Language=E
4697939,ca.proc.d.2017-02-10.9366125,2017-02-10,101111c4-d4b7-46a9-9f88-9bfa542bb606,229700,"Mr. David de Burgh Graham (Laurentides—Labelle, Lib.)",,Private Members' Business,Income Tax Act,,"Mr. Speaker, I am definitely sympathetic to this bill. I have received a lot of calls from areas in my riding about it. My riding is built on a huge amount of heritage. We have several historic railway stations. The line was built in the 1890s, and we spent all of 2016 celebrating the founder of our region, Antoine Labelle.
When I was growing up, my father spent a lot of time with a bunch of people creating heritage committees and saving the stations. In 2008, on election night, the train station in my hometown burned to the ground. I think it is really important that we do preserve our heritage.
I have a couple of quick questions for my colleague. There is no upper cost limit in this bill. I am curious to know if my colleague thinks there should or should not be one.
I know that the United States has a tax credit for heritage buildings. What does my colleague know about the return on investment for that cost for the government?
Also, and I do not mean this in a partisan way, why did this not happen in the last 10 years?",Liberal,Laurentides—Labelle,David Graham,http://www.parl.gc.ca/MembersOfParliament/ProfileMP.aspx?Key=229700&Language=E
4697940,ca.proc.d.2017-02-10.9366127,2017-02-10,aa58e8f5-4a46-4c79-8e97-b9ebe28c9d9a,218472,Hon. Peter Van Loan,,Private Members' Business,Income Tax Act,,"Mr. Speaker, in terms of controlling costs, and I spoke to that somewhat in my speech, the most important control is that this applies only to properties that are on the Canadian Register of Historic Places, and that creates a limited frame of properties. Properties could be added to that, but the government is in a position to control that, because it is done through Parks Canada. While we welcome properties going onto it, if there is a concern that there is too much financial exposure, that gives the Government of Canada an ability to manage that cost.
In an ideal world, I would have extended this tax credit to all properties designated at the provincial and territorial level, but instead, I gave that power to the minister, something that is in the structure of the bill, which would ensure that those costs can be kept under control.
Certainly Parks Canada had in the past, when the policy was being prepared, come up with projections and said that the cost was quite small, a tiny fraction of what we are spending on the restoration of these five or six buildings around us in the parliamentary precinct. From that perspective, it does that.
Why it did not happen in the past over Liberal and Conservative governments is a good question. This is an opportunity for all of us to solve whatever failures occurred due to other priorities people focused on that allowed these things to be delayed. Now is the time, on the 150th anniversary of Confederation, to put an end to those delays and proceed forward with this policy.",Conservative,York—Simcoe,Peter Van Loan,http://www.parl.gc.ca/MembersOfParliament/ProfileMP.aspx?Key=218472&Language=E
4697941,ca.proc.d.2017-02-10.9366130,2017-02-10,dfce868a-f590-4d20-b1b6-4e08a3e5b669,217195,"Mr. Wayne Stetski (Kootenay—Columbia, NDP)",,Private Members' Business,Income Tax Act,,"Mr. Speaker, I would like to thank my colleague from York—Simcoe for this important bill. It is certainly important to many of the middle-class owners in my riding who are involved in heritage buildings.
I would ask the member this. Does he think that the 20% tax credit is also appropriate for wealthy people, the millionaires who happen to live in historic homes?",New Democratic Party,Kootenay—Columbia,Wayne Stetski,http://www.parl.gc.ca/MembersOfParliament/ProfileMP.aspx?Key=217195&Language=E
4697942,ca.proc.d.2017-02-10.9366132,2017-02-10,aa58e8f5-4a46-4c79-8e97-b9ebe28c9d9a,218472,Hon. Peter Van Loan,,Private Members' Business,Income Tax Act,,"Mr. Speaker, the tax credit will only apply to those on the Canadian Register of Historic Places. Therefore, it will not be just anyone who happens to own a nice old house. It would have to be, obviously, one of the most significant properties in the country.
The 20% number is less than in the U.S. In the U.S. it is a 25% credit. This is a bit more modest. However, I also believe that there is a public interest and a public benefit that comes from preserving our built heritage. We all benefit from it.
 It is not surprising that when a municipality moves to designate a heritage property, there is often enormous conflict, and property owners resist, because they are being told that we are effectively, as a state, expropriating part of their property. We are telling them what they can do with it. We are forcing them to keep it the way it is. We are forcing them to protect it, but they are going to have to bear the full cost of that. This is a way of modestly offsetting that and allowing some balance, some incentive, something that makes it a little easier for that property owner to bear, something that I believe will make it a lot easier for those who are seeking to preserve heritage across the country to get people to accept the notion that it is indeed something they should co-operate with in the public interest. I think that is why we see that so many municipal councils have agreed and support this policy. It will help them deal with problems. 
If we look at the situation at Yonge and Roselawn in Toronto, the property owners had worked effectively with developers. They were trying to come up with a way to make it work. However, at the end of the day, the numbers did not work, the pro forma did not work for the property owners, so they demolished it.
 I believe we have tried to strike the right balance. It is a little more conservative than the American tax credit, but nobody is getting rich off of this. Rather, it is something that will just provide a measure of offset for costs that we are asking private owners to bear to deliver in the public interest. ",Conservative,York—Simcoe,Peter Van Loan,http://www.parl.gc.ca/MembersOfParliament/ProfileMP.aspx?Key=218472&Language=E
