basepk,hid,speechdate,pid,opid,speakeroldname,speakerposition,maintopic,subtopic,subsubtopic,speechtext,speakerparty,speakerriding,speakername,speakerurl
4700089,ca.proc.d.2017-02-23.9402688,2017-02-23,85738a00-0a16-4a6f-89c7-9f045782d1fd,217331,"Mr. Richard Cannings (South Okanagan—West Kootenay, NDP)",,Government Orders,Business of Supply,Opposition Motion—Impact of Carbon Taxes,"Madam Speaker, I will be splitting my time with the member for Saanich—Gulf Islands.
I am happy to speak this afternoon to this motion. On its surface, it would seem to be about holding the government to account to commitments for openness and transparency. My two NDP colleagues, who spoke earlier, spoke to that theme of transparency. I have to thank my colleague from Rosemont—La Petite-Patrie for pointing out the delicious irony of a Conservative motion asking for more openness and transparency.
There is another irony in the Conservative debate, and that is the focus of standing up for low-income Canadians. The first two speeches we heard from the Conservatives told stories of low-income people in Ontario who literally had to choose between heating their home and eating, or even being able to afford to keep their home at all. These stories say more about the low incomes of these citizens after years of unreasonably low pensions for seniors and people with disabilities, restrictions on employment insurance, bungled energy pricing, and a complete retreat from affordable housing than they do with any inflated fears about what carbon pricing might bring. Too many Canadians live below or near the poverty line, and we all should all be constantly working in the House to change that shameful record.
 While some Conservative speakers have insisted that this is not an indictment of carbon pricing, it is clearly a tactic to attack that policy.
I want to spend much of my time talking not about the costs of climate action but the costs of inaction. 
On a global scale, The Economist published an analysis that said that an increase of 5°C would cost at least $7 trillion. That is where we are headed if the world follows the policies of this and previous Canadian governments on climate action. That is more than the capitalization of the London Stock Exchange. Imagine the London Stock Exchange collapsing. That is what we are facing on the global front. Citibank has come up with an even more drastic cost estimate of over $40 trillion over the next 40 years.
 In Canada, the National Round Table on the Environment and the Economy came up with estimates of the price of inaction back in 2011. That price for Canadians was put at $5 billion per year, and would rise to $43 billion by 2050. That estimate has not been updated lately because the previous government disbanded that round table, which did such good non-partisan work on this and other issues. Another thing the Liberal government could do is bring back the National Round Table on the Environment and the Economy.
The federal government does come up with cost estimates as well, although they tend to be hidden as footnotes in other reports, as we have seen today. The latest figures are about $40 per tonne of carbon now, which would rise to $75 per tonne by 2050. These costs are still higher than the revenues brought in by any carbon pricing scheme in Canada.
 Many of the costs of inaction are not well represented by dollars alone. The catastrophic fires at Fort McMurray last year, and those in my riding around Rock Creek, British Columbia the year before, forever altered the lives of thousands of people. Floods in Calgary had a similar impact. Calgary faces the opposite effect over the long term as the glaciers in the Rocky Mountains, the sole source of water for that city, disappear over the next century.
 Ocean acidification is already impacting shellfish farms along the B.C. coast.
 Forests are being devastated by more frequent fires and insect outbreaks across Canada, both driven by climate change. It is hard to come up with a cost for the mountain pine beetle epidemic that killed more than half of the pines in British Columbia in a few short years. Those beetles took off during a long period of year after year hot, dry summers and warm winters. That epidemic changed the forest industry of B.C. forever, hollowing out communities across the interior of the province, and is now threatening the Alberta forest industry.
 Now that the salvage operations are over for the beetle kill, allowable cuts will be lowered significantly in B.C. over the next few years, exacerbating the economic impact. We are now facing spruce beetle epidemics in B.C. that are taking advantage of similar climate patterns.
Finally, there are deep cultural impacts that climate change is having, and will continue to have, in communities throughout the Canadian Arctic. These communities and cultures have developed over millennia, with traditions dependent on seasonal patterns of sea ice. Those patterns are changing quickly, and even disappearing. The effect this will have on Arctic communities is difficult to assess or even put into words.
The price of inaction is astronomical. We must look for ways to minimize these unacceptable costs. Pretty much any economist from any country in the world will tell us that the cheapest way to tackle climate change is to put a price on carbon. That action would minimize the ongoing impacts of climate change, both financially and socially, on all Canadians. 
There are other actions that would help as well. One expert I recently talked to told me that efficiency is the best new fuel, so one easy action for the government to take would be to bring back the eco-energy home retrofit program. This popular program ran from 2007 to 2012 and helped hundreds of thousands of Canadians retrofit their homes, lowering their energy bills by 20%, creating thousands of good local jobs, and reducing greenhouse gas emissions by three tonnes per year for each house. While the program cost the federal government $900 million over about five years, it leveraged more than $4 billion in retrofit investments by Canadian families. When homeowners invest in new windows, insulation, and other energy-saving projects, that money circulates through communities across the country. The program combined everything that the Liberal government likes: leveraged infrastructure investments, carbon emission reductions, and helping the middle class and those struggling to join it. 
The Conservatives, who usually champion policies that help the financial bottom line of Canadians, should get behind the price on carbon. Climate change is one of the biggest threats facing Canadians in the global community, and avoiding action now would cost all of us significantly in the long term.
I would remind the government that it promised to be open and transparent with Canadians, and it is beyond time that it clearly articulated how it will address climate change with a real plan. We have heard a lot about real change. Now we need a real plan. Several provinces have introduced measures to help low- and middle-income households adapt to measures to combat climate change, but there is no sign of federal leadership to ensure that fair programs are in place across the country.
We in the NDP want the government to build a just transition to a greener economy, one that creates good jobs across the country. That is what Canadians expect from the government, not foot-dragging. ",New Democratic Party,South Okanagan—West Kootenay,Richard Cannings,http://www.parl.gc.ca/MembersOfParliament/ProfileMP.aspx?Key=217331&Language=E
4700090,ca.proc.d.2017-02-23.9402781,2017-02-23,b0010e40-d2c6-4a8e-a518-447721affc15,229875,"Ms. Filomena Tassi (Hamilton West—Ancaster—Dundas, Lib.)",,Government Orders,Business of Supply,Opposition Motion—Impact of Carbon Taxes,"Madam Speaker, I would like to commend the hon. member for an excellent speech. I really appreciate the passion he has for this topic. It came out very clearly in his speech this afternoon, particularly as he talked about the impact of climate change and the cost of inaction. That is something our government has recognized, and it is why we are moving forward in such an aggressive way on this very important topic. 
I would like the member's comments on the approach the government has taken with respect to tackling climate change; that is, the collaborative approach we are taking with the provinces. What we are doing is giving the decision-making authority to the provinces, working collaboratively with them, then empowering them to make the decisions as to how they are going to use the revenues they generate from the ways in which they improve their climate change approach. ",Liberal,Hamilton West—Ancaster—Dundas,Filomena Tassi,http://www.parl.gc.ca/MembersOfParliament/ProfileMP.aspx?Key=229875&Language=E
4700091,ca.proc.d.2017-02-23.9402797,2017-02-23,85738a00-0a16-4a6f-89c7-9f045782d1fd,217331,Mr. Richard Cannings,,Government Orders,Business of Supply,Opposition Motion—Impact of Carbon Taxes,"Madam Speaker, obviously, in many of these cases the provinces have jurisdiction, but what we need from this government is a sense of urgency and boldness. We heard a lot of talk in Paris that Canada was back and we were going to take action. Then we spent a year consulting Canadians across the country about what to do about climate change. I know I held several town halls in my riding, and members in the House all did the same. Everyone told me “We know what we need to do about climate change. You guys should be doing it”. 
That is one thing I would say to the government. I am glad you are thinking about this, but we really have to get going and do it. We should have started a year ago. ",New Democratic Party,South Okanagan—West Kootenay,Richard Cannings,http://www.parl.gc.ca/MembersOfParliament/ProfileMP.aspx?Key=217331&Language=E
4700092,ca.proc.d.2017-02-23.9402810,2017-02-23,cedf1659-ebb1-4f26-b723-5c7c5353988b,214948,The Assistant Deputy Speaker (Mrs. Carol Hughes),,Government Orders,Business of Supply,Opposition Motion—Impact of Carbon Taxes,"I just want to remind the member that he might want to not use the word “you” and he should direct his comments to the Chair as opposed to the government. 
Questions and comments, the hon. member for Saanich—Gulf Islands. ",New Democratic Party,Algoma—Manitoulin—Kapuskasing,Carol Hughes,http://www.parl.gc.ca/MembersOfParliament/ProfileMP.aspx?Key=214948&Language=E
4700093,ca.proc.d.2017-02-23.9402815,2017-02-23,eaa6694f-1e20-4aae-ad3b-e694b0e12c59,224170,"Ms. Elizabeth May (Saanich—Gulf Islands, GP)",,Government Orders,Business of Supply,Opposition Motion—Impact of Carbon Taxes,"Madam Speaker, I want to follow up on the speech given by the member for Dauphin—Swan River—Neepawa with the member who just spoke. 
I just flipped to the Wikipedia page for the member for South Okanagan—West Kootenay, because I know he is one of British Columbia's leading bird experts. I found that he has written 12 books on birds in British Columbia. 
Since the hon. member for Dauphin—Swan River—Neepawa suggested that renewable energy was slaughtering our birds, I thought he might be able to tell me if it is correct that there are far more birds killed by striking office towers in urban centres than are affected by renewable energy, and that the biggest threat to the survival of bird life on this planet is the threat of climate change. ",Green Party,Saanich—Gulf Islands,Elizabeth May,http://www.parl.gc.ca/MembersOfParliament/ProfileMP.aspx?Key=224170&Language=E
4700094,ca.proc.d.2017-02-23.9402828,2017-02-23,85738a00-0a16-4a6f-89c7-9f045782d1fd,217331,Mr. Richard Cannings,,Government Orders,Business of Supply,Opposition Motion—Impact of Carbon Taxes,"Madam Speaker, I could go on and on about birds, but I'll try to be succinct.
Yes, there are certain impacts that renewable energy projects have on birds, but we have done a lot of studies on this and we know how we can mitigate that. We know how we can operate wind farms to really reduce those losses, and some of the losses that the member mentioned were from years ago. As the member for Saanich—Gulf Islands mentioned, it is really the relative numbers of birds that are killed by habitat loss from climate change are very high. 
I will also mention cats, which is the one thing that humans have done to this world that really affects birds much more than wind farms ever will, and I know I will get some mail about that.",New Democratic Party,South Okanagan—West Kootenay,Richard Cannings,http://www.parl.gc.ca/MembersOfParliament/ProfileMP.aspx?Key=217331&Language=E
4700095,ca.proc.d.2017-02-23.9402840,2017-02-23,2490b23e-4439-4513-9d54-6fceb6320267,221288,"Ms. Cheryl Hardcastle (Windsor—Tecumseh, NDP)",,Government Orders,Business of Supply,Opposition Motion—Impact of Carbon Taxes,"Madam Speaker, I do not know if I should start with a rant as a crazy cat lady. 
I respect my hon. colleague so much for the work he has done, the thoughtfulness he has put into his speech, and his understanding of the environment.
 I have family members who were highly traumatized by the losses they experienced in the Fort McMurray fire. However, it is very disconcerting to know that people have lost their homes not only due to the actual destruction by the fire, but also because of the toxicity levels. Some people cannot go back into their homes for 30 years. 
We heard a member ask if another member knew what photosynthesis was. Can we maybe go into the depth a little more of the basis for this carbon pricing initiative?",New Democratic Party,Windsor—Tecumseh,Cheryl Hardcastle,http://www.parl.gc.ca/MembersOfParliament/ProfileMP.aspx?Key=221288&Language=E
4700096,ca.proc.d.2017-02-23.9402851,2017-02-23,85738a00-0a16-4a6f-89c7-9f045782d1fd,217331,Mr. Richard Cannings,,Government Orders,Business of Supply,Opposition Motion—Impact of Carbon Taxes,"Madam Speaker, on photosynthesis and carbon dioxide, we have long passed the time, years and years ago, when all the trees and plants in the world could take up the carbon dioxide we are producing; and that is what is causing this. The carbon dioxide levels are increasing in the atmosphere, we have the greenhouse effect, and the world is warming.",New Democratic Party,South Okanagan—West Kootenay,Richard Cannings,http://www.parl.gc.ca/MembersOfParliament/ProfileMP.aspx?Key=217331&Language=E
4700097,ca.proc.d.2017-02-23.9402860,2017-02-23,eaa6694f-1e20-4aae-ad3b-e694b0e12c59,224170,"Ms. Elizabeth May (Saanich—Gulf Islands, GP)",,Government Orders,Business of Supply,Opposition Motion—Impact of Carbon Taxes,"Madam Speaker, I want to begin by thanking the preceding speaker, the member for South Okanagan—West Kootenay, and in fact, the whole NDP caucus for allowing me 10 minutes to speak in this very important debate. 
I have been struggling today. I keep thinking to myself that people who live in glass houses should not keep an abundance of stones. Every time a Conservative speaks, I find myself thinking, “Do you not remember the last 10 years of cancelling all the carbon plans?” There was a very decent, workable plan in place in 2005 and 2006 that was cancelled within weeks of Stephen Harper becoming prime minister. Three different times, Canada's carbon target was weakened. It has been referenced already that Stephen Harper put a cap and trade program into a plan that he never really intended to execute. 
I do feel enormous empathy for the parade of environment ministers who suffered under that regime. I think they were all told that they would be able to deliver the plan. The current leader of the official opposition, who was the first minister of environment, said they were intending to reach Kyoto, and the rug was pulled out from under her. John Baird came along and said he had a turning-the-corner plan, that there would be regulations sector by sector. Nothing ever happened, except that we shamed ourselves in the world over and over again by obstructing global negotiations. That is something Canadians do not understand: how much, under the previous government, we did not just stand back, but we got in the way. Those are a few glass houses and stone moments that I wanted to get rid of before proceeding to a review of carbon pricing and what it means. 
I did not get the chance to put this to the hon. member for Dauphin—Swan River—Neepawa in questions and comments, but he said he had not heard anything about the Great Lakes. I remember distinctly that one of the Harper government budgets spent more money on barbed wire and fencing to go around the Great Lakes to make sure that terrorists were not getting access into Canada across the Great Lakes than for water quality. I just picked up the 2016 budget, and if we go to page 162, and several pages therein, we see there is finally a return to some Great Lakes policy; not enough, I have to say. I was part of the government back in 1986 to 1988 that put together the Great Lakes water quality strategy and a St. Lawrence cleanup plan, but at least there are some millions of dollars for the Great Lakes now.
It is really a rhetorical trick to have framed today's opposition day motion around the idea that electricity prices in Ontario are what we can expect everywhere if we adopt carbon pricing. Electricity prices in Ontario currently are very high, but they have nothing to do with carbon pricing. The only way we could replicate it across Canada is if we could somehow impose on every province the bad energy decisions made by Ontario Hydro for generations in building nuclear plants that created billions of dollars of stranded debt.
If we look at the breakdown of electricity prices for Ontario, and I urge everyone to google it and have a look, the number one price is the cost of generation, of course. Then there is the cost of distribution. The next biggest price, over $1 billion a year, is retiring the debt. This is related not to green energy but to nuclear energy. 
There has also been a great deal of nonsense about the B.C. carbon prices and the carbon tax there. I want to put that to bed. The hon. member for Calgary Nose Hill did not cite a reference on this one. She was referring to the Fraser Institute report, which claims, falsely, that the B.C. carbon tax is not revenue neutral. For those listening who do not know the term “revenue neutral”, it means that for every $1 of tax taken in on carbon, $1 of tax is reduced on small business and individual British Columbians.
 It is working very well, and the B.C. finance department has completely rebutted the Fraser Institute, but of course, the Fraser Institute is funded by the fossil fuel industry, the Koch brothers, ExxonMobil. We can examine the source and not be surprised. The finance ministry of B.C. says that the carbon tax has actually not been revenue neutral recently. It is giving more tax cuts than it is getting in revenue. In terms of how British Columbians receive it, it is a very positive thing.
Let me turn to what a price on carbon is and is not. It needs to be said really clearly that a price on carbon is not the magic silver bullet. We put a price on carbon in Canada and we have not reached our Paris targets magically. We have not averted the climate crisis magically. We need a whole range of measures, a whole suite of measures. What a carbon price attempts to do is correct market failure, because in that perfect world on the blackboard of economics 101, everything has an input cost. 
We have materials and labour. Pollution is free. It is an externality to the economic equation, but it is not external to real life. It piles up. Whether it is the Sydney tar ponds and toxic waste that had to be cleaned up at a cost of $400 million, or whether it is the future cost of cleaning up the oil sands tailings ponds, or whether it is overloading our global atmosphere with warming gases that threaten, and I am not using hyperbole here as this is actually what is at risk, human civilization itself, this is not a free good, so we have to put a price on it so our free market system can actually pay attention to it. It almost does not matter, in response to the member for Calgary Nose Hill, whether we have elasticity of price or not. There is such a demand for gasoline that we would have to put a huge carbon price on to affect the demand for gasoline. 
That is not the point of a carbon price. A carbon price is to make sure there is a signal at almost any level that this will cost something. It is to try to create some incentive, but on its own it is not enough. We need regulations and we need other plans. We need to bring on renewable energy so that we can decarbonize all of our electricity. That is a top priority. Ontario did it first, but others need to do it.
What kind of institutions favour a carbon tax? Looney left-wing ones? No. The International Monetary Fund says that every country needs to put in place a carbon price and eliminate fossil fuel subsidies. This was a promise in the Liberal platform that we need to see executed. It has not happened yet. We still have fossil fuel subsidies for liquefied natural gas and dwindling but still in the oil sands. The World Bank also favours carbon pricing and the elimination of fossil fuel subsidies. It is the same for the International Energy Agency. 
The first carbon price that was applied by any nation was by Finland in 1990, followed by Sweden in 1991. By the way, the carbon price in Sweden is now hovering at around $150 a tonne. Norway applied its carbon price as it began to develop its North Sea oil resources. It was at the point of becoming potentially a petro-state but decided not to go that route. It decided not to let its currency be linked to the money that it was taking in. Norway took in royalties. It also applied a carbon tax. It now has a sovereign wealth fund, so as North Sea oil dwindles, it will have a $900-billion sovereign wealth fund. 
Guess whose advice Norway followed when it did that? That was the advice of former Alberta premier Peter Lougheed. If only Albertans had followed the advice of former premier Peter Lougheed, there would be a huge amount of money to adapt to transitions. They would not have put all of their money into the bitumen basket, all of their eggs into the bitumen basket, of shipping out raw bitumen but would have followed Peter Lougheed's plan and had ancillary infrastructure for refining and upgrading.
Today's debate is about the Liberals revealing numbers. Guess what, folks? I do not think there are any numbers, because no one can know yet. In the absence of any federal role on carbon pricing or carbon action under the Harper era, we have a patchwork, because provinces began to take action on their own. Frankly, I am no fan of cap and trade. It is open to fraud and it is a difficult system. But they had nothing else going on, so Ontario and Quebec decided to work with California. 
British Columbia brought in the best architecture of a carbon price with returning every dollar collected to reduce taxes across the province. Gordon Campbell would not have been re-elected without having brought in a carbon tax. He fell later on because he never told anyone he was going to bring in a harmonized sales tax, but that is another issue. Carbon tax saved him. HST took him down.
Here we are in a situation where we have a patchwork. The federal government has stepped up and I think the architecture of what it is proposing is very good. It is backfill and infill. The federal government is saying it is not going to tax on top of what B.C. is already taxing, which is already at $30 a tonne, or Ontario and Quebec and California. It wants to make sure there is an even playing field for business certainty to send out that carbon signal. 
We need a carbon price that is uniform across Canada, but we do not know that every province is going to design a revenue neutral tax. I wish they would. We do know that the federal government will return to every province all the money it collects from that province if by the time the carbon tax rolls around that province has not designed its own system.
Frankly, all the people in the Conservative caucus who are suddenly concerned that there is going to be an impact by doing something need to think about the situation. There is no hidden report. The report they want was prepared under the Harper administration. If they want transparency, they should help everyone work together to deliver a carbon price that is effective, reduces pollution, and helps us move into a 21st century green economy.",Green Party,Saanich—Gulf Islands,Elizabeth May,http://www.parl.gc.ca/MembersOfParliament/ProfileMP.aspx?Key=224170&Language=E
