basepk,hid,speechdate,pid,opid,speakeroldname,speakerposition,maintopic,subtopic,subsubtopic,speechtext,speakerparty,speakerriding,speakername,speakerurl
4699983,ca.proc.d.2017-02-23.9401943,2017-02-23,8908cde5-7474-4d2a-8c50-d05da5ee0712,214493,"Hon. Navdeep Bains (Minister of Innovation, Science and Economic Development, Lib.)",,Oral Questions,Foreign Investment,,"Mr. Speaker, we believe in investments. We think it is absolutely critical that we have investments in Canada to grow the economy and create jobs. With respect to this particular case, under the Investment Canada Act, Cedar Tree will now be owned and operated by Canadians going forward. More importantly, it will have additional financial resources to expand its facility, which means it will be able to create more jobs. That is good for British Columbia, good for seniors, and good for all Canadians.",Liberal,Mississauga—Malton,Navdeep Bains,http://www.parl.gc.ca/MembersOfParliament/ProfileMP.aspx?Key=214493&Language=E
4699984,ca.proc.d.2017-02-23.9401945,2017-02-23,9c9a64e6-58f1-4367-9f49-93ad31744c96,217354,"Mrs. Cathy McLeod (Kamloops—Thompson—Cariboo, CPC)",,Oral Questions,Foreign Investment,,"Mr. Speaker, I know many of the people who live in these facilities, and they deserve to know who owns their home. Our seniors are concerned about the quality of care, of food, and the credentials of the people caring for them. This transaction is clearly not about charity; it is about profit. Why would the Prime Minister put the care of our parents and grandparents at the mercy of profiteers pulling strings from Beijing?",Conservative,Kamloops—Thompson—Cariboo,Cathy McLeod,http://www.parl.gc.ca/MembersOfParliament/ProfileMP.aspx?Key=217354&Language=E
4699985,ca.proc.d.2017-02-23.9401947,2017-02-23,8908cde5-7474-4d2a-8c50-d05da5ee0712,214493,"Hon. Navdeep Bains (Minister of Innovation, Science and Economic Development, Lib.)",,Oral Questions,Foreign Investment,,"Mr. Speaker, it is our government that has shown leadership when it comes to supporting our seniors. We have reduced the old-age security age limit from 67 to 65. We have increased the guaranteed income supplement by 10%. With respect to this particular transaction, the additional financial resources will allow Cedar Tree the ability to expand, provide better service, and create more jobs. This is good for seniors, good for the economy, and good for all Canadians.",Liberal,Mississauga—Malton,Navdeep Bains,http://www.parl.gc.ca/MembersOfParliament/ProfileMP.aspx?Key=214493&Language=E
4699986,ca.proc.d.2017-02-23.9401949,2017-02-23,51d4e050-d737-4879-bead-20a3b672a36c,56126,"Hon. Diane Finley (Haldimand—Norfolk, CPC)",,Oral Questions,Foreign Investment,,"Mr. Speaker, yesterday the Prime Minister defended his approval of the sale of Canadian seniors' care facilities to the Chinese, claiming that it would create jobs for Canadians. Today we learned that nothing could be further from the truth; there are absolutely no new jobs attached to this deal. Clearly, pleasing Chinese billionaires is more important than Canadian jobs and Canadian seniors. How can he justify selling Canadian medical facilities companies to his friends in Beijing with no guarantee of benefits to Canadians?",Conservative,Haldimand—Norfolk,Diane Finley,http://www.parl.gc.ca/MembersOfParliament/ProfileMP.aspx?Key=56126&Language=E
4699987,ca.proc.d.2017-02-23.9401952,2017-02-23,8908cde5-7474-4d2a-8c50-d05da5ee0712,214493,"Hon. Navdeep Bains (Minister of Innovation, Science and Economic Development, Lib.)",,Oral Questions,Foreign Investment,,"Mr. Speaker, we engaged the British Columbia government and the minister of health to make sure that all of the regulations would be followed in that province.
 However, more importantly, we believe that global investment is good for Canada, because when we bring investment to Canada, it creates opportunities for growth. When we grow the economy, we create good-quality jobs. What does “good-quality jobs” mean? They help strengthen the middle class. That is what this investment is all about, making sure that we maintain good jobs, and making sure that it has additional financial resources to expand its facilities and create more jobs. This is good for the economy, good for job creation, and good for the middle class.",Liberal,Mississauga—Malton,Navdeep Bains,http://www.parl.gc.ca/MembersOfParliament/ProfileMP.aspx?Key=214493&Language=E
4699988,ca.proc.d.2017-02-23.9401954,2017-02-23,0bd5970c-e4c2-4044-8344-8123b16d75bd,218725,"Hon. Peter Kent (Thornhill, CPC)",,Oral Questions,Foreign Investment,,"Mr. Speaker, beyond the very real concerns for the welfare of Canadian seniors living in these care facilities, the Liberals' indecent rush to embrace this sketchy deal has skated too quickly past security and investment due diligence. American government regulators and investment houses have absolutely refused to deal with this Chinese company on the basis of its murky ownership and shareholder structure. If the minister is so confident in this backroom deal, will he make public the analysis of the Canadian security agencies that reviewed the deal?",Conservative,Thornhill,Peter Kent,http://www.parl.gc.ca/MembersOfParliament/ProfileMP.aspx?Key=218725&Language=E
4699989,ca.proc.d.2017-02-23.9401956,2017-02-23,8908cde5-7474-4d2a-8c50-d05da5ee0712,214493,"Hon. Navdeep Bains (Minister of Innovation, Science and Economic Development, Lib.)",,Oral Questions,Foreign Investment,,"Mr. Speaker, the member opposite knows that this deal was under the provision of the Investment Canada Act. We did our due diligence, followed the process, and made sure that this was in the overall net economic benefit of all Canadians. Otherwise we would not have proceeded. As I have reiterated before, it is about global investment, creating jobs, and growing the economy. We made the best decision in our national interest and in the net economic benefit for British Columbians and all Canadians.",Liberal,Mississauga—Malton,Navdeep Bains,http://www.parl.gc.ca/MembersOfParliament/ProfileMP.aspx?Key=214493&Language=E
4699990,ca.proc.d.2017-02-23.9401958,2017-02-23,febe5b3f-1a40-472b-873d-11be938a0e59,218106,"Hon. Gerry Ritz (Battlefords—Lloydminster, CPC)",,Oral Questions,International Trade,,"Mr. Speaker, the Minister of Foreign Affairs has stated in this House that when it comes to trade deals, “we need more transparency on what is happening. We need not just great photo ops, but the details of what is going on”. Therefore, it seems a little strange then that only Chinese state-run media is reporting that Canadian officials have been in Beijing since last Monday for secret meetings on a bilateral trade agreement. Will the minister be open and transparent with Canadians and tell us if she is negotiating a free trade agreement with China, yes or no?",Conservative,Battlefords—Lloydminster,Gerry Ritz,http://www.parl.gc.ca/MembersOfParliament/ProfileMP.aspx?Key=218106&Language=E
4699991,ca.proc.d.2017-02-23.9401964,2017-02-23,782dab6a-6e60-4132-992b-4933293f30d4,229493,"Ms. Pam Goldsmith-Jones (Parliamentary Secretary to the Minister of International Trade, Lib.)",,Oral Questions,International Trade,,"Mr. Speaker, we owe it to Canadian workers and their families to ensure that we have the access we need to the significant Asia-Pacific market. We will continue to explore ways to expand our commercial relations and our progressive trade agenda throughout the region in the most effective way possible. This will be the message of the Minister of International Trade at the upcoming high-level dialogue in China.
 As well, and as the member opposite well knows, all of us in this House look forward to sharing the committee's recommendations on the future of our trade with the Asia region.",Liberal,West Vancouver—Sunshine Coast—Sea to Sky Country,Pam Goldsmith-Jones,http://www.parl.gc.ca/MembersOfParliament/ProfileMP.aspx?Key=229493&Language=E
4699992,ca.proc.d.2017-02-23.9401966,2017-02-23,febe5b3f-1a40-472b-873d-11be938a0e59,218106,"Hon. Gerry Ritz (Battlefords—Lloydminster, CPC)",,Oral Questions,International Trade,,"Mr. Speaker, the committee has not done any work on China, and it is all about consultations until it should.
The Liberals have turned the softwood lumber deal into a crisis. The Liberals are failing Canadian farmers on pulse exports to India; that deal is up in March. The Liberals rolled over on negotiations on NAFTA without really knowing what they are putting at risk. Now, the Liberals are engaged in secret negotiations with Chinese officials. It is more of the same.
Why do the Liberals not start cleaning up the messes they have already created before they launch new negotiations with China?",Conservative,Battlefords—Lloydminster,Gerry Ritz,http://www.parl.gc.ca/MembersOfParliament/ProfileMP.aspx?Key=218106&Language=E
4699993,ca.proc.d.2017-02-23.9401968,2017-02-23,782dab6a-6e60-4132-992b-4933293f30d4,229493,"Ms. Pam Goldsmith-Jones (Parliamentary Secretary to the Minister of International Trade, Lib.)",,Oral Questions,International Trade,,"Mr. Speaker, as the member opposite well knows, Canada is a trading nation. We understand the importance of strengthening Canada's role in the global economy and we are very concerned about the rising ways of protectionism we see around the world.
To turn to Japan, for instance, it is a long-standing and important partner for us, and that has not changed. The international trade report on TPP will help guide us as we expand commercial relations and our progressive trade agenda in the Asia region.",Liberal,West Vancouver—Sunshine Coast—Sea to Sky Country,Pam Goldsmith-Jones,http://www.parl.gc.ca/MembersOfParliament/ProfileMP.aspx?Key=229493&Language=E
4699994,ca.proc.d.2017-02-23.9401973,2017-02-23,c5b09363-414d-43b2-bc2c-274b997c8989,217112,"Ms. Jenny Kwan (Vancouver East, NDP)",,Oral Questions,Public Safety,,"Mr. Speaker, this morning, the University of Toronto's international human rights program released a shocking report on Canada's practice of detaining children in medium-security immigration jails. According to the report, Canada detains almost 250 children annually. Some of these children are even held in solitary confinement, in breach of international law and the charter. This is a disgrace.
Will the government finally amend the Immigration and Refugee Protection Act and prohibit the detention of children?",New Democratic Party,Vancouver East,Jenny Kwan,http://www.parl.gc.ca/MembersOfParliament/ProfileMP.aspx?Key=217112&Language=E
4699995,ca.proc.d.2017-02-23.9401983,2017-02-23,1a1a9dee-c228-40fc-b926-42f8441d84f0,214405,"Hon. Ralph Goodale (Minister of Public Safety and Emergency Preparedness, Lib.)",,Oral Questions,Public Safety,,"Mr. Speaker, immigration detention is a measure of absolute last resort. That is why we are investing $138 million to both improve the system and minimize its use. We want to avoid the housing of minors in detention facilities as much as humanly possible.
I would note that the report the hon. member refers to said this:
 CBSA has embarked on several new programs to improve transparency, alternatives to detention, and infrastructure.... the total number of children in detention across the country...has decreased significantly.... 
",Liberal,Regina—Wascana,Ralph Goodale,http://www.parl.gc.ca/MembersOfParliament/ProfileMP.aspx?Key=214405&Language=E
4699996,ca.proc.d.2017-02-23.9401992,2017-02-23,78336f0e-962c-47d2-a5b8-b59a26592789,217339,"Mr. Matthew Dubé (Beloeil—Chambly, NDP)",,Oral Questions,Public Safety,,"Mr. Speaker, today is the second anniversary of the first vote on Bill C-51. The Liberals and the Conservatives joined forces to pass a bill that violates our rights and freedoms.
History is repeating itself with Bill C-23, which is bad for human rights and Canadians' privacy.
The government has admitted that the current pre-clearance system works well, so why is it so determined to forge ahead with giving American officers more powers on Canadian soil?",New Democratic Party,Beloeil—Chambly,Matthew Dubé,http://www.parl.gc.ca/MembersOfParliament/ProfileMP.aspx?Key=217339&Language=E
4699997,ca.proc.d.2017-02-23.9401994,2017-02-23,1a1a9dee-c228-40fc-b926-42f8441d84f0,214405,"Hon. Ralph Goodale (Minister of Public Safety and Emergency Preparedness, Lib.)",,Oral Questions,Public Safety,,"Mr. Speaker, the point is simply this. Under the pre-clearance system improved by the legislation in Bill C-23, more Canadians will be able to clear customs in Canada before they cross the border, under the full umbrella of Canadian law, the protection of the Charter of Rights and Freedoms, the protection of the Bill of Rights, and the protection of the Canadian Human Rights Act. That is obviously a far superior process.",Liberal,Regina—Wascana,Ralph Goodale,http://www.parl.gc.ca/MembersOfParliament/ProfileMP.aspx?Key=214405&Language=E
4699998,ca.proc.d.2017-02-23.9401996,2017-02-23,e277e13e-59ec-425f-a957-eb5e54d8cb62,226920,"Mr. Gérard Deltell (Louis-Saint-Laurent, CPC)",,Oral Questions,Finance,,"Mr. Speaker, this morning, during one of my regular meetings with Canadian business people and economic stakeholders, I met with officials from the Canadian Chamber of Commerce. These are entrepreneurs, job creators, and wealth creators from across the country, and they are all very worried about this government's lack of vision.
We know that the Liberal Party was elected on a promise to return to a balanced budget by 2019, but the Department of Finance has found that we will not return to a balanced budget until 2055. That is completely unacceptable, and the minister knows it.
Could the minister at least set the record straight for these entrepreneurs, job creators and wealth creators? When will Canada return—",Conservative,Louis-Saint-Laurent,Gérard Deltell,http://www.parl.gc.ca/MembersOfParliament/ProfileMP.aspx?Key=226920&Language=E
4699999,ca.proc.d.2017-02-23.9401998,2017-02-23,3176068f-62ee-4b2f-aacd-1131201c6db1,214707,The Speaker,,Oral Questions,Finance,,The hon. Minister of Finance.,Liberal,Halifax West,Geoff Regan,http://www.parl.gc.ca/MembersOfParliament/ProfileMP.aspx?Key=214707&Language=E
4700000,ca.proc.d.2017-02-23.9401999,2017-02-23,5d3dfa7b-f157-4019-ac2a-4dab0cb15f92,213961,"Hon. Bill Morneau (Minister of Finance, Lib.)",,Oral Questions,Finance,,"Mr. Speaker, it is very important to create good economic conditions for business across the country, for small and medium-sized businesses as well as large corporations.
That is why we need to make investments in our future. Our goal is to spur economic growth and create more opportunities for workers, and at the same time, more opportunities for companies of all sizes. We will therefore continue our investment program to grow the economy.",Liberal,Toronto Centre,Bill Morneau,http://www.parl.gc.ca/MembersOfParliament/ProfileMP.aspx?Key=213961&Language=E
4700001,ca.proc.d.2017-02-23.9402001,2017-02-23,e277e13e-59ec-425f-a957-eb5e54d8cb62,226920,"Mr. Gérard Deltell (Louis-Saint-Laurent, CPC)",,Oral Questions,Finance,,"Mr. Speaker, not even a hint of a response telling us when we are going to return to a balanced budget. When my colleague worked in the private sector, he would never have tolerated such a weak answer like that.
I will ask the question again on behalf of all Canadian business owners and all Canadian taxpayers: when will the government finally return to a balanced budget?
Will it be in 2019, like my colleague promised, or will it be in 2055, as the officials at the Department of Finance are sadly predicting?",Conservative,Louis-Saint-Laurent,Gérard Deltell,http://www.parl.gc.ca/MembersOfParliament/ProfileMP.aspx?Key=226920&Language=E
4700002,ca.proc.d.2017-02-23.9402003,2017-02-23,5d3dfa7b-f157-4019-ac2a-4dab0cb15f92,213961,"Hon. Bill Morneau (Minister of Finance, Lib.)",,Oral Questions,Finance,,"Mr. Speaker, our goal is clear: we want to have an economy that works for Canadians and companies across the country. That is very important.
It is very important to invest in infrastructure and to have innovative companies. There will be more growth in the future and more opportunities for individuals and companies.",Liberal,Toronto Centre,Bill Morneau,http://www.parl.gc.ca/MembersOfParliament/ProfileMP.aspx?Key=213961&Language=E
4700003,ca.proc.d.2017-02-23.9402005,2017-02-23,ad4032f2-6bb1-497b-b146-f321cfb71ba9,226915,"Hon. Pierre Poilievre (Carleton, CPC)",,Oral Questions,Taxation,,"Mr. Speaker, on the carbon tax cover-up, this week 68-year-old Rick Russell put up a massive sign on his house declaring “another senior loses home due to high energy costs”. He has given up his truck and house so he can pay a tax that will fund rebates for millionaires who buy $150,000 electric cars. Now the government is hiding what the tax will cost the poor and middle class.
Will the Prime Minister end the carbon tax cover-up and tell Rick what the tax will cost him?",Conservative,Carleton,Pierre Poilievre,http://www.parl.gc.ca/MembersOfParliament/ProfileMP.aspx?Key=226915&Language=E
4700004,ca.proc.d.2017-02-23.9402008,2017-02-23,cee27afa-cdf8-4e99-ab22-22290f86aa3a,214082,"Hon. Catherine McKenna (Minister of Environment and Climate Change, Lib.)",,Oral Questions,Taxation,,"Mr. Speaker, 80% of Canadians already live in a jurisdiction where there is a price on carbon pollution. That is thanks to the leadership of the provinces.
 I was actually heartened to see that it was not just Liberal governments which had done that, or NDP governments. We also have Conservative parties. The Conservative Party of Manitoba has committed to putting a price on pollution. Patrick Brown, the leader of the Conservative Party in Ontario, has said that putting a price on carbon pollution just makes sense.
 Why does it make sense? Because it fosters a cleaner future, it reduces emissions, it creates good jobs, and it is the right thing to do.",Liberal,Ottawa Centre,Catherine McKenna,http://www.parl.gc.ca/MembersOfParliament/ProfileMP.aspx?Key=214082&Language=E
4700005,ca.proc.d.2017-02-23.9402009,2017-02-23,3176068f-62ee-4b2f-aacd-1131201c6db1,214707,The Speaker,,Oral Questions,Taxation,,"Order, please. I know hon. members want to assist the minister in how she might answer, but let us remember that one person asks the question, one person answers the question, and the rest of us need to listen. 
Now we need to listen to the hon. member for Carleton.",Liberal,Halifax West,Geoff Regan,http://www.parl.gc.ca/MembersOfParliament/ProfileMP.aspx?Key=214707&Language=E
4700006,ca.proc.d.2017-02-23.9402010,2017-02-23,ad4032f2-6bb1-497b-b146-f321cfb71ba9,226915,"Hon. Pierre Poilievre (Carleton, CPC)",,Oral Questions,Taxation,,"Mr. Speaker, still on the carbon tax cover-up, disabled grandmother Kathy Katula broke into tears at the Prime Minister's recent town hall, asking him how she would pay his new carbon tax on her home heating. The Prime Minister gave her a nice warm hug, but not warm enough to heat her home. Now he is censoring the cost of his tax on the poor and middle class.
 Kathy is paying the bill. She should have the right to see the bill. Will the Prime Minister end the carbon tax cover-up and tell Kathy what his tax will cost her?",Conservative,Carleton,Pierre Poilievre,http://www.parl.gc.ca/MembersOfParliament/ProfileMP.aspx?Key=226915&Language=E
4700007,ca.proc.d.2017-02-23.9402013,2017-02-23,d67a49c2-65bd-411e-8bb4-29ff759c5829,214003,"Hon. Jean-Yves Duclos (Minister of Families, Children and Social Development, Lib.)",,Oral Questions,Taxation,,"Mr. Speaker, I am delighted for this opportunity to talk about the importance of working for a cleaner environment, a cleaner economy, an economy that protects the health, the clean water, and the clean air of this generation and future generations; a government that also works for economic growth to benefit the middle class; and a development that also is inclusive of everyone who is vulnerable in our population. We are working very hard to achieve these three goals.",Liberal,Québec,Jean-Yves Duclos,http://www.parl.gc.ca/MembersOfParliament/ProfileMP.aspx?Key=214003&Language=E
4700008,ca.proc.d.2017-02-23.9402015,2017-02-23,13a21d52-bc44-4a96-a206-f18432ef9191,228735,"Mr. Romeo Saganash (Abitibi—Baie-James—Nunavik—Eeyou, NDP)",,Oral Questions,Indigenous Affairs,,"Mr. Speaker, 10 years ago, the AFN and Cindy Blackstock filed a human rights complaint against the federal government to end racial discrimination against first nations kids. Today, at committee, the Minister of Indigenous and Northern Affairs told us that the Canadian Human Rights Tribunal was not the court of law, therefore implying that the government did not need to respect the tribunal. 
All indigenous children have the right to a healthy childhood. Therefore, when will the government do the right thing and stop discriminating against first nations children?",New Democratic Party,Abitibi—Baie-James—Nunavik—Eeyou,Romeo Saganash,http://www.parl.gc.ca/MembersOfParliament/ProfileMP.aspx?Key=228735&Language=E
4700009,ca.proc.d.2017-02-23.9402018,2017-02-23,f470e27a-a074-4b16-8304-960ffe8c9289,213975,"Hon. Carolyn Bennett (Minister of Indigenous and Northern Affairs, Lib.)",,Oral Questions,Indigenous Affairs,,"Mr. Speaker, as the member knows, we welcome the tribunal's ruling and we are working very hard with concrete steps to address its orders. We have committed $635 million over five years to close the gaps in child and family services. We have invested an additional $382 million over three years to expand the definition of Jordan's principle. We are working with the provinces and territories, the service providers, as well as first nations, to totally overhaul the system.
 Today we are very pleased that Grand Chief Ed John has agreed to chair the national advisory committee to ensure we get this done.",Liberal,Toronto—St. Paul's,Carolyn Bennett,http://www.parl.gc.ca/MembersOfParliament/ProfileMP.aspx?Key=213975&Language=E
4700010,ca.proc.d.2017-02-23.9402020,2017-02-23,7f01c656-5f94-4743-9018-ad3a89bb2fc4,217214,"Ms. Brigitte Sansoucy (Saint-Hyacinthe—Bagot, NDP)",,Oral Questions,Health,,"Mr. Speaker, many cases have demonstrated that applying the criterion of naturally foreseeable death is not effective. There has been another tragic case in Quebec. We cannot stand by and wait for judicial rulings. The Special Joint Committee on Physician-Assisted Dying recommended the use of advance directives. Madam minister, action is urgently needed. We cannot let people suffer.
Will the minister insist that the study on advance directives be completed before December 2018?",New Democratic Party,Saint-Hyacinthe—Bagot,Brigitte Sansoucy,http://www.parl.gc.ca/MembersOfParliament/ProfileMP.aspx?Key=217214&Language=E
4700011,ca.proc.d.2017-02-23.9402021,2017-02-23,3176068f-62ee-4b2f-aacd-1131201c6db1,214707,The Speaker,,Oral Questions,Health,,"I would like to remind the hon. member to direct her comments to the chair.
The hon. Minister of Health.",Liberal,Halifax West,Geoff Regan,http://www.parl.gc.ca/MembersOfParliament/ProfileMP.aspx?Key=214707&Language=E
4700012,ca.proc.d.2017-02-23.9402022,2017-02-23,350c31fd-6260-4c63-bd17-0746cb6f4120,214328,"Hon. Jane Philpott (Minister of Health, Lib.)",,Oral Questions,Health,,"Mr. Speaker, I cannot comment on specific cases. It is a very emotional subject.
By passing legislation on medical assistance in dying, our government sought to protect the most vulnerable Canadians while giving them safe and consistent access to medical assistance in dying across the country. We launched independent reviews of three complex issues that are outside the purview of the act. We believe that the reports from experts will provide Canadians with useful information.",Liberal,Markham—Stouffville,Jane Philpott,http://www.parl.gc.ca/MembersOfParliament/ProfileMP.aspx?Key=214328&Language=E
4700013,ca.proc.d.2017-02-23.9402026,2017-02-23,6322565a-d236-4124-81f3-d869f865f7ef,229560,"Ms. Leona Alleslev (Aurora—Oak Ridges—Richmond Hill, Lib.)",,Oral Questions,The Environment,,"Mr. Speaker, Canadians understand that the economy and the environment go hand in hand and that everyone must be involved in a realistic plan to reduce greenhouse gases. In November, the President of the Treasury Board announced that the government will reduce its greenhouse gas emissions by 40% by 2030 and that a centre for greening government will be set up to coordinate those efforts. 
Can the President of the Treasury Board give us an update on this issue?",Liberal,Aurora—Oak Ridges—Richmond Hill,Leona Alleslev,http://www.parl.gc.ca/MembersOfParliament/ProfileMP.aspx?Key=229560&Language=E
4700014,ca.proc.d.2017-02-23.9402029,2017-02-23,6d680702-120b-4bcf-8da9-aae3e38ca0cf,214346,"Hon. Scott Brison (President of the Treasury Board, Lib.)",,Oral Questions,The Environment,,"Mr. Speaker, our government is committed to doing its part to create a cleaner and more innovative economy in order to reduce our greenhouse gas emissions and create good, sustainable jobs for the middle class. 
That is why I was proud today to participate in the launch of the new Centre for Greening Government. We launched a series of round table discussions focused on making sure the Government of Canada was part of the climate change solution.
 I want to thank the member for Vancouver Quadra, my parliamentary secretary, for her leadership on this file.",Liberal,Kings—Hants,Scott Brison,http://www.parl.gc.ca/MembersOfParliament/ProfileMP.aspx?Key=214346&Language=E
