basepk,hid,speechdate,pid,opid,speakeroldname,speakerposition,maintopic,subtopic,subsubtopic,speechtext,speakerparty,speakerriding,speakername,speakerurl
4697759,ca.proc.d.2017-02-10.9365496,2017-02-10,b0010e40-d2c6-4a8e-a518-447721affc15,215946,"Ms. Filomena Tassi (Hamilton West—Ancaster—Dundas, Lib.)",,,Business of the House,,"Mr. Speaker, I ask for unanimous consent for the following motion. I move:
 That notwithstanding any standing order or usual practice of the house the Minister of International Trade be permitted to speak to the motion for 3rd reading of Bill C-31. 
",Liberal,Hamilton West—Ancaster—Dundas,Filomena Tassi,http://www.parl.gc.ca/MembersOfParliament/ProfileMP.aspx?Key=215946&Language=E
4697760,ca.proc.d.2017-02-10.9365497,2017-02-10,02c2cb20-f27d-46a5-8e78-ab4b405bf07b,214864,The Deputy Speaker,,,Business of the House,,Does the hon. member have the unanimous consent of the House to propose the motion?,Conservative,Simcoe North,Bruce Stanton,http://www.parl.gc.ca/MembersOfParliament/ProfileMP.aspx?Key=214864&Language=E
4697761,ca.proc.d.2017-02-10.p4742458,2017-02-10,,,,intervention,,Business of the House,, Agreed.,,,Some hon. members,
4697762,ca.proc.d.2017-02-10.p4742459,2017-02-10,02c2cb20-f27d-46a5-8e78-ab4b405bf07b,214864,The Deputy Speaker,,,Business of the House,, The House has heard the terms of the motion. Is it the pleasure of the House to adopt the motion?,Conservative,Simcoe North,Bruce Stanton,http://www.parl.gc.ca/MembersOfParliament/ProfileMP.aspx?Key=214864&Language=E
4697763,ca.proc.d.2017-02-10.p4742460,2017-02-10,,,,intervention,,Business of the House,, Agreed.,,,Some hon. members,
4697764,ca.proc.d.2017-02-10.p2,2017-02-10,02c2cb20-f27d-46a5-8e78-ab4b405bf07b,214864,The Deputy Speaker,,,Business of the House,,(Motion agreed to),Conservative,Simcoe North,Bruce Stanton,http://www.parl.gc.ca/MembersOfParliament/ProfileMP.aspx?Key=214864&Language=E
4697765,ca.proc.d.2017-02-10.p4742461,2017-02-10,,,,stagedirection,Government Orders,Canada-Ukraine Free Trade Agreement Implementation Act,," The House resumed from February 7 consideration of the motion that Bill C-31, An Act to implement the Free Trade Agreement between Canada and Ukraine, be read the third time and passed. ",,,,
4697766,ca.proc.d.2017-02-10.9365503,2017-02-10,c049fb93-b7d8-4021-8fc6-cf1c69f7200b,229217,"Hon. François-Philippe Champagne (Minister of International Trade, Lib.)",,Government Orders,Canada-Ukraine Free Trade Agreement Implementation Act,,"Mr. Speaker, I would first like to thank all the members of this House for granting unanimous consent for me to speak this morning. I am very grateful. I will be splitting my time with the member for Kootenay—Columbia.
I have the privilege of speaking this morning on Bill C-31, An Act to implement the Free Trade Agreement between Canada and Ukraine. This is a momentous time in our history for us to be looking at this bill together in this House. I am indeed very pleased to speak today on the topic of the Canada-Ukraine free trade agreement and the benefits it will provide to all Canadians.
When we talk about trade, those are benefits that are going to each and every one of the 338 jurisdictions and ridings we have in our country. The good people who sent every member sitting in this House here to represent them will benefit from our free trade agreement. This is a good example of what Canada can do in the world, when Canada stands for progressive trade, and when Canada becomes a beacon of hope and openness around the world.
This agreement is an important step in Canada's relationship with Ukraine, and one that is supported by Canadians from across the country. Following the 125th anniversary of Ukrainian migration to Canada last year, we are reminded of the Ukrainian Canadian community, which is more than 1.2 million strong in our nation.
Our people-to-people ties form a strong foundation for the partnership enjoyed by Canada and Ukraine today. Canada has remained steadfast in its support of Ukraine and believes the free trade agreement will only strengthen this relationship going forward. Trade is good for the world; trade is good for the people. 
In 1991, Canada became the first western country to recognize Ukraine's independence. I am sure this is an act that a lot of members in the House take great pride in. Since then, and especially now in the face of recent crises, Canada has prioritized its role in the international community by encouraging Ukraine's and Canada's shared commitment to security, advancing democracy, and promoting sustainable economic growth.
One of the ways that Canada has done this is through technical and financial assistance, which since 1991 amounts to more than $1.2 billion. Reflecting the multi-faceted nature of our relationship, this includes support for macroeconomic stabilization, democratic and economic reforms, support for promoting the rule of law, security and stability, and, very importantly, humanitarian assistance.
In addition, Canada is seeking to support efforts to find a lasting and sustainable resolution to the armed conflict in Eastern Ukraine through the provision of stabilization and security assistance. Since 2014, over $60 million has been committed to support initiatives in a wide range of areas, including ceasefire and human rights monitoring, police reform, and non-military equipment and training.
Further, Canada has provided $27 million in humanitarian assistance to help people affected by the conflict in Eastern Ukraine, including emergency shelters and essential relief items, safe drinking water, food, sanitation, basic medical care, hygiene supplies, education, protection, and psychosocial support.
I am sure that every member in this House today recognizes how Canada is a power for good in the world. When I say these words, I am sure many of us take great pride in saying what role Canada can play in the world. As we can see through our multi-faceted work with Ukraine, Canada is deeply committed to supporting the economic reform and development efforts of the Government of Ukraine.
The Canada-Ukraine FTA will only reinforce these efforts. The agreement is complementary on the premise that economic development can strengthen the social foundations in countries and contribute to a domestic environment where human rights, good governance, and the rule of law are all respected.
I am sure that is something that all members in the House firmly believe to be the foundation of every nation. This agreement will create new business opportunities and assist with developing a predictable and prosperous future for Ukraine.
The beauty of the agreement, however, is that it is mutually beneficial. It has opportunities for both Ukraine and Canada. Tariff elimination will improve access to each other's markets and thus help to expand commerce between Canada and Ukraine. 
Upon implementation, the Canada-Ukraine FTA will result in an immediate elimination of tariffs on 86% of Canadian exports to Ukraine. This is very significant. The remaining tariffs will be phased out over seven years on industrial products, fish and seafood, and essentially all agricultural goods exported by Canada.
Ukraine is an interesting market for Canadian exporters with opportunities in areas such as aerospace, agricultural equipment, information and communication technologies, agriculture, agrifood, fish and seafood, and mining equipment. At the same time Canada will eliminate tariffs on 99.9% of imports from Ukraine. This stands to benefit Ukrainian exporters for products such as sunflower oil, sugar and chocolate, baked goods, vodka, apparel, ceramics, and mineral products.",Liberal,Saint-Maurice—Champlain,François-Philippe Champagne,http://www.parl.gc.ca/MembersOfParliament/ProfileMP.aspx?Key=229217&Language=E
4697767,ca.proc.d.2017-02-10.p4742477,2017-02-10,,,,intervention,Government Orders,Canada-Ukraine Free Trade Agreement Implementation Act,, Vodka.,,,An hon. member,
4697768,ca.proc.d.2017-02-10.p4742478,2017-02-10,c049fb93-b7d8-4021-8fc6-cf1c69f7200b,229217,Hon. François-Philippe Champagne,,Government Orders,Canada-Ukraine Free Trade Agreement Implementation Act,," Mr. Speaker, I see members already interested in free trade. It is only Friday morning, but I see a lot of support in the House for free trade.
Beyond tariff reductions, the FTA includes disciplines and commitments on non-tariff measures that will help ensure that market access gains are not constrained by unjustified trade barriers. This agreement also includes commitments on trade facilitation that are designed to reduce red tape at the border. These provisions will increase certainty and predictability for businesses, something that Canadian businesses across our country will want to see.
Furthermore, the Canada-Ukraine FTA reflects this government's commitment to a progressive approach to trade in trying to ensure that trade reflects Canadian values such as environmental protection and labour rights. This agreement therefore includes comprehensive provision in the areas of labour, environment, transparency, and anti-corruption.
As part of this free trade agreement, Canada and Ukraine have agreed on anti-corruption provisions to protect human rights. Under this agreement, Canada and Ukraine have committed to ensuring that companies can be held responsible for human rights violations.
The agreement also encourages both countries to look at implementing legal protection for whistleblowers. Time and again, Canada has shown that it considers protecting workers' rights a priority. It has negotiated labour protection provisions in the free trade agreements it is a party to, provisions that are essential to upholding human rights. The labour provisions in the free trade agreement with Ukraine will ensure that workers' basic rights are protected in both countries.
Canada and Ukraine also agreed to uphold the standards in the International Labour Organization's 1998 Declaration on Fundamental Principles and Rights at Work. To do so, both parties must comply with labour laws governing standards pertaining to minimum wage, hours of work, and workplace health and safety. The labour provisions protect the right to collective bargaining and freedom of association. Child labour, forced labour, and discrimination at work are forbidden. The Canadian labour movement made a vital contribution to promoting equality for women, indigenous peoples, and people with disabilities.
One of our government's priorities is to strengthen the middle class and ensure that all Canadians benefit from trade. Canada's long-term prosperity depends on broad access to foreign markets because trade is a driver of our country's growth and economic success. It enables Canadian businesses to grow, gives Canadian consumers access to a variety of products at competitive prices, and creates jobs for the middle class.
In closing, that is exactly what the free trade agreement with Ukraine is intended to do. I want to thank all members who are here this morning for adding their support by voting in favour of the Canada-Ukraine agreement. This support will help ensure that Canada remains a model of global progressive trade as well as a world leader that chooses to do business with a country like Ukraine, so that people on both sides of the Atlantic can benefit from a progressive trade agreement.",Liberal,Saint-Maurice—Champlain,François-Philippe Champagne,http://www.parl.gc.ca/MembersOfParliament/ProfileMP.aspx?Key=229217&Language=E
4697769,ca.proc.d.2017-02-10.9365527,2017-02-10,4437c848-d8c7-4a39-a948-1539969f3a90,218734,"Ms. Marilyn Gladu (Sarnia—Lambton, CPC)",,Government Orders,Canada-Ukraine Free Trade Agreement Implementation Act,,"Mr. Speaker, I want to thank my colleague for his speech and congratulate him on his new responsibilities.
My question is with respect to the area of corruption. The member mentioned that there are measures taken to prevent corruption. I am interested in hearing more about how we will prevent people from making deals with their buddies, and those kinds of things. Could he elaborate a bit on those measures?",Conservative,Sarnia—Lambton,Marilyn Gladu,http://www.parl.gc.ca/MembersOfParliament/ProfileMP.aspx?Key=218734&Language=E
4697770,ca.proc.d.2017-02-10.9365530,2017-02-10,c049fb93-b7d8-4021-8fc6-cf1c69f7200b,229217,Hon. François-Philippe Champagne,,Government Orders,Canada-Ukraine Free Trade Agreement Implementation Act,,"Mr. Speaker, my colleague has always been a great supporter, and someone for whom I have a lot of respect.
It is very important that we talk about that this morning. When we talk about progressive trade, what Canada stands for in these trade agreements is to try to move the bar higher in a number of countries with respect to that. There is a whole chapter in the agreement with respect to terms of transparency and anti-corruption. It would require legislation in the jurisdiction we are talking about and would make acts of bribery a criminal offence, as well as imposing sanctions that reflect the gravity of these acts and the negative impacts they have on the poorest people. We know that corruption disproportionately affects poor people, and those who are working hard to join the middle class. Lastly, any enterprises doing so will be liable for the crimes that they commit.
I am happy to receive that question, because it shows on the record how, when we talk about progressive trade, we can help people in a concrete fashion.",Liberal,Saint-Maurice—Champlain,François-Philippe Champagne,http://www.parl.gc.ca/MembersOfParliament/ProfileMP.aspx?Key=229217&Language=E
4697771,ca.proc.d.2017-02-10.9365542,2017-02-10,dfce868a-f590-4d20-b1b6-4e08a3e5b669,217195,"Mr. Wayne Stetski (Kootenay—Columbia, NDP)",,Government Orders,Canada-Ukraine Free Trade Agreement Implementation Act,,"Mr. Speaker, I would like to thank my colleague, the Minister of International Trade, for sharing his time with me today. Because we will be supporting the bill at third reading, I am sure it has made it easier for him.
As well, we support the bill because of the inclusion of clauses relating to environment, labour, and corruption, and because of what it does not include, which are investor-state provisions and forcing municipalities to be part of the agreement. I will talk more on that later.
I recently heard from a Republican senator that, from the U.S. perspective, Americans think that trade agreements are not only important because of the trade aspects, but also because of what they do for world peace. Therefore, I would be interested in my colleague's comment on that approach to trade.",New Democratic Party,Kootenay—Columbia,Wayne Stetski,http://www.parl.gc.ca/MembersOfParliament/ProfileMP.aspx?Key=217195&Language=E
4697772,ca.proc.d.2017-02-10.9365545,2017-02-10,c049fb93-b7d8-4021-8fc6-cf1c69f7200b,229217,Hon. François-Philippe Champagne,,Government Orders,Canada-Ukraine Free Trade Agreement Implementation Act,,"Mr. Speaker, I thank my colleague from Kootenay—Columbia, but I also want to thank him on behalf of the people of Ukraine and Canada for supporting this agreement. He has made the point as to how progressive trade and these agreements are good for the world. When we set an ambitious agenda for Canada with respect to progressive trade, whether we are talking about labour standards, or the environment, something that I know the member, and I think all members in this House, care a lot about, that is exactly the voice that people in the world want to hear.
 This morning, I had the privilege of meeting with a number of ambassadors. People are asking Canada to seize the moment, to show the world that we can think about open trade and move the bar by working together. There is no greater pleasure for me than to stand here today, knowing that this has bipartisan support. We are sending a strong message, not only to Ukraine, but to the world, that Canada will always stand behind free trade, will always stand for open societies, and will always stand for the environment. We will be true to our values. Our Canadian values will be exported to our trade agreement, and those in the world who are like-minded will benefit. It is all about people. This agreement will improve the lives of people. I am sure that the constituents in my colleague's riding and in mine, as well as the good people of Ukraine, will benefit from what we are doing today. This is an historic moment.",Liberal,Saint-Maurice—Champlain,François-Philippe Champagne,http://www.parl.gc.ca/MembersOfParliament/ProfileMP.aspx?Key=229217&Language=E
4697773,ca.proc.d.2017-02-10.9365556,2017-02-10,dfce868a-f590-4d20-b1b6-4e08a3e5b669,217195,"Mr. Wayne Stetski (Kootenay—Columbia, NDP)",,Government Orders,Canada-Ukraine Free Trade Agreement Implementation Act,,"Mr. Speaker, I would like to thank the member for Saint-Maurice—Champlain for sharing his time today.
New Democrats support deepening trade relationships with Ukraine, particularly as it reaches out to the west while trying to deal with ongoing tensions and problems in Russia. We very much support this agreement, and we have, of course, for many years supported improvement of Canada–Ukraine relations. We support this particular agreement because of the lower tariffs on Canadian exports, but it will also do a lot more. This is the kind of bilateral trade that the NDP can support, for a number of reasons, and I will speak to those in a minute.
What is good about this agreement is that it contains chapters on rules of origin, trade facilitation, trade remedies, state-owned enterprises, government procurement, intellectual property, environment, labour, and a state-to-state dispute settlement mechanism. The labour chapter includes comprehensive and enforceable provisions and is the most comprehensive labour chapter ever negotiated by Ukraine. This could raise the bar on labour standards for Ukrainian workers, which is important to us in the NDP. 
What it does not include is equally important, as I alluded to earlier. It would not bring in investor-state provisions that would allow corporations to sue Canada. For the life of me, I cannot figure out why we ever got those clauses in any of our trade agreements. It does not seem right that a corporation can sue Canada if it does not like the fact that we are looking after our own interests.
There are other reasons besides trade that I think this agreement is important. I want to thank the member for Laurier—Sainte-Marie for giving me the opportunity to travel to Ukraine in January as part of the foreign affairs and international development committee trip. What is interesting about being in Ukraine is the challenges it has. Of course, the major challenge is the war with the Russian-backed rebels in the eastern part of Ukraine. That took a step in the wrong direction about a week ago, so it continues to have impacts. Over a million refugees have been created by this war. We do not hear much about that because they are not living in tent camps. We do not get the same kind of visuals that we get from Syria. However, over one million refugees have been created from this ongoing war in Ukraine, and Ukraine is at war.
It is easy to sit in the comfort of our homes back in our ridings and not understand what is going on across the world. This trade agreement is important, because it sends a message to Russia that Canada is there and that we care about Ukraine.
One of the things that Ukrainians are doing is fighting corruption. What makes Ukraine so exciting is that this new push for democracy is being led by youth. It is amazing to see what is happening as a result of those youth and the involvement from civil society in Ukraine. 
There are a couple of examples of what Ukrainians are doing to deal with the corruption. The RCMP are over there helping to train Ukraine's new police force. The reason the Ukrainians need a new police force is that they have fired 25,000 patrol officers in the last two years. These patrol officers earned most of their living by taking bribes. They fired all 25,000 of them. They have hired 11,000 new members. New members have to be 35 years of age or younger to get on the force, because Ukrainians want a new demographic with a new set of values involved in the police going forward. We were able to watch some of the training of the new recruits in Ukraine, led by our own RCMP, who are respected around the world for our training abilities.
The Ukrainians also fired all of their Supreme Court judges, and they are looking to hire new judges. They expect another 2,000 judges to be fired this year in Ukraine. They are working hard to clean up the corruption there.
 Democracy is interesting. One of the reasons that Mr. Putin is invading Ukraine and that he took over Crimea is because of the fact that Ukraine is working hard to become a democratic country. I met with a number of members of civil society, and what was interesting for parliamentarians in the room is that civil society actually drafts most of the legislation in Ukraine. Youthful people get together, they draft the legislation, and they pass it on to the members of parliament who then work on it to bring it into law. It is democracy at its finest, in the sense that it is driven very much from the ground up.
Related to that is that many of us over the years have had Ukrainian parliamentary interns. That program is in financial jeopardy this year, I believe. It would be great to see some kind of sponsorship or support for that program. I have met a number of interns over the last year; it was my first time as a member of Parliament. They were so excited about democracy, taking Canadian values back to Ukraine, and making a difference in that country. I hope that the parliamentary intern program can continue. 
In terms of the military, Ukraine is working on building up its military. It wants to have 250,000 trained troops. It also needs to bring up the training to a standard that is acceptable to NATO. That is what Canada is over there helping them with right now. We are trying to bring the Ukrainian military forces up to a standard so that NATO will accept Ukraine as part of the group. We are not there yet, but that is the target.
We live in pretty isolated circumstances here in Canada. Unless we get the opportunity to travel and see what is happening in these countries, we do not realize what is going on. Some of the sayings that are important there, such as, “If you want peace in that part of Europe, prepare for war”, sound awfully hawkish coming from a dove. However, having been there, I absolutely believe that we need a military deterrent in Europe, Asia, and anywhere surrounding Russia. It is important that we see that happen in Ukraine. 
I want to go back a bit to the free trade agreement and the fact that municipalities are not included in this particular agreement. When I was mayor of Cranbrook and heard that way off in Ottawa they were signing an agreement that was going to make it difficult for me, as mayor of my community, to support local businesses over foreign businesses, it was not very well received, quite frankly. Therefore, I am very happy to see that this agreement does not include municipalities. We have had the same reaction from the school board in my riding of Kootenay—Columbia. This agreement does not include school boards either. 
This is an excellent agreement from a trade perspective. It is one that we should be using as an example for further trade agreements. However, the agreement is also important for building on the Canada-Ukraine friendship and letting Mr. Putin know that Canada will be there for the Ukraine. It is important for trade, but it is also important for world peace. ",New Democratic Party,Kootenay—Columbia,Wayne Stetski,http://www.parl.gc.ca/MembersOfParliament/ProfileMP.aspx?Key=217195&Language=E
4697774,ca.proc.d.2017-02-10.9365564,2017-02-10,6cef02a4-e5dd-44f0-9355-faf30afbb856,220020,"Mr. Borys Wrzesnewskyj (Etobicoke Centre, Lib.)",,Government Orders,Canada-Ukraine Free Trade Agreement Implementation Act,,"Mr. Speaker, I would like to thank our colleague across the way for all the work he has done on this file.
We have heard a lot about trade today. When we look at the numbers, trade is quite modest between our two countries. It has averaged around $285 million over the last five years. However, one of the interesting components to the agreement is the investment component and the fact that Ukraine has a free trade association agreement with the European Union, which allows small and medium-size Canadian businesses.
 A lot of these free trade agreements only look at the big corporate entities. They are already in the European Union. However, small and medium-size Canadian businesses would now have an opportunity to invest in Ukraine, where capital costs are significantly lower than they would be in a place like Germany. Also, manufacturing costs are a lot lower. Therefore, there is an opportunity for small and medium-sized businesses to invest in Ukraine as a gateway into Europe, and, vice versa, small and medium-sized Ukrainian businesses to invest in Canada and the North American market. I wonder if my colleague would like to speak to that particular point.",Liberal,Etobicoke Centre,Borys Wrzesnewskyj,http://www.parl.gc.ca/MembersOfParliament/ProfileMP.aspx?Key=220020&Language=E
