basepk,hid,speechdate,pid,opid,speakeroldname,speakerposition,maintopic,subtopic,subsubtopic,speechtext,speakerparty,speakerriding,speakername,speakerurl
4699882,ca.proc.d.2017-02-23.9400705,2017-02-23,85738a00-0a16-4a6f-89c7-9f045782d1fd,217331,"Mr. Richard Cannings (South Okanagan—West Kootenay, NDP)",,Government Orders,Business of Supply,Opposition Motion—Impact of Carbon Taxes,"Madam Speaker, I would like to ask the member a question about the Liberals' commitment to action on climate change. We have mainly seen the downloading of all responsibility to the provinces. The federal government seems to have no plan. It has a framework, and I always worry when I see the word “framework”, but it has no plan to actually do concrete work itself to tackle climate change.
One of the topics that was brought up today is the ecoENERGY retrofit program, a program that was brought in by the former Conservative government. It was very successful. It was so successful that the Conservatives cancelled it. I am wondering whether the member would support the government bringing that program back, a program that allowed Canadians to invest money in their homes to make them more energy efficient and to reduce greenhouse gases and bring jobs to communities. It was a win-win solution all around.",New Democratic Party,South Okanagan—West Kootenay,Richard Cannings,http://www.parl.gc.ca/MembersOfParliament/ProfileMP.aspx?Key=217331&Language=E
4699883,ca.proc.d.2017-02-23.9400724,2017-02-23,af4d6069-8435-4361-9a6f-d38c96e9d50a,215916,Mr. Francesco Sorbara,,Government Orders,Business of Supply,Opposition Motion—Impact of Carbon Taxes,"Madam Speaker, the framework and approach the Government of Canada has taken is to sit down and work with the provinces and territories to come up with a pan-Canadian framework. Each province and territory has a different electricity generation mix, a different consumption mix. We have said to the provinces and territories that we will work with them and come to an agreement. 
Each province has its own set of unique circumstances. The revenues collected by pricing carbon pollution, which leads to a better and stronger environment, a cleaner environment, and job growth, would flow directly to the provinces. It would be up to each individual province to use those revenues in the manner it sees fit to make investments in retrofit programs and assist those who may be impacted by pricing carbon pollution. 
At the end of the day, we have to work together to build a stronger, cleaner, and more prosperous country.",Liberal,Vaughan—Woodbridge,Francesco Sorbara,http://www.parl.gc.ca/MembersOfParliament/ProfileMP.aspx?Key=215916&Language=E
4699884,ca.proc.d.2017-02-23.9400742,2017-02-23,fa2cbab8-f429-402f-b603-ea918add87c3,216585,"Mr. Kevin Waugh (Saskatoon—Grasswood, CPC)",,Government Orders,Business of Supply,Opposition Motion—Impact of Carbon Taxes,"Madam Speaker, last week in the House, it was mentioned that recreation sites in the province of Ontario received astronomical power bills in December and January, over $10,000 a month. Since the Liberals have taken away the sports tax credit and the arts tax credit coast to coast, I wonder what the solution is for Ontario recreation facilities that are in the red right now and are worried that they cannot keep their recreation facilities open to the public.",Conservative,Saskatoon—Grasswood,Kevin Waugh,http://www.parl.gc.ca/MembersOfParliament/ProfileMP.aspx?Key=216585&Language=E
4699885,ca.proc.d.2017-02-23.9400766,2017-02-23,af4d6069-8435-4361-9a6f-d38c96e9d50a,215916,Mr. Francesco Sorbara,,Government Orders,Business of Supply,Opposition Motion—Impact of Carbon Taxes,"Madam Speaker, we have introduced what is called the Canada child benefit. This year alone it will put over $4.5 billion of incremental new investment in the pockets of Canadian families, versus the old program under the previous government. That works out to approximately $2,300 more, on average, per family. Nine out of 10 families are better off. It assists families to put their kids into recreational, arts, and fitness programs.",Liberal,Vaughan—Woodbridge,Francesco Sorbara,http://www.parl.gc.ca/MembersOfParliament/ProfileMP.aspx?Key=215916&Language=E
4699886,ca.proc.d.2017-02-23.9400777,2017-02-23,18e36567-4082-4ce3-a35b-d4aba65560ca,229508,"Mr. David Lametti (Parliamentary Secretary to the Minister of Innovation, Science and Economic Development, Lib.)",,Government Orders,Business of Supply,Opposition Motion—Impact of Carbon Taxes,"Madam Speaker, pricing pollution is the most efficient way to reduce greenhouse gas emissions and reach our objective to protect the environment and create a clean growth economy. For this reason, it is a foundational pillar of Canada's action on climate change.
The Government of Canada has demonstrated national leadership and has worked in partnership with provinces and territories to establish a pan-Canadian approach to pricing pollution. It is a core element of the pan-Canadian framework on clean growth and climate change released by Canada's first ministers on December 9, 2016. Under this framework, pricing pollution will apply to a broad set of emission sources throughout Canada, with increasing stringency over time in order to reduce GHG emissions at lowest cost to business and consumers, and to support innovation and clean growth.
As affirmed in the pan-Canadian framework, provinces and territories have flexibility to design their own pollution pricing policies adapted to their specific circumstances. Provinces and territories can put a direct price on carbon pollution, either through a direct price on pollution, like in British Columbia, or in implementing a hybrid system along the lines used in the Alberta model, or they can adopt a cap-and-trade system.
A federal pollution pricing backstop will apply in provinces and territories that do not have a pollution pricing system in place that meets that benchmark in 2018. Pollution pricing revenues will remain in the jurisdiction of origin, and each jurisdiction can use those revenues according to its needs. This gives provinces and territories the flexibility to decide how to reinvest pollution pricing revenue in their economies to support their workers and their families, and to minimize the impact on vulnerable groups.
Pollution pricing systems create an incentive for households and businesses to reduce their consumption of carbon intensive goods and fuels and to choose lower carbon alternatives. For example, households could choose to reduce fuel consumption by either using public transit more often or by replacing their vehicle with a more fuel efficient vehicle.
 The cost of pollution pricing to households will vary by province and territory, depending in part on differences in energy and fuel consumption, and the electricity generation mix across provinces and territories. The cost to households will also depend on the design of pollution pricing policies introduced by each jurisdiction as well as the decisions they make as to how to use the revenues from pollution pricing.
An illustrative modelling scenario conducted by Environment and Climate Change Canada estimates that the average increase in the cost of energy to households across Canada would be $290 per year when the backstop pollution price reaches $50 per tonne in 2022. This captures the increase in the fuel price, approximately 12¢ per litre, and a modest reduction in the amount of energy used by the average family. Further analyses on the economic impacts of pollution pricing, including analyses of impacts on households and businesses, will become available as each province and territory clarifies the precise design of its pollution pricing system, including how it will utilize its revenues and as experience is gained.
It is important to recognize that the goods and services purchased by low-income people are usually not more carbon intensive than those purchased by higher-income earners. Accordingly, a direct price on pollution does not exhibit a greater burden on low-income families. However, because low-income earners spend a greater share of their income, they may be disproportionately impacted by any price on consumption unless specific measures are taken to compensate them.
There are a number of ways to protect low-income Canadians and vulnerable communities from price increases associated with pollution pricing. Revenue generated from pricing pollution can be used in a variety of ways. Under the pan-Canadian approach to pricing pollution, all revenues raised, as we have stated, will remain in the province or territory of origin. 
This gives provinces and territories maximum flexibility to decide how to reinvest the revenue from pollution pricing in their own economies and work to support their workers and their families, and to minimize the impact on other vulnerable groups. Provinces and territories can choose to use pollution pricing revenues to compensate low-income and middle-income families for higher energy costs, for example, while still maintaining an incentive to reduce energy use and thereby helping to reduce emissions. 
For example, British Columbia provides a tax credit for low-income families and has made its direct price on carbon revenue-neutral by reducing income taxes for British Columbians and for businesses operating in the province.
Alberta's pollution pricing system includes rebates for low- and middle-income households to offset the cost of the carbon levy charged on fuels used for transportation and heating. The Government of Alberta has estimated that six out of 10 households will receive a rebate to compensate them for the cost of the carbon levy. For example, the full rebate amount for a household with two adults and two children will be $540 annually in 2018, when Alberta's carbon levy reaches $30 per tonne of carbon dioxide. This will exceed Alberta's estimate of the total annual cost of the levy for a household with two adults and two children, which is $508 for 2018. Alberta has stated that it will provide the full rebate amount for couples and families earning less than $95,000 per year and for singles earning less than $47,500 per year.
The approach chosen by the Province of Ontario is to include, in its climate action plan, investments that low-income individuals and households stand to benefit from. Ontario plans to spend $380 million to $500 million on social housing retrofits, starting in 2017-18, to improve comfort for residents and to save money for social housing providers to use to make other improvements.
Ontario also plans to consider options for legislative and regulatory changes that would lessen the impact of pollution pricing on all tenants who rent their housing to make sure that pollution pricing is not passed on to tenants who are unable to make changes to reduce energy use.
In addition, Ontario plans to invest $45 million to $75 million in post-secondary training and innovation to ensure that the province has the capacity to build, maintain, and repair low-carbon buildings. This will include training for first nation and Métis peoples. Low-carbon jobs and training partnerships will be established among post-secondary institutions and indigenous communities.
 The Government of Canada is committed to working with all provincial, territorial, and indigenous partners in ensuring that vulnerable groups, including indigenous peoples and low-income Canadians, are protected from any significant price increases resulting from pollution pricing.
Our climate is already changing, and Canadians are already feeling the effects. In the past, in some dream world, pollution was treated as an externality that people did not have to pay for and that the market did not have to worry about it. In fact, economists are telling us that it is time to internalize that so-called externality, make the price of pollution part of the market price of goods and services, and then let markets and governments take care of it. This is the approach taken by Patrick Brown, for example, who is the leader of the Conservative Party in Ontario.
The changes have already begun. Extreme weather, in the form of droughts and floods, is increasing in frequency. North of 60°, the average annual temperature has tripled, compared to the global average, since the middle of the last century. Snow, sea ice, glaciers, and permafrost are all in rapid decline.
 We must address climate change now for the well-being of our people, our communities, and our economy and most of all, as a parent, for our children and grandchildren. We can no longer afford to not take action.",Liberal,LaSalle—Émard—Verdun,David Lametti,http://www.parl.gc.ca/MembersOfParliament/ProfileMP.aspx?Key=229508&Language=E
4699887,ca.proc.d.2017-02-23.9400896,2017-02-23,53eb10e4-f8e7-4ef7-9448-b4a10ec1dba3,217051,"Mrs. Cathay Wagantall (Yorkton—Melville, CPC)",,Government Orders,Business of Supply,Opposition Motion—Impact of Carbon Taxes,"Madam Speaker, the truth of the matter is that Canada absorbs almost four times as much carbon as it emits. Because of the size of our country, our forests, our wetlands, and our farm land, we absorb more carbon than we can create.
At the same time, we are very aware, in my province of Saskatchewan, of how important it is that we be good stewards of what we have. When our provinces were approached by the government to take on more responsibility for taking care of our environment, they were given five options, before they were blindsided, again, by the government and told that they had option one or option two.
In Saskatchewan, our people respond to incentives, not punitive measures. We were ready to continue with what we are already doing with incentives for innovation and research and making things better. We already do some of the best farming and best industry in the country.
Coal in Estevan was visited by the minister, and she made very little mention of it. I am wondering if the member would like to respond to my question. Why are we willing to sell our seniors' care to a company from China, where some of the worst pollution exists, when we could be selling them our innovation—",Conservative,Yorkton—Melville,Cathay Wagantall,http://www.parl.gc.ca/MembersOfParliament/ProfileMP.aspx?Key=217051&Language=E
4699888,ca.proc.d.2017-02-23.9400915,2017-02-23,cedf1659-ebb1-4f26-b723-5c7c5353988b,214948,The Assistant Deputy Speaker (Mrs. Carol Hughes),,Government Orders,Business of Supply,Opposition Motion—Impact of Carbon Taxes,"I just want to remind members that there are only five minutes for questions and comments. If members could keep their questions much shorter, that would be great.
The hon. parliamentary secretary.",New Democratic Party,Algoma—Manitoulin—Kapuskasing,Carol Hughes,http://www.parl.gc.ca/MembersOfParliament/ProfileMP.aspx?Key=214948&Language=E
4699889,ca.proc.d.2017-02-23.9400917,2017-02-23,18e36567-4082-4ce3-a35b-d4aba65560ca,229508,Mr. David Lametti,,Government Orders,Business of Supply,Opposition Motion—Impact of Carbon Taxes,"Madam Speaker, I realize full well that we lost 10 years on innovation and having an innovation policy under the previous government, because they had none, and we missed an example--",Liberal,LaSalle—Émard—Verdun,David Lametti,http://www.parl.gc.ca/MembersOfParliament/ProfileMP.aspx?Key=229508&Language=E
4699890,ca.proc.d.2017-02-23.9400921,2017-02-23,cedf1659-ebb1-4f26-b723-5c7c5353988b,214948,The Assistant Deputy Speaker (Mrs. Carol Hughes),,Government Orders,Business of Supply,Opposition Motion—Impact of Carbon Taxes,"Order, please. I just want to remind members that when someone has the floor to have the respect to allow that person to answer. The member provided such respect while the question was being posed, so the same would be greatly appreciated.
The hon. parliamentary secretary.",New Democratic Party,Algoma—Manitoulin—Kapuskasing,Carol Hughes,http://www.parl.gc.ca/MembersOfParliament/ProfileMP.aspx?Key=214948&Language=E
4699891,ca.proc.d.2017-02-23.9400926,2017-02-23,18e36567-4082-4ce3-a35b-d4aba65560ca,229508,Mr. David Lametti,,Government Orders,Business of Supply,Opposition Motion—Impact of Carbon Taxes,"Madam Speaker, this carbon pricing plan our government has worked out with the territories and provinces is coupled with an innovation agenda that is breathtaking. We are going to move ahead to make sure that we profit from the clean, green economy so that we can work with innovative people in Saskatchewan and other parts of the country to make all of this work.",Liberal,LaSalle—Émard—Verdun,David Lametti,http://www.parl.gc.ca/MembersOfParliament/ProfileMP.aspx?Key=229508&Language=E
4699892,ca.proc.d.2017-02-23.9400936,2017-02-23,85738a00-0a16-4a6f-89c7-9f045782d1fd,217331,"Mr. Richard Cannings (South Okanagan—West Kootenay, NDP)",,Government Orders,Business of Supply,Opposition Motion—Impact of Carbon Taxes,"Madam Speaker, I want to ask the member opposite about the Liberals' commitment to climate change. We heard so many good words coming out of Paris, but now the federal government has adopted the former Conservative government's weak targets for greenhouse gas reductions, and these targets will not get us anywhere near the greenhouse gas reductions we are seeking. 
I am just wondering where and when we will hear a concrete plan from the federal government on how we will meet those targets. Right now we are putting it off so that our grandchildren will have to deal with this.",New Democratic Party,South Okanagan—West Kootenay,Richard Cannings,http://www.parl.gc.ca/MembersOfParliament/ProfileMP.aspx?Key=217331&Language=E
4699893,ca.proc.d.2017-02-23.9400952,2017-02-23,18e36567-4082-4ce3-a35b-d4aba65560ca,229508,Mr. David Lametti,,Government Orders,Business of Supply,Opposition Motion—Impact of Carbon Taxes,"Madam Speaker, I thank the hon. member for his question and his dedication on environmental issues.
There are many steps this government has to take to reach our climate change goals. I share the concerns raised by the hon. member.
 We have the provinces on board with this pan-Canadian strategy. We will keep moving forward on reducing gas emissions, and hopefully, at some point, we will reach a point where we are satisfied with both the lowering of emissions and the targets that are in place.",Liberal,LaSalle—Émard—Verdun,David Lametti,http://www.parl.gc.ca/MembersOfParliament/ProfileMP.aspx?Key=229508&Language=E
4699894,ca.proc.d.2017-02-23.9400962,2017-02-23,3ee3ccd6-802d-454e-9dcf-61a7a017bdf7,226908,"Ms. Dianne L. Watts (South Surrey—White Rock, CPC)",,Government Orders,Business of Supply,Opposition Motion—Impact of Carbon Taxes,"Madam Speaker, on the GST being charged on the carbon tax that is already being implemented, will the government stop taking revenues from the GST to make it revenue neutral?",Conservative,South Surrey—White Rock,Dianne Lynn Watts,http://www.parl.gc.ca/MembersOfParliament/ProfileMP.aspx?Key=226908&Language=E
4699895,ca.proc.d.2017-02-23.9400966,2017-02-23,18e36567-4082-4ce3-a35b-d4aba65560ca,229508,Mr. David Lametti,,Government Orders,Business of Supply,Opposition Motion—Impact of Carbon Taxes,"Revenue neutrality, Madam Speaker, is something that will be determined by each province and territory. That is why they have the flexibility to create and craft the kind of program and policy they feel is best for their province or territory.",Liberal,LaSalle—Émard—Verdun,David Lametti,http://www.parl.gc.ca/MembersOfParliament/ProfileMP.aspx?Key=229508&Language=E
