basepk,hid,speechdate,pid,opid,speakeroldname,speakerposition,maintopic,subtopic,subsubtopic,speechtext,speakerparty,speakerriding,speakername,speakerurl
4730206,ca.proc.d.2017-12-01.9832630,2017-12-01,8c04baa6-daad-4fe5-8413-3973a24a2760,234592,"Hon. Maxime Bernier (Beauce, CPC)",,Government Orders,"Budget Implementation Act, 2017, No. 2",,"Mr. Speaker, speaking of equalization, is my colleague proud of the fact that Quebec receives so much money through equalization, more than $10 billion? Should Quebec not strive to stop receiving equalization payments? That would make Quebec a “have” province.
Should we not be making sure that Quebec becomes a wealthy province instead of a poorer province that needs higher equalization payments?",Conservative,Beauce,Maxime Bernier,http://www.parl.gc.ca/Parliamentarians/en/members/maxime-bernier(234592)
4730207,ca.proc.d.2017-12-01.9832632,2017-12-01,f45e86b7-f192-4692-9889-6b57283fc3b0,224178,Mr. Gabriel Ste-Marie,,Government Orders,"Budget Implementation Act, 2017, No. 2",,"Mr. Speaker, all federations use equalization programs to prevent certain regions from losing their populations to regions with more wealth. In the beginning, the program was developed to help a western province, Saskatchewan, I believe. The objective is to redistribute wealth.
We know the government makes choices based on economic development. These choices benefit the banking and automotive sectors in Toronto, for example. These choices also benefit fossil fuels in the west. In making these choices, the government neglected other segments of the economy, such as the Davie shipyard, which I mentioned earlier.
We are talking about several tens of billions of dollars in the coming decades. Half of this money should normally have returned to the Davie shipyard. If Quebec had received this money in return for the taxes it pays the federal government, we would not need equalization. Quebec could pay. 
Equalization is the result of political choices made here and of choices made at the expense of Quebec and my people. That is why we are here to speak out against the situation.
This is about Bill C-63. With all due respect to my colleague from Beauce, he could have spoken about the situation we want to denounce. The government is resorting to predatory federalism and is appropriating another tax. This is what we are condemning. I would be very happy if my colleague supported us.",Bloc Québécois,Joliette,Gabriel Ste-Marie,http://www.parl.gc.ca/Parliamentarians/en/members/gabriel-ste-marie(224178)
4730208,ca.proc.d.2017-12-01.9832648,2017-12-01,07cf5767-802c-406c-92a7-7dc92af79b40,229526,"Mr. Kevin Lamoureux (Parliamentary Secretary to the Leader of the Government in the House of Commons, Lib.)",,Government Orders,"Budget Implementation Act, 2017, No. 2",,"Mr. Speaker, I take an immense amount of pride in the province of Quebec. In fact, my heritage goes back to the province of Quebec. I have had the opportunity to travel there on a number of occasions. 
One of the things I really appreciate, and it does not matter what province one goes to, is that we have such a wonderful health care system. Yes, there is room for improvement. It could always be better. I am wondering if my colleague across the way would also acknowledge just how much the people of Canada genuinely appreciate our health care. That is why the health care accords with the provinces was so critically important.",Liberal,Winnipeg North,Kevin Lamoureux,http://www.parl.gc.ca/Parliamentarians/en/members/kevin-lamoureux(229526)
4730209,ca.proc.d.2017-12-01.9832651,2017-12-01,48fc6e8f-3117-407b-bba3-bd6eede347ec,224672,"Hon. Bardish Chagger (Leader of the Government in the House of Commons and Minister of Small Business and Tourism, Lib.)",,Government Orders,Access to Information Act,Bill C-58—Notice of time allocation motion,"Mr. Speaker, I would like to advise that an agreement could not be reached under the provisions of Standing Orders 78(1) or 78(2) with respect to the third reading stage of Bill C-58, an act to amend the Access to Information Act and the Privacy Act and to make consequential amendments to other acts.
Under the provisions of Standing Order 78(3), I give notice that a minister of the crown will propose at the next sitting a motion to allot a specific number of days or hours for the consideration and disposal of proceedings at the said stage.",Liberal,Waterloo,Bardish Chagger,http://www.parl.gc.ca/Parliamentarians/en/members/bardish-chagger(224672)
4730210,ca.proc.d.2017-12-01.p5165424,2017-12-01,,,,stagedirection,Government Orders,"Budget Implementation Act, 2017, No. 2",,"The House resumed consideration of the motion that Bill C-63, A second Act to implement certain provisions of the budget tabled in Parliament on March 22, 2017 and other measures, be read the third time and passed.",,,,
4730211,ca.proc.d.2017-12-01.9832653,2017-12-01,f45e86b7-f192-4692-9889-6b57283fc3b0,224178,"Mr. Gabriel Ste-Marie (Joliette, BQ)",,Government Orders,"Budget Implementation Act, 2017, No. 2",,"Mr. Speaker, the Liberals are again moving closure. That is appalling. They said they would do things differently. It is really disappointing.
In response to my colleague's comments, we should be proud of our health system. A member of my family just underwent serious surgery, and I saw for myself the support provided to patients at the new CHUM.
I would like to remind members that, historically, half of the support for health services was to be provided by the federal government. That support has diminished over the years. The small amounts of money added recently are not nearly enough. This points to the problem of the fiscal imbalance and the difficulty the provinces have funding the health system properly.",Bloc Québécois,Joliette,Gabriel Ste-Marie,http://www.parl.gc.ca/Parliamentarians/en/members/gabriel-ste-marie(224178)
4730212,ca.proc.d.2017-12-01.9832667,2017-12-01,16c839d3-0183-4ed6-892a-8d7bdc37c474,214972,The Assistant Deputy Speaker (Mr. Anthony Rota),,Government Orders,"Budget Implementation Act, 2017, No. 2",,"It being 1:15 p.m., pursuant to order made Tuesday, November 28, 2017, it is my duty to interrupt the proceedings and put forthwith every question necessary to dispose of the third reading stage of the bill now before the House. 
Pursuant to Standing Order 69.1, the first question is on clause 48 in relation to agricultural and fisheries co-operatives. 
Is it the pleasure of the House to adopt the clause?",Liberal,Nipissing—Timiskaming,Anthony Rota,http://www.parl.gc.ca/Parliamentarians/en/members/anthony-rota(214972)
4730213,ca.proc.d.2017-12-01.p5165431,2017-12-01,,,,intervention,Government Orders,"Budget Implementation Act, 2017, No. 2",," Agreed.
 No.",,,Some hon. members,
4730214,ca.proc.d.2017-12-01.p5165433,2017-12-01,16c839d3-0183-4ed6-892a-8d7bdc37c474,214972,The Assistant Deputy Speaker (Mr. Anthony Rota),,Government Orders,"Budget Implementation Act, 2017, No. 2",, All those in favour of the clause will please say yea.,Liberal,Nipissing—Timiskaming,Anthony Rota,http://www.parl.gc.ca/Parliamentarians/en/members/anthony-rota(214972)
4730215,ca.proc.d.2017-12-01.p5165434,2017-12-01,,,,intervention,Government Orders,"Budget Implementation Act, 2017, No. 2",, Yea.,,,Some hon. members,
4730216,ca.proc.d.2017-12-01.p5165435,2017-12-01,16c839d3-0183-4ed6-892a-8d7bdc37c474,214972,The Assistant Deputy Speaker (Mr. Anthony Rota),,Government Orders,"Budget Implementation Act, 2017, No. 2",, All those opposed will please say nay.,Liberal,Nipissing—Timiskaming,Anthony Rota,http://www.parl.gc.ca/Parliamentarians/en/members/anthony-rota(214972)
4730217,ca.proc.d.2017-12-01.p5165436,2017-12-01,,,,intervention,Government Orders,"Budget Implementation Act, 2017, No. 2",, Nay.,,,Some hon. members,
4730218,ca.proc.d.2017-12-01.p5165437,2017-12-01,16c839d3-0183-4ed6-892a-8d7bdc37c474,214972,The Assistant Deputy Speaker (Mr. Anthony Rota),,Government Orders,"Budget Implementation Act, 2017, No. 2",," In my opinion, the yeas have it. 
 And five or more members having risen: 
 The recorded division on the clause stands deferred.
The next question is on clauses 139 and 163 in relation to the GST/HST rebate for public service bodies. Is it the pleasure of the House to adopt these clauses?",Liberal,Nipissing—Timiskaming,Anthony Rota,http://www.parl.gc.ca/Parliamentarians/en/members/anthony-rota(214972)
4730219,ca.proc.d.2017-12-01.p5165441,2017-12-01,,,,intervention,Government Orders,"Budget Implementation Act, 2017, No. 2",," Agreed.
 No.",,,Some hon. members,
4730220,ca.proc.d.2017-12-01.p5165443,2017-12-01,16c839d3-0183-4ed6-892a-8d7bdc37c474,214972,The Assistant Deputy Speaker (Mr. Anthony Rota),,Government Orders,"Budget Implementation Act, 2017, No. 2",, All those in favour will please say yea.,Liberal,Nipissing—Timiskaming,Anthony Rota,http://www.parl.gc.ca/Parliamentarians/en/members/anthony-rota(214972)
4730221,ca.proc.d.2017-12-01.p5165444,2017-12-01,,,,intervention,Government Orders,"Budget Implementation Act, 2017, No. 2",," Yea.
 No.",,,Some hon. members,
4730222,ca.proc.d.2017-12-01.p5165446,2017-12-01,16c839d3-0183-4ed6-892a-8d7bdc37c474,214972,The Assistant Deputy Speaker (Mr. Anthony Rota),,Government Orders,"Budget Implementation Act, 2017, No. 2",, All those opposed will please say nay.,Liberal,Nipissing—Timiskaming,Anthony Rota,http://www.parl.gc.ca/Parliamentarians/en/members/anthony-rota(214972)
4730223,ca.proc.d.2017-12-01.p5165447,2017-12-01,,,,intervention,Government Orders,"Budget Implementation Act, 2017, No. 2",, Nay.,,,Some hon. members,
4730224,ca.proc.d.2017-12-01.p5165448,2017-12-01,16c839d3-0183-4ed6-892a-8d7bdc37c474,214972,The Assistant Deputy Speaker (Mr. Anthony Rota),,Government Orders,"Budget Implementation Act, 2017, No. 2",," In my opinion the yeas have it.
 And five or more members having risen: 
 The recorded division on these clauses stands deferred.
The next question is on clauses 165 to 168 in relation to beer made concentrate. Is it the pleasure of the House to adopt these clauses?",Liberal,Nipissing—Timiskaming,Anthony Rota,http://www.parl.gc.ca/Parliamentarians/en/members/anthony-rota(214972)
4730225,ca.proc.d.2017-12-01.p5165452,2017-12-01,,,,intervention,Government Orders,"Budget Implementation Act, 2017, No. 2",," Agreed. 
 No. ",,,Some hon. members,
4730226,ca.proc.d.2017-12-01.p5165454,2017-12-01,,,,,Government Orders,"Budget Implementation Act, 2017, No. 2",, All those in favour of the clauses will please say yea. ,,,The Acting Deputy Speaker (Mr. Anthony Rota),
4730227,ca.proc.d.2017-12-01.p5165455,2017-12-01,,,,intervention,Government Orders,"Budget Implementation Act, 2017, No. 2",, Yea. ,,,Some hon. members,
4730228,ca.proc.d.2017-12-01.p5165456,2017-12-01,,,,,Government Orders,"Budget Implementation Act, 2017, No. 2",, All those opposed will please say nay. ,,,The Acting Deputy Speaker (Mr. Anthony Rota),
4730229,ca.proc.d.2017-12-01.p5165457,2017-12-01,,,,intervention,Government Orders,"Budget Implementation Act, 2017, No. 2",, Nay. ,,,Some hon. members,
4730230,ca.proc.d.2017-12-01.p5165458,2017-12-01,,,,,Government Orders,"Budget Implementation Act, 2017, No. 2",, In my opinion the yeas have it. ,,,The Acting Deputy Speaker (Mr. Anthony Rota),
4730231,ca.proc.d.2017-12-01.p5165459,2017-12-01,16c839d3-0183-4ed6-892a-8d7bdc37c474,214972,The Assistant Deputy Speaker (Mr. Anthony Rota),,Government Orders,"Budget Implementation Act, 2017, No. 2",, And five or more members having risen: ,Liberal,Nipissing—Timiskaming,Anthony Rota,http://www.parl.gc.ca/Parliamentarians/en/members/anthony-rota(214972)
4730232,ca.proc.d.2017-12-01.p5165460,2017-12-01,,,,,Government Orders,"Budget Implementation Act, 2017, No. 2",, The recorded division on these clauses stand deferred.,,,The Acting Deputy Speaker (Mr. Anthony Rota),
4730233,ca.proc.d.2017-12-01.p5165461,2017-12-01,16c839d3-0183-4ed6-892a-8d7bdc37c474,214972,The Assistant Deputy Speaker (Mr. Anthony Rota),,Government Orders,"Budget Implementation Act, 2017, No. 2",, The next question is on clause 261 in relation to the discharge of debt. Is it the pleasure of the House to adopt this clause? ,Liberal,Nipissing—Timiskaming,Anthony Rota,http://www.parl.gc.ca/Parliamentarians/en/members/anthony-rota(214972)
4730234,ca.proc.d.2017-12-01.p5165462,2017-12-01,,,,intervention,Government Orders,"Budget Implementation Act, 2017, No. 2",," Agreed.
 No.",,,Some hon. members,
4730235,ca.proc.d.2017-12-01.p5165464,2017-12-01,,,,,Government Orders,"Budget Implementation Act, 2017, No. 2",, All those in favour of the clause will please say yea. ,,,The Acting Deputy Speaker (Mr. Anthony Rota),
4730236,ca.proc.d.2017-12-01.p5165465,2017-12-01,,,,intervention,Government Orders,"Budget Implementation Act, 2017, No. 2",, Yea. ,,,Some hon. members,
4730237,ca.proc.d.2017-12-01.p5165466,2017-12-01,,,,,Government Orders,"Budget Implementation Act, 2017, No. 2",, All those opposed will please say nay. ,,,The Acting Deputy Speaker (Mr. Anthony Rota),
4730238,ca.proc.d.2017-12-01.p5165467,2017-12-01,,,,intervention,Government Orders,"Budget Implementation Act, 2017, No. 2",, Nay. ,,,Some hon. members,
4730239,ca.proc.d.2017-12-01.p5165468,2017-12-01,,,,,Government Orders,"Budget Implementation Act, 2017, No. 2",, In my opinion the yeas have it. ,,,The Acting Deputy Speaker (Mr. Anthony Rota),
4730240,ca.proc.d.2017-12-01.p5165469,2017-12-01,16c839d3-0183-4ed6-892a-8d7bdc37c474,214972,The Assistant Deputy Speaker (Mr. Anthony Rota),,Government Orders,"Budget Implementation Act, 2017, No. 2",, And five or more members having risen: ,Liberal,Nipissing—Timiskaming,Anthony Rota,http://www.parl.gc.ca/Parliamentarians/en/members/anthony-rota(214972)
4730241,ca.proc.d.2017-12-01.p5165470,2017-12-01,,,,,Government Orders,"Budget Implementation Act, 2017, No. 2",, The recorded division on clause 261 stands deferred. ,,,The Acting Deputy Speaker (Mr. Anthony Rota),
4730242,ca.proc.d.2017-12-01.p5165471,2017-12-01,16c839d3-0183-4ed6-892a-8d7bdc37c474,214972,The Assistant Deputy Speaker (Mr. Anthony Rota),,Government Orders,"Budget Implementation Act, 2017, No. 2",,The next question is on the remaining elements of the bill. Is it the pleasure of the House to adopt the remaining elements of the bill?,Liberal,Nipissing—Timiskaming,Anthony Rota,http://www.parl.gc.ca/Parliamentarians/en/members/anthony-rota(214972)
4730243,ca.proc.d.2017-12-01.p5165472,2017-12-01,,,,intervention,Government Orders,"Budget Implementation Act, 2017, No. 2",," Agreed.
 No",,,Some hon. members,
4730244,ca.proc.d.2017-12-01.p5165474,2017-12-01,,,,,Government Orders,"Budget Implementation Act, 2017, No. 2",, All those in favour of the remaining elements of the bill will please say yea.,,,The Acting Deputy Speaker (Mr. Anthony Rota),
4730245,ca.proc.d.2017-12-01.p5165475,2017-12-01,,,,intervention,Government Orders,"Budget Implementation Act, 2017, No. 2",, Yea. ,,,Some hon. members,
4730246,ca.proc.d.2017-12-01.p5165476,2017-12-01,,,,,Government Orders,"Budget Implementation Act, 2017, No. 2",, All those opposed will please say nay.,,,The Acting Deputy Speaker (Mr. Anthony Rota),
4730247,ca.proc.d.2017-12-01.p5165477,2017-12-01,,,,intervention,Government Orders,"Budget Implementation Act, 2017, No. 2",, Nay.,,,Some hon. members,
4730248,ca.proc.d.2017-12-01.p5165478,2017-12-01,,,,,Government Orders,"Budget Implementation Act, 2017, No. 2",, In my opinion the yeas have it.,,,The Acting Deputy Speaker (Mr. Anthony Rota),
4730249,ca.proc.d.2017-12-01.p5165479,2017-12-01,16c839d3-0183-4ed6-892a-8d7bdc37c474,214972,The Assistant Deputy Speaker (Mr. Anthony Rota),,Government Orders,"Budget Implementation Act, 2017, No. 2",, And five or members having risen: ,Liberal,Nipissing—Timiskaming,Anthony Rota,http://www.parl.gc.ca/Parliamentarians/en/members/anthony-rota(214972)
4730250,ca.proc.d.2017-12-01.p5165480,2017-12-01,,,,,Government Orders,"Budget Implementation Act, 2017, No. 2",, The recorded division on the remaining elements of the bill stands deferred.,,,The Acting Deputy Speaker (Mr. Anthony Rota),
4730251,ca.proc.d.2017-12-01.p5165481,2017-12-01,16c839d3-0183-4ed6-892a-8d7bdc37c474,214972,The Assistant Deputy Speaker (Mr. Anthony Rota),,Government Orders,"Budget Implementation Act, 2017, No. 2",,"Pursuant to Standing Order 45 the recorded divisions stand further deferred until Monday, December 4, at the ordinary hour of daily adjournment.",Liberal,Nipissing—Timiskaming,Anthony Rota,http://www.parl.gc.ca/Parliamentarians/en/members/anthony-rota(214972)
4730252,ca.proc.d.2017-12-01.9832683,2017-12-01,07cf5767-802c-406c-92a7-7dc92af79b40,229526,Mr. Kevin Lamoureux,,Government Orders,"Budget Implementation Act, 2017, No. 2",,"Mr. Speaker, I suspect if you were to canvass the House, you would find unanimous support to call the time 1:30 p.m. so we could begin private members' hour.",Liberal,Winnipeg North,Kevin Lamoureux,http://www.parl.gc.ca/Parliamentarians/en/members/kevin-lamoureux(229526)
4730253,ca.proc.d.2017-12-01.9832684,2017-12-01,16c839d3-0183-4ed6-892a-8d7bdc37c474,214972,The Assistant Deputy Speaker (Mr. Anthony Rota),,Government Orders,"Budget Implementation Act, 2017, No. 2",,Is that agreed?,Liberal,Nipissing—Timiskaming,Anthony Rota,http://www.parl.gc.ca/Parliamentarians/en/members/anthony-rota(214972)
4730254,ca.proc.d.2017-12-01.p5165484,2017-12-01,,,,intervention,Government Orders,"Budget Implementation Act, 2017, No. 2",, Agreed.,,,Some hon. members,
4730255,ca.proc.d.2017-12-01.9832686,2017-12-01,78336f0e-962c-47d2-a5b8-b59a26592789,217320,Mr. Matthew Dubé,,Government Orders,"Budget Implementation Act, 2017, No. 2",,"Mr. Speaker, the parliamentary secretary to the government in the House leader, when we forced the vote, which is obviously at the heart of the work we do here, heckled across the way “Jagmeet made me do it”. I am not quite sure what he was implying, what was being insinuated. I do not find it particularly appropriate, so I would ask that he either clarify or withdraw that inane comment.",New Democratic Party,Beloeil—Chambly,Matthew Dubé,http://www.parl.gc.ca/Parliamentarians/en/members/matthew-dube(217320)
4730256,ca.proc.d.2017-12-01.9832688,2017-12-01,07cf5767-802c-406c-92a7-7dc92af79b40,229526,Mr. Kevin Lamoureux,,Government Orders,"Budget Implementation Act, 2017, No. 2",,"Mr. Speaker, if I offended anyone with an inappropriate heckle, I would apologize for doing that.",Liberal,Winnipeg North,Kevin Lamoureux,http://www.parl.gc.ca/Parliamentarians/en/members/kevin-lamoureux(229526)
4730257,ca.proc.d.2017-12-01.9832689,2017-12-01,16c839d3-0183-4ed6-892a-8d7bdc37c474,214972,The Assistant Deputy Speaker (Mr. Anthony Rota),,Government Orders,"Budget Implementation Act, 2017, No. 2",,"It being 1:30 p.m., the House will now proceed to the consideration of private members' business as listed on today's Order Paper.",Liberal,Nipissing—Timiskaming,Anthony Rota,http://www.parl.gc.ca/Parliamentarians/en/members/anthony-rota(214972)
