basepk,hid,speechdate,pid,opid,speakeroldname,speakerposition,maintopic,subtopic,subsubtopic,speechtext,speakerparty,speakerriding,speakername,speakerurl
4730158,ca.proc.d.2017-12-01.9832221,2017-12-01,363e30d6-e47b-4c39-91ad-667deb63009c,217115,"Ms. Sheila Malcolmson (Nanaimo—Ladysmith, NDP)",,Routine Proceedings,Petitions,The Environment,"Mr. Speaker, because five bulk commercial anchorages, each for 300 metre long freighters in the Strait of Georgia, also known as the Salish Sea, are proposed to stop at Gabriola Island, petitioners from Nanaimo, Port Coquitlam, North Vancouver, Vancouver, and Gabriola Island urge the Minister of Transport to have the new anchorage proposal withdrawn.
 They cite the risks from oil spills, catastrophic storms, impacts on commercial and sport fishing, and tourism in the area. We urge the government to take their advice.",New Democratic Party,Nanaimo—Ladysmith,Sheila Malcolmson,http://www.parl.gc.ca/Parliamentarians/en/members/sheila-malcolmson(217115)
4730159,ca.proc.d.2017-12-01.9832223,2017-12-01,9225dd6b-e672-44d5-8bb7-c634b7e72f2e,217441,"Hon. Michelle Rempel (Calgary Nose Hill, CPC)",,Routine Proceedings,Petitions,Sittings of the House,"Mr. Speaker, sometimes I get asked if signing a petition makes a difference, but the 30,984 people who signed e-petition 983, asking the Liberals to reverse their decision to end Friday sittings and have the Prime Minister attend QP only once a week, made a difference by forcing them to reverse their decision.
 With that and on a Friday, I am pleased to table this petition, led by Kerri Frank, with my deep thanks to her and to all those who signed.",Conservative,Calgary Nose Hill,Michelle Rempel,http://www.parl.gc.ca/Parliamentarians/en/members/michelle-rempel(217441)
4730160,ca.proc.d.2017-12-01.9832225,2017-12-01,51d4e050-d737-4879-bead-20a3b672a36c,56126,"Hon. Diane Finley (Haldimand—Norfolk, CPC)",,Routine Proceedings,Petitions,Access to Education,"Mr. Speaker, I am pleased to present two petitions on behalf of constituents in my riding of Haldimand—Norfolk.
 The first petition is from constituents who are concerned about the insufficient amount of funding available for global education for girls. The petitioners call upon the government to increase Canada's funding on global education to $592 million by 2020. ",Conservative,Haldimand—Norfolk,Diane Finley,http://www.parl.gc.ca/Parliamentarians/en/members/diane-finley(56126)
4730161,ca.proc.d.2017-12-01.9832397,2017-12-01,51d4e050-d737-4879-bead-20a3b672a36c,56126,"Hon. Diane Finley (Haldimand—Norfolk, CPC)",,Routine Proceedings,Petitions,Religious Freedom,"Mr. Speaker, the second petition is from constituents who are deeply concerned about clause 14 of Bill C-51. As it stands, clause 14 would remove the only provision in the Criminal Code that directly protects the rights of individuals to freely practise their religion, whatever that religion may be.
 The petitioners call on the government to remove clause 14 from the legislation and to protect the religious freedom of all Canadians.",Conservative,Haldimand—Norfolk,Diane Finley,http://www.parl.gc.ca/Parliamentarians/en/members/diane-finley(56126)
4730162,ca.proc.d.2017-12-01.9832241,2017-12-01,16650588-6dad-4651-892b-32a2bbca8a4f,234503,"Mr. Peter Fragiskatos (London North Centre, Lib.)",,Routine Proceedings,Petitions,Organ Donation,"Mr. Speaker, yesterday was miracle day in the Ferguson and Lashbrook household. Three years ago, Doug Ferguson, a constituent in London North Centre, was able to live because he received a liver transplant. He can now enjoy life with Laurie, his wife, Sarah, Erika, and Duncan.
 I stand to present e-petition 1155, the result of Erika, his step-daughter's very hard work on this. She gathered 680 signatures on her own. It encourages more Canadians to consider organ donation. I applaud Erika's work.
 I salute the family for all the work it is doing to improve knowledge of this important issue. Doug is an outstanding community member and we are very fortunate to have him.",Liberal,London North Centre,Peter Fragiskatos,http://www.parl.gc.ca/Parliamentarians/en/members/peter-fragiskatos(234503)
4730163,ca.proc.d.2017-12-01.9832243,2017-12-01,07cf5767-802c-406c-92a7-7dc92af79b40,229526,"Mr. Kevin Lamoureux (Parliamentary Secretary to the Leader of the Government in the House of Commons, Lib.)",,Routine Proceedings,Questions on the Order Paper,,"Mr. Speaker, today the following questions will be answered: Questions Nos. 1230, 1231 and 1236. ",Liberal,Winnipeg North,Kevin Lamoureux,http://www.parl.gc.ca/Parliamentarians/en/members/kevin-lamoureux(229526)
4730164,ca.proc.d.2017-12-01.p5165258,2017-12-01,b6850f16-57dc-486c-b5bb-0fd191022af4,218535,Mr. Garnett Genuis,,Routine Proceedings,Questions on the Order Paper,Question No. 1230," With regard to expenditures on private security firms in Myanmar: (a) which private security firms have been utilized in Myanmar since January 1, 2017; (b) what specific actions is the government taking to ensure that private security forces receiving government expenditures do not participate in violence against Rohingyas or other minorities; (c) is the government aware of any firms referred to in (a) participating in violence against Rohingyas or other minorities; and (d) if the answer to (c) is affirmative, what specific actions did the government take against such firms?",Conservative,Sherwood Park—Fort Saskatchewan,Garnett Genuis,http://www.parl.gc.ca/Parliamentarians/en/members/garnett-genuis(218535)
4730165,ca.proc.d.2017-12-01.p5165259,2017-12-01,3dd9162a-4763-4000-8c8a-706a788f7e50,229209,"Hon. Chrystia Freeland (Minister of Foreign Affairs, Lib.)",,Routine Proceedings,Questions on the Order Paper,Question No. 1230,"Mr. Speaker, with regard to (a), since January 1, 2017, the Embassy of Canada to Myanmar in Yangon has utilized one private security firm, IDG Myanmar Co. Ltd.
With regard to (b), as part of the embassy’s due diligence process in contracting a security firm to provide a security guard for the embassy, market research is conducted to identify capable suppliers, which includes but is not limited to referrals from other embassies or international organizations, and online and local research. IDG has provided and provides security services in Myanmar including guarding services and security training to the UN, EU, the Norwegian Embassy, and the British Embassy. Positive recommendations have been received from the UN and the Norwegian Embassy. The contract award is based on predetermined evaluation criteria and methods of selection assessing several areas such as experience, capacity, capability, transition plan, and price. The contracted security firm, IDG Myanmar Co. Ltd, has provided effective, professional security services for the embassy since its opening in 2014.
Contract clauses used within Global Affairs Canada ensure that security providers must be in compliance with local law and that they abide by specific governance and ethics clauses including anti-terrorism and international sanctions. Canada may terminate this contract, or reduce or suspend any payments under it if the contractor fails to honour the provisions within these clauses. These contracts are also subject to the integrity provisions policy and directive.
IDG Myanmar Co. Ltd is part of the IDG group of international security companies, a member in good standing of the International Code of Conduct Association, ICoCA, for private security companies. ICoCA member companies must submit to ongoing and independent monitoring, auditing, and verification of conduct, including adherence to international human rights standards.
With regard to (c) and (d), we have no indication that IDG Myanmar Co. Ltd has participated in violence against the Rohingyas or other minorities. ",Liberal,University—Rosedale,Chrystia Freeland,http://www.parl.gc.ca/Parliamentarians/en/members/chrystia-freeland(229209)
4730166,ca.proc.d.2017-12-01.p5165264,2017-12-01,07efb925-e6f4-4f2a-bd9f-bd5b0a297a8d,216120,Mr. Guy Lauzon,,Routine Proceedings,Questions on the Order Paper,Question No. 1231, With regard to the decision to exclude Ottawa from the Innovation Superclusters Initiative: (a) why was Ottawa not included on the list of superclusters; and (b) what specific criteria did Ottawa fail to meet?,Conservative,Stormont—Dundas—South Glengarry,Guy Lauzon,http://www.parl.gc.ca/Parliamentarians/en/members/guy-lauzon(216120)
4730167,ca.proc.d.2017-12-01.p5165265,2017-12-01,8908cde5-7474-4d2a-8c50-d05da5ee0712,214493,"Hon. Navdeep Bains (Minister of Innovation, Science and Economic Development, Lib.)",,Routine Proceedings,Questions on the Order Paper,Question No. 1231," Mr. Speaker, with regard to part (a), the selection of applications for the innovation superclusters initiative involves a two-phase process. In the first phase, which closed on July 24, 2017, applicants submitted letters of intent. The intake was very competitive, with the government receiving over 50 applications from interested applicants from all regions of Canada including British Columbia, the Prairies, Ontario, Quebec, the Atlantic, and the North and from across highly innovative industries such as clean technology, advanced manufacturing, digital technology, health/bio-sciences, clean resources, and agri-food, as well as infrastructure and transportation.
The Minister of Innovation, Science and Economic Development Canada announced a short list of nine proposals on October 12, 2017. These selected applicants have been invited to submit a full application by November 24, 2017. The application process is ongoing and a final decision has not been made.
Descriptions of the assessment criteria and process, reflecting key elements contributing to program outcomes, are published in the program guide. They are used to assess the potential of proposals to generate economic impact and industrial benefits for Canada, as well as other key elements such as the importance and relevance of the applicant’s proposed plans.
With regard to part (b), each letter of intent received was screened for eligibility. Eligible applications were assessed against selection criteria: vision and mission for supercluster, economic growth and industrial benefits, capabilities and assets, and budget and financial commitment.
The strongest proposals were those that best demonstrated a clearly defined and common vision for building a business-led cluster, setting their cluster apart by building on the best of its assets and making the cluster more than the sum of its parts; strong potential to accelerate economic growth and achieve industrial benefits in highly innovative industries; unique capabilities and potential to position Canada for global leadership in a particular field; scale and critical mass, bringing together a large number of interested organizations, and securing or demonstrating potential to secure financial commitment from the private sector.
Recognizing that there were many good proposals and interesting ideas presented beyond those that were shortlisted, all lead applicants on non-selected proposals received calls from program officials to discuss how Innovation, Science and Economic Development Canada and its portfolio partners might continue working together with proponents. The goal of these conversations has been to find new partnerships, programs, and avenues to maintain the applicants’ momentum and advance the issues of greatest interest to their member firms and organizations. ",Liberal,Mississauga—Malton,Navdeep Bains,http://www.parl.gc.ca/Parliamentarians/en/members/navdeep-bains(214493)
4730168,ca.proc.d.2017-12-01.p5165271,2017-12-01,2428082e-6784-4ce4-ae08-dab7caa06e6b,217459,Mr. Ron Liepert,,Routine Proceedings,Questions on the Order Paper,Question No. 1236," —With regard to the tweet by the Prime Minister on October 11, 2017, that “Let me be blunt: we are not going to tax anyone's employee discounts”: (a) are all employee discounts exempt from taxation; (b) if the answer to (a) is negative, what specific discounts are subject to taxation; and (c) have specific instructions been given to the Canada Revenue Agency not to tax employee discounts, and if so, what was the exact text of the instructions?",Conservative,Calgary Signal Hill,Ron Liepert,http://www.parl.gc.ca/Parliamentarians/en/members/ron-liepert(217459)
4730169,ca.proc.d.2017-12-01.p5165272,2017-12-01,c58bb7da-2385-4bbf-a8f1-b781f634a80c,213875,"Hon. Diane Lebouthillier (Minister of National Revenue, Lib.)",,Routine Proceedings,Questions on the Order Paper,Question No. 1236,"Mr. Speaker, with regard to parts (a) and (b), the Income Tax Act, ITA, states that, with certain exceptions, “the value of … benefits of any kind whatever received or enjoyed ... in respect of, in the course of, or by virtue of an office or employment” be included in income. To assist with the interpretation of the ITA, the CRA has a long-standing administrative policy that states that employee discounts on merchandise are generally not taxed, except in certain situations when a discount on merchandise is included in income. This policy is explained in T4130, “Employers’ Guide: Taxable Benefits and Allowances”, as follows:
If an employer sells merchandise to an employee at a discount, the benefit the employee gets from the discount is not usually taxable except in the following situations:
• The employer makes a special arrangement with an employee or a group of employees to buy merchandise at a discount. 
• The employer makes an arrangement that allows an employee to buy merchandise (other than old or soiled merchandise) for less than the employer’s cost.
• The employer makes a reciprocal arrangement with one or more other employers so that employees of one employer can buy merchandise at a discount from another employer.
If an employer provides a subsidized meal to an employee, the CRA does not consider these meals a taxable benefit if the employee pays a reasonable charge. A reasonable charge is one that covers the cost of the food, its preparation, and service. Employees are also, in most cases, not taxed if they receive a meal when they work the occasional overtime shift.
With regard to part (c), on October 10, 2017, the Minister of National Revenue asked officials to clarify the wording of discounts on merchandise to ensure taxpayers are ?provided with clear and concise information in Folio S2-F3-C2, “Benefits and Allowances Received from Employment”. As a result, the CRA removed the folio from its website and is reviewing the folio’s wording regarding discounts on merchandise. ",Liberal,Gaspésie—Les-Îles-de-la-Madeleine,Diane Lebouthillier,http://www.parl.gc.ca/Parliamentarians/en/members/diane-lebouthillier(213875)
4730170,ca.proc.d.2017-12-01.9832247,2017-12-01,07cf5767-802c-406c-92a7-7dc92af79b40,229526,"Mr. Kevin Lamoureux (Parliamentary Secretary to the Leader of the Government in the House of Commons, Lib.)",,Routine Proceedings,Questions Passed as Orders for Returns,,"Furthermore, if the government's response to Questions Nos. 1229 and 1232 to 1235 could be made orders for return, these returns would be tabled immediately.",Liberal,Winnipeg North,Kevin Lamoureux,http://www.parl.gc.ca/Parliamentarians/en/members/kevin-lamoureux(229526)
4730171,ca.proc.d.2017-12-01.p5165280,2017-12-01,16c839d3-0183-4ed6-892a-8d7bdc37c474,214972,The Assistant Deputy Speaker (Mr. Anthony Rota),,Routine Proceedings,Questions Passed as Orders for Returns,, Is that agreed?,Liberal,Nipissing—Timiskaming,Anthony Rota,http://www.parl.gc.ca/Parliamentarians/en/members/anthony-rota(214972)
4730172,ca.proc.d.2017-12-01.p5165281,2017-12-01,,,,intervention,Routine Proceedings,Questions Passed as Orders for Returns,, Agreed.,,,Some hon. members,
4730173,ca.proc.d.2017-12-01.p5165282,2017-12-01,a710e2c4-20f9-4df8-ba6c-2dc50c03bb75,217321,Ms. Marjolaine Boutin-Sweet,,Routine Proceedings,Questions Passed as Orders for Returns,Question No. 1229," With regard to social infrastructure funding and other investments to address housing and homelessness: (a) how much has been allocated per fiscal year from 2011-12 to 2027-28, overall and broken down by province or territory for (i) the Investment in Affordable Housing initiative, (ii) the doubling of the Investment in Affordable Housing initiative, (iii) affordable housing for seniors, (iv) shelters for victims of family violence, (v) renovations and retrofits of social housing, (vi) rental subsidies for housing administered by Canada Mortgage and Housing Corporation (CMHC), (vii) northern and Inuit housing in Yukon, the Northwest Territories and Nunavut, (viii) Inuit housing in Nunavik, Inuvialuit and Nunatsiavut, (ix) housing in First Nations communities, (x) on-reserve shelters for victims of family violence, (xi) the Affordable Rental Housing Innovation Fund, (xii) affordable rental housing funding, (xiii) assistance for homeowners affected by pyrrhotite, (xiv) the Homelessness Partnering Strategy, (xv) the renewed Federal-Provincial-Territorial Partnership in Housing, (xvi) the new National Housing Fund, (xvii) targeted support for Northern housing, (xviii) targeted housing support for Indigenous Peoples not living on-reserve, (xix) making more federal lands available for affordable housing, (xx) strengthening housing research and establishing a housing statistics framework; (b) to date, what amounts have actually been spent or are the subject of a funding agreement for each fiscal year from 2011-12 to 2027-28, overall and broken down by province or territory for (i) the Investment in Affordable Housing initiative, (ii) the doubling of the Investment in Affordable Housing initiative, (iii) affordable housing for seniors, (iv) shelters for victims of family violence, (v) renovations and retrofits of social housing, (vi) rental subsidies for CMHC-administered housing, (vii) northern and Inuit housing in Yukon, the Northwest Territories and Nunavut, (viii) Inuit housing in Nunavik, Inuvialuit and Nunatsiavut, (ix) housing in First Nations communities, (x) on-reserve shelters for victims of family violence, (xi) the Affordable Rental Housing Innovation Fund, (xii) affordable rental housing funding, (xiii) assistance for homeowners affected by pyrrhotite, (xiv) the Homelessness Partnering Strategy, (xv) the renewed Federal-Provincial-Territorial Partnership in Housing, (xvi) the new National Housing Fund, (xvii) targeted support for Northern housing, (xviii) targeted housing support for Indigenous Peoples not living on-reserve, (xix) making more federal lands available for affordable housing, (xx) strengthening housing research and establishing a housing statistics framework; (c) on what dates does funding come into effect and terminate, broken down by province or territory, for (i) the Investment in Affordable Housing initiative, (ii) the doubling of the Investment in Affordable Housing initiative, (iii) affordable housing for seniors, (iv) shelters for victims of family violence, (v) renovations and retrofits of social housing, (vi) rental subsidies for CMHC-administered housing, (vii) northern and Inuit housing in Yukon, the Northwest Territories and Nunavut, (viii) Inuit housing in Nunavik, Inuvialuit and Nunatsiavut, (ix) housing in First Nations communities, (x) on-reserve shelters for victims of family violence, (xi) the Affordable Rental Housing Innovation Fund, (xii) affordable rental housing funding, (xiii) assistance for homeowners affected by pyrrhotite, (xiv) the Homelessness Partnering Strategy, (xv) the renewed Federal-Provincial-Territorial Partnership in Housing, (xvi) the new National Housing Fund, (xvii) targeted support for Northern housing, (xviii) targeted housing support for Indigenous Peoples not living on-reserve, (xix) making more federal lands available for affordable housing, (xx) strengthening housing research and establishing a housing statistics framework; (d) what is the funding mechanism for (i) the Investment in Affordable Housing initiative, (ii) the doubling of the Investment in Affordable Housing initiative, (iii) affordable housing for seniors, (iv) shelters for victims of family violence, (v) renovations and retrofits of social housing, (vi) rental subsidies for CMHC-administered housing, (vii) northern and Inuit housing in Yukon, the Northwest Territories and Nunavut, (viii) Inuit housing in Nunavik, Inuvialuit and Nunatsiavut, (ix) housing in First Nations communities, (x) on-reserve shelters for victims of family violence, (xi) the Affordable Rental Housing Innovation Fund, (xii) affordable rental housing funding, (xiii) assistance for homeowners affected by pyrrhotite, (xiv) the Homelessness Partnering Strategy, (xv) the renewed Federal-Provincial-Territorial Partnership in Housing, (xvi) the new National Housing Fund, (xvii) targeted support for Northern housing, (xviii) targeted housing support for Indigenous Peoples not living on-reserve, (xix) making more federal lands available for affordable housing, (xx) strengthening housing research and establishing a housing statistics framework; (e) how much funding has been invested in or allocated to existing social housing under long-term arrangements, per fiscal year from 2011-12 to 2029-30 (i) in Canada, (ii) by province, (iii) by social housing project; (f) since 1995, what amount of funding has expired following the expiry of long-term arrangements (i) by year, (ii) by province or territory; (g) how many long-term arrangements are scheduled to expire by 2030 (i) by year, (ii) by province or territory and what is the expired amount; and (h) by 2030, what amount of funding will expire following the expiry of long-term arrangements (i) by year, (ii) by province or territory?",New Democratic Party,Hochelaga,Marjolaine Boutin-Sweet,http://www.parl.gc.ca/Parliamentarians/en/members/marjolaine-boutin-sweet(217321)
4730174,ca.proc.d.2017-12-01.p5165283,2017-12-01,,,,stagedirection,Routine Proceedings,Questions Passed as Orders for Returns,Question No. 1229,(Return tabled),,,,
4730175,ca.proc.d.2017-12-01.p5165284,2017-12-01,9fb311fc-3875-4698-b13c-014f0d819393,218453,Mr. Colin Carrie,,Routine Proceedings,Questions Passed as Orders for Returns,Question No. 1232," With regard to videos posted on the Innovation, Science and Economic Development Canada YouTube channel since January 1, 2016: (a) what are the details of expenses related to the videos, broken down by individual video, including (i) graphics, (ii) production, (iii) human resources, (iv) editing, (v) total amount spent; and (b) what are the details of any contracts, of which the goods of services were used, either in whole or in part, in relation to the videos, including for each contract the (i) amount, (ii) vendor, (iii) date, (iv) description of goods or services provided, (v) file number?",Conservative,Oshawa,Colin Carrie,http://www.parl.gc.ca/Parliamentarians/en/members/colin-carrie(218453)
4730176,ca.proc.d.2017-12-01.p5165285,2017-12-01,,,,stagedirection,Routine Proceedings,Questions Passed as Orders for Returns,Question No. 1232,(Return tabled),,,,
4730177,ca.proc.d.2017-12-01.p5165286,2017-12-01,9fb311fc-3875-4698-b13c-014f0d819393,218453,Mr. Colin Carrie,,Routine Proceedings,Questions Passed as Orders for Returns,Question No. 1233," With regard to applications for appointments to the Invest in Canada Hub: (a) how many individuals applied for the Chairperson position; (b) how many individuals applied for the Chief Executive Officer (CEO) position; (c) for (a) and (b), how many applicants met all of the required criteria; (d) what are the salary ranges for the (i) Chairperson, (ii) CEO; (e) were any headhunting firms used by the government in any way for positions at the Invest in Canada Hub; and (f) if the answer to (e) is affirmative, what are the details of any such expenditures including (i) vendor or firm, (ii) date of contract, (iii) amount, (iv) file number, (v) summary or description of goods or services provided?",Conservative,Oshawa,Colin Carrie,http://www.parl.gc.ca/Parliamentarians/en/members/colin-carrie(218453)
4730178,ca.proc.d.2017-12-01.p5165287,2017-12-01,,,,stagedirection,Routine Proceedings,Questions Passed as Orders for Returns,Question No. 1233,(Return tabled),,,,
4730179,ca.proc.d.2017-12-01.p5165288,2017-12-01,113d2f8f-bc0d-4db5-86e8-99f31c86216f,234464,Mr. Martin Shields,,Routine Proceedings,Questions Passed as Orders for Returns,Question No. 1234," With regard to the skating rink currently being installed on Parliament Hill: (a) what is the total amount budgeted for the construction, assembly and operation of the skating rink; and (b) what are the amounts budgeted broken down by type of expense?",Conservative,Bow River,Martin Shields,http://www.parl.gc.ca/Parliamentarians/en/members/martin-shields(234464)
4730180,ca.proc.d.2017-12-01.p5165289,2017-12-01,,,,stagedirection,Routine Proceedings,Questions Passed as Orders for Returns,Question No. 1234,(Return tabled),,,,
4730181,ca.proc.d.2017-12-01.p5165290,2017-12-01,2428082e-6784-4ce4-ae08-dab7caa06e6b,217459,Mr. Ron Liepert,,Routine Proceedings,Questions Passed as Orders for Returns,Question No. 1235," With regard to the book cover for Budget 2017: (a) how much did the government spend on the cover; and (b) what is the breakdown of all expenses, including for each expense the (i) amount, (ii) date, (iii) vendor, (iv) description of good or service, (v) file number?",Conservative,Calgary Signal Hill,Ron Liepert,http://www.parl.gc.ca/Parliamentarians/en/members/ron-liepert(217459)
4730182,ca.proc.d.2017-12-01.p5165291,2017-12-01,,,,stagedirection,Routine Proceedings,Questions Passed as Orders for Returns,Question No. 1235,(Return tabled),,,,
