basepk,hid,speechdate,pid,opid,speakeroldname,speakerposition,maintopic,subtopic,subsubtopic,speechtext,speakerparty,speakerriding,speakername,speakerurl
4730059,ca.proc.d.2017-12-01.9831687,2017-12-01,ad4032f2-6bb1-497b-b146-f321cfb71ba9,234631,"Hon. Pierre Poilievre (Carleton, CPC)",,Oral Questions,Ethics,,"Yes, Mr. Speaker, and the platform the Liberals put out said that the tax measure would come in place April 1, the beginning of the next fiscal year.
 Nothing is certain until it is actually tabled on the floor of the House of Commons. However, even if it were widely predicted, when corporate earnings are widely predicted, and even forecasted by the company itself, the leaders of those companies, officers and directors, are forbidden from selling shares in the immediate lead up to the release of those formal documents. That is a basic corporate standard.
 All I am asking is why the minister would not hold himself to that same standard in this office. ",Conservative,Carleton,Pierre Poilievre,http://www.parl.gc.ca/Parliamentarians/en/members/pierre-poilievre(234631)
4730060,ca.proc.d.2017-12-01.9831689,2017-12-01,d32cbf2b-5b28-4698-ba39-c1ac2f736c3e,234563,"Mr. Joël Lightbound (Parliamentary Secretary to the Minister of Finance, Lib.)",,Oral Questions,Ethics,,"Mr. Speaker, I will finish, because I was cut off. In the November 6, 2015, Ottawa Citizen article, we said that our objective was to have the middle class tax cut in place for January 1.
There has never been any secret in our plan to tax the wealthiest 1% and reduce taxes for the middle class. The accusations opposition members are trying to make are completely baseless. The fact that they do not dare repeat them outside the House shows, with great certainty, that they have nothing to back them up. ",Liberal,Louis-Hébert,Joël Lightbound,http://www.parl.gc.ca/Parliamentarians/en/members/joel-lightbound(234563)
4730061,ca.proc.d.2017-12-01.9831704,2017-12-01,ad4032f2-6bb1-497b-b146-f321cfb71ba9,234631,"Hon. Pierre Poilievre (Carleton, CPC)",,Oral Questions,Canada Revenue Agency,,"Mr. Speaker, let us talk about this famous tax policy. The minister made sure to sell his shares before his tax increases took effect so he would not have to pay any of the taxes he was imposing on others.
However, who is paying more now? People suffering with diabetes. Now we learn that people suffering with autism are losing the disability tax credit, a tax increase of $1,500 for families that are suffering with great hardship. Whenever Liberals raise taxes, why do they always target those with the least?",Conservative,Carleton,Pierre Poilievre,http://www.parl.gc.ca/Parliamentarians/en/members/pierre-poilievre(234631)
4730062,ca.proc.d.2017-12-01.9831706,2017-12-01,c58bb7da-2385-4bbf-a8f1-b781f634a80c,213875,"Hon. Diane Lebouthillier (Minister of National Revenue, Lib.)",,Oral Questions,Canada Revenue Agency,,"Mr. Speaker, our government pledged that the agency would administer measures for persons with disabilities in a fair, transparent, and accessible way.
I was proud to announce that the disability advisory committee, which was disbanded by the former Conservative government in 2006, was being reinstated. By reinstating the committee, the agency will benefit from its advice about enhancing the quality and accessibility of the services it provides to persons with disabilities and their families.",Liberal,Gaspésie—Les-Îles-de-la-Madeleine,Diane Lebouthillier,http://www.parl.gc.ca/Parliamentarians/en/members/diane-lebouthillier(213875)
4730063,ca.proc.d.2017-12-01.9831708,2017-12-01,8c04baa6-daad-4fe5-8413-3973a24a2760,234592,"Hon. Maxime Bernier (Beauce, CPC)",,Oral Questions,Ethics,,"Mr. Speaker, it is sad that today, and for the past few days, we have had to ask the Minister of Finance the same question without getting an answer. 
We expect that a minister who manages public finances should be able to answer specific and simple questions. We have repeatedly asked the same question. We have the right to ask it, since the minister's behaviour has raised huge ethical problems. 
In light of these ethical problems, why is the finance minister unable to answer our questions and why does he not resign?",Conservative,Beauce,Maxime Bernier,http://www.parl.gc.ca/Parliamentarians/en/members/maxime-bernier(234592)
4730064,ca.proc.d.2017-12-01.9831711,2017-12-01,d32cbf2b-5b28-4698-ba39-c1ac2f736c3e,234563,"Mr. Joël Lightbound (Parliamentary Secretary to the Minister of Finance, Lib.)",,Oral Questions,Ethics,,"Mr. Speaker, I did not see a question in the member's comments. He should repeat his question because there was no question in what he just said. ",Liberal,Louis-Hébert,Joël Lightbound,http://www.parl.gc.ca/Parliamentarians/en/members/joel-lightbound(234563)
4730065,ca.proc.d.2017-12-01.9831713,2017-12-01,8c04baa6-daad-4fe5-8413-3973a24a2760,234592,"Hon. Maxime Bernier (Beauce, CPC)",,Oral Questions,Ethics,,"Mr. Speaker, it is simple. We are calling for the resignation of the country's chief financial officer, given that he has lost our confidence.
The Minister of Finance is caught up in conflicts of interest. He forgot to declare his villa in Europe and he made transactions that will affect his own portfolio. With his Bay Street background, he should know the rules for these transactions. 
Here, we are held to the highest ethical standards, and he is not living up to them. He is in a conflict of interest. He does not even consult Canadians about his measures—",Conservative,Beauce,Maxime Bernier,http://www.parl.gc.ca/Parliamentarians/en/members/maxime-bernier(234592)
4730066,ca.proc.d.2017-12-01.9831714,2017-12-01,16c839d3-0183-4ed6-892a-8d7bdc37c474,214972,The Assistant Deputy Speaker (Mr. Anthony Rota),,Oral Questions,Ethics,,The hon. parliamentary secretary.,Liberal,Nipissing—Timiskaming,Anthony Rota,http://www.parl.gc.ca/Parliamentarians/en/members/anthony-rota(214972)
4730067,ca.proc.d.2017-12-01.9831715,2017-12-01,d32cbf2b-5b28-4698-ba39-c1ac2f736c3e,234563,"Mr. Joël Lightbound (Parliamentary Secretary to the Minister of Finance, Lib.)",,Oral Questions,Ethics,,"Mr. Speaker, the question from the member for Beauce is a perfect example of the Conservatives's tactics. They are conflating a bunch of different issues and making false, baseless accusations.
If the member wants to know whether I have confidence in the Minister of Finance and whether we have confidence in the Minister of Finance, he need only look to the job numbers posted just today, which show that we have created 600,000 jobs in the past two years. That is more than the Conservatives ever managed to do. Yes, the Minister of Finance has our full confidence.",Liberal,Louis-Hébert,Joël Lightbound,http://www.parl.gc.ca/Parliamentarians/en/members/joel-lightbound(234563)
4730068,ca.proc.d.2017-12-01.9831730,2017-12-01,c861cfd8-ac30-4ddf-9d31-79dd34dcc59e,217165,"Ms. Ruth Ellen Brosseau (Berthier—Maskinongé, NDP)",,Oral Questions,Government Appointments,,"Mr. Speaker, the government has set a new record for unfilled appointments, including the appointments of parliamentary watchdogs. Yesterday, the Liberals released the names of their picks for the positions of official languages and lobbying commissioner. Once again, they failed to consult the opposition.
Our parliamentary leader requested the list of candidates so we could engage in something called “real consultation”. Will the government share the list of candidates for both appointments with the opposition, yes or no?",New Democratic Party,Berthier—Maskinongé,Ruth Ellen Brosseau,http://www.parl.gc.ca/Parliamentarians/en/members/ruth-ellen-brosseau(217165)
4730069,ca.proc.d.2017-12-01.9831733,2017-12-01,83cd3ab5-7dc7-414e-ab8b-e0dbc16b4c4a,214117,"Hon. Mélanie Joly (Minister of Canadian Heritage, Lib.)",,Oral Questions,Government Appointments,,"Mr. Speaker, when it comes to official languages in general as well as bilingualism, it goes without saying that the NDP has lost all credibility. The NDP is now trying to undermine the credibility of the new Commissioner of Official Languages. 
I do not really understand where my colleague is coming from. I consulted the NDP critic last summer and he replied with a letter. Last week, I had another opportunity to talk with him. He made three requests: ensure that we consult the various official languages organizations, which we did; consult the opposition leaders, which we did; and appoint a candidate from Acadia, which we did.
We fulfilled all three requests and we have an excellent candidate in Raymond Théberge.",Liberal,Ahuntsic-Cartierville,Mélanie Joly,http://www.parl.gc.ca/Parliamentarians/en/members/melanie-joly(214117)
4730070,ca.proc.d.2017-12-01.9831736,2017-12-01,c861cfd8-ac30-4ddf-9d31-79dd34dcc59e,217165,"Ms. Ruth Ellen Brosseau (Berthier—Maskinongé, NDP)",,Oral Questions,Government Appointments,,"Mr. Speaker, that is nonsense. We are talking about consultation. We want the government to work with the opposition.
It seems to me that the government learned nothing from the Madeleine Meilleur fiasco. The appointment of officers of Parliament who work for every member of the House should be done in consultation with the opposition, in other words through real consultation with the recognized parties in the House.
I will repeat my simple question. Will the government share the list of members of the selection committee and the people on the list of finalists, yes or no? ",New Democratic Party,Berthier—Maskinongé,Ruth Ellen Brosseau,http://www.parl.gc.ca/Parliamentarians/en/members/ruth-ellen-brosseau(217165)
4730071,ca.proc.d.2017-12-01.9831739,2017-12-01,86fed1de-3861-4448-8242-ad414073ef2e,229525,"Ms. Joyce Murray (Parliamentary Secretary to the President of the Treasury Board, Lib.)",,Oral Questions,Government Appointments,,"Mr. Speaker, we consulted the leaders of the recognized parties on the matter of appointments, including the appointment of the lobbying commissioner. Once her appointment is approved by Parliament, Ms. Bélanger will have a seven-year term.
We welcome all ideas, proposals, and people from all parties in this process, which is truly open and transparent, something we are proud of.",Liberal,Vancouver Quadra,Joyce Murray,http://www.parl.gc.ca/Parliamentarians/en/members/joyce-murray(229525)
4730072,ca.proc.d.2017-12-01.9831741,2017-12-01,78336f0e-962c-47d2-a5b8-b59a26592789,217320,"Mr. Matthew Dubé (Beloeil—Chambly, NDP)",,Oral Questions,Public Safety,,"Mr. Speaker, this would have been a lot less complicated if we had adopted the member for Skeena—Bulkley Valley's motion for a real appointment process for officers. 
On another topic, yesterday, the Standing Committee on Public Safety and National Security met with the Minister of Public Safety only for one hour on a 138-page omnibus bill, Bill C-59.
We cannot fast-track issues relating to our national security, rights and freedoms, and the privacy of Canadians. Spending one hour with the minister and two hours with heads of agencies is simply not enough. 
Can the minister commit to come before the Standing Committee on Public Safety and National Security, and once again answer members' questions on this omnibus bill?",New Democratic Party,Beloeil—Chambly,Matthew Dubé,http://www.parl.gc.ca/Parliamentarians/en/members/matthew-dube(217320)
4730073,ca.proc.d.2017-12-01.9831756,2017-12-01,0fd242c0-71bc-4c1b-a4e4-609a396eca76,234578,"Mr. Mark Holland (Parliamentary Secretary to the Minister of Public Safety and Emergency Preparedness, Lib.)",,Oral Questions,Public Safety,,"Mr. Speaker, never before have Canadians been so engaged on the issue of national security. In fact, the broadest consultations in Canadian history happened on Bill C-59.
 I want to thank the member opposite and the committee as well for their months of work in the study of the national security intelligence framework. The minister was able to point directly to the work of the committee and how it influenced the creation of that bill. This is an excellent example of not only profound and deep national consultation, but the committee working excellently together. Because the bill has been moved at first reading, I look forward to working with the member in a very open way to make sure we—",Liberal,Ajax,Mark Holland,http://www.parl.gc.ca/Parliamentarians/en/members/mark-holland(234578)
4730074,ca.proc.d.2017-12-01.9831757,2017-12-01,16c839d3-0183-4ed6-892a-8d7bdc37c474,214972,The Assistant Deputy Speaker (Mr. Anthony Rota),,Oral Questions,Public Safety,,The hon. member for Beloeil—Chambly.,Liberal,Nipissing—Timiskaming,Anthony Rota,http://www.parl.gc.ca/Parliamentarians/en/members/anthony-rota(214972)
4730075,ca.proc.d.2017-12-01.9831758,2017-12-01,78336f0e-962c-47d2-a5b8-b59a26592789,217320,"Mr. Matthew Dubé (Beloeil—Chambly, NDP)",,Oral Questions,Public Safety,,"Mr. Speaker, I appreciate the member's compliments, but we are talking about the minister appearing for one hour on a 138 page bill, which, by the government's own admission, is the biggest overhaul of pieces of legislation in 30 years. If the Liberals think that is sufficient, then they do not understand what they are doing. It just does not work.
 This is in a context where we are hearing more and more about some of CSIS's questionable spying practices, with the use of things like stingray technologies. There are still many questions about a too low threshold for information sharing in the current legislation. There are issues around new powers for CSE, a whole slew of questions that we have not even had a chance to ask.
In its new legislation, when will the government finally take Canadians—",New Democratic Party,Beloeil—Chambly,Matthew Dubé,http://www.parl.gc.ca/Parliamentarians/en/members/matthew-dube(217320)
4730076,ca.proc.d.2017-12-01.9831949,2017-12-01,16c839d3-0183-4ed6-892a-8d7bdc37c474,214972,The Assistant Deputy Speaker (Mr. Anthony Rota),,Oral Questions,Public Safety,,The hon. parliamentary secretary.,Liberal,Nipissing—Timiskaming,Anthony Rota,http://www.parl.gc.ca/Parliamentarians/en/members/anthony-rota(214972)
4730077,ca.proc.d.2017-12-01.9831760,2017-12-01,0fd242c0-71bc-4c1b-a4e4-609a396eca76,234578,"Mr. Mark Holland (Parliamentary Secretary to the Minister of Public Safety and Emergency Preparedness, Lib.)",,Oral Questions,Public Safety,,"Mr. Speaker, the changes we have tabled are not only comprehensive but are recognized as really being on the vanguard in leading the world on the issue of bringing our protection of Canadians, both their security and their rights, to bear. We are at the beginning of this process. 
The member knows I am at the committee every day. I am at his disposal to answer his questions any day of the week. The committee proceedings are following detailed work that was done on the security and intelligence framework, and the most exhaustive consultations that happened on a national basis. I look forward to continuing the conversation.",Liberal,Ajax,Mark Holland,http://www.parl.gc.ca/Parliamentarians/en/members/mark-holland(234578)
4730078,ca.proc.d.2017-12-01.9831762,2017-12-01,e277e13e-59ec-425f-a957-eb5e54d8cb62,234454,"Mr. Gérard Deltell (Louis-Saint-Laurent, CPC)",,Oral Questions,Ethics,,"Mr. Speaker, the first duty of the opposition is to ask questions about the facts, which we are doing. The first duty of the government is to answer, which it is not doing.
We have asked the Minister of Finance dozens of times over a period of more than a week now whether he was the person who sold 680,000 Morneau Shepell shares valued at about $10 million one week before his tax policy was introduced in 2015. Not once did we get even a hint of a specific answer. 
Could the Minister of Finance finally stand up and come clean with Canadians? That is what they want.",Conservative,Louis-Saint-Laurent,Gérard Deltell,http://www.parl.gc.ca/Parliamentarians/en/members/gerard-deltell(234454)
4730079,ca.proc.d.2017-12-01.9831778,2017-12-01,d32cbf2b-5b28-4698-ba39-c1ac2f736c3e,234563,"Mr. Joël Lightbound (Parliamentary Secretary to the Minister of Finance, Lib.)",,Oral Questions,Ethics,,"Mr. Speaker, I wonder if the member was listening to the Minister of Finance this week, because the minister repeatedly said that he sold these shares that November and December, after coming to Ottawa, and that he even gave nearly $5 million to charity. 
Yes, the opposition's role is to ask questions and hold the government to account, but that does not include making personal attacks, which regrettably is what we heard in the House this week. There was not a hint of insider trading in the transaction that was carried out. No need to take my word for it, however.
This was in a CBC News column this morning, “To be clear: there is zero actual evidence that [the finance minister] engaged in insider trading.”",Liberal,Louis-Hébert,Joël Lightbound,http://www.parl.gc.ca/Parliamentarians/en/members/joel-lightbound(234563)
4730080,ca.proc.d.2017-12-01.9831780,2017-12-01,e277e13e-59ec-425f-a957-eb5e54d8cb62,234454,"Mr. Gérard Deltell (Louis-Saint-Laurent, CPC)",,Oral Questions,Ethics,,"Mr. Speaker, I would like the parliamentary secretary to quote the finance minister's exact answer when he confirmed whether it was his shares that he sold on November 30, 2015. This was a very clear and specific question, and the minister has never given me anything close to a real answer.
Could the Minister of Finance finally rise and give Canadians a clear answer? We have asked him about 75 questions. Could he finally give us an answer?
Was he the one who sold the 680,000 shares? We are not talking about buying a pair of socks. We are talking about 10 million dollars' worth of shares.",Conservative,Louis-Saint-Laurent,Gérard Deltell,http://www.parl.gc.ca/Parliamentarians/en/members/gerard-deltell(234454)
4730081,ca.proc.d.2017-12-01.9831782,2017-12-01,d32cbf2b-5b28-4698-ba39-c1ac2f736c3e,234563,"Mr. Joël Lightbound (Parliamentary Secretary to the Minister of Finance, Lib.)",,Oral Questions,Ethics,,"Mr. Speaker, the minister has been clear. He sold some shares that November and December. He was very clear about that. Why is this worth talking about? That is the question.
Could the member tell me how that could have made any difference? We are talking about a clear tax measure, one that was public knowledge. It was no secret that we said we were coming back to Ottawa to raise taxes on the wealthiest 1% and lower them for the middle class. How could that have had any sort of impact on the stock market or on one particular stock? I would like him to tell me that.",Liberal,Louis-Hébert,Joël Lightbound,http://www.parl.gc.ca/Parliamentarians/en/members/joel-lightbound(234563)
4730082,ca.proc.d.2017-12-01.9831784,2017-12-01,78cd5419-2f3c-4798-9c5b-0e55843ef9fb,234721,"Mrs. Kelly Block (Carlton Trail—Eagle Creek, CPC)",,Oral Questions,Ethics,,"Mr. Speaker, while the finance minister has not told us much, he has said that he gave direction to sell some shares in his family company when he came into office. He said he did not remember exactly when, just like he did not remember he owned a company in France. These non-answers simply raise more questions.
Why did the finance minister not take the opportunity to sell all of his shares in Morneau Shepell when he was first elected instead of hiding them in a numbered company in Alberta?",Conservative,Carlton Trail—Eagle Creek,Kelly Block,http://www.parl.gc.ca/Parliamentarians/en/members/kelly-block(234721)
4730083,ca.proc.d.2017-12-01.9831788,2017-12-01,d32cbf2b-5b28-4698-ba39-c1ac2f736c3e,234563,"Mr. Joël Lightbound (Parliamentary Secretary to the Minister of Finance, Lib.)",,Oral Questions,Ethics,,"Mr. Speaker, I am trying to understand the line of reasoning. The Conservatives are saying that he should have sold all of his shares, or he should not have sold all of his shares. 
The fact is that what I see from this week on the part of opposition members is that they want to talk about anything else but the economy. On that front, the finance minister has delivered for Canadians more than the Conservatives ever could in the 10 years they were in power. We have 600,000 jobs created, with most of them full-time; the fastest growth in the G7; and the unemployment rate is the lowest in a decade. This is the finance minister's record. ",Liberal,Louis-Hébert,Joël Lightbound,http://www.parl.gc.ca/Parliamentarians/en/members/joel-lightbound(234563)
4730084,ca.proc.d.2017-12-01.9831790,2017-12-01,78cd5419-2f3c-4798-9c5b-0e55843ef9fb,234721,"Mrs. Kelly Block (Carlton Trail—Eagle Creek, CPC)",,Oral Questions,Ethics,,"Mr. Speaker, what we have learned is that the Minister of Finance is quite forgetful. He forgot to disclose the company that held his French villa. He forgot to ask the Ethics Commissioner for clearance to introduce Bill C-27. He cannot seem to recall when he sold 680,000 shares in Morneau Shepell. 
Perhaps he will remember this. Before he made his late November 2015 sale of those 680,000 shares, did the minister clear it with the Ethics Commissioner first?",Conservative,Carlton Trail—Eagle Creek,Kelly Block,http://www.parl.gc.ca/Parliamentarians/en/members/kelly-block(234721)
4730085,ca.proc.d.2017-12-01.9831805,2017-12-01,d32cbf2b-5b28-4698-ba39-c1ac2f736c3e,234563,"Mr. Joël Lightbound (Parliamentary Secretary to the Minister of Finance, Lib.)",,Oral Questions,Ethics,,"Mr. Speaker, the Conservatives forgot, for 10 years, to grow the economy and to take care of the middle class. That is something the finance minister has done remarkably well in the last two years, creating 600,000 jobs and growing our economy at the fastest pace in the G7.
 I understand why the Conservatives do not want to talk about it. They focus on the finance minister, making all sorts of false and baseless accusations they would not dare repeat outside.",Liberal,Louis-Hébert,Joël Lightbound,http://www.parl.gc.ca/Parliamentarians/en/members/joel-lightbound(234563)
4730086,ca.proc.d.2017-12-01.9831807,2017-12-01,61c83e21-f9a3-4e4b-b881-4b2d1ce33c43,216152,"Mr. John Brassard (Barrie—Innisfil, CPC)",,Oral Questions,Ethics,,"Mr. Speaker, the finance minister has been asked directly, many times, if he was the one who sold 680,000 shares of Morneau Shepell stock on November 30, 2015. He said that he gave instructions to sell some stock when he was elected 42 days earlier but says he does not know, or will not say, when the sale happened.
The minister seems to have a hard time recalling specifics about his assets, like forgetting that he owned a French company for two years. I will make it easy. Can the minister confirm if the number of shares he gave instructions to sell was in fact 680,000?",Conservative,Barrie—Innisfil,John Brassard,http://www.parl.gc.ca/Parliamentarians/en/members/john-brassard(216152)
4730087,ca.proc.d.2017-12-01.9831810,2017-12-01,d32cbf2b-5b28-4698-ba39-c1ac2f736c3e,234563,"Mr. Joël Lightbound (Parliamentary Secretary to the Minister of Finance, Lib.)",,Oral Questions,Ethics,,"Mr. Speaker, the finance minister has said time and time again in this House that he sold shares when he took office, when he arrived in Ottawa, and that he has always worked, as well, with the Ethics Commissioner to make sure that all the rules are followed. He followed her recommendations to the letter when she said to put in place a conflict of interest screen. That is what he has done.
The finance minister has been working for the last two years to grow this economy, to create jobs for Canadians, and to reduce inequalities, and he has done it remarkably well.",Liberal,Louis-Hébert,Joël Lightbound,http://www.parl.gc.ca/Parliamentarians/en/members/joel-lightbound(234563)
4730088,ca.proc.d.2017-12-01.9831812,2017-12-01,61c83e21-f9a3-4e4b-b881-4b2d1ce33c43,216152,"Mr. John Brassard (Barrie—Innisfil, CPC)",,Oral Questions,Ethics,,"Mr. Speaker, there have been multiple issues with the finance minister: not having his assets in a blind trust after he said he did and would; controlling assets in numbered companies; not declaring a French corporation; introducing Bill C-27, for which he is now under investigation, a pension change that could directly affect his company; and now, this share issue.
Why can the finance minister not see how Canadians find it hard to trust him after he has broken their trust?",Conservative,Barrie—Innisfil,John Brassard,http://www.parl.gc.ca/Parliamentarians/en/members/john-brassard(216152)
4730089,ca.proc.d.2017-12-01.9831814,2017-12-01,d32cbf2b-5b28-4698-ba39-c1ac2f736c3e,234563,"Mr. Joël Lightbound (Parliamentary Secretary to the Minister of Finance, Lib.)",,Oral Questions,Ethics,,"Mr. Speaker, I think the 600,000 Canadians who have gotten jobs over the last two years as a result of the work of this government, of this finance minister, who has created the conditions for prosperity for all in this country, would have the utmost confidence in the finance minister.",Liberal,Louis-Hébert,Joël Lightbound,http://www.parl.gc.ca/Parliamentarians/en/members/joel-lightbound(234563)
4730090,ca.proc.d.2017-12-01.p5165106,2017-12-01,,,,intervention,Oral Questions,Ethics,," Oh, oh!",,,Some hon. members,
4730091,ca.proc.d.2017-12-01.9831815,2017-12-01,16c839d3-0183-4ed6-892a-8d7bdc37c474,214972,The Assistant Deputy Speaker (Mr. Anthony Rota),,Oral Questions,Ethics,,"I am sure the hon. member for Barrie—Innisfil would like to hear the answer to his question. I just want to remind the hon. members not to shout across the floor when someone is answering or asking a question.
The hon. parliamentary secretary has, I believe, another 22 seconds.",Liberal,Nipissing—Timiskaming,Anthony Rota,http://www.parl.gc.ca/Parliamentarians/en/members/anthony-rota(214972)
