basepk,hid,speechdate,pid,opid,speakeroldname,speakerposition,maintopic,subtopic,subsubtopic,speechtext,speakerparty,speakerriding,speakername,speakerurl
4720088,ca.proc.d.2017-09-27.9671045,2017-09-27,3176068f-62ee-4b2f-aacd-1131201c6db1,214707,The Speaker,,,,,"It being Wednesday, we will now have the singing of the national anthem led by the hon. member for Edmonton Centre.
[Members sang the national anthem]",Liberal,Halifax West,Geoff Regan,http://www.parl.gc.ca/Parliamentarians/en/members/geoff-regan(214707)
4720089,ca.proc.d.2017-09-27.9671056,2017-09-27,3c3175ff-595b-4f50-a58d-b41cd7b5b100,214600,"Hon. Hunter Tootoo (Nunavut, Ind.)",,Statements By Members,Nunavut,,"Mr. Speaker, last fall I committed to visiting every community in Nunavut over the coming year. Today I am proud to say that I have visited 23 of the 25 Nunavut communities, with Arctic Bay and Grise Fiord scheduled for early next month. I have travelled from Kugluktuk in the west to Qikiqtarjuaq in the east, Sanikiluaq in the south, to Resolute Bay in the north.
Although each of Nunavut's communities are unique, the thoughts and concerns raised by my constituents in every community were similar. Concerns about Nunavut's suicide rate, a lack of mental health facilities and services, the high cost of living, and the broken nutrition north program were voiced territory-wide. These issues are not new. They are serious and have been significantly affecting the quality of life for Nunavummiut for far too long. We expect and deserve meaningful action on these issues as soon as possible.",Independent,Nunavut,Hunter Tootoo,http://www.parl.gc.ca/Parliamentarians/en/members/hunter-tootoo(214600)
4720090,ca.proc.d.2017-09-27.9671059,2017-09-27,782dab6a-6e60-4132-992b-4933293f30d4,220014,"Ms. Pam Goldsmith-Jones (West Vancouver—Sunshine Coast—Sea to Sky Country, Lib.)",,Statements By Members,Aquaculture,,"Mr. Speaker, a key opportunity for our economy is the exploding global demand for high-quality protein. Canada's open-net aquaculture industry is a key contributor to our seafood exports, but the industry faces some serious constraints. Growing public concern for the health of the environment and for wild stocks, attenuating support from indigenous peoples, the lack of new licences, and massive losses globally due to sea lice, viruses, and even Washington State's complete net-pen collapse suggest that we need to alter our course. We should recognize these threats and embrace the exciting opportunity. British Columbia has a moratorium on licences, and our government should support that. 
There is nothing more perfect or more respected on the west coast of Canada than wild salmon. It is time to deliver on our innovation economy and grow our agrifood exports through land-based salmon aquaculture.",Liberal,West Vancouver—Sunshine Coast—Sea to Sky Country,Pam Goldsmith-Jones,http://www.parl.gc.ca/Parliamentarians/en/members/pam-goldsmith-jones(220014)
4720091,ca.proc.d.2017-09-27.9671063,2017-09-27,62bfd797-8d32-425b-91b1-1422ca16694f,224621,"Mr. Blake Richards (Banff—Airdrie, CPC)",,Statements By Members,Taxation,,"Mr. Speaker, today is World Tourism Day. As we all know, tourism is one of the most important sectors in the Canadian economy. This is especially true in my riding of Banff—Airdrie. Tourism is a $90-billion-per-year industry and accounts for one in every 11 jobs in Canada.
 Most tourism operations are small businesses, the backbone of the Canadian economy. Nearly 10% of small and medium-size businesses in Canada operate in tourism. Over the past month, I have heard from hundreds of tourism operators, such as campground owners, who are concerned and outraged that the Liberals are branding them as millionaire tax cheats and comparing them to Marie Antoinette. Tourism depends on factors outside their control to be successful. These tax changes will make it harder for Canadians working in tourism to save for a rainy day or to plan for their financial futures. We should be doing everything possible to lessen their tax burden, not to increase it. 
Today, on World Tourism Day, the Liberals should do the right thing to help ensure the viability of tourism operations by cancelling the proposed small-business tax increases. ",Conservative,Banff—Airdrie,Blake Richards,http://www.parl.gc.ca/Parliamentarians/en/members/blake-richards(224621)
4720092,ca.proc.d.2017-09-27.9671066,2017-09-27,04ef6f9c-3039-4fb0-a1ad-82a6ba2f03bf,219912,"Mr. Peter Schiefke (Vaudreuil—Soulanges, Lib.)",,Statements By Members,Fall Festival,," Mr. Speaker, this October 7th to 9th, the historic town of Rigaud will be celebrating its 20th annual Festival des couleurs.
The festival is an opportunity for families, friends, and all those who form a part of our community to come together to celebrate the coming of fall and take in our dazzling displays of colour, arts, and culture, as well as delicious food and fun activities for the whole family.
I encourage all those who live in Vaudreuil—Soulanges to join my family and me at the 20th annual Festival des couleurs to celebrate the beauty of our community, which is what makes it so strong. This year, more than ever before, Rigaud is where the action is.",Liberal,Vaudreuil—Soulanges,Peter Schiefke,http://www.parl.gc.ca/Parliamentarians/en/members/peter-schiefke(219912)
4720093,ca.proc.d.2017-09-27.9671070,2017-09-27,78336f0e-962c-47d2-a5b8-b59a26592789,217320,"Mr. Matthew Dubé (Beloeil—Chambly, NDP)",,Statements By Members,Gilles Plante,,"Mr. Speaker, it is with mixed emotions that I rise to recognize the political career of Gilles Plante, mayor of McMasterville and reeve of the Vallée-du-Richelieu RCM. Along with the residents of McMasterville, I learned on Monday that Mr. Plante will not be seeking a new term.
Mr. Plante served his community for 28 years, first as a municipal councillor from 1989 to 1993, and then as mayor from 1993 to 2017. That is incredible. He has also been the reeve of the RCM for 14 years. As a mentor he gave the best of himself, demonstrating discretion, humility, and strength of character. His advice and dedication have helped me become a better MP. His legacy is the vibrant city he helped create, a city beloved by young and old alike. However, there comes a time for every politician to put their family first.
I am sure that Bernadette and their entire family will be happy to have him to themselves. On behalf of the residents of McMasterville and everyone in Vallée-du-Richelieu, thank you, Gilles.",New Democratic Party,Beloeil—Chambly,Matthew Dubé,http://www.parl.gc.ca/Parliamentarians/en/members/matthew-dube(217320)
4720094,ca.proc.d.2017-09-27.9671073,2017-09-27,6ba9d6d4-25fc-4892-bc70-d2c289cf25b1,219826,"Mr. Bob Bratina (Hamilton East—Stoney Creek, Lib.)",,Statements By Members,"Hamilton, Ontario",,"Mr. Speaker, my city of Hamilton has benefited greatly from our government's handling of the economy. In the past year, employment has grown from 308,000 to 429,000 people with jobs in the Hamilton CMA.
 In my riding, we have a railcar manufacturer whose workforce more than doubled in recent years, much of which is being trained through company programs, and its products are exported throughout North America. Another company makes equipment for the oil industry in Canada and the United States and struggles to keep pace with demand. Another makes infrared heating devices for customers worldwide, including the United States, Germany, and China, despite that country's 20% tariff on its products. These companies range from 30 to 2,500 employees, with the potential for more hiring in a strong economic environment. 
I am sure Hamilton's success story will be repeated throughout Canada if we stay the course on our management of the economy. ",Liberal,Hamilton East—Stoney Creek,Bob Bratina,http://www.parl.gc.ca/Parliamentarians/en/members/bob-bratina(219826)
4720095,ca.proc.d.2017-09-27.9671078,2017-09-27,a5da7604-b429-46d1-b702-0e3be1febcec,218570,"Mr. Bob Saroya (Markham—Unionville, CPC)",,Statements By Members,Taxation,,"Mr. Speaker, I rise today to share that this weekend, in my riding of Markham—Unionville, I will be hosting a round table for small businesses and professionals. 
I have received numerous calls and emails from residents of Markham—Unionville who are concerned about what these new tax changes will mean for their families. Many local business owners and professionals will be meeting this Sunday to discuss the government's proposed tax changes, which will make it harder for them to be successful. These are the entrepreneurs who take risks and create jobs in our country. Professionals, entrepreneurs, and small businesses, men and women, are the backbone of our economy. I will remind them that I will continue to fight against this tax hike every step of the way.",Conservative,Markham—Unionville,Bob Saroya,http://www.parl.gc.ca/Parliamentarians/en/members/bob-saroya(218570)
4720096,ca.proc.d.2017-09-27.9671081,2017-09-27,41c4a234-7472-4511-a49a-d09355b4c726,229555,"Mr. Kyle Peterson (Newmarket—Aurora, Lib.)",,Statements By Members,Newmarket Honorary Citizen Award,,"Mr. Speaker, I am proud to rise today to pay tribute to an outstanding individual who has done so much for so many in Newmarket. I want to personally congratulate Jackie Playter on receiving the Newmarket Honorary Citizen Award. The award is presented by the town in recognition of an individual's outstanding service and commitment. I cannot think of a better recipient of this prestigious award. 
Jackie is exceptional. Her accomplishments are too lengthy to list, but I will name but a few of the organizations she has helped: Belinda's Place, Victim Services, the Newmarket Farmers Market, the Newmarket Historical Society, and the gala for the arts. She volunteers her time for Terry Fox, Easter Seals, MS, and Inn from the Cold. She is a tireless and effective promoter of her beloved Main Street, a jewel in our town.
 I was proud to attend the ceremony with Jackie and her family and friends on Saturday at Fairy Lake.
We congratulate and thank Jackie. She is indeed the queen of Newmarket.",Liberal,Newmarket—Aurora,Kyle Peterson,http://www.parl.gc.ca/Parliamentarians/en/members/kyle-peterson(229555)
4720097,ca.proc.d.2017-09-27.9671085,2017-09-27,711a47d7-2f48-4673-a4b1-a79126bd8e85,215926,"Mr. Ken Hardie (Fleetwood—Port Kells, Lib.)",,Statements By Members,Autism,,"Mr. Speaker, many people in this place and many right across the country have been touched by autism. It is something we do not know a lot about, but here is what we do know. One in 68 kids is somewhere on the spectrum, they say, and that has doubled in the last 10 years. We also know about the financial and emotional hardships it brings to families. We need to hear their voices on the way forward, which is why I will be holding a town hall this Saturday at the Fleetwood Recreation Centre from 3 to 5 p.m. It will be live-streamed on Facebook for those who want to tune in. 
We are going to have Autism BC; Paula Williams, a mom who has lived the challenges and who has also made a great contribution to the national conversation on this issue; and Dave Hurford, who is working on a policy that he believes will move the government and the country forward. 
We need to hear more. We need to do more. That is the focus. That is why are doing this town hall on Saturday.",Liberal,Fleetwood—Port Kells,Ken Hardie,http://www.parl.gc.ca/Parliamentarians/en/members/ken-hardie(215926)
4720098,ca.proc.d.2017-09-27.9671089,2017-09-27,53eb10e4-f8e7-4ef7-9448-b4a10ec1dba3,217051,"Mrs. Cathay Wagantall (Yorkton—Melville, CPC)",,Statements By Members,Communities in Bloom,,"Mr. Speaker, Communities in Bloom is a Canadian non-profit organization committed to fostering civic pride, environmental responsibility, and beautification through community involvement in a national program to enhance green spaces. The lovely town of Naicam, Saskatchewan, in my riding of Yorkton—Melville, was recognized with a 5 Leaves award in the Canada 150 category. 
The success of the project was spearheaded by two groups from the town's high school, with funding from the local thrift store. One group, the Goat Getters, was founded two years ago to sponsor a World Vision gift of a goat to a family, and the second was the Grade 9-10 art students. In their evaluation, the judges said that this was a wonderful display of initiative, volunteering, creativity, gardening, restoration, and youth involvement, a tribute to those who give back willingly to help others.
 Please join me in congratulating the town of Naicam, Saskatchewan.",Conservative,Yorkton—Melville,Cathay Wagantall,http://www.parl.gc.ca/Parliamentarians/en/members/cathay-wagantall(217051)
4720099,ca.proc.d.2017-09-27.9671092,2017-09-27,5e126a6d-7b4a-4e53-951f-7f1a7e9b5c0e,215947,"Mr. Ramesh Sangha (Brampton Centre, Lib.)",,Statements By Members,Navratri,,"Mr. Speaker, during the month of September, Hindus from all over the world are celebrating Navratri, a nine day festival. This is considered to be a cleansing period for the body and soul.
The ultimate goal of this festival is to attain virtues over vices, and become victorious in the battle of good over evil. This festival is now very visible in Canada as it has been all across India and the rest of the word. This is another example of cultural diversity that makes our country strong.
On behalf of my family and my constituents of Brampton Centre, I wish all of those who are celebrating a happy Navratri.
Let us continue to make the world a place of one family.",Liberal,Brampton Centre,Ramesh Sangha,http://www.parl.gc.ca/Parliamentarians/en/members/ramesh-sangha(215947)
4720100,ca.proc.d.2017-09-27.9671095,2017-09-27,86fed1de-3861-4448-8242-ad414073ef2e,229525,"Ms. Joyce Murray (Vancouver Quadra, Lib.)",,Statements By Members,Tree Canada,,"Mr. Speaker, Tree Canada is our country's leading national tree-planting charity, and I rise today on National Tree Day to offer my warm congratulations on the occasion of its 25th anniversary. 
For 25 years, Tree Canada has been growing better places to live all across Canada, by planting and caring for trees in our communities, reforesting rural areas, and by celebrating the environmental, social, cultural, economic, and spiritual benefits of trees.
As a former tree planter and reforestation business owner, I was honoured to join Tree Canada president Michael Rosen and his staff, volunteers, and board in planting their 82 millionth tree in Ottawa near Parliament Hill this afternoon.
I would like to thank Tree Canada for what it does. I also thank the Minister of Natural Resources for being there.
Finally, I would like to thank the thousands of Canadian tree planters across the country for their hard work in restoring Canada's forests in communities and remote regions across the country.
Happy National Tree Day.",Liberal,Vancouver Quadra,Joyce Murray,http://www.parl.gc.ca/Parliamentarians/en/members/joyce-murray(229525)
4720101,ca.proc.d.2017-09-27.9671210,2017-09-27,6519cfba-0080-419d-baa9-8ae6e56d032f,232946,"Hon. Andrew Scheer (Regina—Qu'Appelle, CPC)",,Statements By Members,Human Rights,,"Mr. Speaker, the Conservatives are deeply committed to a foreign policy that advances freedom, human rights, democracy, and the rule of law, and in particular that advances the rights of religious and ethnic minorities.
Last night, you, Mr. Speaker, granted our request to convene an emergency debate to discuss the ethnic cleansing of Muslim Rohingya in Burma. I would like to add my voice to those of other members, calling on the Burmese government and Burmese military to stop this vicious assault on fundamental human rights.
 I also call on the Government of Canada to do more to respond. Canada should have done more, earlier, but in any event we can do more now. The Liberal government needs to raise this issue more forcefully with all levels of the Burmese government.
We regret that the government did not act earlier, that the Prime Minister did not raise this issue during his speech to the United Nations, and that the Liberals eliminated the Office of Religious Freedom. We, the Conservatives, will continue to present constructive proposals for how the government can move forward. Canadians expect us to stand up for the most vulnerable, and we will continue to urge the Prime Minister to do just that.",Conservative,Regina—Qu'Appelle,Andrew Scheer,http://www.parl.gc.ca/Parliamentarians/en/members/andrew-scheer(232946)
4720102,ca.proc.d.2017-09-27.9671101,2017-09-27,f8d9db71-b5f5-4e2f-977c-0ad80169e2a6,214187,"Mr. Angelo Iacono (Alfred-Pellan, Lib.)",,Statements By Members,World Alzheimer's Month,,"Mr. Speaker, I want to begin with a special thought for my mother who would have celebrated her 90th birthday today.
[Member spoke in Italian]
[Translation]
September is World Alzheimer's Month. On September 21, we acknowledged World Alzheimer's Day. In Canada, more than one million people are affected by this form of dementia. 
This disease is life-altering to those affected and their families. Research into preventing the disease continues.
I want to take this opportunity to acknowledge the work of the Alzheimer Society Laval in Alfred-Pellan. That organization works tirelessly to help and support people affected by Alzheimer's disease. It also provides respite care and accommodation to help the families. Its work deserves our utmost admiration.
Thank you and continued success to Alzheimer Society Laval.",Liberal,Alfred-Pellan,Angelo Iacono,http://www.parl.gc.ca/Parliamentarians/en/members/angelo-iacono(214187)
4720103,ca.proc.d.2017-09-27.9671105,2017-09-27,0f7e3c8d-e579-44c0-b8b7-202b425758e4,218968,"Ms. Tracey Ramsey (Essex, NDP)",,Statements By Members,Take Back the Night,,"Mr. Speaker, Take Back the Night is an annual event held on colleges and university campuses, and in communities throughout our country. The event includes rallies, marches, and vigils where survivors and supporters alike unite to protest against sexual violence. It is a grassroots event for women to take to the streets and reclaim their right to be without fear, for women to stand strong and united against all forms of sexual violence and oppression.
 Our actions work to make our communities safer, standing with survivors fighting for education and awareness of the realities Canadian women face. We also work in solidarity with our indigenous sisters, fighting against the violence through which they survive.
Every year, women in Windsor and Essex gather downtown to reclaim the streets, with moving speeches by survivors, as attendees bear witness to their struggles and their victories. Men join us as allies, lining the streets and holding candles in support. 
There is nothing more empowering than strong women standing in solidarity with our sisters, mothers, daughters, neighbours, and friends. This Saturday, women in Windsor and Essex will take to the streets once again, because in Canada gender-based violence exists and it must end.",New Democratic Party,Essex,Tracey Ramsey,http://www.parl.gc.ca/Parliamentarians/en/members/tracey-ramsey(218968)
4720104,ca.proc.d.2017-09-27.9671108,2017-09-27,8880684e-3bb8-4705-a2b4-767f37811391,234437,"Mr. Dean Allison (Niagara West, CPC)",,Statements By Members,Sears Canada,,"Mr. Speaker, I rise today on behalf of concerned workers and pensioners who are worried about Sears Canada sliding into bankruptcy. A decision on Sears will be made this week, a decision that could cost 15,000 Canadians their jobs.
 The Wall Street Journal has reported that Sears chairman, Mr. Brandon Stranzl, has made a bid to rescue the company and save jobs. His long-term commitment to Canada, and Sears Canada, is real and measurable. I hope the government's long-term commitment to saving jobs is also real and measurable.
 Under liquidation, major banks and law firms stand to make millions of dollars. The government should do more than simply say that this matter is before the courts. I hope the government will communicate to the Bank of Montreal, and the other interested parties, that we must support the people who have helped make Sears Canada part of our country's rich history. We support those 15,000 Canadian jobs.",Conservative,Niagara West,Dean Allison,http://www.parl.gc.ca/Parliamentarians/en/members/dean-allison(234437)
4720105,ca.proc.d.2017-09-27.9671111,2017-09-27,3e3ce514-a196-4878-ad0f-a2bf0772cdfd,229558,"Mr. Randy Boissonnault (Edmonton Centre, Lib.)",,Statements By Members,Canada's Economic and Employment Development Network,,"Mr. Speaker, this week, the Réseau de développement économique et d'employabilité du Canada, known as the RDEE, is celebrating its 20th anniversary.
Bilingualism defines us as a country. As a proud Franco-Albertan and former president of the Conseil de développement économique de l'Alberta, I am quite familiar with issues pertaining to francophone minority communities, and I assure the House that the RDEE has been dedicated to supporting the vitality and development of our communities. The RDEE strengthens the economies in francophone communities across the country and improves the quality of life of Canadians.
Congratulations to the RDEE on doing an excellent job supporting the economic development of francophone minority communities. Thanks to its 20 years of work, we can now bring together francophone, francophile, and “franco-curious” business owners, who all help promote the francophonie here in Canada and around the world.",Liberal,Edmonton Centre,Randy Boissonnault,http://www.parl.gc.ca/Parliamentarians/en/members/randy-boissonnault(229558)
4720106,ca.proc.d.2017-09-27.9671115,2017-09-27,6519cfba-0080-419d-baa9-8ae6e56d032f,232946,"Hon. Andrew Scheer (Leader of the Opposition, CPC)",,Oral Questions,Canadian Heritage,,"Mr. Speaker, approximately six million Jews perished at the hands of the Nazis during the Second World War. It was an incredibly dark moment in human history, and serves as a reminder to all Canadians that we must continue to fight anti-Semitism wherever we find it.
Many are persecuted here and around the world for simply being a Jew. I trust all members agree that we must all stay vigilant to protect their fundamental human rights.
Today I will be joining the Prime Minister at the dedication of Canada's national Holocaust memorial. Could the Prime Minister inform the House about the importance of working together on this issue, and will he join me in congratulating all those who helped make the dream of a memorial a reality?",Conservative,Regina—Qu'Appelle,Andrew Scheer,http://www.parl.gc.ca/Parliamentarians/en/members/andrew-scheer(232946)
4720107,ca.proc.d.2017-09-27.9671117,2017-09-27,b8c04eca-f237-48a8-8975-374ccd40d1a9,214115,"Right Hon. Justin Trudeau (Prime Minister, Lib.)",,Oral Questions,Canadian Heritage,,"Mr. Speaker, I want to congratulate all members of the House from all parties who came together to make sure that this monument got built. This is an important commemoration of the six million Jewish men, women, and children, as well as the five million other victims, who were murdered during the Holocaust.
It will recognize those who survived, many of whom made their way to countries around the world, including Canada, and it will stand as a reminder of the dangers of hatred, racism, and intolerance, while affirming respect for human rights, dignity, and resilience.
With this monument, we all stand together and say solemnly “Never again”.",Liberal,Papineau,Justin Trudeau,http://www.parl.gc.ca/Parliamentarians/en/members/justin-trudeau(214115)
4720108,ca.proc.d.2017-09-27.9671119,2017-09-27,6519cfba-0080-419d-baa9-8ae6e56d032f,232946,"Hon. Andrew Scheer (Leader of the Opposition, CPC)",,Oral Questions,Taxation,,"Mr. Speaker, at yesterday's meeting of the Standing Committee on Finance, experts confirmed that the Prime Minister's plan to raise taxes on local businesses is going to hurt the middle class. 
Meanwhile, the Prime Minister has admitted that his own family fortune will not be touched by these tax hikes. It is hardly surprising that small business owners are up in arms.
When is the Prime Minister going to stop taking money away from local business owners and start listening to them instead?",Conservative,Regina—Qu'Appelle,Andrew Scheer,http://www.parl.gc.ca/Parliamentarians/en/members/andrew-scheer(232946)
4720109,ca.proc.d.2017-09-27.9671121,2017-09-27,b8c04eca-f237-48a8-8975-374ccd40d1a9,214115,"Right Hon. Justin Trudeau (Prime Minister, Lib.)",,Oral Questions,Taxation,,"Mr. Speaker, we are listening to small businesses and to Canadians. They tell us that they want our tax system to be fair and equitable. 
It is not fair that wealthy Canadians are able to incorporate so they can pay lower tax rates than middle-class Canadians. That is why we made a commitment during the election campaign to raise taxes for the wealthy, cut taxes for middle-class Canadians, and help the middle class, including small businesses, succeed in our economy.",Liberal,Papineau,Justin Trudeau,http://www.parl.gc.ca/Parliamentarians/en/members/justin-trudeau(214115)
