basepk,hid,speechdate,pid,opid,speakeroldname,speakerposition,maintopic,subtopic,subsubtopic,speechtext,speakerparty,speakerriding,speakername,speakerurl
4720182,ca.proc.d.2017-09-27.9671395,2017-09-27,b8c04eca-f237-48a8-8975-374ccd40d1a9,214115,"Right Hon. Justin Trudeau (Prime Minister, Lib.)",,Oral Questions,Indigenous Affairs,,"Mr. Speaker, moving forward with a nation-to-nation relationship in the spirit of reconciliation means consulting. It means listening to the affected people to understand how best to move forward. 
That is why the special representative has met with 26 chiefs, experts, officials, advocates, and individuals with extraordinary lived experiences from coast to coast to coast to inform how we are moving forward on completely renewing child and family services for first nations communities.",Liberal,Papineau,Justin Trudeau,http://www.parl.gc.ca/Parliamentarians/en/members/justin-trudeau(214115)
4720183,ca.proc.d.2017-09-27.9671400,2017-09-27,0bd5970c-e4c2-4044-8344-8123b16d75bd,234389,"Hon. Peter Kent (Thornhill, CPC)",,Oral Questions,Government Spending,,"Mr. Speaker, here is another question on the Liberals' wastage of hard-earned tax dollars in trying to cover up political problems. There was $10 million in an attempted secret payoff to Omar Khadr, millions to fight indigenous children and women in court, and almost half a million dollars to a defeated Liberal candidate for a PR campaign to fight a tribunal ruling in favour of indigenous children.
Why is the Prime Minister robbing the middle class to pay for Liberal profligacy?",Conservative,Thornhill,Peter Kent,http://www.parl.gc.ca/Parliamentarians/en/members/peter-kent(234389)
4720184,ca.proc.d.2017-09-27.9671403,2017-09-27,b8c04eca-f237-48a8-8975-374ccd40d1a9,214115,"Right Hon. Justin Trudeau (Prime Minister, Lib.)",,Oral Questions,Government Spending,,"Mr. Speaker, I understand the member opposite's outrage at the settlement in the Omar Khadr case. I understand Canadians' outrage. I understand how angry I am that we had to settle that. 
The fact is that we should all be outraged, and remain outraged, that Canadian governments violated a Canadian's fundamental rights. If we stay angry enough for long enough, maybe no future government will ever violate a Canadian's fundamental rights that way again.",Liberal,Papineau,Justin Trudeau,http://www.parl.gc.ca/Parliamentarians/en/members/justin-trudeau(214115)
4720185,ca.proc.d.2017-09-27.9671405,2017-09-27,7ee20ab9-2d43-420c-8027-f6403cb498a2,229567,"Mr. Emmanuel Dubourg (Bourassa, Lib.)",,Oral Questions,Sports,,"Mr. Speaker, the World Anti-Doping Agency is located in Montreal. It is a very important organization, given its mission. Not only does it create good jobs in Montreal, but it also enhances its reputation on the world stage. 
Could the member for Papineau, the Prime Minister,  please tell the House and Canadians about what the government has done to ensure that this agency stays in Montreal well into the future?",Liberal,Bourassa,Emmanuel Dubourg,http://www.parl.gc.ca/Parliamentarians/en/members/emmanuel-dubourg(229567)
4720186,ca.proc.d.2017-09-27.9671408,2017-09-27,b8c04eca-f237-48a8-8975-374ccd40d1a9,214115,"Right Hon. Justin Trudeau (Prime Minister, Lib.)",,Oral Questions,Sports,,"Mr. Speaker, I thank my colleague from Bourassa for his question. 
The World Anti-Doping Agency is an important organization for Montreal, Quebec and all of Canada. The Minister of Transportation, the Minister of Global Affairs, the Minister ofInnovation, Science and Economic Development, as well as the Minister of Sport and Persons with Disabilities, along with the Government of Quebec and the City of Montreal, are working hard to ensure the agency keeps its headquarters in Montreal. 
There is still work to do, but I am pleased to hear that the agency's executive committee is in negotiations to keep its headquarters in Montreal after 2021 for another 10 years.",Liberal,Papineau,Justin Trudeau,http://www.parl.gc.ca/Parliamentarians/en/members/justin-trudeau(214115)
4720187,ca.proc.d.2017-09-27.9671410,2017-09-27,6519cfba-0080-419d-baa9-8ae6e56d032f,232946,"Hon. Andrew Scheer (Leader of the Opposition, CPC)",,Oral Questions,Taxation,,"Mr. Speaker, hundreds of people across Atlantic Canada have been coming out to town halls and public consultations because they are legitimately concerned about the Prime Minister's own proposals.
 They know this is going to have such a negative impact, because so many of them are local business owners. These use these measures legitimately to pass on the family farm or the fishing boat.
Today, all four Atlantic opposition leaders are denouncing the Prime Minister's plan, because they know that under his administration, middle-class Canadians are paying more. It is even worse in Atlantic Canada, where provincial Liberal taxes are already killing jobs and opportunities.
Will the Prime Minister finally listen to his Atlantic Canadian friends, and even his own caucus, and cancel these unfair tax hikes?",Conservative,Regina—Qu'Appelle,Andrew Scheer,http://www.parl.gc.ca/Parliamentarians/en/members/andrew-scheer(232946)
4720188,ca.proc.d.2017-09-27.9671413,2017-09-27,b8c04eca-f237-48a8-8975-374ccd40d1a9,214115,"Right Hon. Justin Trudeau (Prime Minister, Lib.)",,Oral Questions,Taxation,,"Mr. Speaker, this government is always proud to stand up for, and stand with, our friends from Atlantic Canada.
We know that creating economic growth and boosting small businesses that create economic opportunity across Atlantic Canada is a priority that this government shares with all Atlantic Canadians.
That is why we are moving forward to make our tax system fairer. It is so that we can support small businesses as they work hard to grow our economy right across the country, and we can make sure that everyone pays their fair share of taxes.",Liberal,Papineau,Justin Trudeau,http://www.parl.gc.ca/Parliamentarians/en/members/justin-trudeau(214115)
4720189,ca.proc.d.2017-09-27.9671416,2017-09-27,551183c2-2f3e-41ba-8660-2d194cf60169,213985,"Hon. Thomas Mulcair (Outremont, NDP)",,Oral Questions,Canada Post,,"Mr. Speaker, the Prime Minister himself made a campaign promise to restore home mail delivery to those who lost it. Ten months ago, the House of Commons committee that includes a number of his MPs recommended restoring the service, but since then it has been radio silence from his government.
Why will the Prime Minister not just admit that he broke his promise to restore home mail delivery?",New Democratic Party,Outremont,Thomas Mulcair,http://www.parl.gc.ca/Parliamentarians/en/members/thomas-mulcair(213985)
4720190,ca.proc.d.2017-09-27.9671419,2017-09-27,b8c04eca-f237-48a8-8975-374ccd40d1a9,214115,"Right Hon. Justin Trudeau (Prime Minister, Lib.)",,Oral Questions,Canada Post,,"Mr. Speaker, Canadians expect quality service from Canada Post, and that is what we have promised to deliver. We all know the world is changing. We placed a moratorium on new community mailboxes. We recognize the need for more conversations about how best to serve Canadians and to ensure that Canada Post is meeting our expectations and fulfilling our responsibilities. We are working very hard on that.",Liberal,Papineau,Justin Trudeau,http://www.parl.gc.ca/Parliamentarians/en/members/justin-trudeau(214115)
4720191,ca.proc.d.2017-09-27.9671421,2017-09-27,79ed56c5-9960-4de7-bf05-9cd4aa51dbf5,215927,"Mr. Pat Finnigan (Miramichi—Grand Lake, Lib.)",,Oral Questions,Fisheries and Oceans,,"Mr. Speaker, we all know that our oceans are absolutely essential to our planet's health.
As Canadians, we are all connected to our oceans, which are significant to our heritage, our culture, and of course our economy. Canada is committed to protecting 5% of our marine and coastal areas by the end of this year, and 10% by 2020.
Can the Prime Minister update this House on the government's progress toward these targets?",Liberal,Miramichi—Grand Lake,Pat Finnigan,http://www.parl.gc.ca/Parliamentarians/en/members/pat-finnigan(215927)
4720192,ca.proc.d.2017-09-27.9671424,2017-09-27,b8c04eca-f237-48a8-8975-374ccd40d1a9,214115,"Right Hon. Justin Trudeau (Prime Minister, Lib.)",,Oral Questions,Fisheries and Oceans,,"Mr. Speaker, we are deeply committed to achieving our marine conservation targets. I am pleased to announce in this House today that we are taking one more step toward reaching our goal by creating two marine refuges on the east coast, including one in Miramichi Bay, in my colleague's riding.
This is just one more example of our real action to protect our oceans for future generations.",Liberal,Papineau,Justin Trudeau,http://www.parl.gc.ca/Parliamentarians/en/members/justin-trudeau(214115)
4720193,ca.proc.d.2017-09-27.9671426,2017-09-27,aa58e8f5-4a46-4c79-8e97-b9ebe28c9d9a,217898,"Hon. Peter Van Loan (York—Simcoe, CPC)",,Oral Questions,Taxation,,"Mr. Speaker, 100 years ago, the wartime government of Robert Laird Borden introduced an income tax. Believe it or not, Liberals actually opposed the new tax—but wait: Liberals opposed the new income tax because it was not high enough.
The Liberal whip of the day said that it would be “a mere flea-bite”, and complained that the new tax “does not take from men enough to make it hurt.”
I give them full marks for consistency, but after 100 years of Liberals continually pressing to raise taxes, is it not time to stop making it hurt so much?",Conservative,York—Simcoe,Peter Van Loan,http://www.parl.gc.ca/Parliamentarians/en/members/peter-van-loan(217898)
4720194,ca.proc.d.2017-09-27.9671430,2017-09-27,b8c04eca-f237-48a8-8975-374ccd40d1a9,214115,"Right Hon. Justin Trudeau (Prime Minister, Lib.)",,Oral Questions,Taxation,,"Mr. Speaker, over the past two years we have seen, after 10 long years of Conservative governance, positive signs of growth, job creation, and an economy on the upswing. A large part of that is because of the investments we made in our communities, in the middle class, and because we lowered taxes on the middle class and raised them on the wealthiest 1%. We brought in the Canada child benefit, which puts more money in the pockets of those who need it by not sending money to those who do not need it. We continue to be committed to making our tax system fairer for Canadians. That is exactly what we are doing with the recent measures we are discussing.",Liberal,Papineau,Justin Trudeau,http://www.parl.gc.ca/Parliamentarians/en/members/justin-trudeau(214115)
4720195,ca.proc.d.2017-09-27.9671433,2017-09-27,3c3175ff-595b-4f50-a58d-b41cd7b5b100,214600,"Hon. Hunter Tootoo (Nunavut, Ind.)",,Oral Questions,Indigenous Affairs,,"Mr. Speaker, my question is for the Prime Minister. The Prime Minister's speech to the UN General Assembly stressed the humiliation, neglect, and abuse that many indigenous people have suffered as a result of colonialism in Canada. The trauma experienced by those of us who attended residential schools has resulted in transgenerational addiction and mental health issues in Nunavut. These issues have contributed and continue to contribute to a suicide rate in Nunavut that is 10 times the national average. Can the Prime Minister inform the House of the government's plan to address this crisis?",Independent,Nunavut,Hunter Tootoo,http://www.parl.gc.ca/Parliamentarians/en/members/hunter-tootoo(214600)
4720196,ca.proc.d.2017-09-27.9671436,2017-09-27,b8c04eca-f237-48a8-8975-374ccd40d1a9,214115,"Right Hon. Justin Trudeau (Prime Minister, Lib.)",,Oral Questions,Indigenous Affairs,,"Mr. Speaker, we are committed to a renewed nation-to-nation relationship and to closing the gap in health and mental wellness outcomes for first nations and Inuit peoples. We are investing more than $300 million each year in community programming to help address the mental wellness needs of first nations and Inuit populations. Budget 2017 also included $118.2 million over five years to supplement existing mental health programming for first nations and Inuit. There remains much more to do, but we are committed to supporting local communities in a true Inuit-to-crown relationship.",Liberal,Papineau,Justin Trudeau,http://www.parl.gc.ca/Parliamentarians/en/members/justin-trudeau(214115)
4720197,ca.proc.d.2017-09-27.9671439,2017-09-27,3176068f-62ee-4b2f-aacd-1131201c6db1,214707,The Speaker,,Oral Questions,Presence in Gallery,,"I would like to draw to the attention of hon. members the presence in the gallery of Her Excellency Malu Dreyer, President of the Federal Council, the Bundesrat, of the Federal Republic of Germany.",Liberal,Halifax West,Geoff Regan,http://www.parl.gc.ca/Parliamentarians/en/members/geoff-regan(214707)
4720198,ca.proc.d.2017-09-27.p5012348,2017-09-27,,,,intervention,Oral Questions,Presence in Gallery,," Hear, hear!",,,Some hon. members,
4720199,ca.proc.d.2017-09-27.9671443,2017-09-27,3176068f-62ee-4b2f-aacd-1131201c6db1,214707,The Speaker,,Oral Questions,Presence in Gallery,,The hon. member for Rosemont—La Petite-Patrie on a point of order.,Liberal,Halifax West,Geoff Regan,http://www.parl.gc.ca/Parliamentarians/en/members/geoff-regan(214707)
4720200,ca.proc.d.2017-09-27.9671444,2017-09-27,3c3ee442-a873-4845-84d0-7da07a66ce61,217244,"Mr. Alexandre Boulerice (Rosemont—La Petite-Patrie, NDP)",,Oral Questions,Aerospace Industry,,"Mr. Speaker, I believe you will find unanimous consent for me to move the following motion: 
 That the House acknowledge the importance of the aerospace industry and the fact that Bombardier is a major employer in Quebec and elsewhere in Canada, as well as reiterate the importance of standing up to protect the industry and jobs against Boeing’s unjustified complaint and the United States government’s preliminary decision. 
",New Democratic Party,Rosemont—La Petite-Patrie,Alexandre Boulerice,http://www.parl.gc.ca/Parliamentarians/en/members/alexandre-boulerice(217244)
4720201,ca.proc.d.2017-09-27.9671445,2017-09-27,3176068f-62ee-4b2f-aacd-1131201c6db1,214707,The Speaker,,Oral Questions,Aerospace Industry,, Does the hon. member have the unanimous consent of the House to move the motion?,Liberal,Halifax West,Geoff Regan,http://www.parl.gc.ca/Parliamentarians/en/members/geoff-regan(214707)
4720202,ca.proc.d.2017-09-27.p5012353,2017-09-27,,,,intervention,Oral Questions,Aerospace Industry,, Agreed.,,,Some hon. members,
4720203,ca.proc.d.2017-09-27.p5012354,2017-09-27,3176068f-62ee-4b2f-aacd-1131201c6db1,214707,The Speaker,,Oral Questions,Aerospace Industry,, The House has heard the terms of the motion. Is it the pleasure of the House to adopt the motion?,Liberal,Halifax West,Geoff Regan,http://www.parl.gc.ca/Parliamentarians/en/members/geoff-regan(214707)
4720204,ca.proc.d.2017-09-27.p5012355,2017-09-27,,,,intervention,Oral Questions,Aerospace Industry,, Agreed,,,Some hon. members,
4720205,ca.proc.d.2017-09-27.p1,2017-09-27,3176068f-62ee-4b2f-aacd-1131201c6db1,214707,The Speaker,,Oral Questions,Aerospace Industry,,(Motion agreed to),Liberal,Halifax West,Geoff Regan,http://www.parl.gc.ca/Parliamentarians/en/members/geoff-regan(214707)
4720206,ca.proc.d.2017-09-27.9671446,2017-09-27,ad4032f2-6bb1-497b-b146-f321cfb71ba9,216102,Hon. Pierre Poilievre,,Oral Questions,Aerospace Industry,,"Mr. Speaker, I rise on a point of order. It is standard practice that whenever members make reference to government documents in the House of Commons, they table them. Earlier on during the debate, I made reference to the “Annual Financial Report of the Government of Canada”, which showed that the wealthiest Canadians paid less tax in the government's first full fiscal year in office, revenues from that group falling by roughly $1 billion. I quoted directly from page 16 of that document.
The Prime Minister said that was all false. I am here today to table the document in question, and trust I will have unanimous and enthusiastic consent from the government.",Conservative,Carleton,Pierre Poilievre,http://www.parl.gc.ca/Parliamentarians/en/members/pierre-poilievre(216102)
4720207,ca.proc.d.2017-09-27.9671448,2017-09-27,3176068f-62ee-4b2f-aacd-1131201c6db1,214707,The Speaker,,Oral Questions,Aerospace Industry,,Does the hon. member have the unanimous consent of the House?,Liberal,Halifax West,Geoff Regan,http://www.parl.gc.ca/Parliamentarians/en/members/geoff-regan(214707)
4720208,ca.proc.d.2017-09-27.p5012359,2017-09-27,,,,intervention,Oral Questions,Aerospace Industry,, No.,,,Some hon. members,
4720209,ca.proc.d.2017-09-27.9671456,2017-09-27,22a6ff7d-fc39-47b2-8003-a016329ed224,229490,"Mr. Matt DeCourcey (Parliamentary Secretary to the Minister of Foreign Affairs, Lib.)",,Routine Proceedings,Foreign Affairs,,"Mr. Speaker, on behalf of the Minister of Foreign Affairs and pursuant to Standing Order 32(2), I have the honour to table, in both official languages, the treaties entitled “Agreement on Enhancing International Arctic Scientific Cooperation,” done at Fairbanks on May 11, 2017; “Acts of the 26th Congress of the Universal Postal Union,” done at Istanbul on October 6, 2016; and “Modifications in Part IV, Section II in Schedule V of Canada to the General Agreement on Tariffs and Trade 1994, pursuant to the Ministerial Decision on Export Competition,” adopted in Nairobi on December 19, 2015. An explanatory memorandum is included with each treaty.",Liberal,Fredericton,Matt DeCourcey,http://www.parl.gc.ca/Parliamentarians/en/members/matt-decourcey(229490)
4720210,ca.proc.d.2017-09-27.9671459,2017-09-27,897d99d9-377d-43a8-81be-27a22174136e,229484,"Mr. Jean Rioux (Parliamentary Secretary to the Minister of National Defence, Lib.)",,Routine Proceedings,Committees of the House,National Defence,"Mr. Speaker, pursuant to Standing Order 109, I have the honour to table, in both official languages, the government's response to the 4th report of the Standing Committee on National Defence entitled “Protection of our Military Personnel”, tabled in the House of Commons on April 6, 2017. ",Liberal,Saint-Jean,Jean Rioux,http://www.parl.gc.ca/Parliamentarians/en/members/jean-rioux(229484)
4720211,ca.proc.d.2017-09-27.9671462,2017-09-27,6322565a-d236-4124-81f3-d869f865f7ef,229560,"Ms. Leona Alleslev (Aurora—Oak Ridges—Richmond Hill, Lib.)",,Routine Proceedings,Interparliamentary Delegations,,"Mr. Speaker, pursuant to Standing Order 34(1) I have the honour to present to the House, in both official languages, the report of the Canadian delegation of the Canadian NATO Parliamentary Association respecting its participation at the 62nd annual session of the Parliamentary assembly, from November 18 to 21, 2016, in Istanbul, Turkey.
Pursuant to Standing Order 34(1), I have the honour to present to the House, in both official languages, the report of the Canadian delegation of the Canadian NATO Parliamentary Association respecting its participation at the joint meeting of the defence and security, economics and security, and political committees in Brussels, Belgium, from February 18 to 20, 2017.",Liberal,Aurora—Oak Ridges—Richmond Hill,Leona Alleslev,http://www.parl.gc.ca/Parliamentarians/en/members/leona-alleslev(229560)
4720212,ca.proc.d.2017-09-27.9671468,2017-09-27,9e8dc941-5170-448f-8b08-591892bb1d05,220102,"Hon. Hedy Fry (Vancouver Centre, Lib.)",,Routine Proceedings,Committees of the House,Canadian Heritage,"Mr. Speaker, I have the honour to present, in both official languages, the 7th report of the Standing Committee on Canadian Heritage entitled “Canadian Women and Girls in Sport”. 
Pursuant to Standing Order 109 the committee requests that the government table a comprehensive response to this report.",Liberal,Vancouver Centre,Hedy Fry,http://www.parl.gc.ca/Parliamentarians/en/members/hedy-fry(220102)
4720213,ca.proc.d.2017-09-27.9671471,2017-09-27,d3ed44bf-a69d-4457-92e3-5e94157c4980,215892,"Mr. Jati Sidhu (Mission—Matsqui—Fraser Canyon, Lib.)",,Routine Proceedings,Petitions,"Immigration, Refugees and Citizenship","Mr. Speaker, this is a petition to the Minister of Immigration, Refugees and Citizenship.
The petitioners call upon the Minister of Immigration, Refugees and Citizenship to repeal the decision to remove Elsje and Ronel to South Africa and grant them landed immigrant status to Canada. They are seeking a safe place to become productive members of our open and welcoming society.",Liberal,Mission—Matsqui—Fraser Canyon,Jati Sidhu,http://www.parl.gc.ca/Parliamentarians/en/members/jati-sidhu(215892)
4720214,ca.proc.d.2017-09-27.9671474,2017-09-27,b37cad30-26f6-40c6-8e4c-dd3a0ba841bb,217034,"Mrs. Cheryl Gallant (Renfrew—Nipissing—Pembroke, CPC)",,Routine Proceedings,Petitions,Taxation,"Mr. Speaker, I am pleased to present a petition signed by campers who stayed at the Bevaline Cottage Resort in Barry's Bay, a quiet, carefree, and relaxing destination in the riding of Renfrew—Nipissing—Pembroke.
 The petitioners call on the government to ensure that campgrounds with fewer than five full-time, year-round employees will continue to be recognized and taxed as small businesses. They are especially concerned that now with the full assault on small businesses, some of their campers, like those who have construction companies, will also be hit with the definition of being a small business, requiring them to have a minimum of five full-time, year-round employees as well.",Conservative,Renfrew—Nipissing—Pembroke,Cheryl Gallant,http://www.parl.gc.ca/Parliamentarians/en/members/cheryl-gallant(217034)
4720215,ca.proc.d.2017-09-27.9671476,2017-09-27,72dace30-741a-4877-8c1c-31b5dc3e4a8e,217971,"Mr. James Bezan (Selkirk—Interlake—Eastman, CPC)",,Routine Proceedings,Petitions,Ukraine,"Mr. Speaker, I have two petitioners to present today, which came in over the summer months.
The first is electronic petition no. 968, which received almost 600 signatures. It is in relation to Ukraine and the conflict in Donbass and Crimea.
The petitioners call upon the government to do a number of things, including signing the Canada–Ukraine Defence Cooperation Arrangement, which the government did, by the way, after a year and a half delay; government reinstate RADARSAT-2 imagery to the Ukraine military, which the Liberals took away and which President Poroshenko asked to receive back, and provide lethal equipment to support the Ukrainian military; and, finally, add Ukraine to the Automatic Firearms Country Control List, which the Conservatives have called on the government to do for quite some time.",Conservative,Selkirk—Interlake—Eastman,James Bezan,http://www.parl.gc.ca/Parliamentarians/en/members/james-bezan(217971)
4720216,ca.proc.d.2017-09-27.9671817,2017-09-27,72dace30-741a-4877-8c1c-31b5dc3e4a8e,217971,"Mr. James Bezan (Selkirk—Interlake—Eastman, CPC)",,Routine Proceedings,Petitions,Falun Gong,"Mr. Speaker, the second petition is in relation to the Falun Gong and the ongoing persecution of those individuals.
The petitioners ask that the Government of Canada condemn the illegal arrest of a Canadian citizen, Ms. Qian Sun, who practises Falun Gong. She was arrested in China on February 19. They call for her immediate and unconditional release.",Conservative,Selkirk—Interlake—Eastman,James Bezan,http://www.parl.gc.ca/Parliamentarians/en/members/james-bezan(217971)
4720217,ca.proc.d.2017-09-27.9671479,2017-09-27,d013e8ca-fdd5-4eb4-a0e4-b5f0782a8f6d,217247,"Mr. Fin Donnelly (Port Moody—Coquitlam, NDP)",,Routine Proceedings,Petitions,Falun Gong,"Mr. Speaker, I would like to table a petition signed by residents of British Columbia, including constituents from my riding of Port Moody—Coquitlam.
The petitioners call on the Government of Canada to condemn the illegal arrest of a Canadian citizen and call for the immediate and unconditional release of Ms. Qian Sun.",New Democratic Party,Port Moody—Coquitlam,Fin Donnelly,http://www.parl.gc.ca/Parliamentarians/en/members/fin-donnelly(217247)
4720218,ca.proc.d.2017-09-27.9671481,2017-09-27,61c83e21-f9a3-4e4b-b881-4b2d1ce33c43,216152,"Mr. John Brassard (Barrie—Innisfil, CPC)",,Routine Proceedings,Petitions,Airline Industry,"Mr. Speaker, Barrie—Innisfil is commonly known as “Terminal 4”. My riding is home to many pilots, flight crews, and many industries that support Pearson International Airport, commonly known as YYZ.
Today, I present e-petition no. 1051, a petition that has generated much conversation around flight safety and flight duty time. I have met with air carrier owners and representatives, pilots' associations, and pilots themselves. This petition has also made it possible for some of these stakeholders to be aware of the changes proposed by Transport Canada. All want to make air travel the safest in the world.
 The petitioners ask the government and the Minister of Transport to seriously consider the input of all concerned, and address the proposed flight fatigue rules. The petition has 9,056 signatures. I support this petition, and proudly present it in the House today.",Conservative,Barrie—Innisfil,John Brassard,http://www.parl.gc.ca/Parliamentarians/en/members/john-brassard(216152)
4720219,ca.proc.d.2017-09-27.9671483,2017-09-27,ad4032f2-6bb1-497b-b146-f321cfb71ba9,216102,"Hon. Pierre Poilievre (Carleton, CPC)",,Routine Proceedings,Petitions,The Environment,"Mr. Speaker, I rise today to introduce petitions.
The first petition is from almost 2,000 Canadians who demand an end to the carbon tax coverup and ask for simple, straightforward answers on what the carbon tax will cost them.",Conservative,Carleton,Pierre Poilievre,http://www.parl.gc.ca/Parliamentarians/en/members/pierre-poilievre(216102)
