basepk,hid,speechdate,pid,opid,speakeroldname,speakerposition,maintopic,subtopic,subsubtopic,speechtext,speakerparty,speakerriding,speakername,speakerurl
4719493,ca.proc.d.2017-09-25.9662812,2017-09-25,2490b23e-4439-4513-9d54-6fceb6320267,220306,"Ms. Cheryl Hardcastle (Windsor—Tecumseh, NDP)",,Oral Questions,Automotive Industry,,"Mr. Speaker, on defending Canadians, Windsor's city council is calling on the federal government to make the protection and growth of Canada's automotive sector a key priority in NAFTA renegotiations, and the resolution is important to both Windsor and Essex County and to all of Canada. 
With no national auto strategy, the Liberals are silent on their plan to fortify our automotive industry. Can the minister reassure the people of Windsor how the Government of Canada is actively and aggressively promoting our best interests in the auto industry?",New Democratic Party,Windsor—Tecumseh,Cheryl Hardcastle,http://www.parl.gc.ca/Parliamentarians/en/members/cheryl-hardcastle(220306)
4719494,ca.proc.d.2017-09-25.9662815,2017-09-25,3dd9162a-4763-4000-8c8a-706a788f7e50,229209,"Hon. Chrystia Freeland (Minister of Foreign Affairs, Lib.)",,Oral Questions,Automotive Industry,,"Mr. Speaker, I am very pleased to have this opportunity to reassure the people of Windsor and in fact all Canadians that we absolutely understand the importance of manufacturing and the automotive sector to our economy. Those are good, well-paying, very often unionized jobs, and we will fight to keep them here in Canada. I do want to point out, particularly for Americans who might be listening to us today, that North American content levels in Canada-produced vehicles are on average considerably higher than in vehicles produced in the U.S. and Mexico, and that is a good thing.",Liberal,University—Rosedale,Chrystia Freeland,http://www.parl.gc.ca/Parliamentarians/en/members/chrystia-freeland(229209)
4719495,ca.proc.d.2017-09-25.9662819,2017-09-25,f40d602c-1ae6-414e-bac3-23a2f31f1cdf,224989,"Ms. Linda Duncan (Edmonton Strathcona, NDP)",,Oral Questions,The Environment,,"Mr. Speaker, further on transparency, the government claims it is seeking inclusion of strong environment and climate provisions in a modernized NAFTA, yet there are no environment advisers on the minister's NAFTA council. At the eleventh hour, the Minister of Environment and Climate Change formed a NAFTA subgroup, promising openness and transparency, yet refusing to reveal the measures the Liberals are seeking in the new deal. 
How can Canadians have faith that the Liberals are strengthening environment in trade deals without transparency? When will the minister come clean on what the Liberals are actually seeking for the environment at the negotiation table?",New Democratic Party,Edmonton Strathcona,Linda Duncan,http://www.parl.gc.ca/Parliamentarians/en/members/linda-duncan(224989)
4719496,ca.proc.d.2017-09-25.9662822,2017-09-25,cee27afa-cdf8-4e99-ab22-22290f86aa3a,214082,"Hon. Catherine McKenna (Minister of Environment and Climate Change, Lib.)",,Oral Questions,The Environment,,"Mr. Speaker, there are many environmentalists on my advisory council. There are also an indigenous leader, business leaders, and academics. We believe that we are going to have the strongest environmental protections. We are going to fight for them. We know that is the right thing to do. We understand that the environment and the economy go together, and Canadians expect clean air, clean water, and action on climate change.",Liberal,Ottawa Centre,Catherine McKenna,http://www.parl.gc.ca/Parliamentarians/en/members/catherine-mckenna(214082)
4719497,ca.proc.d.2017-09-25.9662828,2017-09-25,61c83e21-f9a3-4e4b-b881-4b2d1ce33c43,216152,"Mr. John Brassard (Barrie—Innisfil, CPC)",,Oral Questions,Government Appointments,,"Mr. Speaker, the Liberal government continues working hard for Liberal insiders and those wanting to join the Liberal insiders.
Cynthia Wesley-Esquimaux ran unsuccessfully for the federal Liberals in 2011 in the riding of York—Simcoe last year. The Liberals gave her an unbelievable $437,000 contract to consult on first nation child welfare issues and write a report.
How can the Prime Minister justify paying this Liberal insider $55,000 a month when seniors, veterans, and indigenous communities struggle month to month just to survive?",Conservative,Barrie—Innisfil,John Brassard,http://www.parl.gc.ca/Parliamentarians/en/members/john-brassard(216152)
4719498,ca.proc.d.2017-09-25.9662833,2017-09-25,f470e27a-a074-4b16-8304-960ffe8c9289,233806,"Hon. Carolyn Bennett (Minister of Crown-Indigenous Relations and Northern Affairs, Lib.)",,Oral Questions,Government Appointments,,"Mr. Speaker, our government is committed to completely overhauling child and family services in full partnership with first nations communities.
The special representative met with 261 chiefs, experts, officials, advocates, and individuals with lived experience from coast to coast to coast to inform our commitment to first nations child welfare reform.
We look forward to receiving a report and recommendations on how we transform the system to better support and reflect the needs of first nations children and to put their well-being first.",Liberal,Toronto—St. Paul's,Carolyn Bennett,http://www.parl.gc.ca/Parliamentarians/en/members/carolyn-bennett(233806)
4719499,ca.proc.d.2017-09-25.9662835,2017-09-25,9ad0ff66-1598-45e6-b146-6dd0eefb9cd0,216712,"Mr. Alexander Nuttall (Barrie—Springwater—Oro-Medonte, CPC)",,Oral Questions,Government Appointments,,"Mr. Speaker, Cynthia Wesley-Esquimaux is unapologetic about her major taxpayer-funded payout. She believes that because she paid tax on the income, it is no big deal. She even went so far as to scold first nations advocates for not blindly praising her work. The Liberals know what they did is wrong, yet they continue to do it.
Can the minister explain how giving $437,000 to a Liberal insider is somehow helping Canadian indigenous youth?",Conservative,Barrie—Springwater—Oro-Medonte,Alex Nuttall,http://www.parl.gc.ca/Parliamentarians/en/members/alex-nuttall(216712)
4719500,ca.proc.d.2017-09-25.9662837,2017-09-25,f470e27a-a074-4b16-8304-960ffe8c9289,233806,"Hon. Carolyn Bennett (Minister of Crown-Indigenous Relations and Northern Affairs, Lib.)",,Oral Questions,Government Appointments,,"Mr. Speaker, we acknowledge the disproportionate number of indigenous children in the child welfare system. We believe that transformation requires investments in children, families, and communities, not in lawyers, agencies, and non-indigenous foster families.
The MSR was critical to understanding the needs of communities in order to overhaul the system and preventing children from entering the system at all.",Liberal,Toronto—St. Paul's,Carolyn Bennett,http://www.parl.gc.ca/Parliamentarians/en/members/carolyn-bennett(233806)
4719501,ca.proc.d.2017-09-25.9662840,2017-09-25,b42374fa-e181-4337-93e9-2a5c41eb5d1e,217546,"Hon. Rob Nicholson (Niagara Falls, CPC)",,Oral Questions,Justice,,"Mr. Speaker, the Ontario Superior Court of Justice is warning that it desperately needs more judges. Just last week, B.C. courts were forced to shut down because of the government's indecision. What is the problem with the government? Why did it not make these judicial appointments? It had all summer to do it, and now we have a situation of Ontario desperately needing 12 more judges. There are 57 vacancies. 
I have a solution for the Liberals. If they cannot get the job done, turn it over to us and we will make the appointments. How about that?",Conservative,Niagara Falls,Rob Nicholson,http://www.parl.gc.ca/Parliamentarians/en/members/rob-nicholson(217546)
4719502,ca.proc.d.2017-09-25.9662844,2017-09-25,cd83ba99-0c5b-4f51-a42b-a73504b91199,214903,"Hon. Jody Wilson-Raybould (Minister of Justice and Attorney General of Canada, Lib.)",,Oral Questions,Justice,,"Mr. Speaker, to reiterate, I take the appointment of Superior Court justices incredibly seriously. Our government has taken significant steps to make the process for the appointment of judges open and transparent, with a focus on embracing diversity.
To date, I have been pleased to appoint 109 Superior Court justices across the country, including 22 deputy judges in the territories. I will continue to ensure that we appoint very meritorious candidates to fill the remaining vacancies across the country.",Liberal,Vancouver Granville,Jody Wilson-Raybould,http://www.parl.gc.ca/Parliamentarians/en/members/jody-wilson-raybould(214903)
4719503,ca.proc.d.2017-09-25.9662858,2017-09-25,c127569a-6bb5-4afe-b64b-401affe669d2,229527,"Ms. Gudie Hutchings (Long Range Mountains, Lib.)",,Oral Questions,Social Development,,"Mr. Speaker, I would like to ask the minister responsible for seniors about an issue that occurred in the past month. Some seniors living separately for no reason of their own seem to be being denied their GIS benefits. 
Can the minister tell the House what action he has taken to ensure our seniors get all the benefits they deserve?",Liberal,Long Range Mountains,Gudie Hutchings,http://www.parl.gc.ca/Parliamentarians/en/members/gudie-hutchings(229527)
4719504,ca.proc.d.2017-09-25.9662861,2017-09-25,d67a49c2-65bd-411e-8bb4-29ff759c5829,214003,"Hon. Jean-Yves Duclos (Minister of Families, Children and Social Development, Lib.)",,Oral Questions,Social Development,,"Mr. Speaker, I would like to thank the member for Long Range Mountains for her remarkable work on behalf of seniors.
Our government recognizes Canadian seniors' contributions to building our country and is committed to improving the lives of our seniors.
I would like to thank members on all sides of the House who brought this matter to my attention. I have tasked my officials to correct the rules and to contact affected seniors to review their applications.
Our government is keen to improve the lives of seniors, and we will continue to do that.",Liberal,Québec,Jean-Yves Duclos,http://www.parl.gc.ca/Parliamentarians/en/members/jean-yves-duclos(214003)
4719505,ca.proc.d.2017-09-25.9662863,2017-09-25,b6850f16-57dc-486c-b5bb-0fd191022af4,216512,"Mr. Garnett Genuis (Sherwood Park—Fort Saskatchewan, CPC)",,Oral Questions,Foreign Affairs,,"Mr. Speaker, the Conservatives have been raising the plight of the Rohingya people for over a year, and we have not been getting answers from the government. The Prime Minister was asked directly about this in the spring but did not agree to take the needed action at that time. Unlike many world leaders, the Prime Minister declined to discuss this ongoing ethnic cleansing in a speech to the UN, despite the escalation.
What, if anything, has the government's much-trumpeted Office of Human Rights, Freedoms and Inclusion been doing to help Rohingya people?",Conservative,Sherwood Park—Fort Saskatchewan,Garnett Genuis,http://www.parl.gc.ca/Parliamentarians/en/members/garnett-genuis(216512)
4719506,ca.proc.d.2017-09-25.9662866,2017-09-25,3dd9162a-4763-4000-8c8a-706a788f7e50,229209,"Hon. Chrystia Freeland (Minister of Foreign Affairs, Lib.)",,Oral Questions,Foreign Affairs,,"Mr. Speaker, we are absolutely seized by the urgent question of the persecution of the Rohingya. Based on reports from the region, this is ethnic cleansing, and it is important for Canada to condemn it in the strongest possible terms and to act. It is important particularly to call on the military leadership to cease this horror. 
The Prime Minister has spoken directly with Aung San Suu Kyi about this. I have spoken to Kofi Annan. At the UN last week we were working closely with allies such as Indonesia and Turkey on—",Liberal,University—Rosedale,Chrystia Freeland,http://www.parl.gc.ca/Parliamentarians/en/members/chrystia-freeland(229209)
4719507,ca.proc.d.2017-09-25.9662867,2017-09-25,3176068f-62ee-4b2f-aacd-1131201c6db1,214707,The Speaker,,Oral Questions,Foreign Affairs,,The hon. member for Trois-Rivières.,Liberal,Halifax West,Geoff Regan,http://www.parl.gc.ca/Parliamentarians/en/members/geoff-regan(214707)
4719508,ca.proc.d.2017-09-25.9662869,2017-09-25,075456c7-3cca-483c-b4f1-85006031ca09,224982,"Mr. Robert Aubin (Trois-Rivières, NDP)",,Oral Questions,Housing,,"Mr. Speaker, on Friday, we learned that it will take at least a year to find out the results of the appeal filed by pyrrhotite victims regarding their initial lawsuit. As you can imagine, things will take even longer for upcoming trials, if that is even possible, given all of the victims who are caught in the grey area and are still without recourse.
Despite the seriousness of the situation, the government is dragging its feet or refusing to do anything to establish a scientific standard on the presence of pyrrhotite.
When will the government finally do something to help the families who are caught in the grey area?",New Democratic Party,Trois-Rivières,Robert Aubin,http://www.parl.gc.ca/Parliamentarians/en/members/robert-aubin(224982)
4719509,ca.proc.d.2017-09-25.9662874,2017-09-25,d67a49c2-65bd-411e-8bb4-29ff759c5829,214003,"Hon. Jean-Yves Duclos (Minister of Families, Children and Social Development, Lib.)",,Oral Questions,Housing,,"Mr. Speaker, I thank our colleague for once again raising the issue of pyrrhotite, which is very important in the Mauricie region. 
As our colleague said, as soon as we took office, we implemented important measures to keep one of our promises and to ensure that the families affected by the situation are treated respectfully and their concerns are addressed in a timely manner.
We are pleased that things have improved since then, and we continue to listen, so that our government can continue to make Canadian families and their housing conditions a priority.",Liberal,Québec,Jean-Yves Duclos,http://www.parl.gc.ca/Parliamentarians/en/members/jean-yves-duclos(214003)
4719510,ca.proc.d.2017-09-25.9662877,2017-09-25,7a2a1996-59b6-46e8-8ed0-9ea3c0fcf4ad,224981,"Mr. Marc Serré (Nickel Belt, Lib.)",,Oral Questions,Government Appointments,,"Mr. Speaker, I am proud to rise today as a Franco-Ontarian.
The Minister of Justice introduced significant reforms to the judicial appointment process. Her reform promotes diversity, gender balance, and bilingualism. I am pleased to see that five of the eight judges who were appointed in eastern Ontario are perfectly bilingual. 
Minister, could you inform the House of the steps our government has taken to strengthen the bilingual capacity of our courts?",Liberal,Nickel Belt,Marc Serré,http://www.parl.gc.ca/Parliamentarians/en/members/marc-serre(224981)
4719511,ca.proc.d.2017-09-25.9662879,2017-09-25,3176068f-62ee-4b2f-aacd-1131201c6db1,214707,The Speaker,,Oral Questions,Government Appointments,,"I must remind the hon. member, and possibly the assistants who write his questions, to address his comments to the Chair.
The hon. Minister of Justice. ",Liberal,Halifax West,Geoff Regan,http://www.parl.gc.ca/Parliamentarians/en/members/geoff-regan(214707)
4719512,ca.proc.d.2017-09-25.9662880,2017-09-25,cd83ba99-0c5b-4f51-a42b-a73504b91199,214903,"Hon. Jody Wilson-Raybould (Minister of Justice and Attorney General of Canada, Lib.)",,Oral Questions,Government Appointments,,"Mr. Speaker, I am very pleased that the critical reforms to the judicial appointments process have led to increased bilingual capacity. As mentioned, five out of the eight judges in northeastern Ontario are fluently bilingual. 
To build on these reforms, today our government is launching an action plan to enhance the bilingual capacity of Canada's superior courts. This multi-faceted approach will ensure that we move forward so individuals can have a hearing before a judge in both official languages. ",Liberal,Vancouver Granville,Jody Wilson-Raybould,http://www.parl.gc.ca/Parliamentarians/en/members/jody-wilson-raybould(214903)
4719513,ca.proc.d.2017-09-25.9662882,2017-09-25,0bd5970c-e4c2-4044-8344-8123b16d75bd,234389,"Hon. Peter Kent (Thornhill, CPC)",,Oral Questions,Justice,,"Mr. Speaker, the Liberals abandoned the court of law to offer a $10.5 million settlement payoff to Omar Khadr, a confessed terrorist. The Liberals chose not to defend Omar Khadr's outrageous claim. They just wanted it all to go away. Then the Liberals tried to hide this extravagant, outrageous payoff from Canadians and Americans.
Did the cabinet follow this deceitful course while knowing of Mr. Khadr's victims' outstanding court order claims against him?",Conservative,Thornhill,Peter Kent,http://www.parl.gc.ca/Parliamentarians/en/members/peter-kent(234389)
4719514,ca.proc.d.2017-09-25.9662887,2017-09-25,1a1a9dee-c228-40fc-b926-42f8441d84f0,214405,"Hon. Ralph Goodale (Minister of Public Safety and Emergency Preparedness, Lib.)",,Oral Questions,Justice,,"Mr. Speaker, sadly, this was a case of the rights of a Canadian in jail being violated by Canadian government officials. A settlement in this case was court supervised and based upon the hard facts, the law, the constitution, and two unequivocal rulings by the Supreme Court of Canada, and the decision was taken. Rights are not optional. Violating them is costly. There was no chance of winning the civil lawsuit. As much as $40 million could have been lost, and a settlement in this case saved taxpayers millions of dollars. ",Liberal,Regina—Wascana,Ralph Goodale,http://www.parl.gc.ca/Parliamentarians/en/members/ralph-goodale(214405)
4719515,ca.proc.d.2017-09-25.9662890,2017-09-25,e915cec9-7164-4846-aeb5-d5bf2e4f3598,214562,"Mr. Xavier Barsalou-Duval (Pierre-Boucher—Les Patriotes—Verchères, BQ)",,Oral Questions,International Trade,,"Mr. Speaker, as a result of a barrage of tweets from Donald Trump, our supply management system is now being targeted by U.S. lobby groups.
In Quebec, we are proud of our farming model of family-owned farms. The Liberals already abandoned our dairy farmers during negotiations with Europe. They had better not do the same with NAFTA.
Will the minister make a solemn commitment to keep the supply management system precisely as it is, with no changes?",Bloc Québécois,Pierre-Boucher—Les Patriotes—Verchères,Xavier Barsalou-Duval,http://www.parl.gc.ca/Parliamentarians/en/members/xavier-barsalou-duval(214562)
4719516,ca.proc.d.2017-09-25.9662895,2017-09-25,a25e0e6b-f3fa-46c7-a795-ad60037fe56e,213962,"Hon. Lawrence MacAulay (Minister of Agriculture and Agri-Food, Lib.)",,Oral Questions,International Trade,,"Mr. Speaker, I can assure my hon. colleague that this government is the government that will protect supply management and this is the party that fought to put it in place. This is also the government that put the innovation package together to make sure that supply management in the dairy sector in the country thrived.
 I can assure my hon. colleague that this government has and will continue to support supply management.",Liberal,Cardigan,Lawrence MacAulay,http://www.parl.gc.ca/Parliamentarians/en/members/lawrence-macaulay(213962)
4719517,ca.proc.d.2017-09-25.9662897,2017-09-25,530dc476-c9bf-477c-83e7-6efc545f2bf8,224177,"Mr. Luc Thériault (Montcalm, BQ)",,Oral Questions,Foreign Affairs,,"Mr. Speaker, the Prime Minister has been inconsistent and has had very little positive impact on human rights and democracy. A direct attack has been made on Catalonia, and he has said nothing.
How can he justify his silence? What is he waiting for? When will he call on the Spanish government to order under the International Covenant on Civil and Political Rights that both Canada and Spain signed and ratified?",Bloc Québécois,Montcalm,Luc Thériault,http://www.parl.gc.ca/Parliamentarians/en/members/luc-theriault(224177)
4719518,ca.proc.d.2017-09-25.9662902,2017-09-25,3dd9162a-4763-4000-8c8a-706a788f7e50,229209,"Hon. Chrystia Freeland (Minister of Foreign Affairs, Lib.)",,Oral Questions,Foreign Affairs,," Mr. Speaker, Canada enjoys friendly relations with Spain. The issue of Catalonia falls squarely under Spanish domestic affairs. We hope that the country's internal debates come to a harmonious and respectful end in accordance with its constitutional framework. ",Liberal,University—Rosedale,Chrystia Freeland,http://www.parl.gc.ca/Parliamentarians/en/members/chrystia-freeland(229209)
4719519,ca.proc.d.2017-09-25.9662905,2017-09-25,eaa6694f-1e20-4aae-ad3b-e694b0e12c59,224170,"Ms. Elizabeth May (Saanich—Gulf Islands, GP)",,Oral Questions,Taxation,,"Mr. Speaker, my question is for the Minister of Finance.
I had eight town halls recently in my riding and, not surprisingly, heard from many constituents on their concerns about the proposed tax changes. One young doctor made a point that I have not heard from others.
 If we look at the demographics of how many doctors are near retirement and how they have structured their income and practice around the tax laws as they have been for decades, his fear is that we might have an unintended consequence of tax changes in a doctor shortage, as many doctors near retirement might decide to retire early. 
Could we phase-in tax changes or grandfather certain professions?",Green Party,Saanich—Gulf Islands,Elizabeth May,http://www.parl.gc.ca/Parliamentarians/en/members/elizabeth-may(224170)
4719520,ca.proc.d.2017-09-25.9662909,2017-09-25,5d3dfa7b-f157-4019-ac2a-4dab0cb15f92,213961,"Hon. Bill Morneau (Minister of Finance, Lib.)",,Oral Questions,Taxation,,"Mr. Speaker, we understand that getting to a fair tax system, a system that does not encourage people to incorporate so they pay a lower tax rate than middle-class Canadians, requires understanding the specifics of different cases. I appreciate the member bringing forward this idea. We are certainly listening to people to make sure we get this right.
 We are making sure that, as move forward, we grandfather existing amounts, which is important. We are also making sure to consider how to best move forward in a way that is going to get to our objective, while considering the ongoing goal of investing in our economy.",Liberal,Toronto Centre,Bill Morneau,http://www.parl.gc.ca/Parliamentarians/en/members/bill-morneau(213961)
4719521,ca.proc.d.2017-09-25.9662921,2017-09-25,b37cad30-26f6-40c6-8e4c-dd3a0ba841bb,217034,"Mrs. Cheryl Gallant (Renfrew—Nipissing—Pembroke, CPC)",,Routine Proceedings,Petitions,Taxation,"Mr. Speaker, I am pleased to present a petition signed by campers who stayed at the Busy Beaver Campground in Hilton Township, Ontario, located on the historic St. Joseph Island in the riding of Algoma—Manitoulin—Kapuskasing.
The petitioners call on the government to ensure that campgrounds with fewer than five full-time employees will continue to be recognized and taxed as small businesses. As John Ivison of the National Post so aptly pointed out, higher taxes are resulting in lower revenues.
Why are we increasing taxes on campgrounds by 33% anyway, just to put them out of business?",Conservative,Renfrew—Nipissing—Pembroke,Cheryl Gallant,http://www.parl.gc.ca/Parliamentarians/en/members/cheryl-gallant(217034)
4719522,ca.proc.d.2017-09-25.9662926,2017-09-25,bd2068aa-74c7-430a-bdf5-6f17b14ca140,216501,"Mr. Tom Kmiec (Calgary Shepard, CPC)",,Routine Proceedings,Petitions,Motor Vehicle Safety Act,"Mr. Speaker, I have four petitions to table.
 The first is signed by 100 constituents in my riding regarding the Motor Vehicle Safety Act. I have to thank Tim Reed for getting these signatures on the petition.
 What is basically being called for is equal treatment for American plated vehicles owned by Canadians so they receive the same treatment as Canadian plated vehicles in the United States.",Conservative,Calgary Shepard,Tom Kmiec,http://www.parl.gc.ca/Parliamentarians/en/members/tom-kmiec(216501)
4719523,ca.proc.d.2017-09-25.9663061,2017-09-25,bd2068aa-74c7-430a-bdf5-6f17b14ca140,216501,"Mr. Tom Kmiec (Calgary Shepard, CPC)",,Routine Proceedings,Petitions,Religious Freedom,"Mr. Speaker, the next petition is on Bill C-51, regarding religious freedoms. There are 43 signatures on it.
 The petitioners ask that the government not remove section 176 of the Criminal Code, which would eliminate protection for members of the clergy and faith assemblies. 
 The third petition I am tabling today is on behalf of 36 petitioners. The petitioners have grave concerns about Motion No. 103 that was passed in the last session.",Conservative,Calgary Shepard,Tom Kmiec,http://www.parl.gc.ca/Parliamentarians/en/members/tom-kmiec(216501)
4719524,ca.proc.d.2017-09-25.9663110,2017-09-25,bd2068aa-74c7-430a-bdf5-6f17b14ca140,216501,"Mr. Tom Kmiec (Calgary Shepard, CPC)",,Routine Proceedings,Petitions,Falun Gong,"Mr. Speaker, finally, I am tabling my final petition signed by 128 petitioners.
The petitioners call the attention of the government to the treatment of Falun Gong followers in China. Specifically, they ask for three things: to establish measures to stop the Chinese regime mass killing of innocent people for organ harvesting; for the Government of Canada to take every opportunity to call for an end to the persecution of Falun Gong practitioners; and to urge the Chinese authorities to bring former leader Jiang Zemin to justice.",Conservative,Calgary Shepard,Tom Kmiec,http://www.parl.gc.ca/Parliamentarians/en/members/tom-kmiec(216501)
