basepk,hid,speechdate,pid,opid,speakeroldname,speakerposition,maintopic,subtopic,subsubtopic,speechtext,speakerparty,speakerriding,speakername,speakerurl
4720279,ca.proc.d.2017-09-27.9672606,2017-09-27,1ad00957-54b5-494d-8773-b530fbe4967b,217599,"Mr. Mel Arnold (North Okanagan—Shuswap, CPC)",,Government Orders,Oceans Act,,"Madam Speaker, I appreciate the opportunity to speak today, but not knowing when I will be cut off is awkward. Hopefully I can get through my speech today.
I rise today to speak to Bill C-55, an act to amend the Oceans Act and the Canada Petroleum Resources Act. The bill proposes to significantly increase the powers of the Minister of Fisheries, Oceans and the Canadian Coast Guard so as to allow the minister to designate marine protected areas, or MPAs, for an interim period of up to five years.
The Standing Committee on Fisheries and Oceans is currently studying MPAs, specifically the criteria and process being used to identify and establish them.
Last December, I presented a motion to committee to undertake this study because it was clear to me that massive efforts and a significant amount of funding was being exerted by the government to increase MPAs, while stakeholders living and working along Canada's coasts were unaware of what was happening. At that time, it was clear that the government was exerting pressure on the established process and protocols for establishing MPAs in an effort to speed up that process. It was also clear that the government was willing to sacrifice processes of consensus-building with Canadians for the sake of expediency.
First nations, fishermen, cargo shippers, tourism operators, conservation groups, academics, and many other stakeholders continue to face consequences of the government's frantic and half-baked approach to speeding up the process of establishing MPAs.
Why is the government in such a hurry? Why is it so desperate that it needs to propose a bill that would nullify long-established processes and protocols used to establish consensus among stakeholders?
The answer is that in 2015, the Liberals set delivery dates for achieving MPA objectives that the previous Conservative government had committed to through the Aichi targets under the UN Convention on Biological Diversity, or CBD.
Through the Aichi targets, the Conservative government in 2010 committed to conserving 10% of our coastal and marine areas through networks of protected areas and other effective area-based conservation measures, not necessarily MPAs.
The objectives of conserving coastal and marine areas are worthy objectives, but the problem that thousands of Canadians working and living in coastal areas face today is that they have been cut out of the process for establishing MPAs. Why? Because the Liberal government has failed to deliver so many campaign promises that the pressure is on to deliver these commitments made by the Conservatives. The problem is that the timelines promised by the Liberals in the election were unrealistic in 2015, and they are unrealistic today.
The Liberal government has overwhelmed the established structures and processes for developing MPAs. Rather than stepping back and re-assessing its timeline, the Liberal government, through this legislation, is attempting to discard the systems, structures, and processes that have been used for years to establish MPAs in Canada.
Through the bill, the Liberal government proposes to give the fisheries minister increased powers to completely bypass established structures and processes designed to build consensus, designed to identify the right balance to strike in considering the interests of first nations, fishermen, and other Canadians affected by MPAs.
Bill C-55 would allow for arbitrary interim designation of MPAs prior to formal consultations with first nations or area stakeholders.
It is completely unacceptable in Canada, or anywhere for that matter, for the federal government to undermine structures and processes that allow citizens, including first nations, to engage and defend their interests when the government is considering a decision that could have a major effect on those citizens.
Upon reviewing the mandate letter of the Minister of Fisheries, Oceans and the Canadian Coast Guard, it was clear the government was going to do everything it could to reach its political targets come hell or high water, pardon the pun.
Considering that the 2010 Aichi targets were given 10 years to be implemented, it occurred to me that there may be a reason for the long time frame set to reach these targets. 
The Standing Committee on Fisheries and Oceans, or FOPO, as it is known here on the Hill, consists of members from across the country and the three main political parties in the House. It is an honour to sit on that committee with members who I believe share a common commitment to fish, fisheries, and their habitat. 
The FOPO committee is still in the midst of this study on MPAs, and has so far heard from witnesses from many areas of Canada and abroad. The committee had benefited greatly from testimony by first nations, fishermen, conservationists, and representatives from the shipping and tourism sectors. What has been even more interesting are the common themes borne in the testimony and the evidence the committee has received. 
The committee has heard that proper consultation before and during the process of establishing MPAs is paramount to establishing MPAs that are both effective and accepted, especially consultation with and by local communities. Nowhere was this more evident than in the north where MPAs have been established for the protection of our aboriginal fishing and harvesting areas. These areas were established where the local people wanted them, in the manner in which the local people wanted them, and only after appropriate consultation was completed. It was not in an arbitrary manner, absent of scientific certainty, to meet a political target.
I raise the point of scientific certainty here, because in one of the most alarming clauses in Bill C-55, proposed section 35.2 reads:
 The Governor in Council and the Minister shall not use lack of scientific certainty regarding the risks posed by any activity that may be carried out in certain areas of the sea as a reason to postpone or refrain from exercising their powers or performing their duties and functions under subsection 35(3) or 35.1(2). 
Now, not everyone may take the time to understand what this means. However, it means that the minister would not need the backing of science to designate a marine protected area. There would be no science necessary.
It is shameful that the current Liberal government's 2015 policy platform alluded to basing decisions on science, yet now as government, it is proposing to discard the structures and processes of consultation and science by setting the will of the minister above the needs and interests of all Canadians, including first nations. 
I support marine protected areas. Canada has some of the most biodiverse regions in the world, and our coasts are truly rich in biodiversity. We need to recognize and identify where those important and sensitive areas are and take measures to protect them while at the same time recognize that we can harvest and develop sustainably, so that our country can prosper, maintain our high standards, and be able to enforce the laws and protect the areas we designate. If we choose to move forward without first knowing what it is we were trying to protect, or what industry we may be prejudicing, we will fail in our duties to the Canadians who have elected us to represent them here in the House.
Getting back to the study by the FOPO committee, I could quote from a number of witnesses who testified that the process of establishing MPAs has been rushed. For example, Mr. Ian MacPherson, executive director of Prince Edward Island Fishermen's Association, stated:
 ...the PEIFA understands the requirement to protect marine environments, but we do have concerns surrounding the tight timelines to accomplish these goals. The first step to designating a ministerial order MPA is to gather existing scientific, economic, social, and cultural information on the area. Prince Edward Island is a small province driven by small fishing communities. The displacement of fishers from one community— 
It would appear that I am out of time. Hopefully, I will be able to continue my speech tomorrow.",Conservative,North Okanagan—Shuswap,Mel Arnold,http://www.parl.gc.ca/Parliamentarians/en/members/mel-arnold(217599)
4720280,ca.proc.d.2017-09-27.9672750,2017-09-27,cedf1659-ebb1-4f26-b723-5c7c5353988b,214948,The Assistant Deputy Speaker (Mrs. Carol Hughes),,Government Orders,Oceans Act,,"I am sorry to interrupt, but the member will have 10 minutes remaining in his speech the next time this matter is before the House.",New Democratic Party,Algoma—Manitoulin—Kapuskasing,Carol Hughes,http://www.parl.gc.ca/Parliamentarians/en/members/carol-hughes(214948)
4720281,ca.proc.d.2017-09-27.p5012681,2017-09-27,,,,stagedirection,Government Orders,Access to Information Act,,"The House resumed from September 26 consideration of the motion that Bill C-58, An Act to amend the Access to Information Act and the Privacy Act and to make consequential amendments to other Acts, be read the second time and referred to a committee.",,,,
4720282,ca.proc.d.2017-09-27.9672756,2017-09-27,cedf1659-ebb1-4f26-b723-5c7c5353988b,214948,The Deputy Chair,,Government Orders,Access to Information Act,,"It being 5:30 p.m., the House will now proceed to the taking of the deferred recorded division on the motion at second reading stage of Bill C-58.
Call in the members.",New Democratic Party,Algoma—Manitoulin—Kapuskasing,Carol Hughes,http://www.parl.gc.ca/Parliamentarians/en/members/carol-hughes(214948)
4720283,ca.proc.d.2017-09-27.p5012684,2017-09-27,,,,stagedirection,Government Orders,Access to Information Act,,"(The House divided on the motion, which was agreed to on the following division:)
Vote #350",,,,
4720284,ca.proc.d.2017-09-27.9672757,2017-09-27,3176068f-62ee-4b2f-aacd-1131201c6db1,214707,The Speaker,,Government Orders,Access to Information Act,,"I declare the motion carried. Accordingly, the bill stands referred to the Standing Committee on Access to Information, Privacy and Ethics.
(Bill read the second time and referred to a committee)",Liberal,Halifax West,Geoff Regan,http://www.parl.gc.ca/Parliamentarians/en/members/geoff-regan(214707)
4720285,ca.proc.d.2017-09-27.p5012686,2017-09-27,,,,stagedirection,Government Orders,Customs Act,,"The House resumed from September 26 consideration of the motion that Bill C-21, An Act to amend the Customs Act, be read the second time and referred to a committee.",,,,
4720286,ca.proc.d.2017-09-27.9672780,2017-09-27,3176068f-62ee-4b2f-aacd-1131201c6db1,214707,The Speaker,,Government Orders,Customs Act,,The House will now proceed to the taking of the deferred recorded division on the motion at second reading stage of Bill C-21.,Liberal,Halifax West,Geoff Regan,http://www.parl.gc.ca/Parliamentarians/en/members/geoff-regan(214707)
4720287,ca.proc.d.2017-09-27.p5012688,2017-09-27,,,,stagedirection,Government Orders,Customs Act,,"(The House divided on the motion, which was agreed to on the following division:)
Vote #351",,,,
4720288,ca.proc.d.2017-09-27.9672765,2017-09-27,3176068f-62ee-4b2f-aacd-1131201c6db1,214707,The Speaker,,Government Orders,Customs Act,,"I declare the motion carried. Accordingly, the bill stands referred to the Standing Committee on Public Safety and National Security.
(Bill read the second time and referred to a committee)",Liberal,Halifax West,Geoff Regan,http://www.parl.gc.ca/Parliamentarians/en/members/geoff-regan(214707)
4720289,ca.proc.d.2017-09-27.p5012690,2017-09-27,,,,stagedirection,Private Members' Business,Controlled Drugs and Substances Act,,"The House resumed from September 21 consideration of the motion that Bill C-338, An Act to amend the Controlled Drugs and Substances Act (punishment), be read the second time and referred to a committee.",,,,
4720290,ca.proc.d.2017-09-27.9672767,2017-09-27,3176068f-62ee-4b2f-aacd-1131201c6db1,214707,The Speaker,,Private Members' Business,Controlled Drugs and Substances Act,,"The House will now proceed to the taking of the deferred division on the motion at second reading stage of Bill C-338, under private members' business.",Liberal,Halifax West,Geoff Regan,http://www.parl.gc.ca/Parliamentarians/en/members/geoff-regan(214707)
4720291,ca.proc.d.2017-09-27.p5012692,2017-09-27,,,,stagedirection,Private Members' Business,Controlled Drugs and Substances Act,, Before the Clerk announced the results of the vote: ,,,,
4720292,ca.proc.d.2017-09-27.9672803,2017-09-27,3176068f-62ee-4b2f-aacd-1131201c6db1,214707,The Speaker,,Private Members' Business,Controlled Drugs and Substances Act,,Is the hon. member for Nipissing—Timiskaming rising on a point of order?,Liberal,Halifax West,Geoff Regan,http://www.parl.gc.ca/Parliamentarians/en/members/geoff-regan(214707)
4720293,ca.proc.d.2017-09-27.9672804,2017-09-27,16c839d3-0183-4ed6-892a-8d7bdc37c474,214972,Mr. Anthony Rota,,Private Members' Business,Controlled Drugs and Substances Act,,"Yes, Mr. Speaker. My intent was to vote in opposition to the bill, and unfortunately there was some confusion in the room. I would like my vote registered as opposed.",Liberal,Nipissing—Timiskaming,Anthony Rota,http://www.parl.gc.ca/Parliamentarians/en/members/anthony-rota(214972)
4720294,ca.proc.d.2017-09-27.9672806,2017-09-27,3176068f-62ee-4b2f-aacd-1131201c6db1,214707,The Speaker,,Private Members' Business,Controlled Drugs and Substances Act,,"In a moment I am going to be asking for unanimous consent for two people it looks like.
Is the hon. member for Saint-Laurent rising on a point of order?",Liberal,Halifax West,Geoff Regan,http://www.parl.gc.ca/Parliamentarians/en/members/geoff-regan(214707)
4720295,ca.proc.d.2017-09-27.9672807,2017-09-27,00000000-0000-0000-0000-000000000000,232369,Ms. Emmanuella Lambropoulos,,Private Members' Business,Controlled Drugs and Substances Act,,"Yes, Mr. Speaker. I would like my vote to be recorded as opposed.",Liberal,Saint-Laurent,Emmanuella Lambropoulos,http://www.parl.gc.ca/Parliamentarians/en/members/emmanuella-lambropoulos(232369)
4720296,ca.proc.d.2017-09-27.9672808,2017-09-27,3176068f-62ee-4b2f-aacd-1131201c6db1,214707,The Speaker,,Private Members' Business,Controlled Drugs and Substances Act,,Is there unanimous consent in the House for the members to change their votes?,Liberal,Halifax West,Geoff Regan,http://www.parl.gc.ca/Parliamentarians/en/members/geoff-regan(214707)
4720297,ca.proc.d.2017-09-27.p5012699,2017-09-27,,,,intervention,Private Members' Business,Controlled Drugs and Substances Act,, Agreed.,,,Some hon. members,
4720298,ca.proc.d.2017-09-27.p5012700,2017-09-27,,,,stagedirection,Private Members' Business,Controlled Drugs and Substances Act,,"(The House divided on the motion, which was negatived on the following division:)
Vote #352",,,,
4720299,ca.proc.d.2017-09-27.9672811,2017-09-27,3176068f-62ee-4b2f-aacd-1131201c6db1,214707,The Speaker,,Private Members' Business,Controlled Drugs and Substances Act,,I declare the motion lost.,Liberal,Halifax West,Geoff Regan,http://www.parl.gc.ca/Parliamentarians/en/members/geoff-regan(214707)
4720300,ca.proc.d.2017-09-27.p5012702,2017-09-27,,,,stagedirection,Private Members' Business,Venezuela,,"The House resumed from September 26 consideration of the motion, and of the amendment.",,,,
4720301,ca.proc.d.2017-09-27.9672813,2017-09-27,3176068f-62ee-4b2f-aacd-1131201c6db1,214707,The Speaker,,Private Members' Business,Venezuela,,The House will now proceed to the taking of the deferred recorded division on the amendment of the member for Durham to Motion No. 128 under private members' business. ,Liberal,Halifax West,Geoff Regan,http://www.parl.gc.ca/Parliamentarians/en/members/geoff-regan(214707)
4720302,ca.proc.d.2017-09-27.9672842,2017-09-27,3176068f-62ee-4b2f-aacd-1131201c6db1,214707,The Speaker,,Private Members' Business,Venezuela,,"Could I confirm that the seven members in the back all intended to vote yes? The hon. member for Cariboo—Prince George is suggesting I name them. I am not going to do that, because they voted quietly.
I am going to assume that it is agreed.",Liberal,Halifax West,Geoff Regan,http://www.parl.gc.ca/Parliamentarians/en/members/geoff-regan(214707)
4720303,ca.proc.d.2017-09-27.p5012706,2017-09-27,,,,stagedirection,Private Members' Business,Venezuela,,"(The House divided on the amendment, which was agreed to on the following division:)
Vote #353",,,,
4720304,ca.proc.d.2017-09-27.9672846,2017-09-27,3176068f-62ee-4b2f-aacd-1131201c6db1,214707,The Speaker,,Private Members' Business,Venezuela,,"I declare the amendment carried.
The next question is on the main motion as amended. Is it the pleasure of the House to adopt the motion as amended? ",Liberal,Halifax West,Geoff Regan,http://www.parl.gc.ca/Parliamentarians/en/members/geoff-regan(214707)
4720305,ca.proc.d.2017-09-27.p5012709,2017-09-27,,,,intervention,Private Members' Business,Venezuela,," Agreed. 
 No. ",,,Some hon. members,
4720306,ca.proc.d.2017-09-27.p5012711,2017-09-27,3176068f-62ee-4b2f-aacd-1131201c6db1,214707,The Speaker,,Private Members' Business,Venezuela,," All those in favour of the motion, as amended, will please say yea. ",Liberal,Halifax West,Geoff Regan,http://www.parl.gc.ca/Parliamentarians/en/members/geoff-regan(214707)
4720307,ca.proc.d.2017-09-27.p5012712,2017-09-27,,,,intervention,Private Members' Business,Venezuela,, Yea. ,,,Some hon. members,
4720308,ca.proc.d.2017-09-27.p5012713,2017-09-27,3176068f-62ee-4b2f-aacd-1131201c6db1,214707,The Speaker,,Private Members' Business,Venezuela,, All those opposed will please say nay. ,Liberal,Halifax West,Geoff Regan,http://www.parl.gc.ca/Parliamentarians/en/members/geoff-regan(214707)
4720309,ca.proc.d.2017-09-27.p5012714,2017-09-27,,,,intervention,Private Members' Business,Venezuela,, Nay. ,,,Some hon. members,
4720310,ca.proc.d.2017-09-27.p5012715,2017-09-27,3176068f-62ee-4b2f-aacd-1131201c6db1,214707,The Speaker,,Private Members' Business,Venezuela,," In my opinion the yeas have it. 
 And five or more members having risen: ",Liberal,Halifax West,Geoff Regan,http://www.parl.gc.ca/Parliamentarians/en/members/geoff-regan(214707)
4720311,ca.proc.d.2017-09-27.p5012717,2017-09-27,,,,stagedirection,Private Members' Business,Venezuela,,"(The House divided on the motion, which was agreed to on the following division:)
Vote #354",,,,
4720312,ca.proc.d.2017-09-27.9672883,2017-09-27,3176068f-62ee-4b2f-aacd-1131201c6db1,214707,The Speaker,,Private Members' Business,Venezuela,,"I declare the motion, as amended, carried.
It being 6:50 p.m., the House will now proceed to the consideration of private members' business as listed on today's Order Paper.",Liberal,Halifax West,Geoff Regan,http://www.parl.gc.ca/Parliamentarians/en/members/geoff-regan(214707)
4720313,ca.proc.d.2017-09-27.p5012720,2017-09-27,,,,stagedirection,Private Members' Business,Canada Labour Code,,"The House resumed from June 5 consideration of the motion that Bill C-345, An Act to amend the Canada Labour Code (pregnant and nursing employees), be read the second time and referred to a committee.",,,,
