basepk,hid,speechdate,pid,opid,speakeroldname,speakerposition,maintopic,subtopic,subsubtopic,speechtext,speakerparty,speakerriding,speakername,speakerurl
4725150,ca.proc.d.2017-10-31.9745583,2017-10-31,22a6ff7d-fc39-47b2-8003-a016329ed224,229490,"Mr. Matt DeCourcey (Parliamentary Secretary to the Minister of Foreign Affairs, Lib.)",,Routine Proceedings,Foreign Affairs,,"Mr. Speaker, on behalf of the Minister of Foreign Affairs and pursuant to Standing Order 32(2), I have the honour to table, in both official languages, the treaty entitled “The Convention on the Recognition of Qualifications concerning Higher Education in the European Region”, done at Lisbon on April 11, 1997. An explanatory memorandum is included with the treaty. ",Liberal,Fredericton,Matt DeCourcey,http://www.parl.gc.ca/Parliamentarians/en/members/matt-decourcey(229490)
4725151,ca.proc.d.2017-10-31.9745589,2017-10-31,0fd242c0-71bc-4c1b-a4e4-609a396eca76,229494,"Mr. Mark Holland (Parliamentary Secretary to the Minister of Public Safety and Emergency Preparedness, Lib.)",,Routine Proceedings,Correctional Investigator of Canada,,"Mr. Speaker, I am pleased to table, in both official languages, the 2016-17 annual report of the Office of the Correctional Investigator, as required under section 192 of the Corrections and Conditional Release Act. 
I am also tabling a response to one recommendation in the report to the Minister of Public Safety and Emergency Preparedness, as well as the responses to the 16 recommendations directed to Correctional Services Canada.",Liberal,Ajax,Mark Holland,http://www.parl.gc.ca/Parliamentarians/en/members/mark-holland(229494)
4725152,ca.proc.d.2017-10-31.9745604,2017-10-31,ac588301-cc6e-4f6e-9c58-84542c62c46b,217183,"Mr. François Choquette (Drummond, NDP)",,Routine Proceedings,Judges Act,," moved for leave to introduce Bill C-381, An Act to amend the Judges Act (bilingualism).
Mr. Speaker, I am very pleased to introduce a second bill, an act to amend the Judges Act with regard to bilingualism. This bill is very important and it responds to the recommendations of Graham Fraser, the former official languages commissioner, who issued a report in 2013 entitled “Access to Justice in Both Official Languages: Improving the Bilingual Capacity of the Superior Court Judiciary”. When I met the commissioner in early 2015, he told me that he had tabled this report but that the Conservatives had shelved it. He asked me to dust it off and do something with it.
I decided to move forward. I am therefore introducing this bill and hoping that the Liberals will implement it, since it seeks to replace the existing system in which judges evaluate their own mastery of the two official languages with an evaluation by the Office of the Commissioner for Federal Judicial Affairs, as recommended by the Commissioner of Official Languages. Everyone knows that self-evaluation does not work and that a formal assessment is needed.
(Motions deemed adopted, bill read the first time and printed)",New Democratic Party,Drummond,François Choquette,http://www.parl.gc.ca/Parliamentarians/en/members/francois-choquette(217183)
4725153,ca.proc.d.2017-10-31.9745639,2017-10-31,ac588301-cc6e-4f6e-9c58-84542c62c46b,217183,"Mr. François Choquette (Drummond, NDP)",,Routine Proceedings,Official Languages Act,," moved for leave to introduce C-382, An Act to amend the Official Languages Act (Supreme Court of Canada).
Mr. Speaker, I am somewhat less pleased to introduce this bill because, last week, the Liberals defeated Bill C-203, the bill that would have required Supreme Court justices to understand both official languages, despite the fact that they had previously voted in favour of it three times. This time, unfortunately, they defeated the bill, so now we have to do something else. 
Now, we can amend the Official Languages Act, which may help the situation but will not resolve everything. It would be a good step forward anyway, and that is why I am introducing Bill C-382, an act to amend the Official Languages Act (Supreme Court of Canada). This bill would amend section 16 of the Official Languages Act so that it also applies to the Supreme Court of Canada. If this bill passes, all federal courts will be responsible for ensuring that judges hearing a case understand the parties' official language of choice without the help of an interpreter. This is a good step forward, but it will not resolve everything. We will have to form government ourselves and introduce another bill like Bill C-203 to fix the problem, so that everyone can access the Supreme Court in the official language of their choice.
(Motions deemed adopted, bill read the first time and printed) ",New Democratic Party,Drummond,François Choquette,http://www.parl.gc.ca/Parliamentarians/en/members/francois-choquette(217183)
4725154,ca.proc.d.2017-10-31.9745667,2017-10-31,5836b275-89f1-49ce-9b8c-7de46b261c3d,229480,"Hon. Pablo Rodriguez (Chief Government Whip, Lib.)",,Routine Proceedings,Official Languages Act,Transportation Modernization Act,"Mr. Speaker, there have been discussions among the parties and I believe if you seek it you will find consent for the following.
 That notwithstanding any Standing Order or usual practice, at the conclusion of today's debate on Bill C-49, An Act to amend the Canada Transportation Act and other Acts respecting transportation and to make related and consequential amendments to other Acts, all questions necessary to dispose of the third reading stage of the said Bill be deemed put and a recorded division deemed requested and deferred until Wednesday, November 1, 2017, at the expiry of the time provided for Government Orders. 
That being said, Happy Halloween.",Liberal,Honoré-Mercier,Pablo Rodriguez,http://www.parl.gc.ca/Parliamentarians/en/members/pablo-rodriguez(229480)
4725155,ca.proc.d.2017-10-31.9745672,2017-10-31,3176068f-62ee-4b2f-aacd-1131201c6db1,214707,The Speaker,,Routine Proceedings,Official Languages Act,Transportation Modernization Act,"The same to the member and to all members.
Does the hon. member have unanimous consent of the House to move the motion?",Liberal,Halifax West,Geoff Regan,http://www.parl.gc.ca/Parliamentarians/en/members/geoff-regan(214707)
4725156,ca.proc.d.2017-10-31.p5090946,2017-10-31,,,,intervention,Routine Proceedings,Official Languages Act,Transportation Modernization Act, Agreed.,,,Some hon. members,
4725157,ca.proc.d.2017-10-31.p5090947,2017-10-31,3176068f-62ee-4b2f-aacd-1131201c6db1,214707,The Speaker,,Routine Proceedings,Official Languages Act,Transportation Modernization Act, Is it the pleasure of the House to adopt the motion?,Liberal,Halifax West,Geoff Regan,http://www.parl.gc.ca/Parliamentarians/en/members/geoff-regan(214707)
4725158,ca.proc.d.2017-10-31.p5090948,2017-10-31,,,,intervention,Routine Proceedings,Official Languages Act,Transportation Modernization Act, Agreed.,,,Some hon. members,
4725159,ca.proc.d.2017-10-31.p6,2017-10-31,3176068f-62ee-4b2f-aacd-1131201c6db1,214707,The Speaker,,Routine Proceedings,Official Languages Act,Transportation Modernization Act,(Motion agreed to),Liberal,Halifax West,Geoff Regan,http://www.parl.gc.ca/Parliamentarians/en/members/geoff-regan(214707)
4725160,ca.proc.d.2017-10-31.9745680,2017-10-31,b37cad30-26f6-40c6-8e4c-dd3a0ba841bb,234443,"Mrs. Cheryl Gallant (Renfrew—Nipissing—Pembroke, CPC)",,Routine Proceedings,Petitions,Taxation,"Mr. Speaker, I am pleased to present a petition signed by campers who stayed at the Grandview Cottages &amp; Trailer Park in Renfrew, Ontario, located on the majestic Ottawa River in my riding of Renfrew—Nipissing—Pembroke. 
The petitioners call on the government to ensure that campgrounds with fewer than five full-time, year-round employees continue to be recognized and taxed as small businesses.",Conservative,Renfrew—Nipissing—Pembroke,Cheryl Gallant,http://www.parl.gc.ca/Parliamentarians/en/members/cheryl-gallant(234443)
4725161,ca.proc.d.2017-10-31.9745687,2017-10-31,ffeab63b-041e-4d87-bdad-1b79ff9a98c5,215886,"Mr. Dan Vandal (Saint Boniface—Saint Vital, Lib.)",,Routine Proceedings,Petitions,Minimum Voting Age,"Mr. Speaker, I am pleased to present a petition on behalf of the Fédération de la jeunesse canadienne-française that seeks to lower the minimum voting age to 16. Lowering the voting age to 16 would give young people a voice, restore some balance, and encourage politicians and political parties to take their concerns into consideration.
The voting age is already 16 in other parts of the world, including Austria, Nicaragua, Brazil, Argentina, and Ecuador.
It is my pleasure to present this petition on behalf of the Fédération de la jeunesse canadienne-française.",Liberal,Saint Boniface—Saint Vital,Dan Vandal,http://www.parl.gc.ca/Parliamentarians/en/members/dan-vandal(215886)
4725162,ca.proc.d.2017-10-31.9745694,2017-10-31,cedf1659-ebb1-4f26-b723-5c7c5353988b,214948,"Mrs. Carol Hughes (Algoma—Manitoulin—Kapuskasing, NDP)",,Routine Proceedings,Petitions,Eating Disorders,"Mr. Speaker, I rise to table a petition to the government concerning a pan-Canadian strategy for eating disorders. 
The petitioners indicate that among mental illnesses, the highest mortality rate is with people suffering from eating disorders such anorexia and bulimia. They also indicate that eating disorders can cause brain damage, changes in hair and skin, and loss of bone mass. Eating disorders can cause the heart to shut down. The first cause of death is cardiac arrest, and the second is suicide. 
The petitioners ask that the Government of Canada support Motion No. 117 and initiate discussions with the provincial and territorial ministers responsible for health, and all stakeholders, to develop a comprehensive pan-Canadian strategy for eating disorders to include prevention, diagnosis, treatment, support, and research.",New Democratic Party,Algoma—Manitoulin—Kapuskasing,Carol Hughes,http://www.parl.gc.ca/Parliamentarians/en/members/carol-hughes(214948)
4725163,ca.proc.d.2017-10-31.9745713,2017-10-31,95ed53a7-7538-4c0f-85a4-64af76065f95,218942,"Mr. Don Davies (Vancouver Kingsway, NDP)",,Routine Proceedings,Petitions,Shipping Industry,"Mr. Speaker, I rise to present a petition signed by hundreds of British Columbians who are concerned that the government's intended adoption of the Emerson report will dismantle the established rules respecting cabotage in Canada. The petitioners fear that up to 12,000 Canadian maritime jobs across our nation will be lost through dismantling cabotage. They say that it will allow the industry to hire cheaper, more vulnerable foreign seafarers without local knowledge of the waters they sail.
The petitioners call upon the government to hold full and open debate on the Emerson report; hold a national multi-stakeholder maritime round table with the aim of developing a national maritime strategy that keeps cabotage rules in place; and make sure that we have good, family-sustaining, unionized jobs in the maritime industry here in Canada.",New Democratic Party,Vancouver Kingsway,Don Davies,http://www.parl.gc.ca/Parliamentarians/en/members/don-davies(218942)
4725164,ca.proc.d.2017-10-31.9745730,2017-10-31,eaa6694f-1e20-4aae-ad3b-e694b0e12c59,224170,"Ms. Elizabeth May (Saanich—Gulf Islands, GP)",,Routine Proceedings,Petitions,Climate Change,"Mr. Speaker, I am honoured to rise today to present three petitions. All three petitions have to do with climate change.
The petitions are all from constituents of Saanich—Gulf Islands.
The first petition calls upon the government to work with provinces and territories to upgrade our building code to ensure a 15% improvement in energy efficiency.
The second petition calls upon the government to bring into place meaningful actions to meet the Paris accord target of global commitment to ensure that global average temperatures do not exceed 1.5° Celsius. The petitioners draw particular focus on decarbonizing our electricity sector.
The last petition has the most signatories, also from my constituency, and it calls for the House of Commons and Parliament to work to achieve the goals set out in the Leap Manifesto.",Green Party,Saanich—Gulf Islands,Elizabeth May,http://www.parl.gc.ca/Parliamentarians/en/members/elizabeth-may(224170)
4725165,ca.proc.d.2017-10-31.9745746,2017-10-31,07cf5767-802c-406c-92a7-7dc92af79b40,229526,"Mr. Kevin Lamoureux (Parliamentary Secretary to the Leader of the Government in the House of Commons, Lib.)",,Routine Proceedings,Questions on the Order Paper,,"Mr. Speaker, I ask that all questions be allowed to stand.",Liberal,Winnipeg North,Kevin Lamoureux,http://www.parl.gc.ca/Parliamentarians/en/members/kevin-lamoureux(229526)
4725166,ca.proc.d.2017-10-31.p5090965,2017-10-31,3176068f-62ee-4b2f-aacd-1131201c6db1,214707,The Speaker,,Routine Proceedings,Questions on the Order Paper,, Is that agreed?,Liberal,Halifax West,Geoff Regan,http://www.parl.gc.ca/Parliamentarians/en/members/geoff-regan(214707)
4725167,ca.proc.d.2017-10-31.p5090966,2017-10-31,,,,intervention,Routine Proceedings,Questions on the Order Paper,, Agreed.,,,Some hon. members,
4725168,ca.proc.d.2017-10-31.9745754,2017-10-31,9d3d2220-818c-494e-8d58-29f7cee7b65d,216537,"Hon. Candice Bergen (Portage—Lisgar, CPC)",,Routine Proceedings,Points of Order,,"Mr. Speaker, I rise on a point of order to ask that you divide Bill C-56, an act to amend the Corrections and Conditional Release Act and the Abolition of Early Parole Act, pursuant to Standing Order 69.1. 
Standing Order 69.1 states:
 In the case where a government bill seeks to repeal, amend or enact more than one act, and where there is not a common element connecting the various provisions or where unrelated matters are linked, the Speaker shall have the power to divide the questions, for the purposes of voting, on the motion for second reading and reference to a committee and the motion for third reading and passage of the bill. The Speaker shall have the power to combine clauses of the bill thematically and to put the aforementioned questions on each of these groups of clauses separately, provided that there will be a single debate at each stage. 
There are two parts of Bill C-56 that I believe should be separated through the application of Standing Order 69.1. One of those parts would be the section that amends the Corrections and Conditional Release Act. These proposals are meant to address the findings of the inquiry into the death of Ashley Smith, which resulted in a set of recommendations, including the restricted use of administrative segregation. The other part aims to amend the Abolition of Early Parole Act to reinstate the accelerated parole review at one-sixth of the sentence for non-violent offences. 
Further, the segregation proposals deal with the introduction of firm deadlines regarding days spent in solitary confinement, as well as the inclusion of oversight or review measures, i.e., independent external reviewers, whereas the one-sixth issue is quite separate and touches on the ability for non-violent criminals to be released on parole and into community much sooner than previously allowed. 
Both are related in that they deal with prisons, but they tackle separate issues. In fact, it is my understanding that the Correctional Service Canada would deal with the segregation issue, whereas the Parole Board of Canada would deal with the other. 
As you know Mr. Speaker, there is no jurisprudence for the House on this new practice of dividing bills, since the standing order granting you this authority was only adopted in June. Since we do not have any precedents for dividing bills in the manner proposed through Standing Order 69.1, the Speaker has always had the authority to divide motions. Perhaps we can look at these precedents for some guidance on this.
On page 562 and 563 of O'Brien and Bosc, it states:
 When any Member objects to a motion containing two or more distinct propositions, he or she may request that the motion be divided and that each proposition be debated and voted on separately. 
On June 15, 1964, Mr. Speaker Macnaughton ruled on a request to divide a government motion regarding a new Canadian flag. The Speaker made the following statement:
 I must come to the conclusion that the motion before the house contains two propositions, and since strong objections have been made to the effect that these two propositions should not be considered together, it is my duty to divide them.... 
The Speaker, in this particular ruling, gave a summary of proceedings in the British House with regard to the division of complicated questions. He gave, for example, a ruling from April 19, 1888, where the British Speaker said:
 It may be for the convenience of the house that the hon. gentleman's two propositions should be put together, but if any hon. gentleman objects to their being taken together, they will be put separately. 
Another illustration came in a ruling from July 17, 1905. The Speaker said:
 A member raised a point of order asking the Speaker to rule as to whether when a resolution contains various different propositions it should not be divided and each put separately. It will be seen that the Speaker decided that, in his opinion, it should be divided. 
A ruling from October 8, 1912, was also cited: 
 If the noble lord finds himself in any doubt as to how to vote upon it I shall be very glad to put it as two questions. 
That same year, on November 13, the Speaker said:
 ...the rule, of course, is that if any hon. member feels embarrassed in voting upon a resolution, that the Chair shall divide the resolution.... 
While the Speaker in 1964 went on to reference more British examples, such as a case from July 1920 and December 10, 1947, he relied on the ruling of November 13, 1912, when he said:
 Taking into consideration the references and quotations just cited, and more especially the view expressed by the Speaker of the British house on November 13, 1912, where he said, “the rule, of course, is if any honourable member feels embarrassed on voting on a resolution that the Chair shall revise the resolution in order that the member may, if he wishes to vote “Aye” on the one part and “No” on the other not be embarrassed by having to vote “Aye” or “No” on the whole of it,” 
Accordingly, Speaker Macnaughton concluded:
 ...the motion before the house contains two propositions, and since strong objections have been made to the effect that these two propositions should not be considered together, it is my duty to divide them.... 
The common guidance here would appear to be strong objections, which I am expressing to you in regard to Bill C-56 and the discomfort members would have voting against a motion containing two parts they support, and vice versa.
On April 8, 1991, members argued that a motion to amend the Standing Orders contained more than one proposal, and the option of passing only one vote on the various proposals in the motion posed a problem for some members. Some members favoured certain proposals and were against others.
 On April 10, 1991, Speaker Fraser made a ruling more in line with the new standing order regarding bills when ruling on a request to divide a government motion to amend the Standing Orders of the House. 
Citing Speaker Fraser, Speaker Milliken said: 
 Rather than intervening to divide the motion, he ruled that a single debate would be held on the motion, and its components would be separated into three questions for voting purposes. 
He continued:
 After having carefully examined the precedents and after having reviewed the arguments on both sides of the question, I am inclined to agree that Government Business Item No. 2 does, indeed, present an instance where the Chair is justified in taking some action. 
 On October 4, 2002, the hon. member for Saskatoon—Rosetown—Biggar raised the matter that a motion for reinstatement of House business contained four separate and distinct parts. She objected to the fact of having only one debate and one vote, when the House was being asked to decide on four subjects, and she asked the Speaker to divide the motion, which he did.
 I would argue that the reasons to support the division of the second reading motion of Bill C-56 are the same as those cited from the British House and from the Canadian House in 1964, 1991, and 2002. Members cannot speak for their constituents responsibly by casting one vote that covers various issues. Standing Order 69.1 was meant to relieve members of that impediment.
 I suspect that the majority of the House supports the sections of the bill that address the findings of the inquiry into the death of Ashley Smith. I know that a great number of the members disagree with the section in Bill C-56 that reinstates accelerated parole review at one-sixth of the sentence for non-violent offences. Many members, and the constituents who elected them, believe that this would be good news for those convicted of white-collar fraudulent crimes and drug dealers who might get out of prison early.
 I believe that Bill C-56 is a good test for Standing Order 69.1, since the division of this bill, along the lines I have described, would address the omnibus nature of Bill C-56 and the problem members have with casting one vote on distinct, separate, and conflicting areas of public policy. 
The author of this new standing order, the Leader of the Government in the House of Commons, should agree with me, since during debate on the motion proposing this change, on June 19, 2017, she said:
 We want to ensure that MPs are not faced with the dilemma of how to vote on a bill that is most supportable but contains a totally unrelated clause, a poison pill, that they find objectionable. We want flexibility for MPs in these instances. Under the proposed change, the Speaker would have the authority to divide bills for the purpose of voting for second reading, third reading, and passage of a bill. The Speaker would also be authorized to group a bill thematically. There would be a single debate at each stage, and members would then be able to vote on parts of a bill separately. 
The minister's intentions for the use of Standing Order 69.1 are in line with the predicament my colleagues and I are in, with casting only one vote on Bill C-56. 
Further, the minister's concerns would appear to echo the concerns contained in the ruling I presented with respect to the Speaker's authority to divide motions, in particular the November 13, 1912, ruling stating that if a member wishes to vote for one part and against another part of a motion, the member should not be embarrassed by having to vote for or against the whole of it.
This new Standing Order was put forward to address the problem of omnibus bills. The fact that it exempts budget implementation bills makes it somewhat of a farce. However, in the case of Bill C-56, there may be some merit in its application.
I look forward to your ruling, Mr. Speaker.",Conservative,Portage—Lisgar,Candice Bergen,http://www.parl.gc.ca/Parliamentarians/en/members/candice-hoeppner(216537)
4725169,ca.proc.d.2017-10-31.9745889,2017-10-31,b41c3b7e-c64f-4415-9f58-79d7462e5d8e,217284,"Mr. Peter Julian (New Westminster—Burnaby, NDP)",,Routine Proceedings,Points of Order,,"Mr. Speaker, I will not repeat the arguments made by my colleague, the official opposition House leader. However, I do believe, as she does, that this is a very important point in the life of this House.
Standing Order 69.1 was established and put into place to give you, Mr. Speaker, the power to separate these unrelated elements within omnibus legislation and to provide to the House the ability to vote in favour of or in opposition to specific elements in legislation. 
This is a real test. There is no doubt. It is an important point of order raised by the official opposition House leader. I would agree with her that the test of Bill C-56 is essentially met within Standing Order 69.1. These are unrelated clauses that should be treated as separate within the framework of the House. That can only enhance democracy.
We may come back later with further arguments to contribute to this, but we hope that you, Mr. Speaker, will be deliberating on this in a timely manner. It is extremely important for the life of this House, and we believe, for democratic values in Canada.",New Democratic Party,New Westminster—Burnaby,Peter Julian,http://www.parl.gc.ca/Parliamentarians/en/members/peter-julian(217284)
4725170,ca.proc.d.2017-10-31.9746288,2017-10-31,3176068f-62ee-4b2f-aacd-1131201c6db1,214707,The Speaker,,Routine Proceedings,Points of Order,,"I thank the hon. opposition House leader and the hon. member for New Westminster—Burnaby for their interventions. I particularly appreciate the thorough review, going back as far as 1888. Those here who have studied law know that judges, of course, in their jurisprudence, often call upon precedence older than that. It is entirely valid. I would not have expected anyone responding to the point of order to have that kind of review, but I appreciate the interventions of both members who have spoken.
 I gather that I will be hearing more on the subject from the hon. member for New Westminster—Burnaby, hopefully in the near future. I do not know if the government will be bringing forward an argument on this, but perhaps it will respond when the hon. member for New Westminster—Burnaby comes back. I thank the members for their interventions. 
Now it is time for a ruling on a different matter.",Liberal,Halifax West,Geoff Regan,http://www.parl.gc.ca/Parliamentarians/en/members/geoff-regan(214707)
