basepk,hid,speechdate,pid,opid,speakeroldname,speakerposition,maintopic,subtopic,subsubtopic,speechtext,speakerparty,speakerriding,speakername,speakerurl
4725394,ca.proc.d.2017-10-31.9749134,2017-10-31,f45e86b7-f192-4692-9889-6b57283fc3b0,224178,"Mr. Gabriel Ste-Marie (Joliette, BQ)",,Government Orders,Transportation Modernization Act,,"Madam Speaker, Bill C-49, the transportation modernization act, does not live up to its name. Many aspects of this bill represent, quite simply, a step backwards.
The government announced its air passenger bill of rights and many other great measures as part of this bill. Not only is the bill of rights not there, but there is nothing to enhance our security. We see this as a missed opportunity. Bill C-49 could have really addressed some of the concerns of Canadians, like the people in Lac-Mégantic, for example, who are still waiting for their bypass. This omnibus bill is problematic in many ways. Unfortunately, once again and as usual, the government is introducing a bill that is far too big to be examined effectively. This omnibus bill includes a lot of measures, and we did not have time to comb through it and discuss it properly. 
As well, in the Bloc Québécois, we have fewer rights than members of the other parties in the House. There are not enough of us. We cannot sit on committees, ask questions to experts who come testify, or debate the bill in depth in the House. My comments today will therefore be the only ones by my party on this bill, which will have major repercussions on transportation as a whole and affect many of our laws.
 For example, Bill C-49 gives the minister the authority to allow airlines to circumvent the Competition Bureau as he sees fit. That is something. Call a spade a spade: it makes no sense. The government is politicizing a process that currently a judicial one. Come on. We can already see the lobbyists in the minister’s office, and almost lining up one by one to get the green light to act on plans that will reduce competition. We can even imagine that they will obtain that by attending a fundraising cocktail party. It seems to be a model that works.
 How can the Minister claim that that is for the good of passengers? We are not fooled. Everyone in the House understands that the government does not want to repeat the situation we saw in 2011 and 2012, when Air Canada and United Continental wanted to coordinate their activities on 19 transborder routes. The Competition Bureau studied the matter and determined that, on 14 of those routes, Air Canada would have far too much market share, which would have greatly reduced competition. The bureau found that a near-monopoly on certain routes would lead to an increase in the rates paid by travellers. Its role is to block that, and that is what it did.
 For some routes, like Montreal to Washington or Montreal to Houston, Air Canada and United Continental together would have held the entire market. That is a near-monopoly for sure. In the end, travellers would have paid the increase in ticket prices, which is obviously unfair, because of the rules of trade. The Competition Bureau stated that, if the situation changed, it would be reassessed. That is logical and fair, even though Air Canada did not like the decision, as they wanted to line their pockets.
 It was the right decision for travellers and other businesses. The Competition Bureau committed to reassessing the situation if there were any changes. In our opinion, there was therefore no problem. If we do not want that to happen again, why would we want to politicize something that is not politicised? Why give the Minister the authority to circumvent the Competition Bureau? That is what we are asking here, and that is one of the elements that we deplore in Bill C-49.
What purpose will the Competition Bureau and the Competition Tribunal serve if the government gives the minister the authority to circumvent them as he sees fit? We can see that, with the Liberals, the interests of travellers take a back seat to those of big business and party cronies. We can think of Air Canada in particular. 
Another thing I would like to mention is foreign ownership. This bill seeks to increase the foreign investment limit for air carriers from 25%, or one-quarter, to 49%, which is basically half. A single corporation or individual cannot own more than 25% of voting shares. The idea here is to give airlines more cash flow and to promote the creation of low-cost carrier services. The government is saying that Canadian air carriers will not be subject to the controlling influence of international investors. That seems fine at first glance, but it creates an opening that allows the government to get its foot in the door and make major changes to the way things are done. We are worried about the future. What will the next step be? The next time a company like Air Canada is on the verge of bankruptcy, will it meet with the minister to say that it wants to be sold to a foreign company?
We already know that the government did not even make Air Canada obey the law when it decided to hand over its maintenance division to Aveos. The government even changed the law after the fact, and announced it the Thursday before an Easter recess. I remember. I was very angry with the transport minister that day. That is why these measures being announced in an omnibus bill is not very reassuring.
It is the same thing when it comes to shipping and coasting trade. The government is taking a number of steps backward in that regard. Bill C-49 will allow ships registered in other countries to reposition empty containers, when currently only Canadian shipowners have that right. Way to go. It is already clear that good jobs will be lost here in Canada and that they will be replaced by cheap foreign labour. Why? The government is putting large foreign corporations ahead of Canadians. That is not even to mention the different training standards, which means that there will not only be fewer jobs here in Canada but that there will also be a decline in the quality of work and a significant increase in the risk of accidents. That is no small thing.
We also have concerns over the part of the bill on transporting products on our river. The bill allows ships registered in European Union countries to transport bulk commodities between the ports of Montreal and Halifax in accordance with the Canada-EU agreement. We are concerned about this announcement and the pilotage legislation that is being discussed. By all accounts it looks to us as though our seaway pilots will no longer be the only ones to navigate the St. Lawrence River. That is one of our major concerns and we see an opening in it. We know that it takes a real expert to navigate our river. It has challenging winding routes and many obstacles. 
It is more than our jobs being threatened, but our very safety. The pilots' role is not just to pilot their ship, but also to assess whether the ship that enters the seaway presents an environmental or security risk. Our pilots are also responsible for protecting the public's safety and well-being and can decide that a certain ship is not to enter our river. 
The day this role is no longer reserved for seaway pilots is the day we have serious problems. A foreign pilot hired by a foreign country that instructs the pilot to do their job without concern for the environment or safety will have no choice but to follow orders. Why take this chance? This should not be allowed. We have to remain vigilant and speak out against such practices. We are unnecessarily exposing ourselves to huge risks.
There are many elements in this mammoth bill. We do not have the time to study them all, but we would like to draw the attention of the House to the issue of the infrastructure bank. Bill C-49 shows us once again that the federal government is backing away from infrastructure. The bill opens the door wide to the funding of ports and other federal infrastructure by the infrastructure privatization bank. Investors will expect to make a profit, the infrastructure will not be maintained as well, and there will be more charges and fees. Taxpayers will have to pay more. As we have said, with this bank, profits are privatized while losses are socialized. It is too bad that this is in Bill C-49. Once again, the Liberals are helping their friends.
As I said in my introduction, there are many reasons why the Bloc Québécois will be voting against this mammoth bill and we do not have time to cannot mention them all. This bill just does not address Quebeckers' concerns. As I said at the beginning, we were expecting that there would be something for the people of Lac-Mégantic, but there is absolutely nothing. There is no mention of the bypass.
The government has made it a habit to put everything into a single mammoth bill, even though it is breaking an election promise by doing so, and then making sure that we cannot study it thoroughly. That is not the best approach to take and we are against it.
This bill politicizes a process by giving the minister the authority to circumvent the Competition Tribunal. That is a step backwards, a step in the wrong direction. It will contribute to the loss of our businesses. It is the withdrawal of the state for the benefit of the private sector. The government is potentially jeopardizing safety on the St. Lawrence River and sacrificing our jobs for the benefit of foreign companies.
As everyone may have guessed, the Bloc Québécois will be opposing this bill, which we found severely disappointing.",Bloc Québécois,Joliette,Gabriel Ste-Marie,http://www.parl.gc.ca/Parliamentarians/en/members/gabriel-ste-marie(224178)
4725395,ca.proc.d.2017-10-31.9749225,2017-10-31,e8a82025-8dd3-4301-bccf-653d4b98b18c,214019,"Mr. Peter Fonseca (Mississauga East—Cooksville, Lib.)",,Government Orders,Transportation Modernization Act,,"Madam Speaker, I am sure the member often travels by plane or rail. When we get on a plane, we want to know that there are always continuous improvements and that employees are always looking after our safety. That is paramount. On a plane, voice recorders are in the cockpit and data is being collected. All of that is put into place. That does not happen today when it comes to rail safety.
 We have seen some tragic incidents take place over this past year, and in prior years. The former government shirked its responsibility to address that safety. We want to ensure that safety is there, by looking to those continuous improvements to ensure data and the voice recordings are captured in the cockpit so we can use it to improve our systems. Therefore, we are bringing safety, modernization, and innovation together to ensure passengers are as safe as they would be in a plane. 
We do not want to see any kind of incidents happen with respect to our planes. It is the same with our rail safety. Does the member think this is a good thing? Would that help his community and his citizens?",Liberal,Mississauga East—Cooksville,Peter Fonseca,http://www.parl.gc.ca/Parliamentarians/en/members/peter-fonseca(214019)
4725396,ca.proc.d.2017-10-31.9749243,2017-10-31,f45e86b7-f192-4692-9889-6b57283fc3b0,224178,Mr. Gabriel Ste-Marie,,Government Orders,Transportation Modernization Act,," Madam Speaker, I would like to thank the member for Mississauga for his question. First, I would remind him that I travel by bike more than by train or plane. Living in Joliette allows me to get around using active modes of transportation such as walking and cycling. 
I must say I find the actions of the Liberal government deplorable. It is the same for almost all issues. If we listen to their speeches, like the one my colleague just gave, we hear fine statements about about train safety and about how we need to do more and what the government is doing is fantastic. In speaking about the budget and finance, the government constantly refers to the middle class. The mini budget repeated that phrase 61 times. In reality, however, both it and the budget contained virtually no measures for the middle class.
In our opinion, the rail safety measures set out in Bill C-49 are completely inadequate. Yes, putting black boxes on locomotives and recording what is done is another step, but people in Quebec just lived through the Lac-Mégantic disaster. The subcontractor must have its own maintenance and monitoring plan. Everything is being left up to the private sector. That is the ultimate in complacency. Rail cars that are no longer up to standard are being used to transport oil. Companies are pressuring employees. We are still dealing with the same toxic combination that previously ended in disaster, and that is shameful. This would have been the time to present a real comprehensive rail safety plan so that a tragedy like that never happens again. The government should have given the people of Lac-Mégantic something, like a rail bypass, and made sure that a situation like that never happens again.
 Right now, all we have is a black box for rail passengers who are travelling. The government is out of touch with reality. Once again, we agree with what the Liberal Party is saying, but it is not backing up its words with action. The Liberals cannot govern using only a communications plan.",Bloc Québécois,Joliette,Gabriel Ste-Marie,http://www.parl.gc.ca/Parliamentarians/en/members/gabriel-ste-marie(224178)
4725397,ca.proc.d.2017-10-31.9749282,2017-10-31,07cf5767-802c-406c-92a7-7dc92af79b40,229526,"Mr. Kevin Lamoureux (Parliamentary Secretary to the Leader of the Government in the House of Commons, Lib.)",,Government Orders,Transportation Modernization Act,,"Madam Speaker, I disagree with the member across the way when he tries to give the impression that very little has been done. The minister has indicated a commitment to safety on a number of occasions. Within two years, we brought legislation forward to deal with safety. The member might have wanted to see a lot more done in that area, but having sat in opposition for a number of years, the Harper government did nothing with respect to that. It did not give it the attention necessary.
 Therefore, I am a bit surprised that, at the very least, the member would not recognize we are moving in the right direction. There is always room for improvement. In fact, we saw that at the standing committee. A number of opposition amendments were accepted and incorporated into the legislation.
Would the member not agree that the actions of the government to date are far greater than what we witnessed in the previous 10 years under the Harper government? Yes, there is some room for improvement, but at least we have a minister that has currently said that this is of the utmost importance and that we will continue to do what we can to ensure our railways are safe.",Liberal,Winnipeg North,Kevin Lamoureux,http://www.parl.gc.ca/Parliamentarians/en/members/kevin-lamoureux(229526)
4725398,ca.proc.d.2017-10-31.9749306,2017-10-31,f45e86b7-f192-4692-9889-6b57283fc3b0,224178,Mr. Gabriel Ste-Marie,,Government Orders,Transportation Modernization Act,,"Madam Speaker, in Quebec, between high school and university, students attend CEGEP, where they take mandatory philosophy classes. In those classes, they learn about sophisms, which are false arguments. One can condemn what the previous government did, but one cannot justify one's own actions on the grounds that those of the other government were worse. 
The idea of a black box in passenger trains is a step in the right direction, but it is a very, very small step. I just talked about the Lac-Mégantic tragedy. There is a lot to be done, and we see this as urgent.
My colleague, the Parliamentary Secretary to the Leader of the Government in the House of Commons, said the Liberals are taking a step in the right direction, but the problem is that all of the other elements in this mammoth bill are big steps in the wrong direction. On seaway safety, I am sorry, but this is anything but reassuring, and the situation is getting much worse. On air transportation and the Competition Bureau, why is the minister giving himself the power to just ignore the analysis of transactions? What was wrong with the existing system? I think there has been too much pressure from lobby groups. We need a government that can stand up to businesses and do a better job of ensuring safety and keeping prices down to benefit consumers. Bill C-49 is certainly a step in the right direction in some cases, but it is not nearly enough considering everything that needs to be done.",Bloc Québécois,Joliette,Gabriel Ste-Marie,http://www.parl.gc.ca/Parliamentarians/en/members/gabriel-ste-marie(224178)
4725399,ca.proc.d.2017-10-31.9749322,2017-10-31,07cf5767-802c-406c-92a7-7dc92af79b40,229526,Mr. Kevin Lamoureux,,Government Orders,Transportation Modernization Act,,"Madam Speaker, the member across the way made reference to air travel. We know the legislation will enable the minister to provide to all Canadians throughout every region of our country a sense of more accountability from airlines by putting in place rights for air passengers. Constituents who I represent perceive this as a very strong thing. It was part of the election platform we put forward to Canadians. We are fulfilling another commitment.
Would my friend across the way not agree that his constituents would be pleased to know we have forward momentum in dealing with the very important and sensitive matter of ensuring airlines are more accountable for the services they provide? At the least the opportunity is there today for government, after this legislation passes. The opposition can then hold the government and the minister accountable if it feels they have in fact dropped the ball once the regulations are in place.",Liberal,Winnipeg North,Kevin Lamoureux,http://www.parl.gc.ca/Parliamentarians/en/members/kevin-lamoureux(229526)
4725400,ca.proc.d.2017-10-31.9749338,2017-10-31,f45e86b7-f192-4692-9889-6b57283fc3b0,224178,Mr. Gabriel Ste-Marie,,Government Orders,Transportation Modernization Act,,"Madam Speaker, we wanted a passenger bill of rights. We wanted passengers rights to be guaranteed, but we wanted that from concrete measures, and not from some window dressing in Bill C-49. It does not even contain the minimum standards.
It seems to me that the government reached a consensus with airlines through some great deal. It is as though the industry were the government's boss and told the government what to do so it would not be angry. It almost seems as though the government is lobbying on behalf of the companies. As for consumers, they need much stronger measures, like the measures found in other countries, such as the United States. We were told we would have a great passenger bill of rights, but when we look more closely at this omnibus bill, we see that it contains very little. It is really disappointing.",Bloc Québécois,Joliette,Gabriel Ste-Marie,http://www.parl.gc.ca/Parliamentarians/en/members/gabriel-ste-marie(224178)
