basepk,hid,speechdate,pid,opid,speakeroldname,speakerposition,maintopic,subtopic,subsubtopic,speechtext,speakerparty,speakerriding,speakername,speakerurl
4722344,ca.proc.d.2017-10-17.9711183,2017-10-17,72dace30-741a-4877-8c1c-31b5dc3e4a8e,235112,"Mr. James Bezan (Selkirk—Interlake—Eastman, CPC)",,Government Orders,Business of Supply,Opposition Motion—Minister of Finance's documents submitted to the Conflict of Interest and Ethics Commissioner,"Mr. Speaker, I am going to be splitting my time with my colleague from Charlesbourg—Haute-Saint-Charles. 
It is going to be hard to follow the comedy show that we just witnessed from our friend from Hastings—Lennox and Addington. I know it is a difficult day for the Liberals on the other side. This is a tough one for them to explain to their constituents about the ethical lapses of the finance minister. Let us just get back to the basics. All we are asking for today is for the finance minister to be completely transparent here and that he follow through with the request of the motion that the House will hopefully adopt later today, to table all the documents that he submitted to the Conflict of Interest and Ethics Commissioner between November 4, 2015, and July 18, 2017.
A lot of people will ask why that is important. We are talking about the second most powerful person in the cabinet of the Government of Canada. This the individual who has all the control over the financial levers of our country. This is the individual who has to have the most trust of Canadians, of investors, and of our financial markets. This is the individual who has to make sure he is working in the best interests of Canadians and not of himself. What we have witnessed so far is that this minister hates transparency, hates accountability, and really has a lapse in judgment in trying to circumvent the rules that have been laid out by the Conflict of Interest Commissioner.
As a former parliamentary secretary, when I was sworn in, I had to immediately comply with the Office of the Conflict of Interest and Ethics Commissioner. There is a complete act called the Conflict of Interest Act for ministers and parliamentary secretaries as well as the book that the Prime Minister himself has updated on the accountable government, a guide for ministers and parliamentary secretaries. We have to look at all the rules that are in there, on which the Minister of Finance himself has refused to follow through. That in itself is something where the minister is really letting down not only his own caucus, but I really feel sorry for all my friends on the other side who have to sit through this miserable situation, listening to the Minister of Finance try to weasel out of this situation and actually have the Prime Minister step in and handle all the questions at a press conference because the minister was not able to do it himself. The Prime Minister was definitely disappointed in his finance minister. I can say that based upon what happened
In the guidelines, there is a section in chapter IV, part 1, called “Ministerial Conduct”. The Prime Minister's own book says:
 Ministers and Parliamentary Secretaries must act with honesty and must uphold the highest ethical standards so that public confidence and trust in the integrity and impartiality of government are maintained and enhanced. 
Looking at the definition of integrity and as it relates to ethics, we see it says in Wikipedia, “In ethics, integrity is regarded by many as the honesty and truthfulness or accuracy of one's actions.” We are not getting that when we look at the Minister of Finance and how he has completely dodged the issue of being transparent, of making sure that he has done things to the letter of the law, that all the is are dotted and the ts are crossed. I do not know whether he was trying to find loopholes in the Ethics Commissioner's guidelines or in the Conflict of Interest Act, because he definitely has broken the law in the way it is defined in the Conflict of Interest Act as it applies to ministers.
I am sure the members of the cabinet have all read the documents and they are all well aware of what needs to be done here, but the thing that struck me the most is that, once they become a public office holder, they have to provide all disclosure to the Conflict of Interest Commissioner. In subsection 22(1), the act says:
 A reporting public office holder shall, within 60 days after the day on which he or she is appointed as a public office holder, provide a confidential report to the Commissioner. 
That is two months, not two years but two months. Let us do the math over there. That never happened, because the French villa was not on that original list. Once they do report it, there is a public declaration, in subsection 25(2), which states, on “certain assets”:
 A reporting public office holder shall, within 120 days after the day on which he or she is appointed as a public office holder, make a public declaration of all of his or her assets that are neither controlled assets nor exempt assets. 
That is two months beyond the two months that the minister already had, so four months. Let us do the math—it is four months in total—for our Liberal friends.
We heard about the French villa that was reported in July of this year, two full years after the Minister of Finance was sworn in to cabinet. Here is an individual who completely missed the mark, and he is calling it an administrative oversight, which is just unheard of.
It further states, section 26: 
 (2) The summary statement must contain the following: 
 (a) for each controlled asset of the reporting public officer holder, and for each asset of the reporting public office holder that the Commissioner has ordered divested under section 30, a description of the asset and the method used to divest it;... 
All of his assets would have received direction from the Ethics Commissioner. 
It goes on to state that he has to: 
 (b)...recuse himself or herself under section 30, a description of the matter and information regarding the process to be put in place by the reporting public office holder and others to effect the recusal; and 
 (c) for any other matter in respect of which the Commissioner has issued an order to the reporting public office holder... 
Everyone sitting over there who is a parliamentary secretary or a minister of the crown has had to follow these rules. That is everybody except the Minister of Finance. That is why it is so important that we get the documents from the Ethics Commissioner herself, so that we, as parliamentarians, and Canadians can see whether the integrity of the finance minister is in question. If he said he received direction from the Office of the Conflict of Interest and Ethics Commissioner and somebody in that office said no, he did not need to put his assets in a blind trust or he did not need to disclose that he has a beautiful villa, owned by a private corporation, in France, possibly earning income from rentals to tourists or people who love the Mediterranean, that we need to find out. The only way to do that is if the Minister of Finance is honest and up front, and provides those documents to all of us in Parliament.
The other part of this is the requirement for divestment of assets through that appointment. Through the divestment, a minister has to either sell them, so that they do not influence the person's behaviour as a minister of the crown, or put them into a blind trust. When I was sworn in as parliamentary secretary in the previous government, I had to put my little farm into a blind trust. My wife had to be the manager and I was allowed to work on the farm, but not allowed to provide any input into the day-to-day operations of the farm. I was not allowed to talk to any of our clients, some of whom were my buddies. We could process cattle together, move them from pasture to pasture or vaccinate them, anything like that, as long as we were working, but I could not talk about any of the contracts that existed between them, as clients, and myself, as one of the owners of the blind trust.
Therefore, there are rules to follow. We know for a fact that the Minister of Finance did not put his considerable assets in Morneau Shepell into a blind trust. He was sitting on millions of shares worth over $32 million. As I said, the finance minister is the most important person in cabinet. He handles the finances of this country. He is really the flag-bearer for the most ethical behaviour, and we are not seeing that since he did not put his French villa into a blind trust.
To add insult to injury, we also now find out that Morneau Shepell has a private corporation called Morneau Shepell Bahamas, registered in Barbados, where it gets preferential tax treatment at an income tax rate of 2.5%. Through a tax treaty that Finance Canada negotiated with Barbados, it can repatriate that money back into Morneau Shepell Canada at no Canadian tax level at all. It pays its 2.5% income tax in Barbados, brings the money back here, and redistributes it through dividends to its shareholders, the Minister of Finance being one of the biggest shareholders of the company.
Let us also look at the overall issue of how this has completely hurt the finance minister's credibility. All we are asking is that he finally be honest, show some integrity, and provide parliamentarians and Canadians with the respect we deserve, the respect that the Office of the Conflict of Interest and Ethics Commissioner deserves, the respect that everyone involved in this issue deserves by being honest and up front, and disclosing all of the information he has relating to his relationship with the Office of the Conflict of Interest and Ethics Commissioner.
 ",Conservative,Selkirk—Interlake—Eastman,James Bezan,http://www.parl.gc.ca/Parliamentarians/en/members/james-bezan(235112)
4722345,ca.proc.d.2017-10-17.9711255,2017-10-17,07cf5767-802c-406c-92a7-7dc92af79b40,229526,"Mr. Kevin Lamoureux (Parliamentary Secretary to the Leader of the Government in the House of Commons, Lib.)",,Government Orders,Business of Supply,Opposition Motion—Minister of Finance's documents submitted to the Conflict of Interest and Ethics Commissioner,"Mr. Speaker, the Conservatives have opposed everything that the current Minister of Finance has done. What did the Conservatives do when we decreased taxes on Canada's middle class? They voted no. What did the Conservatives do when we put on a special tax on the wealthiest 1%? They said no. What do the Conservatives do when we talk about tax fairness? They say no.
I suggest that the Conservatives have once again found a topic to disagree on with the Minister of Finance. However, I believe that Canadians as a whole will have more faith and trust in what the Ethics Commissioner has to say than they do members of the Conservative Party who have consistently been critical of the Minister of Finance.
 The Minister of Finance himself has said that he will follow the advice of the Ethics Commissioner. I understand why we will not follow the advice of the Conservative Party. It is because we believe in Canada's middle class.",Liberal,Winnipeg North,Kevin Lamoureux,http://www.parl.gc.ca/Parliamentarians/en/members/kevin-lamoureux(229526)
4722346,ca.proc.d.2017-10-17.9711260,2017-10-17,72dace30-741a-4877-8c1c-31b5dc3e4a8e,235112,Mr. James Bezan,,Government Orders,Business of Supply,Opposition Motion—Minister of Finance's documents submitted to the Conflict of Interest and Ethics Commissioner,"Mr. Speaker, the member for Winnipeg North can sit here and yell and scream at the top of his lungs all he wants, because I can tell members that nobody that I have talked to on the small business tax changes trusts the Liberals. They even trust them less because of the actions of the Minister of Finance. 
The member can rally on and say that things are just great, but all the Liberals are doing is saying that there is one set of rules for the Liberals and a different set of rules for all the rest of us, and that is not right.",Conservative,Selkirk—Interlake—Eastman,James Bezan,http://www.parl.gc.ca/Parliamentarians/en/members/james-bezan(235112)
4722347,ca.proc.d.2017-10-17.9711266,2017-10-17,f37d5cb2-a1ad-4ec9-a7de-ca265da02938,214560,"Hon. Harjit S. Sajjan (Minister of National Defence, Lib.)",,Government Orders,Business of Supply,Opposition Motion—Minister of Finance's documents submitted to the Conflict of Interest and Ethics Commissioner,"Mr. Speaker, on behalf of the Minister of Finance, I wish to table these documents in the House, in both official languages.",Liberal,Vancouver South,Harjit S. Sajjan,http://www.parl.gc.ca/Parliamentarians/en/members/harjit-s-sajjan(214560)
4722348,ca.proc.d.2017-10-17.9711268,2017-10-17,02c2cb20-f27d-46a5-8e78-ab4b405bf07b,214864,The Deputy Speaker,,Government Orders,Business of Supply,Opposition Motion—Minister of Finance's documents submitted to the Conflict of Interest and Ethics Commissioner,"I thank the hon. minister.
The hon. member for Selkirk—Interlake—Eastman will have three minutes remaining in his time for questions and comments when the House next returns to debate on the question. 
We will now go to Statements by Members. 
The hon. member for Brossard—Saint-Lambert.",Conservative,Simcoe North,Bruce Stanton,http://www.parl.gc.ca/Parliamentarians/en/members/bruce-stanton(214864)
4722349,ca.proc.d.2017-10-17.9711276,2017-10-17,3ff878ad-e5c8-4b69-83cc-70922b56fe89,215894,"Mrs. Alexandra Mendès (Brossard—Saint-Lambert, Lib.)",,Statements By Members,International Day of the Girl,,"Mr. Speaker, October 11 is International Day of the Girl, a day of celebration proclaimed by the United Nations. Canada has joined other countries in making the issue of the rights of girls front and centre. Canadians recognize the importance of empowering girls and giving them opportunities for real growth.
Empowering girls empowers our communities. Globally, equality for girls starts with access to clean water, education, and health care. It also means ensuring that girls lead lives free of violence, oppression, and discrimination.
The International Day of the Girl is an opportunity to celebrate our country's energetic young women and the positive change they initiate.
Last week, on October 11, I had the great privilege of hosting a discussion with students of Champlain College Saint-Lambert. Their enthusiasm, participation, and insights reiterated that girls' rights and the empowerment of younger generations are as crucial today as ever. 
I want to say a big thank you to the students, professors and directors at Champlain College Saint-Lambert for welcoming me so warmly on the International Day of the Girl.",Liberal,Brossard—Saint-Lambert,Alexandra Mendes,http://www.parl.gc.ca/Parliamentarians/en/members/alexandra-mendes(215894)
4722350,ca.proc.d.2017-10-17.9711289,2017-10-17,bb27e38b-4887-48e1-b182-ba18b39d411b,217589,"Mr. Gordon Brown (Leeds—Grenville—Thousand Islands and Rideau Lakes, CPC)",,Statements By Members,Thalidomide,,"Mr. Speaker, when will the government act to compensate the forgotten survivors of thalidomide? For close to 60 years, these Canadians have suffered from the ravages of this horrible drug that was approved by the government of the day, and as they age their conditions are worsening.
 In the spring, the health committee made a series of recommendations to the minister after hearing from thalidomide compensation evaluation experts from around the world. The committee recommended that the Canadian criteria for compensation be re-evaluated, that survivors who have been rejected receive a physical exam, and that the compensation requirements err on the side of compassion.
Another Christmas is fast approaching and these survivors cannot wait another week, month, or year to finally hear some good news from the government. These victims have lived a life of pain, suffering, and discrimination. When will the government do the right thing and help these people?",Conservative,Leeds—Grenville—Thousand Islands and Rideau Lakes,Gord Brown,http://www.parl.gc.ca/Parliamentarians/en/members/gord-brown(217589)
4722351,ca.proc.d.2017-10-17.9711293,2017-10-17,4abeb9b5-279b-4117-9e04-b8901d9ccc53,224216,"Mr. Francis Scarpaleggia (Lac-Saint-Louis, Lib.)",,Statements By Members,Retirement Congratulations,,"Mr. Speaker, there are people of such energy, vision, tenacity, and commitment to community that they become the foundation of the quality of life we all enjoy. Natalie Chapman is such a person. She has devoted herself to building a loving community around those who are socially isolated. 
After over 20 years as director of the West Island Association for the Intellectually Handicapped, friends recently gathered to wish Natalie a happy and well-deserved retirement, and to honour her remarkable advocacy for those with intellectual disabilities and their families. 
Natalie believes deeply that it not only takes a village to raise a child and to care for the vulnerable but that it also takes goodwill and investment to keep that village strong. Natalie leaves WIAIH, a resilient community resource, confidently focused on the future. Natalie has created a lasting legacy, and set the bar high for what it means to care for and fashion a community that truly includes everyone.",Liberal,Lac-Saint-Louis,Francis Scarpaleggia,http://www.parl.gc.ca/Parliamentarians/en/members/francis-scarpaleggia(224216)
4722352,ca.proc.d.2017-10-17.9711299,2017-10-17,d013e8ca-fdd5-4eb4-a0e4-b5f0782a8f6d,217247,"Mr. Fin Donnelly (Port Moody—Coquitlam, NDP)",,Statements By Members,World Mental Health Day,,"Mr. Speaker, one in three Canadians will experience a mental illness or substance use disorder, or SUD, in his or her lifetime. Shockingly, more than 10 Canadians die by suicide each day. Suicide rates of indigenous youth in Canada are among the highest in the world. More than half of Canadian adults, and almost half of Canadian youth, say they cannot cope with unexpected difficult problems and day-to-day demands. Many people suffer in silence. 
World Mental Health Day provides each of us with an opportunity to pause and reflect on the importance of mental health and how we can help those living with mental illness. That is why it is so important to recognize World Mental Health Day each year on October 10.
 I encourage the government to officially designate October 10 as World Mental Health Day in Canada through resolution or legislation. 
I thank advocates like Carol Todd for their tireless efforts to raise awareness of mental health issues.",New Democratic Party,Port Moody—Coquitlam,Fin Donnelly,http://www.parl.gc.ca/Parliamentarians/en/members/fin-donnelly(217247)
4722353,ca.proc.d.2017-10-17.9711305,2017-10-17,500229ce-460b-45f9-93ce-abf974f9787d,229492,"Ms. Kate Young (London West, Lib.)",,Statements By Members,Daphne Caruana Galizia,,"Mr. Speaker, I rise in the House today to pay my respects to Ms. Daphne Caruana Galizia, the Maltese journalist whose life was tragically cut short yesterday when a bomb exploded in her car shortly after she had left her home. Ms. Caruana Galizia bravely investigated corruption and organized crime in Malta.
We unequivocally condemn this barbaric attack, and express our deepest sympathy to her family, and to all those affected by her tragic death. We must continue to support journalists from around the world in their pursuit of the truth, and the preservation of the fourth estate. As a former journalist, I praise Ms. Caruana Galizia' s dedication to truth, and call upon my colleagues in this House to stand united against this horrific attack.",Liberal,London West,Kate Young,http://www.parl.gc.ca/Parliamentarians/en/members/kate-young(229492)
4722354,ca.proc.d.2017-10-17.9711312,2017-10-17,9f0040ba-a9d7-4aa4-b2e4-f3213a4e024f,217922,"Hon. Deepak Obhrai (Calgary Forest Lawn, CPC)",,Statements By Members,Diwali,,"Mr. Speaker, many Canadians will join Hindus, Sikhs, Jains, and others from around the world on October 19 to celebrate Diwali, the festival of lights, which symbolizes good over evil. Diwali is now an international event, even acknowledged by the United Nations. 
Tomorrow evening I will be hosting the 17th National Diwali Celebration 2017 on Parliament Hill. We have come a long way since I first inaugurated this event back in 1998. We are the first western democracy to celebrate Diwali in Parliament. The success of this truly Canadian national event is due to the participation of the Indo-Canadian community.
 This year too, more than 30 temples and community organizations from Montreal, Toronto, Calgary, Vancouver, and Ottawa will help me organize this event. I invite all my colleagues to join me tomorrow at the event. I want to wish everyone a happy Diwali.",Conservative,Calgary Forest Lawn,Deepak Obhrai,http://www.parl.gc.ca/Parliamentarians/en/members/deepak-obhrai(217922)
4722355,ca.proc.d.2017-10-17.9711317,2017-10-17,9d4edb74-dcdc-4751-8541-6e42405e2bc5,234528,"Ms. Julie Dzerowicz (Davenport, Lib.)",,Statements By Members,Hispanic Day on the Hill,,"Mr. Speaker, today is a special day as we celebrate the second annual Hispanic Day on the Hill.
 As the daughter of a Mexican immigrant, the Hispanic and Latin American communities are very close to my heart. I am blessed that in Davenport, the riding I represent, there is a thriving, vibrant, and growing Spanish-speaking community, whether from Mexico, Argentina, Ecuador, Colombia, Cuba, El Salvador, or many other Latin American countries.
 In a world where we see increasing intolerance, Canada is a beacon of light, showing that diversity is a strength. Indeed, the contributions of our Spanish and Latin American communities enrich Canadian society and culture.
 I would like to close by warmly extending an offer to all my colleagues in the House to join us for our second annual Hispanic Day on the Hill celebrations in the Speaker's chamber today from 5 p.m. to 7 p.m.
[Member spoke in Spanish]",Liberal,Davenport,Julie Dzerowicz,http://www.parl.gc.ca/Parliamentarians/en/members/julie-dzerowicz(234528)
4722356,ca.proc.d.2017-10-17.9711325,2017-10-17,d9a6cad1-b3b6-4393-afc5-7c897fb638e6,229654,"Hon. MaryAnn Mihychuk (Kildonan—St. Paul, Lib.)",,Statements By Members,Kathleen Rice,,"Mr. Speaker, I rise today during Women's History Month in recognition of Kathleen Rice, Canada's first female professional prospector.
Kate was born in 1882 to a wealthy industrial family in St. Marys, Ontario, attended the University of Toronto and graduated in mathematics and physics in 1906.
Kate recognized early on the injustice of her half-pay teaching salary and decided to join the Manitoba gold rush. To add to the insult, as a non-person, Kate's plan to homestead in The Pas meant she had to have her brother sign the papers.
A sharpshooter, survivor, brilliant prospector, and Cree linguist, Kate staked many claims in Manitoba on her significant mineral discoveries, and was a correspondent for The Globe and Mail. Kate loved the majestic beauty of Manitoba's north, and for 40 years lived in a modest log cabin near Rice Island in Manitoba.
This month, let us stake our claim and recognize Kate Rice as an extraordinary role model.",Liberal,Kildonan—St. Paul,MaryAnn Mihychuk,http://www.parl.gc.ca/Parliamentarians/en/members/maryann-mihychuk(229654)
4722357,ca.proc.d.2017-10-17.9711328,2017-10-17,661a3062-86d1-4ba3-9e70-81c866aa2fc3,216864,"Mr. David Anderson (Cypress Hills—Grasslands, CPC)",,Statements By Members,The Economy,,"Mr. Speaker, it is time to start saying no to the deliberate destruction of the western Canadian economy.
These Liberals are very carefully sabotaging natural resource development and the prosperity that comes with it. For decades western Canadian natural resources have led the Canadian economy.
Now the government insists on interfering with that prosperity. The hypocrisy on pipeline approvals, the politicization of the regulatory approval process, and the hundreds of billions of dollars of lost investment are crippling the western Canadian economy.
On top of all of that comes an even larger threat, the carbon tax that the Liberals are about to impose. This tax is built on lies, that it will somehow change our environment, that it will be fiscally insignificant, and that it will somehow be revenue neutral, whatever that is. The reality is that this is a massive tax grab by irresponsible governments, that it will exclude some of the worst polluters by letting them buy their way out, and that western Canada will be hardest hit.
From the west, it looks like this Prime Minister is trying to finish the job that his father started.",Conservative,Cypress Hills—Grasslands,David Anderson,http://www.parl.gc.ca/Parliamentarians/en/members/david-anderson(216864)
