basepk,hid,speechdate,pid,opid,speakeroldname,speakerposition,maintopic,subtopic,subsubtopic,speechtext,speakerparty,speakerriding,speakername,speakerurl
4725259,ca.proc.d.2017-10-31.9748624,2017-10-31,a9fb83d8-ba9f-4794-9229-1fb53e7a1a1d,218632,"Ms. Rachael Harder (Lethbridge, CPC)",,Statements By Members,Community Builders Volunteer Awards,,"Mr. Speaker, 2017 marks a significant milestone for Canada. This year we celebrated our 150th anniversary since Confederation. What better way to commemorate this occasion than to recognize the amazing contributions made to our country by outstanding Canadians who give their time, talent, and resources to positively impact others and make our nation great?
The Community Builders Volunteer awards were created to recognize and celebrate the many volunteers in the Lethbridge riding who go above and beyond to give back. On October 20, I had the honour of recognizing and celebrating 18 amazing individuals, not-for-profit organizations, and businesses for their remarkable contributions to our community. The place I call home would not be the same without these individuals.
 Today, in the House of Commons, I take this moment to formally recognize and honour those women and men of my riding who were granted a Community Builders Volunteer award.",Conservative,Lethbridge,Rachael Harder,http://www.parl.gc.ca/Parliamentarians/en/members/rachael-harder(218632)
4725260,ca.proc.d.2017-10-31.9748628,2017-10-31,deea27ee-c7f2-4442-99ac-2417bbea8359,219764,"Mr. Steven MacKinnon (Gatineau, Lib.)",,Statements By Members,Infrastructure Projects in the Outaouais,,"Mr. Speaker, over the past few days I have had the pleasure of announcing two exciting projects for Gatineau. First, we are going to begin re-cladding the Terrasses de la Chaudière complex, which is a group of federal government buildings where the largest contingent of Canada's public servants work. Together with my colleague from Hull—Aylmer, we are taking this opportunity to revitalize public spaces inside and outside the complex for our community and for the 6,000 public servants who work there every day.
This morning, I also announced the construction of a second complex for the Library and Archives Canada Preservation Centre, a $400-million project that will create good jobs and preserve Canada's historic treasures. The federal government is working to ensure its presence in Quebec and the Outaouais.",Liberal,Gatineau,Steven MacKinnon,http://www.parl.gc.ca/Parliamentarians/en/members/steven-mackinnon(219764)
4725261,ca.proc.d.2017-10-31.9748631,2017-10-31,7ee20ab9-2d43-420c-8027-f6403cb498a2,219955,"Mr. Emmanuel Dubourg (Bourassa, Lib.)",,Statements By Members,Jean Nicolet Elementary School,,"Mr. Speaker, there are some initiatives that deserve to be commended. For the second year in a row, I had the immense pleasure of swearing in the grade 6 student council at Jean Nicolet elementary school in Montreal North. In an exercise led by their teacher, Ms. Kerline François, 20 students campaigned for seven councillor positions. During their well-run campaign, they worked to sway voters while learning about the democratic process and group management. This inspiring initiative also gives the students a chance to get involved in school activities. I therefore wish these aspiring leaders every success in government, and I also commend the administration at this school in my riding of Bourassa, which has been running this exercise every year for eight years. ",Liberal,Bourassa,Emmanuel Dubourg,http://www.parl.gc.ca/Parliamentarians/en/members/emmanuel-dubourg(219955)
4725262,ca.proc.d.2017-10-31.9748634,2017-10-31,37385e96-15e4-49cd-9b92-9932c96e0f69,234468,"Mr. Ben Lobb (Huron—Bruce, CPC)",,Statements By Members,100th International Plowing Match,,"Mr. Speaker, the highlight this fall in Huron—Bruce was found in Walton, Ontario, which played host to 76,000 people for the 100th International Plowing Match. I thank Jack Ryan, Joe Ryan, and the entire Ryan family and their surrounding neighbours, who made it such a great venue.
I congratulate Jacquie Bishop on being named the first female chair of the plowing match in that 100-year history. I thank the thousands of volunteers, sponsors, and exhibitors, the musical entertainment, and the talent of Huron East and the surrounding municipalities. Special thanks go to the plowing association. What a fantastic, great event.
We are proud of our rural roots in Huron—Bruce and southwestern Ontario. This was a fantastic plowing match, and I want to sincerely thank all the people involved. What a tremendous show we put on.",Conservative,Huron—Bruce,Ben Lobb,http://www.parl.gc.ca/Parliamentarians/en/members/ben-lobb(234468)
4725263,ca.proc.d.2017-10-31.9748641,2017-10-31,e38f0ee9-418f-4b86-a6fd-2c859c05d475,229509,"Ms. Kamal Khera (Brampton West, Lib.)",,Statements By Members,Women's History Month,,"Mr. Speaker, as we conclude Women's History Month, let us pay tribute to the trail-blazing women who have shaped our country and our way of life. Today I would like to highlight some of the organizations in Brampton West, and the women behind them, that bring positive change to the women in our community.
The Lady Ballers Camp is an organization that develops girl-centred programs that encourage physical, emotional, and educational development. Led by Toyo Ajibolade, this camp has touched the lives of hundreds of young girls.
Hope 24/7 is an organization that assists victims of sexual and domestic violence. Laura Zilney, the CEO of Hope 27/7, has been a tireless advocate in her pursuit of ensuring that these essential services are available to all women who are in need. 
I want to encourage young women across Canada to follow in the footsteps of these inspiring women and claim their place.",Liberal,Brampton West,Kamal Khera,http://www.parl.gc.ca/Parliamentarians/en/members/kamal-khera(229509)
4725264,ca.proc.d.2017-10-31.9748644,2017-10-31,7a2a1996-59b6-46e8-8ed0-9ea3c0fcf4ad,224981,"Mr. Marc Serré (Nickel Belt, Lib.)",,Statements By Members,Student Volunteers,,"Mr. Speaker, congratulations to students for taking action against poverty. The students at Confederation Secondary School in Val Caron have come together to collect funds to provide food, clothing, laundry services, and public transit for their peers. They surpassed their goal in one night by collecting over $3,900, which is truly amazing. 
Champlain Catholic high school held a “Homeless for a Night” event that raised $5,270 for the Chelmsford food bank. For the 17th year in a row, the students of Franco-Cité Catholic high school held a Thanksgiving fundraiser, and this year a total of 20,000 pounds of food was donated to the West Nipissing food bank.
All people deserve to have fresh food on the table and clothing on their backs.
I want to thank the faculty and parents for supporting these students' efforts.
I thank all staff, parents, and students for caring for their community.",Liberal,Nickel Belt,Marc Serré,http://www.parl.gc.ca/Parliamentarians/en/members/marc-serre(224981)
4725265,ca.proc.d.2017-10-31.9748647,2017-10-31,72dace30-741a-4877-8c1c-31b5dc3e4a8e,235112,"Mr. James Bezan (Selkirk—Interlake—Eastman, CPC)",,Statements By Members,Ukraine,,"Mr. Speaker, today we welcome the Prime Minister of Ukraine, Volodymyr Groysman, to Canada. This being his first visit to Canada, Prime Minister Groysman will be meeting with policy-makers and business leaders to discuss and improve upon existing projects and new partnerships between Canada and Ukraine.
 Our previous Conservative government initiated many economic, diplomatic, and security agreements, to the benefit of both our nations. The strong historical and cultural links between Ukraine and Canada were strengthened by Conservative initiatives such as the Canada-Ukraine Free Trade Agreement, the bilateral defence co-operation agreement, and more than $100 million in aid to promote economic growth, democracy, and humanitarian assistance.
Canada still has much to offer Ukraine. Conservatives have called on the government to restore Radarsat imagery, to add Ukraine to the Automatic Firearms Country Control List, and to provide it with the lethal defensive equipment it has requested. We continue to call on the Liberals to work with Prime Minister Groysman to continue Canada's legacy of unequivocal support for Ukraine.",Conservative,Selkirk—Interlake—Eastman,James Bezan,http://www.parl.gc.ca/Parliamentarians/en/members/james-bezan(235112)
4725266,ca.proc.d.2017-10-31.9748651,2017-10-31,6cef02a4-e5dd-44f0-9355-faf30afbb856,219864,"Mr. Borys Wrzesnewskyj (Etobicoke Centre, Lib.)",,Statements By Members,Ukraine,,"Mr. Speaker, this past August 24, Canadian soldiers marched in Ukraine's Independence Day parade carrying the Canadian flag in downtown Kyiv, which was a clear message to Ukrainians that Canada and NATO stand with them during this time of Russian military invasion and daily aggression. 
The liberal democratic west faces a global hybrid war against our foundational values and a rules-based international order. Ukraine's largely volunteer army is in the hot conflict in the Donbas fighting Kremlin soldiers and proxies. Defending Ukraine's territorial integrity, these brave soldiers are a living shield for NATO and the west. Through Operation Unifier, Canada has trained 5,500 Ukrainian soldiers. Let us make sure that these brave men and women are properly trained and equipped to deter further aggression.
Today on the Hill we welcome Prime Minister Volodymyr Groysman, and we extend to him a heartfelt greeting of Slava Ukraini i Slava Kanadi.",Liberal,Etobicoke Centre,Borys Wrzesnewskyj,http://www.parl.gc.ca/Parliamentarians/en/members/borys-wrzesnewskyj(219864)
4725267,ca.proc.d.2017-10-31.9748655,2017-10-31,ea197684-00f6-458f-a46b-5bea7db6f7f3,232372,"Mr. Daniel Blaikie (Elmwood—Transcona, NDP)",,Statements By Members,Human Rights,,"Mr. Speaker, I rise today in solidarity with the Oromo people who are being persecuted by their own government in Ethiopia. Popular protests began in earnest against the government's master plan in November 2015. The plan seeks to dispossess Oromo people of their land in order to expand Ethiopia's capital city, Addis Ababa. The plan followed on the heels of a number of development projects that had already displaced many Oromo farmers over the past decade. 
The government has disregarded the Oromo people's right to peaceful assembly, using brutal force against its own people to quell protests across Oromia. The number of arbitrary arrests and untimely deaths continues to rise for Oromia's farmers, opposition politicians, academics, journalists, and students, among others. 
I urge the Canadian government to respond to this situation, voice Canada's concerns about the Oromo people in Ethiopia, and work with our allies in the international community to create consequences for the Ethiopian government's violation of its citizens' human rights.",New Democratic Party,Elmwood—Transcona,Daniel Blaikie,http://www.parl.gc.ca/Parliamentarians/en/members/daniel-blaikie(232372)
4725268,ca.proc.d.2017-10-31.9748690,2017-10-31,9ad0ff66-1598-45e6-b146-6dd0eefb9cd0,234882,"Mr. Alexander Nuttall (Barrie—Springwater—Oro-Medonte, CPC)",,Statements By Members,Taxation,,"Mr. Speaker, over the past few weeks it has come to our attention that the Liberal government has been unfairly raising taxes on Canadians suffering from diabetes. I now hear reports that the government is also targeting Canadians with mental illness.
Living with disease or disability is not easy. The government should not be making it even more difficult by forcing these Canadians to pay even more to deal with or treat their various conditions.
As the shadow minister for youth, sports, and persons with disabilities, I want to make it absolutely clear to those suffering from disease or disabilities that the Conservative Party is listening to them and we are fighting on their behalf. We will not let the government turn its back on them. We will not be silent. We will stand beside them and with them to undo these injustices. ",Conservative,Barrie—Springwater—Oro-Medonte,Alex Nuttall,http://www.parl.gc.ca/Parliamentarians/en/members/alex-nuttall(234882)
4725269,ca.proc.d.2017-10-31.9748694,2017-10-31,4c0685b7-4ab9-4321-bb90-a5cb3ae307da,229496,"Mr. Terry Duguid (Winnipeg South, Lib.)",,Statements By Members,Women's History Month,,"Mr. Speaker, this year's celebrations for Women's History Month have once again underscored the immense contribution of women and girls throughout our country's history. Each day this month stories were shared of trail-blazing women and girls who embodied the spirit of this year's theme, #ClaimYourPlace. 
Their stories sparked a dialogue and inspired Canadians to get actively involved. On October 11, we celebrated the International Day of the Girl, reaffirming our role as a leader in the fight for girls' rights and gender equality around the world.
One week later, we honoured Persons Day and the five women who fought tirelessly to have women legally recognized as persons in Canada. 
As Women's History Month draws to a close, let us channel this powerful momentum and rededicate our efforts to empowering women and girls here in Canada and around the world. ",Liberal,Winnipeg South,Terry Duguid,http://www.parl.gc.ca/Parliamentarians/en/members/terry-duguid(229496)
4725270,ca.proc.d.2017-10-31.9748699,2017-10-31,6519cfba-0080-419d-baa9-8ae6e56d032f,232946,"Hon. Andrew Scheer (Leader of the Opposition, CPC)",,Oral Questions,Ethics,,"Mr. Speaker, we know that the Minister of Finance secretly held his Morneau Shepell shares in a numbered company for two years. He also introduced legislation on pensions that would benefit him personally. A former House of Commons law clerk stated that his conduct was, and I quote, a “huge error of judgment”.
Does the Prime Minister agree?",Conservative,Regina—Qu'Appelle,Andrew Scheer,http://www.parl.gc.ca/Parliamentarians/en/members/andrew-scheer(232946)
4725271,ca.proc.d.2017-10-31.9748701,2017-10-31,b8c04eca-f237-48a8-8975-374ccd40d1a9,214115,"Right Hon. Justin Trudeau (Prime Minister, Lib.)",,Oral Questions,Ethics,,"Mr. Speaker, as members and ministers are almost always required to do, the Minister of Finance worked with the Ethics Commissioner to ensure that he was following all the rules and laws. He also put in place a screen to ensure he did not make decisions where he was in a conflict of interest, a step also taken by a former leader of the opposition, former minister Denis Lebel, and many people on both sides of the House who entered into similar arrangements.",Liberal,Papineau,Justin Trudeau,http://www.parl.gc.ca/Parliamentarians/en/members/justin-trudeau(214115)
4725272,ca.proc.d.2017-10-31.9748703,2017-10-31,6519cfba-0080-419d-baa9-8ae6e56d032f,232946,"Hon. Andrew Scheer (Leader of the Opposition, CPC)",,Oral Questions,Ethics,,"Mr. Speaker, a former law clerk of the House of Commons is astounded that the finance minister thought he was complying with the spirit of the Conflict of Interest Act by holding assets through numbered companies and that, at the same time that he was introducing pension legislation, he owned a company whose business is pensions. The former law clerk says that the finance minister “should've known better”. We agree completely. Does the Prime Minister?",Conservative,Regina—Qu'Appelle,Andrew Scheer,http://www.parl.gc.ca/Parliamentarians/en/members/andrew-scheer(232946)
4725273,ca.proc.d.2017-10-31.9748707,2017-10-31,b8c04eca-f237-48a8-8975-374ccd40d1a9,214115,"Right Hon. Justin Trudeau (Prime Minister, Lib.)",,Oral Questions,Ethics,,"Mr. Speaker, everyone in the House works with the Conflict of Interest and Ethics Commissioner to ensure that their personal dispositions are in line with the rules in place. I can assure everyone that the finance minister followed that advice, and I am absolutely certain that the leader of the official opposition also followed the advice of the Conflict of Interest and Ethics Commissioner in accordance to his own personal tax dispositions.",Liberal,Papineau,Justin Trudeau,http://www.parl.gc.ca/Parliamentarians/en/members/justin-trudeau(214115)
4725274,ca.proc.d.2017-10-31.9748710,2017-10-31,6519cfba-0080-419d-baa9-8ae6e56d032f,232946,"Hon. Andrew Scheer (Leader of the Opposition, CPC)",,Oral Questions,Ethics,,"Mr. Speaker, the key difference here is that I disclosed everything to the Ethics Commissioner and the finance minister did not.
This is not a backbencher we are talking about. We are talking about the Minister of Finance, one of the government's most prominent ministers.
When did the Prime Minister find out that the Minister of Finance was in conflict of interest?",Conservative,Regina—Qu'Appelle,Andrew Scheer,http://www.parl.gc.ca/Parliamentarians/en/members/andrew-scheer(232946)
4725275,ca.proc.d.2017-10-31.9748712,2017-10-31,b8c04eca-f237-48a8-8975-374ccd40d1a9,214115,"Right Hon. Justin Trudeau (Prime Minister, Lib.)",,Oral Questions,Ethics,,"Mr. Speaker, everyone on this side of the House works with the Ethics Commissioner. We comply with the Ethics Commissioner's decisions and advice.
In truth, it is not surprising to see the Conservatives attack the commissioner, because during their decade in government, they attacked the Chief Electoral Officer, the Information Commissioner, and the Privacy Commissioner. They also axed the national science advisor position. They were constantly going after the institutions that safeguard our democracy.",Liberal,Papineau,Justin Trudeau,http://www.parl.gc.ca/Parliamentarians/en/members/justin-trudeau(214115)
4725276,ca.proc.d.2017-10-31.9748715,2017-10-31,6519cfba-0080-419d-baa9-8ae6e56d032f,232946,"Hon. Andrew Scheer (Leader of the Opposition, CPC)",,Oral Questions,Ethics,,"Mr. Speaker, it is the finance minister who just cannot be trusted. He hid an offshore company from Canadians for two years. He secretly managed his Morneau Shepell stocks in an Alberta numbered company. He tabled legislation that could benefit him personally. The finance minister still owns another five numbered companies that are unaccounted for. When will the Prime Minister order the finance minister to disclose what he is holding in those numbered companies?",Conservative,Regina—Qu'Appelle,Andrew Scheer,http://www.parl.gc.ca/Parliamentarians/en/members/andrew-scheer(232946)
4725277,ca.proc.d.2017-10-31.9748718,2017-10-31,b8c04eca-f237-48a8-8975-374ccd40d1a9,214115,"Right Hon. Justin Trudeau (Prime Minister, Lib.)",,Oral Questions,Ethics,,"Mr. Speaker, all Canadians and indeed all members opposite know that the finance minister worked with the Ethics Commissioner and followed her advice. What is not surprising is to see the Conservatives yet again attacking the integrity and the work of an officer of Parliament. For 10 years in government they attacked the Information Commissioner, they attacked the Official Languages Commissioner, they attacked the Privacy Commissioner, they took potshots at Supreme Court justices, and attacked Elections Canada every step of the way. The fact is that the Conservatives need to respect the institutions that defend Parliament.",Liberal,Papineau,Justin Trudeau,http://www.parl.gc.ca/Parliamentarians/en/members/justin-trudeau(214115)
4725278,ca.proc.d.2017-10-31.9748721,2017-10-31,6519cfba-0080-419d-baa9-8ae6e56d032f,232946,"Hon. Andrew Scheer (Leader of the Opposition, CPC)",,Oral Questions,Ethics,,"Mr. Speaker, the Liberal government needs to respect Canadians who are demanding transparency. Only a Liberal would think it is a petty attack to ask a finance minister, who has responsibility to regulate and legislate the economy, to disclose what he owns in his numbered companies. This has nothing to do with the Conflict of Interest Commissioner herself. This has to do with the finance minister who has withheld information from Canadians. When will the Prime Minister order his finance minister to come clean?",Conservative,Regina—Qu'Appelle,Andrew Scheer,http://www.parl.gc.ca/Parliamentarians/en/members/andrew-scheer(232946)
4725279,ca.proc.d.2017-10-31.9748723,2017-10-31,b8c04eca-f237-48a8-8975-374ccd40d1a9,214115,"Right Hon. Justin Trudeau (Prime Minister, Lib.)",,Oral Questions,Ethics,,"Mr. Speaker, again, it is all a bit rich coming from the Conservative Party, who spent 10 years attacking and dismantling the institutions that protected our Parliament. It is the only government in the history—",Liberal,Papineau,Justin Trudeau,http://www.parl.gc.ca/Parliamentarians/en/members/justin-trudeau(214115)
4725280,ca.proc.d.2017-10-31.9748929,2017-10-31,a2d5c8bf-d42e-4b53-be9e-70af2a6fe169,217370,Mr. Mark Strahl,,Oral Questions,Ethics,,"That dog will not hunt, Justin.",Conservative,Chilliwack—Hope,Mark Strahl,http://www.parl.gc.ca/Parliamentarians/en/members/mark-strahl(217370)
4725281,ca.proc.d.2017-10-31.9748724,2017-10-31,3176068f-62ee-4b2f-aacd-1131201c6db1,214707,The Speaker,,Oral Questions,Ethics,,"Order.
I ask the hon. member for Chilliwack—Hope, and others, not to be heckling and talking when someone else has the floor. We do not call attention to the absence of—",Liberal,Halifax West,Geoff Regan,http://www.parl.gc.ca/Parliamentarians/en/members/geoff-regan(214707)
4725282,ca.proc.d.2017-10-31.p5091502,2017-10-31,,,,intervention,Oral Questions,Ethics,," Oh, oh!",,,Some hon. members,
4725283,ca.proc.d.2017-10-31.p5091503,2017-10-31,3176068f-62ee-4b2f-aacd-1131201c6db1,214707,The Speaker,,Oral Questions,Ethics,," However, I can assure members he did heckle.
The hon. Prime Minister has the floor.",Liberal,Halifax West,Geoff Regan,http://www.parl.gc.ca/Parliamentarians/en/members/geoff-regan(214707)
4725284,ca.proc.d.2017-10-31.9748725,2017-10-31,b8c04eca-f237-48a8-8975-374ccd40d1a9,214115,"Right Hon. Justin Trudeau (Prime Minister, Lib.)",,Oral Questions,Ethics,,"Mr. Speaker, the Conservative Party is the only one in the history of the Parliament of Canada to be held in contempt of Parliament as a sitting government. The members opposite have shown no respect for transparency and openness. That is why Canadians elected a better government two years ago. That is why we continue to raise the bar on transparency and openness, despite their attacks.",Liberal,Papineau,Justin Trudeau,http://www.parl.gc.ca/Parliamentarians/en/members/justin-trudeau(214115)
4725285,ca.proc.d.2017-10-31.9748729,2017-10-31,a71a1741-7ff2-4246-b0da-4622e96b10cf,235389,"Mr. Guy Caron (Rimouski-Neigette—Témiscouata—Les Basques, NDP)",,Oral Questions,Ethics,,"Mr. Speaker, my problem with this defence is the fact that, when Liberals campaigned, they asked Canadians to vote for them because they were nothing like the Conservatives, and now they are saying not to blame them because they are doing what the Conservatives did before.
My colleague from Skeena—Bulkley Valley had a motion adopted yesterday at the Standing Committee on Access to Information, Privacy and Ethics to invite the Conflict of Interest and Ethics Commissioner to discuss the changes that will be needed to close the loophole in the Conflict of Interest Act. We moved the motion last week and the Liberals voted against it. Everyone agrees that the loophole is a problem.
When will the Prime Minister finally come around to closing it?",New Democratic Party,Rimouski-Neigette—Témiscouata—Les Basques,Guy Caron,http://www.parl.gc.ca/Parliamentarians/en/members/guy-caron(235389)
4725286,ca.proc.d.2017-10-31.9748732,2017-10-31,b8c04eca-f237-48a8-8975-374ccd40d1a9,214115,"Right Hon. Justin Trudeau (Prime Minister, Lib.)",,Oral Questions,Ethics,,"Mr. Speaker, I respect the independence of the committees. I am happy that the committee in question will be studying the legislation that governs conflicts of interest and inviting the Conflict of Interest and Ethics Commissioner. I think it is good to hear what parliamentarians have to say on the matter. That is part of what this place does in a constant effort to improve itself. However, we on this side of the House have always shown openness, transparency, and respect for Canadians.",Liberal,Papineau,Justin Trudeau,http://www.parl.gc.ca/Parliamentarians/en/members/justin-trudeau(214115)
4725287,ca.proc.d.2017-10-31.9748735,2017-10-31,f40d602c-1ae6-414e-bac3-23a2f31f1cdf,224989,"Ms. Linda Duncan (Edmonton Strathcona, NDP)",,Oral Questions,Ethics,,"Mr. Speaker, the fact is that multiple ministers are benefiting from a loophole in the Conflict of Interest Act, and the Ethics Commissioner has been calling for this loophole to be closed since 2013.
For a government that held itself to such a high ethical standard, why is the Prime Minister refusing to do the right thing: take the Ethics Commissioner's advice and close the loophole?",New Democratic Party,Edmonton Strathcona,Linda Duncan,http://www.parl.gc.ca/Parliamentarians/en/members/linda-duncan(224989)
4725288,ca.proc.d.2017-10-31.9748737,2017-10-31,b8c04eca-f237-48a8-8975-374ccd40d1a9,214115,"Right Hon. Justin Trudeau (Prime Minister, Lib.)",,Oral Questions,Ethics,,"Mr. Speaker, I am pleased to say that this information has been available for a long time on the Conflict of Interest and Ethics Commissioner's website; indeed two ministers had controlled assets held indirectly. The finance minister has announced that he is moving forward, going above and beyond what was originally asked. In the case of the other minister, those assets were divested 18 months ago. ",Liberal,Papineau,Justin Trudeau,http://www.parl.gc.ca/Parliamentarians/en/members/justin-trudeau(214115)
