basepk,hid,speechdate,pid,opid,speakeroldname,speakerposition,maintopic,subtopic,subsubtopic,speechtext,speakerparty,speakerriding,speakername,speakerurl
4725200,ca.proc.d.2017-10-31.9747301,2017-10-31,08f8d23a-fbea-4e7b-ba41-34c9f62dde9e,217134,"Ms. Anne Minh-Thu Quach (Salaberry—Suroît, NDP)",,Government Orders,Transportation Modernization Act,,"Mr. Speaker, I thank my colleague from Trois-Rivières for having explained so clearly the main problems with a bill that, as he said, is a mammoth omnibus bill, a Trojan horse. This bill amends 13 pieces of legislation and we are also under time allocation.
 I will not even have the time to speak about this bill that will affect my riding. There is a port in Salaberry-de-Valleyfield. The Liberals claim to stand up for Canadian jobs. The part on coasting trade does not even favour our maritime industries for the transportation of bulk products, for example, or goods that go through Salaberry-de-Valleyfield.
 What also worries me is everything related to passenger rights. We have seen very alarming videos lately of passengers being dragged from their seats because the companies overbooked. That is still happening and could continue to happen. 
 What does my colleague think about that? Could he discuss the NDP’s amendments that were defeated and that should have been accepted by the Liberals?",New Democratic Party,Salaberry—Suroît,Anne Minh-Thu Quach,http://www.parl.gc.ca/Parliamentarians/en/members/anne-minh-thu-quach(217134)
4725201,ca.proc.d.2017-10-31.9747312,2017-10-31,075456c7-3cca-483c-b4f1-85006031ca09,224982,Mr. Robert Aubin,,Government Orders,Transportation Modernization Act,,"Mr. Speaker, I thank my colleague from Salaberry—Suroît for asking this truly broad question.
 Indeed, in this magnificent maritime corridor that is the St. Lawrence and the Great Lakes, all members affected will not have the opportunity to speak. Spokespersons are sent to Ottawa to defend their part of the country, and they are not given the opportunity to speak on bills that affect them directly. That is ridiculous.
As for the passenger bill of rights, the main amendment by the NDP was very simple. It sought to include in Bill C-49 the passengers' bill of rights that was tabled by the NDP in the previous Parliament, and to have us vote on a true passengers' bill of charter, not guidelines for consultation.",New Democratic Party,Trois-Rivières,Robert Aubin,http://www.parl.gc.ca/Parliamentarians/en/members/robert-aubin(224982)
4725202,ca.proc.d.2017-10-31.9747318,2017-10-31,8942c6f2-bfc8-4275-97bb-a5086a07138e,215862,"Mr. Gagan Sikand (Mississauga—Streetsville, Lib.)",,Government Orders,Transportation Modernization Act,,"Mr. Speaker, it is a pleasure working with my colleague on the transportation committee.
In 2002, the United States had a form of a passenger bill of rights, and in 2005, Europe did. We are actually playing 15 years of catch-up to our counterparts. I was wondering if my colleague could comment on the fact that, in Canada, we are actually playing catch-up to our counterparts.",Liberal,Mississauga—Streetsville,Gagan Sikand,http://www.parl.gc.ca/Parliamentarians/en/members/gagan-sikand(215862)
4725203,ca.proc.d.2017-10-31.9747324,2017-10-31,075456c7-3cca-483c-b4f1-85006031ca09,224982,Mr. Robert Aubin,,Government Orders,Transportation Modernization Act,,"Mr. Speaker, I thank my colleague and I would like him to know that I also enjoy working with him in committee.
He raised some essential points. When it comes to a passengers' bill of rights, we do not have to reinvent the wheel here in Canada because good models already exist, including the European Union's bill of rights, which many witnesses mentioned in committee. They said that Europe's bill of rights was good, that it worked, and that we should use it as a model.",New Democratic Party,Trois-Rivières,Robert Aubin,http://www.parl.gc.ca/Parliamentarians/en/members/robert-aubin(224982)
4725204,ca.proc.d.2017-10-31.9747332,2017-10-31,8942c6f2-bfc8-4275-97bb-a5086a07138e,215862,"Mr. Gagan Sikand (Mississauga—Streetsville, Lib.)",,Government Orders,Transportation Modernization Act,,"Mr. Speaker, last year the Minister of Transport presented his vision for the future of transportation in Canada, also referred to as transportation 2030. This vision reflects thorough consultation with Canadians, stakeholders, provinces and territories, indigenous groups, and academics, following the release of the final report on the Canada Transportation Act review, also known as the Emerson report.
Transportation 2030 is made up of a series of initiatives under five themes: the traveller; safe transportation; green and innovative transportation; waterways, coasts, and the north; and trade corridors to global markets. These themes encompass various modes of transport and allow the government to take a holistic approach in ensuring the transportation system is equipped to support our broader priorities.
Canadian travellers and their experiences are top of mind for our government. During consultations conducted by the Minister of Transport, we asked Canadian travellers for their feedback, and they were clear. They want lower-cost air travel, more opportunities for leisure and business travel, and they want to see Canada become a more attractive travel destination for visitors. Canadians told us that they want long-term sustainable competition, which will allow for the introduction of additional air services, improved air connectivity, and more choice.
The government has listened, and it is committed to achieving tangible improvements to the traveller experience. As a result of the feedback we received, a number of proposals have been introduced in Bill C-49 to help improve the traveller experience. For example, the government intends to liberalize international ownership restrictions for Canadian air carriers. What does this mean for Canadian travellers? Allow me to briefly describe this initiative.
The legislation proposes to liberalize international ownership restrictions from 25% to 49% for Canadian air carriers, with associated safeguards. For example, a single international investor would not be able to hold more than 25% of the voting interests of a Canadian air carrier, and no combination of international air carriers could own more than 25% of a Canadian carrier. The policy change would not apply to Canadian specialty air services, such as aerial photography or firefighting, which would retain international ownership levels at 25%. Liberalizing international ownership restrictions means Canadian air carriers—and this includes all passenger and cargo providers—would have access to more investment capital that they can use for innovation. This would bring more competition into the Canadian air sector, providing more choice for Canadians, and generating benefits for airports and suppliers, including—",Liberal,Mississauga—Streetsville,Gagan Sikand,http://www.parl.gc.ca/Parliamentarians/en/members/gagan-sikand(215862)
4725205,ca.proc.d.2017-10-31.9747350,2017-10-31,37385e96-15e4-49cd-9b92-9932c96e0f69,234468,Mr. Ben Lobb,,Government Orders,Transportation Modernization Act,,"Mr. Speaker, I rise on a point of order. I think, if you check, you will find we have lost quorum.",Conservative,Huron—Bruce,Ben Lobb,http://www.parl.gc.ca/Parliamentarians/en/members/ben-lobb(234468)
4725206,ca.proc.d.2017-10-31.9747352,2017-10-31,02c2cb20-f27d-46a5-8e78-ab4b405bf07b,214864,The Deputy Speaker,,Government Orders,Transportation Modernization Act,,"I thank the hon. member for bringing this to my attention. I will begin to count.
 And the count having been taken: 
 Indeed, we do not have quorum. I will ask that the bells be rung.
 And the bells having rung: 
 Quorum has been reconstituted, and we will carry on with the debate. 
Resuming debate, the hon. member for Mississauga—Streetsville.",Conservative,Simcoe North,Bruce Stanton,http://www.parl.gc.ca/Parliamentarians/en/members/bruce-stanton(214864)
4725207,ca.proc.d.2017-10-31.9747364,2017-10-31,8942c6f2-bfc8-4275-97bb-a5086a07138e,215862,Mr. Gagan Sikand,,Government Orders,Transportation Modernization Act,,"In fact, Mr. Speaker, in the fall of 2016, the Minister of Transport exempted from the 25% ownership restrictions two companies that wanted to enter the Canadian market supported by increased foreign investment. This decision is now permitting Enerjet and Jetlines to pursue their intention to create low-cost carrier service to Canadians. With liberalized foreign investment provisions, Canadians would have more frequent access to air travel within and from Canada to transborder and international locations.
Like most countries, Canada limits international ownership and control of domestic air carriers. As I mentioned, under the Canada Transportation Act, non-Canadians currently cannot possess more than 25% of the voting shares of a Canadian carrier. Additionally, Canadian air carriers must also be controlled by Canadians, which means they may not be subject to controlling influence by international investors. 
Limits on foreign ownership and control of air carriers are the norm around the world. For example, in the United States, the limit is 25%, while the European Union, Korea, Australia, and New Zealand allow up to 49%, and Japan allows 33.3%. Limits vary depending on the circumstance of each region. However, Canada's current ownership limits may be acting as a barrier to new services and enhanced competition.
Earlier I mentioned that the two prospective ultra-low-cost carriers, Canada Jetlines and Enerjet, have already applied for and received exemptions to the current limits on international ownership from the Minister of Transport. This was granted because both companies successfully argued that, under the current 25% limit, there is insufficient risk capital in the Canadian market to support the launch of new services. 
Reflecting on this reality and the Canada Transportation Act review recommendations, the government is proposing changes that would allow international investors to own up to 49% of the voting shares of Canadian air carriers, by introducing legislation that would amend the act and other relevant acts. As I mentioned earlier, countries have different approaches to international ownership of air carriers, and our government wants to make sure that Canadian air carriers compete on a level playing field.
To protect the competitiveness of our air sector and support connectivity, no single international investor or any combination of international air carriers would be allowed to own more than 25%, but how would this benefit Canadian travellers? The direct impact of higher levels of international investment is that Canadian air carriers would have access to a wider pool of risk capital. This would allow air carriers to be better funded and could allow new carriers, which are otherwise not able to find sufficient risk capital, to enter the Canadian market.
New carriers, including ultra-low-cost carriers offering extremely competitive prices, are expected to bring more competition into the entire Canadian air travel sector. This could, in turn, reduce the cost of air transportation and open new markets to Canadian consumers and shippers. Small markets currently underserved by existing carriers could also benefit from services by new carriers. For example, airports in smaller cities that currently offer services to a very limited number of destinations could benefit from the addition of new services since we know that ultra-low-cost carriers use these smaller airports as their hubs. All of this could lead to more choice when purchasing airline tickets, more travel destinations for all travellers, including those from smaller cities, and lower prices for Canadian travellers. Additionally, there could also be benefits for airports and suppliers and the entire country, as more jobs are added to the Canadian economy.
Another improvement to the air travel sector in this bill is that it proposes a new transparent and predictable process for the authorization of joint ventures between air carriers, taking into account competition and wider public interest considerations. Joint ventures are a common practice in the global air transport sector. They enable two or more air carriers to coordinate functions on specific routes, including scheduling, pricing, revenue management, and marketing and sales. In Canada, air carrier joint ventures are currently examined from the perspective of possible harm to competition by the Competition Bureau under the Competition Act. 
Unlike many other countries, notably the United States, Canada's current approach does not allow for the consideration of the wider public interest benefits other than competition and economic impacts. Furthermore, the bureau's review is not subject to specific timelines. This raises concerns that the current approach to assessing joint ventures may make Canadian carriers less attractive to global counterparts as joint venture partners and may limit the ability of Canadian carriers to engage in this industry trend.
The bill before us in the House proposes amendments that would allow the minister to consider and approve air carrier joint ventures, taking into account competition considerations. On this latter concern, the current transport minister would work in close consultation with the commissioner of competition to ensure that he or she was properly informed regarding any concerns he or she may have with regard to competition. Air carriers that chose to have their proposed joint ventures assessed through the new process would be given clear timelines for an expected decision.
Providing Canada's air carriers with such a tool would also benefit the air traveller. By joining up networks, air carriers could allow seamless travel to a wide range of destinations and could reduce the duplication of functions. For Canadians, this could mean more seamless access to key global markets, easier inbound travel in support of tourism and business, and increased transiting traffic through our airports, thus increasing flight options. 
Globally, airports are making unprecedented investments in passenger screening to facilitate passenger travel and to gain global economic advantages. Canada's largest airports have expressed interest in making significant investments in passenger screening, either through an additional workforce or technology innovation. Smaller airports have also shown interest in obtaining access to screening services to promote local economic development. In the last two years alone, 10 small airports across Canada have requested screening services. 
The proposed amendments to the Canadian Air Transport Security Authority Act are important, as they would create a more flexible framework to allow CATSA to provide these services on a cost-recovery basis, which would in turn allow Canada to maintain an aviation system that is both secure and cost-effective. It would also strengthen Canadian communities' competitiveness as they attracted new commercial routes.
That is not all the transportation modernization act would do. Bill C-49 proposes to mandate the Canadian Transportation Agency to develop, in partnership with Transport Canada, new regulations to enhance Canada's air passenger rights. These new rules would ensure that air passenger rights were clear, consistent, and fair for both travellers and air carriers. When passengers purchase an airline ticket they expect and deserve that the airline will fulfill its part of the transaction. When that agreement is not fulfilled, passengers deserve clear, transparent, and enforceable standards of treatment and compensation for such situations. 
Under the proposed legislation, Canadians would benefit from a uniform, predictable, and reasonable approach. The details of the new approach would be elaborated through the regulatory process, which would include consultations with Canadians and the air stakeholders. My objective is to ensure that Canadians have a clear understanding of their rights as air travellers without negatively impacting access to air services and the cost of air travel for Canadians. 
Bill C-49 specifies that the regulations would include provisions regarding the following most frequently experienced irritants: providing passengers with plain language information about carriers' obligations and how to seek compensation or file complaints; setting standards for the treatment of passengers in the case of overbooking, delays, and cancellations, including compensation; standardizing compensation levels for lost or damaged baggage; establishing standards for the treatment of passengers in the case of tarmac delays over a certain period of time; seating children close to a parent or guardian at no extra charge; and requiring air carriers to develop standards for transporting musical instruments. 
The minister has been clear that he intends that the regulations include provisions ensuring that no Canadian is involuntarily removed from an aircraft due to overbooking after having boarded. The minister has issued a challenge to Canada's air carriers on this matter, on seating arrangements for minors, and on moving to strengthen air practices even before new passenger rights are finalized. 
The bill also proposes that data could be required from all parties in the air sector to monitor the air traveller experience, including compliance with the proposed passenger rights approach. This data would also inform any future policy or regulatory actions taken by the Minister of Transport to ensure that the air traveller experience to, within, and out of Canada was efficient and effective.
To finish, I will underscore that the experience of Canadian air travellers is a priority for the Government of Canada. We know that it is also a priority for Canadians. This is why we have proposed to increase international ownership restrictions for Canadian carriers. It is why we are proposing new rules on joint ventures that would help create greater efficiencies and more choices for Canadian travellers. It is why we are proposing some modest changes to the provisions of CATSA screening services that should help air passengers transit through airports more quickly. Finally, it is why we are creating a legislative framework so that Canadians can finally benefit from an air travellers' bill of rights. 
Once these new measures were in place, they could help lower prices, support increased competition among air carriers, provide more choice to Canadians when it comes to purchasing tickets, and improve service and connectivity for all Canadians and Canadian travellers.",Liberal,Mississauga—Streetsville,Gagan Sikand,http://www.parl.gc.ca/Parliamentarians/en/members/gagan-sikand(215862)
4725208,ca.proc.d.2017-10-31.9747588,2017-10-31,e7d4b944-1d3e-4f87-a7df-cdbd4fe7ca2b,218936,"Mr. Gord Johns (Courtenay—Alberni, NDP)",,Government Orders,Transportation Modernization Act,,"Mr. Speaker, coastal communities rely on jobs in the transportation industry, especially in shipping. During the last election campaign, the Liberal Party promised not to change the Coasting Trade Act, yet the bill before us would allow foreign registered vessels to compete unfairly with Canadian shipowners. We are requesting that Canadian registered vessels continue to have preferential access to government contracts, to carrying goods by container, and to repositioning of empty containers. In addition, the government did not consult the stakeholders affected by this measure. 
Why is the government going back on its word and now opening the door to unfair competition by foreign registered vessels?",New Democratic Party,Courtenay—Alberni,Gord Johns,http://www.parl.gc.ca/Parliamentarians/en/members/gord-johns(218936)
4725209,ca.proc.d.2017-10-31.9747603,2017-10-31,8942c6f2-bfc8-4275-97bb-a5086a07138e,215862,Mr. Gagan Sikand,,Government Orders,Transportation Modernization Act,,"Mr. Speaker, I can assure my hon. colleague that anything this government does takes into account Canadians. We surely do not intend that any change affects Canadians in a detrimental way. At the same time, we have to recognize that we operate in a global economy and a global marketplace, which is why we should not be very protectionist. We should actually work with foreign investors to increase our economy and benefit all Canadians. ",Liberal,Mississauga—Streetsville,Gagan Sikand,http://www.parl.gc.ca/Parliamentarians/en/members/gagan-sikand(215862)
4725210,ca.proc.d.2017-10-31.9747620,2017-10-31,ea476a5f-790f-416f-842b-f4ac57acb57b,216848,"Hon. Tony Clement (Parry Sound—Muskoka, CPC)",,Government Orders,Transportation Modernization Act,,"Mr. Speaker, we have had a lot of debate in the House already on the bill, which seems to be, and in fact manifestly is, an omnibus bill. It would amend 13 different pieces of legislation. At the same time, the much-vaunted expression to the Canadian people was that this was going to solve a lot of passenger issues. It was going to be the passenger bill of rights, yet there is very little in the bill that is about passengers.
 I wonder whether the hon. member can give his perspective on why he is supporting this piece of legislation when it does not do what the Liberals said it was going to and it would have all this impact on 13 other pieces of legislation. ",Conservative,Parry Sound—Muskoka,Tony Clement,http://www.parl.gc.ca/Parliamentarians/en/members/tony-clement(216848)
4725211,ca.proc.d.2017-10-31.9747651,2017-10-31,8942c6f2-bfc8-4275-97bb-a5086a07138e,215862,Mr. Gagan Sikand,,Government Orders,Transportation Modernization Act,,"Mr. Speaker, I find it curious to have that charge, knowing that the previous government was notorious for using omnibus bills.
If members look at what we are putting forward, it all deals with one piece of legislation, or 90% of it deals with one piece of legislation. Having said that, I am quite confident that this bill would help Canadians, especially with the aspect of air passenger rights. We are 15 years behind the United States and 12 years behind Europe, so it is about time we put something forward Canadians can rely on.",Liberal,Mississauga—Streetsville,Gagan Sikand,http://www.parl.gc.ca/Parliamentarians/en/members/gagan-sikand(215862)
4725212,ca.proc.d.2017-10-31.9747699,2017-10-31,ffeab63b-041e-4d87-bdad-1b79ff9a98c5,215886,"Mr. Dan Vandal (Saint Boniface—Saint Vital, Lib.)",,Government Orders,Transportation Modernization Act,,"Mr. Speaker, the hon. member has worked very hard on the transportation committee for the last couple of years, and it certainly shows.
Could the hon. member comment on how this legislation would affect the overall strategic plan with respect to the minister's comments on transportation 2030?",Liberal,Saint Boniface—Saint Vital,Dan Vandal,http://www.parl.gc.ca/Parliamentarians/en/members/dan-vandal(215886)
4725213,ca.proc.d.2017-10-31.9747714,2017-10-31,8942c6f2-bfc8-4275-97bb-a5086a07138e,215862,Mr. Gagan Sikand,,Government Orders,Transportation Modernization Act,,"Mr. Speaker, the approach is looking forward to 2030, and the approach has been to look at the entire transportation system holistically, as it is vast and quite intricate. 
I applaud the minister for the work he has done and for all the consultations he has had with stakeholders and Canadians. ",Liberal,Mississauga—Streetsville,Gagan Sikand,http://www.parl.gc.ca/Parliamentarians/en/members/gagan-sikand(215862)
4725214,ca.proc.d.2017-10-31.9747721,2017-10-31,95ed53a7-7538-4c0f-85a4-64af76065f95,218942,"Mr. Don Davies (Vancouver Kingsway, NDP)",,Government Orders,Transportation Modernization Act,,"Mr. Speaker, listening to the Conservatives accuse the Liberals of introducing omnibus bills is a little rich. The Harper government introduced omnibus bills to such an extent that Canadians became quite engaged and enraged about it, but that does not excuse the current government for doing the same thing, and it is doing it here. The Liberals stood in the House, along with New Democrats, and criticized the previous government for introducing omnibus bills, and here they have introduced one bill that would amend 13 different acts. It is by every single measure an omnibus bill.
My question is about Canadians, not about what we are doing in the House. I would like the member to explain why his Liberal colleagues voted against an NDP amendment that would have, among other things, required airlines to reimburse passengers for the full price of a ticket when a flight was cancelled. It would seem to me that this would be a very logical and reasonable request of airlines. Why did the Liberals not support that NDP amendment?",New Democratic Party,Vancouver Kingsway,Don Davies,http://www.parl.gc.ca/Parliamentarians/en/members/don-davies(218942)
4725215,ca.proc.d.2017-10-31.9747736,2017-10-31,8942c6f2-bfc8-4275-97bb-a5086a07138e,215862,Mr. Gagan Sikand,,Government Orders,Transportation Modernization Act,,"Mr. Speaker, I apologize. I was not here in the House when the previous government was here. 
Speaking to the first part of my colleague's question, we cannot compartmentalize such a vast transportation system. When 90% of Bill C-49 deals with one act, I do not see that it is an omnibus bill.
To the second part of the member's question, we worked quite collaboratively in committee. If specific amendments were rejected, it could have been due to duplication or a number of other reasons. There was no malice there. We worked really well together.",Liberal,Mississauga—Streetsville,Gagan Sikand,http://www.parl.gc.ca/Parliamentarians/en/members/gagan-sikand(215862)
