basepk,hid,speechdate,pid,opid,speakeroldname,speakerposition,maintopic,subtopic,subsubtopic,speechtext,speakerparty,speakerriding,speakername,speakerurl
4722282,ca.proc.d.2017-10-17.9709683,2017-10-17,3838746e-29a4-4a93-8239-a2b17a3b387f,234876,"Mr. Mark Warawa (Langley—Aldergrove, CPC)",,Government Orders,Business of Supply,Opposition Motion—Minister of Finance's documents submitted to the Conflict of Interest and Ethics Commissioner,"Mr. Speaker, it is a true honour to be in the House today to speak on this very important issue. I thank my colleague who just spoke for his tenacity in standing up for Canadians. It is a real honour to be part of the Conservative Party of Canada with its legacy of standing up for Canadian taxpayers. 
Over the years, when Canadians have seen fit to elect a party with an entitlement mentality like the Liberal party, eventually it creates a huge mess. We see Canada heading in that direction again. We are ready and committed to clean up any Liberal mess left over. 
I am particularly honoured to be able to share what I heard from my youth advisory board. I notified youth in my riding of Langley—Aldergrove that I would like to hold a monthly youth advisory board meeting with them to discuss issues that were important to them. We have held two meetings. The first was on the marijuana issue. These are youth in grade 12 up to and in university, some working on undergraduate degrees. They are very mature, wise, bright, and engaging young people, and it was interesting to get their perspective. It is a non-partisan youth advisory board, with people with all kinds of opinions. The consensus within the group on marijuana was that the government was moving way too fast, that it needed to provide education, to listen to police boards across the country, and to slow the process down. Many of them are okay with the legalization process for marijuana, but not the way the Liberal government is doing it. It is moving way too fast. It seems to have this artificial date of July 1 of next year that legalization must be in place by Canada Day, so that everyone can start smoking then. The group is very concerned about the government's approach to marijuana.
I asked them what topic they would like to talk about next, and they said the new tax the government is wanting to put on Canadian small business. I found that fascinating. We met last Saturday morning and had another really good meeting that lasted for about an hour or an hour and a half. Some of the youth went into the meeting thinking that maybe the government was right and that some Canadians are not paying their fair share of taxes. To prepare for the meeting, the materials they received were general materials that all Canadians have access to. Much of it was non-partisan, and some partisan. 
Overwhelmingly, those who went into the meeting thinking that maybe the government was right changed their position 180 degrees and came out of the meeting saying that the government was wrong. Calling hard-working Canadians tax cheats is shameful, and they were really shocked at the government taking that approach. They also said that the government needed to slow the process down. The number one thing that every Liberal member of Parliament heard regarding their so-called consultations was to keep the consultations going. The Liberal Party held the consultations during the summertime, starting in the middle of July and continuing in August and September and ending at the beginning of October. In those two and a half months, people were on holidays, and the consultations were often held in the middle of the week at three o'clock in the afternoon when Canadians were at work. Those who were not on holidays were working, yet the Liberals still held these so-called consultations. 
The Liberals heard over and over again that they should keep the consultations going so they could continue to hear from people because they were not happy. The answer from the Liberal members was that the people were confused, that Canadians are confused and business is confused, so they would end the consultations to avoid the confusion. They would provide legislation so there would be no more confusion. 
The youth advisory board also said that this process needed to continue and that there needed to be additional consultations. I am very proud and happy to be able to pass on what I heard from them this last Saturday morning. It is a very wise group of young people.
Today, we are debating a motion by Her Majesty's official opposition. I have listened to the debate and the comments made so far, and I think back to Jim Flaherty, who was a finance minister in the Stephen Harper government. He was appointed and very quickly earned the reputation of being the greatest finance minister in the world.
 What an honour it was to be part of that government. He did deserve that title. He was an extremely bright, ethical, funny man. He had a great sense of humour. People liked to be around Jim. There was great sorrow at his untimely death. He was known as the greatest finance minister Canada probably has ever had. At the time, he was greatest in the world.
Just yesterday when I was watching the news I heard the questions by the media as the government was trying to calm down people. There was a news conference where the government was saying that it is really looking out for what is good for Canadians, that it wants tax fairness and is launching its new programs around fairness and taxes.
Canadians do not believe this. The media does not believe it. There is this cloud hanging over the finance minister. As has been pointed out, the office of the finance minister is extremely important. The finance minister is probably the most powerful posting in government in Canada. That finance minister has to be squeaky clean. 
I really do not want to attack that individual, because I do not know his intent. However, it is the responsibility of the government to make sure that everything is squeaky clean. That is what this Prime Minister promised, that he was going to be squeaky clean and all his ministers were going to be squeaky clean. Throughout the last two years, the first half of a one-term mandate, they were going to do things that were squeaky clean and transparent.
There is great suspicion that things are not squeaky clean. I am hearing a lot of angst among Canadians that the government is not keeping its promises time and time again. The small business tax was supposed to be reduced. That was in the platform of the previous Conservative government, and it would have happened immediately. Now we are two years into this government's mandate, and look at what has happened to that. The government is in trouble now. Canadians are very upset with what is happening.
 The government has now announced that it will reduce the small business tax back down to the 9%. Well, actually, it will go down to 10%, and then just before the election it will be lowered to 9%. That is not what Canadians want. They have not been told the truth throughout the whole process.
This motion is about wanting information. What did the finance minister declare to the Ethics Commissioner from the time of his appointment to July of this year when the consultation period started? That would indicate whether there was any intended self-benefit, or whether there is a conflict of interest. What is the motive of the Prime Minister and the finance minister?
 I have heard Canadians say that these two people have really not lived like hard-working Canadians. They live off a trust. They have multi-million dollar assets. They are not like you and me, Mr. Speaker. They are not like normal Canadians. They are very wealthy people. To whom much is given, much is required.
 Accountability is a critical promise by the Prime Minister. We need accountability from him, and we have not had it. We need accountability from the finance minister, and to this point we have not had it. 
It will be interesting as we go to a vote on this motion, probably later today, to see if the members of the Liberal Party keep the promises that were made in the Speech from the Throne at the start of this Parliament that they would be a transparent, accountable government. We are not seeing that from the leadership within the cabinet. Will the Liberal members demand that their Prime Minister and finance minister be transparent and provide the House with the details necessary for transparency?",Conservative,Langley—Aldergrove,Mark Warawa,http://www.parl.gc.ca/Parliamentarians/en/members/mark-warawa(234876)
4722283,ca.proc.d.2017-10-17.9709856,2017-10-17,711a47d7-2f48-4673-a4b1-a79126bd8e85,215926,"Mr. Ken Hardie (Fleetwood—Port Kells, Lib.)",,Government Orders,Business of Supply,Opposition Motion—Minister of Finance's documents submitted to the Conflict of Interest and Ethics Commissioner,"Mr. Speaker, I have great confidence in my friend and hon. member across the way, and in fact, all of them on the other side, because their job is to take a situation and for the benefit of Canadians, paint the blackest, bleakest possible picture. However, I have even more confidence in the non-partisan commissioner whose job it is to review this and truly assess it from a non-partisan perspective.
If the Ethics Commissioner reviews this and finds that everything is good and above board, will that be good enough for the Conservative Party and for him?",Liberal,Fleetwood—Port Kells,Ken Hardie,http://www.parl.gc.ca/Parliamentarians/en/members/ken-hardie(215926)
4722284,ca.proc.d.2017-10-17.9709886,2017-10-17,3838746e-29a4-4a93-8239-a2b17a3b387f,234876,Mr. Mark Warawa,,Government Orders,Business of Supply,Opposition Motion—Minister of Finance's documents submitted to the Conflict of Interest and Ethics Commissioner,"Mr. Speaker, I want to thank the member for Fleetwood—Port Kells for his kind compliment, and I return that. I think highly of him. He has worked hard. I have heard good reports about his constituency office work and his helping his constituents, so I congratulate him on that.
Our concern is with the leadership of the Liberal Party and this entitlement mentality and the lack of transparency. The Ethics Commissioner can only make decisions based on the information provided. I think that is the issue today. Has the finance minister provided all the details of his assets?
We cannot always believe the media, but we have heard reports that there are unreported assets. If that is the case, the Ethics Commissioner would not be able to make a true ruling. That is why we have this motion today that asks the finance minister, in full transparency, what he reported to the Ethics Commissioner. If he did not report all these assets, why not, and is he fit to be the finance minister of this country?
I think it is very important, and it is fair. It needs to be transparent.",Conservative,Langley—Aldergrove,Mark Warawa,http://www.parl.gc.ca/Parliamentarians/en/members/mark-warawa(234876)
4722285,ca.proc.d.2017-10-17.9709923,2017-10-17,e7d4b944-1d3e-4f87-a7df-cdbd4fe7ca2b,218936,"Mr. Gord Johns (Courtenay—Alberni, NDP)",,Government Orders,Business of Supply,Opposition Motion—Minister of Finance's documents submitted to the Conflict of Interest and Ethics Commissioner,"Mr. Speaker, The Globe and Mail places the value of the finance minister's shares in Morneau Shepell at around $43 million. We know it is possible that with the proposed tax changes, HR management and pension consulting companies like Morneau Shepell could benefit from increased sales of individual pension plans as business owners shift their retirement savings from private corporations. We also know that Morneau Shepell has subsidiaries in Barbados and the Bahamas, where corporate tax rates are as low as 2.5%. We know that Morneau Shepell and the Morneau family trust are sheltered from the proposed tax changes, as is the Prime Minister's family fortune.
When we add this all up and think about the small-business people at home who have now become a target of these proposed tax changes, do they have confidence that the government will do them justice when it looks at tax fairness as a whole? I wonder if they feel that CEOs and tax havens and the wealthiest Canadians are going to be under the same scrutiny, when we hear that the finance minister himself has these connections, potentially.
Given all that, does the member feel that the business people in his community have that confidence in the finance minister?",New Democratic Party,Courtenay—Alberni,Gord Johns,http://www.parl.gc.ca/Parliamentarians/en/members/gord-johns(218936)
4722286,ca.proc.d.2017-10-17.9709973,2017-10-17,3838746e-29a4-4a93-8239-a2b17a3b387f,234876,Mr. Mark Warawa,,Government Orders,Business of Supply,Opposition Motion—Minister of Finance's documents submitted to the Conflict of Interest and Ethics Commissioner,"Mr. Speaker, I do not believe the business community in my community or across Canada has confidence in the Liberal government, its proposals, and the drastic tax changes that have been done or are being proposed without proper consultation.
I was also shocked when the finance minister was asked in the House about his involvement and if there would be any direct benefit from this and whether he thought he would be in conflict. The finance minister said, “Not only did I not abstain, but I actively engaged in” the discussions. For the finance minister to be bragging of his engagement on this, when the optics are that he could be in conflict, is shocking.
Small businesses, and Canadians in general, are very concerned about the entitlement attitude of the government. ",Conservative,Langley—Aldergrove,Mark Warawa,http://www.parl.gc.ca/Parliamentarians/en/members/mark-warawa(234876)
4722287,ca.proc.d.2017-10-17.9710005,2017-10-17,330c0119-cf49-4e85-9407-539367825c2b,234610,"Mr. Chris Bittle (St. Catharines, Lib.)",,Government Orders,Business of Supply,Opposition Motion—Minister of Finance's documents submitted to the Conflict of Interest and Ethics Commissioner,"Mr. Speaker, I am happy to rise here today to defend an individual of incredible integrity. We have heard a lot of attempts in this place to attack the integrity of the finance minister, but as we have heard, he has worked with the integrity commissioner, and to any questions, he has been more than forthright. Therefore, I am happy to rise here today to talk about the accomplishments of this minister and what he is doing, along with our government, to build a stronger middle class. 
Building a stronger middle class does not come without changes. The issue of tax planning and using private corporations is one of those changes that is required to finally bring equity to our tax system, something the finance minister has been behind from the start. We have been working, from the moment we took office, to implement these changes that benefit the middle class and those working hard to join it. These changes that are forthcoming are just another step in setting things right for the middle class, again something the finance minister talked about as a candidate and has now as the Minister of Finance.
We took our first steps when Parliament resumed in December 2015, lowering taxes on the middle class, as promised, and raising them on the wealthiest 1%. Unfortunately, both the Conservatives and the New Democrats voted against that. This middle-class tax cut has been benefiting nine million Canadians, and we are extremely proud of that. 
We brought in the new Canada child benefit, which has lifted thousands of children out of poverty, including 16,000 in my riding of St. Catharines. This is a significant accomplishment, and one of the architects of it was, of course, the finance minister. As a result of the Canada child benefit, nine out of 10 families are getting more in benefits than they did under the previous government. With the CCB, we have ensured that child benefits are more generous and are actually targeted to those who need them most.
 Our government, under the leadership of the finance minister and working with the provinces, expanded the Canada pension plan to ensure that Canadians have financial security after a lifetime of hard work. The strengthened CPP will provide more money to Canadians when they retire, allowing them to focus more on what matters most: time with family.
 As members can see, our actions and the actions of the finance minister could not be clearer. The guiding principle of fairness is essential, and indeed, is the defining piece of our plan to strengthen the middle class. It is abundantly clear that when we have an economy that works for the middle class, we have a country that works for everyone. 
It is fitting that we are having this debate during Small Business Week, so let us talk about small businesses. We know that small businesses are the backbone of our economy. They are a key driver of Canada's economy. I think everyone in this chamber would agree with that. Small businesses account for 98% of all businesses and more than 70% of all private sector jobs. In recognition of how critical small businesses are to Canada's growth, our government, and again, the Minister of Finance, are taking action to help small businesses grow, invest, and create good, well-paying jobs. 
Yesterday the finance minister announced, along with the Prime Minister and the Minister of Small Business and Tourism, the government's intention to lower the small-business tax rate to 10% in 2018 and then to 9% in 2019. As a result, the combined federal-provincial-territorial average tax rate for small businesses will be lowered to 12.9% from 14.4%, ensuring that Canadians by far will continue to have the lowest small-business taxes in the G7 and the fourth-lowest among the Organisation for Economic Co-operation and Development countries. This lower rate will mean that small-business owners can retain more of their earnings to reinvest, to support the growth of their businesses, and for job creation. 
The finance minister also announced the government's intention to move forward on proposals to fix a tax system that is inherently unfair to the middle class. We have heard a lot of criticism about the finance minister, but he is one of the leading voices in this country on this side of the House to fight for a system that benefits the middle class and against those policies that are unfair to the middle class. 
We have a tax system currently that encourages wealthy individuals to incorporate just so they can get a tax advantage. This cannot continue. It leads to a solution where someone making hundreds of thousands of dollars can get a lower tax rate than a middle-class worker making much less. A person making $300,000 per year can save as much tax as an average Canadian can earn in a year. This is not acceptable, and our government and the finance minister are going to fix it.
In July, the finance minister launched consultations to hear from Canadians on how to fix things and how to then make—",Liberal,St. Catharines,Chris Bittle,http://www.parl.gc.ca/Parliamentarians/en/members/chris-bittle(234610)
4722288,ca.proc.d.2017-10-17.9710119,2017-10-17,02c2cb20-f27d-46a5-8e78-ab4b405bf07b,214864,The Deputy Speaker,,Government Orders,Business of Supply,Opposition Motion—Minister of Finance's documents submitted to the Conflict of Interest and Ethics Commissioner,"Order, please. I see the hon. member for Cypress Hills—Grasslands rising on a point of order.",Conservative,Simcoe North,Bruce Stanton,http://www.parl.gc.ca/Parliamentarians/en/members/bruce-stanton(214864)
4722289,ca.proc.d.2017-10-17.9710125,2017-10-17,661a3062-86d1-4ba3-9e70-81c866aa2fc3,216864,"Mr. David Anderson (Cypress Hills—Grasslands, CPC)",,Government Orders,Business of Supply,Opposition Motion—Minister of Finance's documents submitted to the Conflict of Interest and Ethics Commissioner,"Mr. Speaker, I rise on a point of order. There are a number of us here who are very enthused about this subject and about hearing the government's perspective on the motion we have before us. However, the member is about seven minutes into his speech and has not yet touched on the motion. I would ask if you could encourage him to speak to the motion and to the tabling of documents that have to do with the minister's ethical lapses and his failure to abide by the ethical conditions that have been laid out for him by the Ethics Commissioner and others, including the Prime Minister. If he could speak to that, we would be glad to hear his opinion.",Conservative,Cypress Hills—Grasslands,David Anderson,http://www.parl.gc.ca/Parliamentarians/en/members/david-anderson(216864)
4722290,ca.proc.d.2017-10-17.9710134,2017-10-17,02c2cb20-f27d-46a5-8e78-ab4b405bf07b,214864,The Deputy Speaker,,Government Orders,Business of Supply,Opposition Motion—Minister of Finance's documents submitted to the Conflict of Interest and Ethics Commissioner,"I thank the hon. member for his intervention. I recognize that the hon. member for St. Catharines, in his initial comments, made reference to the activities of the finance minister in a general sense. Considering that the subject of the motion today pertains to the performance of the finance minister in the course of his duties, I so far have not heard anything that is impertinent and not relevant to the discussion. Certainly, in the course of his time, the member for St. Catharines will bring the dialogue back in reference specifically to the motion. I am sure he will do that in the minutes ahead. 
The hon. member for St. Catharines.",Conservative,Simcoe North,Bruce Stanton,http://www.parl.gc.ca/Parliamentarians/en/members/bruce-stanton(214864)
4722291,ca.proc.d.2017-10-17.9710149,2017-10-17,330c0119-cf49-4e85-9407-539367825c2b,234610,Mr. Chris Bittle,,Government Orders,Business of Supply,Opposition Motion—Minister of Finance's documents submitted to the Conflict of Interest and Ethics Commissioner,"Mr. Speaker, hearing the attempt by the official opposition to criticize the finance minister, I am standing here to speak of the great work he is doing. The finance minister has worked with various commissioners, and there is no wrongdoing. I mentioned this to a colleague earlier, from the old commercial from the 1980s: where is the beef? This is a fishing expedition and an attempt to undermine the credibility of the finance minister.
As I was stating, yesterday our government announced the intention to simplify the proposal to limit the ability of owners of private corporations to lower their personal income taxes by sprinkling their income to family members. We want to be very clear on this next point that the vast majority of private corporations will not be impacted by these sprinkling measures. Only an estimated 50,000 family-owned private businesses are sprinkling income. This represents only around 3% of privately controlled corporations. Again, we have a finance minister who is looking at what is best for the middle class. These are policies the previous government did not go after, policies that generally disproportionately benefit the wealthiest Canadians
In addition, our government announced that it will not be moving forward with proposed measures to limit access to the lifetime capital gains exemption.
As we continue to make progress, we will also continue to listen carefully to the submissions that have been received on these matters. 
As I conclude my remarks, I want to assure my hon. colleagues of the finance minister's, and the government's, plan to grow and strengthen the middle class. 
Job creation has been robust since we came to power, with 400,000 jobs created. Over the last 12 months, nearly 90% of the jobs created have been full-time positions. In the second quarter of this year, the economy grew by an impressively strong 4.5%. Over the last four quarters, our economy has had the fastest growth since early 2006. The Canadian economy is the fastest-growing economy in the G7 by a wide margin. A lot of that is thanks to the hard work of the finance minister. That is news Canadians can be happy about. It is great news. 
The finance minister continues to work hard to create a healthy and growing economy in which businesses can generate good-paying jobs and where the middle class and those working hard to join it can have confidence that they will succeed.",Liberal,St. Catharines,Chris Bittle,http://www.parl.gc.ca/Parliamentarians/en/members/chris-bittle(234610)
