basepk,hid,speechdate,pid,opid,speakeroldname,speakerposition,maintopic,subtopic,subsubtopic,speechtext,speakerparty,speakerriding,speakername,speakerurl
4722492,ca.proc.d.2017-10-17.9711977,2017-10-17,16ec30ba-16f2-4777-ab8d-db372238e239,216462,"Mrs. Karen Vecchio (Elgin—Middlesex—London, CPC)",,Government Orders,Business of Supply,Opposition Motion—Minister of Finance's documents submitted to the Conflict of Interest and Ethics Commissioner,"Madam Speaker, I am glad we are back on the actual motion. I was happy to send the motion over to the member just to remind him what we were talking about today.
I am going to be focusing on this, because we are talking about finance and money. Let us say that the member is an owner of a pharmaceutical company. Should he not, if he is a health minister, advise that he is the minister of health and owns a pharmaceutical company? Let us say that he is a member of the board at a military equipment company. As the procurement minister, should he not make sure that there is not a conflict of interest? Should he not make sure that there is a screen?
Rather than thinking that this is a personal attack on the Minister of Finance, think of any other situation where a minister's department and what they do are so hand in hand. Does he not think the Minister of Finance should have declared his business in a blind trust?",Conservative,Elgin—Middlesex—London,Karen Vecchio,http://www.parl.gc.ca/Parliamentarians/en/members/karen-vecchio(216462)
4722493,ca.proc.d.2017-10-17.9711997,2017-10-17,07cf5767-802c-406c-92a7-7dc92af79b40,229526,Mr. Kevin Lamoureux,,Government Orders,Business of Supply,Opposition Motion—Minister of Finance's documents submitted to the Conflict of Interest and Ethics Commissioner,"Madam Speaker, I sat in opposition when the Harper government decided to kill the Canadian wheat board. I wonder how many farmers from the Prairies were in the government caucus. Many would imply that they had a vested interest. After all, many of them were grain farmers, yet they were killing the Canadian wheat board. We are still paying part of the cost for that issue today.
We have a system in place, a process. It says that if people are elected, they go before the commissioner's office, or the commissioner's office contacts them, and there are certain requirements. A person must fulfill those requirements. There is a certain amount of trust that all members are honourable members. When we are asked for information, we provide that information. There might be a mistake or two when there are 338 members, but we all have to respect the process and go through it.
I believe that the Minister of Finance and all members of this House have respected that process and have gone through it. There might be the odd mistake, whether it is a New Democrat, a Conservative, or a Liberal. It is possible, but I believe that the intent of all members is genuine in dealing with the commissioner's office.",Liberal,Winnipeg North,Kevin Lamoureux,http://www.parl.gc.ca/Parliamentarians/en/members/kevin-lamoureux(229526)
4722494,ca.proc.d.2017-10-17.9712035,2017-10-17,ea197684-00f6-458f-a46b-5bea7db6f7f3,232372,"Mr. Daniel Blaikie (Elmwood—Transcona, NDP)",,Government Orders,Business of Supply,Opposition Motion—Minister of Finance's documents submitted to the Conflict of Interest and Ethics Commissioner,"Madam Speaker, part of the crux of the issue and the reason the finance minister was singled out is that Canadians were led to believe that he was acting in accordance with the recommendations of the Ethics Commissioner. What we found out in testimony at committee today was that, in fact, that was not the case. The Ethics Commissioner said clearly at committee today that she did not advise the finance minister not to put his assets in a blind trust.
We know also that in two instances, Bill C-27 and the small business tax proposals, there are legitimate concerns about the fact that those proposals could directly have an impact on the business of the finance minister, which we now know is not in a blind trust. He has knowledge of what is going on in his own business.
That is why this is about the finance minister. That is different from any other member of the House. There are not stories like that about any other member of the House. They are not in a position to benefit their own businesses in the way we are concerned the finance minister may be. 
I wonder why the member for Winnipeg North is more concerned about defending the finance minister's precarious position than he is about making sure that the business of government is being conducted fairly and in a way that meets a very high ethical standard. There are clearly legitimate questions about whether the finance minister is meeting that standard.",New Democratic Party,Elmwood—Transcona,Daniel Blaikie,http://www.parl.gc.ca/Parliamentarians/en/members/daniel-blaikie(232372)
4722495,ca.proc.d.2017-10-17.9712061,2017-10-17,07cf5767-802c-406c-92a7-7dc92af79b40,229526,Mr. Kevin Lamoureux,,Government Orders,Business of Supply,Opposition Motion—Minister of Finance's documents submitted to the Conflict of Interest and Ethics Commissioner,"Madam Speaker, the member is somewhat playing with words. Think about the question he posed. He said that the commissioner did not say that she did not advise him to set up a blind trust. The point is that she did not recommend or advise him to establish a blind trust. Imagine if we were to apply that very same principle to each of the 338 MPs. 
The Ethics Commissioner was doing her job. She did not say to the Minister of Finance that he had to create a blind trust. Why try to give that impression? That is what the NDP and the Conservatives are trying to do. That is why I am saying not to trust the opposition on this issue. I will trust Mary Dawson, the Ethics Commissioner, because that is what she does, and she is independent. ",Liberal,Winnipeg North,Kevin Lamoureux,http://www.parl.gc.ca/Parliamentarians/en/members/kevin-lamoureux(229526)
4722496,ca.proc.d.2017-10-17.9712079,2017-10-17,8138ca16-415e-431d-9d95-051874ca6e3d,229561,"Mr. Joël Godin (Portneuf—Jacques-Cartier, CPC)",,Government Orders,Business of Supply,Opposition Motion—Minister of Finance's documents submitted to the Conflict of Interest and Ethics Commissioner,"Madam Speaker, I would like to congratulate my colleague from Winnipeg-North for having such a selective memory, but I hope he remembers what he said over the last few years when he sat in opposition. I will share my time with my colleague from Barrie-Innisfil, in Ontario. 
Before going into politics, I worked for a long time in the business world and, naturally, I met many businessmen and women. I have a huge respect for entrepreneurs and SMEs. I acknowledge their work and contribution. Working in business means not counting the hours. When someone chooses to start a business, that normally means dedicating themselves to it heart and soul. There is no 9 to 5 for them, nor happy hours, since they have to work practically 24/7. They have to wait at least five years before even thinking of planning a vacation, and if they take time off, they have to pay the price, before and after.
 Now let us talk about the risks. Investments have to be made, and there are no guarantees. Entrepreneurs are diving in head first, investing in their business. At the beginning of every month, they have to start over, get more orders, pay their employees, pay back their loans, and remit payroll deductions. Before they know it, their monthly expenses are due again, so they have to create wealth. 
 They also need to become financially independent in order to get through difficult times. Unfortunately, when a person starts a business, there are difficult times. They often occur unexpectedly, so business owners need to have a contingency fund. That is an enormous sacrifice for families. It is a choice, and, if these entrepreneurs do manage to create prosperity, they can enjoy it, but there are no guarantees. 
 Many Canadians dream of being their own boss, creating something that will grow and that can be passed on to their children and grandchildren. A responsible government needs to create winning conditions for these entrepreneurs to achieve their goals and feel good about their accomplishments. That is what economic development is all about. It creates jobs. Many of the jobs out there are held by the middle class. We must not forget that 90% of all jobs in Canada are created by SMEs. 
 Our country is the greatest country in the world, largely because of our robust economy. We spent 10 years in power building a solid economy, and now the government is destroying any optimism and passion our entrepreneurs might have had. Whether they are creating or managing SMEs or working for themselves, these people are an important part of our economy.
 I entered politics for a number of reasons. First, I wanted to represent the citizens of the beautiful riding of Portneuf—Jacques-Cartier, but it was also because I firmly believe that we need to implement measures to support our entrepreneurs. There are many industrial parks in Canada’s 338 ridings. They drive the economies of many of our regions, and it is important that we support them. 
 As I was saying, more than 90% of jobs in Canada are created by SMEs. We need to motivate them to continue to prosper. It makes some people uneasy when we say a business is prospering, but there is no crime in prospering. On the contrary, when businesses prosper, they continue to do business and grow. That is what provides momentum for the economy and makes it possible to improve the lives of middle-class workers. 
 We are well aware that the Liberal government is unabashedly spending Canadians’ tax dollars while continually asking them to tighten their belts. This same Liberal government, in its 2016 budget, could not wait to eliminate the tax breaks implemented by Mr. Harper’s government to help Canadian families.
In 2015, this same government promised to lower the tax rate for small and medium-sized businesses. What has it done since taking office? It nixed this policy because it came from the Conservatives. Just yesterday, as a result of representations from the Conservative opposition and action by thousands of entrepreneurs in Canada, the Prime Minister, with his lapdog the Minister of Finance, hastily, but somewhat reluctantly, said that he was going to lower taxes for SMEs. He did this to buy the silence of SMEs, but that change will take effect not in 2017 or 2018, but in 2019, an election year. What does he take entrepreneurs for? This is all just smoke and mirrors. He is making things up as he goes along. 
What led the Minister of Finance and the Prime Minister to change their plan was the tax reform. When will it be put in place? When will it be applied? They did not cancel the reform yesterday. They handed out a goody, but the tax reform is still happening. The Liberals do not respect SMEs. Once again, it is all just smoke and mirrors.
Meanwhile, the Minister of Finance is strutting about developing business for Morneau Shepell. I do not know if everyone knows about the company. It is the company he owned. We do not know either whether he has sold his shares. We asked today during question period, but we have not yet had a response. He probably did not understand the question. That is why the parliamentary secretary parroted the same talking points that did not answer the question.
This minister said he was above the law. We learned last week that the Minister of Finance had waited two years before informing the Conflict of Interest and Ethics Commissioner that he was a partner in a company that owns and manages a villa in France. We are learning now that no only is this Liberal government spending taxpayers' money shamelessly, but that the Minister of Finance's family business, Morneau Shepell, would also benefit from changes proposed in the document entitled Tax Planning Using Private Corporations. I am not the one saying this; experts have said this. It will lend more credibility. I am a parliamentarian, not an economist.
The Minister of Finance should not avoid questions in the House. He must answer without always repeating the same talking points. He must not scorn the middle class and SMEs that create jobs. He must provide honest answers to the questions asked by all parliamentarians.
Once elected and sworn in, members are required to observe certain rules of conduct in performing their parliamentary duties. I will quote a few paragraphs from the House of Commons Procedure and Practice, which describes the responsibilities and conduct of MPs:
 Members sit in the House of Commons to serve as representatives of the people who have elected them to that office. They have wide-ranging responsibilities which include work in the Chamber, committees, their constituencies and political parties. 
 On being elected, Members of the House of Commons become trustees of public confidence. Members must place the public’s interests over their private interests and [I stress this section] derive no personal benefit or gain from their decisions. [They must be impartial]. 
The same source states:
 In addition to statutory prohibitions, Prime Ministers have issued conflict of interest guidelines for Ministers and other public office holders....The code is voluntary and applies to Cabinet Ministers, Secretaries of State, Parliamentary Secretaries and other senior public office holders (full-time Governor in Council appointees). It requires that, on appointment to one of these offices, the office holders are to arrange their private affairs so as to prevent real, potential or apparent conflicts from arising. They are not to solicit or accept money or gifts; not to assist individuals in their dealings with government in such a way as to compromise their own professional status; not to take advantage of information obtained because of their positions as insiders…. 
I have other things to say, but I simply wanted to ask the Minister of Finance to table these documents, as requested in the motion.",Conservative,Portneuf—Jacques-Cartier,Joël Godin,http://www.parl.gc.ca/Parliamentarians/en/members/joel-godin(229561)
4722497,ca.proc.d.2017-10-17.9712319,2017-10-17,4c0122f7-7958-4cbd-b99e-9d70a4dca1e8,230115,"Mr. Pierre-Luc Dusseault (Sherbrooke, NDP)",,Government Orders,Business of Supply,Opposition Motion—Minister of Finance's documents submitted to the Conflict of Interest and Ethics Commissioner,"Madam Speaker, I thank my colleague for his remarks.
 Although all 338 members are subject to the Conflict of Interest Code, does my colleague feel that it is important for ministers, who sit on the front benches across the way and who hold important public offices, should be subject to the higher standards set out in the Conflict of Interest Act? 
 How serious is it for a minister to contravene the law, as the Minister of Finance seems to have done?",New Democratic Party,Sherbrooke,Pierre-Luc Dusseault,http://www.parl.gc.ca/Parliamentarians/en/members/pierre-luc-dusseault(230115)
4722498,ca.proc.d.2017-10-17.9712331,2017-10-17,8138ca16-415e-431d-9d95-051874ca6e3d,229561,Mr. Joël Godin,,Government Orders,Business of Supply,Opposition Motion—Minister of Finance's documents submitted to the Conflict of Interest and Ethics Commissioner,"Madam Speaker, I would like to thank my colleague. It is a very relevant question. It is unfortunate that the government across the way trivializes it.
 I do not want to belittle the work of a member, but the minister is not just a member. Of 338 members, some are called to serve the public in a more active way and have more authority. The finance minister must respect the law and be beyond reproach. 
 It bothers me to see the government across the way try to defend the indefensible. The Government’s attitude, trivializing this situation, is unacceptable. The rules apply to everyone and the Minister of Finance must be beyond reproach. What is dangerous, in his case, is that he can personally benefit from his decisions. That is what experts are trying more and more to show us, and I think that the truth is starting to come out.",Conservative,Portneuf—Jacques-Cartier,Joël Godin,http://www.parl.gc.ca/Parliamentarians/en/members/joel-godin(229561)
4722499,ca.proc.d.2017-10-17.9712348,2017-10-17,07cf5767-802c-406c-92a7-7dc92af79b40,229526,"Mr. Kevin Lamoureux (Parliamentary Secretary to the Leader of the Government in the House of Commons, Lib.)",,Government Orders,Business of Supply,Opposition Motion—Minister of Finance's documents submitted to the Conflict of Interest and Ethics Commissioner,"Madam Speaker, I have a fairly straightforward question regarding the Ethics Commissioner, who has the responsibility not of just one member but of all members of all political parties. I wonder if the member has any thoughts in terms of how important it is, as we go through the process, to respect the advice that she provides. It is something that the Minister of Finance has sought from the Ethics Commissioner. Does the member not believe that we should be following the process?",Liberal,Winnipeg North,Kevin Lamoureux,http://www.parl.gc.ca/Parliamentarians/en/members/kevin-lamoureux(229526)
4722500,ca.proc.d.2017-10-17.9712364,2017-10-17,8138ca16-415e-431d-9d95-051874ca6e3d,229561,Mr. Joël Godin,,Government Orders,Business of Supply,Opposition Motion—Minister of Finance's documents submitted to the Conflict of Interest and Ethics Commissioner,"Madam Speaker, I agree with my colleague that it is very important to follow the rules from the commissioner.
After two years, the Minister of Finance cannot claim that the commissioner did not properly assist him in completing his forms. I hope that the finance minister, the master of finances in Canada, is intelligent enough to complete his forms without needing help from the commissioner.",Conservative,Portneuf—Jacques-Cartier,Joël Godin,http://www.parl.gc.ca/Parliamentarians/en/members/joel-godin(229561)
