basepk,hid,speechdate,pid,opid,speakeroldname,speakerposition,maintopic,subtopic,subsubtopic,speechtext,speakerparty,speakerriding,speakername,speakerurl
4722224,ca.proc.d.2017-10-17.9708786,2017-10-17,f37d5cb2-a1ad-4ec9-a7de-ca265da02938,214560,Hon. Harjit S. Sajjan,,Routine Proceedings,Public Service Labour Relations Act,," moved for leave to introduce Bill C-34, An Act to amend the Public Service Labour Relations Act and other Acts.
 (Motions deemed adopted, bill read the first time and printed) ",Liberal,Vancouver South,Harjit S. Sajjan,http://www.parl.gc.ca/Parliamentarians/en/members/harjit-s-sajjan(214560)
4722225,ca.proc.d.2017-10-17.9708615,2017-10-17,65916721-c92d-4ae1-80e6-2e696b0c5d94,234523,"Mr. Darrell Samson (Sackville—Preston—Chezzetcook, Lib.)",,Routine Proceedings,Interparliamentary Delegations,,"Mr. Speaker, pursuant to Standing Order 34(1), I have the honour to present to the House, in both official languages, two reports by the delegation of the Canadian branch of the Assemblée parlementaire de la Francophonie, the APF. 
The first is respecting its participation at the bureau meeting and the 42nd ordinary session of the APF held in Madagascar from July 8 to 12, 2016.
The second is respecting its participation at the meeting of the Education, Communication and Cultural Affairs Committee of the APF held in Benin on May 3 and 4, 2017.",Liberal,Sackville—Preston—Chezzetcook,Darrell Samson,http://www.parl.gc.ca/Parliamentarians/en/members/darrell-samson(234523)
4722226,ca.proc.d.2017-10-17.9708633,2017-10-17,89dabae0-bc5d-4af0-babb-7104d4ee1742,219899,"Hon. Larry Bagnell (Yukon, Lib.)",,Routine Proceedings,Committees of the House,Procedure and House Affairs," Mr. Speaker, pursuant to Standing Orders 104 and 114, I have the honour to present, in both official languages, the 40th report of the Standing Committee on Procedure and House Affairs regarding the membership of committees of the House. If the House gives its consent, I intend to move concurrence in the 40th report later this day.",Liberal,Yukon,Larry Bagnell,http://www.parl.gc.ca/Parliamentarians/en/members/larry-bagnell(219899)
4722227,ca.proc.d.2017-10-17.9708639,2017-10-17,ea476a5f-790f-416f-842b-f4ac57acb57b,216848,"Hon. Tony Clement (Parry Sound—Muskoka, CPC)",,Routine Proceedings,Prevention of Radicalization through Foreign Funding Act,," moved for leave to introduce Bill C-371, An Act respecting the prevention of radicalization through foreign funding and making related amendments to the Income Tax Act.
Mr. Speaker, it is an honour to present my very first private member's bill, the prevention of radicalization through foreign funding act. This legislation would provide a powerful tool to stem the flow of funding from foreign groups that promote radicalization and extremism in Canada. 
This bill deals with the so-called secret laws relating to the funding of organizations and institutions in Canada that support radicalization. 
Security experts and anti-radicalization representatives, including members of the Muslim community, are calling for greater scrutiny of funds intended to support radicalization. 
The bill sets out a schedule of foreign states, extending to individuals and entities that suppress religious freedom, impose punishments for religious beliefs, or have engaged in or facilitated activities that promote extremism, terrorism, and radicalization. Canadian individuals and institutions would be prohibited from accepting money or gifts from any state, individual, or entity listed on the schedule.
My sincere hope is that the government will see the practical value of the bill and give it full and thoughtful consideration. 
 (Motions deemed adopted, bill read the first time and printed) ",Conservative,Parry Sound—Muskoka,Tony Clement,http://www.parl.gc.ca/Parliamentarians/en/members/tony-clement(216848)
4722228,ca.proc.d.2017-10-17.9708668,2017-10-17,7ba5ccca-0132-4942-982e-fb0ca43b3ff5,214530,"Mrs. Marilène Gill (Manicouagan, BQ)",,Routine Proceedings,Bankruptcy and Insolvency Act,," moved for leave to introduce Bill C-372, An Act to amend the Bankruptcy and Insolvency Act and the Companies’ Creditors Arrangement Act (pension plans and group insurance plans).
Mr. Speaker, I have the honour to introduce my first bill in the House today, a private member's bill that seeks to amend the Bankruptcy and Insolvency Act and the Companies’ Creditors Arrangement Act.
This bill seeks to correct the injustice faced by retired workers whose pension plans and group insurance plans are not protected when their company goes bankrupt or undergoes restructuring.
I will do everything in my power to ensure that this bill receives royal assent, that way, we can help prevent retirees, like those from my riding who are here today to support me, from losing their pensions, and improve the existing legislation by giving pension plans' unfunded liabilities preferred creditor status, among other things. I hope my colleagues will be supporting this bill.
(Motions deemed adopted, bill read the first time and printed)",Bloc Québécois,Manicouagan,Marilène Gill,http://www.parl.gc.ca/Parliamentarians/en/members/marilene-gill(214530)
4722229,ca.proc.d.2017-10-17.9708680,2017-10-17,89dabae0-bc5d-4af0-babb-7104d4ee1742,219899,"Hon. Larry Bagnell (Yukon, Lib.)",,Routine Proceedings,Committees of the House,Procedure and House Affairs,"Mr. Speaker, if the House gives its consent, I move that the 40th report of the Standing Committee on Procedure and House Affairs, presented to the House earlier this day, be concurred in. ",Liberal,Yukon,Larry Bagnell,http://www.parl.gc.ca/Parliamentarians/en/members/larry-bagnell(219899)
4722230,ca.proc.d.2017-10-17.9708683,2017-10-17,3176068f-62ee-4b2f-aacd-1131201c6db1,214707,The Speaker,,Routine Proceedings,Committees of the House,Procedure and House Affairs,Does the hon. member have the unanimous consent of the House to move the motion?,Liberal,Halifax West,Geoff Regan,http://www.parl.gc.ca/Parliamentarians/en/members/geoff-regan(214707)
4722231,ca.proc.d.2017-10-17.p5062491,2017-10-17,,,,intervention,Routine Proceedings,Committees of the House,Procedure and House Affairs, No.,,,Some hon. members,
4722232,ca.proc.d.2017-10-17.9708684,2017-10-17,b37cad30-26f6-40c6-8e4c-dd3a0ba841bb,217034,"Mrs. Cheryl Gallant (Renfrew—Nipissing—Pembroke, CPC)",,Routine Proceedings,Petitions,Taxation,"Mr. Speaker, I am pleased to present a petition signed by campers who stayed at Wilderness Park in Dowling, Ontario, located in the spectacular riding of Nickel Belt. The petitioners call upon Parliament to ensure that campgrounds with fewer than five full-time year-round employees be taxed as small businesses.",Conservative,Renfrew—Nipissing—Pembroke,Cheryl Gallant,http://www.parl.gc.ca/Parliamentarians/en/members/cheryl-gallant(217034)
4722233,ca.proc.d.2017-10-17.9708692,2017-10-17,7ba5ccca-0132-4942-982e-fb0ca43b3ff5,214530,"Mrs. Marilène Gill (Manicouagan, BQ)",,Routine Proceedings,Legislative Amendments,,"Mr. Speaker, I rise today to present two petitions, petition 421 and petition e-587, which call on the government to amend the Bankruptcy and Insolvency Act and the Companies’ Creditors Arrangement Act.",Bloc Québécois,Manicouagan,Marilène Gill,http://www.parl.gc.ca/Parliamentarians/en/members/marilene-gill(214530)
4722234,ca.proc.d.2017-10-17.9708697,2017-10-17,eaa6694f-1e20-4aae-ad3b-e694b0e12c59,224170,"Ms. Elizabeth May (Saanich—Gulf Islands, GP)",,Routine Proceedings,Legislative Amendments,Shark Finning,"Mr. Speaker, I have the honour to present three petitions this morning. The first petition deals with an issue that this House has debated but has not yet taken action on, which is the sale, distribution, and trade of shark fins in Canada. Sharks around the world are endangered, and the petitioners ask the House to deal with what is illegal in Canada, which is the finning of sharks, and extend it to the trade in shark fins, which is not illegal.",Green Party,Saanich—Gulf Islands,Elizabeth May,http://www.parl.gc.ca/Parliamentarians/en/members/elizabeth-may(224170)
4722235,ca.proc.d.2017-10-17.9708910,2017-10-17,eaa6694f-1e20-4aae-ad3b-e694b0e12c59,224170,"Ms. Elizabeth May (Saanich—Gulf Islands, GP)",,Routine Proceedings,Legislative Amendments,The Environment,"Mr. Speaker, in the second petition, many petitioners are calling upon the government to go farther than Bill C-48, which is is currently before the House, with respect to a tanker ban on the north coast of B.C. The petitioners ask that a ban on crude oil tankers extend through B.C.'s entire west coast.",Green Party,Saanich—Gulf Islands,Elizabeth May,http://www.parl.gc.ca/Parliamentarians/en/members/elizabeth-may(224170)
4722236,ca.proc.d.2017-10-17.9708913,2017-10-17,eaa6694f-1e20-4aae-ad3b-e694b0e12c59,224170,"Ms. Elizabeth May (Saanich—Gulf Islands, GP)",,Routine Proceedings,Legislative Amendments,Employment Insurance,"Mr. Speaker, the petitioners in the last petition call upon the government to extend employment insurance sickness benefits to 52 weeks for Canadians who are battling cancer and other critical illnesses.",Green Party,Saanich—Gulf Islands,Elizabeth May,http://www.parl.gc.ca/Parliamentarians/en/members/elizabeth-may(224170)
4722237,ca.proc.d.2017-10-17.9708714,2017-10-17,07cf5767-802c-406c-92a7-7dc92af79b40,229526,"Mr. Kevin Lamoureux (Parliamentary Secretary to the Leader of the Government in the House of Commons, Lib.)",,Routine Proceedings,Questions on the Order Paper,,"Mr. Speaker, I would ask that all questions be allowed to stand at this time.",Liberal,Winnipeg North,Kevin Lamoureux,http://www.parl.gc.ca/Parliamentarians/en/members/kevin-lamoureux(229526)
4722238,ca.proc.d.2017-10-17.9708718,2017-10-17,3176068f-62ee-4b2f-aacd-1131201c6db1,214707,The Speaker,,Routine Proceedings,Questions on the Order Paper,,Is that agreed?,Liberal,Halifax West,Geoff Regan,http://www.parl.gc.ca/Parliamentarians/en/members/geoff-regan(214707)
4722239,ca.proc.d.2017-10-17.p5062499,2017-10-17,,,,intervention,Routine Proceedings,Questions on the Order Paper,, Agreed.,,,Some hon. members,
4722240,ca.proc.d.2017-10-17.9708994,2017-10-17,3176068f-62ee-4b2f-aacd-1131201c6db1,214707,The Speaker,,Routine Proceedings,Request for Emergency Debate,Supply Management,I have received notice of an application for an emergency debate from the hon. member for Mirabel.,Liberal,Halifax West,Geoff Regan,http://www.parl.gc.ca/Parliamentarians/en/members/geoff-regan(214707)
4722241,ca.proc.d.2017-10-17.9708720,2017-10-17,c80fcb28-a347-4594-9e11-63ac3c37e428,214017,"Mr. Simon Marcil (Mirabel, BQ)",,Routine Proceedings,Request for Emergency Debate,Supply Management,"Mr. Speaker, the American administration's desire to abolish supply management constitutes an unprecedented threat to Quebec agriculture.
By calling for the abolition of our agricultural model, American negotiators are out to get our dairy farmers and poultry producers. This is happening right now. Canada's negotiators need to walk away from the negotiating table any time supply management is mentioned. 
The urgent nature of this debate is quite clear. We need to take action in the House today. We will not allow the Americans to destroy our agriculture. This is a fundamental issue for Quebec, and quite frankly, for the rest of Canada too. We voted unanimously on a motion to fully maintain supply management, which is currently being threatened. We will not allow that. We have had enough of the ridiculous demands of the American administration. Once the Americans are ready to get serious and negotiate a free trade agreement that works for everyone, they will come back to the table, but for now, we need to send a clear message. We will not allow anyone to destroy our agricultural sector.",Bloc Québécois,Mirabel,Simon Marcil,http://www.parl.gc.ca/Parliamentarians/en/members/simon-marcil(214017)
4722242,ca.proc.d.2017-10-17.9708726,2017-10-17,3176068f-62ee-4b2f-aacd-1131201c6db1,214707,The Speaker,,Routine Proceedings,Request for Emergency Debate,Speaker's Ruling,"I thank the hon. member for Mirabel for raising this important matter. However, I find that the request does not meet the exigencies of the Standing Orders at this time. ",Liberal,Halifax West,Geoff Regan,http://www.parl.gc.ca/Parliamentarians/en/members/geoff-regan(214707)
4722243,ca.proc.d.2017-10-17.9708738,2017-10-17,ad4032f2-6bb1-497b-b146-f321cfb71ba9,234631,"Hon. Pierre Poilievre (Carleton, CPC)",,Government Orders,Business of Supply,Opposition Motion—Minister of Finance's documents submitted to the Conflict of Interest and Ethics Commissioner," moved:
 That, given accusations by experts that the Minister of Finance’s family business, Morneau Shepell, stands to benefit from the proposed changes outlined in ""Tax Planning Using Private Corporations"" and assurances by the Minister that he has abided by his Public Declaration of Agreed Compliance Measures with respect to his family business, the House request that the Minister table all documents he submitted to the Conflict of Interest and Ethics Commissioner between November 4, 2015, and July 18, 2017. 
Mr. Speaker, the Finance Minister of Canada has awesome powers to help or hinder individual businesses, particularly those businesses that deal in products like pensions. A minister of finance knows beforehand about government decisions that move markets and push individual companies up or down, and his decisions can impact the direct bottom line of companies in which everyday Canadians invest and for which they work. No one in government has more power over taxation, regulations, tariffs, subsidies, or government bond auctions, all of which have direct impact on the fortunes of individual businesses.
 He who has the most control over the nation's finances should have the most transparency over his interests. From those to whom much is given, much is asked. We give ministers the power to impact the lives of everyday people. We expect that they prove they are exercising those decisions in the public interest and not the private interest. This is especially true of the Minister of Finance, for whom these powers are so vast. 
We are not dealing with an ordinary  Minister of Finance. His father built a billion-dollar financial services firm. According to last available insider trader reports, the current finance minister held over $30-million worth of shares in that fine family business as of 2015. Since he became minister, he stopped disclosing his holdings, which is greatly ironic: we knew more about his interests before he was finance minister than we do now.
Public filings with the insider trading reports ensured that he, as a corporate executive, was accountable to his shareholders. He now has no similar accountability to the 35 million shareholders we call Canadian citizens. This company is of direct interest to the minister's department. 
I will read from the Morneau Shepell website:
 Morneau Shepell is the largest provider of pension administration technology and services in Canada. We offer a full range of solutions from software to full outsourcing of pension administration. 
Who regulates pensions in Canada? It is the Office of the Superintendent of Financial Institutions. To whom does that office report? Why, it is the finance minister, and that office regulates “...1,200 pension plans”.
Interestingly, if we go to the Morneau Shepell website, it makes direct reference to that office, saying that the office appoints Morneau Shepell to wind down the pension plans of bankrupt companies. If a company pension plan is going under, the Office of the Superintendent of Financial Institutions needs someone to oversee the pension. In the meantime, it picks from a variety of providers. Of course, there is a financial benefit to whoever is selected, and Morneau Shepell brags on its website that it offers its own services to this office that reports directly to the finance minister.
There are broad and sweeping regulations at a national level to federally regulated pension plans. Of course, Morneau Shepell offers those pension plans. Pension plans also purchase government bonds. The finance minister sells government bonds. 
Every year we have new issuances of government bonds as the government runs deficits and needs to borrow money and past bonds come to maturity and need to be renewed. They are sold to institutional investors, such as pension funds, of which Morneau Shepell is one. The finance minister's family business buys government bonds and the finance minister sells government bonds.
Then there is the issue of taxation. The finance minister, of course, is responsible for setting tax policy for the whole country. That is important for everyone, but especially for companies whose interests and activities are so dramatically impacted by tax levels and tax rules. Allow me to provide one example.
The minister proposed in his July 18 consultation paper to double tax the investment income private businesses earn within their companies. The result is that many of them would be forced to take their retirement savings out of their private companies and put them into individual pension plans, a unique and not well-understood product. A few Canadians hold them, and far fewer companies offer them. One of those companies is Morneau Shepell. The minister might say that he did not take that into consideration when he made his public policy proposal, but we do not know that, because we are not familiar with what holdings he continues to possess.
Furthermore, the minister has defended Canada's 40-year-long tax treaty with Barbados. That treaty allows Canadian companies and wealthy individuals to pay only 2.5% tax in Barbados and to then ship the rest of their profits back to Canada tax free. The minister's family business has registered a subsidiary in Barbados to take advantage of exactly those favourable tax conditions, so the finance minister is responsible for reviewing a tax treaty with a tax haven where his family business has a subsidiary.
Here is what we know about the finance minister. His father built a billion-dollar family business. As of 2015, the finance minister was receiving employment income from that family business, and as of that same year, he had $30 million in shares in that company. Since he has become minister, we no longer know if he holds on to those shares, and it is not because the minister has not been asked. He has been asked on probably a dozen occasions, and he simply refuses to answer. For the longest time, most people thought he could not answer. It is in a blind trust, so he would not know. 
On Twitter late last week, I had an exchange with the Liberal member for downtown Toronto, who came leaping to the finance minister's defence by saying that the money is obviously in an arm's-length blind trust, so how could the minister possibly know where his money is, as it is all blinded to him. I do not blame that Liberal member for saying that, because most of the press gallery thought exactly the same thing. Everyone just assumed that if a finance minister has shares in a financial company, they would have to go into a blind trust. 
Through two weeks of intrepid investigative journalism, The Globe and Mail finally was able to extract the fact that the minister does not have a blind trust, so he knows what he holds. He knows his assets. He knows what they are. Why will he not tell everyone else? Some might suggest that this is an intimate, private detail that we could not possibly ask someone to volunteer to strangers. That is an odd response, given that he was, as a corporate executive, forced to reveal exactly the same facts. Am I the only one who finds it peculiar that a corporate executive had a higher standard of public transparency than the Minister of Finance?",Conservative,Carleton,Pierre Poilievre,http://www.parl.gc.ca/Parliamentarians/en/members/pierre-poilievre(234631)
4722244,ca.proc.d.2017-10-17.p5062523,2017-10-17,,,,intervention,Government Orders,Business of Supply,Opposition Motion—Minister of Finance's documents submitted to the Conflict of Interest and Ethics Commissioner, You are not alone.,,,An hon. member,
