basepk,hid,speechdate,pid,opid,speakeroldname,speakerposition,maintopic,subtopic,subsubtopic,speechtext,speakerparty,speakerriding,speakername,speakerurl
4727547,ca.proc.d.2017-11-09.9782025,2017-11-09,e277e13e-59ec-425f-a957-eb5e54d8cb62,234454,"Mr. Gérard Deltell (Louis-Saint-Laurent, CPC)",,Government Orders,Cannabis Act,Report Stage,"Madam Speaker, it is with great disgust and sadness that I rise today to speak again to this bad bill that will have a major impact on the lives of our children, adolescents, and parents. If by some misfortune this bill is passed and the government's goal of legalizing marijuana on July 1, 2018, is achieved, this will have an adverse and terrifying effect on Canadian families.
Legalizing marijuana normalizes it and that is not the message we want to send to our young people. From now on, under the Liberal government, it will be legal to smoke pot, a gateway drug for all other drugs. No one knows anyone who just one day decides to start using cocaine or other hard drugs. It always starts with a little joint and ends with hard drugs. This Liberal government is practically giving unholy permission to use drugs for the first time. After that, the procession of family tragedies that this will generate, the procession of lives destroyed, and the procession of incredibly destructive problems that Canadians will face, like the people of Colorado and Washington have for far too many years, will be on the Liberal government.
In Canada, the Liberal government's initiative did not meet with the approval of the police, municipalities, or the provinces. Let us first talk about the police. They are telling us in all honesty that in the unfortunate event that this bill goes ahead, there will be a host of problems on our roads, in society, and with the preventative measures that we will need. It is impossible to assemble and appropriately equip every police force from coast to coast to coast in order for them to respond directly to the new challenges that this bad Liberal legislation will give rise to. The head of the RCMP recently said that it would be naive to believe that the new Liberal legislation will help eliminate organized crime. The head of the RCMP said that. 
Those people who know the business, those people who have to deal day after day with the reality of the consumption of marijuana and other drugs, will tell them clearly that if they think criminal people will put that aside and kill their criminal activities, they are being naive. This is totally unacceptable. Those who know the business say do not go there.
It is the same for the provinces. Whether we are talking about British Columbia, Newfoundland and Labrador, Saskatchewan, Quebec, or any other province, not one minister of health, not one minister of justice, not one minister of housing, not one provincial premier cheered for the Liberal government's new approach. On the contrary, our provinces are grappling with the implications for their jurisdictions. The provinces will also be saddled with millions of dollars of spending on health, social services, security, training, and equipment. All of this thanks to the Liberals in Ottawa. The provinces could really have done without this.
This is being rushed through. Municipalities are being affected too. They have to adjust their bylaws to accommodate the Liberal government's ridiculous plan to allow every Canadian household to grow four pot plants up to three feet high. Will that be great for Canada or what? As everyone here knows, a house where pot is being grown is not two times or four times or 10 times more likely to catch fire, but 24 times more likely to catch fire. That is a fact. People are going to have to deal with that situation. How are multi-unit building owners supposed to deal with that? How can they check on things? How can they be sure everything is safe? They cannot retroactively prohibit people from doing it because there is already a lease in place.
How is this going to work in each of the provinces? Every province has its own jurisdiction. Every province will do things its own way. Every municipality will have to pass bylaws, and that opens up a whole can of worms. What is the government doing about that? The federal government says this is all up to the provinces and it will not interfere. The Liberal government is the one causing these problems. 
The current Liberal government, which is proposing to normalize marijuana by legalizing it, is creating a whole host of problems and washing its hands of them because they do not fall under its jurisdiction, but that of the police, municipalities, and provinces.
Even worse, the government, because of an obsession unbecoming of any elected representative of any stripe, is pushing for the bill's passage and implementation by July 1.
I will never understand how the government decided, without laughing at people, that the launch date for legalization would be Canada Day. There are 365 days in a year, and it chose Canada Day to launch its bad policy. It is totally unacceptable, and un-Canadian to do that. 
I will be proud to sing O Canada, but be assured, I will never sing O cannabis on July 1. We are laughing, but it is not a joke because here, in the House of Commons, we have seen so many great Canada Days. On the other hand, we have also seen so many stupid and obvious demonstrations by those who smoke marijuana in front of Parliament. We will see people there, smoking marijuana. That is a real shame. It will not be a great Canada Day in 2018, thanks to the Liberals. 
Let us remember the example: unfortunately, two U.S. states, Colorado and Washington, decided to legalize marijuana. What has happened after some years of legalization?
In Colorado, three times as many people have been hospitalized for marijuana related problems since it was legalized. The Liberals tell us that the problem will be solved. On the contrary, it will make it worse. There has been a 108% and 68% increase in overdoses in Colorado and the State of Washington respectively. Will that solve the problems? On the contrary, it will generate twice as many problems and give rise to new ones.
The number of traffic accidents has doubled in the State of Washington and tripled in Colorado. The Liberals are saying, with a straight face, that, on the contrary, it will resolve problems, because we are currently unable to manage them. They are going to legalize marijuana and solve the problems.
It is quite the opposite. There will be twice as many problems in certain situations and we will make things worse. Is it not a fact that, after California, Colorado has the largest illegal production of marijuana?
Those people say, with that, we will kill, we will attack, we will be aggressive with the criminals. That is not true. The criminals are laughing today. They are saying: “Oh, that's great, the dirty job of introducing people to marijuana for the first time will be done under the Liberals. That's fantastic. The government will do the dirty job, and after that we'll enjoy it because those kids will then be able to use other harder drugs”. That is a Liberal reality. That is why we will never accept this kind of bill. 
We need to remember that normalizing the legalization of marijuana has an unfortunate effect on children. I will quote Ms. Seychelle Harding, director of communications for the Portage group's addiction rehabilitation centres, who said, “It is clear that just saying it, writing it, talking about it sends a message to young people that it is okay.” That is the reality of the Liberal government. It sends a message saying it is okay when, in fact, nothing good will come of this.
Also, beginning July 1, if the bill unfortunately passes, 12-year-old children will be allowed to have five grams of pot in their pockets. I was very surprised to hear that five grams can be 10 to 15 joints. That is the reality.
Come June, young boys and girls, 12-year-old sixth graders, will walk around the school yard with 15 joints in their pockets thinking it is okay. They will come home and say everything is okay because the Prime Minister of Canada told them they could. Is this the type of country we want to build for our children? Not at all.
The same goes for the four pot plants which the Liberal government will authorize in every household. This represents 600 grams of pot per house, and yet, we are told this is meant to protect children. The opposite is true. Children will have direct access to 600 grams of pot. For these reasons and many others, we must reject this bill.",Conservative,Louis-Saint-Laurent,Gérard Deltell,http://www.parl.gc.ca/Parliamentarians/en/members/gerard-deltell(234454)
4727548,ca.proc.d.2017-11-09.9782109,2017-11-09,0e1edc18-5616-4f5c-b9bd-535059ec8040,234561,"Mr. Bill Blair (Parliamentary Secretary to the Minister of Justice and Attorney General of Canada and to the Minister of Health, Lib.)",,Government Orders,Cannabis Act,Report Stage,"Madam Speaker, I have a couple of points I want to raise.
First of all, I assure the member opposite that the date of enactment will not be July 1, Canada Day, a day that is special to all Canadians. I can say with great assurance that it will not be that day. In my opinion, that day is a sacred day for the celebration of the birth of this country, and we will not be doing the enactment of this proposed legislation on that day. We will not be doing it on July 1.
I also want to remind the member and a number of people on the other side who are saying that we cannot fight organized crime, that I respectfully disagree. I would also remind them that in this proposed legislation, the offences of illegal production of cannabis, illegal trafficking of cannabis, and illegal importation and exportation of cannabis would remain serious criminal offences with substantial criminal penalties for those who would break the law. The only cannabis that would be available for purchase and consumption by adult Canadians would be cannabis produced under strict regulation. 
I offer that to the member simply to remind him, in response to his concerns about dealing with organized crime, that law enforcement will still have all the tools and authorities it requires to fight the scourge of organized crime in our communities.",Liberal,Scarborough Southwest,Bill Blair,http://www.parl.gc.ca/Parliamentarians/en/members/bill-blair(234561)
4727549,ca.proc.d.2017-11-09.9782124,2017-11-09,e277e13e-59ec-425f-a957-eb5e54d8cb62,234454,Mr. Gérard Deltell,,Government Orders,Cannabis Act,Report Stage,"Madam Speaker, what he said is brand new to me, and I think brand new to Canada. The parliamentary secretary just announced that it will be not July 1. Is that true? Is it written in the bill? Is it not written in the bill that everyone should be ready for July 1, and that every province and municipality should be ready for July 1? If they have changed their minds, that is a first step toward reality, but there are also some other steps for them to take. 
The parliamentary secretary talked about people on the criminal side, because the bill would be very strict, and so if they import drugs, they will be very careful. They are doing that now, and will continue to do so. However, the problem is that with the Liberals' bill, the kids will have access to that.
We are going to downplay the use of marijuana, and that is the problem caused by the Liberal bill. From now on, teenagers will tell their parents it is legal and it is their right. They will use it and go to the neighbour's house because he has pot.",Conservative,Louis-Saint-Laurent,Gérard Deltell,http://www.parl.gc.ca/Parliamentarians/en/members/gerard-deltell(234454)
4727550,ca.proc.d.2017-11-09.9782131,2017-11-09,cedf1659-ebb1-4f26-b723-5c7c5353988b,214948,The Assistant Deputy Speaker (Mrs. Carol Hughes),,Government Orders,Cannabis Act,Report Stage,"Order. I have to give some time to other members so that they can ask questions.
The hon. member for Rivière-des-Mille-Îles.",New Democratic Party,Algoma—Manitoulin—Kapuskasing,Carol Hughes,http://www.parl.gc.ca/Parliamentarians/en/members/carol-hughes(214948)
4727551,ca.proc.d.2017-11-09.9782133,2017-11-09,03fec1f2-5bf7-4f22-8a1f-0a48e4b70a4e,215890,"Ms. Linda Lapointe (Rivière-des-Mille-Îles, Lib.)",,Government Orders,Cannabis Act,Report Stage,"Madam Speaker, I commend my colleague for describing the situation with enthusiasm and passion. He says that this is not good for young people, but in fact young people 18 and under have access to marijuana.
In my riding, we held a consultation in September. Dr. Goyer, director of public health in the Laurentian area said that 32% of people 18 and under in Quebec had used cannabis over the past year. In the Laurentian area, it is 50%. That is not good. That is why we have to put this in the hands of the law and engage in education and prevention.
I imagine that the hon. member, whom I have known for many years, has children. Mine are 25, 23, 21, and 18. They all told me that it is easier to buy marijuana than it is to buy alcohol and cigarettes because those are legal and cannot be purchased without showing identification. I come from the retail sector, which is subject to very strict laws with very harsh penalties for those who sell products to people 18 and under.
We need to legalize cannabis and put very strict measures in place. I would like to know what my colleague has to say about that.",Liberal,Rivière-des-Mille-Îles,Linda Lapointe,http://www.parl.gc.ca/Parliamentarians/en/members/linda-lapointe(215890)
4727552,ca.proc.d.2017-11-09.9782150,2017-11-09,e277e13e-59ec-425f-a957-eb5e54d8cb62,234454,Mr. Gérard Deltell,,Government Orders,Cannabis Act,Report Stage,"Madam Speaker, I just want to point out that this is the second time a Liberal member has asked me a question, even though people on this side had risen.
 The worst thing we could do would be to let children as young as 12 carry 15 joints. The member and the Liberals may well say that educating young people is important, but where is the educational value in letting 12-year-olds, grade 6 students, walk around the schoolyard with 15 joints in their pockets?
I am sorry, but a sign of normalization like this would be the worst thing this government could do.",Conservative,Louis-Saint-Laurent,Gérard Deltell,http://www.parl.gc.ca/Parliamentarians/en/members/gerard-deltell(234454)
4727553,ca.proc.d.2017-11-09.9782161,2017-11-09,9fb311fc-3875-4698-b13c-014f0d819393,218453,"Mr. Colin Carrie (Oshawa, CPC)",,Government Orders,Cannabis Act,Report Stage,"Madam Speaker, I am pleased to rise in the House today to speak to Bill C-45, the cannabis act. I have been here since 2004 and it is probably one of the most badly written pieces of legislation I have ever seen, and there is some frustration on this side in that regard because we have heard the Liberals are going to bring in time allocation. For a bill of such importance and such reach within our provinces and territories, the requirement to have different Houses of Parliament coordinated on this is totally irresponsible.
I want my colleagues, especially on the Liberal side, to understand that there are certain important points to bear in mind in my speech. First of all, everyone agrees that too many kids are smoking marijuana. In my community of Oshawa, no one wants to see a kid who has a couple of joints get a criminal record or get thrown into jail. Most Canadians would agree with that, and that is why it is really important that Canadians recognize that the Conservatives favour making the possession of small amounts of marijuana a ticketable offence only. This is exactly in line with the position of the chiefs of police. This is a responsible approach, one that Canadians would be very supportive of, but not of the bill that we see in front of us.
The Liberals claim that the status quo is not working, but how does the Liberal government define that? According to a Statistics Canada report dated April 2015, based on data collected from the Canadian community health survey on mental health, the total percentage of teens aged 15-17, which is the target group, reporting having used marijuana had dropped from 40% in 2002 to 25% in 2012. That is a 15 percentage point decrease. This means that something in the status quo is working, but why are the Liberals not telling Canadians about that? What are the Liberals saying? They are saying they want to legalize marijuana because it will it out of the hands of our kids and keep the profits out of the hands of organized crime. We agree with that. These are good ideas, but does C-45 accomplish that objective? Anyone who has read the bill would say no. 
At the health committee we had scientists testify, and the science is clear. Any use of marijuana under the age of 25 can cause permanent psychological damage to our kids, and currently the bill allows kids aged 12 to 17, as young as grade 6, to possess up to five grams of marijuana, equivalent to 10 to 15 joints. That is ridiculous in light of the medical evidence of the harm it can cause our youth. There is no provision to prevent them from selling or distributing cannabis. The amount should be zero.
I am asked if a child in grade 6 could share it with younger kids. That is an important question. It is a great concern of parents and teachers. It would allow drug dealers to target kids and use them for profit. 
Bill C-45 allows up to four plants to be grown in the home. Any home can become a grow op. Four plants under the right conditions can yield up to 600 grams or 1,200 to 1,800 joints. This is a concern for homeowners, landlords, law enforcement. Moreover, there is no mandatory testing for the potency or toxicity of the homegrown plants, and no money for inspection. There is no federal requirement to lock up the marijuana. This is going to expose kids and even pets to the drugs. Grow ops lead to a 24-fold increase in incidents involving fire. Landlords are concerned that they will not be able to forbid grow ops or smoking if they are already renting their properties. 
Other jurisdictions that have legalized marijuana have said that home grows were hugely penetrated by organized crime. We know it from the science and the evidence out there. For this reason, Washington state does not allow home grows, except for medically fragile people who cannot get to a dispensary. It has been able to reduce organized crime to less than 20% of the market.
The legal opinion is that allowing four plants per dwelling will end up being challenged in court as well. The government has not thought through the bill. There will not only be danger in the homes of Canadians, but on the roads too. Drug-impaired driving is not addressed in Bill C-45. It is encompassed in Bill C-46, but a study recently issued by the Canadian Centre on Substance Abuse and Addiction put the cost of impaired driving from cannabis at one billion dollars. The AAA found there has been a large increase in the number of fatal accidents in Washington state involving the use of marijuana after the state legalized the drug. In fact, impaired driving has increased in the American states that have legalized it, and there is no current instrument that can accurately measure one's level of impairment on the roadside. The science is not there yet. 
Canada is unable to train our own officers in Canada and needs to send our officers to expensive, lengthy training in the United States, and this training currently has wait lists.
The legalization of marijuana will definitely impact our ability to trade internationally. Have the Liberals noticed that we are negotiating NAFTA? Do the Liberals think that having a drug policy way out of sync with our American neighbours will improve trade or thicken the border? For Oshawa and my community, this is a huge problem, as it is for other communities as well.
Let us look at the treaties. Passing Bill C-45 would violate three UN treaties to which Canada is a signatory. In order to legalize marijuana by July 1 and not be in violation of the UN treaties, Canada would have had to withdraw by July 1 of this year, and the Liberal government did not do that. How can Canada hold other countries to account on their treaty obligations when Canada does not even honour its own? 
This leads me to this question. Why the rush? There are only 241 days to go until this arbitrary date that the Liberals selected. Provinces, municipalities, police forces, and our indigenous communities have stated they are not ready to implement this legislation. The government knows this; members have heard it in committee.
So many questions have been left unanswered. Will Canadians who use marijuana be able to cross the border into the United States where marijuana is still illegal? No department has been able to answer this question, and Canadians deserve an answer before the legislation is implemented.
How will enforcement officers test for drug impairment on the roadside? Can these tests be constitutionally challenged? Is the science valid? Canadians deserve an answer.
What education programs are in place now to inform youth about the dangers and consequences of marijuana? If they are not in place now, when will this education process begin? The health minister said today $43 million, but there is no timeline. 
What will happen to the current medical marijuana system and how will recreational sales impact medical marijuana pricing and distribution?
Canadians deserve answers to these questions before the legislation is passed.
The Liberals talk about the black market. One of the stated goals is to eliminate the black market by creating a legal framework for marijuana, but this is a flawed way of thinking. A variety of factors are being left up to the provinces, such as pricing, distribution, which products are included, and packaging. 
We need to listen to the real experts on the ground.
 Assistant Commissioner Joanne Crampton, of federal policing criminal operations, Royal Canadian Mounted Police, said: 
 As Kathy mentioned, organized crime is a high priority for federal policing, in particular, for the RCMP. We target the highest echelon within the organized crime world. We're very cognizant...and realize that the chances of organized crime being eliminated in the cannabis market would be.... It's probably naive to think that could happen. 
Naive, that is what the experts say about the Liberal approach.
Our Conservative position is the same as the Canadian chiefs of police position, to issue tickets for the simple possession of small amounts of marijuana. This approach is more sensible regarding marijuana possession. Instead of rushing to legalize marijuana, Conservatives are working with law enforcement to protect the health and safety of Canadians. Canadians would be spared a criminal record for simple possession of small amounts.
To summarize, the Liberals promised that they wanted to keep marijuana out of the hands of kids. They also promised that they wanted to keep profit out of the hands of organized crime. 
My speech ultimately has proven that the Liberal approach is wrong. This bill would not accomplish what they are promising Canadians. This is like a big bill of sale. The bill would actually place children further in harm's way by permitting possession for kids as young as 12. That is grade 6. Home grow ops will expose children living in a dwelling to dangerous living space and increase the production of marijuana and diversion to organized crime. This approach will increase the rate of impaired driving. 
The bill leaves so many questions unanswered, which has blindsided law enforcement and other levels of government.
The question is why the Liberals are force-feeding us this deeply flawed bill. The only answer I can come up with is that the government has no problem being deceitful to Canadians in order to keep the Prime Minister's irrresponsible election promise, muddying the water about the implications of full legalization under the bill.
Instead of blindly trying to keep campaign promises at the expense of Canadians' health and safety, perhaps the Liberals should refocus their attention on protecting kids and protecting the public, protecting our trade agreements, and not putting international relationships in jeopardy, particularly the one we have with the United States. They have had no problem breaking other promises, whether it is the balanced budget, electoral reform, or openness and transparency. 
It is time the Liberals put the brakes on this legislation until the science supports the ability to ensure the health and safety of Canadians, particularly our kids.",Conservative,Oshawa,Colin Carrie,http://www.parl.gc.ca/Parliamentarians/en/members/colin-carrie(218453)
