basepk,hid,speechdate,pid,opid,speakeroldname,speakerposition,maintopic,subtopic,subsubtopic,speechtext,speakerparty,speakerriding,speakername,speakerurl
4727443,ca.proc.d.2017-11-09.9781007,2017-11-09,22a96405-bed6-45e9-811a-69d055416803,234948,"Hon. Steven Blaney (Bellechasse—Les Etchemins—Lévis, CPC)",,Oral Questions,Taxation,,"Mr. Speaker, if the Minister of National Revenue is saying that payments have increased, why is it that a constituent from Sainte-Justine who used to get a disability tax credit no longer qualifies for a registered disability savings plan, according to the CRA?
The Prime Minister gave me his word that the Minister of National Revenue and the Minister of Health would follow up on this case. 
What progress has the minister made on the case of my constituent from Sainte-Justine who has diabetes, who is worried, who unfortunately is not a friend of the Prime Minister's, and who has no tax haven in the Caribbean? ",Conservative,Bellechasse—Les Etchemins—Lévis,Steven Blaney,http://www.parl.gc.ca/Parliamentarians/en/members/steven-blaney(234948)
4727444,ca.proc.d.2017-11-09.9781009,2017-11-09,c58bb7da-2385-4bbf-a8f1-b781f634a80c,213875,"Hon. Diane Lebouthillier (Minister of National Revenue, Lib.)",,Oral Questions,Taxation,,"Mr. Speaker, our government is committed to ensuring that everyone receives the tax credits and benefits they are entitled to. The eligibility criteria for the tax credit have not changed. My colleague opposite knows very well that all personal information held by the CRA is strictly confidential. I will not discuss any individual in the House today or at any time during our term in office.",Liberal,Gaspésie—Les-Îles-de-la-Madeleine,Diane Lebouthillier,http://www.parl.gc.ca/Parliamentarians/en/members/diane-lebouthillier(213875)
4727445,ca.proc.d.2017-11-09.9781011,2017-11-09,22a96405-bed6-45e9-811a-69d055416803,234948,"Hon. Steven Blaney (Bellechasse—Les Etchemins—Lévis, CPC)",,Oral Questions,Taxation,,"Mr. Speaker, we are tired of empty talk. We want action. What my constituent from Sainte-Justine wants is action. She wants the government to stop going after her savings, which will provide her with a secure retirement, because she is diabetic and she has children to take care of. We want action. 
Why is the Prime Minister defending his bagman, who is hiding millions of dollars in the Caribbean, rather than taking care of my constituent from Sainte-Justine?
I expect some action.",Conservative,Bellechasse—Les Etchemins—Lévis,Steven Blaney,http://www.parl.gc.ca/Parliamentarians/en/members/steven-blaney(234948)
4727446,ca.proc.d.2017-11-09.9781014,2017-11-09,c58bb7da-2385-4bbf-a8f1-b781f634a80c,213875,"Hon. Diane Lebouthillier (Minister of National Revenue, Lib.)",,Oral Questions,Taxation,,"Mr. Speaker, we are fully committed to combatting tax evasion and aggressive tax avoidance. It is funny to hear the Conservatives talking about how important it is to combat tax evasion since they did so little in that regard when they were in office.
In its last year in office, the Harper government conducted 98 offshore audits. We conducted 223 last year. In its last year in office, the Conservative government transferred 244 cases to criminal investigation. We transferred 335 last year. These numbers show that we are taking the situation much more seriously than the Conservatives—",Liberal,Gaspésie—Les-Îles-de-la-Madeleine,Diane Lebouthillier,http://www.parl.gc.ca/Parliamentarians/en/members/diane-lebouthillier(213875)
4727447,ca.proc.d.2017-11-09.9781015,2017-11-09,3176068f-62ee-4b2f-aacd-1131201c6db1,214707,The Speaker,,Oral Questions,Taxation,,Order. The hon. member for Sarnia—Lambton.,Liberal,Halifax West,Geoff Regan,http://www.parl.gc.ca/Parliamentarians/en/members/geoff-regan(214707)
4727448,ca.proc.d.2017-11-09.9781016,2017-11-09,4437c848-d8c7-4a39-a948-1539969f3a90,234764,"Ms. Marilyn Gladu (Sarnia—Lambton, CPC)",,Oral Questions,Taxation,,"Mr. Speaker, the clock is ticking for the people with type 1 diabetes who have had their previously approved disability tax credits rejected. That is because refusal triggers a letter telling them that they are not eligible for the retirement disability pension fund they have being putting money into for 10 years and that the account must be shut down. What are the Liberals going to do with the funds that were supposed to help these people manage their disability? They are going use them to pay for their out of control spending. How can they not see this is wrong?",Conservative,Sarnia—Lambton,Marilyn Gladu,http://www.parl.gc.ca/Parliamentarians/en/members/marilyn-gladu(234764)
4727449,ca.proc.d.2017-11-09.9781020,2017-11-09,c58bb7da-2385-4bbf-a8f1-b781f634a80c,213875,"Hon. Diane Lebouthillier (Minister of National Revenue, Lib.)",,Oral Questions,Taxation,,"Mr. Speaker, our government is committed to ensuring that everyone receives the tax credits and benefits that they are entitled to.
The eligibility requirements for this tax credit have not changed. It is important to recognize that far too many Canadians are struggling and need help. That is why we are helping low-income workers keep more of their hard-earned money by increasing the working income tax benefit by $500 million a year as of 2019.
We continue to deliver on our promises to Canadians.",Liberal,Gaspésie—Les-Îles-de-la-Madeleine,Diane Lebouthillier,http://www.parl.gc.ca/Parliamentarians/en/members/diane-lebouthillier(213875)
4727450,ca.proc.d.2017-11-09.9781022,2017-11-09,6fda5a4f-19c6-4cf2-b72d-9a00b48e0d21,219053,"Ms. Hélène Laverdière (Laurier—Sainte-Marie, NDP)",,Oral Questions,Foreign Affairs,,"Mr. Speaker, next week, Canada will host a major international summit involving about 70 peacekeeping nations.
However, in the meantime, Canada has yet to deliver on its own pledge to contribute to peacekeeping operations. That is a shame. It seems this government is really in no rush to fulfill its promises and international obligations.
When will the government stop embarrassing itself and us and finally announce a contribution to peacekeeping?",New Democratic Party,Laurier—Sainte-Marie,Hélène Laverdière,http://www.parl.gc.ca/Parliamentarians/en/members/helene-laverdiere(219053)
4727451,ca.proc.d.2017-11-09.9781026,2017-11-09,22a6ff7d-fc39-47b2-8003-a016329ed224,234544,"Mr. Matt DeCourcey (Parliamentary Secretary to the Minister of Foreign Affairs, Lib.)",,Oral Questions,Foreign Affairs,,"Mr. Speaker, we strongly believe that Canada has an important role to play in peacekeeping operations, and we are proud of our track record.
Canadians expect us to make an international contribution. That is why we have committed half a billion dollars and promised troops for peacekeeping missions.
Last week, we announced an ambitious action plan to integrate gender equality into peace and security efforts. We are proceeding with caution, as Canadians expect.",Liberal,Fredericton,Matt DeCourcey,http://www.parl.gc.ca/Parliamentarians/en/members/matt-decourcey(234544)
4727452,ca.proc.d.2017-11-09.9781028,2017-11-09,f4efade5-e605-4926-b4d9-cea84ef76f14,217136,"Mr. Randall Garrison (Esquimalt—Saanich—Sooke, NDP)",,Oral Questions,Foreign Affairs,,"Mr. Speaker, it is unacceptable that Canada will be welcoming the world to a conference on peacekeeping without making any specific commitment on a peacekeeping mission.
To make matters worse, United Nations officials believe that the things being considered by Canada do not even match the UN's priorities. Now, with this conference just a few days away, it is still not clear if or how Canada will contribute.
Again, will the government be announcing a specific peacekeeping mission commitment before the conference opens?",New Democratic Party,Esquimalt—Saanich—Sooke,Randall Garrison,http://www.parl.gc.ca/Parliamentarians/en/members/randall-garrison(217136)
4727453,ca.proc.d.2017-11-09.9781030,2017-11-09,22a6ff7d-fc39-47b2-8003-a016329ed224,234544,"Mr. Matt DeCourcey (Parliamentary Secretary to the Minister of Foreign Affairs, Lib.)",,Oral Questions,Foreign Affairs,,"Mr. Speaker, Canada has a proud history of peacekeeping, and our government knows how important it is for Canadians, for us to re-engage in that leadership role in a modernized view of how peacekeeping is done through the United Nations.
We committed personnel and $500 million to re-engage and take on a leadership role in peacekeeping operations. Last week, we announced an ambitious action plan that talks about gender equality in all of our engagement and fragile states, including in police and military deployments.
Canada will re-engage in a leadership role in peacekeeping operations around the world.",Liberal,Fredericton,Matt DeCourcey,http://www.parl.gc.ca/Parliamentarians/en/members/matt-decourcey(234544)
4727454,ca.proc.d.2017-11-09.9781033,2017-11-09,5984fab3-2564-47f9-a49a-ebb07b5cbb24,234527,"Mr. Nick Whalen (St. John's East, Lib.)",,Oral Questions,"Families, Children and Social Development",,"Mr. Speaker, in budget 2017, the government announced that it would make maternity and parental leave more flexible and improve support for caregivers.
Could the Minister of Families, Children and Social Development please update this House on recently announced measures our government is implementing to support parental benefits and those providing compassionate care?",Liberal,St. John's East,Nick Whalen,http://www.parl.gc.ca/Parliamentarians/en/members/nick-whalen(234527)
4727455,ca.proc.d.2017-11-09.9781037,2017-11-09,d67a49c2-65bd-411e-8bb4-29ff759c5829,214003,"Hon. Jean-Yves Duclos (Minister of Families, Children and Social Development, Lib.)",,Oral Questions,"Families, Children and Social Development",,"Mr. Speaker, I am delighted to take this opportunity to thank the member for St. John's East for his remarkable work on behalf of his constituents.
I am also delighted to have been able to announce this morning that a budget 2017 enhancement to our EI system will take effect on December 3. This means that parents will have more support, more flexibility to look after their children. It also means that caregivers will have more flexibility and support to look after their dear ones when they go through difficult health circumstances.
This is part of our plan to grow the economy, grow the middle class, and help more Canadians join the middle class. We will celebrate that next week.",Liberal,Québec,Jean-Yves Duclos,http://www.parl.gc.ca/Parliamentarians/en/members/jean-yves-duclos(214003)
4727456,ca.proc.d.2017-11-09.9781039,2017-11-09,8c04baa6-daad-4fe5-8413-3973a24a2760,234592,"Hon. Maxime Bernier (Beauce, CPC)",,Oral Questions,Taxation,,"Mr. Speaker, for weeks we have asked the Liberals to provide details about the scandals we are debating today in the House, especially those involving tax evasion.
The minister responds every time with the number of investigations conducted. However, we have heard nothing about investigations of the Liberals' cronies. My question for the minister is very simple.
With respect to the paradise papers, which were recently disclosed, will all the people named in those papers be investigated by her department, yes or no?",Conservative,Beauce,Maxime Bernier,http://www.parl.gc.ca/Parliamentarians/en/members/maxime-bernier(234592)
4727457,ca.proc.d.2017-11-09.9781042,2017-11-09,c58bb7da-2385-4bbf-a8f1-b781f634a80c,213875,"Hon. Diane Lebouthillier (Minister of National Revenue, Lib.)",,Oral Questions,Taxation,,"Mr. Speaker, we are firmly committed to working on and cracking down on tax evasion and aggressive tax avoidance.
It is strange to hear the Conservatives talk about the importance of cracking down on tax evasion as they did so little when in power. In the last year they were in office, the Conservatives sent 244 cases to criminal investigations and only 39 search warrants were executed. Last year there were 335 cases, and 123 search warrants. 
While the Conservatives work for the wealthy, we work for the—",Liberal,Gaspésie—Les-Îles-de-la-Madeleine,Diane Lebouthillier,http://www.parl.gc.ca/Parliamentarians/en/members/diane-lebouthillier(213875)
4727458,ca.proc.d.2017-11-09.9781043,2017-11-09,3176068f-62ee-4b2f-aacd-1131201c6db1,214707,The Speaker,,Oral Questions,Taxation,,Order. The hon. member for Beauce.,Liberal,Halifax West,Geoff Regan,http://www.parl.gc.ca/Parliamentarians/en/members/geoff-regan(214707)
4727459,ca.proc.d.2017-11-09.9781044,2017-11-09,8c04baa6-daad-4fe5-8413-3973a24a2760,234592,"Hon. Maxime Bernier (Beauce, CPC)",,Oral Questions,Taxation,,"Mr. Speaker, let me make it a little more specific for the minister. 
The Prime Minister's friend and bagman for the Liberal Party of Canada, Stephen Bronfman, was referenced in the paradise papers. The revenue minister spoke about a full investigation into those exposed in these papers.
My question for the minister is very simple. Can the minister assure the House that Stephen Bronfman will be investigated, yes or no?",Conservative,Beauce,Maxime Bernier,http://www.parl.gc.ca/Parliamentarians/en/members/maxime-bernier(234592)
4727460,ca.proc.d.2017-11-09.9781046,2017-11-09,c58bb7da-2385-4bbf-a8f1-b781f634a80c,213875,"Hon. Diane Lebouthillier (Minister of National Revenue, Lib.)",,Oral Questions,Taxation,,"Mr. Speaker, my colleague opposite knows very well that I cannot discuss any specific cases, and I will not do so today or at any point in the future. The integrity of our tax system is at stake. What I can say is that our government is fully committed to fighting tax evasion and tax avoidance. No one is above the law. The law applies to everyone.",Liberal,Gaspésie—Les-Îles-de-la-Madeleine,Diane Lebouthillier,http://www.parl.gc.ca/Parliamentarians/en/members/diane-lebouthillier(213875)
4727461,ca.proc.d.2017-11-09.9781048,2017-11-09,a2d5c8bf-d42e-4b53-be9e-70af2a6fe169,217370,"Mr. Mark Strahl (Chilliwack—Hope, CPC)",,Oral Questions,Taxation,,"Mr. Speaker, the minister just said she cannot comment on an ongoing investigation but that is exactly what the Prime Minister did. He said, “...we have received assurances that all rules were followed...and we are satisfied with those assurances.” He has done exactly the opposite of what the minister promised had to happen.
Apparently, if people raise enough money for the Liberal Party, its assurances are all they need to get off the hook. It must be nice.
Why is there one set of rules for the Liberals and one set of rules for everyone else?",Conservative,Chilliwack—Hope,Mark Strahl,http://www.parl.gc.ca/Parliamentarians/en/members/mark-strahl(217370)
4727462,ca.proc.d.2017-11-09.9781051,2017-11-09,c58bb7da-2385-4bbf-a8f1-b781f634a80c,213875,"Hon. Diane Lebouthillier (Minister of National Revenue, Lib.)",,Oral Questions,Taxation,,"Mr. Speaker, the comments being made by the Conservatives and members opposite are totally absurd and completely irresponsible. No one is interfering in the agency's work. In our last two budgets, we invested historic amounts totalling nearly $1 billion. It is funny to hear the Conservatives talk about the importance of this issue. According to The Globe and Mail, in 2014, they eliminated 50 positions of managers responsible for international cases. Former minister of national revenue Jean-Pierre Blackburn— ",Liberal,Gaspésie—Les-Îles-de-la-Madeleine,Diane Lebouthillier,http://www.parl.gc.ca/Parliamentarians/en/members/diane-lebouthillier(213875)
4727463,ca.proc.d.2017-11-09.9781052,2017-11-09,3176068f-62ee-4b2f-aacd-1131201c6db1,214707,The Speaker,,Oral Questions,Taxation,,Order. The hon. member for Chilliwack—Hope.,Liberal,Halifax West,Geoff Regan,http://www.parl.gc.ca/Parliamentarians/en/members/geoff-regan(214707)
4727464,ca.proc.d.2017-11-09.9781053,2017-11-09,a2d5c8bf-d42e-4b53-be9e-70af2a6fe169,217370,"Mr. Mark Strahl (Chilliwack—Hope, CPC)",,Oral Questions,Taxation,,"Mr. Speaker, what is absurd and irresponsible are the words of the Prime Minister who said, “...we have received assurances that all rules were followed...and we are satisfied with those assurances.” He has let Stephen Bronfman off the hook based solely on his word.
The lesson for Canadians: If they want to avoid a pesky investigation first of all, be rich; second, be famous; but most of all, be a good, close friend of the Liberal Party who raises a lot of money.
Why is there one set of rules for friends of the Liberal Prime Minister and a different set for everyone else?",Conservative,Chilliwack—Hope,Mark Strahl,http://www.parl.gc.ca/Parliamentarians/en/members/mark-strahl(217370)
4727465,ca.proc.d.2017-11-09.9781055,2017-11-09,c58bb7da-2385-4bbf-a8f1-b781f634a80c,213875,"Hon. Diane Lebouthillier (Minister of National Revenue, Lib.)",,Oral Questions,Taxation,,"Mr. Speaker, our government is firmly—",Liberal,Gaspésie—Les-Îles-de-la-Madeleine,Diane Lebouthillier,http://www.parl.gc.ca/Parliamentarians/en/members/diane-lebouthillier(213875)
4727466,ca.proc.d.2017-11-09.p5118088,2017-11-09,,,,intervention,Oral Questions,Taxation,," Oh, oh! ",,,Some hon. members,
4727467,ca.proc.d.2017-11-09.9781057,2017-11-09,3176068f-62ee-4b2f-aacd-1131201c6db1,214707,The Speaker,,Oral Questions,Taxation,,"Order. If there is any more chanting, people will be chanting outside.",Liberal,Halifax West,Geoff Regan,http://www.parl.gc.ca/Parliamentarians/en/members/geoff-regan(214707)
4727468,ca.proc.d.2017-11-09.9781058,2017-11-09,c58bb7da-2385-4bbf-a8f1-b781f634a80c,213875,Hon. Diane Lebouthillier,,Oral Questions,Taxation,,"Mr. Speaker, our government is fully committed to fighting tax evasion and aggressive tax avoidance, and our actions prove it. We have invested close to $1 billion over the past two years. I repeat, no one is above the law. The law applies to everyone equally. What the Conservative Party is trying to do right now is truly appalling. The comments I am hearing are absurd and perhaps even dangerous. No one is interfering in the agency's work. We have a system that is fair and equal for all.",Liberal,Gaspésie—Les-Îles-de-la-Madeleine,Diane Lebouthillier,http://www.parl.gc.ca/Parliamentarians/en/members/diane-lebouthillier(213875)
4727469,ca.proc.d.2017-11-09.9781061,2017-11-09,ab30a165-2ce2-4465-af10-19ae0fc1aec0,217227,"Ms. Sheri Benson (Saskatoon West, NDP)",,Oral Questions,Human Rights,,"Mr. Speaker, the Prime Minister's special LGBTQ adviser said there is no link between an apology to the LGBTQ community and remedies.
A year ago, the military ombudsman said that as soon as the minister gave approval he would begin revising service records for veterans who were kicked out for being gay, lesbian, bisexual, or transgender. A year ago every member of defence committee voted for this process to begin. 
If there is no link between an apology and remedies, why are these vets still waiting?",New Democratic Party,Saskatoon West,Sheri Benson,http://www.parl.gc.ca/Parliamentarians/en/members/sheri-benson(217227)
4727470,ca.proc.d.2017-11-09.9781064,2017-11-09,bbf2ffbd-6780-4792-8a0a-fae1bd72a6c4,234538,"Mr. Arif Virani (Parliamentary Secretary to the Minister of Canadian Heritage (Multiculturalism), Lib.)",,Oral Questions,Human Rights,,"Mr. Speaker, all Canadians should be safe to be themselves, love whom they choose, and be free from discrimination of any kind.
We have already made significant progress on these issues with Bill C-16 and Bill C-39. Our special adviser on LGBTQ2 issues, the member for Edmonton Centre, has been working hard and consulting broadly with the community to ensure that when an apology happens, it will be thorough and complete. That applies to veterans who are LGBTQ as well.
Funds have been allocated for things like the expungement of records. We will be addressing the issues of veterans.",Liberal,Parkdale—High Park,Arif Virani,http://www.parl.gc.ca/Parliamentarians/en/members/arif-virani(234538)
4727471,ca.proc.d.2017-11-09.9781066,2017-11-09,95ed53a7-7538-4c0f-85a4-64af76065f95,218942,"Mr. Don Davies (Vancouver Kingsway, NDP)",,Oral Questions,Human Rights,,"Mr. Speaker, the government has committed to a long overdue apology to LGBTQ Canadians, but this is the same Liberal Party that promised to eliminate the discriminatory ban on gay men donating blood, and broke that promise. There is no scientific basis for this policy and it constitutes clear discrimination today.
How can the Liberals offer a sincere and meaningful apology to the LGBTQ community for past injustices when they are practising discrimination in the present?",New Democratic Party,Vancouver Kingsway,Don Davies,http://www.parl.gc.ca/Parliamentarians/en/members/don-davies(218942)
4727472,ca.proc.d.2017-11-09.9781070,2017-11-09,eda66e22-490c-4221-b4a0-4eaedacd34e1,233811,"Hon. Ginette Petitpas Taylor (Minister of Health, Lib.)",,Oral Questions,Human Rights,,"Mr. Speaker, through our efforts over the years, Canada continues to have one of the safest blood systems in the world. In June 2016, we took steps forward in reducing the barriers that prevent men who have sex with men from donating blood. Our government has also committed $3 million to Canadian Blood Services in collaboration with Héma-Québec to make further progress on this issue. 
This funding helped organize an international health conference on blood donor policy. It will support behavioural research required to develop non-discriminatory practice and encourage the advancement of this technology.",Liberal,Moncton—Riverview—Dieppe,Ginette Petitpas Taylor,http://www.parl.gc.ca/Parliamentarians/en/members/ginette-petitpas-taylor(233811)
4727473,ca.proc.d.2017-11-09.9781074,2017-11-09,55c46957-54e9-422a-8afd-7c709bcf16a0,234393,"Mr. John Barlow (Foothills, CPC)",,Oral Questions,Agriculture and Agri-Food,,"Mr. Speaker, with the previous Conservative government, Canadian pulse exports went from $1 billion to a record $4.2 billion a year, with exports to India at $1.5 billion. However, negotiating exemptions for Canadian exports expired more than a month ago, and now we have learned that there is a 50% duty on Canadian pea exports to India.
How did the agricultural minister allow this situation to go from bad to worse, and when he is going to secure this vital market for Canada's pulse sector? ",Conservative,Foothills,John Barlow,http://www.parl.gc.ca/Parliamentarians/en/members/john-barlow(234393)
4727474,ca.proc.d.2017-11-09.9781077,2017-11-09,a25e0e6b-f3fa-46c7-a795-ad60037fe56e,213962,"Hon. Lawrence MacAulay (Minister of Agriculture and Agri-Food, Lib.)",,Oral Questions,Agriculture and Agri-Food,,"Mr. Speaker, we are extremely concerned over India's increase in duty by 50% of all imported peas, without providing any advance notice. We are right in our concerns with the Government of India and we will continue to work with our farmers and colleagues to closely monitor the development, determine implications, and raise these concerns with the appropriate Indian ministers.",Liberal,Cardigan,Lawrence MacAulay,http://www.parl.gc.ca/Parliamentarians/en/members/lawrence-macaulay(213962)
4727475,ca.proc.d.2017-11-09.9781079,2017-11-09,55c46957-54e9-422a-8afd-7c709bcf16a0,234393,"Mr. John Barlow (Foothills, CPC)",,Oral Questions,Agriculture and Agri-Food,,"Mr. Speaker, a third of Canada's pulse exports go to India. The Minister of Agriculture  must make this a priority. There is simply too much at stake. 
The inactions of the minister have very real consequences. Further delays will jeopardize Canada's $4 billion pulse sector. We have critical trade agreements that are in jeopardy and this minister has been pushed to the sidelines. He has not even been invited to a vital trade mission to India.
When it comes to these negotiations, when will the Prime Minister appoint a Minister of Agriculture Canadian farmers can trust will be at the table fighting for them?",Conservative,Foothills,John Barlow,http://www.parl.gc.ca/Parliamentarians/en/members/john-barlow(234393)
4727476,ca.proc.d.2017-11-09.9781081,2017-11-09,a25e0e6b-f3fa-46c7-a795-ad60037fe56e,213962,"Hon. Lawrence MacAulay (Minister of Agriculture and Agri-Food, Lib.)",,Oral Questions,Agriculture and Agri-Food,,"Mr. Speaker, it is a decision that has been made by the Indian government, as I think my hon. colleague is fully aware. We are fully aware of the importance of the export of lentils to India, but it was a decision that was made by the Government of India, and we are working with the Government of India to attempt to resolve this. We do not want to complicate the situation any more.",Liberal,Cardigan,Lawrence MacAulay,http://www.parl.gc.ca/Parliamentarians/en/members/lawrence-macaulay(213962)
4727477,ca.proc.d.2017-11-09.9781083,2017-11-09,62bfd797-8d32-425b-91b1-1422ca16694f,224621,"Mr. Blake Richards (Banff—Airdrie, CPC)",,Oral Questions,Housing,,"Mr. Speaker, first, the Liberals made it more difficult for Canadians to qualify for a mortgage, and taking away the dream of home ownership from thousands of first-time buyers. Now they are tacking on even more costs, adding thousands of dollars in expenses when Canadians build, sell, or renovate their homes. As the Canadian Home Builders' Association said, when talking about $30,000, $40,000, or $50,000, our concern will always be about what this means for affordability.
Why are the Liberals making home ownership more expensive for middle-class Canadians, while owners of fancy French villas are let off the hook?",Conservative,Banff—Airdrie,Blake Richards,http://www.parl.gc.ca/Parliamentarians/en/members/blake-richards(224621)
