basepk,hid,speechdate,pid,opid,speakeroldname,speakerposition,maintopic,subtopic,subsubtopic,speechtext,speakerparty,speakerriding,speakername,speakerurl
4728369,ca.proc.d.2017-11-22.9796497,2017-11-22,8c3e4bb0-ac84-4071-bc91-3b47268a13eb,220250,"Hon. Judy A. Sgro (Humber River—Black Creek, Lib.)",,Private Members' Business,British Home Child Day,,"Mr. Speaker, may I begin by complimenting my colleague from Stormont—Dundas—South Glengarry and thanking him very sincerely for the time and effort he has put into his motion. I am very hopeful that we will have unanimous consent at some point in the future to be able to celebrate September 28 as a day of recognition.
I have spoken several times on this British home children issue. I have read several books on it, especially ones published recently. There is no way one can read about the lives of some of these children without being reduced to tears. They tell stories of so many children suffering. Although some were successful, and some placed in homes with people who treated them as an additional member of the family, some of the children were in homes where they were simply day labourers, abused, and not treated the way the program had intended. However, I will elaborate a bit further as I go forward.
I am honoured to be able to stand here today to acknowledge this little-known chapter in Canadian history and to recognize the contributions of the British home children and their descendants. I hope that this is the beginning of many debates and discussions that we will have in this House, as we move forward with this particular item that many of us care about.
Though the child migration scheme was touted as a golden opportunity for children facing extreme poverty in Great Britain, it has since become clear that many of the program's participants were subjected to great abuse and severe hardship. We can only imagine that when the scheme was thought up, the children were already suffering immensely and living on the streets. The idea was to find a home for them. I think the intentions were good, but the oversight and assistance that should have been there were lacking. 
 In Canada, children were rarely adopted in the modern sense. More often, they were taken on as indentured labourers and cheap domestic help. 
Though each story we hear is different, whether of a male or female, the separation of so many families was predominant. We now know that the scheme regularly amounted to nothing short of a betrayal, such as when temporary dislocation for a child became permanent, when children were separated, and ultimately when families were tom apart.
More than 100,000 unaccompanied children made the journey to Canada in the hopes of a better life. Though it remains difficult to fathom the courage that the children must have had, today we can salute them for what they endured on our behalf, both as they grew in a strange new land, and later as they fought in the two world wars on our behalf. 
As a former minister of immigration, I had the pleasure and challenge of overseeing the government department responsible not only for immigration, but also for refugees and citizenship. People from all over the world journey to our shores. It strikes me that the diverse stories of the British home children are as relevant today as they were then.
In a rapidly changing world, they remind us that we are all, in our own ways, newcomers. As such, we remained united by the Canadian promise of safety and prosperity, and mindful that the wealth of our country derives in part from the diversity and tenacity of the citizens, like the British home children who travelled from afar seeking home, a safe place to live, food every day, and most importantly, an opportunity to grow.
 Today, we have a long overdue opportunity to acknowledge the critical role these children played in the early stage of Canada's development as a nation. We owe it to these children and their families to tell their stories. 
When we look at the farm fields all across Canada, we need to think of those children that were paid next to nothing to till those farms, and how much they contributed to our economic growth and our prosperity.
Not only did they help to build this land, they helped defend our country's freedom. It is estimated that 10,000 of these children fought for Canada in the first world war. In reading some of the books that have been written and elaborated on, some of them made the decision to go to war, for it was a better alternative than the way they were living on farms, and how they were treated as nothing short of slave labourers. For some of them, going to war was a better option. 
I ask members to think of that, and how those children must have suffered, but they put on the uniform, and fought for us. They defended our country, and for that we should always be grateful. Many also fought in the second world war, along with descendants of those who arrived in the early years of the immigration schemes, and yet, so many Canadians are unaware of this history.
One of my staff members is a descendant of the British home children. That is how I was introduced to this issue. I did not know about this. I did not learn about this in history class. It was here on Parliament Hill when one of my assistants talked about British home children, and she shared that story with me.
Once we learn about it, there is no way we cannot care about it, and deny it. I am very happy to see that we passed a motion some time last year, which did not get enough attention, as my colleague mentioned earlier. Today, trying to move my hon. colleague's motion forward is a fabulous move to name September 28 as a day that we would all get united, and a day of recognition. We need to learn from the mistakes of the past, because no one knows what is coming tomorrow. We should try our best to learn that.
Canada designated 2010 as the Year of the British Home Child in Canada to ensure Canadians would be better informed about this chapter in our history, and by commemorating a yearly day that our government would ensure it would continue to raise awareness of the history and experiences of British home children and their descendants.
Canada has supported a number of outreach commemorative and educational initiatives to recognize the experience of the home children, including the designation of a national historic event and the establishment of a commemorative plaque. We will continue to support former British home children and their descendants, and to raise awareness about their experience.
Somehow no matter what we do, it never feels like it is enough. How do we say we are sorry? How do we say we had the best intentions as a country? We can never say sorry enough, and there are never enough ways to make up for the damage that was done to many of these children.
I salute my colleague and thank him for bringing this forward. I look forward to standing in the House to support the September 28 day. Again, I congratulate and thank him for the opportunity to speak to this motion.",Liberal,Humber River—Black Creek,Judy Sgro,http://www.parl.gc.ca/Parliamentarians/en/members/judy-sgro(220250)
4728370,ca.proc.d.2017-11-22.9796500,2017-11-22,85738a00-0a16-4a6f-89c7-9f045782d1fd,217185,"Mr. Richard Cannings (South Okanagan—West Kootenay, NDP)",,Private Members' Business,British Home Child Day,,"Mr. Speaker, it is an honour to rise today to speak to Motion No. 133. I thank the member for Stormont—Dundas—South Glengarry for bringing it forward. I will be supporting the motion. 
The motion asks the government to recognize the contributions of over 100,000 British home children to Canada, the hardships and stigmas that many endured, and the importance of reflecting on their stories, by declaring September 28 of every year British home child day in Canada.
I would like thank my friend Art Joyce, whose grandfather was a British home child, and who has written a book on these Canadians and their experiences. Much of the information and many of the words I used to prepare this speech came directly from Mr. Joyce.
 My predecessor in this place, Alex Atamanenko, tabled a motion in the previous Parliament asking for an apology from the Canadian government to British home children and their descendants. I was happy to table the same motion in this Parliament. 
On February 16, 2017, the House of Commons unanimously passed a very similar motion from the member for Montcalm asking that the House recognize the injustice, abuse, and suffering endured by the British home children, as well as the efforts, participation, and contribution of these children and their descendants within our communities, and to offer its sincere apology to the British home children and their descendants.
Who were the British home children? They were children from poor families in the United Kingdom who were taken from their families, orphanages, and state workhouses, and sent to Canada, Australia, and New Zealand. Canada received the vast majority of these children. Those countries assisted with transportation and immigration costs, because these children were seen as a virtually free source of labour on newly developing farms and homesteads. 
British parish priests were given the authority to take children into care as wards of the state if it was determined that the family was too poor to support them, a practice called philanthropic abductions. Poor parents, unwilling to give up their children, had little choice. Once taken from their families, children were essentially branded orphans, regardless of whether their parents survived or not. Although parents could occasionally visit their children in the orphanages, some were shocked to discover that what they had considered a temporary placement had become permanent, or worse, that they had been shipped overseas. Most of these parents would never see their children again. 
This practice began in 1869, and continued in Canada until the last shipment of boys and girls arrived on Vancouver Island at the Prince of Wales Fairbridge Farm School, near Duncan, in 1948. During its heyday, single shipments of children sent by steamboat across the Atlantic could reach as many as 200 boys and girls, some as young as five, during the earlier phase of the program. 
There were more than 100,000 boys and girls sent to Canada during this time, and Statistics Canada has estimated that about four million Canadians are descendants of these children, about one in eight Canadians. If this is a truly representative chamber, that means that more than 40 of us here in the House of Commons are descended from one of the home children. 
The organizations that sent the children to Canada said they would have better lives, but in fact, they were required to sign indenture contracts as labourers, and were only allowed to leave service upon reaching legal age. Although the contract stipulated a modest income, most were never paid. The contracts typically required that children be given food, shelter, adequate clothing, as well as regular access to school and church. 
Often, many of these basic provisions were not met, with children being made to sleep in barns or unheated attics, or to endure Canadian winters without proper winter clothing. Contracts were seldom enforced, as neither the charities nor governments involved had enough staff assigned to do this. Most home children never finished school, as they were required for work. Beatings for the boys and sexual abuse for the girls was not uncommon, and very few were adopted by their host families. “We were here to work”, one adult home child recalled. 
British home children made up a substantial portion of volunteers in both world wars, up to 10,000 serving in World War I alone. 
Art Joyce's grandfather, Cyril William Joyce, was sent to Canada in 1926 as a boy of 16. His father George was a travelling salesman, and the family lived in the east end of London, the epicentre of poverty in that city. Cyril spent several years working as an indentured farm labourer in northern Alberta until reaching legal age. 
He never spoke of it much with his wife and children, and spoke even less of his family in England. His mother had signed the emigration papers, and he never spoke of her again. Cyril was unable to loosen the bonds on these painful memories, and took his family secrets to the grave. That shame, that unwillingness to speak of his past, is a common theme with British home children.
Descendants of home children are left with a huge hole in their lives, not knowing their family history, not knowing the true experiences of their parents and grandparents.
Despite the fact that our governments paid to bring 100,000 of these boys and girls here, then abandoned them to their fates on isolated farms, most Canadians know nothing about this dark chapter in our history. 
Art Joyce points out that, “not once in all my years of public schooling did I learn about Canada's home children.” I can say the same thing. He felt compelled to research his grandfather's history, and the stories of other British home children in a book called Laying the Children's Ghosts to Rest: Canada's Home Children in the West.
What have other countries done to recognize the British Home Children? Australia's former Prime Minister Kevin Rudd invited British home children and their descendants to Parliament House in Canberra for a public apology on November 16, 2009. Many of those in the crowd were in tears.
On February 24, 2010, British Prime Minister Gordon Brown publicly apologized to the families of the approximately 130,000 children who were sent away from Britain.
For the elderly survivors and their descendants, numbering now into the millions in Canada, Australia, and New Zealand, it was a long-awaited moment, one some thought might never arrive.
As Art's uncle Rob Joyce wrote upon hearing of Brown's apology: 
 It is a great day, I wish we could be reading this with Dad now; that would have made it even better. I understand Dad better now than I ever did, and why he was sad at times for reasons I never knew. An understanding that, like the British Government’s apology, has come much too late. 
On the subject of apologies, I would only add that while this House did issue a unanimous apology a few months ago, that apology was made unannounced. To my knowledge no one from the British home children community was present in the House to hear the member for Montcalm put forward his motion.
It would be very meaningful to these families if the government would issue a formal apology, given by the Prime Minister, with family members invited to be present, as we have done for so many other government apologies. The British home children who were taken from their families, lost their childhood to hard labour, and lived with the shame for the rest of their lives deserve no less.
Having a British home child day in Canada would be one more positive step on the road to healing those families. The day chosen, September 28, is coincidentally Art Joyce's birthday.",New Democratic Party,South Okanagan—West Kootenay,Richard Cannings,http://www.parl.gc.ca/Parliamentarians/en/members/richard-cannings(217185)
4728371,ca.proc.d.2017-11-22.9796542,2017-11-22,a2d5c8bf-d42e-4b53-be9e-70af2a6fe169,217370,"Mr. Mark Strahl (Chilliwack—Hope, CPC)",,Private Members' Business,British Home Child Day,,"Mr. Speaker, it is an honour to rise today on behalf of the people of Chilliwack—Hope.
 Today, I am also rising on behalf of my grandmother, Carol Bateman, and my great-grandfather, Sheriff Atcheson Thompson, who was a British home child. Therefore, I am one of the four million to five million descendants of British home children, something I have only discovered thanks to the work of my grandmother in the last few years. 
It was an honour to be part of the group of members of Parliament who sponsored the motion from the member for Montcalm on February 16, which states:
 That the House recognize the injustice, abuse and suffering endured by the British Home Children as well as the efforts, participation and contribution of these children and their descendants within our communities; and offer its sincere apology to the former British Home Children who are still living and to the descendants of these 100,000 individuals who were shipped from Great Britain to Canada between 1869 and 1948, and torn from their families to serve mainly as cheap labour once they arrived in Canada. 
Today, in honour of my great-grandfather, my grandmother has penned some words about her father, which I will try to get through.
She says:
 I write today of my father who suffered the stigma that came with being a British Home Child in Canada. He lived his whole life with the torture of silence and shame forced on him by the very people who were to look out for him. A child of 12 when he came to Canada. 
 Dad, Sheriff Atcheson Thompson was one of 120,000 children shipped to Canada through a cleansing scheme developed in Britain and one which Canada signed onto in ridding England of her over abundance of children who were either living in the streets or in orphanages. 
 Homes for these children sprung up everywhere as there was money to be made by shipping this merchandise to the different British colonies. 
 Philanthropists opened Homes for these children giving them training in farming and as domestics. Bernardos was one of the largest homes, Fegans was a smaller home and this is where my Aunts placed my dad following the death of both his parents. His mother died in 1908 and his father in 1910 leaving three little boys. Henry 7, Sheriff 5 and Richard 3, and so began their journey as “home children” 
 My father Sheriff Atcheson Thompson was placed in Fegans by his Aunt and Uncle at the age of 7 to learn farming skills and be sent to Canada. He spent 5 years in Fegans 4 of those years he was with his brothers but when his brothers were sent to Canada in 1914 he was left behind as he had scarlet fever. He was sent with a group of boys in April 1915. Arrived in St. John New Brunswick and taken to 295 George St, in Toronto, a distributing home for Fegans. He was there for a few days before he was picked up by Mr. Kirby a farmer from Port Perry, Ontario. Dad was to spend the next 5 years as a farm hand. for Mr and Mrs. Kirby and their family. Shortly after dad arrived at Kirby's he took ill Mr. Kirby took him back to George St. and he was diagnosed with a burst appendix. Fegans distributing home offered Mr. Kirby another boy but Mr. Kirby said he liked this boy and would wait. 
 Part of the boys training in Fegans Ramsgate Orphanage was to be obedient and humble and to always appreciate the situation, never show a negative side or cry. Be Grateful. However, Mr. Kirby saying he wanted this boy did make dad feel wanted and the Kirby's were a good family. Dad was not included in the family but was treated well. 
 Part of the agreement Canada signed was to have agents check on these boys and to see they were fed, clothed and were given schooling until they were 14. Dad was fed and clothed and he was schooled in the evening after chores at the kitchen table where Mrs. Kirby would teach him the lessons her son had learned in school that day. Dad knew how to read and write and do basic math, but never attended school. If he talked about the Kirby years at all he said they did the best they could. 
 Dad told Mr. Kirby about his brothers and Mr Kirby found Richard living in Janetsville, just 18 miles away. Uncle Dick would cry when telling his daughter the story of how they had time off work every Sunday afternoons and would walk 9 miles and meet for a short visit and then walk back to their farm in time for the evening meal.... 
 My Aunt...told me another story along this same line. Dad was at church with the Kirby's one Sunday morning when someone from the back started calling his name. dad turned to see...a friend from Fegans who had traveled to Canada on the same ship. The two boys climbed over the pews to reach each other....The loneliness was so profound. 
 I did ask dad about his mom and dad when I was about 12 years old. He was not open to talking about this part of his life and told me that he had letters in his bible that I could read. I tried reading these letter a few times but they were difficult to read and even more difficult to understand. I had a happy childhood and so did not pursue the issue. These letters it turns out were in answer to my dads request in 1935 for information on his family and life in England and how he ended up in Canada. I have read them now and find them very cold and unfeeling, all 6 foolscap...pages. However, they do give the details of his mother and fathers death and they try to justify why they put them into the orphanage. 
 Dad married in 1935 and that was part of the reason for wanting his family history. They planned a family in the future and it became more important.... 
 Mom and Dad left Ontario in 1945, escaping the stigma that still remained there and moved West where the air was clear and there was never any talk of “home children”. They never mentioned going back East. They lived and died in BC Dad never mention his family or his time as a home child or the stigma and of course lived with the shame in silence. 
 My sister and I shared a happy home life with our parents. Our father was a warm and caring father who as you might guess was happy and proud to have a family of his own, a place where he belonged and was loved. His legacy is in his family, his descendants are five generations 60 strong and still growing. All proud Canadian citizens. 
 The scheme that he became part of was not in any way in support of these children. In some documentation they were referred to as merchandise. They were bought and aid for by Canada per head and were indentured for 5 years or until they were 18. The government agents who were to check on the children, often just had a visit with the farmer and left. My Uncle Henry was one of the children who was not placed on a good farm. He slept in the barn, ate in the barn, was beaten and whipped, but it took a year before the agent moved him to a better farm where he stayed until he was 18. I have seen the scars on my Uncles back when he came for a visit in 1958. I stared in disbelief that one human being could do this to another but the scars were there and that I could not ignore. He was not alone in this type of treatment and my heart goes out to others who suffered like him or worse. This in part is a reason these living children are silent today. They still live with the shame bestowed on them and the pain of remembering. 
 My issue today is the fact that they were totally left out of Canada's history. This part of our immigration history is not required teaching in the classrooms. They worked along side the pioneers of our country and yet are not included, the stigma exists today even though they loved Canada enough to fight and die in both world wars. Were decorated heroes, and still? Where are you Canada. Why are you hiding this part of our history? Step up do right by these children and their descendants. Let us show the pride we have in them and finally include them as the important part of Canada they are. 
I think that this motion will go a long way to providing some of that for British home children, their descendants, and even my grandmother. This is not something that she has spent her whole life knowing. This is awareness that she has shared with our family just in the last number of years as she has traced back her family history. She is fiercely proud of her family, and fiercely proud of her father and all that he accomplished. He came from nothing, and was treated as worse than nothing when he arrived, just as an indentured farm servant. Now, 60 family members are his descendants. What a legacy. 
So many British home children have that legacy, as has been said. It is a legacy that has helped build this country, and the least we can do is support this motion and remember them every September 28 so that more and more Canadians can learn about this, not a proud part of our history, but proud people who are still having an impact through their descendants on this great country.",Conservative,Chilliwack—Hope,Mark Strahl,http://www.parl.gc.ca/Parliamentarians/en/members/mark-strahl(217370)
