basepk,hid,speechdate,pid,opid,speakeroldname,speakerposition,maintopic,subtopic,subsubtopic,speechtext,speakerparty,speakerriding,speakername,speakerurl
4727344,ca.proc.d.2017-11-09.9779829,2017-11-09,08f8d23a-fbea-4e7b-ba41-34c9f62dde9e,217134,"Ms. Anne Minh-Thu Quach (Salaberry—Suroît, NDP)",,Government Orders,Cannabis Act,,"Mr. Speaker, I will return to what my colleague has just said about criminalization. All the studies show that criminalization and the longer minimum sentences implemented by the Conservatives for cannabis-related offences have not worked. They have not reduced drug use in young people, and they have not reduced the involvement of organized crime in the sale of cannabis. 
 On the contrary, according to the statistics on drug-related offences reported by the police in 2014, one year after the Conservatives’ repressive laws were passed, cases of methamphetamine possession rose by 38% and trafficking by 17%, while cases of heroine possession rose by 34% and trafficking by 12%. The minimum sentences did not work, the war on drugs was unsuccessful. Why do the Conservatives not want us to adopt and implement a new strategy, an approach based on public health? Right now, the number one drug, the most commonly used drug in Canada and throughout the world, is cannabis. The people who use cannabis the most are young people between the ages of 12 and 25. We need a new strategy to continue to work with young people and improve prevention. Obviously, there are shortcomings in the bill we are debating, but we can work on these shortcomings and make improvements.",New Democratic Party,Salaberry—Suroît,Anne Minh-Thu Quach,http://www.parl.gc.ca/Parliamentarians/en/members/anne-minh-thu-quach(217134)
4727345,ca.proc.d.2017-11-09.9779853,2017-11-09,8138ca16-415e-431d-9d95-051874ca6e3d,229561,Mr. Joël Godin,,Government Orders,Cannabis Act,,"Mr. Speaker, if my colleague had really listened to what I said, she would see that I agree that there is a problem and we need to find solutions. Decriminalization is not a magic wand to solve all our drug-related problems, but it is a step in the right direction. Now, let us take the time to determine the best way to proceed. 
 What I said earlier is that we need to protect young people aged 25 and under and set up a prevention program. In fact, I might not have said it because I was short of time, but I included it in my speech. We need to establish a prevention program, a program to encourage young people to become involved in sports, the arts and volunteering, and put in place the means to eliminate the distribution of drugs to young people. ",Conservative,Portneuf—Jacques-Cartier,Joël Godin,http://www.parl.gc.ca/Parliamentarians/en/members/joel-godin(229561)
4727346,ca.proc.d.2017-11-09.9779869,2017-11-09,fc9a44ff-23e0-45df-8ec4-a9cccefa71e1,234608,"Hon. Ed Fast (Abbotsford, CPC)",,Government Orders,Cannabis Act,,"Mr. Speaker, I am thankful for the opportunity to engage in this debate. Bill C-45 is, of course, the bill that would legalize marijuana in Canada.
When we talk about legalization, we have to understand what this legislation would do. It would normalize the use of marijuana in everyday life across Canada. Like cigarettes, which were normalized many years ago, and the same with booze, marijuana would now become an accepted part of Canadian life. The message we send to our children would be a terrible one. It is one that says we give up, we surrender, because we are no longer going take action to eliminate the use of marijuana and other drugs in our society. We are simply going to go, as my colleague said, the coward's way: acquiesce and legalize it. 
I am absolutely confident that Bill C-45, which represents the normalization of the use of marijuana in Canada, would become a massive public policy failure for the Liberal government, just like its tax reforms, where it attacks small businesses, diabetics, those who are getting employee discounts, and the mentally ill. That has become a massive policy failure, and Bill C-45 would also become a massive policy failure for the reasons I will articulate.
The bill would effectively legalize the sale, use, and cultivation of marijuana. As I said, it would normalize its use. We have worked so hard as a society to discourage cigarette smoking, and yet here we are opening the door to what is arguably an even more dangerous substance. The irony is that the current government, while it would pass the bill to legalize the use of marijuana, would then engage in a public relations and communications strategy telling young people who would be purchasing marijuana that they should not buy it because it is very dangerous and they should not use it, but it would be legalized and normalized. I mean, the hypocrisy of that is jaw-dropping. 
I was an elected official in the City of Abbotsford for many years. I was very pleased to serve there as a city councillor. I can tell members that, as a council, one of the biggest challenges we had was the growing of marijuana plants at home. Many of these were illegal grow ops. Eventually, medicinal marijuana was approved for use in Canada, and homes are now growing this under the auspices of providing some kind of medicinal relief. What has happened is that we have communities and neighbourhoods within Abbotsford that are wonderful neighbourhoods, but they have houses in which marijuana is grown. Historically, they would cover the windows with foil, and the stench emanating from those properties was overwhelming. There was a constant stream of neighbourhood members who would come to us council members and complain about it. 
This bill would authorize the growing of marijuana plants at home. I can assure members that many Canadians, unfortunately, will take that opportunity to grow more than the four plants that would be allowed under the proposed legislation. This would result in continued challenges with our neighbourhoods across Canada.
There was a stated objective of the government that it wanted to protect youth, and that the regulation and legalization of marijuana would achieve that end. The Liberals stated that they also wanted to eliminate organized crime, but we know that children under the age of 18 are not supposed to be buying marijuana. Anyone over the age of 18, under the proposed legislation, would be able to legally purchase and consume marijuana, but those under the age of 18 would not. Ironically, those between the ages of 12 and 17 would be allowed to possess small amounts of marijuana. Where would they acquire that marijuana? They cannot buy it legally. Who are they going to go to? Well, organized crime would supply that drug.
There is a bigger problem. All of the medical and and scientific research says that marijuana use among young people has a very negative impact on their developing young brains.
Why would the Liberal government want to legalize a drug that we know will be used by our youth in increasing numbers, because it will be that much more available to them? Why would we allow this to happen when it is very clear from the medical literature that the use of marijuana amongst young people invariably leads to significant mental health issues? In fact, I am predicting that if this legislation passes, in 5, 10, 15 years from now, Canada will face a mental health crisis. All of these youth who have had greater access to marijuana will be suffering from significant mental health challenges. What a terrible legacy for us to leave for our children.
I want to address the issue of the timing of this legislation. As we know, the Prime Minister has said he is going to ram this thing through and implement the legislation by July 1, 2018. However, we have heard from police chiefs across Canada that it is impossible for them to get ready and implement this legislation with all the challenges this bill represents. We have heard from communities across the country, including from my own city of Abbotsford, which communicated with the federal government, made a submission to the committee that studied this bill, and said, “Please, you cannot do this by July 1”. The provinces and territories are saying to the Prime Minister that July 1 is way too ambitious a date to implement this plan by, that they will not be ready for it. Their police services will not be ready, their educational system will not be ready, and Canadians will not be ready for it.
Generally speaking, it is going to result in a fiasco. However, that is what we have to expect from the Liberal government. Whatever file it touches, it it ends up being a huge mess. That includes ethical failures like those of the finance minister and the Prime Minister and his fundraiser having offshore accounts. No one trusts the government anymore. There has been a fundamental breach of trust.
Let us look at some of the other challenges. I want to be very clear that we support ticketing the possession of small amounts of marijuana. We are supportive of decriminalization of small amounts of marijuana. We do not want to leave young children with a criminal record.
However, this bill goes far beyond decriminalization. It is clear-cut legalization of the use of marijuana and the normalization that will follow. We run a huge risk as we normalize the use of marijuana in Canada, where people will be entitled by law to possess small amounts of marijuana. Many Canadians will be travelling. They will have used marijuana regularly. They will have some of it in their glove compartments. When they get to the U.S. border, suddenly the border agents will be asking, “Hey, what do you have in your car? Do you have any guns or drugs?” People will say, “No, we do not.” The agents will rifle through the car and find marijuana in the glove compartment. Those people will probably be apprehended on the American side of the border. They will have a criminal record on that side of the border. They will have to go through the legal process there. That is one of the many small consequences the bill will generate.
Finally, it is very clear that the government has run out of money. That is why it is taxing Canadians to death. It has gone after small businesses, diabetics, employee discounts, the mentally ill, and now it is going after marijuana. The government is going to tax marijuana. More and more, it is because the government is running short of money. Can members imagine that being the reason for passing a bill like this that will have enormous consequences for Canadians?
I say to my Liberal friends across the way in closing that they should give their heads a shake and reconsider what they are doing here. This is bad policy that will hurt future generations of Canadians. They should not do it.",Conservative,Abbotsford,Ed Fast,http://www.parl.gc.ca/Parliamentarians/en/members/ed-fast(234608)
4727347,ca.proc.d.2017-11-09.9780018,2017-11-09,fe08cc31-44b1-466e-a0c6-1b0c61c8bf97,215973,"Mr. Mark Gerretsen (Kingston and the Islands, Lib.)",,Government Orders,Cannabis Act,,"Mr. Speaker, I appreciate the comments by the member for Abbotsford. We get along great at the environment committee and had a great discussion this morning. 
Regrettably, I see some challenges with what he has presented here today. In particular, he talked about normalizing the use of cannabis. Is he aware of the fact that 21% of our youth have used marijuana? Is he aware of the fact that 30% of young adults use marijuana? What more is required for him to realize it is already a problem?
He then talked about access to cannabis, particularly the access of young children to cannabis, and how it will somehow give rise to the criminal activity behind production and distribution. How many of these young people are getting alcohol brewed at home, or tobacco that has been grown and dried at home and rolled into cigarettes? It simply will not work like that.
The reality of the situation is that when we have legalized it and regulated its production, and when we can start to properly inform and educate children about the challenges involved, as we have done with cigarettes, we will be so much more successful. I am not creating a brand new scenario here. This has already been the case. We have already seen this happen with alcohol and tobacco. We have had a much higher success rate at keeping those out of the hands of children.
Would the member like to respond to the fact that so many youth are already experimenting with cannabis?",Liberal,Kingston and the Islands,Mark Gerretsen,http://www.parl.gc.ca/Parliamentarians/en/members/mark-gerretsen(215973)
4727348,ca.proc.d.2017-11-09.9780048,2017-11-09,16c839d3-0183-4ed6-892a-8d7bdc37c474,214972,The Assistant Deputy Speaker (Mr. Anthony Rota),,Government Orders,Cannabis Act,,"Before we go to the hon. member for Abbotsford, I want to remind the hon. members, as I know a few of them are getting antsy and making suggestion out loud, that when I say “questions and comments”, I leave it to the members to either ask a question or make comments.
The hon. member for Abbotsford.",Liberal,Nipissing—Timiskaming,Anthony Rota,http://www.parl.gc.ca/Parliamentarians/en/members/anthony-rota(214972)
4727349,ca.proc.d.2017-11-09.9780057,2017-11-09,fc9a44ff-23e0-45df-8ec4-a9cccefa71e1,234608,"Hon. Ed Fast (Abbotsford, CPC)",,Government Orders,Cannabis Act,,"Mr. Speaker, I did want to reiterate what my colleague said. We do work very well at committee and get a lot of things done, which indicates there is a lot of goodwill around the environment committee table. 
He has suggested that a significant percentage of Canadian youth already use drugs to some degree. He is right. Therefore, the member asked if this was not already a problem. Yes, it is.
This bill would make that problem much worse for the reasons I articulated. Just because there are youth who have been using it illegally, like our Prime Minister did, it does not mean it is good for them or that we should normalize its use. It means we should find new and creative ways of discouraging the use of marijuana.
The irony is that with this bill, the government's legalization of the use of marijuana will increase marijuana use amongst our youth at the same time the government is establishing a policy to communicate with youth telling them not to use marijuana. The hypocrisy is jaw dropping.",Conservative,Abbotsford,Ed Fast,http://www.parl.gc.ca/Parliamentarians/en/members/ed-fast(234608)
4727350,ca.proc.d.2017-11-09.9780082,2017-11-09,4c0122f7-7958-4cbd-b99e-9d70a4dca1e8,230115,"Mr. Pierre-Luc Dusseault (Sherbrooke, NDP)",,Government Orders,Cannabis Act,,"Mr. Speaker, I would like to thank my colleague for his speech. However, I often have difficulty understanding the Conservatives’ logic when it comes to finding solutions to problems. Often, their first reaction is to say that all the answers are in the Criminal Code. They want to criminalize everything, as though that would solve the problem.
 My other colleague even drew a parallel with cigarettes by talking about the awareness campaigns, which, statistics have shown, enabled us, over time, to reduce tobacco use without having to criminalize the toxic substance. 
 I therefore wonder why we should not use the same approach with cannabis that we used with cigarettes; in other words, legalize it and launch awareness campaigns to reduce its use. 
 Since it worked for cigarettes, why would it not work for cannabis?",New Democratic Party,Sherbrooke,Pierre-Luc Dusseault,http://www.parl.gc.ca/Parliamentarians/en/members/pierre-luc-dusseault(230115)
4727351,ca.proc.d.2017-11-09.9780100,2017-11-09,fc9a44ff-23e0-45df-8ec4-a9cccefa71e1,234608,Hon. Ed Fast,,Government Orders,Cannabis Act,,"Mr. Speaker, I will say this. The member suggested that we in the Conservative Party want to make the use of marijuana criminal. Here is a news flash: the use and selling of marijuana in Canada is illegal right now. We want to preserve the state of the law as it is. The best thing we can do, something that has been resisted by the NDP and the Liberals for time immemorial, is to come up with targeted mandatory minimum prison sentences for those who produce and sell marijuana, especially those who sell marijuana to our youth. I articulated in my speech the terrible impact that marijuana use has on the young developing brain. Therefore, we should be going after the predators who produce the stuff and sell it to our kids, rather than simply saying that we should give up and normalize it. That is a backward solution.",Conservative,Abbotsford,Ed Fast,http://www.parl.gc.ca/Parliamentarians/en/members/ed-fast(234608)
4727352,ca.proc.d.2017-11-09.9780151,2017-11-09,3838746e-29a4-4a93-8239-a2b17a3b387f,218480,"Mr. Mark Warawa (Langley—Aldergrove, CPC)",,Government Orders,Cannabis Act,,"Mr. Speaker, it is a real honour and privilege to represent my beautiful community of Langley—Aldergrove. I want to thank the member for Abbotsford for his hard work over the many years, representing his community well. He brought up many good and important points. I hope the government is listening.
 I want to congratulate the parliamentary secretary for being recognized for having spoken more words in Parliament than anyone else. What a great record. He sure talks.
The parliamentary secretary asked where the facts were coming from. If the government does not know where the facts come from, we have a problem. Maybe this is one of the reasons why Canadians are concerned with the government and why they are losing trust in it. The decisions the Liberals make are not logical.
The member for Abbotsford addressed the national issue of too many young people using marijuana. It is a problem when 21% of children use it.
I took a one-week bike training course with the RCMP. I wanted to be with RCMP members as they travelled into parks. I wanted to see how they dealt with the issue of drugs. It was being confiscated from youths because it was bad for them. The officers also took their names. Yes, it is illegal. Yes, 21% of youth using it. It is a problem. I was very proud of how they handled the situation.
 I agree with the member for Abbotsford that it should be decriminalized and that it should be a ticketable offence rather than a criminal offence. However, right now it is illegal and we have a problem. 
The government is talks about the 21% of children and 30% of young adults. Young adults are on my youth advisory board. These are bright young people who, hopefully, will be our leaders in the years to come. I did not ask what percentage of them were using cannabis. I asked them what they thought of the government's goal to have it legalized by July 1, and they all smiled. I asked if they thought the Liberals were on the right track. Almost all their hands went up and they all wanted to have input. Overwhelmingly they criticized the government. 
Young people from all political persuasions sit on the youth advisory board. I did not want just Conservatives, I wanted a full spectrum representing our community of Langley—Aldergrove. They said that the government should not be moving so fast, that it should be listening to the different police forces across Canada, and that It should be listening to health authorities across Canada, all saying that Canada was not ready for this.
The Prime Minister may have smoked some joints or been in the room where joints were being smoked while he was the leader of the opposition, which is inappropriate. However, because we can do something does not mean we should do something. The youth advisory board overwhelmingly said that the government should slow down the process. It is a problem, so it needs to educate youth on the risks associated with it. That is how we dealt with the tobacco problem, and it has been quite successful.
 Past governments maybe should have done more to address this through education. Maybe there should have been research on what the medical benefits were from marijuana, because it is a problem. The logic of the government is that we have a problem, so let us legalize it and that will solve it. 
In criminology, one can determine what somebody is likely to do by past behaviour. It is the same in psychology. It is common sense; it is logic. Therefore, why not look at what has happened in other jurisdictions that have legalizing marijuana? Did it make things better or worse? Actually, it made things way worse. The criminal connection to the distribution of pot has increased in Colorado. These are the facts and the research that has been done. 
In the years since it was legalized in Colorado, the state has seen an increase in marijuana-related traffic deaths, in poison control calls for aid, and in emergency room visits. The marijuana black market has increased in Colorado, not decreased. Numerous Colorado marijuana regulators have been indicted for corruption.
Dr. Harry Bull, superintendent of Cherry Creek Schools, said, “We were promised funds from marijuana taxes that would benefit our communities, particularly schools.” This superintendent is in charge of one of the largest school districts in the United States. He went on to say, “So far, the only thing that the legalization of marijuana has brought to our schools has been marijuana.”
I have been with the police bike unit and also in police cars. I have seen how officers professionally protect our communities, how they try to keep our communities safe in practical, realistic ways, and how they confiscate. 
The government is proposing that if somebody is driving a car with some buddies in it and there is an open bottle of alcohol in that vehicle, if the care is stopped by the police, the police can confiscate that open bottle of alcohol. However, if police officers stop a car that has four people in it and marijuana is found, every one of in the car can legally have 30 grams of marijuana, or 60 joints. That is 240 joints in total.
It is illogical to say that this is the way we will fight the problem or this how we will fight organized crime. The parliamentary secretary said that too many criminals wanted young people to use pot but the government did not. Therefore, the Liberal government is going to compete with the criminal element. The Liberals will ensure that the quality of the pot is good and people can have lots of it. The Liberals are saying that anybody aged 18 and older can have 60 joints. If it were a child, the Liberals would confiscate it. Under this legislation, children between the ages of 12 and 18 will be able to have five grams, which is 10 joints. What the government is saying is illogical. 
We should learn from others who have made mistakes. The government has proposed that we go way beyond what Colorado did. Our roads will be less safe and there will be more deaths, yet the Liberals are rushing the legislation through before there is any technology to determine drug-impaired driving. 
We just dealt with Bill C-46. How will the government get tough when somebody gets killed by a drunk driver? There will be a fine of at least $1,000 for driving drunk and killing somebody. The second offence will result in at least 10 days in jail, a 30-day sentence for killing the second time. What the government has proposed is bizarre. Our communities will be less safe. This is wrong. 
I would remind the government that just because a government can do something does not mean that it should.",Conservative,Langley—Aldergrove,Mark Warawa,http://www.parl.gc.ca/Parliamentarians/en/members/mark-warawa(218480)
4727353,ca.proc.d.2017-11-09.9780266,2017-11-09,f60ef5d8-8e71-4953-bc1b-a8ea4749a18e,235608,"Mr. Michel Picard (Montarville, Lib.)",,Government Orders,Cannabis Act,,"Mr. Speaker, I appreciate the unfortunate attempts of my colleague across the aisle to show that there is a problem by trying to explain why we need to decriminalize cannabis.
 In other words, he is telling parents and Canadians in his riding and mine, among others, that there is no problem, we will leave the profits to organized crime. We will just give offenders a small fine and reduce the penalty.
By what lack of logic can they promote the status quo? They have done nothing for 10 years, and they admit that it is a problem. By what twisted logic can they explain to parents in our ridings that we prefer to keep organized crime in charge rather than taking control as we are doing?",Liberal,Montarville,Michel Picard,http://www.parl.gc.ca/Parliamentarians/en/members/michel-picard(235608)
4727354,ca.proc.d.2017-11-09.9780278,2017-11-09,3838746e-29a4-4a93-8239-a2b17a3b387f,218480,Mr. Mark Warawa,,Government Orders,Cannabis Act,,"Mr. Speaker, the member is quite wrong to insult police chiefs and health professionals and say that is bombast. There is a problem. The solution the government is proposing and stubbornly moving ahead with is wrong. Canadians and professionals are telling the government that it is wrong, asking it to please reconsider what it is doing.
As the official opposition, we will work with the government, if it listens to Canadians, the police chiefs, and the health care professionals and does the right thing. We would support that. However, what it is doing now is foolish and wrong. ",Conservative,Langley—Aldergrove,Mark Warawa,http://www.parl.gc.ca/Parliamentarians/en/members/mark-warawa(218480)
