basepk,hid,speechdate,pid,opid,speakeroldname,speakerposition,maintopic,subtopic,subsubtopic,speechtext,speakerparty,speakerriding,speakername,speakerurl
4728184,ca.proc.d.2017-11-22.9794275,2017-11-22,3176068f-62ee-4b2f-aacd-1131201c6db1,214707,The Speaker,,,,," It being Wednesday, we will now have the singing of the national anthem led by the hon. member for Edmonton Centre.
[Members sang the national anthem] ",Liberal,Halifax West,Geoff Regan,http://www.parl.gc.ca/Parliamentarians/en/members/geoff-regan(214707)
4728185,ca.proc.d.2017-11-22.9794286,2017-11-22,9e05a099-6a0b-4fe2-9e9b-0a8b91b7807b,214054,"Ms. Monique Pauzé (Repentigny, BQ)",,Statements By Members,Climate Change,,"Mr. Speaker, everyone put their best foot forward at COP23. Everyone was a leader in the fight against climate change. Everyone promised to do more, and Canada even launched an international coalition against coal. Then, everyone went home. The government realized that phasing out coal was the right thing to do, but that is not stopping it from selling coal to the Americans.
Next, the Minister of Environment and Climate Change praised the United States' decision to green-light the Keystone XL pipeline project on the same week there was an 800,000-litre oil spill from a pipeline. There is also the Premier of Alberta who is calling on the federal government for assistance in building more new pipelines. This is the same Premier that the NDP leader says shares many of his values.
The Liberals are sticking with the strategies used by Mr. Harper, who skipped UN meetings to go eat doughnuts at Tim Hortons.
Canada is certainly not finding any solutions to climate change.",Bloc Québécois,Repentigny,Monique Pauzé,http://www.parl.gc.ca/Parliamentarians/en/members/monique-pauze(214054)
4728186,ca.proc.d.2017-11-22.9794289,2017-11-22,1405c0fa-dc85-40cd-a0a4-8640fa70fa86,229523,"Mr. Omar Alghabra (Mississauga Centre, Lib.)",,Statements By Members,Mississauga Poet Laureate,,"Mr. Speaker, last May, Mississauga got a new poet laureate. Wali Shah, a 22-year-old UTM student, has a remarkable story. He arrived in Canada, with his family, from Pakistan when he was three years old. He had turbulent teen years. When he was 15, he faced assault charges and jail time, but because of his mother and teachers, he turned his life around. Today he is a TEDx speaker and an eloquent voice on mental health issues and anti-bullying.
In 2013, Wali released his first hip hop album, entitled “Rhythm &amp; Poetry”. In 2014, he was named one of Canada's top 20 under 20. Today his words inspire, motivate, and help thousands. 
I congratulate Wali on his awesome appointment. This is an appropriate time to quote Wali's words back to him: “Seize the day, make it your moment...you're the king of the castle.” ",Liberal,Mississauga Centre,Omar Alghabra,http://www.parl.gc.ca/Parliamentarians/en/members/omar-alghabra(229523)
4728187,ca.proc.d.2017-11-22.9794292,2017-11-22,6e88c64b-66df-4989-84da-2a037744909c,218596,"Mr. Jamie Schmale (Haliburton—Kawartha Lakes—Brock, CPC)",,Statements By Members,Missing Persons,,"Mr. Speaker, I rise to speak to a matter of deep concern for the tens of thousands of families who each year experience the most horrific of circumstances, that of finding a loved one missing. Anyone who has experienced the tragic loss of a family member or close friend will tell us that closure is an important part of the healing process, but for so many Canadian families with missing loved ones, this process cannot even begin. Canada has many national days of observance, but we do not have a national missing person's day.
The latest RCMP numbers suggest that approximately 71,000 people went missing in 2015 alone.
 At the request of the Boyle sisters, from Scarborough, Ontario, whose brother Jay went missing in 1995, at the age of 17, I was honoured to sponsor a petition calling on the Government of Canada to enact a national day of solidarity and remembrance, a day for action to prevent this tragedy from happening to another family. I urge all Canadians to support the petition for a national missing person's day, which can be found at petitions.ourcommons.ca.",Conservative,Haliburton—Kawartha Lakes—Brock,Jamie Schmale,http://www.parl.gc.ca/Parliamentarians/en/members/jamie-schmale(218596)
4728188,ca.proc.d.2017-11-22.9794296,2017-11-22,330c0119-cf49-4e85-9407-539367825c2b,234610,"Mr. Chris Bittle (St. Catharines, Lib.)",,Statements By Members,Vimy Ridge Oak,,"Mr. Speaker, last week I was pleased to join Principal Gretsinger and the students and staff of Oakridge Public School to plant an English oak sapling. However, this was no ordinary oak sapling. As Callie Germain, an Oakridge student, noted, the Battle of Vimy Ridge was a significant moment in our collective history, a defining moment for Canada. One hundred years ago, that battle left Vimy Ridge a barren wasteland. Of the many oaks that once stood tall, only one remained. Lieutenant Leslie Miller, of the Canadian Expeditionary Force, found the acorns from that remaining tree and brought them home to Canada. The sapling we planted in St. Catharines is a direct descendant of that remaining oak.
It was my pleasure to personally donate one of the remaining saplings to Oakridge. Its location holds personal significance for me, as my son Ethan will one day attend Oakridge Public School. My hope is that this tree grows tall and serves as a monument for the students of Oakridge and the residents of St. Catharines to remind them of the tremendous sacrifice given by so many in service to St. Catharines and to Canada.",Liberal,St. Catharines,Chris Bittle,http://www.parl.gc.ca/Parliamentarians/en/members/chris-bittle(234610)
4728189,ca.proc.d.2017-11-22.9794299,2017-11-22,551183c2-2f3e-41ba-8660-2d194cf60169,213985,"Hon. Thomas Mulcair (Outremont, NDP)",,Statements By Members,Rohingya,,"Mr. Speaker, years of persecution, fuelled by anti-Muslim hatred, have exploded into an lslamophobic, government-led pogrom against the Rohingya in Myanmar. 
I had occasion to meet with special envoy Bob Rae during the recent Commonwealth parliamentary assizes in neighbouring Bangladesh. His remarks were chilling. The Canadian delegation there played a major role in getting the CPA to take the uncharacteristic step of adopting a strongly worded statement on the Rohingya, one that referred to genocide. 
At the end of the Second World War, when the horrifying magnitude of the holocaust was revealed, the whole world swore to never forget, to be vigilant, lest hatred once again give rise to state-sponsored murder on a massive scale.
On the very day when the butcher of the Balkans has been sentenced to life in prison for genocide, Canada must do everything we can to ensure that the butchers of Burma suffer a similar fate.",New Democratic Party,Outremont,Thomas Mulcair,http://www.parl.gc.ca/Parliamentarians/en/members/thomas-mulcair(213985)
4728190,ca.proc.d.2017-11-22.9794302,2017-11-22,3106c3be-f49e-4c55-9d12-fb6441875251,219988,"Mr. Randeep Sarai (Surrey Centre, Lib.)",,Statements By Members,Sukhi Thind and Doug Nickerson,,"Mr. Speaker, I would like to commemorate two inspiring residents of my riding who recently passed away.
First, I would like to commemorate Sukhi Thind, who passed away unexpectedly on September 8. Sukhi was a political activist for the Prof. Mohan Singh Memorial Foundation. She fought long and hard to bring recognition of the victims of the Komagata Maru incident, including an official apology from the Government of Canada. In doing so, she performed a great service to the South Asian community and to Canadians as a whole.
Surrey Centre also lost Doug Nickerson, the guardian angel of the Surrey strip. Little Doug, as he was known to his friends, protected some of the most vulnerable people in our society by racing around 135A Street, on his bicycle, administering naloxone to those overdosing on opioids. In total, Little Doug saved an incredible 148 lives.
People like Sukhi Thind and Doug Nickerson make Surrey a better place to call home.",Liberal,Surrey Centre,Randeep Sarai,http://www.parl.gc.ca/Parliamentarians/en/members/randeep-sarai(219988)
4728191,ca.proc.d.2017-11-22.9794307,2017-11-22,a5da7604-b429-46d1-b702-0e3be1febcec,218570,"Mr. Bob Saroya (Markham—Unionville, CPC)",,Statements By Members,CIK Telecom,,"Mr. Speaker, last week I visited a telecommunications firm in Markham. The name of the company is CIK Telecom. CIK stands for “customer is king”. It is a small telecommunications provider.
 CIK Telecom is the story of the Canadian dream. In 2003, Mr. Deng and Mr. Jin started ClK in their basement. Today it has grown to over 400 employees, and it recently celebrated its 14th anniversary. 
Without the efforts of entrepreneurs like Mr. Deng and Mr. Jin, Canada would not be what it is today. I am glad to see that a competitive company, with five-star services and two-star pricing, was able to be successful. 
While the finance minister accuses small business owners of being tax cheats, we in the Conservative caucus will continue to stand up for small business owners and the people who work for them. I am proud to have growing businesses in my riding that are creating jobs and prosperity.",Conservative,Markham—Unionville,Bob Saroya,http://www.parl.gc.ca/Parliamentarians/en/members/bob-saroya(218570)
4728192,ca.proc.d.2017-11-22.9794310,2017-11-22,bc4bee2d-993a-4485-a436-4b45cb6553da,219888,"Ms. Yvonne Jones (Labrador, Lib.)",,Statements By Members,Labradorians of Distinction,,"Mr. Speaker, I am proud today to rise to pay tribute to the 150 extraordinary Labradorians who were honoured this past week across Labrador. In celebration of Canada 150, I launched the Labradorians of Distinction awards as a way to acknowledge the contributions of Labradorians to their communities. Through an independent process, Labradorians were nominated and selected, and 150 incredible people, both living and deceased, were honoured for their contributions to our culture, history, economy, and environment.
A diverse culture of indigenous peoples and settlers from around the world make up Labrador. When I think of these people who have moulded our great home, I see only the faces of hard-working, resilient, creative, and genuine people. From the people who walked the land in moccasins to those who came in uniform to serve, from those who sailed the Labrador Sea to those who dug the first iron ore, and from those who harpooned their food from the ice to those who opened their first modern facilities, we—",Liberal,Labrador,Yvonne Jones,http://www.parl.gc.ca/Parliamentarians/en/members/yvonne-jones(219888)
4728193,ca.proc.d.2017-11-22.9794312,2017-11-22,3176068f-62ee-4b2f-aacd-1131201c6db1,214707,The Speaker,,Statements By Members,Labradorians of Distinction,,The hon. member for Vimy.,Liberal,Halifax West,Geoff Regan,http://www.parl.gc.ca/Parliamentarians/en/members/geoff-regan(214707)
4728194,ca.proc.d.2017-11-22.9794314,2017-11-22,04c68597-7211-414e-b0f0-da12d212bd3f,234530,"Mrs. Eva Nassif (Vimy, Lib.)",,Statements By Members,74th Anniversary of Lebanese Independence,,"Mr. Speaker, it is an honour for me to rise in recognition of the 74th anniversary of Lebanese independence.
This is the second time I have had the pleasure to rise in this chamber to bring attention to the proud people of Lebanon, who celebrate their independence on November 22. This is a day defined by happiness, autonomy, and the progress of a people whose history goes back thousands of years.
Despite rising tensions, the people are unflinching. Like a phoenix, the Lebanese people have survived decades of political turbulence. Today, November 22, I hope everyone will join me in wishing the people of Lebanon a happy independence day and a swift return to peace and prosperity.
[Member spoke in Arabic]",Liberal,Vimy,Eva Nassif,http://www.parl.gc.ca/Parliamentarians/en/members/eva-nassif(234530)
4728195,ca.proc.d.2017-11-22.9794317,2017-11-22,68bad047-6aec-43e2-b870-7bc501110873,234415,"Mr. Ziad Aboultaif (Edmonton Manning, CPC)",,Statements By Members,Lebanon,,"Mr. Speaker, today marks the 74th anniversary of the independence of Lebanon. Lebanese people are multi-talented, with many achievements of which they should be proud.
 Today, as we celebrate 74 years of independence, my message to all Canadians of Lebanese origin is for them to celebrate their love for Canada as much as they celebrate their love for Lebanon; celebrate their entrepreneurial spirit as their ability to contribute to the diversity that we enjoy in the country, welcoming people to practise their religion and beliefs free of persecution; and celebrate our flourishing democracy, as all countries should be independent of interference from regional involvement.
I invite all members to join the Canada-Lebanon Parliamentary Friendship Group this evening for a celebration of Lebanon independence in the Sir John A. Macdonald Building.",Conservative,Edmonton Manning,Ziad Aboultaif,http://www.parl.gc.ca/Parliamentarians/en/members/ziad-aboultaif(234415)
4728196,ca.proc.d.2017-11-22.9794320,2017-11-22,ea3bdfb2-c01b-4b31-937f-51fafc045172,214023,"Mr. Fayçal El-Khoury (Laval—Les Îles, Lib.)",,Statements By Members,Lebanon's 74th Anniversary,,"Mr. Speaker, today being Lebanon's 74th anniversary, I wish Lebanese people around the world, and especially Lebanese Canadians, a happy national holiday.
The Lebanese community, the largest Arab Canadian community, is making a remarkable and growing contribution to Canadian heritage. The Lebanese, most of whom have chosen the province of Quebec as their home, are not only bilingual, they are also a diverse group, comprising of 18 religious denominations. They are active in politics, science, medicine, music, and the economy.
 Through this diversity, the Lebanese community reinforces the fundamental values of the charter of Canada. 
I hope that Lebanon will find the best possible ways to maintain peace within its borders.
Once again, I wish all of the Lebanese people and all Lebanese Canadians a happy national holiday. ",Liberal,Laval—Les Îles,Fayçal El-Khoury,http://www.parl.gc.ca/Parliamentarians/en/members/faycal-el-khoury(214023)
4728197,ca.proc.d.2017-11-22.9794323,2017-11-22,3a81a21a-bec2-40b4-aae5-d554237ba474,234508,"Ms. Anita Vandenbeld (Ottawa West—Nepean, Lib.)",,Statements By Members,President of the Republic of Kosovo,,"Mr. Speaker, it is my honour today to welcome to Canada the President of the Republic of Kosovo, Hashim Thaçi.
This week, accompanied by members from the House, the president laid flowers at Canada's Peacekeeping Monument to thank Canada for our contributions to bringing peace to Kosovo during and after the brutal conflict there, and for accepting thousands of refugees from Kosovo 18 years ago. Those former asylum seekers are now leaders in Canada in business, culture, sport, and so many areas. 
I had the privilege of living and working in Kosovo 10 years ago as an adviser to its Parliament, and it is impressive to see how far Kosovo has come in developing pluralistic, multi-ethnic, inclusive democratic institutions, including strong gender representation and a modern, professional public service. It is a country with a young; educated population; natural resources; and a progressive, outward-looking attitude. 
I look forward to this visit deepening the ties of friendship between our two countries.",Liberal,Ottawa West—Nepean,Anita Vandenbeld,http://www.parl.gc.ca/Parliamentarians/en/members/anita-vandenbeld(234508)
4728198,ca.proc.d.2017-11-22.9794326,2017-11-22,9f0040ba-a9d7-4aa4-b2e4-f3213a4e024f,217922,"Hon. Deepak Obhrai (Calgary Forest Lawn, CPC)",,Statements By Members,Zimbabwe,,"Mr. Speaker, for Zimbabwe and Africa, the resignation of Robert Mugabe is excellent news.
 Having been born in Africa, I witnessed the winds of change blowing. At independence for the people of Zimbabwe, a new era of hope and prosperity was in the offing, but Mugabe's subsequent abuses of human rights and crimes turned those hopes around quickly into an dictatorial regime, drowning in poverty. 
I met with the official opposition leader, Morgan Tsvangirai, when he visited Canada and discussed extensively our shared hopes for a democratic future for Zimbabwe. It has been a long journey but today that hope has returned.
 We will support the people of Zimbabwe in the bright future ahead of them. Good luck to Zimbabweans.",Conservative,Calgary Forest Lawn,Deepak Obhrai,http://www.parl.gc.ca/Parliamentarians/en/members/deepak-obhrai(217922)
4728199,ca.proc.d.2017-11-22.9794329,2017-11-22,014bf6ed-9176-4fbd-8f35-48bb8c579ff0,234768,"Mr. Robert Oliphant (Don Valley West, Lib.)",,Statements By Members,Attack in Mubi,,"Mr. Speaker, I rise today to express my deepest condolences to the people of Nigeria following the terrible attack yesterday in the Mubi, Adamawa state.
 Nigeria has been facing multiple threats to its peace and security in recent years. As a United Church minister, it is appalling for me that this attack happened in a place of worship where people should feel safe.
 As co-chair of the Canada-Africa Parliamentary Association, I know of the important relationship between Canada and Nigeria, but this tragedy should serve to draw us even closer. Today, we stand in solidarity with the people of Nigeria, especially those injured and their loved ones. We extend our deepest condolences to the families of the victims of this heinous crime. An injury to one is an injury to all.
 Today, more than ever, we must work together to support a more peaceful future, free of hatred and violence here and around the world.",Liberal,Don Valley West,Rob Oliphant,http://www.parl.gc.ca/Parliamentarians/en/members/rob-oliphant(234768)
4728200,ca.proc.d.2017-11-22.9794333,2017-11-22,363e30d6-e47b-4c39-91ad-667deb63009c,219399,"Ms. Sheila Malcolmson (Nanaimo—Ladysmith, NDP)",,Statements By Members,Abandoned Vessels,,"Mr. Speaker, for decades, jurisdictional gaps have left coastal communities with nowhere to turn when they need help cleaning up abandoned vessels. Oil spills and marine debris from thousands of vessels pollute our waterways and put local fishing and tourism jobs at risk. This is the 83rd time I have raised this. 
Fifteen years of coastal community solutions are built into our legislation to fix vessel registration, deal with the backlog, support good green jobs and recycling, and end the run around by making the Coast Guard the first responder and resourcing it.
However, on November 9, the Liberals blocked debate on my bill, an unprecedented interference. This week I will appeal so that coastal voices are heard. The government's new legislation and my bill would complement each other and, with the public's help, both could proceed. 
I ask Canadians to please ask their MP to vote yes in next week's first-time and historic secret ballot vote to have Bill C-352 be votable, and to hear coastal community voices.",New Democratic Party,Nanaimo—Ladysmith,Sheila Malcolmson,http://www.parl.gc.ca/Parliamentarians/en/members/sheila-malcolmson(219399)
4728201,ca.proc.d.2017-11-22.9794337,2017-11-22,9225dd6b-e672-44d5-8bb7-c634b7e72f2e,217441,"Hon. Michelle Rempel (Calgary Nose Hill, CPC)",,Statements By Members,Grey Cup,,"Mr. Speaker, this Sunday, one team will take home the Grey Cup. It is very apparent that the Calgary Stampeders is the team that is on its way up.
 The cup is contested between the east and west winners of the CFL, but this year I think it is clear which team is truly the best. 
The Stamps know that this weekend they can win it all. Unlike the federal deficit, the Argos are sure to fall.
 We have Bo Levi Mitchell, a killer quarterback. There is absolutely no way that his mad skills will lack. Then there is the work of punter Rob Maver who will surely keep the Stampeders on their best behaviour. As well, Coach Dave Dickenson has been called the smartest in the league, even if the Argo's Marc Trestman finds that hard to believe.
On Sunday, we will proudly sing “Ye Men of Calgary”. We are looking forward to the match of the century, so giddy up, Argos. We are cheering on our Stamps. With a great big yahoo, they are sure to be Grey Cup champions.",Conservative,Calgary Nose Hill,Michelle Rempel,http://www.parl.gc.ca/Parliamentarians/en/members/michelle-rempel(217441)
4728202,ca.proc.d.2017-11-22.9794340,2017-11-22,86fed1de-3861-4448-8242-ad414073ef2e,229525,"Ms. Joyce Murray (Vancouver Quadra, Lib.)",,Statements By Members,National Housing Day,,"Mr. Speaker, today we recognize National Housing Day. Safe and affordable housing is central to our lives, our health, and our families. It is essential to vibrant communities and a strong middle class.
 Vancouverites from all walks of life face housing challenges. Our most vulnerable citizens sleep on the streets, seniors and single parents cannot afford rising rents, and the next generation is giving up on home ownership or moving away.
When our new government was appointed two years ago, my first priority was to ensure that the ministers and the Prime Minister were well informed and prepared to act on housing access and affordability challenges in Vancouver and beyond. 
I am proud to celebrate today's announcement of Canada's first-ever national housing strategy, which comes with historic levels of investment. By listening to local residents, by partnering with housing advocates and all levels of government, we are thinking nationally and acting locally.",Liberal,Vancouver Quadra,Joyce Murray,http://www.parl.gc.ca/Parliamentarians/en/members/joyce-murray(229525)
4728203,ca.proc.d.2017-11-22.9794344,2017-11-22,3176068f-62ee-4b2f-aacd-1131201c6db1,214707,The Speaker,,Routine Proceedings,New Member,,"I have the honour to inform the House that the Clerk of the House has received from the Acting Chief Electoral Officer a certificate of the election and return of Mr. Dane Lloyd, member for the electoral district of Sturgeon River—Parkland.",Liberal,Halifax West,Geoff Regan,http://www.parl.gc.ca/Parliamentarians/en/members/geoff-regan(214707)
4728204,ca.proc.d.2017-11-22.p5146800,2017-11-22,,,,stagedirection,Routine Proceedings,New Member Introduced,,"Mr. Dane Lloyd, member for Sturgeon River–Parkland, introduced by Hon. Andrew Scheer and Mr. Gordon Brown.",,,,
4728205,ca.proc.d.2017-11-22.9794353,2017-11-22,6519cfba-0080-419d-baa9-8ae6e56d032f,232946,"Hon. Andrew Scheer (Leader of the Opposition, CPC)",,Oral Questions,Post-Secondary Education,,"Mr. Speaker, will the Prime Minister join me in condemning the egregious crackdown on free speech at Wilfrid Laurier University? ",Conservative,Regina—Qu'Appelle,Andrew Scheer,http://www.parl.gc.ca/Parliamentarians/en/members/andrew-scheer(232946)
4728206,ca.proc.d.2017-11-22.9794356,2017-11-22,c5378648-5d94-4645-bc05-339090e1077b,214338,"Hon. Kirsty Duncan (Minister of Science, Lib.)",,Oral Questions,Post-Secondary Education,,"Mr. Speaker, our government is committed to creating open spaces for Canadians to debate and express their views. In a free society, we may disagree with someone's views, but we must defend their right to hold them, unless those views promote hate. Intolerance and hate have no place in Canadian society or in our post-secondary institutions. We will continue to fight to ensure that the charter rights of Canadians are upheld and that every Canadian can feel safe and secure in their community.",Liberal,Etobicoke North,Kirsty Duncan,http://www.parl.gc.ca/Parliamentarians/en/members/kirsty-duncan(214338)
4728207,ca.proc.d.2017-11-22.9794359,2017-11-22,6519cfba-0080-419d-baa9-8ae6e56d032f,232946,"Hon. Andrew Scheer (Leader of the Opposition, CPC)",,Oral Questions,Ethics,,"Mr. Speaker, I do not know why the Prime Minister cannot just simply denounce what happened at the university.
The Prime Minister defends and protects hidden companies in France, shares that go up in accordance with the Liberals' decisions, and a bill that could result in personal gains. The Minister of Finance still controls many numbered companies we know nothing about.
When will the Prime Minister order the Minister of Finance to disclose all the shares he bought, sold, or held in all of these private companies or trust funds since he was elected?",Conservative,Regina—Qu'Appelle,Andrew Scheer,http://www.parl.gc.ca/Parliamentarians/en/members/andrew-scheer(232946)
4728208,ca.proc.d.2017-11-22.9794361,2017-11-22,5d3dfa7b-f157-4019-ac2a-4dab0cb15f92,213961,"Hon. Bill Morneau (Minister of Finance, Lib.)",,Oral Questions,Ethics,,"Mr. Speaker, on behalf of everyone in this House, I would like to start by wishing you a happy birthday.
[Members sang Happy Birthday]",Liberal,Toronto Centre,Bill Morneau,http://www.parl.gc.ca/Parliamentarians/en/members/bill-morneau(213961)
4728209,ca.proc.d.2017-11-22.p5146808,2017-11-22,,,,intervention,Oral Questions,Ethics,," Order, order.",,,Some hon. members,
4728210,ca.proc.d.2017-11-22.9794363,2017-11-22,3176068f-62ee-4b2f-aacd-1131201c6db1,214707,The Speaker,,Oral Questions,Ethics,,"Exactly, order. Some things do make the House very difficult to control.
The hon. Minister of Finance has the floor.",Liberal,Halifax West,Geoff Regan,http://www.parl.gc.ca/Parliamentarians/en/members/geoff-regan(214707)
