basepk,hid,speechdate,pid,opid,speakeroldname,speakerposition,maintopic,subtopic,subsubtopic,speechtext,speakerparty,speakerriding,speakername,speakerurl
4728336,ca.proc.d.2017-11-22.9795084,2017-11-22,6dfe3b54-024b-432d-bc01-7f89da30b7cd,217523,"Mr. Dave Van Kesteren (Chatham-Kent—Leamington, CPC)",,Government Orders,Cannabis Act,,"Mr. Speaker, throughout the debate at second reading, through committee hearings, and now finally, in the final debate, mounds and mounds of evidence have been introduced and cited, painting a grim picture of the consequences of the government's determination to legalize marijuana for recreational purposes.
Still, the Liberal government is bound and determined to ram this legislation through, so that by July 1, 2018, Canada's 151st birthday, youth as young as 18 will be able to legally purchase marijuana from government outlets, and use this drug with virtually no restrictions.
I have been allotted 20 minutes to present my objections to this harmful legislation, but would need hours to present all the evidence presented by doctors, psychiatrists, researchers, police, parents, and a host of specialists warning the government not to go down this road, and of the serious consequences if it does.
I will instead focus on a few articles and studies, and ask the members across the floor, how can they can justify their actions, having had prior knowledge to these?
I hold in my hand mandate letters from the Prime Minister to ministers on expectations and deliveries. I will be using them in my presentation to point out just how this action by the Prime Minister has been broken by his ministers.
The Prime Minister presented all ministers with these mandate letters after the last election. 
The mandate letter to the Minister of Health reads:
 I expect you to work closely with your Deputy Minister and his or her senior officials to ensure that the ongoing work of your department is undertaken in a professional manner and that decisions are made in the public interest. 
I wonder if the minister, at that point, informed the Prime Minister about this document from her own department, modified on August 19, 2016. I am sure she was aware of it. This document, among other things, states:
 Using cannabis or any cannabis product can impair your concentration, your ability to think and make decisions, and your reaction time and coordination. This can affect your motor skills, including your ability to drive. It can also increase anxiety and cause panic attacks, and in some cases cause paranoia and hallucinations. 
It further states:
 Cannabis should not be used if you: 
 are under the age of 25; 
 are allergic to any cannabinoid or to smoke; 
 have serious liver, kidney, heart or lung disease; 
 have a personal or family history of serious mental disorders such as schizophrenia, psychosis, depression, or bipolar disorder; 
 are pregnant, are planning to get pregnant, or are breast-feeding; 
 are a man who wishes to start a family; 
 have a history of alcohol or drug abuse or substance dependence. 
A list of health outcomes regulated to the short and long-term use include the following:
 increase the risk of triggering or aggravating psychiatric and/or mood disorders (schizophrenia, psychosis, anxiety, depression, bipolar disorder); 
 decrease sperm count, concentration and motility, and increase abnormal sperm morphology; 
 negatively impact the behavioural and cognitive development of children born to mothers who used cannabis during pregnancy. 
This document was available to the minister. It clearly shows that in reaction to that, she is breaking what the Prime Minister instructed her to do. I am going to read another that the Prime Minister has written: 
 No relationship is more important to Canada than the relationship with Indigenous Peoples. 
That was to the Minister of Indigenous Services in the opening statement. Why did the minister not sound the alarm and give the Prime Minister the message that she received from President Aluki Kotierk of the Nunavut Tunngavik? She said:
 The federal government needs to consult with Inuit on whether cannabis should be legalized and, if so, when, as well as plan to deal with the possible negative impacts of legalizing cannabis... 
It goes on. Chief Gina Deer of the Mohawk Council of Kanawakee stated:
 Our community has been zero tolerance for many years on drugs. Now when you tell them that we have to accept marijuana as a legal product and not as a drug, it’s hard to accept, especially for elders. 
The Prime Minister further stated to the Minister of Crown-Indigineous Relations:
 I expect you to re-engage in a renewed nation-to-nation process with Indigenous Peoples to make real progress on the issues most important to First Nations, the Métis Nation, and Inuit communities--issues like housing, employment, health and mental health care... 
This is what Chief Isadore Day stated in testimony at committee:
 It's accurate to say that first nations are also not prepared to deal with the ramifications of Bill C-45. Does Canada even know the full impacts of cannabis yet? When the states of Colorado and Washington legalized cannabis sales in 2013, American Indian tribes were negatively impacted. 
Further, Chief Day also stated at committee that despite hearing this, the Liberals continue to reaffirm that it's important that we focus on getting this job done as quickly as we are able.
The chief reiterated that one of the biggest concerns that first nations have with Bill C-45  is the health and safety of our people. He cited statistics that cannabis is the second most abused substance among indigenous people. He added that in Ontario alone, $33 million is needed to treat first nations with drug and alcohol addictions. He concluded by stating that there appears to be more questions than answers. This leaves the first nations in a compromising state, leading to an accelerated timeline.
The Prime Minister also said to the minister:
 Work with the Minister of Public Safety and Emergency Preparedness and the Minister of Indigenous and Northern Affairs to address gaps in services to Aboriginal people and those with mental illness throughout the criminal justice system. 
She should have told him about the health report that I mentioned previously, and the concerns that his own government had with the legalization and usage of marijuana.
 Health Canada stated warnings, and I have mentioned some, but it serves to mention these as well:
 Cannabis contains hundreds of substances, some of which can affect the proper functioning of the brain and central nervous system. The use of this product involves risks to health, some of which may not be known or fully understood. Cannabis should not be used if you have a personal or family history of serious mental disorders such as schizophrenia... 
The Prime Minister loves to point out to the Minister of Justice, who just spoke, his great love and respect for the charter. In his mandate to the minister he stated:
 You are expected to ensure that the rights of Canadians are protected, that our work demonstrates the greatest possible commitment to respecting the Charter of Rights and Freedoms. 
A child advocate group in New Brunswick has done an assessment of violations to the rights of the child treaty, and has a very serious concern that this legislation is going to see legal challenges. I wonder if the minister should have told the Prime Minister that a court challenge, which is what it has stated, is a good idea under the Canadian Charter of Rights and Freedoms. Section 7 states:
 Everyone has the right to life, liberty and security of the person and the right not to be deprived thereof except in accordance with the principles of fundamental justice. 
The minister should have warned him that by legalizing marijuana, a drug with psychoactive properties, the Government of Canada will encourage the sale and consumption of marijuana, thereby putting all Canadians at greater risk of encountering harm and death through impaired driving accidents and workplace accidents, smoking-related sicknesses, and other marijuana-induced injuries. For example, police chiefs across the country have expressed their concern that they will not be able to keep the public safe from drugged drivers. Thus, the proposal to legalize marijuana runs contrary to the charter provision, the right to the security of the person.
To the Minister of Public Safety and Emergency Preparedness, he wrote:
 As Minister...your overarching goal will be to lead our government’s work in ensuring that we are keeping Canadians safe. 
Here again, I would raise the report from the health department, but I would also make mention of a report that has just come out, “The Legalization of Marijuana in Colorado: The Impact”. The executive summary states, “Marijuana-related traffic deaths when a driver was positive for marijuana more than doubled from 55 deaths in 2013 to 123 deaths in 2016.” This same executive summary states, “In 2009, Colorado marijuana-related traffic deaths involving drivers testing positive for marijuana represented 9 percent of the traffic deaths. By 2016, that number has more than doubled to 20 percent.” It goes on, and there are statistics that talk about what happens to the youth and how youth use has risen dramatically as well.
This might be my favourite. The Prime Minister wrote to the Minister of Science, the same minister who has repeatedly, in this House, stood up and said that the current government will listen to science, because the Prime Minister told her this: 
 We are a government that believes in science – and a government that believes that good scientific knowledge should inform decision-making. 
I wonder if that minister told the Prime Minister about the report on the legalization of marijuana in Colorado, or possibly this report from the National Institute on Drug Abuse. Here is a great one she should have read, from Frontiers in Psychiatry: “Persistency of Cannabis Use Predicts Violence following Acute Psychiatric Discharge”. There is this lengthy report from the World Health Organization: “The Health and Social Effects of Nonmedical Cannabis Use”. 
It goes on and on. I am sure the minister read the “Market Analysis of Plant-based Drugs C. The Cannabis Market”, from the United Nations Office on Drugs and Crime.
 Every one of these reports points to the same conclusion: the use of cannabis is restricted for a reason. There is a reason governments have, on a continual basis, made that their practice.
I have often stated in this House that I am genuinely impressed by the Liberal caucus. It is full of doctors and lawyers and Ph.D.s and Rhodes scholars. This is not a group of people who could be excused for not having the information.
 I found a great article by James Di Fiore, written in the Huffington Post. He wrote:
 I've written about my modest contribution to the elimination of pot prohibition before. To recap, in 2011 I was hired by the Liberal Party of Canada's upper brass to pressure their delegates to vote yes on a policy initiative that would push for legalization. For three months, my team approached marijuana advocacy groups and rallied their members to bombard [all] delegates via email, tweets and Facebook messages. The plan was to put enough pressure on delegates until they voted for a Canada who would shed its draconian views on weed. When we started, just 30 per cent of delegates [30 per cent of that caucus] were in [the] camp. After the votes were tallied at the Liberals' 2012 convention, more than 75 per cent of delegates voted yes. 
This group can make the right choice. I know that there are many in the Liberal caucus who are opposed to what the government is doing and what the Prime Minister is forcing them to do as well. Now is the time for them to stand up, make the right choice, and vote against this dangerous bill. 
I might add that the Prime Minister is not leading a bold charge that will make this an example of progressive nations. Let us listen to what Prime Minister Mark Rutte, of the Netherlands, said, in a 2014 article about the use of marijuana. “People should do with their own bodies whatever they please, as long as they are well informed about what that junk does to them”. The Dutch have a different approach to the whole idea of marijuana. 
The article went on, “Rutte added in the same interview that cannabis legalization of the Colorado model”, and I should emphasize that the Colorado model is for those 21 years old and over, “where the state taxes and regulates all levels of the supply chain, and adults 21 and over are allowed to purchase weed from state-licensed stores—was out of the question. 'If we were to do that, ' he said, 'we'd be the laughing stock of Europe.'” 
This not going to be a progressive move by the Prime Minister and the Liberal caucus. As a matter of fact, while the Dutch system has some major drawbacks, current UN treaties forbid countries to legalize and regulate drugs for recreational use. Specifically, the Single Convention on Narcotic Drugs,1961, states that member states have a general obligation “to limit exclusively to medical and scientific purposes the production, manufacture, export, import, distribution of, trade in, use and possession of drugs.” 
Piet Hein van Kempen, a professor of criminal law and criminal procedure in the Netherlands, was recently asked by the justice ministry to study whether international drug treaties offer any wiggle room to legalize, decriminalize, tolerate, or regulate cannabis in any other way for recreational use. His answer was an emphatic no. Maybe when the Prime Minister gets to meet his new best friend, Xi Jinping, he can tell him about his plans to legalize marijuana and ask for his thoughts. I am sure he would give the Prime Minister a history lesson on what took place in Chinese society.
The Liberals are on track to legalize marijuana for recreational purposes by July 1, 2018. They say they have had extensive consultations, conducted the largest online survey, and completed a report called “A Framework for the Legalization and Regulation of Cannabis in Canada”. The Liberals say they have consulted with Canadians; provincial, territorial, and municipal governments; indigenous governments; representatives of organizations; youth; parents; and experts in relevant fields. Ignoring the warnings of doctors, police chiefs, and first nations parents, they have pushed this bill rapidly through the House. 
This bill would drastically change Canadian society, the full ramifications felt for years to come. They say it will protect us and take marijuana out of the hands of criminals. I suggest it would enslave our youth and make the government the new pusher on the block.
I move:
 That the motion be amended by deleting all the words after the word “That” and substituting the following: “Bill C-45, An Act respecting cannabis and to amend the Controlled Drugs and Substances Act, the Criminal Code and other Acts, be not now read a third time, but be referred back to the Standing Committee on Health for the purpose of reconsidering clause 226 with the view to establish a coming into force date that complies with the wishes of those provinces, territories, municipalities, law enforcement officials and first nation groups who require more time to prepare for the legalization of cannabis.” 
",Conservative,Chatham-Kent—Leamington,Dave Van Kesteren,http://www.parl.gc.ca/Parliamentarians/en/members/dave-van-kesteren(217523)
4728337,ca.proc.d.2017-11-22.9795457,2017-11-22,16c839d3-0183-4ed6-892a-8d7bdc37c474,214972,The Assistant Deputy Speaker (Mr. Anthony Rota),,Government Orders,Cannabis Act,,"The amendment seems to be in order.
Questions and comments.",Liberal,Nipissing—Timiskaming,Anthony Rota,http://www.parl.gc.ca/Parliamentarians/en/members/anthony-rota(214972)
4728338,ca.proc.d.2017-11-22.9795470,2017-11-22,0e1edc18-5616-4f5c-b9bd-535059ec8040,234561,"Mr. Bill Blair (Parliamentary Secretary to the Minister of Justice and Attorney General of Canada and to the Minister of Health, Lib.)",,Government Orders,Cannabis Act,,"Mr. Speaker, I would like to acknowledge the remarks made by my colleague from Chatham-Kent—Leamington, and I want to bring some clarification to one of the remarks he made. I listened very carefully, and he said that police chiefs, in the plural, but unnamed, did not support the effort or believe that we were going to bring forward adequate measures to deal with impaired driving.
I want to quote the testimony of Chief Mario Harel, the elected president of the Canadian Association of Chiefs of Police, who appeared before the justice committee on Bill C-46. He said:
 We certainly commend the government for its commitment to consultation of stakeholders and the public. We commend the efforts of ministers, all parliamentarians, and public servants at Public Safety, Justice, and Health Canada who are dedicated to bringing forward the best legislation possible. All share with us the desire to do this right, knowing that the world is watching. 
 The government has put forward strong legislation not only focused on impairment by drugs but also addressing ongoing issues related to alcohol impairment. 
He went on to say:
 Steps that have been introduced to reform the entire impaired driving scheme are seen as much needed and very positive. The CACP has called for such changes in the past, specifically in support of modernizing the driving provision of the Criminal Code, supporting mandatory alcohol screening, and eliminating common loophole defences. Tough new impairment driving penalties introduced in this legislation are strongly supported by the CACP. 
This, of course, includes all the chiefs in Canada. Finally, he said:
 We also acknowledge funding announced recently to support law enforcement for cannabis and drug-impaired driving. The government has been listening. 
In light of this testimony from the head of the Canadian Association of Chiefs of Police, would the member like to comment on his earlier remark with respect to an unnamed chief offering some other opinion?",Liberal,Scarborough Southwest,Bill Blair,http://www.parl.gc.ca/Parliamentarians/en/members/bill-blair(234561)
4728339,ca.proc.d.2017-11-22.9795519,2017-11-22,6dfe3b54-024b-432d-bc01-7f89da30b7cd,217523,Mr. Dave Van Kesteren,,Government Orders,Cannabis Act,,"Mr. Speaker, I want to say that I respect the member's office, and I thank him for his service for years as a police chief. He knows that I have three sons who serve in the police department, and as such, I have had much contact with the police force. 
My colleague has passed me some information. I am not going to read that. The truth of the matter is that my eyesight is not good enough. 
 I do know that there is not a consensus among police chiefs. When we talk about Bill C-46 being the act to strengthen the Criminal Code in respect of driving, those steps are necessary and police chiefs would certainly agree with that, but I also know that police chiefs, police officers, and those involved in law enforcement have repeatedly said that at the very least, they are not prepared for this, and they do not have the tools or what is required to enforce this new legislation. 
Municipalities would need a host of new equipment and much more money. These things have not been provided. That is a small point, but the member must also acknowledge that this is not a complete picture of what the police chiefs have been saying.",Conservative,Chatham-Kent—Leamington,Dave Van Kesteren,http://www.parl.gc.ca/Parliamentarians/en/members/dave-van-kesteren(217523)
4728340,ca.proc.d.2017-11-22.9795566,2017-11-22,2490b23e-4439-4513-9d54-6fceb6320267,217149,"Ms. Cheryl Hardcastle (Windsor—Tecumseh, NDP)",,Government Orders,Cannabis Act,,"Mr. Speaker, I just want to clarify this idea of what some police chiefs may or may not believe.
 I have many family members, including children, who are in law enforcement. Many people reflect a lot of the emotion that sometimes goes along with this issue. The idea of mandatory minimums and a war on drugs approach is not as effective as had been envisioned at one time. As a matter of fact, a criminal record for this non-violent offence is a social determinant of health.
I wonder if the member has had a chance to consider what the public health approach might be, because we need effective solutions moving forward. 
Would the member agree that we need to have a regulated environment? Would he also agree that a public campaign should include how to keep children away from this product? What does he think would be the most effective way for us to do that as we move forward with this?",New Democratic Party,Windsor—Tecumseh,Cheryl Hardcastle,http://www.parl.gc.ca/Parliamentarians/en/members/cheryl-hardcastle(217149)
4728341,ca.proc.d.2017-11-22.9795591,2017-11-22,6dfe3b54-024b-432d-bc01-7f89da30b7cd,217523,Mr. Dave Van Kesteren,,Government Orders,Cannabis Act,,"Mr. Speaker, we must not confuse Bill C-45 with the decriminalization of marijuana, although that is part of this legislation. Conservatives also agree that for minor possession that portion should be struck from the Criminal Code.
Educating children and youth from the ages of 11 to 17 is important. Those under the age of 18 will not be allowed to smoke marijuana, but allowing them to have possession of up to five joints certainly is not the type of education that we on this side of the House envision.
Sweden has spent a lot of money and has done a lot of training and as a result has seen its rate of usage drop, and that country has not legalized marijuana. 
The member is correct. We should and we must educate. We should be telling people. The report that I referred to from Health Canada should be in every home and in every school. We should be warning children about the dangers. We should warn young people about what marijuana can do to them if they use it before the age of 25 and who knows what could happen after that. That should be a part of our education system. 
If we put the time and energy that the Liberal government is prepared to spend on this legislation into education, we would have a whole different scenario in this country.",Conservative,Chatham-Kent—Leamington,Dave Van Kesteren,http://www.parl.gc.ca/Parliamentarians/en/members/dave-van-kesteren(217523)
4728342,ca.proc.d.2017-11-22.9795622,2017-11-22,22a96405-bed6-45e9-811a-69d055416803,234948,"Hon. Steven Blaney (Bellechasse—Les Etchemins—Lévis, CPC)",,Government Orders,Cannabis Act,,"Mr. Speaker, I would like to congratulate my colleague from Ontario for handling this issue with the seriousness it deserves, given the disastrous consequences of the legislation proposed by the Liberals. 
The minister is telling us that there is a serious drug problem and that it will only get worse, as my colleague said, with more crime and organized crime involvement, more young people taking drugs, more fatal accidents due to impaired driving, and more health problems.
My colleague has just mentioned that the police are not ready. The police said so in committee. They do not have either the training or the equipment they need. The money offered by the government is not going to speed up the process. The provinces and health services are not ready. 
My question for the member is simple: apart from the people who grow marijuana, and who, strangely enough, all have links to Liberal friends or to the government, will anyone actually benefit from the bill, and how do the Liberals plan to avoid this fiasco? ",Conservative,Bellechasse—Les Etchemins—Lévis,Steven Blaney,http://www.parl.gc.ca/Parliamentarians/en/members/steven-blaney(234948)
4728343,ca.proc.d.2017-11-22.9795633,2017-11-22,6dfe3b54-024b-432d-bc01-7f89da30b7cd,217523,Mr. Dave Van Kesteren,,Government Orders,Cannabis Act,,"Mr. Speaker, I concur with everything my colleague said. He is absolutely right when he points out the dangers, inability, and unpreparedness of the Liberal government for this legislation. What could be done? We need to stop this. We need to stop this train because this is a wreck. This is not just bad legislation, this is horrible legislation. This would affect generations to come for years and years.
I wish I had a little more time, but we know that marijuana usage lowers the IQ of the user. Now, we talked about the Liberals on that side, and they are a bright bunch, and maybe they can lose two or three points and still get through life. However, the majority of those users of marijuana, the young men who become disenchanted, lose their jobs, drop out of school, and are now smoking dope. Now they are going to have a whole new challenge to face in life. It is these groups we should be thinking about, and it is these groups of people who will get hooked on marijuana. They are the ones who are going to suffer from this poor legislation, the ones who will die in car wrecks, and whose parents will line themselves up here and look across to the Liberals. Maybe then they can answer to them as to why they were so persistent in passing this foolish, crazy legislation.",Conservative,Chatham-Kent—Leamington,Dave Van Kesteren,http://www.parl.gc.ca/Parliamentarians/en/members/dave-van-kesteren(217523)
