basepk,hid,speechdate,pid,opid,speakeroldname,speakerposition,maintopic,subtopic,subsubtopic,speechtext,speakerparty,speakerriding,speakername,speakerurl
4728274,ca.proc.d.2017-11-22.9794551,2017-11-22,831322ab-9fa6-437e-92ba-1b4525f8242d,217746,"Mr. Pat Kelly (Calgary Rocky Ridge, CPC)",,Oral Questions,Taxation,,"Mr. Speaker, getting through to a real person at the CRA is notoriously difficult, unless of course someone is a personal friend and fundraiser for the Prime Minister. In that case, he just picks up the phone for them.
The Auditor General reports that 64% of calls were blocked, given the busy signal, or told to call back and disconnected. The government is raising taxes on diabetics, small businesses, and middle-class families, and it will not even pick up the phone to answer questions.
Why does the government only answer questions for wealthy Liberal insiders and hang up on everyone else?",Conservative,Calgary Rocky Ridge,Pat Kelly,http://www.parl.gc.ca/Parliamentarians/en/members/pat-kelly(217746)
4728275,ca.proc.d.2017-11-22.9794555,2017-11-22,c58bb7da-2385-4bbf-a8f1-b781f634a80c,213875,"Hon. Diane Lebouthillier (Minister of National Revenue, Lib.)",,Oral Questions,Taxation,,"Mr. Speaker, we have an action plan for improving the quality of services the agency provides to Canadians. We have no lessons to learn from the Conservatives, who chose to make cuts to the call centres year after year.
While the number of calls were increasing, they reduced the number of agents at the centres, the opening hours, and the standards of service. Instead of making cuts, we have chosen to make investments. We will continue to take tangible measures to provide Canadians with the best service.",Liberal,Gaspésie—Les-Îles-de-la-Madeleine,Diane Lebouthillier,http://www.parl.gc.ca/Parliamentarians/en/members/diane-lebouthillier(213875)
4728276,ca.proc.d.2017-11-22.9794558,2017-11-22,8c04baa6-daad-4fe5-8413-3973a24a2760,234592,"Hon. Maxime Bernier (Beauce, CPC)",,Oral Questions,Taxation,,"Mr. Speaker, the Minister of Finance is unfairly adding to Canadian entrepreneurs' tax burden.
The Minister of Finance is telling our disappointed entrepreneurs to call him, but the Auditor General indicated that more than 29 million Canadian entrepreneurs did not have their calls returned. That represents almost half of the people who called the minister.
I want to ask the Minister of Finance a simple question: when will he pick up the phone and answer the calls of concerned entrepreneurs? ",Conservative,Beauce,Maxime Bernier,http://www.parl.gc.ca/Parliamentarians/en/members/maxime-bernier(234592)
4728277,ca.proc.d.2017-11-22.9794560,2017-11-22,c58bb7da-2385-4bbf-a8f1-b781f634a80c,213875,"Hon. Diane Lebouthillier (Minister of National Revenue, Lib.)",,Oral Questions,Taxation,,"Mr. Speaker, I will repeat that I agree with all of the Auditor General's recommendations. The former Conservative government decided to cut services, cut staff, and to cut the evaluation of the quality of services. That happened under former national revenue minister, Ms. Findlay.
Instead of making cuts, we have chosen to reinvest $50 million over the next four years. We are taking real action to ensure that Canadians have the services they are entitled to expect.",Liberal,Gaspésie—Les-Îles-de-la-Madeleine,Diane Lebouthillier,http://www.parl.gc.ca/Parliamentarians/en/members/diane-lebouthillier(213875)
4728278,ca.proc.d.2017-11-22.9794562,2017-11-22,96924c12-efff-4de2-9f9e-578fe5434342,234765,"Hon. Erin O'Toole (Durham, CPC)",,Oral Questions,International Trade,,"Mr. Speaker, in July, our American friends released detailed documents on their NAFTA priorities, including considerable detail on rules of origin for autos and other goods. They updated this document a few days ago. In August, Canada did not really release a detailed plan, but the minister gave a speech with considerable detail on the War of 1812. Today, Scotiabank is predicting the failure of NAFTA. When will the minister step away from the dinner parties and her progressive talking points and start fighting for the two million jobs that rely on NAFTA?",Conservative,Durham,Erin O'Toole,http://www.parl.gc.ca/Parliamentarians/en/members/erin-otoole(234765)
4728279,ca.proc.d.2017-11-22.9794565,2017-11-22,3dd9162a-4763-4000-8c8a-706a788f7e50,229209,"Hon. Chrystia Freeland (Minister of Foreign Affairs, Lib.)",,Oral Questions,International Trade,,"Mr. Speaker, let me assure the member opposite and all Canadians that at the NAFTA negotiating table we are fighting very hard, and in a very smart, fact-based way, for the Canadian national interest. We made good progress on some of the technical chapters in the Mexico round. However, I must tell members that significant differences remain on some of the key issues, such as rules of origin and chapter 19. I want to say to Canadians that we will always stand for the national interest. ",Liberal,University—Rosedale,Chrystia Freeland,http://www.parl.gc.ca/Parliamentarians/en/members/chrystia-freeland(229209)
4728280,ca.proc.d.2017-11-22.9794567,2017-11-22,b0010e40-d2c6-4a8e-a518-447721affc15,229933,"Ms. Filomena Tassi (Hamilton West—Ancaster—Dundas, Lib.)",,Oral Questions,Infrastructure,,"Mr. Speaker, our government is making unprecedented investments in infrastructure of $186 billion over 12 years. We know that these investments are essential. We also know that we have to be innovative.
 I would like to ask the Minister of Infrastructure and Communities to update this House on the progress of the Canada infrastructure bank and its leadership team.",Liberal,Hamilton West—Ancaster—Dundas,Filomena Tassi,http://www.parl.gc.ca/Parliamentarians/en/members/filomena-tassi(229933)
4728281,ca.proc.d.2017-11-22.9794571,2017-11-22,811a7b9a-4be5-4f9a-a302-088cb204bfba,214248,"Hon. Amarjeet Sohi (Minister of Infrastructure and Communities, Lib.)",,Oral Questions,Infrastructure,,"Mr. Speaker, our government is focused on investing in public infrastructure to create long-term economic growth and build strong, sustainable, and inclusive communities. We have appointed 10 outstanding Canadians to the board of the infrastructure bank. These appointments will help us mobilize pension funds and institutional investors to build more public infrastructure that Canadian communities need, and create jobs for the middle class.",Liberal,Edmonton Mill Woods,Amarjeet Sohi,http://www.parl.gc.ca/Parliamentarians/en/members/amarjeet-sohi(214248)
4728282,ca.proc.d.2017-11-22.9794573,2017-11-22,661a3062-86d1-4ba3-9e70-81c866aa2fc3,216864,"Mr. David Anderson (Cypress Hills—Grasslands, CPC)",,Oral Questions,Foreign Affairs,,"Mr. Speaker, for months we have pushed the government to take leadership on the Rohingya issue, the greatest humanitarian crisis facing the world today. There are 600,000 Rohingya who have been forced out of Myanmar.
The United Nations has determined that it is ethnic cleansing. Today, the U.S. government declared the Myanmar military operation to be ethnic cleansing. Our foreign affairs minister has said that this “looks...like ethnic cleansing”.
With this kind of international consensus, when is the government going to do something substantive to hold the Myanmar regime responsible for these horrendous atrocities?",Conservative,Cypress Hills—Grasslands,David Anderson,http://www.parl.gc.ca/Parliamentarians/en/members/david-anderson(216864)
4728283,ca.proc.d.2017-11-22.9794577,2017-11-22,3dd9162a-4763-4000-8c8a-706a788f7e50,229209,"Hon. Chrystia Freeland (Minister of Foreign Affairs, Lib.)",,Oral Questions,Foreign Affairs,,"Mr. Speaker, I want to thank the member opposite for raising this very grave issue. This absolutely is ethnic cleansing, and the responsibility falls squarely on Myanmar's military leadership and civilian government. These are crimes against humanity.
In Da Nang, the Prime Minister and I raised the treatment of the Rohingya directly with Aung San Suu Kyi. Our special envoy has visited Myanmar and Bangladesh to see first-hand what is happening. 
This is an urgent issue and Canada is absolutely seized of it.",Liberal,University—Rosedale,Chrystia Freeland,http://www.parl.gc.ca/Parliamentarians/en/members/chrystia-freeland(229209)
4728284,ca.proc.d.2017-11-22.9794580,2017-11-22,e7d4b944-1d3e-4f87-a7df-cdbd4fe7ca2b,218936,"Mr. Gord Johns (Courtenay—Alberni, NDP)",,Oral Questions,The Environment,,"Mr. Speaker, a leaked Parks Canada memo alerted British Columbians that thousands of plastic feed bags escaped from an aquaculture farm and washed ashore in the Broken Group Islands, yet for some reason the Tseshaht First Nation and other local groups were never notified. We only know about the spill due to the memo, riddled with talking points and concerns about negative press but containing no plan.
 Clearly, the government cares a thousand times more about its image than protecting the environment. Will the Liberals apologize to Vancouver Islanders and finally act to create a permanent, dedicated, and annual fund to help with marine debris cleanups?",New Democratic Party,Courtenay—Alberni,Gord Johns,http://www.parl.gc.ca/Parliamentarians/en/members/gord-johns(218936)
4728285,ca.proc.d.2017-11-22.9794583,2017-11-22,cee27afa-cdf8-4e99-ab22-22290f86aa3a,214082,"Hon. Catherine McKenna (Minister of Environment and Climate Change, Lib.)",,Oral Questions,The Environment,,"Mr. Speaker, I can assure the member opposite that we care greatly about the environment, that we are concerned about this incident, that Parks Canada is involved with the cleanup, and that we will continue to work very hard to ensure that we protect our oceans. 
As members know, we have our oceans protection plan. We are absolutely committed to protecting our oceans and protecting the environment.",Liberal,Ottawa Centre,Catherine McKenna,http://www.parl.gc.ca/Parliamentarians/en/members/catherine-mckenna(214082)
4728286,ca.proc.d.2017-11-22.9794585,2017-11-22,f8d9db71-b5f5-4e2f-977c-0ad80169e2a6,214187,"Mr. Angelo Iacono (Alfred-Pellan, Lib.)",,Oral Questions,Rail Transportation,,"Mr. Speaker, many Quebeckers are concerned about rail safety. However, we are heartened by the tireless work of the Minister of Transport, who is clearly making rail safety his number one priority.
Could the minister tell us about some of the measures he has taken to improve rail safety in Quebec?",Liberal,Alfred-Pellan,Angelo Iacono,http://www.parl.gc.ca/Parliamentarians/en/members/angelo-iacono(214187)
4728287,ca.proc.d.2017-11-22.9794588,2017-11-22,bc2e82f3-02f1-46e2-b9be-7d5f04ddddc9,214106,"Hon. Marc Garneau (Minister of Transport, Lib.)",,Oral Questions,Rail Transportation,,"Mr. Speaker, I want to thank my colleague from Alfred—Pellan for his excellent question and for the work he does on the Standing Committee on Transport, Infrastructure and Communities.
Rail safety is indeed my number one priority. To give a few examples, we have added safety barriers on Saint-Ambroise Street in Montreal, on Saint-Georges Street in the Saint-Hyacinthe subdivision, and on Pont-Mitchell Street in the Drummondville subdivision. These are great examples of how we have improved rail safety. Rail safety is my priority.",Liberal,Notre-Dame-de-Grâce—Westmount,Marc Garneau,http://www.parl.gc.ca/Parliamentarians/en/members/marc-garneau(214106)
4728288,ca.proc.d.2017-11-22.9794590,2017-11-22,00000000-0000-0000-0000-000000000000,235718,"Mr. Dane Lloyd (Sturgeon River–Parkland, CPC)",,Oral Questions,Justice,,"Mr. Speaker, seven years ago, Lyle and Marie McCann were brutally murdered. Their family was never able to give them a proper funeral, because the murderer refused to reveal the location of their remains. 
Convicted murderers who re-victimize families by withholding the whereabouts of their victims' remains should not be eligible for parole. Will the Minister of Justice do the right thing and pass legislation that will fix our broken parole system to ensure closure for families like the McCanns?",Conservative,Sturgeon River—Parkland,Dane Lloyd,http://www.parl.gc.ca/Parliamentarians/en/members/dane-lloyd(235718)
4728289,ca.proc.d.2017-11-22.9794593,2017-11-22,1a1a9dee-c228-40fc-b926-42f8441d84f0,214405,"Hon. Ralph Goodale (Minister of Public Safety and Emergency Preparedness, Lib.)",,Oral Questions,Justice,,"Mr. Speaker, first of all, I welcome the hon. gentleman to the House and congratulate him upon his recent election.
Second, all members of the House share the angst and concern the member has expressed with respect to this particular situation. I would look forward to an opportunity to discuss with him and with the Minister of Justice any constructive ideas he might wish to offer about how we can improve our criminal justice system.",Liberal,Regina—Wascana,Ralph Goodale,http://www.parl.gc.ca/Parliamentarians/en/members/ralph-goodale(214405)
4728290,ca.proc.d.2017-11-22.9794595,2017-11-22,88ce81f3-c8b1-4ab9-bbdb-aa677d83b394,214062,"Mr. Michel Boudrias (Terrebonne, BQ)",,Oral Questions,Public Services and Procurement,,"Mr. Speaker, the clock is ticking for the 600 workers at the Davie shipyard who will be out of a job within days because of the federal government. Winter is here. We urgently need icebreakers on the St. Lawrence, and the navy desperately needs two more supply ships, including the future ship Obelix, to achieve its mission. The members on the other side need to open their eyes. Ottawa is asleep at the wheel, and our operational capability is under threat as a result. 
Why is the Liberal government boycotting the best shipyard in North America? Why is it determined to put the Davie shipyard's top skilled workers out of a job?",Bloc Québécois,Terrebonne,Michel Boudrias,http://www.parl.gc.ca/Parliamentarians/en/members/michel-boudrias(214062)
4728291,ca.proc.d.2017-11-22.9794600,2017-11-22,61edc25f-3448-46fd-9632-6c5c23fd98a6,233810,"Hon. Carla Qualtrough (Minister of Public Services and Procurement, Lib.)",,Oral Questions,Public Services and Procurement,,"Mr. Speaker, the Canadian Coast Guard's icebreaking services are essential for keeping our waters safe, protecting our shoreline economy, and strengthening our economy. We are working hard to ensure the continuity of these services, and the interim icebreaking services will supplement the program. ",Liberal,Delta,Carla Qualtrough,http://www.parl.gc.ca/Parliamentarians/en/members/carla-qualtrough(233810)
4728292,ca.proc.d.2017-11-22.9794601,2017-11-22,3176068f-62ee-4b2f-aacd-1131201c6db1,214707,The Speaker,,Oral Questions,Presence in Gallery,,"I would like to draw to the attention of hon. members the presence in the gallery of His Excellency Hashim Thaçi, President of the Republic of Kosovo.",Liberal,Halifax West,Geoff Regan,http://www.parl.gc.ca/Parliamentarians/en/members/geoff-regan(214707)
4728293,ca.proc.d.2017-11-22.p5146989,2017-11-22,,,,intervention,Oral Questions,Presence in Gallery,," Hear, hear! ",,,Some hon. members,
4728294,ca.proc.d.2017-11-22.9794821,2017-11-22,3c3ee442-a873-4845-84d0-7da07a66ce61,217244,Mr. Alexandre Boulerice,,Oral Questions,Presence in Gallery,,"Mr. Speaker, during question period, the Minister of National Revenue accused me of spreading disinformation. That is not very nice. I am therefore requesting the unanimous consent of the House to table the Auditor General's report on the Canada Revenue Agency, because I get the sense she did not read it.",New Democratic Party,Rosemont—La Petite-Patrie,Alexandre Boulerice,http://www.parl.gc.ca/Parliamentarians/en/members/alexandre-boulerice(217244)
4728295,ca.proc.d.2017-11-22.9794846,2017-11-22,3176068f-62ee-4b2f-aacd-1131201c6db1,214707,The Speaker,,Oral Questions,Presence in Gallery,,Does the hon. member have the unanimous consent of the House?,Liberal,Halifax West,Geoff Regan,http://www.parl.gc.ca/Parliamentarians/en/members/geoff-regan(214707)
4728296,ca.proc.d.2017-11-22.p5146992,2017-11-22,,,,intervention,Oral Questions,Presence in Gallery,, No.,,,Some hon. members,
4728297,ca.proc.d.2017-11-22.9794610,2017-11-22,530dc476-c9bf-477c-83e7-6efc545f2bf8,224177,"Mr. Luc Thériault (Montcalm, BQ)",,Oral Questions,Point of Order,Ethics,"Mr. Speaker, subsequent to the point of order my colleague from Joliette raised on November 8, I would like to share some additional observations that I hope will inform your consideration of the matter. I also believe that the vote was marred by irregularities and should be retaken.
As my colleague from Joliette said, the code of conduct for members of Parliament, which is part of our Standing Orders, clearly prohibits an elected member from furthering his or her private interests. In addition to taking part in the vote on Motion No. 42, a motion that will have an impact on his private interests, the Minister of Finance influenced the debate through his then-parliamentary secretary, the member for Saint-Maurice—Champlain.
As stated in the “Guide for Parliamentary Secretaries”, issued by the Prime Minister on January 16, 2016, a parliamentary secretary speaks on behalf of the minister. In other words, when a parliamentary secretary takes the floor in the House, it is the minister's words that we hear, as we can see on pages 1 and 2 of the guide. On page 1, under Your Role and Responsibilities, it says:
 Section 47 of the Parliament of Canada Act sets out the following succinct job description: “The Parliamentary Secretary or Secretaries to a minister shall assist the minister in such manner as the minister directs.” In this context, the responsibilities of parliamentary secretaries generally fall into two broad categories: (1) House business and (2) department-related duties. 
On page 2, under House Business, it says:
 In this context, the role of parliamentary secretaries in supporting ministers’ House duties includes: 
 --attending Question Period; 
 --piloting the minister’s legislation through the legislative process on the floor of the House, in parliamentary committees...and with caucus and opposition MPs; 
 --supporting the minister’s position on Private Members’ Business; 
Later on, the guide specifically talks about the role of parliamentary secretaries with respect to private members' business. On page 4, under Private Members' Business, the guide states:
 Given that ministers do not generally participate directly in debates on Private Members’ Business, this is an opportunity for parliamentary secretaries to bring their parliamentary skills to bear. This is particularly so since all Private Members’ Business comes to a vote. Parliamentary secretaries play a key role in the Government's handling of Private Members’ Business, in that they: 
 --may be called upon to speak for the minister during Private Members’ Hour; 
 --work with the Government House Leader’s office to organize and deliver the minister’s response to Private Members’ Bills and motions; 
As members can see, Minister of Finance, by way of his his parliamentary secretary, reassured members of the House about the government's actions on this matter. He also urged them to vote against Motion No. 42. I remind members that if this motion had passed, it would have affected the minister's personal interests. 
I want to be clear. The Parliamentary Secretary to the Minister of Finance should have recused himself from the debates on Motion No. 42, since he speaks on behalf of his minister. I repeat, this minister's interests are directly affected by Motion No. 42. As my colleague from Joliette pointed out, we are talking about the results of a vote and about the integrity of the House of Commons as an institution, which you oversee, Mr. Speaker. We are here, at the heart of representative democracy, and at the heart of the trust that the public must have in its representatives. This vote should be taken again, since it was tainted.",Bloc Québécois,Montcalm,Luc Thériault,http://www.parl.gc.ca/Parliamentarians/en/members/luc-theriault(224177)
4728298,ca.proc.d.2017-11-22.9794616,2017-11-22,3176068f-62ee-4b2f-aacd-1131201c6db1,214707,The Speaker,,Oral Questions,Point of Order,Ethics,"I thank the hon. member for Montcalm for raising this point of order. As he said, it is related to another point of order that was recently raised by the hon. member for Joliette and that I already responded to, but I will come back to the House at a later time. 
The hon. member for Manicouagan on a point of order. ",Liberal,Halifax West,Geoff Regan,http://www.parl.gc.ca/Parliamentarians/en/members/geoff-regan(214707)
4728299,ca.proc.d.2017-11-22.9794617,2017-11-22,7ba5ccca-0132-4942-982e-fb0ca43b3ff5,214530,Mrs. Marilène Gill,,Oral Questions,Point of Order,Ethics,"Mr. Speaker, I wish to seek consent for the following motion: That this House call on the Department of Transport to prohibit the carrying of a knife with a blade measuring less than six centimetres on board aircraft. ",Bloc Québécois,Manicouagan,Marilène Gill,http://www.parl.gc.ca/Parliamentarians/en/members/marilene-gill(214530)
4728300,ca.proc.d.2017-11-22.9794618,2017-11-22,3176068f-62ee-4b2f-aacd-1131201c6db1,214707,The Speaker,,Oral Questions,Point of Order,Ethics,Does the hon. member have the unanimous consent of the House to move the motion?,Liberal,Halifax West,Geoff Regan,http://www.parl.gc.ca/Parliamentarians/en/members/geoff-regan(214707)
4728301,ca.proc.d.2017-11-22.p5147012,2017-11-22,,,,intervention,Oral Questions,Point of Order,Ethics, No. ,,,Some hon. members,
4728302,ca.proc.d.2017-11-22.9794623,2017-11-22,07cf5767-802c-406c-92a7-7dc92af79b40,229526,"Mr. Kevin Lamoureux (Parliamentary Secretary to the Leader of the Government in the House of Commons, Lib.)",,Routine Proceedings,Government Response to Petitions,,"Mr. Speaker, pursuant to Standing Order 36(8), I have the honour to table, in both official languages, the government's response to four petitions.",Liberal,Winnipeg North,Kevin Lamoureux,http://www.parl.gc.ca/Parliamentarians/en/members/kevin-lamoureux(229526)
4728303,ca.proc.d.2017-11-22.9794626,2017-11-22,6322565a-d236-4124-81f3-d869f865f7ef,229560,"Ms. Leona Alleslev (Aurora—Oak Ridges—Richmond Hill, Lib.)",,Routine Proceedings,Interparliamentary Delegations,,"Mr. Speaker, pursuant to Standing Order 34(1), I have the honour to present to the House, in both official languages, the report of the Canadian delegation of the Canadian NATO Parliamentary Association respecting its participation at the forum Parlementaire Transatlantique.
The forum was held on December 5 and 6, 2016, in Washington, D.C., United States of America. ",Liberal,Aurora—Oak Ridges—Richmond Hill,Leona Alleslev,http://www.parl.gc.ca/Parliamentarians/en/members/leona-alleslev(229560)
4728304,ca.proc.d.2017-11-22.9794629,2017-11-22,eb53bf99-e3d5-44b9-a15e-6c295470cdd4,218395,"Hon. Kevin Sorenson (Battle River—Crowfoot, CPC)",,Routine Proceedings,Committees of the House,Public Accounts,"Mr. Speaker, I have the honour to present two reports today, in both official languages.
The first one is the 32nd report of the Standing Committee on Public Accounts, entitled “Report 4, Mental Health Support for Members of the Royal Canadian Mounted Police, of the Spring 2017 Reports of the Auditor General of Canada”. Pursuant to Standing Order 109, the committee requests that the government table a comprehensive response to this report.
I also have the pleasure to present, in both official languages, the 33rd report of the Standing Committee on Public Accounts, entitled “Public Accounts of Canada 2017”. Pursuant to Standing Order 109, the committee requests that the government table a comprehensive response to this report.",Conservative,Battle River—Crowfoot,Kevin Sorenson,http://www.parl.gc.ca/Parliamentarians/en/members/kevin-sorenson(218395)
4728305,ca.proc.d.2017-11-22.9794635,2017-11-22,a76af2a6-7a43-4f8f-a887-0d10b3a0a3c1,218969,"Hon. Wayne Easter (Malpeque, Lib.)",,Routine Proceedings,Committees of the House,Finance,"Mr. Speaker, I have the honour to present, in both official languages, the 19th report of the Standing Committee on Finance in relation to Bill C-63, a second act to implement certain provisions of the budget tabled in Parliament on March 22, 2017, and other measures. The committee has studied the bill and has decided to report the bill back to the House without amendment.
I want to thank all committee members from all parties, who worked diligently and co-operatively to get this bill back in a timely manner.",Liberal,Malpeque,Wayne Easter,http://www.parl.gc.ca/Parliamentarians/en/members/wayne-easter(218969)
4728306,ca.proc.d.2017-11-22.9794637,2017-11-22,72e2a81c-f40c-4c0f-8be0-09a9e61254c3,219070,"Hon. Robert Nault (Kenora, Lib.)",,Routine Proceedings,Committees of the House,Foreign Affairs and International Development,"Mr. Speaker, I have the honour to present, in both official languages, the 13th report of the Standing Committee on Foreign Affairs and International Development, entitled “Strengthening Canadian Engagement in Eastern Europe and Central Asia”. Pursuant to Standing Order 109, the committee requests that the government table a comprehensive response to this report.",Liberal,Kenora,Bob Nault,http://www.parl.gc.ca/Parliamentarians/en/members/bob-nault(219070)
