basepk,hid,speechdate,pid,opid,speakeroldname,speakerposition,maintopic,subtopic,subsubtopic,speechtext,speakerparty,speakerriding,speakername,speakerurl
4706312,ca.proc.d.2017-05-01.9488033,2017-05-01,7ba5ccca-0132-4942-982e-fb0ca43b3ff5,214530,"Mrs. Marilène Gill (Manicouagan, BQ)",,Oral Questions,Softwood Lumber,,"Mr. Speaker, we already know that the United States has decided to slap a new 20% countervailing duty on softwood lumber. 
On day 1, Quebec announced that it will provide loan guarantees to the companies affected. However, Ottawa is still refusing to support our forestry industry, which means that it is knowingly putting the industry at risk. 
Besides trying to develop a market in China and announcing programs that already exist, is Ottawa coming up with more appropriate solutions, such as providing loan guarantees, as Quebec has unanimously requested?",Bloc,Manicouagan,Marilène Gill,http://www.parl.gc.ca/Parliamentarians/en/members/marilene-gill(214530)
4706313,ca.proc.d.2017-05-01.9488036,2017-05-01,131b0f70-8840-4d9a-94ff-fa579a1ef7af,214246,"Hon. Jim Carr (Minister of Natural Resources, Lib.)",,Oral Questions,Softwood Lumber,,"Mr. Speaker, we are in close collaboration with all of our provincial counterparts, including the Government of Quebec. 
We understand together that our first responsibility is to do what we can for the producers, for the workers, and for the communities affected by these punitive and unconscionable tariffs. 
We will continue to work co-operatively, because we believe that together we will come up with the solution that is in the best interests of workers, communities, and producers.",Liberal,Winnipeg South Centre,Jim Carr,http://www.parl.gc.ca/Parliamentarians/en/members/jim-carr(214246)
4706314,ca.proc.d.2017-05-01.9488037,2017-05-01,3176068f-62ee-4b2f-aacd-1131201c6db1,214707,The Speaker,,Oral Questions,Presence in Gallery,," I draw the attention of hon. members to the presence in the gallery of the Hon. Phil Hogan, Commissioner for Agriculture and Rural Development of the European Parliament.",Liberal,Halifax West,Geoff Regan,http://www.parl.gc.ca/Parliamentarians/en/members/geoff-regan(214707)
4706315,ca.proc.d.2017-05-01.p4854184,2017-05-01,,,,intervention,Oral Questions,Presence in Gallery,," Hear, hear!",,,Some hon. members,
4706316,ca.proc.d.2017-05-01.9488044,2017-05-01,07cf5767-802c-406c-92a7-7dc92af79b40,229526,"Mr. Kevin Lamoureux (Parliamentary Secretary to the Leader of the Government in the House of Commons, Lib.)",,Routine Proceedings,Government Response to Petitions,,"Mr. Speaker, pursuant to Standing Order 36(8), I have the honour to table, in both official languages, the government's responses to 38 petitions. ",Liberal,Winnipeg North,Kevin Lamoureux,http://www.parl.gc.ca/Parliamentarians/en/members/kevin-lamoureux(229526)
4706317,ca.proc.d.2017-05-01.9488048,2017-05-01,89dabae0-bc5d-4af0-babb-7104d4ee1742,219899,"Hon. Larry Bagnell (Yukon, Lib.)",,Routine Proceedings,Committees of the House,Procedure and House Affairs,"Mr. Speaker, pursuant to Standing Orders 104 and 114, I have the honour to present, in both official languages, the 29th report of the Standing Committee on Procedure and House Affairs regarding the membership of committees of the House. If the House gives its consent, I intend to move for concurrence in this 29th report later this day.",Liberal,Yukon,Larry Bagnell,http://www.parl.gc.ca/Parliamentarians/en/members/larry-bagnell(219899)
4706318,ca.proc.d.2017-05-01.9488052,2017-05-01,3a48d31a-42fc-4320-a84f-da61c251bccd,219011,"Mr. Blaine Calkins (Red Deer—Lacombe, CPC)",,Routine Proceedings,Committees of the House,"Access to Information, Privacy and Ethics","Mr. Speaker, I have the honour to present, in both official languages, the fifth report of the Standing Committee on Standing Committee on Access to Information, Privacy and Ethics, entitled “Safeguarding Canada's National Security While Protecting Canadians' Privacy Rights: Review of the Security of Canada Information Sharing Act (SCISA)”.
Pursuant to Standing Order 109, the committee requests that the government table a comprehensive response to this report.",Conservative,Red Deer—Lacombe,Blaine Calkins,http://www.parl.gc.ca/Parliamentarians/en/members/blaine-calkins(219011)
4706319,ca.proc.d.2017-05-01.9488054,2017-05-01,89dabae0-bc5d-4af0-babb-7104d4ee1742,219899,"Hon. Larry Bagnell (Yukon, Lib.)",,Routine Proceedings,Committees of the House,Procedure and House Affairs,"Mr. Speaker, with leave of the House, I move that the 29th report of the Standing Committee on Procedure and House Affairs, presented to the House earlier this day, be concurred in. ",Liberal,Yukon,Larry Bagnell,http://www.parl.gc.ca/Parliamentarians/en/members/larry-bagnell(219899)
4706320,ca.proc.d.2017-05-01.9488056,2017-05-01,3176068f-62ee-4b2f-aacd-1131201c6db1,214707,The Speaker,,Routine Proceedings,Committees of the House,Procedure and House Affairs, Does the hon. minister have the unanimous consent of the House to move the motion?,Liberal,Halifax West,Geoff Regan,http://www.parl.gc.ca/Parliamentarians/en/members/geoff-regan(214707)
4706321,ca.proc.d.2017-05-01.p4854190,2017-05-01,,,,intervention,Routine Proceedings,Committees of the House,Procedure and House Affairs, Agreed.,,,Some hon. members,
4706322,ca.proc.d.2017-05-01.p4854191,2017-05-01,3176068f-62ee-4b2f-aacd-1131201c6db1,214707,The Speaker,,Routine Proceedings,Committees of the House,Procedure and House Affairs, The House has heard the terms of the motion. Is it the pleasure of the House to adopt the motion?,Liberal,Halifax West,Geoff Regan,http://www.parl.gc.ca/Parliamentarians/en/members/geoff-regan(214707)
4706323,ca.proc.d.2017-05-01.p4854192,2017-05-01,,,,intervention,Routine Proceedings,Committees of the House,Procedure and House Affairs, Agreed.,,,Some hon. members,
4706324,ca.proc.d.2017-05-01.p2,2017-05-01,3176068f-62ee-4b2f-aacd-1131201c6db1,214707,The Speaker,,Routine Proceedings,Committees of the House,Procedure and House Affairs,(Motion agreed to),Liberal,Halifax West,Geoff Regan,http://www.parl.gc.ca/Parliamentarians/en/members/geoff-regan(214707)
4706325,ca.proc.d.2017-05-01.9488057,2017-05-01,ac588301-cc6e-4f6e-9c58-84542c62c46b,217183,"Mr. François Choquette (Drummond, NDP)",,Routine Proceedings,Petitions,Labelling of Food,"Mr. Speaker, I am pleased to once again table a petition about ten pages long regarding an extremely important issue in Drummond. People have been talking to me about this for nearly a year now, Canada being the only country to have authorized the marketing of genetically modified salmon.
Fortunately, genetically modified salmon has not yet made its way to our grocery store shelves, but people want to know what they are eating. They want mandatory labelling of GMOs. In that regard, I would like to congratulate and thank my hon. colleague from Sherbrooke for all of the work he has done over the past year or so to call for the mandatory labelling of GMOs.
Hundreds of people have signed this petition. In fact, it has now been signed by two or three thousand people. I am therefore once again tabling this petition calling for the mandatory labelling of GMOs. That is what the people of Drummond want.",NDP,Drummond,François Choquette,http://www.parl.gc.ca/Parliamentarians/en/members/francois-choquette(217183)
4706326,ca.proc.d.2017-05-01.9488061,2017-05-01,9c9a64e6-58f1-4367-9f49-93ad31744c96,217354,"Mrs. Cathy McLeod (Kamloops—Thompson—Cariboo, CPC)",,Routine Proceedings,Petitions,Home Care,"Mr. Speaker, I am standing up to table an e-petition. I want to compliment my colleague, who put the e-petition process in place through a private member's bill.
This particular group believes that health care should include home care. They feel that as our needs change over the years, we need to reflect in terms of what we do and how we do it. I am pleased to present this petition on their behalf.",Conservative,Kamloops—Thompson—Cariboo,Cathy McLeod,http://www.parl.gc.ca/Parliamentarians/en/members/cathy-mcleod(217354)
4706327,ca.proc.d.2017-05-01.9488063,2017-05-01,eaa6694f-1e20-4aae-ad3b-e694b0e12c59,224170,"Ms. Elizabeth May (Saanich—Gulf Islands, GP)",,Routine Proceedings,Petitions,Animal Welfare,"Mr. Speaker, I am honoured to present a petition today.
The petition is sponsored by World Animal Protection. The petitioners are asking for the Minister of International Development and La Francophonie and others to consider that in the event of national disasters, the rescue of animals is essential for the recovery in the wake of a disaster. It deals with animals for livestock, and in events such as the Fort McMurray fire, people rescued pets.
Looking at international disasters and recognizing that animal protection is part of that disaster response is what the petitioners are asking the government to take into consideration.",Green,Saanich—Gulf Islands,Elizabeth May,http://www.parl.gc.ca/Parliamentarians/en/members/elizabeth-may(224170)
4706328,ca.proc.d.2017-05-01.9488158,2017-05-01,eaa6694f-1e20-4aae-ad3b-e694b0e12c59,224170,"Ms. Elizabeth May (Saanich—Gulf Islands, GP)",,Routine Proceedings,Petitions,Tobacco Products,"Mr. Speaker, the second petition is from Canadians on an issue that we wished was solved by now. It is to remove flavours and other ways of targeting youth in the tobacco industry.
These petitioners, primarily from the Thunder Bay area, are asking the government to remove all favouring from all tobacco products.",Green,Saanich—Gulf Islands,Elizabeth May,http://www.parl.gc.ca/Parliamentarians/en/members/elizabeth-may(224170)
4706329,ca.proc.d.2017-05-01.9488065,2017-05-01,07cf5767-802c-406c-92a7-7dc92af79b40,229526,"Mr. Kevin Lamoureux (Parliamentary Secretary to the Leader of the Government in the House of Commons, Lib.)",,Routine Proceedings,Questions on the Order Paper,,"Mr. Speaker, the following questions will be answered today: Questions Nos. 896, 897, 899, 902, 907, 910, and 913.",Liberal,Winnipeg North,Kevin Lamoureux,http://www.parl.gc.ca/Parliamentarians/en/members/kevin-lamoureux(229526)
4706330,ca.proc.d.2017-05-01.p4854204,2017-05-01,13a21d52-bc44-4a96-a206-f18432ef9191,228735,Mr. Romeo Saganash,,Routine Proceedings,Questions on the Order Paper,Question No. 896,"With regard to the promised national reconciliation framework with Indigenous peoples: (a) what is the government’s engagement strategy for developing the framework; (b) what is the timeframe and schedule of the development and implementation of the framework; (c) how have Indigenous peoples identified grievances associated with existing historical treaties, including (i) Treaty Land Entitlement, (ii) Additions to Reserves, (iii) Specific Claims, (iv) all other formal and informal means of dispute resolution, and how are these grievances included in the framework; (d) what mechanisms for resolution have Indigenous peoples chosen; (e) which Indigenous experts, communities, leaders, and knowledge keepers have guided the development process and set the criteria and outcomes; (f) what are the criteria and outcomes of the national reconciliation framework; and (g) what are the terms of the effective consultation processes within the context of the Federal Reconciliation Framework?",NDP,Abitibi—Baie-James—Nunavik—Eeyou,Romeo Saganash,http://www.parl.gc.ca/Parliamentarians/en/members/romeo-saganash(228735)
4706331,ca.proc.d.2017-05-01.p4854205,2017-05-01,bc4bee2d-993a-4485-a436-4b45cb6553da,229524,"Ms. Yvonne Jones (Parliamentary Secretary to the Minister of Indigenous and Northern Affairs, Lib.)",,Routine Proceedings,Questions on the Order Paper,Question No. 896,"Mr. Speaker, the Government of Canada’s overarching goal is to advance reconciliation and self-determination by renewing the relationship between Canada and indigenous peoples based on recognition of rights, respect, co-operation, and partnership. 
To achieve this goal, the Government of Canada is implementing a national reconciliation framework in collaboration with first nations, Inuit, and the Métis Nation. Key elements of the framework are already under way, and it will continue to advance and evolve over time. 
The first important milestone of the framework is the establishment of permanent bilateral mechanisms to co-develop policy on shared priorities and monitor progress as we move forward. Following the Prime Minister’s announcement on December 15, 2016, two of the three distinctions-based permanent bilateral mechanisms have been established. The Inuit Nunangat Declaration on Inuit-Crown Partnership was signed on February 9, 2017. It committed the federal government and Inuit leadership to work in partnership on shared priorities. Similarly, on April 13, 2017, the Prime Minister, the president of the Métis National Council, and its governing members of the council signed the Canada-Métis Nation accord during the first Métis Nation-Crown Summit in Ottawa, Ontario. The accord outlines the ways in which the Government of Canada and the Métis National Council and its governing members will work together to set priorities and develop policy in areas of shared interest. A third permanent bilateral mechanism with First Nations will be established in the near future. These permanent, distinctions-based bilateral mechanisms provide a foundation to reset the relationship and advance towards true nation-to-nation, crown-to-Inuit, and government-to-government relationships. These new processes demonstrate a substantive and significant change in how the Government of Canada is working together with indigenous peoples to co-develop policy and achieve results.
Another important component of the framework involves the establishment of the working group of ministers on the review of laws and policies related to indigenous peoples, which was announced by the Prime Minister in February 2017. The working group of ministers has the mandate to review existing federal laws, policies, and operational practices to help ensure the crown is meeting its constitutional obligations with respect to aboriginal and treaty rights and is adhering to international human rights standards, including the United Nations Declaration on the Rights of Indigenous Peoples. 
The third key component of the framework includes the Government of Canada’s commitment to work in partnership with indigenous communities, the provinces and territories, and other partners to fully implement the Truth and Reconciliation Commission’s 94 calls to action. To date, progress has been made on 49 of 70 of the calls to action under federal or shared responsibility. In 2016, Canada became a full supporter, without qualification, of the United Nations Declaration on the Rights of Indigenous Peoples. The government is committed to fully implementing the declaration in accordance with the Canadian Constitution and is working in full partnership with indigenous peoples on the path forward. The government has also made unprecedented investments in both budget 2016 and budget 2017 towards safe housing, clean water, high-quality education, child and family service reform, and the revitalization of indigenous language and culture to help close the socio-economic gaps and address the priorities of communities from coast to coast to coast.
The government is also working with first nations, Inuit, and the Métis Nation to advance new fiscal relationships, including changes to funding approaches and financial transfer mechanisms that support renewed nation-to-nation, crown-to-Inuit, and government-to-government relationships. In July 2016, Canada signed a memorandum of understanding on a new fiscal relationship with the Assembly of First Nations and has been engaged with self-governing first nations on the structure of a new fiscal relationship with these communities. Budget 2017 also provides $84.9 million over the next five years in key long-term stable funding to support the Métis Nation as it continues to develop and grow governance capacity that will support its future endeavors, including section 35 self-determination and reconciliation discussions. This is on top of existing funding currently being provided to the Métis Nation and under previous Powley funding. 
Reconciliation and the implementation of the framework is being implemented through a whole-of-government approach. A large number of federal departments, as mandated by the Prime Minister’s mandate letter to each respective federal minister, are directly engaging with indigenous peoples across Canada on implementing policies and programs related to a broad range of issues. 
This approach and framework for reconciliation is evergreen and will continue to evolve as the government renews and strengthens the relationship with indigenous peoples. ",Liberal,Labrador,Yvonne Jones,http://www.parl.gc.ca/Parliamentarians/en/members/yvonne-jones(229524)
4706332,ca.proc.d.2017-05-01.p4854213,2017-05-01,13a21d52-bc44-4a96-a206-f18432ef9191,228735,Mr. Romeo Saganash,,Routine Proceedings,Questions on the Order Paper,Question No. 897,"With regard to the announced Indigenous Languages Act: (a) which Indigenous experts, communities, leaders, and knowledge keepers have guided the drafting process and set the criteria and outcomes; (b) what is the timeframe and schedule of the drafting of the proposed legislation; (c) what criteria does the government anticipate will be used to determine appropriate funding levels; (d) does the government anticipate the Truth and Reconciliation Commission’s Call to Action No. 15 for a Language Commissioner will be included in the proposed legislation; and (e) does the government anticipate Indigenous languages will be recognized as official languages as part of the proposed legislation? ",NDP,Abitibi—Baie-James—Nunavik—Eeyou,Romeo Saganash,http://www.parl.gc.ca/Parliamentarians/en/members/romeo-saganash(228735)
4706333,ca.proc.d.2017-05-01.p4854214,2017-05-01,e44116f8-75a8-4ca6-9ba5-fe968dbd42b0,219957,"Mr. Sean Casey (Parliamentary Secretary to the Minister of Canadian Heritage, Lib.)",,Routine Proceedings,Questions on the Order Paper,Question No. 897,"Mr. Speaker, with regard to (a), this legislation will be developed jointly with indigenous peoples. Specialists, communities, and indigenous representatives will be involved in the discussions to guide and conceptualize the framework that will lead to an indigenous languages act. 
With regard to (b), the proposed legislation would be introduced prior to the end of the current parliament.
 With regard to (c), as announced in the 2017 budget, the government will invest $89.9 million over the next three years to support indigenous languages and cultures. 
With regard to (d), all calls to action of the Truth and Reconciliation Commission regarding indigenous languages, including the delegation of a language commissioner, will be considered in the development of the proposed legislation. 
With regard to (e), the protection and support provided by the legislation will be determined through a co-development process with indigenous peoples. ",Liberal,Charlottetown,Sean Casey,http://www.parl.gc.ca/Parliamentarians/en/members/sean-casey(219957)
4706334,ca.proc.d.2017-05-01.p4854219,2017-05-01,0bd5970c-e4c2-4044-8344-8123b16d75bd,218725,Hon. Peter Kent,,Routine Proceedings,Questions on the Order Paper,Question No. 899,"With regard to the statement made by the Minister of Innovation, Science and Economic Development in the House of Commons on February 23, 2017, that “Cedar Tree will now be owned and operated by Canadians going foward”: (a) does the government consider this statement to be accurate; and (b) what evidence or guarantees does the government have to ensure that Cedar Tree Investment Canada is not a subsidiary of Anbang Insurance?",Conservative,Thornhill,Peter Kent,http://www.parl.gc.ca/Parliamentarians/en/members/peter-kent(218725)
4706335,ca.proc.d.2017-05-01.p4854220,2017-05-01,8908cde5-7474-4d2a-8c50-d05da5ee0712,214493,"Hon. Navdeep Bains (Minister of Innovation, Science and Economic Development, Lib.)",,Routine Proceedings,Questions on the Order Paper,Question No. 899,"Mr. Speaker, with regard to (a), on March 6, 2017, during the House of Commons debates, the Minister of Innovation, Science and Economic Development clarified his earlier statement:
On February 23, during question period, in response to a question from the member for Kamloops—Thompson—Cariboo on the Investment Canada Act, I inadvertently stated that Cedar Tree will now be owned and operated by Canadians going forward. What I meant to say is that Retirement Concepts will continue to be managed and operated by Canadians under its new ownership….
With regard to (b), under the Investment Canada Act, the Minister of Innovation, Science and Economic Development carefully considers each reviewable investment on a case-by-case basis and approves foreign investments to acquire control of a Canadian business only if they are likely to be of net benefit to Canada. The act contains strict confidentiality provisions in regard to information obtained through its administration. Section 36 of the act states that:
that “…all information obtained in respect to a Canadian, a non-Canadian, a business or an entity referred to in paragraph 25.1(c) by the Minister or an officer or employee of Her Majesty in the course of the administration or enforcement of this Act is privileged and no one shall knowingly communicate or allow to be communicated any such information or allow anyone to inspect or to have access to any such information.”
As a result of section 36, Innovation, Science and Economic Development Canada is unable to disclose any information obtained under the Investment Canada Act to respond to this question. ",Liberal,Mississauga—Malton,Navdeep Bains,http://www.parl.gc.ca/Parliamentarians/en/members/navdeep-bains(214493)
4706336,ca.proc.d.2017-05-01.p4854225,2017-05-01,d013e8ca-fdd5-4eb4-a0e4-b5f0782a8f6d,217247,Mr. Fin Donnelly,,Routine Proceedings,Questions on the Order Paper,Question No. 902, With regard to the Department of Fisheries and Oceans' public commitment to implement a mandatory fins-attached management measure for all pelagic shark landings across Canada by March 2018: (a) what is the Department's timeline for proceeding with stakeholder consultations; (b) does the government anticipate it will be balancing these domestic measures with regulations to limit the trade of shark fins only to other countries with similar requirements; and (c) does the government anticipate these protections against shark finning will extend to preventing the de-winging of skates and rays by requiring that those animals be landed whole as well?,NDP,Port Moody—Coquitlam,Fin Donnelly,http://www.parl.gc.ca/Parliamentarians/en/members/fin-donnelly(217247)
4706337,ca.proc.d.2017-05-01.p4854226,2017-05-01,5fb3ff09-e569-441c-bbba-5972cd1f656c,229500,"Mr. Terry Beech (Parliamentary Secretary to the Minister of Fisheries, Oceans and the Canadian Coast Guard, Lib.)",,Routine Proceedings,Questions on the Order Paper,Question No. 902,"Mr. Speaker, while there are no directed shark fisheries in Canada, under the new measures announced by the government late last year, harvesters that retain bycatches of sharks will be required to land any pelagic sharks with all fins at least partially attached to the carcass as a measure to strengthen shark finning prevention. 
Most fisheries in Canada are already meeting the requirement to keep fins at least partially attached to the carcass until after landing. Consultations on full implementation of this measure are ongoing with the one remaining fleet that has not yet fully implemented the fins-attached requirement. This measure will be fully implemented for all fisheries no later than March 2018.
While there are currently no regulations being considered to limit the trade of fins to countries that have implemented a fins-attached approach, Canada restricts or bans the trade, possession, or sale of shark products from species that are protected under either the Convention on International Trade in Endangered Species of Wild Fauna and Flora, CITES, or the Species At Risk Act, or those that would present human health or food safety concerns. As a member of the CITES, Canada aims to ensure that international trade in specimens of wild animals and plants does not threaten a species’ long-term survival. The porbeagle shark, the oceanic whitetip shark, the hammerhead, the great white shark, the whale shark and the basking shark are all listed on appendix II of the Convention. Countries exporting any of these species must prove the sustainability of their country’s harvest and issue export permits for international trade. Canada takes seriously its legal obligation to prevent the import of products from these shark species. 
In fisheries where harvesters are permitted to retain skates or rays, de-winging is permitted as a form of processing at sea and a conversion factor is applied to the weight of the wings landed to ensure that the overall established total allowable catch for the stock in question is not exceeded. In most of these fisheries there is 100% dockside monitoring, and in some cases there is 100% observer coverage. As de-winging and accounting for the harvests of skates and rays is not currently a conservation issue, there are no plans to implement any measures to prohibit the removal of skate and ray wings at sea. ",Liberal,Burnaby North—Seymour,Terry Beech,http://www.parl.gc.ca/Parliamentarians/en/members/terry-beech(229500)
