basepk,hid,speechdate,pid,opid,speakeroldname,speakerposition,maintopic,subtopic,subsubtopic,speechtext,speakerparty,speakerriding,speakername,speakerurl
4703089,ca.proc.d.2017-05-01.p0,2017-05-01,,,,stagedirection,,Privilege,Reference to Standing Committee on Procedure and House Affairs,"The House resumed from April 13 consideration of the motion, of the amendment and of the amendment to the amendment. 
The House resumed from April 13 consideration of the motion, of the amendment and of the amendment to the amendment. ",,,,
4706136,ca.proc.d.2017-05-01.p4853584,2017-05-01,,,,stagedirection,,,,"The House resumed from April 13 consideration of the motion, of the amendment and of the amendment to the amendment. ",,,,
4706137,ca.proc.d.2017-05-01.9487534,2017-05-01,07cf5767-802c-406c-92a7-7dc92af79b40,229526,"Mr. Kevin Lamoureux (Parliamentary Secretary to the Leader of the Government in the House of Commons, Lib.)",,,,,"Mr. Speaker, I will be splitting my time with the member for Waterloo.
I have had the opportunity, like many members of this House, to listen at great length in regard to what is indeed a very serious issue. We all acknowledge the importance of unfettered access to the Parliament building and the parliamentary precinct. We all understand why it is so absolutely critically important that as members, we treat the issue very seriously. I would suggest that all members of this House recognize the importance of this issue. It is one reason we believe the matter needs to be dealt with by the procedure and House affairs committee, or PROC.
We had an incident a while back when members did not have that unfettered access. It would appear that unfettered access was, in fact, denied. I want to be very sensitive to that issue. Members of the procedure and house affairs committee are genuine in wanting to have the issue dealt with. I used to sit on that committee, and I have dealt with this very issue of unfettered access. We have had reports from the procedure and house affair committee in the past regarding the importance of unfettered access. Through this debate, we have had members stand in their places and talk about what is stated on the back of their MP cards, the passionate reasons they want to represent their constituents inside this House, in particular, and why it is so critical that we have unfettered access.
Having said that, I have found that the majority of the discussion or the debate coming across from the other benches seems to have focused not necessarily on that issue as much as on the issue of what has been taking place in PROC and some of the issues related to it. I want to use the same latitude that has been given on these important issues, because the opposition has been tying it in as one and the same, which ultimately has led to the privilege issue we are debating today.
I have been a parliamentarian for well over two decades. I have had the opportunity to participate in House leadership issues virtually from the day I was elected, when then leader Sharon Carstairs appointed me, as my colleague from Winnipeg Centre would be very well aware, because we were both elected to the Manitoba Legislature at the same time, back in 1988, the official opposition party whip. 
I understand the importance of the chamber and the proceedings of the chamber. I understand the importance of the opposition and the tools that are available to the opposition. I was in opposition for over 20 of those years as a parliamentarian. I understand the importance of the rules. Unlike many members, I suspect, I am actually very passionate about the rules of this House and Parliament, whether it is here in Ottawa or in Manitoba. Quite often when we talked about or made rule changes in the province of Manitoba, we would look at what was taking place in Ottawa. 
I believe that the Prime Minister is genuinely trying to modernize Parliament. I really believe that. There were commitments made in the last federal election by the Prime Minister to do just that. It has been a long time, the last decade plus, since I have heard so much coming from a leader about the need to reform, and there is a need to reform. There are so many things we could be doing to improve this place.
An issue many members have chosen to talk about, and I use it as an example, is the issue of Fridays. I tell whoever wants to hear it that as an MP, and I am not unique, I work seven days a week. I suggest that this applies on both sides of the House. It is only a question of where it is I am actually working, Ottawa or Winnipeg. 
Through the discussion paper, we were asking the procedures and House affairs committee to have this issue, among many other issues, discussed and to have some professionals and individuals who have first-hand experience come before the committee to express what they believe.
 I will share with members my thoughts on this issue. If it means readjusting some hours to put in more hours on Mondays, Tuesdays, Wednesdays, or Thursdays, I am open to that, because I see the benefit. I am not in favour of reducing the number of hours. Friday is only a half-day, after all. We started today at 11 o'clock. I am personally okay with starting a couple of hours earlier on Monday or Tuesday. I am not shy about working. I am sure all members of this House are not shy about working.
Another issue the opposition members tend to want to talk a lot about is the issue of a prime minister's question period. I sat in opposition for many years, and I may not have been in the first or second round of asking questions. I can say that if there was a prime minister's day, where the Prime Minister was answering every question that was posed, then the Prime Minister would be responding to many of the individuals who would likely not have that opportunity, for a wide variety of reasons. The idea of having only one day a week on which the Prime Minister would come in is something that is being talked about on the other side. There is not one Liberal, including the Prime Minister himself, who is saying that this would be the case.
There are many different issues that will come before this chamber over the next number of years. I would suggest that we would be doing all Canadians a service if we recognized that we must modernize our Parliament. We can do better. It saddens me that there is a feeling that there is a conspiracy taking place, when I know that it is not the case. We have a wonderful opportunity to improve this House and to ensure that members are more effective in what they do.
I would challenge all members of the House, on both sides of the chamber, to understand and appreciate the significance of modernizing Canada's Parliament. The government House leader has gone out of her way to engage with individuals, whether through PROC or in informal discussions with members. She has been open to anyone who has wanted to talk about it. She understands how important it is that we move forward on this file, as do, I believe, most members of this chamber and the cabinet. If we are successful in making these changes, it will modernize this Parliament and will be of great service to the constituents we represent.
We like to say, and as members know, I speak quite often in this House, that we believe in representing our constituents in Ottawa and that we are maximizing our time and effort and are doing good. We can do so much more if we are prepared to recognize what other legislatures across this country have done, which is modernize. Other countries in Europe have done so. We do not have to drag our feet. I have been involved first-hand in trying to change the Standing Orders in Ottawa. I sat on PROC. We can do some minor tweaking here and there with a comma or a period, but we need to modernize. My challenge to all members of this House is to let us get down to business. All Canadians will benefit if we can get this right.
 ",Liberal,Winnipeg North,Kevin Lamoureux,http://www.parl.gc.ca/Parliamentarians/en/members/kevin-lamoureux(229526)
4706138,ca.proc.d.2017-05-01.9487546,2017-05-01,eb8710eb-e6dd-4c04-9d9a-60e7c8503565,214215,"Mr. Kennedy Stewart (Burnaby South, NDP)",,,,,"Mr. Speaker, we are all excited to hear what the member has to say. 
Will any changes be built on consensus, or will they be rammed through unilaterally by the government?",NDP,Burnaby South,Kennedy Stewart,http://www.parl.gc.ca/Parliamentarians/en/members/kennedy-stewart(214215)
4706139,ca.proc.d.2017-05-01.9487548,2017-05-01,07cf5767-802c-406c-92a7-7dc92af79b40,229526,Mr. Kevin Lamoureux,,,,,"Mr. Speaker, let me share with the member some first-hand experience. When I sat down with governments in Manitoba, whether they were NDP or Conservative governments, both of which made rule changes, never did I say to my respective counterparts that if they did not give me a veto, I would not agree to any changes. 
We need to recognize that there needs to be a sense of goodwill. It would be irresponsible to say that unless we have unanimous consent, we are not going to attempt to modernize Parliament. As a majority government, that would be irresponsible. Equally, it would be irresponsible for members of the House not to recognize that there is a role for all parliamentarians to play to see if we can, in a more co-operative fashion, get some rules changed. Because one party decides it does not want to see any rule changes, for whatever reasons, does not mean it should ultimately prevail. That is not in Canada's best interest.",Liberal,Winnipeg North,Kevin Lamoureux,http://www.parl.gc.ca/Parliamentarians/en/members/kevin-lamoureux(229526)
4706140,ca.proc.d.2017-05-01.9487550,2017-05-01,b6e2c8aa-fc83-4d52-ad66-7910b8805f90,216461,"Mr. Arnold Viersen (Peace River—Westlock, CPC)",,,,,"Mr. Speaker, I was not here in the last Parliament, but I understand that over the last several years, changes have been made, and I understand that the member was involved in some of those changes. Could my colleague elaborate on the procedure in the last Parliament and how those decisions were reached? My understanding is that they were consensus-based. Could he confirm or deny that?",Conservative,Peace River—Westlock,Arnold Viersen,http://www.parl.gc.ca/Parliamentarians/en/members/arnold-viersen(216461)
4706141,ca.proc.d.2017-05-01.9487553,2017-05-01,07cf5767-802c-406c-92a7-7dc92af79b40,229526,Mr. Kevin Lamoureux,,,,,"Mr. Speaker, no significant changes based on consensus came out of PROC. There were a couple of significant changes that occurred through a Conservative member and a government member, through private members' issues, for which unanimous consent was never sought. It was a simple majority determination. They were related to the Speaker in the chamber and electronic petitions, if I recall correctly.",Liberal,Winnipeg North,Kevin Lamoureux,http://www.parl.gc.ca/Parliamentarians/en/members/kevin-lamoureux(229526)
4706142,ca.proc.d.2017-05-01.9487555,2017-05-01,eb8710eb-e6dd-4c04-9d9a-60e7c8503565,214215,Mr. Kennedy Stewart,,,,,"Mr. Speaker, I rise on a point of order. I have heard that claim over and over again, and it is untrue. The report that came back from PROC on e-petitions was approved unanimously. I invite the member to correct the record.",NDP,Burnaby South,Kennedy Stewart,http://www.parl.gc.ca/Parliamentarians/en/members/kennedy-stewart(214215)
4706143,ca.proc.d.2017-05-01.9487556,2017-05-01,16c839d3-0183-4ed6-892a-8d7bdc37c474,214972,The Assistant Deputy Speaker (Mr. Anthony Rota),,,,,"I believe that is debate, but I will let the hon. parliamentary secretary continue.",Liberal,Nipissing—Timiskaming,Anthony Rota,http://www.parl.gc.ca/Parliamentarians/en/members/anthony-rota(214972)
4706144,ca.proc.d.2017-05-01.9487557,2017-05-01,07cf5767-802c-406c-92a7-7dc92af79b40,229526,Mr. Kevin Lamoureux,,,,,"Mr. Speaker, the member is wrong. I was in committee when it was actually being debated. For the member to say that there was unanimous consent is just wrong. I do not know why the member would say that. I sat--",Liberal,Winnipeg North,Kevin Lamoureux,http://www.parl.gc.ca/Parliamentarians/en/members/kevin-lamoureux(229526)
4706145,ca.proc.d.2017-05-01.9487558,2017-05-01,16c839d3-0183-4ed6-892a-8d7bdc37c474,214972,The Assistant Deputy Speaker (Mr. Anthony Rota),,,,,I believe we have another point of order.,Liberal,Nipissing—Timiskaming,Anthony Rota,http://www.parl.gc.ca/Parliamentarians/en/members/anthony-rota(214972)
4706146,ca.proc.d.2017-05-01.9487559,2017-05-01,eb8710eb-e6dd-4c04-9d9a-60e7c8503565,214215,Mr. Kennedy Stewart,,,,,"Mr. Speaker, maybe the member misheard. When the report from PROC came back to the House, it was unanimously--",NDP,Burnaby South,Kennedy Stewart,http://www.parl.gc.ca/Parliamentarians/en/members/kennedy-stewart(214215)
4706147,ca.proc.d.2017-05-01.9487560,2017-05-01,16c839d3-0183-4ed6-892a-8d7bdc37c474,214972,The Assistant Deputy Speaker (Mr. Anthony Rota),,,,,That is a point of debate. We will let the hon. parliamentary secretary continue.,Liberal,Nipissing—Timiskaming,Anthony Rota,http://www.parl.gc.ca/Parliamentarians/en/members/anthony-rota(214972)
4706148,ca.proc.d.2017-05-01.9487561,2017-05-01,07cf5767-802c-406c-92a7-7dc92af79b40,229526,Mr. Kevin Lamoureux,,,,,"Mr. Speaker, the member is trying to be tricky here. The member would do better if he were straightforward. He just admitted that I was right. There was no unanimous consent. I sat in that committee as it went through committee. There was a sense of excitement during the discussion on electronic petitions, but to try to give the impression that at the very beginning there was unanimous support for it is just wrong.",Liberal,Winnipeg North,Kevin Lamoureux,http://www.parl.gc.ca/Parliamentarians/en/members/kevin-lamoureux(229526)
4706149,ca.proc.d.2017-05-01.9487564,2017-05-01,48fc6e8f-3117-407b-bba3-bd6eede347ec,224672,"Hon. Bardish Chagger (Leader of the Government in the House of Commons and Minister of Small Business and Tourism, Lib.)",,,,,"Mr. Speaker, I rise today to join this debate and to address some of the statements that have been made by hon. members in the days we have discussed this matter of privilege.
Let me start by saying how seriously our government takes matters of parliamentary privilege. We believe there should be no doubt about the fact that members of Parliament should have unfettered access to this chamber and to the entire parliamentary precinct. 
As Leader of the Government in the House of Commons, I believe strongly in the rights of all members to be present here to represent their constituents, so anytime that a member draws to our attention an incident in which he or she was denied that privilege, we must look at it closely and look at what happened.
Canadians have sent each of us here to be their voice and to improve the way that Parliament works. It is for this reason that earlier this spring I released a discussion paper on the Standing Orders. It contains ideas on how to modernize the House of Commons to make it more effective, accountable, and transparent. The debate on this motion of privilege has from time to time veered into disagreements over this discussion paper. Some of my colleagues across the aisle have drawn certain conclusions about the purpose of the paper. 
As government House leader, I had truly hoped we could start a discussion about modernization at the Standing Committee on Procedure and House Affairs. This has not happened, and I regret that. It was always my intention to engage members in a respectful discussion about how we could improve this place. I accept and respect that members have heartfelt and legitimate views on the important ideas we have raised for public discussion. I also accept that our disagreements on this matter have had an impact on the work of the House in recent weeks. 
It is time to get back to work, to focus on what Canadians have sent us here to do, and to chart a path forward. That is what I would like to discuss today. 
In the last election, we promised real change, to give Canadians a voice in Ottawa, to make the government more accountable in Parliament, and to modernize the House of Commons. Our goal was clear: to better service Canadians, to make this place more effective and transparent, and to encourage more people, from all walks of life, to run for public office so that this House truly reflects our country. 
Canadians responded by electing a Liberal government with a clear mandate to bring change to Parliament. We are committed to acting on that mandate. Yesterday, I informed my Conservative and NDP counterparts of our plan going forward. We will move ahead with the specific commitments from our election platform, all of which would make the government more accountable, not less. This includes a regular prime minister's question period, in addition to the current practice. Our Prime Minister has shown it can be done. He can and will answer many more questions in this chamber. We believe Canadians will benefit if this practice applies to future governments as well.
The second measure is to ensure that governments are forced to justify their actions if they shut down Parliament through prorogation. Governments should pay a price if they resort to legislative tricks to avoid accountability. 
The third measure is to prevent the inappropriate use of omnibus bills. Parliament should have the power to properly scrutinize legislation that contains unrelated policy changes. 
The fourth measure is to strengthen committees. We all know how important committees are to the work that we do here. We need to ensure they have the resources they need, and we need to change the rules so that ministers and parliamentary secretaries do not have a vote on committees. 
The fifth measure is financial oversight. Governments have an obligation to ensure that MPs have consistent and clear information when they are voting on matters such as estimates. 
It is time to make that happen. These are the pledges we made to Canadians in the last election. They are changes that will improve accountability in Parliament. We hope our colleagues on the opposition benches will agree. However, we will not give the Conservatives a veto on the implementation of these commitments that we have made to Canadians. 
Another question that we hoped to discuss is Friday sittings. The issue revolves around whether we should continue the practice of half-day sittings here on Fridays, or to switch to a full constituency day in our own communities. If we make the change, it would be important to reallocate those hours of debate from Friday sittings to other days or weeks. We will now conduct additional consultations with our caucus on this issue of Friday sittings and reallocation of time, and we expect that our colleagues in other caucuses will want to do the same. 
There were many other new ideas in the discussion paper. All of them were offered in good faith. I have now told my Conservative and NDP counterparts that our government does not intend to move forward on those ideas at the present time. We had hoped there would be a willingness to examine the concept of legislative programming to manage time for debating legislation. Unfortunately, that willingness does not exist. Therefore, it is with regret that I inform my colleagues that under these circumstances, the government will need to use time allocation more often to implement the ambitious agenda we were elected to deliver. This will be done every time with full transparency.
As we move forward, we remain committed to strengthening and modernizing Parliament. I will always welcome a dialogue among House leaders about how we can work together to make the House of Commons a place where we can better represent our constituents.
In closing, let me make one thing clear. Canadians have high expectations of all of us in this place, and so they should. They want a Parliament that holds government to account. They want a House of Commons where political discourse is respectful and debate is constructive, and they want a Parliament that is productive. It is time to get to work, so let us join together to make that happen.",Liberal,Waterloo,Bardish Chagger,http://www.parl.gc.ca/Parliamentarians/en/members/bardish-chagger(224672)
4706150,ca.proc.d.2017-05-01.9487569,2017-05-01,9d3d2220-818c-494e-8d58-29f7cee7b65d,216537,"Hon. Candice Bergen (Portage—Lisgar, CPC)",,,,,"Mr. Speaker, what Canadians have seen over the last year and a half is a Prime Minister they cannot trust, a Prime Minister who says one thing and does something completely opposite, a Prime Minister and a Liberal government that is arrogant and has misled Canadians on a number of occasions. The Minister of National Defence has not told the truth and has now given himself credit for something he did not do. We have a House leader who is saying that changes are going to be rammed through that will make ministers and the Prime Minister less accountable. He will only have to be here for one hour on one day a week when the House is sitting.
How can Canadians trust the Liberals and the Prime Minister on anything when they have said one thing and done something different on so many levels? Now he wants to be here on only one day a week for one hour to answer questions.",Conservative,Portage—Lisgar,Candice Bergen,http://www.parl.gc.ca/Parliamentarians/en/members/candice-hoeppner(216537)
4706151,ca.proc.d.2017-05-01.9487571,2017-05-01,48fc6e8f-3117-407b-bba3-bd6eede347ec,224672,Hon. Bardish Chagger,,,,,"Mr. Speaker, let me be clear. All of the changes we are recommending will allow the government to be held to greater account, not less. When it comes the prime minister's question period, we have shown that this is possible. This one day would be in addition to the other days in a week that the Prime Minister is here. What the hon. member is saying is not true. No members in the Liberal caucus are recommending that the Prime Minister only attend on one day. We are recommending that the Prime Minister be held to greater account, so that not just the leaders of the opposition, but private members are also able to ask the Prime Minister questions and receive a response directly from the Prime Minister. We believe that this will allow the government to be held to greater account.",Liberal,Waterloo,Bardish Chagger,http://www.parl.gc.ca/Parliamentarians/en/members/bardish-chagger(224672)
4706152,ca.proc.d.2017-05-01.9487573,2017-05-01,0c9d00b0-a035-46d3-ba51-0db3e8da19b8,227114,"Mr. Murray Rankin (Victoria, NDP)",,,,,"Mr. Speaker, are we to understand that the effect of this motion that the government intends to bring regarding the vast majority of items contained in the discussion paper is that the government will, with its majority, ram those changes through against the opposition of recognized parties in this place?",NDP,Victoria,Murray Rankin,http://www.parl.gc.ca/Parliamentarians/en/members/murray-rankin(227114)
4706153,ca.proc.d.2017-05-01.9487575,2017-05-01,48fc6e8f-3117-407b-bba3-bd6eede347ec,224672,Hon. Bardish Chagger,,,,,"Mr. Speaker, when we ran in the election, we made commitments to Canadians. We made a commitment to modernize the way that this place works. We made a commitment to make government more open and transparent. We are committed to delivering on those promises. A motion will be introduced in this place and will be open to debate. As with the discussion paper, we would like to have a conversation to talk about these ideas. I will continue to encourage all members to be part of that discussion.",Liberal,Waterloo,Bardish Chagger,http://www.parl.gc.ca/Parliamentarians/en/members/bardish-chagger(224672)
4706154,ca.proc.d.2017-05-01.9487578,2017-05-01,eaa6694f-1e20-4aae-ad3b-e694b0e12c59,224170,"Ms. Elizabeth May (Saanich—Gulf Islands, GP)",,,,,"Mr. Speaker, I want to thank the hon. government House leader for withdrawing the most offensive portions of the proposed discussion paper. That is a positive move as we go forward. However, I am concerned. 
As she will know, I presented a very substantive response to her discussion paper, suggesting ways that we could reduce the greenhouse gas content. The carbon footprint of our schedule is large and is brought about because of technology. We are modernizing Parliament, but society around us is modernized. Parliament is still operating in an antiquated fashion, but we do not want to modernize in the interest of government majorities always getting their way without a real effort at consensus. We also do not want to modernize in a way that increases the number of flights and the cost to taxpayers.
Can we have any sense from the government House leader if her government, whether all of us together or the Standing Committee on Procedure and House Affairs, will have an opportunity to discuss and debate more than the suggestions that came from the government, for instance, proposals such as those from the Green Party?",Green,Saanich—Gulf Islands,Elizabeth May,http://www.parl.gc.ca/Parliamentarians/en/members/elizabeth-may(224170)
