basepk,hid,speechdate,pid,opid,speakeroldname,speakerposition,maintopic,subtopic,subsubtopic,speechtext,speakerparty,speakerriding,speakername,speakerurl
4706187,ca.proc.d.2017-05-01.9487712,2017-05-01,eaa6694f-1e20-4aae-ad3b-e694b0e12c59,224170,"Ms. Elizabeth May (Saanich—Gulf Islands, GP)",,,,,"Mr. Speaker, the issue of access to Parliament Hill first arose under the previous government. The member was not in the 41st Parliament, but we did have problems where Parliament was being used for visiting heads of state and dignitaries instead of the traditional practice of using Rideau Hall. This did create conflicts, where the business of Parliament was up against security concerns for visiting heads of state. I remember this particularly in the case of Netanyahu's visit, but there were others. 
Subsequent to that, we had the horrible incident of October 22, 2014. There was a very quick response by the previous administration to change the security rules on the Hill, in my view without adequate consultation with members of Parliament and without adequate public debate, where we have now changed from having the House of Commons security in charge, and the 500 years of tradition that the Speaker protects the rights of MPs and of the place. We should never put that in the hands of a governing party or a prime minister. We have done that now by putting the RCMP in charge of Parliament Hill security because of these issues of access to the place, because of not being able to get here in time to vote which is the question of privilege that is being debated today.
I remain concerned that this change was made without adequate debate. Is my friend at all concerned to have a political party of the day have control over our access to this place, whether by accident or by intention?",Green,Saanich—Gulf Islands,Elizabeth May,http://www.parl.gc.ca/Parliamentarians/en/members/elizabeth-may(224170)
4706188,ca.proc.d.2017-05-01.9487714,2017-05-01,bd2068aa-74c7-430a-bdf5-6f17b14ca140,216501,Mr. Tom Kmiec,,,,,"Mr. Speaker, it is a difficult question to answer because I am not a specialist on personal security, especially when it comes to an institution like Parliament. The precinct is quite large and it has enlarged over time to include new offices and new committee rooms, and it keeps on expanding. Site security has been done by the RCMP for quite a while. 
I was actually here as a staff member to another member of Parliament about 12 years ago. I remember when there were two different security services. In my eyes back then, it was inadequate. It did not provide the type of oversight that was needed. It was very different on the Senate side from the House of Commons side. I find that the PPS today does an excellent service protecting us. I feel far more comfortable having more officers both inside the building and outside the building protecting members of Parliament.
I will mention one thing that I have found interesting. Far too many vehicles are still allowed access to Parliament Hill. Far too many vehicles are on Parliament Hill. Some are stopped and are idling. Some perhaps are waiting for a minister. There are taxis and trucks. That is a far greater area of concern for me than having a united parliamentary security service provided for members of Parliament.",Conservative,Calgary Shepard,Tom Kmiec,http://www.parl.gc.ca/Parliamentarians/en/members/tom-kmiec(216501)
4706189,ca.proc.d.2017-05-01.9487716,2017-05-01,101111c4-d4b7-46a9-9f88-9bfa542bb606,229700,"Mr. David de Burgh Graham (Laurentides—Labelle, Lib.)",,,,,"Mr. Speaker, this is a quick follow-up on the question from the member for Saanich—Gulf Islands. I rather appreciated it. I think the point of it was after the attacks of October 2014 the rules changed to take the parliamentary protective service away from Parliament and give it to the RCMP and change the chain of command. I think that is a concern for many members. It has come up at PROC many times.
I wonder if the member is aware of that change and what he thinks of it. I think it was a very fair question from the member for Saanich—Gulf Islands.",Liberal,Laurentides—Labelle,David Graham,http://www.parl.gc.ca/Parliamentarians/en/members/david-graham(229700)
4706190,ca.proc.d.2017-05-01.9487718,2017-05-01,bd2068aa-74c7-430a-bdf5-6f17b14ca140,216501,Mr. Tom Kmiec,,,,,"Mr. Speaker, I am familiar with the change because it did make the news when those changes were made after the terrorist attacks on Parliament Hill,. On the details of the change and how the change affects security, the differences and different models, I am not a specialist on the security of large buildings such as this, and the types of services. I would defer to the members of PROC to have a better understanding of it and to provide a report to the House to make the final determination on how we should proceed to ensure the security of staff members, members of Parliament, and senators as well.",Conservative,Calgary Shepard,Tom Kmiec,http://www.parl.gc.ca/Parliamentarians/en/members/tom-kmiec(216501)
4706191,ca.proc.d.2017-05-01.9487720,2017-05-01,07cf5767-802c-406c-92a7-7dc92af79b40,229526,Mr. Kevin Lamoureux,,,,,"Mr. Speaker, I appreciate the importance of unfettered access. 
 I have had the opportunity to sit on PROC and we have had some great dialogue from professionals, including the commissioner of the RCMP, who have come forward to tell us what happened, what caused it. There are recommendations or discussions that follow from that committee's hearings.
If we just base it on previous discussions on matters of privilege that are recommending unfettered access, typically they tend to go into the committee in a much more prudent, faster way. I am wondering if the member thinks that we are getting close to seeing this actually go to PROC where PROC can get to work on this very important issue.",Liberal,Winnipeg North,Kevin Lamoureux,http://www.parl.gc.ca/Parliamentarians/en/members/kevin-lamoureux(229526)
4706192,ca.proc.d.2017-05-01.9487722,2017-05-01,bd2068aa-74c7-430a-bdf5-6f17b14ca140,216501,Mr. Tom Kmiec,,,,,"Mr. Speaker, of course I would love to see this go to PROC, once members in this House have fully debated the matter. Any member is free to stand up and contribute to the debate, which then forms part of the transcript that members of PROC can use in their consideration at the committee for the types of expert witnesses they may want to call or members of Parliament they may want to have there for that further discussion at committee. 
I sit on the foreign affairs committee and I have gone back through the Hansard transcripts many times to see what other members of Parliament have said. We can ask some for their thoughts on specific matters.
Once members have spoken to this and once no further members wish to rise to debate this issue, I fully expect it to go to PROC.",Conservative,Calgary Shepard,Tom Kmiec,http://www.parl.gc.ca/Parliamentarians/en/members/tom-kmiec(216501)
4706193,ca.proc.d.2017-05-01.9487725,2017-05-01,e915cec9-7164-4846-aeb5-d5bf2e4f3598,214562,"Mr. Xavier Barsalou-Duval (Pierre-Boucher—Les Patriotes—Verchères, BQ)",,,,,"Mr. Speaker, I want to begin by saying that I will be sharing my time with the member for Saanich—Gulf Islands.
We can all agree that the lapel pins we wear are not what makes us the people's elected representatives. This symbol is useful for security purposes. However, it should not have any bearing on a member's privilege to sit in the House. Parliament belongs to the people, and its representatives should always have access to this place, whether they are wearing their lapel pin or not.
That being said, the question of privilege that was raised today is more anecdotal than fundamental. Fundamentally, there are, in the House, members and legislators who cannot fully participate in the legislative process. I am talking about the 10 members of the Bloc Québécois and the member of the Green Party.
Today, we are talking about a question of privilege because we want our democracy to be as fair and effective as possible. As a result, we are talking about how the House works. That is healthy, and it is a good thing to do. First and foremost, we need to ask ourselves whom the House belongs to. It belongs to the people. We are here as representatives of the people. It is the voice of the people that is heard in the House of Commons, or at least that is the spirit of our democracy.
Like the Liberal Party, the Conservative Party, and the New Democratic Party, the Bloc Québécois and the Green Party are parties that are recognized by Elections Canada. Representatives of these parties were elected as members of the House of Commons. However, at present, only parties with 12 elected members or more have official party status. This standard for recognition is a tradition, but it is not set out in any law.
 The only thing in the Parliament of Canada Act about the required number of elected officials is that a threshold of 12 elected members is needed to establish the additional allowances for the representatives of a recognized party. That is not what we are asking for. We are not asking for additional allowances for representatives of our parties. What we are asking is that all members have the same rights in the House. What would that mean? It would mean, for example, that we would be able to sit on standing committees of the House. It would also mean that we would be able to ask questions in oral question period. At this point in time, on some days we can and on others we cannot. We are never sure whether we will be able to speak. It would also mean that we would be able to fully play our role as elected members and members of the opposition. We would have a budget with which to do our work. Parties must have at least 12 members to have a budget.
 The real losers in all this are not only the parties with fewer than 12 elected representatives, but the entire population. Nearly a million Quebeckers are penalized at the polls because of partisanship. Budgets that enable the parties to do their parliamentary work, be it for party leaders, whips, House leaders, research, support, or IT, are set by the Board of Internal Economy after the general election.
The way we see it, there is nothing preventing the Board of Internal Economy from granting additional funds to parties that are currently unrecognized, funds that would allow them to hire researchers so they can better perform their role and represent their constituents effectively, just like the other MPs in the House of Commons. 
This is not just about political will. Unfortunately, there appears to be a clear absence of political will when it comes to parties other than those with at least 12 elected members, and voters are the ones who pay the price.
I would like to talk about how it works in Quebec. The Office of the National Assembly grants research and support budgets to all political parties with elected members. Under section 108 of the Act respecting the National Assembly, all political parties represented in the Assembly receive monies for research and support purposes. That applies to independent members too.
 The amount provided will be used to cover operational and research expenses, which includes staff salaries. At present, parties with fewer than 12 members must cut their constituency budgets in order to conduct research. That is why the service is not as good in Ottawa, since some parties have less money than others to provide this service, and not as good in our ridings, since part of the constituency budget has to be cut in order to do research.
The NDP, which currently has 44 elected MPs, has an average supplementary budget of about $90,000 per member for research. This budget is used by the party leader, whip, and caucus leader, and for everything from translation to IT to coffee during caucus meetings. The Standing Orders discount 8% of the Canadian electorate. In fact, the House of Commons is discounting the 5% of Canadians who voted for the Bloc Québécois and the 3% of Canadians who voted for the Green Party. As a result, the MPs chosen by more than 1.4 million voters do not have the resources needed to fulfill their role. Is that a good thing for democracy? I hardly think so. Democracy seems to be taking a back seat when it comes to how political parties are recognized in the House.
I would like the other parties to talk about this because generally when we ask the question, they always try to avoid answering it. For so many people to have their elected representative denied the same budget as members of other parties that have more than 12 elected members does not make very much sense to us. It is the voters who determine party recognition because they are the ones who vote for the parties represented in the House. The members of those parties are entitled to the same things as all the others. A two-tier parliamentary system is far from what the public wants. 
In November 2015, there were 200 new members in the House. These members will recall that the Prime Minister came to welcome them all at the Sir John A. Macdonald building. At the time, he told them that his role as the member for Papineau took precedence over his role as Prime Minister. We would like him to fully assume that role and understand that the reality of members is as important as that of the Prime Minister and as important as partisanship. Whatever happened to his fine words? We look forward to seeing what comes of this.
 It is time to move from rhetoric to action by recognizing that MPs from all political parties need similar tools in order to properly represent their constituents. We share the Prime Minister's desire to put legislative powers and the work of members before partisanship. I would remind everyone that the House belongs to the people, not the parties.
The same goes for committees. We do not sit on committees, other than when we are given a few short minutes to speak when it suits everyone, or just about everyone. However, meaningful democratic reform would allow members of the Bloc Québécois and the Green Party to sit on committees. I am convinced that the member for Saanich—Gulf Islands would very much like to sit on the Standing Committee on Environment and Sustainable Development and that she would have many positive things to say that would bring a lot to Parliament and the government.
Our Parliament is the only one in the world that works this way. Every provincial legislature recognizes parties even when they have fewer elected members. That is also the case in London, which was cited as an example by the government. In fact, in London, budgets are allocated when a party has two elected members. The situation in the House of Commons is very unfair and unacceptable and the House must absolutely study this issue because it is not what the people want. The people want the MPs they voted for to be able to speak and to have the means to do their jobs. It is quite simply a question of good faith and democracy.",Bloc,Pierre-Boucher—Les Patriotes—Verchères,Xavier Barsalou-Duval,http://www.parl.gc.ca/Parliamentarians/en/members/xavier-barsalou-duval(214562)
4706194,ca.proc.d.2017-05-01.9487729,2017-05-01,101111c4-d4b7-46a9-9f88-9bfa542bb606,229700,"Mr. David de Burgh Graham (Laurentides—Labelle, Lib.)",,,,,"Mr. Speaker, as the member for Pierre-Boucher—Les Patriotes—Verchères knows, I represent the riding of Laurentides—Labelle, which is north of Montreal. It is a large rural riding that was represented by the Bloc Québécois for a long time and then by the NDP for a few years.
Since becoming an MP, I have noticed, when travelling around the riding, that people often say that a federal MP can really get things done. For nearly 20 years, my constituents had MPs who worked very hard to convince them that the federal government was absolutely useless, that it could not help communities, and that it was not there for people. As a result, it makes me a little bit angry to hear the member talk about the need to stand up for voters' interests, when his party worked against those people's interests for decades.
Can my colleague tell us what the purpose of the Bloc Québécois is?",Liberal,Laurentides—Labelle,David Graham,http://www.parl.gc.ca/Parliamentarians/en/members/david-graham(229700)
4706195,ca.proc.d.2017-05-01.9487731,2017-05-01,e915cec9-7164-4846-aeb5-d5bf2e4f3598,214562,Mr. Xavier Barsalou-Duval,,,,,"Mr. Speaker, I am wondering what my colleague's question has to do with what I just said, but I will answer him anyway, because he asked me a very good question.
The member was elected in the riding of Laurentides—Labelle, a riding that was held by the Bloc Québécois for a long time and by the NDP for a short time. Voters had every right to vote for this member, and I congratulate him on getting elected. I am very happy to hear that his constituents are pleased with his work.
However, I have no doubt that the people in his riding who voted for a member of the Bloc Québécois for 20 years were also pleased with the work that the member did. In order to respect democracy, we need to respect the vision of all voters and parliamentarians. Members of the Bloc Québécois work in the interests of the people who voted for them. In other words, we are working to make Quebec a country.
The member across the way gave us several examples of how important MPs' work is, but I want to point out that the work of all MPs is important, including Bloc Québécois MPs. We are not happy with some of Ottawa's decisions, such as financing Ontario's auto industry, which might be okay because all industries need financing, and Alberta's oil sands, which we do not support at all.
Why is it that the federal government regularly decides to finance these industries at the same level as the provinces, but when it comes to Quebec companies like those in our aerospace industry, it tosses a few crumbs their way just so it can say that it helped them a little?
The same thing is happening with the softwood lumber crisis. The Government of Quebec did its bit to resolve the crisis, but the federal government just cannot commit to helping the industry. The Americans have slapped a 20% duty on our lumber, but the government says it wants to consult. That is what it always says when it comes to Quebec, but when it comes to the other provinces, it is ready to invest. For example, in the latest budget, a cool $100 million for Alberta was not long in coming.
Why is the government doing this? When it comes to protecting the French language, the minister says that she will hold consultations. However, when the time comes to take action, the government does not give Quebec a single penny to protect the French language. That does not work.
That is why we take issue with all this, and this is how we demonstrate our usefulness. We have many more things to say, but I believe that my time is up.",Bloc,Pierre-Boucher—Les Patriotes—Verchères,Xavier Barsalou-Duval,http://www.parl.gc.ca/Parliamentarians/en/members/xavier-barsalou-duval(214562)
4706196,ca.proc.d.2017-05-01.9487734,2017-05-01,eaa6694f-1e20-4aae-ad3b-e694b0e12c59,224170,"Ms. Elizabeth May (Saanich—Gulf Islands, GP)",,,,,"Mr. Speaker, I thank my colleague from Pierre-Boucher—Les Patriotes—Verchère.
To me, money is not the biggest problem. The problem is that hon. members are not equal. In theory, all hon. members are meant to be equal, but in reality, we are not. Money is not the root of the problem: power is. The fact that only parties with more than 12 members have any power is not a legislative issue, but a matter of tradition. I would like the hon. member to say a few words about that.",Green,Saanich—Gulf Islands,Elizabeth May,http://www.parl.gc.ca/Parliamentarians/en/members/elizabeth-may(224170)
4706197,ca.proc.d.2017-05-01.9487736,2017-05-01,e915cec9-7164-4846-aeb5-d5bf2e4f3598,214562,Mr. Xavier Barsalou-Duval,,,,,"Mr. Speaker, I agree with my colleague from Saanich—Gulf Islands that money is not the only problem and that there is also the issue of representation and power. For example, the power to sit on a committee allows the member to express his or her opinion, call witnesses and ask them very useful and very relevant questions that introduce other points of view.
This is also about the power to regularly take part in question period in a reasonable order instead of asking the last question of the day. There is also the power to speak to bills introduced in the House without constantly being relegated to the last speaking spot and thereby losing the chance to speak to most bills. This is undemocratic.",Bloc,Pierre-Boucher—Les Patriotes—Verchères,Xavier Barsalou-Duval,http://www.parl.gc.ca/Parliamentarians/en/members/xavier-barsalou-duval(214562)
4706198,ca.proc.d.2017-05-01.9487739,2017-05-01,16c839d3-0183-4ed6-892a-8d7bdc37c474,214972,The Assistant Deputy Speaker (Mr. Anthony Rota),,,,,"Before resuming debate, I want to remind hon. members that people are speaking. It is just before question period. I know we have had a break and members have forgotten how it works. It is nice to see everybody getting together and talking, but the rumble gets a little loud, and it is hard to hear the hon. member speaking.
Resuming debate, the hon. member for Saanich—Gulf Islands.",Liberal,Nipissing—Timiskaming,Anthony Rota,http://www.parl.gc.ca/Parliamentarians/en/members/anthony-rota(214972)
