basepk,hid,speechdate,pid,opid,speakeroldname,speakerposition,maintopic,subtopic,subsubtopic,speechtext,speakerparty,speakerriding,speakername,speakerurl
4706423,ca.proc.d.2017-05-01.p4854498,2017-05-01,3a48d31a-42fc-4320-a84f-da61c251bccd,219011,Mr. Blaine Calkins,,Routine Proceedings,Privilege,Reference to Standing Committee on Procedure and House Affairs," He did not need any of those things, Madam Speaker. He did not need a red carpet, as my colleague from Foothills just pointed out. As a matter of fact, I would suggest that he did not want it even when he needed it. That is a different approach.
I would argue that the Prime Minister's motorcade does not need to be out front where after a vote, 337 other members of Parliament and ministers need to get on buses or scurry across the road to get to their next meeting or their next appointment. If I asked the question in the chamber today of the members who are currently present how many are double-booked at least once or twice a day in places they need to be, if they were honest with each other, most of them would raise their hands. 
I am supposed to be at an event right now, but I am also on House duty and I have this speech. I am triple-booked. That is not an uncommon situation for members of Parliament to find themselves in. Therefore, why do we not ask ourselves why the Prime Minister's car needs to be in front and why it cannot go out the back, just like the previous prime minister did? Would that have resolved the problem? I do not know. Maybe it is a logistical issue. I do not know what I do not know because there is construction going on now at both ends of the building. There was construction as well on the east side of the building when Prime Minister Harper got his car ride home. Is that one of the solutions that we have? Maybe changing the way one or two people do their business around here might make it easier for others to do the same.
Much has been said about the privileges that are under discussion right now at the Standing Committee on Procedure and House Affairs and have spilled over into this debate. Members of Parliament, according to House of Commons Procedure and Practice, have the privilege of freedom of speech in this place. We must be vigilant and we must protect that. We must be able to say what has to be said when it needs to be said and we should not be denied access to this place to say it. We should not be under threat of intimidation, coercion, or any other type of threat inside this House or out for things that we say in this chamber. When we take away that freedom of speech and opportunities for members of Parliament to speak freely, we are doing a great disservice to our Parliament, to the foundation of our democracy.
I will go back to my opening comments when I talked about how valued Canadian ideals are around the world that people flock here from every corner of the earth. Any member of Parliament who has ever been to a citizenship ceremony will see that 50 people who are sworn in are from 48 different countries usually. That is the way it works here in Canada, and that is a great thing.
We have the privilege of free speech, but we do not have the privilege of free speech if we cannot get here, if we are stopped, if we are prevented, if we are detained in any way, shape, or form. I am not saying that gives members of Parliament the absolute right to do whatever they want whenever they want to get here, but every reasonable effort should be made to allow members of Parliament to get to the House of Commons to do their business. 
Members of Parliament have freedom from arrest in civil actions. This is critical. We cannot do our jobs and be free from intimidation if we are constantly under arrest or being hassled through civil action. That does not mean we cannot be sued, if that is what is required if something wrong has happened, but we cannot be arrested in civil actions. Just imagine if launching a frivolous or vexatious civil action, which may result in the arrest of a member of Parliament, was all one had to do to keep a member of Parliament from getting to a vote. 
Imagine a scenario in a minority Parliament where a couple of votes might be the difference between a government falling and an election being called or a government continuing, which is why there are the same provisions in the Criminal Code about vote buying and bribery. They are very important things. These are the freedoms that we have, not because the 338 of us who happen to be here right now are any more special than the other 35 million Canadians in this country, but the integrity of the office of a member of Parliament is what is at stake. 
The exemption from jury duty makes sense. We should not be part of the judiciary, but we are part of the legislative process. An exemption from being subpoenaed to attend court as a witness is another way somebody, frivolously or vexatiously, could have his or her time usurped by others, preventing or keeping a member of Parliament from doing his or her duties in the House of Commons. 
The most important one, the one that is under discussion today, is the freedom from obstruction, interference, intimidation, and molestation. I am going to read this into the record right from our own website. It states:
 Members of Parliament, by the nature of their office and the variety of work they are called upon to perform, come into contact with a wide range of individuals and groups. Members can, therefore, be subject to all manner of influences.... 
Further on it states:
 Members are entitled to go about their parliamentary business undisturbed. The assaulting, menacing, or insulting of any Member on the floor of the House or while he is coming or going to or from the House— 
That is the important part:
 —or on account of his behaviour during a proceeding in Parliament, is a violation of the rights of Parliament. Any form of intimidation...of a person for or on account of his behaviour during a proceeding in Parliament could amount to contempt. 
It goes on to talk about certain matters such as bribery, the acceptance of fees and corrupt electoral practices that are dealt with in other places in law and rightfully so. However, over the years, members have regularly brought to the attention of the House instances which they believe were attempts to obstruct, impede, interfere, intimidate, or molest them, their staffs or individuals who had some business with them or the House.
In a technical sense, such actions are considered to be contempt of the House and not breaches of privilege. Since these matters relate so closely to the right of the House to the services of its members, they are often considered to be breaches of privilege.
Speakers have consistently upheld the right of the House to the services of its members free from intimidation, obstruction, and interference. Speaker Lamoureux stated in a 1973 ruling that he had no hesitation in reaffirming the principle that parliamentary privilege included the rights of a member to discharge his or her responsibilities as a member of the House free from threats or attempts of intimidation.
As Speaker Bosley noted in 1986:
 If an Hon. Member is impeded or obstructed in the performance of his or her parliamentary duties through threats, intimidation, bribery attempts or other improper behaviour, such a case would fall within the limits of parliamentary privilege. Should an Hon. Member be able to say that something has happened which prevented him or her from performing functions, that he or she has been threatened, intimidated, or in any way unduly influenced, there would be a case for the Chair to consider. 
 We have had rulings and these rulings have been consistently applied in the ruling we had today, which is why we have this debate.
 In the ruling of another question of privilege, Speaker Bosley stated further that the threat or attempt at intimidation could not be “hypothetical”, but must be real or have occurred.
 That is what we have in this case. It occurred. Two members of Parliament were detained in their opinion and in the opinion of the ruling of the Speaker of the House unreasonably detained. What are the consequences of that going to be outside of this debate?
In order to find a prima facie breach of privilege, the Speaker must be satisfied that there is evidence to support the member's claim that he or she has been impeded in the performance of his or her parliamentary functions and that the matter is directly related to a proceeding of Parliament, in this case the most important one, a vote, the opportunity for our actions to match our words and for us to cast a ballot or stand in our place and be counted yea or nay on behalf of the people who sent us here.
In some cases where a prima facie privilege has not been found, the rulings have focused on whether the parliamentary functions of the member were directly involved. While frequently noting that members raising such matters have legitimate grievances, Speakers have consistently concluded that members have not been prevented from carrying out their parliamentary duties from time to time.
These matters as we have laid out in our history, whether it is in O'Brien and Bosc now or in previous rulings by the Speaker, we have enough cases before us that Speakers can properly rule about these issues. It is very important. As members of Parliament, we have to protect and safeguard our rights and privileges. Thankfully we have had Speakers in the past who have helped in that, as in the examples I have just outlined, but we have to also remain vigilant for other assaults on our privileges.
In the last three Parliaments before this one, I do not ever recall an instance, let alone two separate instances, where there has been such disruption of the House of Commons and of committees based on proposed changes to the privileges that we as members of Parliament have. I will go back to Motion No. 6, around a year ago, when it was before this place. It would have taken away virtually every tool opposition members of Parliament would have had and every privilege that had been extended to them in our adversarial system of Parliament, which has been handed to us in the Westminster system. It is the foundation of our House. The Liberals wanted to change it unilaterally, taking away those privileges. We see it again now. It is the approach of a unilateral decision to make numerous changes to how this place works without consulting members of Parliament.
I would urge all my colleagues who are here today, on whatever side of the House they happen to be, to safeguard their rights and privileges, because every inch of ground they give up, they will never get back.",Conservative,Red Deer—Lacombe,Blaine Calkins,http://www.parl.gc.ca/Parliamentarians/en/members/blaine-calkins(219011)
4706424,ca.proc.d.2017-05-01.9489132,2017-05-01,07cf5767-802c-406c-92a7-7dc92af79b40,229526,"Mr. Kevin Lamoureux (Parliamentary Secretary to the Leader of the Government in the House of Commons, Lib.)",,Routine Proceedings,Privilege,Reference to Standing Committee on Procedure and House Affairs,"Madam Speaker, I assure the member across the way, when it comes to the Standing Orders and changing them, I take the matter in the utmost seriousness. I also respect the fact that the Prime Minister of Canada is trying in the best way possible to modernize Canadian Parliament. That is something I believe a majority of Canadians would want to see take place.
 I appreciate the fact that the hon. member spent 95% of his time related to the privilege and my question will be on that.
 We should commend and compliment the incredible efforts that our current security people put in place. Whether it is our security forces in the gallery, at our doors, outside, or in the parliamentary precinct in general, they do an outstanding job. We try to assist them by wearing pins and, if possible, to provide an I.D. It is not as easy as one thinks to memorize 338 faces with names and in different seasons, where toques are worn at one time, then baseball caps, no hats and so forth. They should be commended for the phenomenal job they do in protecting this parliamentary precinct.
Given the context and everything he has said, given that we have agreed from the beginning that this should be going to PROC and given that we support the subamendment, why would we not have PROC do what it has done in the past? When I was on PROC, a question of privilege would come up, a debate occurred and then it went to PROC. PROC deliberated and came back with recommendations. Why would we not do the same thing here?",Liberal,Winnipeg North,Kevin Lamoureux,http://www.parl.gc.ca/Parliamentarians/en/members/kevin-lamoureux(229526)
4706425,ca.proc.d.2017-05-01.9489140,2017-05-01,3a48d31a-42fc-4320-a84f-da61c251bccd,219011,Mr. Blaine Calkins,,Routine Proceedings,Privilege,Reference to Standing Committee on Procedure and House Affairs,"As I said, Madam Speaker, I understand my hon. colleague's question, but it is the approach. Had the Liberals actually approached members of the New Democratic Party, the Conservative Party and the other parties in the House of Commons and said that they would like to engage us in a conversation about how we were going to change any of our Standing Orders, about how we were going to address any of the issues that I brought up in my speech, I would guess that conversation would have been met with a little less resistence than having a paper dropped under the threat or duress of getting the changes rammed through in a timely fashion. 
I understand the Liberals have egg on their faces because they were unable to keep their electoral reform commitments. As my colleague from Peace River—Westlock pointed out in his speech, and I was giggling as I used to read Calvin and Hobbes all the time, changing the rules as we go along to make them suit our needs is no different than the cash for access fundraising rules that we are about to see now. The Liberals are changing the rules as they go along, not changing the behaviour to come into compliance with the rules, to make them suit their needs. 
That the approach is all wrong and that is why the hon. member and his party are struggling to get anything done in this Parliament.",Conservative,Red Deer—Lacombe,Blaine Calkins,http://www.parl.gc.ca/Parliamentarians/en/members/blaine-calkins(219011)
4706426,ca.proc.d.2017-05-01.9489150,2017-05-01,9c9a64e6-58f1-4367-9f49-93ad31744c96,217354,"Mrs. Cathy McLeod (Kamloops—Thompson—Cariboo, CPC)",,Routine Proceedings,Privilege,Reference to Standing Committee on Procedure and House Affairs,"Madam Speaker, my colleague really did stick to the issue of privilege we are debating today, but there is a link between the privilege debate and perhaps why the government did not want to move that to committee. I wonder if he could articulate for those who might be confused, because it truly is a bit of inside baseball, that this is a creation of the current government, the issue we are having right now, and why we are still debating this as opposed to more important issues.",Conservative,Kamloops—Thompson—Cariboo,Cathy McLeod,http://www.parl.gc.ca/Parliamentarians/en/members/cathy-mcleod(217354)
4706427,ca.proc.d.2017-05-01.9489162,2017-05-01,3a48d31a-42fc-4320-a84f-da61c251bccd,219011,Mr. Blaine Calkins,,Routine Proceedings,Privilege,Reference to Standing Committee on Procedure and House Affairs,"Madam Speaker, I wish we were discussing matters that would have a broader effect on the constituents I represent. However, my privileges as a member of Parliament on their behalf are being hindered. My right as a member of Parliament serving in Her Majesty's loyal opposition is being hindered or altered without any input from me at all.
 I have not been asked once by any member of the government or any member of Parliament from the governing party. I have not been approached in the hallway, in the committee room, or anywhere by any member of Parliament from the Liberal Party of Canada asking me what it would take for me and my party to come around to some sort of agreement. Not once has that conversation ever happened. 
What is at stake here is not just the question of privilege being debated today, but all the rights and privileges we have as members of Parliament. That extends well beyond the basic privileges of voting and being able to speak in the House. It is ensuring that we have the right checks and balances in place to ensure our democracy is sound and stable, and we have the best foundation. I tried to make this point in my speech. The foundation of our country is our democracy, and this is the basement. It is the foundation upon which the rest of our country sits. 
We are discussing whether members of Parliament can actually get to the chamber on time for a vote. We are discussing whether an approach by the government of the day is that the government can come in and change the rules of the House of Commons to suit its needs. The Liberals might argue that is not what they are trying to do, but that sure is what it looks like to me because I have not been asked once, and I do have friends on the other side of the House. There are some good people. They talked to me, but they never brought this issue up once with me. I have to ask myself why. 
When I trace all the lines back, this is simply a decree coming through the government House leader from the Prime Minister's Office. There are three or four people making the decision on how Parliament should work, and my guess is maybe one of them actually has a seat in this chamber.
If the member across the way who asked the question and my colleague from this side of the House wonders why people have their backs up, why there is a filibuster in the procedure and House affairs committee, why there is a filibuster going on right now as we discuss this question of privilege in the House of Commons, well, if one does things wrong, one is going to get the wrong reaction, and a different approach can be taken. It was supposed to be sunny ways. It does not feel sunny today at all. ",Conservative,Red Deer—Lacombe,Blaine Calkins,http://www.parl.gc.ca/Parliamentarians/en/members/blaine-calkins(219011)
4706428,ca.proc.d.2017-05-01.9489197,2017-05-01,07cf5767-802c-406c-92a7-7dc92af79b40,229526,Mr. Kevin Lamoureux,,Routine Proceedings,Privilege,Reference to Standing Committee on Procedure and House Affairs,"Madam Speaker, to address the issue of why the member perhaps feels a bit on the outside looking in on this whole idea of changes to the Standing Order, whether it is the government House leader or myself, on numerous occasions we have welcomed and encouraged members across the way to get engaged in the discussion. We spent an entire day last fall talking purely about the Standing Orders. PROC has dealt with a preliminary report, and then we had a discussion paper provided to PROC. A tremendous amount of dialogue has taken place. 
It is up to the member, if he so chooses, to get into the discussion. If he chooses not to take me up on my invitation to meet with me, or the government House leader or others, that is up to the member across the way to make that determination. However, he should not try to give the impression that the government has not been doing its job in consulting and working as much as possible, where there is co-operation, in trying to modernize our Parliament, or at least to have that discussion about the rules. We have talked about it a lot.
The member said at the beginning of his speech that he had been here for 11 years. Compare what I just explained when Stephen Harper changed the election laws, another part of Canada's foundation. Why does he not draw the comparison? He should tell us exactly how Stephen Harper changed the election laws. ",Liberal,Winnipeg North,Kevin Lamoureux,http://www.parl.gc.ca/Parliamentarians/en/members/kevin-lamoureux(229526)
4706429,ca.proc.d.2017-05-01.9489237,2017-05-01,3a48d31a-42fc-4320-a84f-da61c251bccd,219011,Mr. Blaine Calkins,,Routine Proceedings,Privilege,Reference to Standing Committee on Procedure and House Affairs,"Madam Speaker, the only thing I really recall being changed in the elections law was that people had to prove who they were before they could vote. I do not think that is a real mind-boggling concept for most people in Canada to understand. One should actually be a Canadian citizen, over 18 years old, and able to prove it to a returning officer. What a terrible concept. 
Let us just change the rules of the House of Commons, making sure the prime minister is only accountable one particular day a week. Let us change the rules so the Liberals send the image to all Canadians that a four-day workweek is all we need. Let us just put that out there in a paper to the procedure and House affairs committee with the Liberal majority and ram it through. Let us change democracy and look victorious in the eyes of the glorious electorate that voted for the Liberal Party. There is so much resentment right now from the people who voted for this government, not only in Alberta but across the country, because the approach is 100% wrong. The priorities are often misguided and whenever the Liberals have a chance to make a good decision or a bad decision, the bad decision seems to win the day. ",Conservative,Red Deer—Lacombe,Blaine Calkins,http://www.parl.gc.ca/Parliamentarians/en/members/blaine-calkins(219011)
