basepk,hid,speechdate,pid,opid,speakeroldname,speakerposition,maintopic,subtopic,subsubtopic,speechtext,speakerparty,speakerriding,speakername,speakerurl
4714391,ca.proc.d.2017-06-08.9602468,2017-06-08,16c839d3-0183-4ed6-892a-8d7bdc37c474,214972,The Assistant Deputy Speaker (Mr. Anthony Rota),,Government Orders,Business of Supply,Opposition Motion--Nuclear Disarmament,The member for Rosemont—La Petite-Patrie has 45 seconds or less for his reply.,Liberal,Nipissing—Timiskaming,Anthony Rota,http://www.parl.gc.ca/Parliamentarians/en/members/anthony-rota(214972)
4714392,ca.proc.d.2017-06-08.9602471,2017-06-08,3c3ee442-a873-4845-84d0-7da07a66ce61,217244,Mr. Alexandre Boulerice,,Government Orders,Business of Supply,Opposition Motion--Nuclear Disarmament,"Mr. Speaker, I will try. I thank my colleague for his question. I find it hard to explain this kind of strategy on the part of the Liberal government, which refuses to participate in good faith in these crucial negotiations even though it intends to seek the support of those same countries to get a seat on the Security Council. It is completely contradictory. Just because an objective is difficult to achieve does not mean we should not have the political will to achieve it.
We have seen Canada play a leadership role in the past, as it has with the Ottawa convention or the creation of the International Criminal Court. It is time for Canada to make a comeback.
If we are back, we should be back for real.",NDP,Rosemont—La Petite-Patrie,Alexandre Boulerice,http://www.parl.gc.ca/Parliamentarians/en/members/alexandre-boulerice(217244)
4714393,ca.proc.d.2017-06-08.9602482,2017-06-08,16c839d3-0183-4ed6-892a-8d7bdc37c474,214972,The Assistant Deputy Speaker (Mr. Anthony Rota),,Government Orders,Business of Supply,Opposition Motion--Nuclear Disarmament,"Order. It is my duty pursuant to Standing Order 38 to inform the House that the questions to be raised tonight at the time of adjournment are as follows: the hon. member for Banff—Airdrie, Taxation; the hon. member for Edmonton—Wetaskiwin, Health; the hon. member for Saanich—Gulf Islands, The Environment.",Liberal,Nipissing—Timiskaming,Anthony Rota,http://www.parl.gc.ca/Parliamentarians/en/members/anthony-rota(214972)
4714394,ca.proc.d.2017-06-08.9602486,2017-06-08,eb53bf99-e3d5-44b9-a15e-6c295470cdd4,218395,"Hon. Kevin Sorenson (Battle River—Crowfoot, CPC)",,Government Orders,Business of Supply,Opposition Motion--Nuclear Disarmament,"Mr. Speaker, I am pleased to participate in today's debate, and I am also pleased to be sharing my time with the hon. member for Calgary Shepard.
Make no mistake. All of us in the House wish that we could live in a world that was free of nuclear weapons. Facing the reality of the Cold War, the former British prime minister, the late Margaret Thatcher, said, “a world without nuclear weapons would be less stable and more dangerous for all of us.” She said that during the Cold War. 
Is the world today even more unstable than in Margaret Thatcher's era? Today we have jihadi terrorism all around the world. Today we have rogue nations, like Iran, trying hard to build themselves nuclear weapons. There are terrorist groups that want nuclear devices to commit heinous acts of mass murder. It is believed that North Korea has nuclear weapon capability and is working diligently to develop missiles that will deliver a nuclear arsenal. We see every week a new test from North Korea. South Korea is concerned about what is happening in North Korea. The world is concerned about what is happening in North Korea. 
Many countries around the world are vulnerable: Israel, South Korea, Ukraine, and many more. However, many nations continue to thrive and survive, because their enemies know that nuclear retaliation would follow an assault on any of these states. 
During the Cold War, the former Soviet Union was assured that any nuclear assault it committed on the western world would have resulted in a nuclear weapon response from the west, and not necessarily equal to what they sent to the west. Undoubtedly, a larger attack would have been unleashed. This was known as mutually assured destruction, or as many have referred to it, MAD. The MAD doctrine not only worked to deter the initial use of nuclear weapons but was designed to limit the continued use of nuclear weapons, should they ever be used in a conflict.
Dr. Henry Kissinger, the former secretary of state in the Nixon administration, always insists that the United States' nuclear weapon arsenal and the MAD policy has provided the world with more decades of continuous peace than any other time in recorded history. Kissinger maintains that a greater proportion of the world has been engaged in conflict throughout history than we have had since the end of the Second World War. There continue to be conflicts, of course, and in fact there are wars going on right now, yet the longest period of world peace for the greatest proportion of humans has existed since the end of the Second World War and the introduction of nuclear weapon capability. This is the cold reality. It is a peaceful time for the world in this respect, yet the thought of the destructive capability of nuclear weapons is much of what keeps the peace. In fact, it brought an end, some would argue, to World War II.
The motion the NDP has brought forward has six parts. The first part reads:
 (a) recognize the catastrophic humanitarian consequences that would result from any use of nuclear weapons, and recognize those consequences transcend national borders and pose grave implications for human survival, the environment, socioeconomic development, the global economy, food security, and for the health of future generations; 
The Conservative Party does not disagree with that statement. In fact, we kept that in mind for the last three parliaments we governed. 
Second, the NDP motion says that we should:
 (b) reaffirm the need to make every effort to ensure that nuclear weapons are never used again, under any circumstances; 
Well, we have heard a few people use the word “utopian” today. This clause, most believe, is unrealistic, given the reality of nations possessing or trying to acquire nuclear weapons. Iran and North Korea continue to develop their nuclear weapon capacity even today. India and Pakistan achieved the development of nuclear weapon capability. North Korea, Iran, India, and Pakistan have all stated clearly the circumstances under which they would use their nuclear weapons. Therefore, “under any circumstances” in the NDP motion, we believe, is unachievable.
Third, the NDP wants the House to recognize previous motions passed by the House or by the United Nations. The motion reads:
 (c) recall the unanimous vote in both Houses of Parliament in 2010 that called on Canada to participate in negotiations for a nuclear weapons convention; 
The House is aware of that motion from 2010, yet the current international negotiations, we believe, will not lead to a nuclear weapons convention, because Russia, the United States, and China are not participating. They are not talking the talk. 
The NDP also wants the House to: 
 (e) express disappointment in Canada’s vote against, and absence from, initial rounds of negotiations for a legally binding instrument to prohibit nuclear weapons; 
This is where we also disagree with the motion. There is no point in commencing negotiations leading to a convention to prohibit nuclear weapons without including the nations that actually have those nuclear weapons. It is a waste of time, money, and effort. 
The final part of the NDP motion asks the House to support the initial draft of the convention prohibiting nuclear weapons. Again, the nations that have nuclear weapons have already made it clear why they have them, and until the threats they live under are eliminated, these nations will keep their weapons. Some of these nations are Canada's allies, and they are, in some cases, protecting Canada as well.
The question is what we can do. It is one thing to say whether we agree or disagree with the Liberal approach, but what can we do? 
Our previous Conservative government worked to achieve further decommissioning of the still huge arsenals of nuclear weapons that exist in Russia and the United States. The official opposition recognizes the government's action to contain fissionable material. Meaningful talks continue with our nuclear weapon possessing democratic allies and others in the enduring hope of one day having a nuclear free world. 
The coercive exercise the NDP is calling for Canada to participate in is not a good way to work toward a nuclear weapon prohibition. Our Conservative government worked hard over our 10 years as the government to reduce the number of nuclear weapons in the possession of foreign governments and other international actors. We worked to prevent not just nuclear weapons but chemical weapons and biological weapons, weapons of mass destruction. We worked with our allies. 
Conservative and Liberal governments have signed treaties and international agreements at the UN and a number of organizations, including NATO, the G8, the International Atomic Energy Agency, and the Conference on Disarmament, to reduce the number of nuclear weapons available in the world. We continue to work toward reducing nuclear proliferation and making sure that fissionable material is not available to rogue states and terrorist organizations to produce nuclear warheads.
The reality is that an all-out prohibition is not on the horizon in the foreseeable future. Supporting the NDP motion is unrealistic, when our NATO allies, western democracies, and other major UN nations that possess nuclear warheads are not participating in these talks. When the main world powers are in agreement, then there can be a prohibition, but we do not have that agreement when it comes to nuclear weapons. We have a situation where China, and Russia in particular, continue to build up their arsenals, not reduce them. 
As Canadians, we must continue to do what we have in the past. We must always use diplomatic means to assist world powers in the de-escalation of conflict. We must work with our allies and partners in the non-proliferation of nuclear arms to make sure they are effective, safe, and responsibly used. We can work toward a prohibition of nuclear weapons that will be accomplished, we hope, in the future. However, arbitrarily trying to coerce nuclear weapon states into giving up these arms we know does not work. 
The NDP is asking Canada to sign up for negotiations that do not include our allies. These negotiations do not include the powers that possess nuclear weapons. There can be no discussion or dialogue when they are not at the table. 
We can do things, including the enforcement of a Sergei Magnitsky law. We can have sanctions and global isolation of those state players and individuals that are responsible for the proliferation of nuclear weapons. 
There is opportunity to work within the G7, to work through NATO, to work through other forums, and I hope that we continue to do it, whether it be through economic sanctions, travel bans, or engagement with our allies. We can make sure that we are partners with them on the world stage, but if we are to speak, let us make sure the ones who have the weapons are there at the table.",Conservative,Battle River—Crowfoot,Kevin Sorenson,http://www.parl.gc.ca/Parliamentarians/en/members/kevin-sorenson(218395)
4714395,ca.proc.d.2017-06-08.9602608,2017-06-08,fc02fe5c-f4bc-451c-b921-86c4794d1d1d,229554,"Hon. John McKay (Scarborough—Guildwood, Lib.)",,Government Orders,Business of Supply,Opposition Motion--Nuclear Disarmament,"Mr. Speaker, I believe the hon. member's threat assessment would be very similar to my own, which is that the threat of nuclear capability is actually increasing rather than decreasing, whether it is cruise missiles, ICBMs, ballistics, or a whole variety of platforms, whether they are submarine platforms or land-based platforms or whatever, and that only seems to have increased rather than decreased. 
The real issue here is whether we can walk and chew gum at the same time, given the reality posed by the threat from North Korea. China does not seem to be able to rein in its client state, and Iran is a clear and present danger to all those in the region, including Israel, where the relationship is an existential threat.
Given his threat assessment, which I would say is similar to my own, and given the necessity and the need to continue to negotiate, would it be his view that the debate and the concerns on the ballistic missile defence need to be addressed realistically?",Liberal,Scarborough—Guildwood,John McKay,http://www.parl.gc.ca/Parliamentarians/en/members/john-mckay(229554)
4714396,ca.proc.d.2017-06-08.9602619,2017-06-08,eb53bf99-e3d5-44b9-a15e-6c295470cdd4,218395,Hon. Kevin Sorenson,,Government Orders,Business of Supply,Opposition Motion--Nuclear Disarmament,"Mr. Speaker, indeed, that is the direction we should be going, maybe now more than ever. We see rogue states and terrorist organizations trying to get equipment and material so that they can have a dirty bomb or something that can even be carried in a suitcase. Russia and China—both nuclear powers, both veto-wielding permanent members of the Security Council—are not participating in the nuclear weapon ban talks. 
The Russian foreign minister has said that 120 countries are participating in the talks, and are trying to coerce nuclear powers into abandoning nuclear weapons, but as the member asked in his question, is there a greater risk? Yes, and it is not because we see that one of the superpowers is ready to use it, but because we see countries like North Korea with an itchy finger. We see countries like Iran feverishly trying to get not just the technology but the equipment and the material to make a bomb. 
Again, the threat is very clear. Whether one is President Trump or former President Obama, all have spoken about an increased threat to this type of war—not even war, but attack. We do not withdraw from everything, but certainly some exercises are very futile in accomplishing much.",Conservative,Battle River—Crowfoot,Kevin Sorenson,http://www.parl.gc.ca/Parliamentarians/en/members/kevin-sorenson(218395)
4714397,ca.proc.d.2017-06-08.9602624,2017-06-08,eaa6694f-1e20-4aae-ad3b-e694b0e12c59,224170,"Ms. Elizabeth May (Saanich—Gulf Islands, GP)",,Government Orders,Business of Supply,Opposition Motion--Nuclear Disarmament,"Mr. Speaker, the hon. member for Battle River—Crowfoot will not be surprised that I disagree. This is not an NDP motion to engage the world in action; this is a United Nations negotiation that is taking place. It is being led by Austria, Ireland, Mexico, Brazil, South Africa, and Sweden, countries with whom we have strong relationships, countries with whom we are in strong trading relationships. It is not far-fetched that we start the negotiations and bring others in. I note that Iran is actually in these negotiations. I also note that Canada started out in the lead on land mines and cluster munitions when the countries that used land mines and cluster munitions were not in the room.
While the United Nations negotiate, what possible advantage is there for Canada? As a country, we want to show leadership in the world and not ignore negotiations when there is even a chance that the process of negotiation would bring in those countries that are now, as he said himself, modernizing their nuclear weapons and endangering our entire world.",Green,Saanich—Gulf Islands,Elizabeth May,http://www.parl.gc.ca/Parliamentarians/en/members/elizabeth-may(224170)
4714398,ca.proc.d.2017-06-08.9602631,2017-06-08,eb53bf99-e3d5-44b9-a15e-6c295470cdd4,218395,Hon. Kevin Sorenson,,Government Orders,Business of Supply,Opposition Motion--Nuclear Disarmament,"Mr. Speaker, the Liberal government today has determined there is not a lot of benefit to being at those kinds of exercises. I am not certain why the government decided not to be engaged in them. The Liberals went to their convention where they said they were going to be involved in those kinds of exercises, and today they are saying they are not worthwhile.
In preparation for this debate, I went back to 2007 to a meeting that we had with my good friend Doug Roche, a previous Alberta member of Parliament and senator Ernie Regehr from Project Ploughshares. In response to my hon. colleague from Toronto, who spoke prior to the question by the member for Saanich—Gulf Islands, the concerns they talked about that day seemed in some regard to already have taken place, so the threat is even greater. When the threat becomes greater, we must be vigilant in what we do, but we should not be spending time on things that perhaps may not be effective.",Conservative,Battle River—Crowfoot,Kevin Sorenson,http://www.parl.gc.ca/Parliamentarians/en/members/kevin-sorenson(218395)
