basepk,hid,speechdate,pid,opid,speakeroldname,speakerposition,maintopic,subtopic,subsubtopic,speechtext,speakerparty,speakerriding,speakername,speakerurl
4712225,ca.proc.d.2017-06-01.9573547,2017-06-01,eaa6694f-1e20-4aae-ad3b-e694b0e12c59,224170,"Ms. Elizabeth May (Saanich—Gulf Islands, GP)",,Government Orders,Business of Supply,Opposition Motion—Kinder Morgan Trans Mountain Expansion Project,"Mr. Speaker, I am privileged to be able to put a question to my friend from Cariboo—Prince George. He is my friend. I do not say that merely as a nicety. We are friends. However, I do not agree with him that this project is in the national interest.
It is important for Canadians to know that when the National Energy Board reviewed the Kinder Morgan project, it refused to hear evidence from Unifor, the largest union representing workers in the oil sands. It refused to hear evidence from Unifor, because the National Energy Board ruled that jobs and the economy were outside its mandate in reviewing the project. Therefore, it cannot be said that the economic impact of this project has been reviewed. 
It is interesting to know that what Unifor wanted to present to the National Energy Board was evidence that the Trans Mountain pipeline, Kinder Morgan's expansion, would hurt Canadian jobs and cost Canadian jobs. 
I would ask my hon. colleague if he does not agree with me that we should follow the plan for the expansion and development of the oil sands that came from Peter Lougheed. That was the era when the idea was put forward that Alberta's economy would benefit from mining bitumen and processing it in Alberta. The reason this will cost Canadian jobs, according to Unifor, is that shipping raw bitumen to refineries in other countries will hurt Canadian jobs and actually lead to the closing of the Chevron refinery in Burnaby, because it does not have the capacity to process raw bitumen.
Why do the Conservatives prefer creating jobs in other countries, in refineries in other countries, rather than processing the material and creating jobs in Alberta?",Green,Saanich—Gulf Islands,Elizabeth May,http://www.parl.gc.ca/Parliamentarians/en/members/elizabeth-may(224170)
4712226,ca.proc.d.2017-06-01.9573588,2017-06-01,24b3616f-1e8d-4fd3-9420-0a3d7ab8b6d3,216520,Mr. Todd Doherty,,Government Orders,Business of Supply,Opposition Motion—Kinder Morgan Trans Mountain Expansion Project,"Mr. Speaker, as my colleague mentioned, she is a friend, and from time to time, her interventions are interesting and well thought out. I always enjoy listening to her in the House.
I cannot speak to the comments Unifor made and its position on Kinder Morgan. I will not speak to that. I vehemently dispute my hon. colleague's assertion that Conservatives are all about shipping jobs overseas and closures and whatever the question was insinuating. Clearly, the Conservatives are all about free trade and making sure that our suppliers and producers in Canada are able to access every market possible, creating not just jobs but great-paying jobs right here in Canada, and ensuring that our products get to market. Whether at home or abroad, Conservatives are all about—",Conservative,Cariboo—Prince George,Todd Doherty,http://www.parl.gc.ca/Parliamentarians/en/members/todd-doherty(216520)
4712227,ca.proc.d.2017-06-01.9573593,2017-06-01,02c2cb20-f27d-46a5-8e78-ab4b405bf07b,214864,The Deputy Speaker,,Government Orders,Business of Supply,Opposition Motion—Kinder Morgan Trans Mountain Expansion Project,"Questions and comments, the hon. parliamentary secretary to the government House leader.",Conservative,Simcoe North,Bruce Stanton,http://www.parl.gc.ca/Parliamentarians/en/members/bruce-stanton(214864)
4712228,ca.proc.d.2017-06-01.9573594,2017-06-01,07cf5767-802c-406c-92a7-7dc92af79b40,229526,"Mr. Kevin Lamoureux (Parliamentary Secretary to the Leader of the Government in the House of Commons, Lib.)",,Government Orders,Business of Supply,Opposition Motion—Kinder Morgan Trans Mountain Expansion Project,"Mr. Speaker, as I indicated earlier, we as a government have moved forward on the issue of pipelines, being very sensitive to the economic and environmental issues and the importance of consultation. Through our process, what we have seen is that for the first time in over 10 years, pipelines to tidewater have actually been approved. That is of great significance, because that has benefited not only the province of Alberta but, as has been pointed out by other colleagues, the entire country, directly and indirectly.
Would my colleague not agree that the current approach for developing and getting pipelines done is the right approach?",Liberal,Winnipeg North,Kevin Lamoureux,http://www.parl.gc.ca/Parliamentarians/en/members/kevin-lamoureux(229526)
4712229,ca.proc.d.2017-06-01.9573596,2017-06-01,24b3616f-1e8d-4fd3-9420-0a3d7ab8b6d3,216520,Mr. Todd Doherty,,Government Orders,Business of Supply,Opposition Motion—Kinder Morgan Trans Mountain Expansion Project,"Mr. Speaker, I would ask for your indulgence in allowing me to finish my answer to the earlier question. Clearly, the Conservatives stand for making sure that creating jobs in Canada is important, not just good-quality jobs but high-paying jobs.
To my colleague across the way, announcements are great, but getting shovels in the ground and projects up and running is an other thing. The government has shown over the last two years that it is great at making fluffy announcements, but when the tires hit the pavement, where is it? There are not a lot of shovels in the ground. What we are talking about today is having the Prime Minister and the 17 Liberal members of Parliament from British Columbia sell, promote, and support this project in the House and at home in British Columbia.",Conservative,Cariboo—Prince George,Todd Doherty,http://www.parl.gc.ca/Parliamentarians/en/members/todd-doherty(216520)
4712230,ca.proc.d.2017-06-01.9573605,2017-06-01,7bf98536-0fc9-439c-8132-7956605466f0,215885,"Mr. T.J. Harvey (Tobique—Mactaquac, Lib.)",,Government Orders,Business of Supply,Opposition Motion—Kinder Morgan Trans Mountain Expansion Project," Mr. Speaker, I am honoured to say that I will be splitting my time with my hon. colleague, the member for Surrey Centre.
Mr. Speaker, this government believes that economic growth and protecting our environment go hand in hand. Canadians have told us that we need to address climate change by reducing greenhouse gas emissions while promoting economic prosperity across the country. The Government of Canada is taking steps to do just that by lessening our reliance on fossil fuels, introducing a price on carbon pollution, and investing in the clean energy economy of tomorrow. In the meantime, we need to make responsible decisions about energy, the energy we use, and how we move our energy resources safely to the global market.
As a rural member from Atlantic Canada, I recognize the importance of the natural resource sector, along with the preservation and enhancement of the quality of Canada's natural environment, which includes protecting water, air, soil, flora, and fauna. I would like to speak to some of the environmental protection elements that are part of our pipeline plan we have recently announced.
I am pleased to say that our new pipeline plan has a number of strong environmental protections in place. Our ability to meet our greenhouse gas commitments will not be hindered. Species at risk will be protected. Pipeline and marine safety will be improved, and the pristine wilderness of British Columbia's north coast will be protected.
We have assessed the greenhouse gas issues related to these projects and have factored them into our decision. Greenhouse gas emissions from the operation and construction of both pipelines will not be significant. With respect to the Trans Mountain expansion project, the National Energy Board has added conditions to the project certificate to mitigate some of the emissions related to the construction of the pipeline.
Environment and Climate Change Canada has estimated the greenhouse gases related to the production and processing of the oil that will be transported by the pipelines, referred to as “upstream emissions”. These will be regulated through the Province of Alberta's climate action plan and its 100-megaton cap on greenhouse gas emissions from oil sands development. Meeting our 2030 targets for reducing greenhouse gas emissions will require action from all sectors, including all levels of government and the oil and gas industry.
We are working together with the provinces and territories to develop a pan-Canadian framework for clean growth and climate change. In developing this framework, we have actively considered how to collectively do more to reduce greenhouse gases. For example, our government announced last week regulations to cut methane emissions from oil and gas operations by 40% to 45% by 2025.
Our government has put in place a pan-Canadian approach to pricing carbon pollution as a central element of this plan. Pricing carbon pollution is one of the most efficient ways to reduce greenhouse gas emissions, drive innovation, and encourage people and businesses to pollute less.
Future oil and gas production levels will depend on how producers respond to carbon policies and corresponding market signals, what technological advancements are made, and the ability of companies to compete in an increasingly carbon-constrained world. We are confident in our industries' capacity to innovate, reduce greenhouse gas emissions, and compete in the emerging global low-carbon economy.
With all these factors in place, the government believes that the pipeline project will not impact our plan to meet, or exceed, our 2030 emissions reduction target of 30% below 2005 levels.
The Trans Mount pipeline will pass through the ranges of some herds of the southern mountain caribou, which the Species at Risk Act considers to be threatened. The National Energy Board imposed six conditions to ensure that there would be no net loss of caribou habitat. Environment and Climate Change Canada will work with the National Energy Board to assist the proponent in meeting these conditions. Furthermore, construction will be timed to avoid disrupting the mating and migration of the southern mountain caribou. 
The government has worked with the Province of British Columbia on a study to review the protections in place for southern mountain caribou to encourage their recovery. The government will not hesitate to take additional action, if required, to mitigate the potential impacts from specific projects on the affected southern mountain caribou herd.
The government is committed to the protection and recovery of Canada's southern resident killer whales, listed as endangered under the Species at Risk Act. The primary threats to this species' survival and recovery are environmental contamination, reductions in the availability or quality of prey, and acoustic disturbance.
Before any shipping from the Trans Mountain expansion project begins, the Government of Canada is committed to advancing work in key areas to reduce its impacts on this population. The objective is to mitigate the impact of additional Trans Mountain expansion marine traffic before the project begins operations. 
The Government of Canada, with the help of its partners, is putting in place a strong southern resident killer whale action plan to promote recovery. The plan will significantly reduce the impact of noise from marine vessels on killer whales through voluntary and regulatory measures. It will ensure that there is sufficient food available for the whales, and it will reduce the pressure on the whale population from persistent contaminants.
 With Line 3, Enbridge will be required to ensure that the project does not create a net loss of wetland areas, as wetlands are not only vital habitat for migratory birds but also provide important ecosystem services, such as flood prevention and water purification.
 In addition to habitat protection and reducing greenhouse gas emissions, we are making the transport of petroleum products safer. The recently announced oceans protection plan is designed to achieve a world-leading marine safety system for our country's unique context that will increase our government's capacity to prevent and improve its response to marine oil spills.
 The Pipeline Safety Act, which came into force in June 2016, strengthens Canada's pipeline safety system by enshrining the polluter pays principle into law. In terms of specific safety measures, Enbridge's Line 3 replacement will have new, thicker pipeline in many sections and will be built to modern specifications that will enhance the safety and integrity of the network and further protect the environment from potential spills.
 Furthermore, a number of additional safety features are included in the Line 3 replacement project. For example, the installation of 26 new remotely operated sectionalizing valves near waterways will allow the pipeline to be shut off quickly if necessary.
 The biggest environmental protection initiative we will put in place in our pipeline plan is the moratorium on tankers carrying crude oil and persistent oil products. The tanker moratorium will provide an unprecedented level of environmental protection for the Great Bear Rainforest and British Columbia's northern coastline, which is integral to the livelihoods and cultures of indigenous and coastal communities. The Great Bear Rainforest and the Great Bear Sea, which stretches more than 400 kilometres along British Columbia's north coast, is home to several indigenous and coastal communities as well as a spectacular variety of fish, marine mammals, and wildlife. The tanker moratorium will help ensure that this area is preserved for future generations.
The sensitive ecosystem of the Douglas Channel, which is part of the Great Bear Sea, is no place for 220 tankers to be transiting annually. For this reason, we have directed the National Energy Board to dismiss the northern gateway pipeline project application, because it is not in the public interest. In the case of the northern gateway, the proposed economic development was not consistent with our principles of environmental protection.
In coming to these decisions and in developing this plan, the government reviewed thousands of pages of scientific evidence, held hundreds of consultation sessions across the country, specifically in British Columbia with indigenous peoples, and heard from thousands of Canadians. We have listened, and we are confident that our overall plan maps out a path forward that is consistent with both growing the economy and protecting the environment.
I would like to further add that this is a government that has spent a significant amount of time and resources meeting with stakeholders, meeting with indigenous communities, and meeting with environmentalists, and taking all those factors into account as we have made our decisions. We need to ensure that we are not sacrificing the environment for the sake of a project, or vice versa. I think we have achieved a great deal of progress over the last year and a half.
With that, I would like to conclude my remarks today.",Liberal,Tobique—Mactaquac,TJ Harvey,http://www.parl.gc.ca/Parliamentarians/en/members/tj-harvey(215885)
4712231,ca.proc.d.2017-06-01.9573660,2017-06-01,dfce868a-f590-4d20-b1b6-4e08a3e5b669,217195,"Mr. Wayne Stetski (Kootenay—Columbia, NDP)",,Government Orders,Business of Supply,Opposition Motion—Kinder Morgan Trans Mountain Expansion Project,"Mr. Speaker, the people of British Columbia, including people in my riding, are very concerned about the Kinder Morgan pipeline for some very good reasons.
They talk about the flawed environmental assessment process. That has been confirmed by a couple of expert reports recently. They believe that pipelines are old thinking and that we need to be moving towards a green future, a green energy economy, that keeps jobs local rather outside our communities. 
There is no consent from several first nations along the route, which speaks to whether the government is truly interested in reconciliation.
 It will create a sevenfold increase in the risk of a catastrophic oil spill on the B.C. coast. The cost of one oil spill will far outweigh any long-term benefits for British Columbians.
Given those very strong, very important concerns, I would like to hear what my colleague's response is to the people of British Columbia who really care about those things.",NDP,Kootenay—Columbia,Wayne Stetski,http://www.parl.gc.ca/Parliamentarians/en/members/wayne-stetski(217195)
4712232,ca.proc.d.2017-06-01.9573672,2017-06-01,7bf98536-0fc9-439c-8132-7956605466f0,215885,Mr. T.J. Harvey,,Government Orders,Business of Supply,Opposition Motion—Kinder Morgan Trans Mountain Expansion Project,"Mr. Speaker, I respect my colleagues arguments 100% and I think he is really speaking to the plan that we put in place. The reason he is speaking to that is that his question speaks to the tremendous amount of consultation that we have had with indigenous communities, with indigenous stakeholders, and with communities on the B.C. coast. It speaks to our oceans protection plan. It speaks to the changes we have made to the environmental assessment process and to the changes that we plan to make in the future in order to best represent our constituents in a given area that could be affected adversely with the building of any project.
It is important to recognize the tremendous gains we have made as a government over the last 15 or 16 months in terms of ensuring and enshrining the rights of Canadians, especially in geographic areas where there are projects going on. I know there are projects going on in New Brunswick and across Atlantic Canada and Atlantic Canadians have the same concerns as British Columbians. It is important that we recognize the tremendous work that this government has done and will continue to do to ensure that all those stakeholders are properly consulted and that they play an integral part in the process and approval of any project.",Liberal,Tobique—Mactaquac,TJ Harvey,http://www.parl.gc.ca/Parliamentarians/en/members/tj-harvey(215885)
4712233,ca.proc.d.2017-06-01.9573689,2017-06-01,eaa6694f-1e20-4aae-ad3b-e694b0e12c59,224170,"Ms. Elizabeth May (Saanich—Gulf Islands, GP)",,Government Orders,Business of Supply,Opposition Motion—Kinder Morgan Trans Mountain Expansion Project,"Mr. Speaker, with all due respect to my hon. colleague, as the member of Parliament for Saanich—Gulf Islands where my constituents are overwhelmingly against this project, I intervened before the National Energy Board on their behalf. I went through all 23,000 pages of so-called evidence from Kinder Morgan and I will say without a shadow of a doubt, most of what is being claimed in the House is nonsense. There was no rigorous review. There was no rigorous science. What science exists was rejected by the National Energy Board as coming too late in the process and therefore unfair to Kinder Morgan to accept. 
The overwhelming evidence is that bitumen mixed with diluents cannot be cleaned up. Therefore, having a wonderful, so-called world-class oil spill response program is nonsense when there is no technology known by science, including Canada's premier scientific academy, the Royal Society of Canada, to deal with a substance that separates in a marine environment with bitumen sinking and the volatile diluents, which include benzene which is cancer causing, entering the atmosphere. We literally have no technology to clean this stuff up.
Would my hon. friend from New Brunswick and the federal Liberals be willing to wait so that a decent, rigorous environmental review can be done by the Government of British Columbia?",Green,Saanich—Gulf Islands,Elizabeth May,http://www.parl.gc.ca/Parliamentarians/en/members/elizabeth-may(224170)
4712234,ca.proc.d.2017-06-01.9573709,2017-06-01,7bf98536-0fc9-439c-8132-7956605466f0,215885,Mr. T.J. Harvey,,Government Orders,Business of Supply,Opposition Motion—Kinder Morgan Trans Mountain Expansion Project,"Mr. Speaker, I completely 100% respect my hon. colleague's concerns. What is important about the environment we have here in the House is that we can have robust discussions about a variety of topics recognizing that we are not always going to completely agree with each other's opinions. I do not completely agree with my hon. colleague's opinions. The reason is that we have done our due diligence. We have recognized the potential of this project given its merits. We have taken into consideration the effects on indigenous communities. We have consulted with indigenous communities. We have consulted with the people of British Columbia. 
The National Energy Board has done its due diligence and approved this project. It is our responsibility to respect that decision and recognize the economic potential that we could have from this project, while taking into consideration the effects on the environment and the communities in that area. 
I am really proud to say that I am part of a government that has taken those into consideration. I sit on the natural resources committee with hon. colleagues from both sides of the House and we have had robust discussions over the last year about the process and about consulting with Canadians and indigenous communities. I am happy to say that I think that within our committee we have come to a lot of general agreements across party lines. That speaks not only to the strength of this government and our approach but also to the strength of committees.",Liberal,Tobique—Mactaquac,TJ Harvey,http://www.parl.gc.ca/Parliamentarians/en/members/tj-harvey(215885)
4712235,ca.proc.d.2017-06-01.9573722,2017-06-01,3106c3be-f49e-4c55-9d12-fb6441875251,219988,"Mr. Randeep Sarai (Surrey Centre, Lib.)",,Government Orders,Business of Supply,Opposition Motion—Kinder Morgan Trans Mountain Expansion Project,"Mr. Speaker, I am happy to rise in the House to address the motion. As a British Columbian, and someone who cares about our coasts, our environment, and our economy, I would like to talk about the implications for our coastlines of natural resource projects, such as the one being discussed today.
Canada has the longest coastline in the world with tens of thousands of kilometres of beaches, shoals, cliffs, forests, glaciers, grasslands, cities, and villages. Our coastline is home to fisheries. It draws in Canadians and tourists who come to play, to challenge themselves, or to relax and reflect. It allows our businesses to trade with other countries in the world in emerging and established markets. It supports the livelihoods of traditional, indigenous, and coastal communities. Our coasts help define the Canadian experience, and they power the Canadian economy.
I have had numerous constituents speak to me about this matter, some who are for it and some who are against it. Therefore, it is vitally important for Canada that we protect our maritime environments, that our waters and coastlines remain clean, safe, and accessible, and that we continue to sustain communities while growing our economies. 
To this end, in November 2016, the Prime Minister introduced Canadians to the oceans protection plan, a plan that will safeguard our communities, our coastlines, and our marine environment. The plan, developed in collaboration with Transport Canada, the Department of Fisheries and Oceans, the Canadian Coast Guard, Environment and Climate Change Canada, and Natural Resources Canada, reflects and relies on scientific evidence to safeguard our maritime environment. It puts a priority on co-management with indigenous Canadians, and responds to the desire of Canadians to better protect the coastal environment that is central to our way of life.
We are putting $1.5 billion into this plan, the largest investment of its kind ever made in our coasts and waterways. This plan will create a world-leading marine safety system, including new preventative and response measures, to better protect our waters and coasts. Safety is the top priority of this plan.
In Canada, we already have a strong marine safety record. However, with this new plan, Canada will have a truly world-leading system for marine protection and emergency preparedness. To that end, we will ensure that the Canadian Coast Guard has the tools it needs—",Liberal,Surrey Centre,Randeep Sarai,http://www.parl.gc.ca/Parliamentarians/en/members/randeep-sarai(219988)
4712236,ca.proc.d.2017-06-01.9573757,2017-06-01,02c2cb20-f27d-46a5-8e78-ab4b405bf07b,214864,The Deputy Speaker,,Government Orders,Business of Supply,Opposition Motion—Kinder Morgan Trans Mountain Expansion Project,Order. The hon. member for Cariboo—Prince George is rising on a point of order.,Conservative,Simcoe North,Bruce Stanton,http://www.parl.gc.ca/Parliamentarians/en/members/bruce-stanton(214864)
4712237,ca.proc.d.2017-06-01.9573764,2017-06-01,24b3616f-1e8d-4fd3-9420-0a3d7ab8b6d3,216520,Mr. Todd Doherty,,Government Orders,Business of Supply,Opposition Motion—Kinder Morgan Trans Mountain Expansion Project,"Mr. Speaker, with respect to relevance, we are talking about a motion with respect to Kinder Morgan, the Prime Minister, and his 17 B.C. MPs standing up in support of it. However, for the last four minutes, our hon. colleague has gone on about the oceans protection plan, and has not once mentioned the motion with respect to Kinder Morgan.",Conservative,Cariboo—Prince George,Todd Doherty,http://www.parl.gc.ca/Parliamentarians/en/members/todd-doherty(216520)
