basepk,hid,speechdate,pid,opid,speakeroldname,speakerposition,maintopic,subtopic,subsubtopic,speechtext,speakerparty,speakerriding,speakername,speakerurl
4714235,ca.proc.d.2017-06-08.9600619,2017-06-08,f8911e4d-f080-4ac8-94b1-74a18979c811,215938,"Mr. Francis Drouin (Glengarry—Prescott—Russell, Lib.)",,Government Orders,Business of Supply,Opposition motion—Nuclear Disarmament,"Mr. Speaker, I am pleased to rise today to speak to nuclear non-proliferation and the comprehensive nuclear test ban treaty.
Since the advent of nuclear weapons, the international community has had various practical, multilateral instruments to try to stop their proliferation and help to eventually eliminate them. Global non-proliferation and disarmament regimes were designed to be the foundation for the careful management of nuclear weapons in the interests of international security.
The cornerstone of these regimes is the nuclear non-proliferation treaty or NPT. This treaty plays a fundamental role in guiding international mobilization on the most dangerous weapons in the world. The NPT outlines a three-part bargain: the nuclear weapon states commit to work toward nuclear disarmament; non-nuclear weapon states undertake not to acquire or try to acquire such weapons; and all state parties can continue to enjoy the benefits of peaceful uses of nuclear energy.
Canada maintains that these three key commitments are mutually reinforcing. The progress that has been made in nuclear disarmament, non-proliferation, and peaceful uses of energy support the NTP overall and help to create a dynamic in which the treaty's laudable goals can be achieved.
Canada continues to support concrete, practical efforts in favour of nuclear disarmament. As set out in article VI of the NPT, nuclear weapon states should continue to take concrete measures to reduce the number of strategic and non-strategic weapons and to reduce their reliance on them in their security doctrines. 
We note that progress has been made in that regard in recent history. At the end of the Cold War, significant steps were taken to reduce the world's nuclear arsenal, particularly in the United States and Russia. The United Kingdom and France took additional unilateral reduction measures. The global number of nuclear weapons dropped from 80,000 at the height of the Cold War to about 16,000 today. This is not insignificant. We will continue to further reduce the number of nuclear weapons through bilateral, plurilateral, or multilateral measures. Canada remains engaged in various international forums to encourage and support additional progress in that regard, particularly through the NPT review cycle.
While we remain firmly committed to working towards building a world free of nuclear weapons, we recognize that disarmament cannot happen in a vacuum and that it must take the strategic context into account as well as the practical issues associated with that commitment.
It is crucial to ensure that states with nuclear weapons participate in international processes to reduce the number of nuclear weapons or eliminate them entirely. We must also maintain the mutual trust among the parties involved as they move in the direction of reducing and eventually eliminating weapons stockpiles, a process that includes nuclear disarmament verification. Canada is steadfastly committed to the goal of nuclear disarmament.
The second pillar of the NPT makes a vital contribution to the international safety framework by limiting the number of nuclear-weapon states and strengthening our ability to detect inappropriate activity on the part of non-nuclear-weapon states. Thanks to its impressive system of safeguards, the International Atomic Energy Agency, dubbed the “nuclear watchdog”, conducts a number of activities, such as on-site inspections, to ensure that states comply with their non-proliferation obligations. Canada applauds and actively supports the IAEA's efforts to keep its safeguards up to date and enhance their efficiency and effectiveness.
Here is a practical example of international nuclear non-proliferation action: Canada also supports the joint comprehensive plan of action, the JCPOA, an international agreement signed by Iran and the five permanent members of the United Nations Security Council—China, France, Russia, the United Kingdom, and the United States—plus Germany in July 2015. 
The JCPOA represents an important diplomatic achievement that helped in re-establishing the integrity of the global non-proliferation regime. As part of the JCPOA, Iran agreed to significantly curb its nuclear program and to comply with comprehensive international inspections. Canada continues to have serious doubts regarding Iran’s long-term nuclear ambitions given its history regarding nuclear proliferation and ballistic missile programs. 
We join with our allies in supporting efforts to contain Iran’s nuclear program. Canada firmly supports the mandate given the International Atomic Energy Agency to conduct inspections. Furthermore, since 2015, Canada has made voluntary contributions totalling $10 million through Global Affairs Canada’s weapons of mass destruction threat reduction program.
A complementary element to non-proliferation is the right of all states signatory to the nuclear non-proliferation treaty to use nuclear energy in a peaceful manner. States that fully comply with their non-proliferation obligations can legally have access to specific applications of nuclear energy so as to promote sustainable socio-economic development. These include activities pertaining to human health, agriculture and food safety, water and the environment, energy, radiation technology, and security and safety. Canada is a world leader in nuclear energy and we will continue to expand our network of nuclear partners for mutual and beneficial co-operation. 
We have made major voluntary contributions as part of the International Atomic Energy Agency’s Peaceful Uses Initiative, which supports the agency’s activities to achieve sustainable development and mitigation of climate change objectives. 
The NPT remains the cornerstone of the non-proliferation and disarmament regime as well as the central element at the basis of Canada’s global commitment on these important issues. Through our commitment to the relevant multilateral fora, we will continue to strengthen each of these three pillars. 
Whereas the efforts made internationally to curb the proliferation of nuclear weapons remain essential, we must work to eliminate nuclear tests forever through the signing of a legally binding treaty. Since being adopted in 1996, the comprehensive nuclear-test-ban treaty, or CTBT, has helped strengthen the de facto international standard on nuclear testing. Among other things, this treaty has helped put in place a solid verification system that makes it possible to gather evidence of nuclear tests conducted anywhere in the world. 
In fact, the international monitoring system has made it possible to detect each of the nuclear tests conducted to date by North Korea. The CTBT still needs to be ratified by eight countries to come into effect. Canada continues to play an active role in efforts to get other countries to ratify the treaty so that it can come into effect and be universally enforced. During a visit to New York in September 2016, the former minister of foreign affairs implored the eight countries in question to ratify the treaty so that it can come into force. 
Regarding direct aid, Canada continues to promote concrete programs in support of the CTBT organization's activities, including by providing airborne radiation detectors, on top of other financial contributions.
In February 2017, field testing in cold weather was carried out in Ottawa, Canada. This test also involved the use of the detector mentioned above. Canada is also working to construct, test and certify a radionuclide monitoring station as a contributing national facility to strengthen the capacity of the international monitoring system to verify compliance with the treaty.
Recognizing that nuclear weapons are a clear and real danger, the international community developed a set of practical measures that help to stop proliferation, limit nuclear testing and work toward the goal of eliminating nuclear weapons. Canada actively supports multilateral institutions established in support of achieving these goals.
We will continue to work with our foreign partners to achieve these laudable goals.",Liberal,Glengarry—Prescott—Russell,Francis Drouin,http://www.parl.gc.ca/Parliamentarians/en/members/francis-drouin(215938)
4714236,ca.proc.d.2017-06-08.9600736,2017-06-08,f40d602c-1ae6-414e-bac3-23a2f31f1cdf,224989,"Ms. Linda Duncan (Edmonton Strathcona, NDP)",,Government Orders,Business of Supply,Opposition motion—Nuclear Disarmament,"Mr. Speaker, I would like to put a question to my colleague across the way. It is important to go back to our motion today to understand what it is we are discussing. We are discussing the fact that Canada has boycotted ongoing United Nations negotiations toward a nuclear ban treaty. It is important to keep in mind that, as the member is aware, as a party to the non-proliferation treaty, one of our binding obligations is to participate in those exact negotiations. 
We have not said anything against action on all the other obligations under that treaty, far from it. However, what is puzzling is the continued discussion about Canada bringing forward the motion on the fissile material. At the very meeting where Canada tabled yet another version of this measure with a new name, that was when it voted to oppose proceeding with the very negotiations that it is obligated to participate in under the non-proliferation treaty.
It is important to know that in fact there has not been progress on the fissile treaty, because the very same countries that they say make it purposeless to be at the negotiation with the UN are opposing the fissile ban. That includes Pakistan, China, Russia, Iran, Egypt, and Israel. 
I would like to hear the member speak to the very purpose of the motion, which is a response to Canada's refusal to participate in its obligation to participate in these ongoing negotiations at the UN.",NDP,Edmonton Strathcona,Linda Duncan,http://www.parl.gc.ca/Parliamentarians/en/members/linda-duncan(224989)
4714237,ca.proc.d.2017-06-08.9600741,2017-06-08,f8911e4d-f080-4ac8-94b1-74a18979c811,215938,Mr. Francis Drouin,,Government Orders,Business of Supply,Opposition motion—Nuclear Disarmament,"Mr. Speaker, I thank my colleague for his question. I would understand that if Canada were alone in its position, but Canada’s position is the same as that of the United Kingdom, Germany and France, as well as Norway. Many of our multilateral partners have adopted the same position as Canada.
I believe we are taking the right multilateral approach with our G7 partners, and with Norway. I think that that is the correct approach in this file.",Liberal,Glengarry—Prescott—Russell,Francis Drouin,http://www.parl.gc.ca/Parliamentarians/en/members/francis-drouin(215938)
4714238,ca.proc.d.2017-06-08.9600745,2017-06-08,e38f0ee9-418f-4b86-a6fd-2c859c05d475,229509,"Ms. Kamal Khera (Parliamentary Secretary to the Minister of National Revenue, Lib.)",,Government Orders,Business of Supply,Opposition motion—Nuclear Disarmament,"Mr. Speaker, I thank my hon. colleague for highlighting how our government is taking concrete action to achieve nuclear disarmament, such as rallying 159 states to support and pass a resolution calling for a fissile material cut-off treaty, ensuring a high-level group to help phase out nuclear weapons.
Would the member not agree that an immediate ban is an empty process that excludes essential players and may actually set back nuclear disarmament?",Liberal,Brampton West,Kamal Khera,http://www.parl.gc.ca/Parliamentarians/en/members/kamal-khera(229509)
4714239,ca.proc.d.2017-06-08.9600747,2017-06-08,f8911e4d-f080-4ac8-94b1-74a18979c811,215938,Mr. Francis Drouin,,Government Orders,Business of Supply,Opposition motion—Nuclear Disarmament,"Mr. Speaker, I have to say I agree with my colleague. What is the point of negotiating nuclear disarmament if the players are not at the table? 
We are working with our allies on this and working with communities in the multilateral countries that actually have nuclear weapons so that we can create concrete action on these issues. I thank her for her important question. It highlights what Canada is all about. We are not about just talking at a table without the players. We want to make sure that when we propose concrete actions to disarm nuclear weapons, those who own them are actually at the table.",Liberal,Glengarry—Prescott—Russell,Francis Drouin,http://www.parl.gc.ca/Parliamentarians/en/members/francis-drouin(215938)
4714240,ca.proc.d.2017-06-08.9600749,2017-06-08,6da8653f-692f-4bbc-acb2-86e088f0d60d,219035,"Mr. Pierre Nantel (Longueuil—Saint-Hubert, NDP)",,Government Orders,Business of Supply,Opposition motion—Nuclear Disarmament,"Mr. Speaker, I would like to thank my colleague for his speech.
Obviously, this is a fascinating subject for everyone, and no one is against virtue, that goes without saying. However, last week, the minister announced that Canada would sit on eight additional committees. I would like to know if the same logic, to follow our allies, applies here and why Canada cannot be the leader that it has already been in this area?",NDP,Longueuil—Saint-Hubert,Pierre Nantel,http://www.parl.gc.ca/Parliamentarians/en/members/pierre-nantel(219035)
4714241,ca.proc.d.2017-06-08.9600751,2017-06-08,f8911e4d-f080-4ac8-94b1-74a18979c811,215938,Mr. Francis Drouin,,Government Orders,Business of Supply,Opposition motion—Nuclear Disarmament,"Mr. Speaker, Canada will always be a leader in the world. This has been the case for climate change. The Minister of Environment has done a good job working alongside with other partner countries around the world, to sign the Paris agreement. I am glad that all members of Parliament, except one, voted in favour of it.
Canada will always adopt a multilateral approach when it comes to international issues.",Liberal,Glengarry—Prescott—Russell,Francis Drouin,http://www.parl.gc.ca/Parliamentarians/en/members/francis-drouin(215938)
4714242,ca.proc.d.2017-06-08.9600787,2017-06-08,f4efade5-e605-4926-b4d9-cea84ef76f14,217136,"Mr. Randall Garrison (Esquimalt—Saanich—Sooke, NDP)",,Government Orders,Business of Supply,Opposition motion—Nuclear Disarmament,"Mr. Speaker, I will be splitting my time with the member for Victoria.
I am pleased and proud to rise today to speak in favour of this motion calling on Canada to support the draft convention on the prohibition of nuclear weapons. Some of the things I will say at the beginning of my remarks are well known.
There are more than 15,000 nuclear weapons in the world, and about 95% of those are owned by the United States and Russia, but there is good reason to believe that the U.K., China, France, India, Pakistan, North Korea, and Israel also possess nuclear weapons.
It is important to note the second thing that most people who are tuned into this topic are aware of, that nuclear weapons are the only weapons of mass destruction that are not explicitly prohibited by an international treaty. That is why I am both shocked and appalled, although that phrase may sound trite, by the attitude of the government on this question.
More than 120 countries are participating in the negotiations. Yesterday I sat here during question period and I heard the Prime Minister call the negotiations “sort of useless”. His reason for calling these talks “sort of useless” was that the states that possessed nuclear weapons are not participating. 
How will we make any progress on this issue if we do not apply pressure from the rest of the world on those countries that hold nuclear weapons? How will we get any of them to understand the necessity of renouncing not only the possible use but the possession of nuclear weapons? 
There are really only two threats right now to the existence of humanity on this planet. One of those threats is global warming, and we have participated and the government claims leadership. Canada has participated in all of the international conventions to attack this main threat to humanity's existence. 
We have not said that we will no longer participate in the Paris agreement because some leader of a country close to us does not believe that we should participate. That would be the same logic the Prime Minister used for not participating in the draft convention talks for the prohibition of nuclear weapons. It makes no sense to me. It is also a cavalier attitude that treats this issue as trivial. I would submit that this is anything but trivial, because it is the second threat to the existence of humanity on this planet.
Thinking back to Hiroshima and Nagasaki and the use of nuclear weapons at that time, these were very small weapons in comparison to what exists today. We found out later that they were the only nuclear weapons in existence at that time There were no great stockpiles and, if they had not worked, there were not lots more to try to use.
Today, 15,000 nuclear weapons exist and there is no guarantee, with the proliferation that has already taken place, with the number of countries that already have access to this technology, that we are going to be able to control this. There is no guarantee that we will be able to stop these weapons from falling into the hands of groups at a sub-state level, groups that we might want to label as terrorist groups. Who knows who might get access to these weapons because of the broad distribution of the technology at this point?
It is incumbent on us to take every action we can to make sure that nuclear weapons are destroyed and no longer available for use by anyone on this planet. It is like firefighting. We train firefighters. We get them to work as hard as they can on fire prevention as well as putting out fires. Firefighters do not just go to fires and turn on the hose. They work every day to try to educate the public and to identify threats. In this case, it would be far too late if we waited until nuclear weapons were used to then say it was tragedy and we should have done something.
This is like fire prevention. This is like disease prevention. I cannot understand not just the Prime Minister but other members on the other side whom I've heard saying just recently that this is a waste of time. One of the things we are short of is time. We are short of time on climate change. We are short of time in banning nuclear weapons. We need to make the best use if whatever efforts we can to make sure these weapons are destroyed.
New Democrats have long held this position. It is not something new for us. Canada previously held this position, and Canada previously has been a leader in trying to work against the proliferation of nuclear weapons. Canada is part of the international treaties to prevent the proliferation of nuclear weapons.
It makes no sense to me that the government is not participating in these talks, and not just participating, but we should be leading the talks. We should be applying the pressure on those of our allies who have nuclear weapons, and we should be offering whatever support they need to make that decision. Is there some way, through this convention, that we can offer greater security to those who feel so threatened that they feel they need nuclear weapons? Let us have Canada stand up diplomatically and try to solve those problems, to provide the leadership on those problems so that countries no longer feel so threatened that they have to possess these weapons of mass destruction. Again, it is not just participating; it is being a leader. lt is putting forward the ideas through this treaty and through surrounding actions that will get us to a place where we no longer face this threat. 
Yesterday, I had the privilege of standing with Hiroshima survivor Setsuko Thurlow, a Canadian citizen who, as a child growing up in Japan, was severely injured and lost many family members and friends as a result of that nuclear explosion. I am very proud of her and the campaign that she carries on. She received a standing ovation at the United Nations. I would challenge the Prime Minister to tell Setsuko Thurlow that her campaign is useless. I would challenge him to do that.
However, the government would not even meet with her. Liberals would not even show up when she was here to hear what she had to say. With her was Cesar Jaramillo, the executive director of Project Ploughshares, which has worked tirelessly against all kinds of weapons, but in particular against nuclear weapons. I challenge the Prime Minister to tell Cesar Jaramillo that the work he does for Project Ploughshares is useless work. It is beyond belief that we have a prime minister who was so cavalier about this issue in question period yesterday. It is beyond belief after the speech that the Minister of Foreign Affairs gave in the House saying that, given the instability of the world, it was incumbent on Canada to step up and take a leadership role and that, because the United States is withdrawing from its responsibilities, it is going to be a more dangerous world. A day after that the Prime Minister stood and said here is something we are not going to lead on; we are not going to lead on trying to get rid of nuclear weapons.
A day after that we had the new defence strategy released. I am a somewhat naive member of Parliament sometimes. Having heard the Minister of Foreign Affairs say we are are going to step up to take a leadership role, I actually expected to see that in our defence strategy. Instead, the defence strategy has not one new dollar for the Canadian military in this fiscal year, but promises for increased funding that are 10 and 20 years down the road.
The crises we face of international insecurity are now, not 10 years or 20 years down the road. Do not get me wrong. I have no complaint about a government that is going to plan for our future needs and equipment and that is going to cost those out properly. The problem I have is the gap between those promises and the reality we face every day in the Canadian military. We are about to take on a NATO mission in Latvia, which I and my party fully support. It is important to send a message to both Putin and Trump that the Baltics are NATO members and an attack on one is an attack on all. That is a very important mission for us. 
We have also promised to take on a peacekeeping mission in Africa, another mission that I very much look forward to hearing about even though we are about six months late. How is the Canadian military going to take a leadership role in both those missions when its budget increase this year was less than the rate of inflation? We are asking it to take on new duties, which I am very proud of, with fewer resources than it had last year.
I am a bit confused about the government's real attitude to international affairs. What does it expect Canada to accomplish if we are going to leave the obvious avenues for leadership vacant? I call on all members of the House to think very seriously about the implications of Canada continuing to be absent from these negotiations that would lead to a treaty that would make nuclear weapons illegal and that would lead to a much safer and secure world. Yes, the task is hard, but Canada did not shrink from this when it came to the Ottawa treaty to ban landmines. We did not shrink from this when we advocated for the International Criminal Court. Why are we shrinking from that responsibility to lead at this point? I have no answer to that question, and I would like the government to explain to me why it is not taking that leadership role.",NDP,Esquimalt—Saanich—Sooke,Randall Garrison,http://www.parl.gc.ca/Parliamentarians/en/members/randall-garrison(217136)
4714243,ca.proc.d.2017-06-08.9600800,2017-06-08,3a81a21a-bec2-40b4-aae5-d554237ba474,219862,"Ms. Anita Vandenbeld (Ottawa West—Nepean, Lib.)",,Government Orders,Business of Supply,Opposition motion—Nuclear Disarmament,"Mr. Speaker, I want to pick up on the analogy that the member used about a fire. Our government is trying to reduce the matches, accelerant, and lighters, so people will not be able to sell them. That is what is going to stop the fire, not talking to others who do not have matches while not engaging with people who have the capability of starting a fire. We want to prevent it. This is why we have led the world on the fissile material cut-off treaty. We led 159 countries. We are taking leadership and making sure that the very materials that can cause the explosives in nuclear weapons will not be used and there is no proliferation. What we are trying to do is realistic and will reduce nuclear weapons. Simply talking to those without nuclear weapons and saying there will be a ban is not going to get rid of one single nuclear weapon.
Would the hon. member please comment on the fact that what we are trying to do will have impact?",Liberal,Ottawa West—Nepean,Anita Vandenbeld,http://www.parl.gc.ca/Parliamentarians/en/members/anita-vandenbeld(219862)
