basepk,hid,speechdate,pid,opid,speakeroldname,speakerposition,maintopic,subtopic,subsubtopic,speechtext,speakerparty,speakerriding,speakername,speakerurl
4713961,ca.proc.d.2017-06-07.9592347,2017-06-07,ee06377a-6024-40ae-9fe4-a059508592a4,215951,"Mr. Wayne Long (Saint John—Rothesay, Lib.)",,Private Members' Business,National Maternity Assistance Program Strategy Act,,"Mr. Speaker, it is a great privilege for me to here on behalf of my riding of Saint John—Rothesay. As members know, I love my riding. It is an industrial riding and a union riding.
I am here today to speak to Bill C-243, put forward by my colleague from Kingston and the Islands. The bill raises important issues, such as health and job security.
 Just as important for our government is our commitment to help the middle class and those working hard to join it. To respect this commitment, we have to give all workers in the country an equal opportunity. The government recognizes that pregnancy should not be a barrier to full employment. We recognize that we must ensure workplace health and safety for pregnant workers.
 The Canada Labour Code has provisions that guarantee safe working conditions to all workers in federally regulated sectors, including pregnant and nursing employees.
We also believe that pregnant workers should be able to benefit from more flexibility when the time comes to take their maternity leave. This is particularly true in cases where pregnant women have to stop working earlier than expected because of the risks their job could pose to their health or that of their babies. 
I will take the few minutes I have to talk to the House about what our government is doing to help these workers, as well as their families, across the country. In particular, I would like to elaborate on the measures proposed in budget 2017 to increase the flexibility of El special benefits. The special benefits under the El program help parents balance work and family life.
Each year, this program helps thousands of eligible Canadians prepare and care for a new baby or take care of a family member who is critically ill. It is our responsibility to ensure that these measures remain appropriate and accessible for Canadian workers seeking to balance their professional careers and personal lives.
Let us start with parental benefits.
 Starting a family presents certain challenges, especially for working parents. Measures set out in budget 2017 offer these parents flexibility. Parents will be able to choose the option that best suits their needs based on their work and family situation.
 Under the proposed changes, parents will have two options. For the first option, which corresponds to the standard 35-week period for parental benefits, claimants can receive El parental benefits at the current rate of 55% of their average weekly earnings for a period of up to 12 months. For the second option, the extended 61-week parental benefits period, claimants can receive El parental benefits at a rate of 33% of their average weekly earnings over a period of 18 months.
 These changes represent an investment of $152 million over five years, starting in 2017-18, and $27.5 million per year. In addition, parents can continue to share the benefits.
Moreover, we are proposing to allow pregnant women to apply for El maternity benefits up to 12 weeks before their expected delivery date, if they wish to do so. This means more flexibility compared to the current standard of eight weeks. This additional flexibility is expected to amount to $43.1 million over five years, starting in 2017-18, and $9.2 million per year.
In budget 2017, we are also offering more support for caregivers. We are proposing the creation of a new El benefit for a period of up to 15 weeks. This new caregiver benefit will allow Canadians to care for an adult family member who is critically ill or injured.
These benefits would be provided to people caring for an adult family member who is critically ill but not at the end of life. 
This is a first for employment insurance. We are very proud of this measure. I must add that this new benefit would supplement the existing compassionate care benefit for people caring for family members who are critically ill and in end-of-life situations.
Parents of critically ill children would continue to have access to up to 35 weeks of benefits. They would now be able to share these benefits with more family members. 
For some time now, we have wanted to increase the flexibility of the different types of parental benefits to better respond to families' needs. We made sure to do this right. That is why we worked together with all of our partners. I am talking about Canadians and numerous stakeholders. Together we studied the possible changes to employment insurance. Most of all, we listened to people from coast to coast to coast, and the changes we are making are the ones people asked us to make. 
Last fall, we held on-line consultations with Canadians. We asked them how they felt about the idea of offering more flexible EI maternity and parental benefits and leaves under the Canada Labour Code. We also asked them for their views on the idea of offering more inclusive caregiver benefits and leaves for Canadians caring for a family member. We also hosted a stakeholder round table last November. Among the participants were representatives of the medical community, health charities, family advocacy groups, unions, and business associations. We made a commitment to take measures to improve EI benefits, and that is what we are doing. These changes would ensure greater financial security for Canadian workers and their families when they need it the most.
In conclusion, there is no doubt that our government is making a real difference for workers, especially female workers, across Canada. We are taking this action because their well-being, health, and safety are of the utmost benefit and importance to us. Giving everyone an equal opportunity means the middle class and those working hard to join it will be better off. 
I can certainly say first-hand from the riding of Saint John—Rothesay that the response to this bill has been outstanding. Workers who are thrilled with these proposed changes come into my office every week, and I am honoured again to speak to these changes on behalf of my riding of Saint John—Rothesay.",Liberal,Saint John—Rothesay,Wayne Long,http://www.parl.gc.ca/Parliamentarians/en/members/wayne-long(215951)
4713962,ca.proc.d.2017-06-07.9592408,2017-06-07,07cf5767-802c-406c-92a7-7dc92af79b40,229526,"Mr. Kevin Lamoureux (Parliamentary Secretary to the Leader of the Government in the House of Commons, Lib.)",,Private Members' Business,National Maternity Assistance Program Strategy Act,,"Mr. Speaker, what a pleasure it is to rise again to address a very important piece of legislation that my colleague has brought forward. I first must applaud my colleague for advancing an issue that is important to his constituents and individuals for whom he is trying in a very effective way to advocate. He, along with the others who helped him bring this bill forward to where we have it today, has done an incredible job in making sure that we have advanced this debate. My understanding is that it is because of those efforts that we will continue to see this discussion take place in the weeks and months ahead, as the minister responsible will have the mandate to do the consultation that is so extremely important, because as we move forward, we want to make sure we are moving in the right direction on this very important issue.
For many years we often talked about EI, EI benefits, and the way we have evolved from a time when somebody who was laid off or released would have virtually no benefits whatsoever. Then we had a government that ultimately brought in a national program. As some provinces attempted to deal with it, we had a national government that recognized that there was a need to work with Ottawa in an attempt to bring forward a program that is really there for the worker.
When I think of the many different programs that government administers, for which government is ultimately responsible, I like to think that this is one of those programs that is probably at the very heart of protecting the interests of workers. 
Over the years we have seen changes that have been made to tune it up, to improve the program, and we have something here today that is adding progress to that debate, that ongoing discussion, with the idea that we will see some very tangible actions in the not too distant future.
It is with pride that we think of the last budget and some of the things we have already incorporated into the EI program, something I believe we would all like to see enhanced in whatever way we can. It is important to provide opportunities for individuals to have the choice about when it is in their best interests to start receive those benefits. 
I would like to read a couple of very tangible points that were introduced in the last 2017-18 budget, dealing with how we have enhanced EI benefits and leaves for parents. It is important to recognize that the Government of Canada is moving forward on those commitments to better support Canadian families by increasing the flexibility of maternity and parental EI benefits to better reflect the needs of Canadian families. This is something we have seen in a number of different measures, but this hour is to focus on some of those specifics.
These changes will provide more flexibility to pregnant workers to better take into account their particular health and workplace circumstances when choosing when to begin their maternity benefits. That is the type of flexibility that will have a real, tangible impact for many Canadians in all regions of our country. In fact, according to the “Employment Insurance Monitoring and Assessment Report 2014/2015”, there were approximately 169,000 maternity claims that were paid $1.1 billion in benefits, and 191,000 parental claims, of which 86% were by women and 14% by men. This group was paid $2.5 billion in benefits. 
That gives a sense of the number of recipients in this program and the amounts that both workers and employers are contributing into what I believe is a very worthy program. 
Between October 6 and November 4 of 2016, consultations were held to hear Canadians' perspectives on more flexible EI, maternity, and parental benefits and corresponding leave provisions under the Canada Labour Code, as well as their experiences in balancing work and caring for newborns and recently adopted children. A round table discussion with stakeholders was also held in November 2016. A summary of the consultations was posted online in February 2017.
I would like to emphasize the importance of flexibility. A pregnant woman now has the flexibility to claim benefits earlier, before the child is born. I have listened to many members talk about the importance of that flexibility in the work environments that women often find themselves in, whether it is on a cement floor in a factory, behind a welding machine, or any other job. Whether it is the woman's decision or the advice of medical professionals, it may be in the woman's best interest to use more maternity benefits before the child is born. This takes place, and we recognized it in the last budget. That is one of the reasons we made that change and provided the flexibility that is so critically important.
It went from eight weeks to 12 weeks to build in additional support. We need to recognize that not all pregnancies are the same and that not all women are engaged in employment in the same manner. 
Nowadays, more and more fathers want to be at home to provide the care. It was very encouraging to see the number of fathers, which was roughly 14% back in 2014-15, and I suspect the increase in fathers wanting to take those early years is because they are so very important. I have been in politics for many years, and one of my regrets was not having as much time as I would have liked with my children, now young adults, when they were infants. Having that additional flexibility and allowing both parents the opportunity to share those life experiences after a child is born or providing a mother the opportunity to have additional weeks of leave prior to the child being born, for whatever reasons, we see as a very strong positive.
One of the common themes of this government is to assist Canada's middle class and those aspiring to be part of it in a very tangible fashion. Some of the actions in the last budget refer specifically to EI and making the necessary changes. 
I will bring it forward to what we are talking about today, which is that there are always areas where we can improve.
We can in fact do better. I believe my colleague has provided that to us tonight, the ability to have that discussion, explore the issue, maybe listen to what other members have to say on the record, and look at what has been said in committee. We understand that there have been some amendments and changes since the bill was before the House last. That is one of the ways we believe the standing committees can play a very productive role.
I appreciate the opportunity to share a few thoughts and words on this particular piece of legislation.",Liberal,Winnipeg North,Kevin Lamoureux,http://www.parl.gc.ca/Parliamentarians/en/members/kevin-lamoureux(229526)
4713963,ca.proc.d.2017-06-07.9592510,2017-06-07,fe08cc31-44b1-466e-a0c6-1b0c61c8bf97,215973,"Mr. Mark Gerretsen (Kingston and the Islands, Lib.)",,Private Members' Business,National Maternity Assistance Program Strategy Act,,"Mr. Speaker, I will not say much other than to thank everybody who participated in the debate this evening, as well as the people who have taken the opportunity to participate leading up to this point.
This really is about trying to put the dialogue in place to change the discussion we are having about women in the workforce, particularly women who work in hazardous jobs. I hope the bill will pass and that the discussion can begin.",Liberal,Kingston and the Islands,Mark Gerretsen,http://www.parl.gc.ca/Parliamentarians/en/members/mark-gerretsen(215973)
4713964,ca.proc.d.2017-06-07.9592514,2017-06-07,16c839d3-0183-4ed6-892a-8d7bdc37c474,214972,The Assistant Deputy Speaker (Mr. Anthony Rota),,Private Members' Business,National Maternity Assistance Program Strategy Act,, The question is on the motion. Is it the pleasure of the House to adopt the motion?,Liberal,Nipissing—Timiskaming,Anthony Rota,http://www.parl.gc.ca/Parliamentarians/en/members/anthony-rota(214972)
4713965,ca.proc.d.2017-06-07.p4938154,2017-06-07,,,,intervention,Private Members' Business,National Maternity Assistance Program Strategy Act,," Agreed.
 No.",,,Some hon. members,
4713966,ca.proc.d.2017-06-07.p4938156,2017-06-07,16c839d3-0183-4ed6-892a-8d7bdc37c474,214972,The Assistant Deputy Speaker (Mr. Anthony Rota),,Private Members' Business,National Maternity Assistance Program Strategy Act,, All those in favour of the motion will please say yea.,Liberal,Nipissing—Timiskaming,Anthony Rota,http://www.parl.gc.ca/Parliamentarians/en/members/anthony-rota(214972)
4713967,ca.proc.d.2017-06-07.p4938157,2017-06-07,,,,intervention,Private Members' Business,National Maternity Assistance Program Strategy Act,, Yea.,,,Some hon. members,
4713968,ca.proc.d.2017-06-07.p4938158,2017-06-07,16c839d3-0183-4ed6-892a-8d7bdc37c474,214972,The Assistant Deputy Speaker (Mr. Anthony Rota),,Private Members' Business,National Maternity Assistance Program Strategy Act,, All those opposed will please say nay.,Liberal,Nipissing—Timiskaming,Anthony Rota,http://www.parl.gc.ca/Parliamentarians/en/members/anthony-rota(214972)
4713969,ca.proc.d.2017-06-07.p4938159,2017-06-07,,,,intervention,Private Members' Business,National Maternity Assistance Program Strategy Act,, Nay.,,,Some hon. members,
4713970,ca.proc.d.2017-06-07.p4938160,2017-06-07,16c839d3-0183-4ed6-892a-8d7bdc37c474,214972,The Assistant Deputy Speaker (Mr. Anthony Rota),,Private Members' Business,National Maternity Assistance Program Strategy Act,," In my opinion the yeas have it.
 And five or more members having risen: 
 Pursuant to an order made Tuesday, May 30, 2017, the recorded division stands deferred until Wednesday, June 14, 2017, at the expiry of the time provided for oral questions. ",Liberal,Nipissing—Timiskaming,Anthony Rota,http://www.parl.gc.ca/Parliamentarians/en/members/anthony-rota(214972)
4713971,ca.proc.d.2017-06-07.p4938163,2017-06-07,,,,stagedirection,Government Orders,Cannabis Act,,"The House resumed consideration of the motion that Bill C-45, An Act respecting cannabis and to amend the Controlled Drugs and Substances Act, the Criminal Code and other Acts, be read the second time and referred to a committee, and of the amendment.",,,,
4713972,ca.proc.d.2017-06-07.9592539,2017-06-07,634edc34-ea0d-406f-ade1-eeec6c5bad04,229501,"Mr. Adam Vaughan (Parliamentary Secretary to the Minister of Families, Children and Social Development (Housing and Urban Affairs), Lib.)",,Government Orders,Cannabis Act,,"Mr. Speaker, before we engaged in the private members' business, I listened attentively to my colleague from Edmonton West and heard him talk about the need to consult very closely with municipalities.
I am glad the government does that as a matter of not just habit but good governance. I am glad the Conservative Party is starting to realize that talking to municipalities has a value, especially when they tell us good things and give us good advice. We can build a great country with them. We have been talking with municipalities about the need to support them with maintaining standards around this and the law enforcement around this issue, particularly in those areas where municipalities run their police forces.
We have met with the mayor of Edmonton on this precise issue and on other issues related to this. We have met with the mayor of Calgary as well. Are there any other mayors or reeves or local politicians in Alberta that members think we could talk to, many of whom support the bill with a great deal of clarity, to get their advice around revenue streams and other components of this? We want to make sure we reflect all of the municipalities and incorporate their perspectives into this process as we move forward with the best legislation around this issue this country has ever seen.",Liberal,Spadina—Fort York,Adam Vaughan,http://www.parl.gc.ca/Parliamentarians/en/members/adam-vaughan(229501)
4713973,ca.proc.d.2017-06-07.9592549,2017-06-07,62c4052f-dd41-418a-9b5b-1715c0baa84d,216491,"Mr. Kelly McCauley (Edmonton West, CPC)",,Government Orders,Cannabis Act,,"Mr. Speaker, I am glad the hon. member made his way out west. He asked who else he could speak to.
He could talk to the mayor of Morinville, who is the president of the AUMA, whom we met with in Ottawa just a month ago. She expressed absolute disdain for the bill and how the government has not once picked up the phone and spoken to anyone in a rural area. She was absolutely disheartened by the government offloading all of its costs onto municipalities, while providing no support for policing and no support to the provinces.
There are a lot of people in Alberta the member could talk to. He could start with the head of the AUMA.",Conservative,Edmonton West,Kelly McCauley,http://www.parl.gc.ca/Parliamentarians/en/members/kelly-mccauley(216491)
4713974,ca.proc.d.2017-06-07.9592554,2017-06-07,bd2068aa-74c7-430a-bdf5-6f17b14ca140,216501,"Mr. Tom Kmiec (Calgary Shepard, CPC)",,Government Orders,Cannabis Act,," Mr. Speaker, at this late hour, I am pleased to rise to ask a question of my colleague, the member for Edmonton West. My specific question is on the enforceability of many portions of the act. 
It is fine to write legislation, even if it very poorly written, as I think Bill C-45 indeed is, but there is a lack of enforceability for sections such as how we will actually enforce the limit on four plants in a dwelling. For the marijuana tracking system that the Liberals have proposed in the legislation, there is no real money assigned to it in the budget. We do not really know how it is going to work. How will they track marijuana produced privately in someone's home or are they even thinking of tracking this type of information? 
We know this means that thousands of joints could be out there that a person could then sell illegally on the market. There is really no way to enforce many of the provisions of the act. How does the member think the government actually intends to enforce these provisions?",Conservative,Calgary Shepard,Tom Kmiec,http://www.parl.gc.ca/Parliamentarians/en/members/tom-kmiec(216501)
4713975,ca.proc.d.2017-06-07.9592558,2017-06-07,62c4052f-dd41-418a-9b5b-1715c0baa84d,216491,Mr. Kelly McCauley,,Government Orders,Cannabis Act,," Mr. Speaker, I do not think the government knows how it is going to regulate or track this. Right now, we have a bill that would allow every household in this country to have four pot plants that could produce over 3,000 joints. There is nothing in the legislation about how they are going to track that. There is no funding for this. 
 When I used to work in Burnaby, I was great friends with the head of the Burnaby RCMP. There were such rampant problems with grow-ops in that area because they did not even have the resources to go after grow-ops then, much less when every single household will be able to have their own grow-op. There is nothing in the legislation explaining how the government is going to stop people from having five plants, or six plants. Is the government going to separate a building into apartments if it is a duplex, or if it is an upstairs-downstairs building? 
The government has left so many holes in the legislation, we could drive an 18-wheeler full of pot through it any time.",Conservative,Edmonton West,Kelly McCauley,http://www.parl.gc.ca/Parliamentarians/en/members/kelly-mccauley(216491)
