basepk,hid,speechdate,pid,opid,speakeroldname,speakerposition,maintopic,subtopic,subsubtopic,speechtext,speakerparty,speakerriding,speakername,speakerurl
4716361,ca.proc.d.2017-06-15.9625045,2017-06-15,7e23c9e2-cce8-4cd0-b5ed-200a809748cb,229497,"Mr. Serge Cormier (Parliamentary Secretary to the Minister of Immigration, Refugees and Citizenship, Lib.)",,Oral Questions,Citizenship and Immigration,,"Mr. Speaker, once again, I am very proud of our government's commitment to welcoming people fleeing war, terror and persecution.
The board recently introduced new measures, including shorter hearings for simple cases, which would make the process more efficient, and in turn, lead to greater productivity and increased fairness.
We have also put in place an independent review to identify options to further increase our asylum system's productivity. Our government will continue to work with the board to ensure that our refugee protection system is fair and compassionate.",Liberal,Acadie—Bathurst,Serge Cormier,http://www.parl.gc.ca/Parliamentarians/en/members/serge-cormier(229497)
4716362,ca.proc.d.2017-06-15.9625047,2017-06-15,0bd5970c-e4c2-4044-8344-8123b16d75bd,218725,"Hon. Peter Kent (Thornhill, CPC)",,Oral Questions,Foreign Affairs,,"Mr. Speaker, the air and land blockade of Qatar by Saudi Arabia and other Gulf states is continuing. Saudi Arabia cites Qatari links with militant groups in the embrace of various terrorist entities, including Iranian groups. Saudi Arabia is demanding that Qatar break all links with the Muslim Brotherhood, Hamas, and Iran.
Canadians have not heard a peep from the Liberals on this dispute, which includes both allies and enemies. Can the minister explain why?",Conservative,Thornhill,Peter Kent,http://www.parl.gc.ca/Parliamentarians/en/members/peter-kent(218725)
4716363,ca.proc.d.2017-06-15.9625050,2017-06-15,22a6ff7d-fc39-47b2-8003-a016329ed224,229490,"Mr. Matt DeCourcey (Parliamentary Secretary to the Minister of Foreign Affairs, Lib.)",,Oral Questions,Foreign Affairs,,"Mr. Speaker, the stability of the Gulf Cooperation Council and the broader Middle East is certainly of importance to this government, and to all Canadians. Canada is following recent developments in the region. We strongly encourage all parties to work together to resolve disagreements. Canada's consular travel advice has been updated to reflect the ongoing situation. We are advising travellers to exercise a high degree of caution. We hope that issues between the parties will be addressed in a constructive manner.",Liberal,Fredericton,Matt DeCourcey,http://www.parl.gc.ca/Parliamentarians/en/members/matt-decourcey(229490)
4716364,ca.proc.d.2017-06-15.9625054,2017-06-15,33ef2052-c37d-446f-9d03-515d01591eba,218026,"Mr. Larry Maguire (Brandon—Souris, CPC)",,Oral Questions,Agriculture,,"Mr. Speaker, today another two cases of the deadly PED virus have been reported in Manitoba hog barns, yet the Minister of Agriculture has offered nothing more than bafflegab, and more talk. This morning we heard from industry pork experts that the Canadian Food Inspection Agency, at the very least, needs to immediately bring back the biosecurity measures the Liberals eliminated, particularly the trusted truck wash protocol. 
Will the minister finally listen to these industry experts, and stop needlessly putting these Canadian farm families at risk?",Conservative,Brandon—Souris,Larry Maguire,http://www.parl.gc.ca/Parliamentarians/en/members/larry-maguire(218026)
4716365,ca.proc.d.2017-06-15.9625057,2017-06-15,ae40e780-7dd1-4e34-bf90-4dbb35c18443,229522,"Mr. Jean-Claude Poissant (Parliamentary Secretary to the Minister of Agriculture and Agri-Food, Lib.)",,Oral Questions,Agriculture,,"Mr. Speaker, we are determined to protect the health of animals in Canada, and we are working with our partners to ensure that the disease is contained.
Our government supports Manitoba in its efforts to manage the current outbreak of porcine epidemic diarrhea and will continue to do so. We want to ensure that we have very effective and efficient transport protocols in place to protect the livestock.",Liberal,La Prairie,Jean-Claude Poissant,http://www.parl.gc.ca/Parliamentarians/en/members/jean-claude-poissant(229522)
4716366,ca.proc.d.2017-06-15.9625059,2017-06-15,8c3e4bb0-ac84-4071-bc91-3b47268a13eb,220250,"Hon. Judy A. Sgro (Humber River—Black Creek, Lib.)",,Oral Questions,Construction Industry,,"Mr. Speaker, late payment of contractors in the construction industry has been a significant problem for far too long. Contractors who complete their obligations deserve to be paid in a timely manner. Too many workers and small businesses in the construction industry face severe hardships while they wait for payment of their work.
Can the parliamentary secretary please inform the House of recent steps taken to ensure the prompt payment to these contractors?",Liberal,Humber River—Black Creek,Judy Sgro,http://www.parl.gc.ca/Parliamentarians/en/members/judy-sgro(220250)
4716367,ca.proc.d.2017-06-15.9625063,2017-06-15,deea27ee-c7f2-4442-99ac-2417bbea8359,219764,"Mr. Steven MacKinnon (Parliamentary Secretary to the Minister of Public Services and Procurement, Lib.)",,Oral Questions,Construction Industry,,"Mr. Speaker, we have very good news today. I want to thank the hon. member for Humber River—Black Creek for her hard work on this file.
Our government strongly supports the prompt payment of contractors and subcontractors. Last week, we were able to announce that we will publicly disclose payments to contractors to eliminate this unfair situation. This will provide our subcontractors with the information they need to get paid on time. Of course, along with the hon. member, we will continue to work with our industry partners to find further tangible solutions to bring prompt payment fairness to our trade workers and businesses.",Liberal,Gatineau,Steven MacKinnon,http://www.parl.gc.ca/Parliamentarians/en/members/steven-mackinnon(219764)
4716368,ca.proc.d.2017-06-15.9625065,2017-06-15,9fe7bceb-dae2-4f26-b87b-2de1f38b4b84,218113,"Mr. Pierre Paul-Hus (Charlesbourg—Haute-Saint-Charles, CPC)",,Oral Questions,National Defence,,"Mr. Speaker, we are still waiting for the official announcement that university-level programs have been restored at the Collège militaire royal de Saint-Jean, and yet the first group of students is supposed to start this September. Obviously, military officials are growing impatient considering all the delays on this file.
First of all, can the Minister of National Defence confirm the number of announcements that have been cancelled over the past 18 months?
Second, can he confirm whether the Collège militaire royal de Saint-Jean in September will be offering university-level courses to it students come September?",Conservative,Charlesbourg—Haute-Saint-Charles,Pierre Paul-Hus,http://www.parl.gc.ca/Parliamentarians/en/members/pierre-paul-hus(218113)
4716369,ca.proc.d.2017-06-15.9625068,2017-06-15,897d99d9-377d-43a8-81be-27a22174136e,229484,"Mr. Jean Rioux (Parliamentary Secretary to the Minister of National Defence, Lib.)",,Oral Questions,National Defence,,"Mr. Speaker, if my colleague had read the new defence policy, he would know that it says right there in black and white that we are restoring the Collège militaire royal de Saint-Jean as a full degree-granting institution. This is good news, and it has already had an impact. Many students have enrolled in college courses so they can pursue a university degree at the Collège militaire royal de Saint-Jean.",Liberal,Saint-Jean,Jean Rioux,http://www.parl.gc.ca/Parliamentarians/en/members/jean-rioux(229484)
4716370,ca.proc.d.2017-06-15.9625072,2017-06-15,4bc128a9-b349-4867-a545-ad05122c0e46,217242,"Ms. Niki Ashton (Churchill—Keewatinook Aski, NDP)",,Oral Questions,Port of Churchill,,"Mr. Speaker, Churchill, Manitoba is facing a crisis. Almost a year ago the port was shut down. Now it is the rail line. The community is suddenly isolated. Businesses are hurting; people are worried. We need immediate federal action. What Churchill is facing is a national disgrace. Our north deserves better. 
Will the federal government step in to address the immediate crisis, and finally work to re-nationalize the port and the rail line, and work with northern and indigenous communities to get it working again?",NDP,Churchill—Keewatinook Aski,Niki Ashton,http://www.parl.gc.ca/Parliamentarians/en/members/niki-ashton(217242)
4716371,ca.proc.d.2017-06-15.9625075,2017-06-15,bc2e82f3-02f1-46e2-b9be-7d5f04ddddc9,214106,"Hon. Marc Garneau (Minister of Transport, Lib.)",,Oral Questions,Port of Churchill,,"Mr. Speaker, we as a government always stand ready to provide assistance to any province or territory that requests assistance in the event of a natural disaster, such as flooding. The Minister of Public Safety has been in contact with the Government of Manitoba to make that offer clear to it, and we are monitoring the situation. From the Transport Canada point of view, we are developing a plan to make sure that both the Port of Churchill and the airport are capable of addressing the needs with respect to supplies for the people of Churchill.",Liberal,Notre-Dame-de-Grâce—Westmount,Marc Garneau,http://www.parl.gc.ca/Parliamentarians/en/members/marc-garneau(214106)
4716372,ca.proc.d.2017-06-15.9625078,2017-06-15,af4d6069-8435-4361-9a6f-d38c96e9d50a,215916,"Mr. Francesco Sorbara (Vaughan—Woodbridge, Lib.)",,Oral Questions,Labour Relations,,"Mr. Speaker, the previous government used every opportunity to attack middle class Canadians who were part of unions in this country. The Conservatives undermined the collective bargaining process, and made it more difficult for Canadian workers to organize. 
The previous government regarded unions as obstacles. Our government knows that unions are important partners in growing our economy and creating high-quality jobs.
Can the Parliamentary Secretary to the Minister of Employment provide the House with an update on measures the government has taken to support the labour movement at home and abroad?",Liberal,Vaughan—Woodbridge,Francesco Sorbara,http://www.parl.gc.ca/Parliamentarians/en/members/francesco-sorbara(215916)
4716373,ca.proc.d.2017-06-15.9625082,2017-06-15,6fa03d6c-bbe7-4e72-b1de-3f877b6bcb02,229532,"Mr. Rodger Cuzner (Parliamentary Secretary to the Minister of Employment, Workforce Development and Labour, Lib.)",,Oral Questions,Labour Relations,,"Mr. Speaker, I would like to thank the member for Vaughan—Woodbridge for his work on behalf of Canadian unions. This week was a great week for Canadian labour and Canadian workers. 
Yesterday, the Senate passed Bill C-4, which is an act that repeals two Conservative bills that were both egregious, and deliberate attacks on organized labour. As well, our minister ratified ILO Convention 98, which is an act that guarantees workers' right to organize and bargain collectively. This government ran on a platform of fair and balanced labour laws, and we will deliver that to Canadian workers.",Liberal,Cape Breton—Canso,Rodger Cuzner,http://www.parl.gc.ca/Parliamentarians/en/members/rodger-cuzner(229532)
4716374,ca.proc.d.2017-06-15.9625085,2017-06-15,e179296b-086b-4072-9082-6795b9b0da4c,217755,"Mr. Bernard Généreux (Montmagny—L'Islet—Kamouraska—Rivière-du-Loup, CPC)",,Oral Questions,Official Languages,,"Mr. Speaker, yesterday, the Minister of Canadian Heritage claimed that she was part of an exemplary government that is leading the way when it comes to official languages.
If that is indeed the case, how does she explain the fact that the Commissioner of Official Languages received 40% more complaints in the past year and that, yesterday, her colleague, the Minister of Environment sent my office here in Ottawa a letter written in English only about my riding, one of the most francophone ridings in Canada?
Can the Liberals spend less time appointing their friends to important government positions and—",Conservative,Montmagny—L'Islet—Kamouraska—Rivière-du-Loup,Bernard Généreux,http://www.parl.gc.ca/Parliamentarians/en/members/bernard-genereux(217755)
4716375,ca.proc.d.2017-06-15.9625090,2017-06-15,3176068f-62ee-4b2f-aacd-1131201c6db1,214707,The Speaker,,Oral Questions,Official Languages,,"Order.
The hon. Minister of Canadian Heritage.",Liberal,Halifax West,Geoff Regan,http://www.parl.gc.ca/Parliamentarians/en/members/geoff-regan(214707)
4716376,ca.proc.d.2017-06-15.9625091,2017-06-15,83cd3ab5-7dc7-414e-ab8b-e0dbc16b4c4a,214117,"Hon. Mélanie Joly (Minister of Canadian Heritage, Lib.)",,Oral Questions,Official Languages,,"Mr. Speaker, of course, our two official languages are a priority for our government. When it comes to bilingualism, we know that there is always room for improvement.
That being said, we are going to abide by the process and appoint a Commissioner of Official Languages. The Official Languages Commissioner is an important officer of Parliament who is part of our vision for official languages, which involves making them a priority in our government's approach.
I would also like to remind my colleague that we have already taken action on this issue with regard to national defence, justice, early childhood education, and community infrastructure. I invite him to participate in the discussions that are taking place as part of the consultations.",Liberal,Ahuntsic-Cartierville,Mélanie Joly,http://www.parl.gc.ca/Parliamentarians/en/members/melanie-joly(214117)
4716377,ca.proc.d.2017-06-15.9625114,2017-06-15,9e05a099-6a0b-4fe2-9e9b-0a8b91b7807b,214054,"Ms. Monique Pauzé (Repentigny, BQ)",,Oral Questions,Canadian Radio-television and Telecommunications Commission,,"Mr. Speaker, all those who work in Quebec television, actors, technicians, directors, screenwriters, producers, in short, all of Quebec's industry, are calling on the minister to review the decisions made by the CRTC on May 15.
The heritage minister has the power to do so; it is set out in legislation. However, does she have the will to do so?
Will the heritage minister abandon Quebec television, or will she stand up to this attack on our culture?",Bloc,Repentigny,Monique Pauzé,http://www.parl.gc.ca/Parliamentarians/en/members/monique-pauze(214054)
4716378,ca.proc.d.2017-06-15.9625157,2017-06-15,83cd3ab5-7dc7-414e-ab8b-e0dbc16b4c4a,214117,"Hon. Mélanie Joly (Minister of Canadian Heritage, Lib.)",,Oral Questions,Canadian Radio-television and Telecommunications Commission,,"Mr. Speaker, I would like to remind my colleague of our major investment in arts and culture. The 2016 budget provides for an investment of $1.9 billion, the largest investment in 30 years. We are still the only G7 country to have made such a significant investment.
That said, I hear the various artists, artisans and entrepreneurs of our creative sector. The CRTC issued its decision and there is legislation that allows for recourse. I intend to use the time I have at my disposal to hear the various industry perspectives before I make a decision. ",Liberal,Ahuntsic-Cartierville,Mélanie Joly,http://www.parl.gc.ca/Parliamentarians/en/members/melanie-joly(214117)
4716379,ca.proc.d.2017-06-15.9625178,2017-06-15,f45e86b7-f192-4692-9889-6b57283fc3b0,224178,"Mr. Gabriel Ste-Marie (Joliette, BQ)",,Oral Questions,Infrastructure,,"Mr. Speaker, that answer is a real letdown for our artists.
Many constitutional experts, a unanimous National Assembly, and now the Union des producteurs agricoles have all appealed to members of the House of Commons.
What they want is simple: divide Bill C-44 to ensure that the infrastructure bank will be subject to Quebec laws, especially the Act Respecting the Preservation of Agricultural Land and Agricultural Activities. 
The government has ignored our National Assembly. Will it now listen to Quebec farmers, yes or no?",Bloc,Joliette,Gabriel Ste-Marie,http://www.parl.gc.ca/Parliamentarians/en/members/gabriel-ste-marie(224178)
4716380,ca.proc.d.2017-06-15.9625201,2017-06-15,811a7b9a-4be5-4f9a-a302-088cb204bfba,214248,"Hon. Amarjeet Sohi (Minister of Infrastructure and Communities, Lib.)",,Oral Questions,Infrastructure,,"Mr. Speaker, as I have often assured the House and the hon. member, any project undertaken by the Canada infrastructure bank will have to abide by all the rules and regulations of every province and municipality and we will work very closely with the provinces to ensure that is exactly what happens. The role of the bank is to build infrastructure in partnership with the provinces and municipalities and we will respect local jurisdictions.",Liberal,Edmonton Mill Woods,Amarjeet Sohi,http://www.parl.gc.ca/Parliamentarians/en/members/amarjeet-sohi(214248)
4716381,ca.proc.d.2017-06-15.9625202,2017-06-15,3176068f-62ee-4b2f-aacd-1131201c6db1,214707,The Speaker,,Oral Questions,Presence in Gallery,,"I would like to draw to the attention of hon. members the presence in the gallery of Michèle Coninsx, President of Eurojust and National Member for Belgium.",Liberal,Halifax West,Geoff Regan,http://www.parl.gc.ca/Parliamentarians/en/members/geoff-regan(214707)
4716382,ca.proc.d.2017-06-15.p4960017,2017-06-15,,,,intervention,Oral Questions,Presence in Gallery,," Hear, hear!",,,Some hon. members,
4716383,ca.proc.d.2017-06-15.p4960018,2017-06-15,3176068f-62ee-4b2f-aacd-1131201c6db1,214707,The Speaker,,Oral Questions,Presence in Gallery,," I would also like to draw to the attention of hon. members the presence in the gallery of the Honourable Lisa Harris, Minister of Seniors and Long-Term Care, and the Minister responsible for Celtic Affairs, for the Province of New Brunswick.",Liberal,Halifax West,Geoff Regan,http://www.parl.gc.ca/Parliamentarians/en/members/geoff-regan(214707)
4716384,ca.proc.d.2017-06-15.p4960019,2017-06-15,,,,intervention,Oral Questions,Presence in Gallery,," Hear, hear!",,,Some hon. members,
4716385,ca.proc.d.2017-06-15.9625207,2017-06-15,3176068f-62ee-4b2f-aacd-1131201c6db1,214707,The Speaker,,Oral Questions,Presence in Gallery,," To commemorate Canada's 150th anniversary, the Speakers of the Senate and the House of Commons are hosting a speech writing competition for Canadians aged 12 to 17. Today, we welcome and congratulate the six competition finalists.
 I would therefore like to draw to the attention of hon. members the presence in the gallery of the six competition finalists: Arman Barzkar, Ophélie Desfossés, Charlotte LaFleur-Marcotte, Lindsay LeRoux, Braden Marshall, and Asha Mior. ",Liberal,Halifax West,Geoff Regan,http://www.parl.gc.ca/Parliamentarians/en/members/geoff-regan(214707)
4716386,ca.proc.d.2017-06-15.p4960022,2017-06-15,,,,intervention,Oral Questions,Presence in Gallery,," Hear, hear!",,,Some hon. members,
4716387,ca.proc.d.2017-06-15.9625212,2017-06-15,95ed53a7-7538-4c0f-85a4-64af76065f95,218942,"Mr. Don Davies (Vancouver Kingsway, NDP)",,Oral Questions,Points of Order,Oral Questions,"Mr. Speaker, it is said that it is one of the foremost responsibilities of parliamentarians to scrutinize government spending. Twice now the Minister of Health has testified in committee and now before the House that there have been increases in the budget to the federal initiative on HIV. I have in my possession the actual departmental spending estimates that show that this is not the case, not this year, not next year.
I would seek unanimous consent in the interest of allowing the minister to prove that this is the case. I am sure the minister would not want to leave us—",NDP,Vancouver Kingsway,Don Davies,http://www.parl.gc.ca/Parliamentarians/en/members/don-davies(218942)
4716388,ca.proc.d.2017-06-15.9625214,2017-06-15,3176068f-62ee-4b2f-aacd-1131201c6db1,214707,The Speaker,,Oral Questions,Points of Order,Oral Questions,Does the member have unanimous consent?,Liberal,Halifax West,Geoff Regan,http://www.parl.gc.ca/Parliamentarians/en/members/geoff-regan(214707)
4716389,ca.proc.d.2017-06-15.p4960026,2017-06-15,,,,intervention,Oral Questions,Points of Order,Oral Questions," Agreed.
 No.",,,Some hon. members,
4716390,ca.proc.d.2017-06-15.p4960028,2017-06-15,3176068f-62ee-4b2f-aacd-1131201c6db1,214707,The Speaker,,Oral Questions,Points of Order,Oral Questions,The hon. member for Montmagny—L'Islet—Kamouraska—Rivière-du-Loup is rising on a point of order.,Liberal,Halifax West,Geoff Regan,http://www.parl.gc.ca/Parliamentarians/en/members/geoff-regan(214707)
4716391,ca.proc.d.2017-06-15.9625215,2017-06-15,e179296b-086b-4072-9082-6795b9b0da4c,217755,Mr. Bernard Généreux,,Oral Questions,Points of Order,Oral Questions,"Mr. Speaker, if I may, I would like to seek the unanimous consent of the House to table the infamous letter I received from the Minister of Environment and Climate Change, which was sent to me in English only. Here in the House and in committees, we respect official languages, so this is totally unacceptable. I seek unanimous consent to table this letter.",Conservative,Montmagny—L'Islet—Kamouraska—Rivière-du-Loup,Bernard Généreux,http://www.parl.gc.ca/Parliamentarians/en/members/bernard-genereux(217755)
4716392,ca.proc.d.2017-06-15.9625216,2017-06-15,3176068f-62ee-4b2f-aacd-1131201c6db1,214707,The Speaker,,Oral Questions,Points of Order,Oral Questions,Does the member have the unanimous consent of the House to table this letter? ,Liberal,Halifax West,Geoff Regan,http://www.parl.gc.ca/Parliamentarians/en/members/geoff-regan(214707)
4716393,ca.proc.d.2017-06-15.p4960031,2017-06-15,,,,intervention,Oral Questions,Points of Order,Oral Questions," Agreed.
 No.",,,Some hon. members,
4716394,ca.proc.d.2017-06-15.p4960033,2017-06-15,,,,stagedirection,Government Orders,Canada Elections Act,," The House resumed consideration of the motion that Bill C-50, An Act to amend the Canada Elections Act (political financing), be read the second time and referred to a committee.",,,,
4716395,ca.proc.d.2017-06-15.9625223,2017-06-15,3176068f-62ee-4b2f-aacd-1131201c6db1,214707,The Speaker,,Government Orders,Canada Elections Act,,"It being 3:10 p.m., pursuant to order made on Tuesday, May 30, 2017, the House will now proceed to the taking of the deferred recorded division on the motion at second reading stage of Bill C-50.
 Call in the members.",Liberal,Halifax West,Geoff Regan,http://www.parl.gc.ca/Parliamentarians/en/members/geoff-regan(214707)
4716396,ca.proc.d.2017-06-15.p4960036,2017-06-15,,,,stagedirection,Government Orders,Canada Elections Act,," (The House divided on the motion, which was agreed to on the following division:)
Vote #335",,,,
4716397,ca.proc.d.2017-06-15.9625269,2017-06-15,3176068f-62ee-4b2f-aacd-1131201c6db1,214707,The Speaker,,Government Orders,Canada Elections Act,,"I declare the motion carried. Accordingly, the bill stands referred to the Standing Committee on Procedure and House Affairs. 
 (Motion agreed to, bill read the second time and referred to a committee.) ",Liberal,Halifax West,Geoff Regan,http://www.parl.gc.ca/Parliamentarians/en/members/geoff-regan(214707)
4716398,ca.proc.d.2017-06-15.9625271,2017-06-15,3176068f-62ee-4b2f-aacd-1131201c6db1,214707,The Speaker,,Government Orders,Parliamentary Precinct,,"I have the honour to lay upon the table a document regarding the extension of the parliamentary precinct for the purposes of the celebration of Canada Day, pursuant to section 79.51 of the Parliament of Canada Act.",Liberal,Halifax West,Geoff Regan,http://www.parl.gc.ca/Parliamentarians/en/members/geoff-regan(214707)
4716399,ca.proc.d.2017-06-15.9625274,2017-06-15,9d3d2220-818c-494e-8d58-29f7cee7b65d,216537,"Hon. Candice Bergen (Portage—Lisgar, CPC)",,Government Orders,Business of the House,,"Mr. Speaker, I would like to ask the government House leader if she can let us know what the government is planning for the rest of this week as well as next week, which I am sure everyone knows will hopefully be our final week.",Conservative,Portage—Lisgar,Candice Bergen,http://www.parl.gc.ca/Parliamentarians/en/members/candice-hoeppner(216537)
4716400,ca.proc.d.2017-06-15.9625276,2017-06-15,48fc6e8f-3117-407b-bba3-bd6eede347ec,224672,"Hon. Bardish Chagger (Leader of the Government in the House of Commons and Minister of Small Business and Tourism, Lib.)",,Government Orders,Business of the House,,"Mr. Speaker, this afternoon we will resume second reading debate on Bill C-51, to remove the outdated provisions from the law books.
Tomorrow the House will be—",Liberal,Waterloo,Bardish Chagger,http://www.parl.gc.ca/Parliamentarians/en/members/bardish-chagger(224672)
4716401,ca.proc.d.2017-06-15.9625277,2017-06-15,3176068f-62ee-4b2f-aacd-1131201c6db1,214707,The Speaker,,Government Orders,Business of the House,,"Order. I would ask those having conversations to have them in the lobbies. Perhaps the minister of environment, the Treasury Board president, and the Minister of Natural Resources could carry on their conversations in the lobby.
The hon. government House leader.",Liberal,Halifax West,Geoff Regan,http://www.parl.gc.ca/Parliamentarians/en/members/geoff-regan(214707)
