basepk,hid,speechdate,pid,opid,speakeroldname,speakerposition,maintopic,subtopic,subsubtopic,speechtext,speakerparty,speakerriding,speakername,speakerurl
4712412,ca.proc.d.2017-06-01.9575680,2017-06-01,b6850f16-57dc-486c-b5bb-0fd191022af4,216512,"Mr. Garnett Genuis (Sherwood Park—Fort Saskatchewan, CPC)",,Government Orders,Business of Supply,Opposition Motion—Kinder Morgan Trans Mountain Expansion Project,"Mr. Speaker, it is a pleasure for me to speak on a subject that is particularly important in my own constituency of Sherwood Park—Fort Saskatchewan, the issues around pipeline construction. 
I want to start with some context about how pipelines are built. Some members may know this already; some, unfortunately, may not. It is important that we start with an understanding of the context.
First, pipeline projects are proposed by the private sector. Already some people have made claims about the previous government not building pipelines to tidewater, and so forth. There needs to be an understanding that pipelines are proposed and then, if approved, built by the private sector, and it is up to the government to decide to approve or not approve pipelines for which there have been applications. That is one important point.
The second point is that after a project is proposed, there is a consultation process through the independent National Energy Board. The National Energy Board hears from different people in the community and from experts, considers the evidence, and weighs the facts of the situation. Then it comes forward with a recommendation to the government. Ultimately it is the cabinet's call, but in my view, it virtually always makes sense for the cabinet to approve projects that have been approved by the NEB. The NEB is, after all, the expert. It hears and weighs the evidence and then presents a recommendation.
Finally, it is important, as we think about how pipelines are built, to understand that these are clearly and squarely within federal jurisdiction. There was much discussion and public discourse about what particular provincial leaders and even mayors might think about pipelines. Of course, it is quite legitimate for these people to have opinions about where a pipeline should or should not go, and they are welcome to express that opinion, but we do not live in a country where different jurisdictions can decide what infrastructure goes into and out of their province. These are not countries; these are provinces governed by a Constitution that defines what is and is not in their jurisdictions. It is the federal government's responsibility to consider and rule on these applications, hopefully to listen to the NEB, and to do so in a way that reflects the best science and information. 
That is the context through which we should view a discussion of the process of pipeline approval.
I am very proud to remind members that the previous Conservative government built four pipelines and approved a fifth. These were the applications that were brought from the private sector during the Conservatives' time in government. Of course, we were very supportive of other applications. We were very supportive of energy east and Trans Mountain, but obviously there is a process these projects have to go through. While we are supportive of pipelines, we are also supportive and respectful of that process.
Conservatives also, though, reformed the consultation process. We made the case, and I think we were right to do so, that the consultation process for any development project should not be unlimited. People with a particular political perspective who are never going to change their minds should not be able to do everything possible to drag out for years, even decades, good projects that should be discussed, considered, and ultimately decided upon. If the decision is not to proceed, okay; if the decision is to proceed, okay. 
A consultation process should be reasonably time-limited, should leave those who have an interest in the process, who are affected, as well as experts, the opportunity to present information, but that process of deliberation should lead to a conclusion. 
This was a problem we had in the past with certain projects in Canada. That process of deliberation was not designed to allow for a reasonably timely conclusion, so we made changes to ensure that there was a full consultation where experts and affected people were heard but that ultimately led to, on the positive or on the negative, a conclusion that would allow some degree of certainty for the project proponents as well as for the communities.
Conservatives built the Alberta Clipper energy project, which carries 450,000 barrels per day; the TransCanada Keystone, which carries 435,000 barrels per day; the Kinder Morgan anchor loop, which increased capacity by 40,000 barrels per day; and the Enbridge Line 9B reversal, which carries 300,000 barrels per day.
I am very proud of those accomplishments, and of course we approved the northern gateway project. That is the record of the previous Conservative government with respect to pipelines: respecting the process, respecting expertise, and recognizing the value of the energy sector and the need to move forward. 
What happened when this new Liberal government took power? The Liberals made certain changes that are very clearly bad for independent processes and bad for the energy sector. For example, they emphasized that they would be willing to reject projects that had been approved through the National Energy Board. They would not provide the certainty that after independent expert review, they would approve projects that were, through that process, found to be in the best interests of Canada.
What is striking is that members in the Liberal Party frequently talk about listening to the science and about evidence-based decision-making, but they have actually been very clear that their decisions with respect to pipelines will not be constrained by the facts and the evidence. They specifically said that. They said they will not be limited by the decisions of an independent process, but that instead cabinet may well choose to reject projects that are demonstrably in the best interests of the country. 
That is what they said with respect to projects such as energy east, which is currently going through the process, but they have already done that with respect to the northern gateway pipeline. This was a pipeline that went through the process. It was a pipeline that was approved by the NEB with conditions, and then approved by the previous Conservative government with conditions, and then the government decided that it could not go ahead. 
The Liberals have also gone further. They have legislation coming forward now that would exclude tanker traffic in northern B.C. I am very clearly in favour of tankers, because that is how oil gets from place to place. People here in this House in some corners talk about tankers as if they are a terrible thing, and frankly, they are living a little bit outside reality if they think that we should live in a world without tankers. 
Not only am I pro-tankers, but I am particularly in favour of Canadian tankers, because off the coast of B.C. there are tankers from other countries, tankers coming from Alaska, and there is every indication that we will see expanded development and expanded tanker traffic from Alaska, and if there is a spill, unfortunately, it is not as if the Canadian coast would be immune.
 Instead of saying that we will not have any part of it and leaving the opportunities for energy development in the Asia-Pacific for other countries, let us instead encourage Canadian energy development while putting the necessary safety regulations in place to protect ourselves.
The government has taken steps that are of great concern to our energy sector, and now we are having a debate on the Trans Mountain pipeline, a pipeline that the government has uniquely decided to approve. It is important to note that this pipeline went through the same process as the northern gateway pipeline and that the government has made an arbitrary decision, based on its analysis of the politics of the day, to approve one pipeline and not the other.
Meanwhile, the politics of the day have changed. There is now a new provincial government in B.C.—I should not say that. There is a proposal for a coalition of a number of parties that did not get the largest number of seats in the election. That is what seems to be a possibility. 
It is important that the government stand firm on Trans Mountain, of course, and government members have said they will, but it is also important that they develop some coherence in their approach to pipelines. 
Our approach was coherent. It was based on evidence. It was based on listening to the NEB. It was based on a fair process that understood how pipelines were built. The government's approach is more arbitrary, which puts it in a much weaker position when it comes to defending pipelines across the board.
On the issue of pipelines in general, we believe it is important to address climate change, and to do so mainly through a discussion of consumption. That is how we reduce emissions: we reduce the amount of consumption. In the meantime, we have to use energy, and besides energy, we use manufactured petroleum products, which include things like election signs—even NDP election signs come from petroleum products—and we all fly in airplanes.
In the meantime, while we are still using energy resources, it makes no sense to try to limit the transportation of supply. Let us look for efficiencies that allow us to reduce demand, but supply and the transportation that facilitates supply are important while we are still using energy resources. 
The government needs to do better in supporting vital energy transportation products that are important for our national economy.",Conservative,Sherwood Park—Fort Saskatchewan,Garnett Genuis,http://www.parl.gc.ca/Parliamentarians/en/members/garnett-genuis(216512)
4712413,ca.proc.d.2017-06-01.9575907,2017-06-01,82710269-4171-4303-af2b-f60b55256b3e,219805,"Mr. John Oliver (Oakville, Lib.)",,Government Orders,Business of Supply,Opposition Motion—Kinder Morgan Trans Mountain Expansion Project,"Mr. Speaker, the Kinder Morgan pipeline is a critical pipeline to tidewater. In ensuring that this pipeline progresses safely and properly, the government has made tremendous efforts. It has announced interim principles to govern decisions on major projects, it has appointed a ministerial panel to travel the proposed pipeline route to hear from concerned citizens and provide further opportunity for public comment, and it has committed to co-develop indigenous advisory and monitoring committees to provide ongoing environmental monitoring for the project. That is how to get by and that is how to get approval for this kind of project. 
When I listened to the hon. member in his address, l have to ask how it was that the previous government did not have meaningful engagement with provinces on these kinds of topics. How did it let the relationship with indigenous communities get so bad over that 10-year period that it was not able to get any project to tidewater? I think it is because it did not have a proper process, which is what this government is putting in place.
Could the hon. member speak to why the previous government failed to maintain those relationships?",Liberal,Oakville,John Oliver,http://www.parl.gc.ca/Parliamentarians/en/members/john-oliver(219805)
4712414,ca.proc.d.2017-06-01.9575933,2017-06-01,b6850f16-57dc-486c-b5bb-0fd191022af4,216512,Mr. Garnett Genuis,,Government Orders,Business of Supply,Opposition Motion—Kinder Morgan Trans Mountain Expansion Project,"Mr. Speaker, it will not surprise the member for me to point out that the premise of his question is entirely correct. If he listened to my speech, he would have heard me explain the fact that pipeline projects are proposed and built by the private sector. 
In our government, private sector proposals came before us, and we approved them. We approved and saw the building of four pipelines, and we approved a fifth, which was then killed by the current government, so it is a complete mischaracterization of reality, bordering on the kind used by the heritage minister in question period, to suggest that we failed when it came to this issue.
With respect to relationships with indigenous people, it is really unfortunate that members mischaracterize the perspectives on energy development that come from our indigenous communities. We recognize that there is a diversity of opinion on energy issues within indigenous communities. There are some that oppose certain developments; there are many, though, that support them and have been vocal in their support. It is unfortunate that the government does not seem to listen to indigenous communities that very strongly defend the energy sector and are able to show the significant benefits to their communities that come from energy development.",Conservative,Sherwood Park—Fort Saskatchewan,Garnett Genuis,http://www.parl.gc.ca/Parliamentarians/en/members/garnett-genuis(216512)
4712415,ca.proc.d.2017-06-01.9575963,2017-06-01,363e30d6-e47b-4c39-91ad-667deb63009c,219399,"Ms. Sheila Malcolmson (Nanaimo—Ladysmith, NDP)",,Government Orders,Business of Supply,Opposition Motion—Kinder Morgan Trans Mountain Expansion Project,"Mr. Speaker, in September 122 first nations signed a declaration of opposition to the Kinder Morgan pipeline and many other pipelines. That number is high.
I am finding breathtaking the member's revisionist history around the National Energy Board process and his dedication to, as he stated it, “respecting the process”. Under the previous government, the Conservatives dismantled all kinds of environmental laws. They buried their attacks in budget bills. They targeted the Navigable Waters Protection Act, which triggered the indigenous Idle No More movement. They targeted the Environmental Assessment Act, the Fisheries Act, and the National Energy Board Act. 
I was a participant in both the Enbridge process and the Kinder Morgan process. I promise they were entirely different processes. The Kinder Morgan process was a public hearing with no hearings. People were not allowed to say what was on their mind, and there was no cross-examination of evidence. Does the member now regret his party's role in creating the current legal challenges that face the Kinder Morgan pipeline approval?",NDP,Nanaimo—Ladysmith,Sheila Malcolmson,http://www.parl.gc.ca/Parliamentarians/en/members/sheila-malcolmson(219399)
4712416,ca.proc.d.2017-06-01.9575984,2017-06-01,b6850f16-57dc-486c-b5bb-0fd191022af4,216512,Mr. Garnett Genuis,,Government Orders,Business of Supply,Opposition Motion—Kinder Morgan Trans Mountain Expansion Project,"Mr. Speaker, where shall I start? The member started her question by talking about indigenous communities. Of course, I am not here to pretend that all indigenous people think one way or another. There is a great deal of diversity within indigenous communities about these issues. Many of them are opposed to certain or all projects, and many of them are very supportive of many projects and, in fact, are directly involved in benefiting from them. 
The member mentioned a number of indigenous communities. I think the number was about 100 that had signed some particular document. We know that there are far more than that in terms of the overall number of indigenous communities in this country, and I would be curious to know, in terms of those that signed, what the proportions were in terms of direct involvement with the energy sector or being along the pipeline route. However, regardless, we know that indigenous people disagree with and debate these issues just as everybody else disagrees with and debates these issues, and we should not try to present as if they are sort of a monolith in terms of perspective.
In terms of processes for pipeline approvals, I will make absolutely no apologies for the fact that the Conservative government took important steps to streamline the processes. It had credible reviews that involved expert testimony, as well as evidence and testimony provided by those who were affected, but it took the position that activists should not be able to indefinitely filibuster important energy projects. People should be able to express their opinions, there should be debate and discussion, and ultimately that process should get to a conclusion, which allows—",Conservative,Sherwood Park—Fort Saskatchewan,Garnett Genuis,http://www.parl.gc.ca/Parliamentarians/en/members/garnett-genuis(216512)
4712417,ca.proc.d.2017-06-01.9576011,2017-06-01,02c2cb20-f27d-46a5-8e78-ab4b405bf07b,214864,The Deputy Speaker,,Government Orders,Business of Supply,Opposition Motion—Kinder Morgan Trans Mountain Expansion Project,"Before we resume debate, it is my duty pursuant to Standing Order 38 to inform the House that the questions to be raised tonight at the time of adjournment are as follows: the hon. member for Vancouver East, Immigration, Refugees and Citizenship; the hon. member for Nanaimo—Ladysmith, Indigenous Affairs; and the hon. member for Mégantic—L'Érable, Government Appointments.
Resuming debate, the hon. member for Vancouver East.",Conservative,Simcoe North,Bruce Stanton,http://www.parl.gc.ca/Parliamentarians/en/members/bruce-stanton(214864)
4712418,ca.proc.d.2017-06-01.9576019,2017-06-01,c5b09363-414d-43b2-bc2c-274b997c8989,217220,"Ms. Jenny Kwan (Vancouver East, NDP)",,Government Orders,Business of Supply,Opposition Motion—Kinder Morgan Trans Mountain Expansion Project," Mr. Speaker, I will be splitting my time with the member for Nanaimo—Ladysmith.
I am pleased to have the opportunity to speak in the House today to this motion and to reaffirm my opposition to the Kinder Morgan Trans Mountain expansion project, on the record once again, and therefore my opposition to the motion before us today. 
The motion mentions that it needs social licence to proceed. I must say I was incredibly disappointed to hear the Minister of Natural Resources suggest that somehow social licence was an outdated term, earlier this morning. Today, more than ever before, social licence is imperative for major initiatives, especially those that have significant impacts—and, I would argue in this instance, negative impacts—especially when we are talking about the environment and combatting climate change. 
I am left with the assumption that the minister stated this because he is well aware that social licence for this project has not been obtained, so he would rather suggest it is not something that is needed. Sadly, this is just an extension of the Liberals backing away from their lofty election promises, hoping to break them without being noticed by Canadians. 
The Liberal election platform states, “While governments grant permits for resource development, only communities can grant permission”. That was the definition of social licence then—before the election, of course—and now, after the election, not so much. In an effort to try to pull one over on Canadians, and particularly British Columbians, in the fall of 2016 a new, watered-down notion of social licence was stated. The new definition for social licence, according to the Liberal government, is about “ensuring public confidence in the decision-making for major resource projects”. Of course, the Liberals cannot even say that they have met the test of even this watered-down definition. Today, we learned that the government believes the term itself is actually outdated. 
I have spoken to my constituents many times about this project, as I believe social licence is needed for a project like this. Their view was loud and clear: 78% of survey participants in my riding are against the pipeline expansion. It is an issue my office receives a significant amount of correspondence on, such as from Sarah, in my riding, who wrote that certainly economic prosperity is important in Canada, but not at the expense of our environment, wildlife, and the rights and resources of indigenous communities. She said taking such a gamble would be foolhardy, short-term thinking. Using basic risk analysis—what are the chances of something going wrong, and if something went wrong then how drastic would the impact be—reminds us of how serious the risks are in considering such a choice. She asked that we not approve this proposal.
This is not atypical but a common thread and a common theme of the messages that I get in Vancouver East from my constituents with respect to the Kinder Morgan expansion project.
 The government said it has obtained the necessary social licence from Canada's first nation communities that would be impacted by this project. Can the government explain why there are currently numerous legal actions being taken by first nation communities to stop this pipeline? There are 17 court challenges, to be exact—so much for that promise of a renewed and strengthened nation-to-nation relationship. 
The fact is that social licence simply has not been obtained, and no attempt to call the term outdated changes that. 
With respect to the issue of the economy, which we have heard raised as well, the Simon Fraser University Centre for Public Policy Research found, on the Canadian economy issue, that 65% of the fiscal benefit would go to Kinder Morgan, 32% to Alberta, and—guess what—all of 2% to British Columbia.
The report found Kinder Morgan was also seriously understating the potential cost of a serious spill. While it was suggested that the most expensive diluted bitumen spill would be from $100 million to $300 million, the report pegged those costs more realistically in the $2 billion to $5 billion range. What is more, the science is simply not there to clean up a spill, if there should be one. The real issue is not whether there would be one, but when there would be one.
I must take exception to the second claim in this motion as well. What is critical for the Canadian economy and for the creation of jobs is to help move Canada towards a more sustainable economy, one that ensures the Canadian environment, such as B.C.'s beautiful coasts, are respected and preserved, one that tackles issues such as income inequality and precarious work.
 The motion also points to the NEB's approval of the Kinder Morgan pipeline's environmental safety issue. As my colleagues have pointed out throughout the day, the NEB's process is fundamentally flawed, and its approval of this pipeline is yet another of a growing list of broken promises made by the Prime Minister to Canadians.
The Prime Minister's personal approval represented a betrayal to all Canadians who expect better from government, who expect decision-making based on science, genuine consultation with first nations communities, and respect and protection of our environment. 
Do not just take my word on the NEB, but let us take the word of the Prime Minister's—not one, but two—hand-picked expert panels that confirmed that the public has fundamentally lost confidence in the NEB and that there is a crisis in confidence in the decisions being made.
For good measure, let us take the word of the Liberals' election platform, which was highly critical of the NEB, and where they promised to “make environmental assessments credible again”, and that they would “immediately review Canada's environmental assessment processes”. Finally on this, the words of the Prime Minister himself assured Canadians publicly on August 20, 2015, that the NEB overhaul would apply to Kinder Morgan, when he said ""Yes. Yes. It applies to existing projects, existing pipelines as well.”
There was clear acknowledgement from this government that the NEB was flawed, the government's expert panels were clear that the NEB is not trusted by Canadians, and the Prime Minister provided clear assurance that an overhauled NEB would be the body that approved the Kinder Morgan pipeline. However, here were are with yet another broken promise. 
We know there are serious environmental concerns should there be a spill from this pipeline, or as a result of the anticipated nearly sevenfold increase in tanker traffic. The results could be devastating for our environment and our coastal economy. The science is not there to properly clean up a diluted bitumen spill into the water. How can the government claim to be making evidence-based decisions with this serious question unanswered? 
 We know Canadians are seriously concerned about this project, and we know they have lost confidence in the ability of the NEB to make decisions for the greater public good. We also know that many first nations communities on the proposed pipeline route are staunchly opposed to this project. We know that, by pushing forward on this project under its current conditions, the Liberal government is breaking promises made to Canadians.
I, along with my NDP colleagues, both in this house and in the provincial legislature, will continue to oppose this project, and I will oppose this motion today.",NDP,Vancouver East,Jenny Kwan,http://www.parl.gc.ca/Parliamentarians/en/members/jenny-kwan(217220)
