basepk,hid,speechdate,pid,opid,speakeroldname,speakerposition,maintopic,subtopic,subsubtopic,speechtext,speakerparty,speakerriding,speakername,speakerurl
4713567,ca.proc.d.2017-06-06.9587898,2017-06-06,634edc34-ea0d-406f-ade1-eeec6c5bad04,229501,"Mr. Adam Vaughan (Parliamentary Secretary to the Minister of Families, Children and Social Development (Housing and Urban Affairs), Lib.)",,Government Orders,Paris Agreement,Resuming debate,"Madam Speaker, it seems as if the Conservatives are now taking credit for a global recession in 2008, and if they could only have made it deeper and collapsed the mortgage market further, their plan would have worked. Does the minister really think Stephen Harper was in charge of the global recession all those years ago, and was it really the Conservatives' plan to fight greenhouse gas emissions?",Liberal,Spadina—Fort York,Adam Vaughan,http://www.parl.gc.ca/Parliamentarians/en/members/adam-vaughan(229501)
4713568,ca.proc.d.2017-06-06.9587901,2017-06-06,cee27afa-cdf8-4e99-ab22-22290f86aa3a,214082,Hon. Catherine McKenna,,Government Orders,Paris Agreement,Resuming debate,"Madam Speaker, I am not going to talk about the previous government. I would prefer to talk about all of the action we have taken. We understand we need to be working with the provinces and territories, businesses, indigenous peoples, labour, environmentalists, and all Canadians. That is how we developed our made-in-Canada climate plan. That is how we are going to tackle climate change. That is how we are going to do our part, and show leadership in the world. That is how we are going to ensure a more sustainable future for our kids and grandkids.",Liberal,Ottawa Centre,Catherine McKenna,http://www.parl.gc.ca/Parliamentarians/en/members/catherine-mckenna(214082)
4713569,ca.proc.d.2017-06-06.9587908,2017-06-06,e277e13e-59ec-425f-a957-eb5e54d8cb62,216144,"Mr. Gérard Deltell (Louis-Saint-Laurent, CPC)",,Government Orders,Paris Agreement,Resuming debate,"Madam Speaker, this evening we are going to talk about the Paris agreement, which sets exactly the same targets as those set by the Conservative government in the spring of 2015. The whole planet must know that. Not only did the Liberal government adopt exactly the same targets as Prime Minister Harper, but so did the whole planet and President Obama too. That is an indisputable and undisputed fact.
Which government was the only government in Canada's 150-year history to reduce greenhouse gas emissions? The Conservative government, which reduced emissions by 2%. That is another fact.
Also under our government, greenhouse gas emissions from the oil sands went down by 32%. These planet-friendly, environmentally friendly accomplishments are courtesy of the Conservative government. Need I remind anyone that the targets we set were so sensible that the whole planet adopted them? That is a fact.
However, the only thing the government has to show for its lofty principles is the creation of a new tax, the Liberal carbon tax. This is typical of the Liberals, they who never stop lecturing. Whenever they are faced with a problem, they create a tax. This should come as no surprise, given that under the Chrétien and Martin Liberal governments, greenhouse gas emissions rose by 30%.
Now reality is catching up to them. I cannot repeat this enough. The entire planet has recognized that we, the Conservatives, established the right greenhouse gas reduction targets. Now those folks over there are improvising a Liberal carbon tax and imposing it on the provinces, contrary to what they said earlier. They said they would act collaboratively with the provinces, but that is absolutely not the case.
The Prime Minister said in this very place that he would give the provinces two years to reach an agreement, and if there was no agreement, he would impose the tax. The reality is that the Liberals are imposing it, period. That is the Liberal approach. They impose a tax and punish everyone.
Instead of helping businesses and working with the major polluters on finding positive and constructive solutions, as we did with the oil sands, this government wants to punish everyone. Then it adopts lofty principles, treats the provinces poorly and forces them to raise taxes, which is not the right thing to do.
That is why we think that the government should at least have the honour, dignity, and courage to recognize that the Paris agreement targets are the Conservative government's targets, of which we are very proud.",Conservative,Louis-Saint-Laurent,Gérard Deltell,http://www.parl.gc.ca/Parliamentarians/en/members/gerard-deltell(216144)
4713570,ca.proc.d.2017-06-06.9587919,2017-06-06,cedf1659-ebb1-4f26-b723-5c7c5353988b,214948,The Assistant Deputy Speaker (Mrs. Carol Hughes),,Government Orders,Paris Agreement,Resuming debate,Is the House ready for the question?,NDP,Algoma—Manitoulin—Kapuskasing,Carol Hughes,http://www.parl.gc.ca/Parliamentarians/en/members/carol-hughes(214948)
4713571,ca.proc.d.2017-06-06.p4934995,2017-06-06,,,,intervention,Government Orders,Paris Agreement,Resuming debate, Question.,,,Some hon. members,
4713572,ca.proc.d.2017-06-06.p4934996,2017-06-06,cedf1659-ebb1-4f26-b723-5c7c5353988b,214948,The Assistant Deputy Speaker (Mrs. Carol Hughes),,Government Orders,Paris Agreement,Resuming debate, The question is on the subamendment. Is it the pleasure of the House to adopt the subamendment? ,NDP,Algoma—Manitoulin—Kapuskasing,Carol Hughes,http://www.parl.gc.ca/Parliamentarians/en/members/carol-hughes(214948)
4713573,ca.proc.d.2017-06-06.p4934997,2017-06-06,,,,intervention,Government Orders,Paris Agreement,Resuming debate," Agreed. 
 No. ",,,Some hon. members,
4713574,ca.proc.d.2017-06-06.p4934999,2017-06-06,cedf1659-ebb1-4f26-b723-5c7c5353988b,214948,The Assistant Deputy Speaker (Mrs. Carol Hughes),,Government Orders,Paris Agreement,Resuming debate, All those in favour of the subamendment will please say yea. ,NDP,Algoma—Manitoulin—Kapuskasing,Carol Hughes,http://www.parl.gc.ca/Parliamentarians/en/members/carol-hughes(214948)
4713575,ca.proc.d.2017-06-06.p4935000,2017-06-06,,,,intervention,Government Orders,Paris Agreement,Resuming debate, Yea. ,,,Some hon. members,
4713576,ca.proc.d.2017-06-06.p4935001,2017-06-06,cedf1659-ebb1-4f26-b723-5c7c5353988b,214948,The Assistant Deputy Speaker (Mrs. Carol Hughes),,Government Orders,Paris Agreement,Resuming debate, All those opposed will please say nay. ,NDP,Algoma—Manitoulin—Kapuskasing,Carol Hughes,http://www.parl.gc.ca/Parliamentarians/en/members/carol-hughes(214948)
4713577,ca.proc.d.2017-06-06.p4935002,2017-06-06,,,,intervention,Government Orders,Paris Agreement,Resuming debate, Nay. ,,,Some hon. members,
4713578,ca.proc.d.2017-06-06.p4935003,2017-06-06,cedf1659-ebb1-4f26-b723-5c7c5353988b,214948,The Assistant Deputy Speaker (Mrs. Carol Hughes),,Government Orders,Paris Agreement,Resuming debate," In my opinion the nays have it. 
 And five or more members having risen: 
 Call in the members. ",NDP,Algoma—Manitoulin—Kapuskasing,Carol Hughes,http://www.parl.gc.ca/Parliamentarians/en/members/carol-hughes(214948)
4713579,ca.proc.d.2017-06-06.p4935006,2017-06-06,,,,stagedirection,Government Orders,Paris Agreement,,"(The House divided on the subamendment, which was negatived on the following division:)
Vote #306",,,,
4713580,ca.proc.d.2017-06-06.9587990,2017-06-06,02c2cb20-f27d-46a5-8e78-ab4b405bf07b,214864,The Deputy Speaker,,Government Orders,Paris Agreement,,"I declare the subamendment defeated.
The next question is on the amendment. Is it the pleasure of the House to adopt the amendment?",Conservative,Simcoe North,Bruce Stanton,http://www.parl.gc.ca/Parliamentarians/en/members/bruce-stanton(214864)
4713581,ca.proc.d.2017-06-06.p4935009,2017-06-06,,,,intervention,Government Orders,Paris Agreement,," Agreed. 
 No. ",,,Some hon. members,
4713582,ca.proc.d.2017-06-06.p4935011,2017-06-06,02c2cb20-f27d-46a5-8e78-ab4b405bf07b,214864,The Deputy Speaker,,Government Orders,Paris Agreement,, All those in favour of the amendment will please say yea. ,Conservative,Simcoe North,Bruce Stanton,http://www.parl.gc.ca/Parliamentarians/en/members/bruce-stanton(214864)
4713583,ca.proc.d.2017-06-06.p4935012,2017-06-06,,,,intervention,Government Orders,Paris Agreement,, Yea. ,,,Some hon. members,
4713584,ca.proc.d.2017-06-06.p4935013,2017-06-06,02c2cb20-f27d-46a5-8e78-ab4b405bf07b,214864,The Deputy Speaker,,Government Orders,Paris Agreement,, All those opposed will please say nay. ,Conservative,Simcoe North,Bruce Stanton,http://www.parl.gc.ca/Parliamentarians/en/members/bruce-stanton(214864)
4713585,ca.proc.d.2017-06-06.p4935014,2017-06-06,,,,intervention,Government Orders,Paris Agreement,, Nay. ,,,Some hon. members,
4713586,ca.proc.d.2017-06-06.p4935015,2017-06-06,02c2cb20-f27d-46a5-8e78-ab4b405bf07b,214864,The Deputy Speaker,,Government Orders,Paris Agreement,," In my opinion the yeas have it. 
 And five or more members having risen: ",Conservative,Simcoe North,Bruce Stanton,http://www.parl.gc.ca/Parliamentarians/en/members/bruce-stanton(214864)
4713587,ca.proc.d.2017-06-06.p4935017,2017-06-06,,,,stagedirection,Government Orders,Paris Agreement,,"(The House divided on the amendment, which was negatived on the following division:)
Vote #307",,,,
4713588,ca.proc.d.2017-06-06.9587998,2017-06-06,02c2cb20-f27d-46a5-8e78-ab4b405bf07b,214864,The Deputy Speaker,,Government Orders,Paris Agreement,,"I declare the amendment defeated.
The next question is on the main motion. Is it the pleasure of the House to adopt the motion?",Conservative,Simcoe North,Bruce Stanton,http://www.parl.gc.ca/Parliamentarians/en/members/bruce-stanton(214864)
4713589,ca.proc.d.2017-06-06.p4935020,2017-06-06,,,,intervention,Government Orders,Paris Agreement,," Agreed.
 No.",,,Some hon. members,
4713590,ca.proc.d.2017-06-06.p4935022,2017-06-06,02c2cb20-f27d-46a5-8e78-ab4b405bf07b,214864,The Deputy Speaker,,Government Orders,Paris Agreement,, All those in favour of the motion will please say yea.,Conservative,Simcoe North,Bruce Stanton,http://www.parl.gc.ca/Parliamentarians/en/members/bruce-stanton(214864)
4713591,ca.proc.d.2017-06-06.p4935023,2017-06-06,,,,intervention,Government Orders,Paris Agreement,, Yea.,,,Some hon. members,
4713592,ca.proc.d.2017-06-06.p4935024,2017-06-06,02c2cb20-f27d-46a5-8e78-ab4b405bf07b,214864,The Deputy Speaker,,Government Orders,Paris Agreement,, All those opposed will please say nay.,Conservative,Simcoe North,Bruce Stanton,http://www.parl.gc.ca/Parliamentarians/en/members/bruce-stanton(214864)
4713593,ca.proc.d.2017-06-06.p4935025,2017-06-06,,,,intervention,Government Orders,Paris Agreement,, Nay.,,,Some hon. members,
4713594,ca.proc.d.2017-06-06.p4935026,2017-06-06,02c2cb20-f27d-46a5-8e78-ab4b405bf07b,214864,The Deputy Speaker,,Government Orders,Paris Agreement,," In my opinion, the yeas have it.
 And five or more members having risen: ",Conservative,Simcoe North,Bruce Stanton,http://www.parl.gc.ca/Parliamentarians/en/members/bruce-stanton(214864)
4713595,ca.proc.d.2017-06-06.p4935028,2017-06-06,,,,stagedirection,Government Orders,Paris Agreement,,"(The House divided on the motion, which was agreed to on the following division:)
Vote #308",,,,
4713596,ca.proc.d.2017-06-06.9588011,2017-06-06,02c2cb20-f27d-46a5-8e78-ab4b405bf07b,214864,The Deputy Speaker,,Government Orders,Paris Agreement,,I declare the motion carried.,Conservative,Simcoe North,Bruce Stanton,http://www.parl.gc.ca/Parliamentarians/en/members/bruce-stanton(214864)
4713597,ca.proc.d.2017-06-06.9588037,2017-06-06,48fc6e8f-3117-407b-bba3-bd6eede347ec,224672,"Hon. Bardish Chagger (Leader of the Government in the House of Commons, Lib.)",,Government Orders,Cannabis Act,Bill C-45—Time Allocation Motion," moved:
 That, in relation to Bill C-45, an act respecting cannabis and to amend the Controlled Drugs and Substances Act, the Criminal Code and other acts, not more than five further hours shall be allotted to the consideration at the second reading stage of the bill; and 
 That, at the expiry of the five hours provided for the consideration at the second reading stage of the said bill, any proceedings before the House shall be interrupted, if required for the purpose of this order, and, in turn, every question necessary for the disposal of the said stage of the bill shall be put forthwith and successively, without further debate or amendment. 
",Liberal,Waterloo,Bardish Chagger,http://www.parl.gc.ca/Parliamentarians/en/members/bardish-chagger(224672)
4713598,ca.proc.d.2017-06-06.9588016,2017-06-06,02c2cb20-f27d-46a5-8e78-ab4b405bf07b,214864,The Deputy Speaker,,Government Orders,Cannabis Act,Bill C-45—Time Allocation Motion,"Pursuant to Standing Order 67(1), there will be a 30-minute question period. As is usually the case with these 30-minute question periods, hon. members who are on the opposition side of the House are given preference during that time, but not to the exclusion of government members. Also, as is usually the case, we try to limit the interventions to no more than one minute. That is for the questioner as well as the minister responding.
Now, we will go to questions. The hon. member for Central Okanagan—Similkameen—Nicola.",Conservative,Simcoe North,Bruce Stanton,http://www.parl.gc.ca/Parliamentarians/en/members/bruce-stanton(214864)
4713599,ca.proc.d.2017-06-06.9588021,2017-06-06,26c8b0bc-42d4-4db5-bf7d-1e1544c7b4b5,216450,"Mr. Dan Albas (Central Okanagan—Similkameen—Nicola, CPC)",,Government Orders,Cannabis Act,Bill C-45—Time Allocation Motion,"Mr. Speaker, I am disappointed that the government treats this place so poorly. The bill is a stark change from the previous regimen we have had in our country. We have international conventions, a variety of laws, and the Criminal Code. There are issues that will relate to our home provinces in terms of places of sale and terms of sale. There are so many questions. It is disappointing that the government would have such arrogance as to treat this place so lightly and move for time allocation. 
Why does it treat this place so badly, in such a way that we cannot have civilized debate about an issue that affects our whole great country?",Conservative,Central Okanagan—Similkameen—Nicola,Dan Albas,http://www.parl.gc.ca/Parliamentarians/en/members/dan-albas(216450)
4713600,ca.proc.d.2017-06-06.9588023,2017-06-06,cd83ba99-0c5b-4f51-a42b-a73504b91199,214903,"Hon. Jody Wilson-Raybould (Minister of Justice and Attorney General of Canada, Lib.)",,Government Orders,Cannabis Act,Bill C-45—Time Allocation Motion,"Mr. Speaker, we have great respect for this place and we appreciate the two and a half days of debate and discussions we have had on Bill C-45. I very much look forward to the next number of hours of debate in this place. 
I look forward to the bill passing through the parliamentary process and having substantive and vigorous discussion at committee. We have had the benefit of having a task force that has undertaken a substantive amount of work and has put forward 80 recommendations, forming a substantive part of the legislation that we have introduced. This is an entirely important topic, and I look forward to continued discussion. ",Liberal,Vancouver Granville,Jody Wilson-Raybould,http://www.parl.gc.ca/Parliamentarians/en/members/jody-wilson-raybould(214903)
4713601,ca.proc.d.2017-06-06.9588025,2017-06-06,0c9d00b0-a035-46d3-ba51-0db3e8da19b8,227114,"Mr. Murray Rankin (Victoria, NDP)",,Government Orders,Cannabis Act,Bill C-45—Time Allocation Motion,"Mr. Speaker, I share the sense of disappointment my colleague has just expressed. We have five more hours on a bill that puts Canada at odds with many of our allies. I and my party support this initiative, but that does not take away from the fact of how disrespectful of this place this five hours more is.
I agree with the hon. member for Beaches—East York who keeps saying, as we have, that we have to deal with aspects around young people going to jail. There have been 7,000, under 25, since the government came to power. People are getting criminal records. Their lives are being wrecked. The government members are doing nothing. They talk about 80 recommendations. This has an enormous impact on the provinces as well, and we are supposed to be happy with five hours more. We owe it to Canadians to address this with more care and respect. ",NDP,Victoria,Murray Rankin,http://www.parl.gc.ca/Parliamentarians/en/members/murray-rankin(227114)
4713602,ca.proc.d.2017-06-06.9588027,2017-06-06,cd83ba99-0c5b-4f51-a42b-a73504b91199,214903,Hon. Jody Wilson-Raybould,,Government Orders,Cannabis Act,Bill C-45—Time Allocation Motion,"Mr. Speaker, we have taken on the task of legalizing, strictly regulating, and restricting access to cannabis in order to achieve our public policy objectives of keeping it out of the hands of children and the proceeds out of the hands of criminals. 
We have engaged in a substantive way on this, putting together a high-level task force that provided us with substantive recommendations. As well, on an ongoing basis, we have been engaging with the provinces and territories to ensure we put in place the comprehensive, complex regime that is necessary to legalize cannabis. 
I very much look forward to the ongoing debate and discussion around this issue as it goes to committee, and as it hears from more and more experts beyond the 30,000 from the general public who responded to the task force report. ",Liberal,Vancouver Granville,Jody Wilson-Raybould,http://www.parl.gc.ca/Parliamentarians/en/members/jody-wilson-raybould(214903)
4713603,ca.proc.d.2017-06-06.9588029,2017-06-06,b6850f16-57dc-486c-b5bb-0fd191022af4,216512,"Mr. Garnett Genuis (Sherwood Park—Fort Saskatchewan, CPC)",,Government Orders,Cannabis Act,Bill C-45—Time Allocation Motion,"Mr. Speaker, in 2016, The New York Times did a study and found that the average joint contains 0.32 grams of marijuana. According to this legislation, it will be legal and there will be no criminal penalties for someone 12 to 17 years old to possess up to five grams of marijuana. According to that New York Times estimate, that is up to 15 joints. 
It would be legal for a minor to possess up to 15 joints, and not to sell but to distribute them. Because they are not going to smoke it all themselves right away, how does allowing someone to carry that much marijuana, allowing 12-year-olds to have with them up to 15 joints of marijuana, consistent with the government's stated objectives?",Conservative,Sherwood Park—Fort Saskatchewan,Garnett Genuis,http://www.parl.gc.ca/Parliamentarians/en/members/garnett-genuis(216512)
4713604,ca.proc.d.2017-06-06.9588031,2017-06-06,cd83ba99-0c5b-4f51-a42b-a73504b91199,214903,Hon. Jody Wilson-Raybould,,Government Orders,Cannabis Act,Bill C-45—Time Allocation Motion,"Mr. Speaker, as I stated before, but will say it again, there is nothing in the legislation that provides a legal means for young people to obtain cannabis. With respect to the realities and taking a public health approach, we have to draw the distinction to ensure we have information, education, and public awareness around the health impacts on young people, while also balancing the reality that young people more than any other people are smoking cannabis right now. We need to balance those two objectives and ensure we put forward the smartest approach. 
We have been holding discussions with the provinces and territories and, as with alcohol, they will provide provincial offences to regulate and monitor cannabis intake and possession by—",Liberal,Vancouver Granville,Jody Wilson-Raybould,http://www.parl.gc.ca/Parliamentarians/en/members/jody-wilson-raybould(214903)
4713605,ca.proc.d.2017-06-06.9588032,2017-06-06,02c2cb20-f27d-46a5-8e78-ab4b405bf07b,214864,The Deputy Speaker,,Government Orders,Cannabis Act,Bill C-45—Time Allocation Motion,"Questions and comments, the hon. member for Cowichan—Malahat—Langford.",Conservative,Simcoe North,Bruce Stanton,http://www.parl.gc.ca/Parliamentarians/en/members/bruce-stanton(214864)
4713606,ca.proc.d.2017-06-06.9588033,2017-06-06,eb417798-95f7-45a0-b1e9-ca3a6526d4db,228612,"Mr. Alistair MacGregor (Cowichan—Malahat—Langford, NDP)",,Government Orders,Cannabis Act,Bill C-45—Time Allocation Motion,"Mr. Speaker, even though the NDP agrees with the legislation in principle, we have to realize that it is a monumental and revolutionary change to Canada's drug laws. Cannabis has been illegal in our country since 1923.
 For such a far-reaching change to our laws, every member of Parliament deserves to have a say on the bill. I deplore the fact that the government is using time allocation to force this through. Every member of Parliament has raised some serious concerns in the House and I do not agree with them being shut out of this debate.",NDP,Cowichan—Malahat—Langford,Alistair MacGregor,http://www.parl.gc.ca/Parliamentarians/en/members/alistair-macgregor(228612)
4713607,ca.proc.d.2017-06-06.9588035,2017-06-06,cd83ba99-0c5b-4f51-a42b-a73504b91199,214903,Hon. Jody Wilson-Raybould,,Government Orders,Cannabis Act,Bill C-45—Time Allocation Motion,"Mr. Speaker, I am pleased the hon. member across the way agrees with the bill. It is a monumental shift and a monumental change. That is why we have taken a substantive amount of time engaging with the task force, engaging with experts in the areas of public health, safety, and justice to ensure we get substantive feedback.
This debate is going to continue. The status quo simply is not working in terms of criminal prohibitions with respect to cannabis. We need to change the status quo in order to ensure we achieve the objectives of keeping it out of the hands of children and the proceeds out of the hands of criminals. Bill C-45 would do this. That is why we are actively pursing a comprehensive regulatory approach.",Liberal,Vancouver Granville,Jody Wilson-Raybould,http://www.parl.gc.ca/Parliamentarians/en/members/jody-wilson-raybould(214903)
4713608,ca.proc.d.2017-06-06.9588039,2017-06-06,4437c848-d8c7-4a39-a948-1539969f3a90,232969,"Ms. Marilyn Gladu (Sarnia—Lambton, CPC)",,Government Orders,Cannabis Act,Bill C-45—Time Allocation Motion,"Mr. Speaker, it is positively negligent that the government is shutting down debate on this topic. We have already established that this legislation would put marijuana in the hands of children, not just with the 15 joints that 12-year-olds can have but with the four plants per household, so little Johnny can put some in the toaster oven and smoke it up.
We know from Colorado that there is a 32% increase in drug-impaired driving and that has not been addressed. Issues have been raised about treaties and about inadequate resources in the provinces and municipalities. 
Why does the minister not care about the safety of Canadians and Canadian children?",Conservative,Sarnia—Lambton,Marilyn Gladu,http://www.parl.gc.ca/Parliamentarians/en/members/marilyn-gladu(232969)
4713609,ca.proc.d.2017-06-06.9588041,2017-06-06,cd83ba99-0c5b-4f51-a42b-a73504b91199,214903,Hon. Jody Wilson-Raybould,,Government Orders,Cannabis Act,Bill C-45—Time Allocation Motion,"Mr. Speaker, I completely reject that accusation. Of course we care about the health and safety of Canadians. That is the whole premise and the basis upon which we are putting forward this legislation to legalize cannabis, to strictly regulate it, and to restrict access it to ensure we keep it out of the hands of children and the proceeds out of the hands of criminals. There is nothing in the legislation that makes it legal for a young person to gain access to marijuana.
With respect to drug-impaired driving, I am very proud that we have introduced, as a companion piece, Bill C-46, which is, and will amount to if passed through Parliament, one of the strictest impaired driving regimes with respect to drugs and alcohol.",Liberal,Vancouver Granville,Jody Wilson-Raybould,http://www.parl.gc.ca/Parliamentarians/en/members/jody-wilson-raybould(214903)
4713610,ca.proc.d.2017-06-06.9588043,2017-06-06,16ec30ba-16f2-4777-ab8d-db372238e239,216462,"Mrs. Karen Vecchio (Elgin—Middlesex—London, CPC)",,Government Orders,Cannabis Act,Bill C-45—Time Allocation Motion,"Mr. Speaker, I had the opportunity to speak to this legislation on Friday. 
I am a parent of five. We are less than 13 months away from cannabis becoming legal for all Canadians. The minister says that the bill will keep cannabis out of the hands of young people, but we know that with homegrown marijuana, and with 18-years-old going to school with children who are 14-years-old, there are going to be great opportunities for children to have access to it. 
We do not have the education in place, and I will look at this. Why are we putting the cart before the horse? Why do we not have all the information out there for parents, teachers, and children, so we can ensure we are safeguarding them and giving them the knowledge about cannabis and its affects on the brain?",Conservative,Elgin—Middlesex—London,Karen Vecchio,http://www.parl.gc.ca/Parliamentarians/en/members/karen-vecchio(216462)
