basepk,hid,speechdate,pid,opid,speakeroldname,speakerposition,maintopic,subtopic,subsubtopic,speechtext,speakerparty,speakerriding,speakername,speakerurl
4713481,ca.proc.d.2017-06-06.p4934622,2017-06-06,,,,intervention,Government Orders,"Budget Implementation Act, 2017, No. 1",, Nay. ,,,Some hon. members,
4713482,ca.proc.d.2017-06-06.p4934623,2017-06-06,3176068f-62ee-4b2f-aacd-1131201c6db1,214707,The Speaker,,Government Orders,"Budget Implementation Act, 2017, No. 1",," In my opinion the yeas have it. 
 And five or more members having risen: ",Liberal,Halifax West,Geoff Regan,http://www.parl.gc.ca/Parliamentarians/en/members/geoff-regan(214707)
4713483,ca.proc.d.2017-06-06.p4934625,2017-06-06,,,,stagedirection,Government Orders,"Budget Implementation Act, 2017, No. 1",,"(The House divided on the motion, which was agreed to on the following division:)
Vote #304",,,,
4713484,ca.proc.d.2017-06-06.9587124,2017-06-06,3176068f-62ee-4b2f-aacd-1131201c6db1,214707,The Speaker,,Government Orders,"Budget Implementation Act, 2017, No. 1",,I declare the motion carried. ,Liberal,Halifax West,Geoff Regan,http://www.parl.gc.ca/Parliamentarians/en/members/geoff-regan(214707)
4713485,ca.proc.d.2017-06-06.9587132,2017-06-06,e915cec9-7164-4846-aeb5-d5bf2e4f3598,214562,Mr. Xavier Barsalou-Duval,,Government Orders,"Budget Implementation Act, 2017, No. 1",,"Mr. Speaker, I rise to inform the House that the member for Manicouagan is paired with the member for Egmont for the votes today and tomorrow with the consent of the chief government whip.",Bloc,Pierre-Boucher—Les Patriotes—Verchères,Xavier Barsalou-Duval,http://www.parl.gc.ca/Parliamentarians/en/members/xavier-barsalou-duval(214562)
4713486,ca.proc.d.2017-06-06.9587134,2017-06-06,3176068f-62ee-4b2f-aacd-1131201c6db1,214707,The Speaker,,Government Orders,"Budget Implementation Act, 2017, No. 1",,I thank the member for Pierre-Boucher—Les Patriotes—Verchères for his intervention.,Liberal,Halifax West,Geoff Regan,http://www.parl.gc.ca/Parliamentarians/en/members/geoff-regan(214707)
4713487,ca.proc.d.2017-06-06.9587127,2017-06-06,48fc6e8f-3117-407b-bba3-bd6eede347ec,224672,"Hon. Bardish Chagger (Leader of the Government in the House of Commons and Minister of Small Business and Tourism, Lib.)",,Government Orders,Paris Agreement,Motion that debate be not further adjourned," Mr. Speaker, in relation to the consideration of Government Business No. 15, I move:
 That the debate be not further adjourned 
",Liberal,Waterloo,Bardish Chagger,http://www.parl.gc.ca/Parliamentarians/en/members/bardish-chagger(224672)
4713488,ca.proc.d.2017-06-06.9587468,2017-06-06,3176068f-62ee-4b2f-aacd-1131201c6db1,214707,The Speaker,,Government Orders,Paris Agreement,Motion that debate be not further adjourned,"Pursuant to Standing Order 67.1, there is a 30-minute question period in relation to the closure motion. However, the House is scheduled to proceed to private members' business at 5:30 p.m. before the 30 minutes have expired.
 When confronted with a somewhat similar situation on April 30, 2015, where the 30-minute question period was interrupted by statements by members, the Acting Speaker noted that there would be an opportunity for the House to resume and finish the proceedings pursuant to Standing Order 67.1 later in the day. The Chair intends to take the same approach in this case. 
Accordingly, the question period will begin now, interrupted at 5:30 p.m. and resume following private members' business.
I therefore invite all members who wish to ask questions to rise so that the Chair has an idea of how many members want to participate in this question period.",Liberal,Halifax West,Geoff Regan,http://www.parl.gc.ca/Parliamentarians/en/members/geoff-regan(214707)
4713489,ca.proc.d.2017-06-06.9587138,2017-06-06,9d3d2220-818c-494e-8d58-29f7cee7b65d,216537,"Hon. Candice Bergen (Portage—Lisgar, CPC)",,Government Orders,Paris Agreement,Motion that debate be not further adjourned,"Is this not interesting, Mr. Speaker. We have been sitting until midnight for the last week and a half. We will be sitting until midnight until the end of session because the government has such important business, apparently, that it wants to get accomplished. The Liberals have not been able to accomplish it previously because they have mismanaged the House so badly.
In the midst of all of us sitting this late and the Liberals ramming through their legislation, they have thrown two motions on the Order Paper that have absolutely no consequence. The motions could have been discussed in a press conference. The motions could have been discussed in a ministerial statement. The motions could have been discussed in a variety of ways. However, the government chose to bring the motions here to us and interrupted the work that we were doing, using up valuable House time and still making all of us sit here until midnight. 
Now the Liberals are moving time allocation and shutting down debate on this motion. This is unbelievable of the Liberals, absolutely mismanaging not only the House but their own pathetic agenda.
I ask that the Liberals stop this kind of nonsense. We have a summer break coming up and things will not be better when we come back in the fall if this is the way they continue. ",Conservative,Portage—Lisgar,Candice Bergen,http://www.parl.gc.ca/Parliamentarians/en/members/candice-hoeppner(216537)
4713490,ca.proc.d.2017-06-06.9587141,2017-06-06,cee27afa-cdf8-4e99-ab22-22290f86aa3a,214082,"Hon. Catherine McKenna (Minister of Environment and Climate Change, Lib.)",,Government Orders,Paris Agreement,Motion that debate be not further adjourned,"Madam Speaker, I am very disappointed to hear the words of the member opposite, because there could be nothing more important than reaffirming our support for the Paris agreement in light of the U.S. decision. 
I would ask if the party opposite could please clarify its position. After so many declarative statements in support of the Paris agreement by Conservatives members of Parliament, including the members for Abbotsford, Carlton Trail—Eagle Creek, Langley—Aldergrove, Oshawa, Thornhill, Portneuf—Jacques-Cartier and Calgary Rocky Ridge, one would think they would be somewhat embarrassed that yesterday the member for Carleton stood in this place, on behalf of the Conservative Party, and not once simply affirm his party's support for the Paris agreement, and during questions, refuse to answer.",Liberal,Ottawa Centre,Catherine McKenna,http://www.parl.gc.ca/Parliamentarians/en/members/catherine-mckenna(214082)
4713491,ca.proc.d.2017-06-06.9587144,2017-06-06,78336f0e-962c-47d2-a5b8-b59a26592789,217320,"Mr. Matthew Dubé (Beloeil—Chambly, NDP)",,Government Orders,Paris Agreement,Motion that debate be not further adjourned,"Madam Speaker, it is certainly true that the NDP is very happy to support the Paris agreement, despite the lack of effective targets. In fact, we do have targets, but they are the ones put in place by the former Conservative government. 
 That being said, I find this interesting and I would like to echo the comments made by the official opposition House leader. For example, it might have been nice to have a motion denouncing the President Trump's executive orders that discriminate against people from certain countries. This is the reaction we are seeing in the case of the Paris agreement, from which he withdrew. It seems we are being very selective. 
 The decision has now been move to propose a motion to make grand statements on foreign affairs. We are pleased to see Parliament getting some respect for once; we are happy for these statements. 
 However, we see how difficult it seems to be to get legislation through; things are moving rather slowly. Despite the grand speeches on work-family balance, parliamentarians are being made to work even harder because of this government's lack of efficiency; for example, it could have initiated a debate and collaborated with the opposition parties.
 I would like the minister to tell us why the government is not going forward in a more constructive way to avoid having to gag the opposition and introduce time allocation motions, when all we need to do is have a constructive conversation on these issues so we can really work for Canadians. ",NDP,Beloeil—Chambly,Matthew Dubé,http://www.parl.gc.ca/Parliamentarians/en/members/matthew-dube(217320)
4713492,ca.proc.d.2017-06-06.9587147,2017-06-06,cee27afa-cdf8-4e99-ab22-22290f86aa3a,214082,Hon. Catherine McKenna,,Government Orders,Paris Agreement,Motion that debate be not further adjourned,"Madam Speaker, I want to thank my opposition colleague for saying with certainty that the NDP will support this evening’s motion regarding the Paris agreement. I am really happy to hear that. 
 I want to be clear: the targets were not just adopted by our party, but the provinces and territories also adopted them, along with the Prime Minister, in the Vancouver declaration. It is very important to declare today to the world that Canada supports the Paris agreement. We know that climate change is real and we need to work with everyone to protect our planet. We are also going to create good jobs and make innovations, here, in Canada. ",Liberal,Ottawa Centre,Catherine McKenna,http://www.parl.gc.ca/Parliamentarians/en/members/catherine-mckenna(214082)
4713493,ca.proc.d.2017-06-06.9587155,2017-06-06,96924c12-efff-4de2-9f9e-578fe5434342,217509,"Hon. Erin O'Toole (Durham, CPC)",,Government Orders,Paris Agreement,Motion that debate be not further adjourned,"Madam Speaker, I had the good fortune of spending the last seven months speaking with a lot of Canadians in all parts of this country. I have to say that they are very worried about the government's carbon tax plan and scheme across this country. At a time where manufacturers in Ontario are already facing high electricity costs, they are worried about input costs related to pricing carbon.
Making our Paris commitments is important. What I said on the road is that having a tailored plan of innovation and tax reductions for our 30 largest emitters would mean we are targeting 25% of our nation's emissions, if we took a pragmatic approach like that. Instead, the government is spreading the hurt across all companies and all families across this country, to not even meet its targets.
My question for the minister is this. A few weeks ago, 500 families in Brockville learned that the production at Procter &amp; Gamble will be moving to West Virginia, a state in the integrated North American economy that does not have a carbon tax. The government's conduct is putting a dagger in the heart of manufacturing in Ontario. What will the minister say to those 500 families who are seeing those jobs flee as a result of the Ontario government's hydro prices, and as a result of its federal carbon tax scheme?",Conservative,Durham,Erin O'Toole,http://www.parl.gc.ca/Parliamentarians/en/members/erin-otoole(217509)
4713494,ca.proc.d.2017-06-06.9587162,2017-06-06,cee27afa-cdf8-4e99-ab22-22290f86aa3a,214082,Hon. Catherine McKenna,,Government Orders,Paris Agreement,Motion that debate be not further adjourned,"Madam Speaker, unlike the party opposite, when we work with the provinces and territories to develop a climate plan, we actually have a plan to achieve a target. The previous government disingenuously brought a target, had no plan, and had no intention to meet it. Our government is committed to climate action.
Once again, I have a very simple question. Will the members of the party opposite stand up tonight and say very clearly that they believe climate change is real, that they believe we need to take action, and that they support the Paris agreement?",Liberal,Ottawa Centre,Catherine McKenna,http://www.parl.gc.ca/Parliamentarians/en/members/catherine-mckenna(214082)
4713495,ca.proc.d.2017-06-06.9587164,2017-06-06,9c9a64e6-58f1-4367-9f49-93ad31744c96,217354,"Mrs. Cathy McLeod (Kamloops—Thompson—Cariboo, CPC)",,Government Orders,Paris Agreement,Motion that debate be not further adjourned,"Madam Speaker, I want to build on what my colleague, the opposition House leader, was talking about. She said we are here until midnight for the next number of weeks. We know that the summer recess is coming. I sit on the indigenous affairs committee and we have a Supreme Court of Canada decision that needs to be responded to. There is a deadline of July 3. That bill has come through the Senate. It has been introduced in the House and we have not had any time debating that bill. 
As the member indicated, there are important motions that could be achieved in other ways, but we have women who are waiting for the decision on the Descheneaux case. The Supreme Court of Canada gave us a deadline and we have to get a response back to the Senate in terms of the amendments it has made.
In terms of House management, this is an absolutely ludicrous way forward when the Liberals are saying we have critical legislation that has to be passed before we rise for the summer and we have not spent one hour debating the case and we are spending time doing many different motions, time allocation, etc.",Conservative,Kamloops—Thompson—Cariboo,Cathy McLeod,http://www.parl.gc.ca/Parliamentarians/en/members/cathy-mcleod(217354)
4713496,ca.proc.d.2017-06-06.9587174,2017-06-06,cee27afa-cdf8-4e99-ab22-22290f86aa3a,214082,Hon. Catherine McKenna,,Government Orders,Paris Agreement,Motion that debate be not further adjourned,"Madam Speaker, it is critical that the House is clear to the world that Canada stands up, that we support the Paris agreement, that we understand that we need to be taking action to protect our planet, and that we are going to stand with the governors, mayors, businesses, and communities in the United States that have said they support the aims of the Paris agreement. 
We understand that the economy and the environment go together. That is why we have developed a practical plan with the provinces and territories, with indigenous leaders, with business leaders, with labour leaders, with environmentalists, and with all Canadians because we know Canada needs to do its part to tackle climate change. There is a huge economic opportunity in the trillions of dollars. We are going to position ourselves well so that we can create innovation here in Canada that we will export to the world, creating good jobs and growing our economy.",Liberal,Ottawa Centre,Catherine McKenna,http://www.parl.gc.ca/Parliamentarians/en/members/catherine-mckenna(214082)
4713497,ca.proc.d.2017-06-06.9587183,2017-06-06,2490b23e-4439-4513-9d54-6fceb6320267,220306,"Ms. Cheryl Hardcastle (Windsor—Tecumseh, NDP)",,Government Orders,Paris Agreement,Motion that debate be not further adjourned,"Madam Speaker, I agree that it is important for Canadians to understand what is going on here. The issue is not really about us looking at new policy and the era of using legislation to advance environmental sustainability as well as economic health. The issue here is about the tactics being used by the governing party to run roughshod over opposition members who want to have meaningful debate about the very significant and milestone achievements that the government wants to be able to take credit for.
I am here and ready to give my thoughtful, meaningful, and reflective comments on the legislation, which is historic. However, every time I sit here and am ready to be the voice for the very progressive constituents in my area who have provided very insightful information, we get shut down by a government that campaigned on being healthy for democracy, campaigned on sunny ways, and I see this Eddie Haskell version of governance here. It is very disconcerting to hear the members detract from the real issue of undermining our ability to talk about the issue in this place, when we should be debating it.",NDP,Windsor—Tecumseh,Cheryl Hardcastle,http://www.parl.gc.ca/Parliamentarians/en/members/cheryl-hardcastle(220306)
4713498,ca.proc.d.2017-06-06.9587200,2017-06-06,cee27afa-cdf8-4e99-ab22-22290f86aa3a,214082,Hon. Catherine McKenna,,Government Orders,Paris Agreement,Motion that debate be not further adjourned,"Madam Speaker, I would once again repeat how important it is that Canada shows to the world that we stand firm on the Paris agreement. In the face of the very disappointing decision by the U.S. administration, we need to stand up and say that Canada understands that climate change is real and we understand the very real impacts that we are seeing across our country. We are seeing floods, forest fires, and an Arctic that is literally melting before our eyes. 
We know we need to take action and we need to show that the world is resolved to take action, that we are all going to be working together. I have three children and I am absolutely committed to making sure that we take serious action to protect our planet, but also to create good jobs for them, to grow the economy, to make sure that we are creating the innovation needed for a cleaner planet to help grow our economy and place us well in the world.",Liberal,Ottawa Centre,Catherine McKenna,http://www.parl.gc.ca/Parliamentarians/en/members/catherine-mckenna(214082)
4713499,ca.proc.d.2017-06-06.p4934662,2017-06-06,,,,intervention,Government Orders,Paris Agreement,Motion that debate be not further adjourned," Oh, oh!",,,Some hon. members,
4713500,ca.proc.d.2017-06-06.9587205,2017-06-06,cedf1659-ebb1-4f26-b723-5c7c5353988b,214948,The Assistant Deputy Speaker (Mrs. Carol Hughes),,Government Orders,Paris Agreement,Motion that debate be not further adjourned,"Before I recognize anyone else, I want to remind members that if they have something to contribute, they should stand up to be recognized and I will try to make sure that everyone has an opportunity to ask a question or make a comment.
Questions and comments, the hon. Parliamentary Secretary to the Minister of Environment.",NDP,Algoma—Manitoulin—Kapuskasing,Carol Hughes,http://www.parl.gc.ca/Parliamentarians/en/members/carol-hughes(214948)
4713501,ca.proc.d.2017-06-06.9587206,2017-06-06,858770e9-c9c2-4a95-a6e4-679c973912fd,219959,"Mr. Jonathan Wilkinson (Parliamentary Secretary to the Minister of Environment and Climate Change, Lib.)",,Government Orders,Paris Agreement,Motion that debate be not further adjourned,"Madam Speaker, I think the thoughtful people in the House understand the environmental imperatives associated with endorsing the Paris agreement and addressing climate change in a substantive way, but there is also an enormous economic opportunity enabled through the Paris agreement and in how countries actually implement it. In Canada, that is reflected in the pan-Canadian framework on climate change and clean growth.
Can the minister tell us a little more about the economic opportunity and the ways in which the government is actually approaching this subject?",Liberal,North Vancouver,Jonathan Wilkinson,http://www.parl.gc.ca/Parliamentarians/en/members/jonathan-wilkinson(219959)
4713502,ca.proc.d.2017-06-06.9587209,2017-06-06,cee27afa-cdf8-4e99-ab22-22290f86aa3a,214082,Hon. Catherine McKenna,,Government Orders,Paris Agreement,Motion that debate be not further adjourned,"Madam Speaker, I would like to thank the member for his tireless work on climate change and the environment.
The economic opportunity of climate action is enormous. The former governor of the Bank of Canada, now the governor of the Bank of England, Mark Carney, has called it a $30-trillion economic opportunity. We need investments in renewable energy. China is making historic investments in solar and wind power. It is the same for India. Countries around the world are looking for innovations. When I was in China, I brought a trade mission with me. The Chinese government told me it needs our clean air, clean water, and soil remediation solutions. I want Canadian innovations to be exported to the world and to take advantage of that economic opportunity so that we can grow our economy and create good jobs, all the while saving the planet.",Liberal,Ottawa Centre,Catherine McKenna,http://www.parl.gc.ca/Parliamentarians/en/members/catherine-mckenna(214082)
4713503,ca.proc.d.2017-06-06.9587216,2017-06-06,b37cad30-26f6-40c6-8e4c-dd3a0ba841bb,217034,Mrs. Cheryl Gallant,,Government Orders,Paris Agreement,Motion that debate be not further adjourned,"Madam Speaker, a taxpayer shared with me a recent conversation he had with Jon-Paul Jepp, who goes by the inflated title of senior policy adviser to the Minister of Environment and Climate Change. Jon-Paul Jepp, who hung up twice on the taxpayer, was completely unable to respond in a professional way. Apart from his former employment with an oil company, which Jon-Paul Jepp felt made him a climate change expert, he was incapable of defending the Liberal Party position on carbon taxes and the reality that carbon taxes are a tax policy, not an environmental policy. When Jon-Paul Jepp was asked to explain how a carbon tax is going to hold temperatures to less than 2° as per the Paris agreement and how a carbon tax causes warming when higher levels do not perceive warming, he hung up.
Is not the real reason the Liberals are bringing in this carbon tax and forcing this vote on the Paris agreement so quickly before all of us have had a chance to talk that they are afraid the truth is getting out and that their signing this agreement is not based on fact?",Conservative,Renfrew—Nipissing—Pembroke,Cheryl Gallant,http://www.parl.gc.ca/Parliamentarians/en/members/cheryl-gallant(217034)
4713504,ca.proc.d.2017-06-06.9587228,2017-06-06,cee27afa-cdf8-4e99-ab22-22290f86aa3a,214082,Hon. Catherine McKenna,,Government Orders,Paris Agreement,Motion that debate be not further adjourned,"Madam Speaker, I am a bit confused. The Paris agreement was actually negotiated with 195 countries around the world in 2015. We are strongly supportive of action to tackle climate change. I have a very simple question for the Conservative Party opposite. Do you or do you not stand with the House and support the Paris agreement?",Liberal,Ottawa Centre,Catherine McKenna,http://www.parl.gc.ca/Parliamentarians/en/members/catherine-mckenna(214082)
4713505,ca.proc.d.2017-06-06.9587231,2017-06-06,cedf1659-ebb1-4f26-b723-5c7c5353988b,214948,The Assistant Deputy Speaker (Mrs. Carol Hughes),,Government Orders,Paris Agreement,Motion that debate be not further adjourned,"I would remind the minister that she is to address the Chair and not individual members.
It is my duty to interrupt the proceedings at this time. I remind hon. members that there will be 14 minutes and 16 seconds remaining for questions and comments on the motion after private members' business.
It being 5:30 p.m., the House will now proceed to the consideration of private members' business as listed on today's Order Paper.",NDP,Algoma—Manitoulin—Kapuskasing,Carol Hughes,http://www.parl.gc.ca/Parliamentarians/en/members/carol-hughes(214948)
