basepk,hid,speechdate,pid,opid,speakeroldname,speakerposition,maintopic,subtopic,subsubtopic,speechtext,speakerparty,speakerriding,speakername,speakerurl
4712745,ca.proc.d.2017-06-02.9578376,2017-06-02,e277e13e-59ec-425f-a957-eb5e54d8cb62,216144,"Mr. Gérard Deltell (Louis-Saint-Laurent, CPC)",,Oral Questions,Government Accountability,,"Mr. Speaker, the parliamentary budget officer released a report this week, which, once again, is devastating to the government. Even worse, the PBO again indicated that he is finding it difficult to obtain the important information that he needs to do his job.
Why is the government hindering the parliamentary budget officer's work? ",Conservative,Louis-Saint-Laurent,Gérard Deltell,http://www.parl.gc.ca/Parliamentarians/en/members/gerard-deltell(216144)
4712746,ca.proc.d.2017-06-02.9578378,2017-06-02,6d680702-120b-4bcf-8da9-aae3e38ca0cf,214346,"Hon. Scott Brison (President of the Treasury Board, Lib.)",,Oral Questions,Government Accountability,,"Mr. Speaker, we have a great respect for the work that the parliamentary budget officer does on an ongoing basis. We work closely with the parliamentary budget officer, and we will continue to do so.
It is notable that in terms of his work with the Department of Finance, he was provided with the information requested. That happened for the budget decisions and the budget decision-making process that occurred under our government's mandate. We provided that information. Finance did provide that information to the parliamentary budget officer.
I appreciate the congratulations from the hon. member as part of the class of—",Liberal,Kings—Hants,Scott Brison,http://www.parl.gc.ca/Parliamentarians/en/members/scott-brison(214346)
4712747,ca.proc.d.2017-06-02.9578379,2017-06-02,16c839d3-0183-4ed6-892a-8d7bdc37c474,214972,The Assistant Deputy Speaker (Mr. Anthony Rota),,Oral Questions,Government Accountability,,The hon. member for Louis-Saint-Laurent.,Liberal,Nipissing—Timiskaming,Anthony Rota,http://www.parl.gc.ca/Parliamentarians/en/members/anthony-rota(214972)
4712748,ca.proc.d.2017-06-02.9578380,2017-06-02,e277e13e-59ec-425f-a957-eb5e54d8cb62,216144,"Mr. Gérard Deltell (Louis-Saint-Laurent, CPC)",,Oral Questions,Government Accountability,,"Mr. Speaker, those were the good old days. The hon. member was on the right side of the podium.
With all due respect for the President of the Treasury Board, what he said is not exactly what the parliamentary budget officer said. He once again indicated that he has difficulty obtaining information. It is not surprising given the example set at the top. When this government spends recklessly, it is clear that all levels of the federal administration will deem that if the Prime Minister does not keep his word about expenses, there is no reason to stay within budget.
Will the government clearly spell out for the public service that we must live within our means in Canada?",Conservative,Louis-Saint-Laurent,Gérard Deltell,http://www.parl.gc.ca/Parliamentarians/en/members/gerard-deltell(216144)
4712749,ca.proc.d.2017-06-02.9578382,2017-06-02,6d680702-120b-4bcf-8da9-aae3e38ca0cf,214346,"Hon. Scott Brison (President of the Treasury Board, Lib.)",,Oral Questions,Government Accountability,,"Mr. Speaker, I first want to respectfully correct the hon. member. He said that I had been a Conservative. In fact, I had been a Progressive Conservative. Since that party dropped the “progressive” moniker, both in name and reality, I chose to join a party that I am very proud of, the Liberal Party, which continues to give me the opportunity to serve and work on behalf of all Canadians, even the hon. member.",Liberal,Kings—Hants,Scott Brison,http://www.parl.gc.ca/Parliamentarians/en/members/scott-brison(214346)
4712750,ca.proc.d.2017-06-02.9578384,2017-06-02,ff7a7f13-0558-4282-8cfc-9bfdfcbf6a1a,216774,"Mr. Michael Cooper (St. Albert—Edmonton, CPC)",,Oral Questions,Justice,,"Mr. Speaker, every day accused criminals are being set free due to court delays. A father accused of breaking his infant's ankles was set free. A man accused of shooting an Ottawa area man twice in the head was set free.
The Minister of Justice said that she is proud of her record. How can the minister possibly be proud of her record of negligence in failing to fill judicial vacancies, which has resulted in accused criminals like these being set free?",Conservative,St. Albert—Edmonton,Michael Cooper,http://www.parl.gc.ca/Parliamentarians/en/members/michael-cooper(216774)
4712751,ca.proc.d.2017-06-02.9578387,2017-06-02,cd83ba99-0c5b-4f51-a42b-a73504b91199,214903,"Hon. Jody Wilson-Raybould (Minister of Justice and Attorney General of Canada, Lib.)",,Oral Questions,Justice,,"Mr. Speaker, I am certainly very proud of the 67 substantive judicial appointments that I have made to the superior courts across the country. We are going to continue to work within our open and transparent process. I look forward to introducing more judges in the very near future.
With respect to court delays, I take these issues very seriously. That is why I am working with my counterparts in the provinces and territories. We have identified priority areas where we are going to collaboratively address the court delays that exist in the country.",Liberal,Vancouver Granville,Jody Wilson-Raybould,http://www.parl.gc.ca/Parliamentarians/en/members/jody-wilson-raybould(214903)
4712752,ca.proc.d.2017-06-02.9578389,2017-06-02,f8911e4d-f080-4ac8-94b1-74a18979c811,215938,"Mr. Francis Drouin (Glengarry—Prescott—Russell, Lib.)",,Oral Questions,Infrastructure,,"Mr. Speaker, Canadians know the importance of clean water and waste-water treatment to building healthy and sustainable communities. This is fundamental to the well-being of Canadian communities, and after years of underinvestment, these systems need significant investments. Can the Minister of Infrastructure and Communities update this House on the investments that the government is making in clean water and waste-water systems across Canada?",Liberal,Glengarry—Prescott—Russell,Francis Drouin,http://www.parl.gc.ca/Parliamentarians/en/members/francis-drouin(215938)
4712753,ca.proc.d.2017-06-02.9578403,2017-06-02,811a7b9a-4be5-4f9a-a302-088cb204bfba,214248,"Hon. Amarjeet Sohi (Minister of Infrastructure and Communities, Lib.)",,Oral Questions,Infrastructure,,"Mr. Speaker, our government knows how important our water and waste-water systems are to the health and well-being of Canadians. That is why we introduced a $2 billion clean water and wastewater fund. Last week, we announced 730 water projects across Ontario, with a combined investment of $1 billion, including in the member's own riding of Glengarry—Prescott—Russell. We have announced more projects in one year than the previous government did in four years combined.",Liberal,Edmonton Mill Woods,Amarjeet Sohi,http://www.parl.gc.ca/Parliamentarians/en/members/amarjeet-sohi(214248)
4712754,ca.proc.d.2017-06-02.9578427,2017-06-02,9c9a64e6-58f1-4367-9f49-93ad31744c96,217354,"Mrs. Cathy McLeod (Kamloops—Thompson—Cariboo, CPC)",,Oral Questions,Indigenous Affairs,,"Mr. Speaker, when the Government of Canada provides $25,000 to the Legion for a new floor, the Legion is required to publicly account for every penny. When it sends billions of dollars in transfers to first nations, the community members who are supposed to benefit the most are too often left in the dark. The minister said that she cares about transparency. It has been 18 months now, and the Liberals have done nothing. When will they provide basic information to band members that every other Canadian has and deserves? ",Conservative,Kamloops—Thompson—Cariboo,Cathy McLeod,http://www.parl.gc.ca/Parliamentarians/en/members/cathy-mcleod(217354)
4712755,ca.proc.d.2017-06-02.9578430,2017-06-02,f470e27a-a074-4b16-8304-960ffe8c9289,213975,"Hon. Carolyn Bennett (Minister of Indigenous and Northern Affairs, Lib.)",,Oral Questions,Indigenous Affairs,,"Mr. Speaker, for everyone, including first nations, the government supports transparency and accountability. Since last summer, we have been working with indigenous organizations, including the AFN and the Aboriginal Financial Officers Association, on ways to enhance mutual accountability. The government is also reaching out to community members and leadership through a comprehensive online engagement, and is planning in-person sessions across the country over the coming months. We will continue to work in full partnership with first nations to improve mutual accountability and transparency.",Liberal,Toronto—St. Paul's,Carolyn Bennett,http://www.parl.gc.ca/Parliamentarians/en/members/carolyn-bennett(213975)
4712756,ca.proc.d.2017-06-02.9578432,2017-06-02,00000000-0000-0000-0000-000000000000,232373,"Mrs. Mona Fortier (Ottawa—Vanier, Lib.)",,Oral Questions,Science,,"Mr. Speaker, this is Gender-based Analysis Plus Awareness Week. I am proud to be a member of this feminist government with a feminist Prime Minister who is committed to gender equality.
Recently, the Minister of Science announced new measures to improve gender equality in the Canada research chairs program.
Can the Parliamentary Secretary for Science tell the House how increasing the participation of women in academia will help make Canada a better and more prosperous country?",Liberal,Ottawa—Vanier,Mona Fortier,http://www.parl.gc.ca/Parliamentarians/en/members/mona-fortier(232373)
4712757,ca.proc.d.2017-06-02.9578435,2017-06-02,500229ce-460b-45f9-93ce-abf974f9787d,229492,"Ms. Kate Young (Parliamentary Secretary for Science, Lib.)",,Oral Questions,Science,,"Mr. Speaker, our government understands that by increasing diversity, we bring different experiences and ideas to the table to advance Canadian science, grow our economy, and create the good well-paying jobs of the future. We reinstated the university and college academic staff system survey, and strengthened equity provisions in both the Canada research chairs and the Canada excellence research chairs programs. As a scientist, the minister has spent 25 years fighting for women in science, and she and I will continue to do so.",Liberal,London West,Kate Young,http://www.parl.gc.ca/Parliamentarians/en/members/kate-young(229492)
4712758,ca.proc.d.2017-06-02.9578437,2017-06-02,33ef2052-c37d-446f-9d03-515d01591eba,218026,"Mr. Larry Maguire (Brandon—Souris, CPC)",,Oral Questions,Agriculture and Agri-Food,,"Mr. Speaker, the Liberals were warned by pork producers that weakening the biosecurity measures would spread the PED virus and put the livelihood of farmers at risk. It turns out that due to the Minister of Agriculture and Agri-Food's lack of action, there has now been another confirmed case of PED, the ninth this month. Farmers are sick and tired of the Liberal government's lack of action. When will the current Liberal government stop ignoring this biosecurity risk and work with the Manitoba pork producers to find a solution?",Conservative,Brandon—Souris,Larry Maguire,http://www.parl.gc.ca/Parliamentarians/en/members/larry-maguire(218026)
4712759,ca.proc.d.2017-06-02.9578440,2017-06-02,a25e0e6b-f3fa-46c7-a795-ad60037fe56e,213962,"Hon. Lawrence MacAulay (Minister of Agriculture and Agri-Food, Lib.)",,Oral Questions,Agriculture and Agri-Food,,"Mr. Speaker, it is a concern. The health and safety of Canadians is the government's first priority. The CFIA is monitoring the program in place for this product, and if unacceptable levels are detected, the CFIA will take action, including product retention and recall. We are addressing the problem.",Liberal,Cardigan,Lawrence MacAulay,http://www.parl.gc.ca/Parliamentarians/en/members/lawrence-macaulay(213962)
4712760,ca.proc.d.2017-06-02.9578442,2017-06-02,f45e86b7-f192-4692-9889-6b57283fc3b0,224178,"Mr. Gabriel Ste-Marie (Joliette, BQ)",,Oral Questions,Infrastructure,,"Mr. Speaker, I call on the Minister of Justice. Bill C-44 makes it possible to grant private investors in the infrastructure bank the same privileges as the government itself. Simply put, that means that the financial sector will be above Quebec laws and municipal regulations.
The Minister of Finance can say all he wants that this is not his intention, but that is what his bill says. Constitutional experts agree with us, and the Quebec National Assembly is unanimous on the subject. The finance minister is all alone.
I call on the justice minister to act, since she is responsible for ensuring compliance with our laws. Can she intervene and set things straight?",Bloc,Joliette,Gabriel Ste-Marie,http://www.parl.gc.ca/Parliamentarians/en/members/gabriel-ste-marie(224178)
4712761,ca.proc.d.2017-06-02.9578445,2017-06-02,811a7b9a-4be5-4f9a-a302-088cb204bfba,214248,"Hon. Amarjeet Sohi (Minister of Infrastructure and Communities, Lib.)",,Oral Questions,Infrastructure,,"Mr. Speaker, the bank has been set over the same legal structure and framework as many other crown corporations. Any project undertaken by the Canada infrastructure bank will be required to follow all provincial, territorial, and municipal laws.
We have committed to invest a historic amount of resources to build Canadian communities and rebuild infrastructure where there is a need. We will do that for every province, while respecting the regulations that are currently in place.",Liberal,Edmonton Mill Woods,Amarjeet Sohi,http://www.parl.gc.ca/Parliamentarians/en/members/amarjeet-sohi(214248)
4712762,ca.proc.d.2017-06-02.9578447,2017-06-02,9e05a099-6a0b-4fe2-9e9b-0a8b91b7807b,214054,"Ms. Monique Pauzé (Repentigny, BQ)",,Oral Questions,Infrastructure,,"Mr. Speaker, the Minister of Justice does not seem to have a voice, and I am wondering whether the Minister of Environment has one.
Quebec has put in place tools such as the Bureau d'audiences publiques sur l'environnement, or BAPE, to ensure that environmental impacts are taken into account for all development projects. With the infrastructure bank, projects will be able to ignore our environmental protection laws. The government is trying to attract foreign investors by allowing them to circumvent Quebec laws. That is unacceptable, and it does not make any sense. 
Will the government change the law so that the infrastructure bank is not an agent of the crown?",Bloc,Repentigny,Monique Pauzé,http://www.parl.gc.ca/Parliamentarians/en/members/monique-pauze(214054)
4712763,ca.proc.d.2017-06-02.9578450,2017-06-02,811a7b9a-4be5-4f9a-a302-088cb204bfba,214248,"Hon. Amarjeet Sohi (Minister of Infrastructure and Communities, Lib.)",,Oral Questions,Infrastructure,," Mr. Speaker, the bank is one very important tool that is available to our municipalities and provinces to build the infrastructure they need.
As I said earlier, I want to assure the hon. member that the bank would have to abide by all the laws that are in place in provinces, territories, and municipalities.
Our goal is to make sure that our provinces, territories, and municipalities understand that we are here to help them build the infrastructure they need, whether it is housing or recreational facilities, or any other amenities they need to build strong, sustainable, and inclusive communities.",Liberal,Edmonton Mill Woods,Amarjeet Sohi,http://www.parl.gc.ca/Parliamentarians/en/members/amarjeet-sohi(214248)
4712764,ca.proc.d.2017-06-02.9578453,2017-06-02,c80fcb28-a347-4594-9e11-63ac3c37e428,214017,"Mr. Simon Marcil (Mirabel, BQ)",,Oral Questions,Infrastructure,,"Mr. Speaker, the members across the aisle told us simply not to worry. This is hard to say with a straight face. They said that just because they gave wealthy foreign investors the right to expropriate does not mean they will use it. In Mirabel, we have seen what happens when the federal government uses its power of expropriation. Indeed, 97,000 hectares were seized by a previous Liberal government.
Through Bill C-44, they want to give their bank the right to disregard agricultural zoning and do whatever they want with our lands. Does anyone over there understand that no one is interested in their privatization bank?",Bloc,Mirabel,Simon Marcil,http://www.parl.gc.ca/Parliamentarians/en/members/simon-marcil(214017)
4712765,ca.proc.d.2017-06-02.9578456,2017-06-02,811a7b9a-4be5-4f9a-a302-088cb204bfba,214248,"Hon. Amarjeet Sohi (Minister of Infrastructure and Communities, Lib.)",,Oral Questions,Infrastructure,,"Mr. Speaker, we have been in touch with the Province of Quebec to assure it that the role of the bank is not, in any way, to undermine the regulations and laws that are in place in every province, territory, and municipality. We work very closely with all provinces to be sure they are rightly supported to build the infrastructure, whether it is housing, public transit, or recreational and cultural facilities; or building shelters for women fleeing from domestic violence; seniors care facilities; or helping to welcome newcomers into our communities, all multicultural communities, or any other support that they need. We are here to stand with them while respecting the laws that we have.",Liberal,Edmonton Mill Woods,Amarjeet Sohi,http://www.parl.gc.ca/Parliamentarians/en/members/amarjeet-sohi(214248)
4712766,ca.proc.d.2017-06-02.9578458,2017-06-02,eaa6694f-1e20-4aae-ad3b-e694b0e12c59,224170,"Ms. Elizabeth May (Saanich—Gulf Islands, GP)",,Oral Questions,The Environment,,"Mr. Speaker, after yesterday's very disturbing announcement from the rose garden, the surrealistic orchestras striking up on the deck of the Titanic as Trump announced that the U.S. would leave the Paris agreement, which it cannot legally do for four years, it opens up a chasm where there will be insufficient action. There was already insufficient action in the commitments that had been made by all governments in order to meet the Paris accord.
I wonder if the Minister of Environment  can commit that Canada is prepared to do more, to look at our targets, to look at our developing country partnerships, and to work with subnational levels of government within the United States to keep moving to climate action.",Green,Saanich—Gulf Islands,Elizabeth May,http://www.parl.gc.ca/Parliamentarians/en/members/elizabeth-may(224170)
4712767,ca.proc.d.2017-06-02.9578461,2017-06-02,cee27afa-cdf8-4e99-ab22-22290f86aa3a,214082,"Hon. Catherine McKenna (Minister of Environment and Climate Change, Lib.)",,Oral Questions,The Environment,,"Mr. Speaker, I would like to thank the member opposite for her long-time advocacy work on climate change . We are all in this together. We have only one planet. Canada is steadfast in our commitment to the Paris agreement. If the U.S. administration is going to step back, we are going to step up.
I am very happy to announce that next week we will be introducing a motion in the House to support the Paris agreement. I certainly hope that all members will stand to indicate their support for our planet.",Liberal,Ottawa Centre,Catherine McKenna,http://www.parl.gc.ca/Parliamentarians/en/members/catherine-mckenna(214082)
4712768,ca.proc.d.2017-06-02.9578466,2017-06-02,78336f0e-962c-47d2-a5b8-b59a26592789,217320,Mr. Matthew Dubé,,Oral Questions,The Environment,,"Mr. Speaker, in your ruling regarding the admissibility of a question, you also mentioned that you would take the time to examine the blues and the content of the question. 
If I may, I would like to point out that the two key elements of the question from my colleague from London—Fanshawe had to do with, first of all, the reaction of the Minister of Public Safety and Emergency Preparedness with respect to the implications of the issue raised, and second, an amendment to the Parliament of Canada Act, which is a federal jurisdiction.
In closing, I would like to say that perhaps if the parliamentary secretary had listened to the question, he would not have hidden behind a Speaker's decision and stood up with more than words for the brave men and women who protect us.",NDP,Beloeil—Chambly,Matthew Dubé,http://www.parl.gc.ca/Parliamentarians/en/members/matthew-dube(217320)
4712769,ca.proc.d.2017-06-02.9578467,2017-06-02,16c839d3-0183-4ed6-892a-8d7bdc37c474,214972,The Assistant Deputy Speaker (Mr. Anthony Rota),,Oral Questions,The Environment,,"I would like to thank the hon. member. After the question was asked, we examined it again and discussed it. Indeed, the question was valid. The way it was phrased yesterday was different. However, the content of the question asked today was admissible. I believe the hon. member received a response to his question. I thank him for his point of order.",Liberal,Nipissing—Timiskaming,Anthony Rota,http://www.parl.gc.ca/Parliamentarians/en/members/anthony-rota(214972)
4712770,ca.proc.d.2017-06-02.9578472,2017-06-02,0992ca07-764f-4fa6-aa55-9a1f3f0a7327,214297,"Mr. David McGuinty (Ottawa South, Lib.)",,Routine Proceedings,Interparliamentary Delegations,,"Mr. Speaker, pursuant to Standing Order 34(1) I have the honour to present to the House, in both official languages, the report of the Canadian Group of the Inter-Parliamentary Union respecting its participation at the Annual Parliamentary Hearing at the United Nations in New York, February 13-14, 2017, and the 61st session of the United Nations Commission on the Status of Women in New York, March 17, 2017.",Liberal,Ottawa South,David McGuinty,http://www.parl.gc.ca/Parliamentarians/en/members/david-mcguinty(214297)
4712771,ca.proc.d.2017-06-02.9578474,2017-06-02,d9a6cad1-b3b6-4393-afc5-7c897fb638e6,229654,"Hon. MaryAnn Mihychuk (Kildonan—St. Paul, Lib.)",,Routine Proceedings,Committees of the House,Indigenous and Northern Affairs,"Mr. Speaker, I have the honour to present, in both official languages, the seventh report of the Standing Committee on Indigenous and Northern Affairs, entitled “Supplementary Estimates (A) 2017-18: Votes 1a, 10a and L20a under Department of Indian Affairs and Northern Development”.",Liberal,Kildonan—St. Paul,MaryAnn Mihychuk,http://www.parl.gc.ca/Parliamentarians/en/members/maryann-mihychuk(229654)
4712772,ca.proc.d.2017-06-02.9578546,2017-06-02,f470e27a-a074-4b16-8304-960ffe8c9289,213975,"Hon. Carolyn Bennett (Minister of Indigenous and Northern Affairs, Lib.)",,Routine Proceedings,Indian Act,," moved that Bill S-3, An Act to amend the Indian Act (elimination of sex-based inequities in registration), be read the first time. 
 (Motion agreed to and bill read the first time) ",Liberal,Toronto—St. Paul's,Carolyn Bennett,http://www.parl.gc.ca/Parliamentarians/en/members/carolyn-bennett(213975)
4712773,ca.proc.d.2017-06-02.9578479,2017-06-02,363e30d6-e47b-4c39-91ad-667deb63009c,219399,"Ms. Sheila Malcolmson (Nanaimo—Ladysmith, NDP)",,Routine Proceedings,Petitions,The Environment,"Mr. Speaker, on behalf of residents of Nanaimo—Ladysmith, I rise to present two petitions today.
To end the runaround on abandoned vessels, to fix vessel registration and get the costs off taxpayers, to build a coast-wide strategy in co-operation with local governments, to act before vessels spill oil and contaminate our coasts, and to create good, green jobs, I present this petition. I am grateful local government leaders are supporting my Bill C-352 and have been pushing for a decade and a half for solutions to the problem of abandoned vessels.
We all recognize that the $1 million a year announced this week by the government is deeply inadequate, just a drop in the bucket. We are going to continue to push hard together for a long-term solution to abandoned vessels.",NDP,Nanaimo—Ladysmith,Sheila Malcolmson,http://www.parl.gc.ca/Parliamentarians/en/members/sheila-malcolmson(219399)
4712774,ca.proc.d.2017-06-02.9578482,2017-06-02,363e30d6-e47b-4c39-91ad-667deb63009c,219399,"Ms. Sheila Malcolmson (Nanaimo—Ladysmith, NDP)",,Routine Proceedings,Petitions,Bee Population,"Mr. Speaker, because bees are in peril, because they are facing habitat loss and pesticide deaths, because they are vital pollinators and contribute over $2 billion a year to Canada's agricultural economy, I present to Parliament petitions signed by members of the Nanaimo Beekeepers Club. They gathered these signatures in support of federal action to protect bees on the Day of the Honey Bee. ",NDP,Nanaimo—Ladysmith,Sheila Malcolmson,http://www.parl.gc.ca/Parliamentarians/en/members/sheila-malcolmson(219399)
4712775,ca.proc.d.2017-06-02.9578484,2017-06-02,eaa6694f-1e20-4aae-ad3b-e694b0e12c59,224170,"Ms. Elizabeth May (Saanich—Gulf Islands, GP)",,Routine Proceedings,Petitions,The Environment,"Mr. Speaker, it is an honour to rise today to present two petitions.
The first is from residents of Kipawa, Quebec, who are very concerned about the Lake Kipawa system. The ecosystem there is threatened by a rare earth project, and petitions continue to come in asking the federal government to work to protect this ecosystem from the proposed Matamec Explorations Inc. mine. ",Green,Saanich—Gulf Islands,Elizabeth May,http://www.parl.gc.ca/Parliamentarians/en/members/elizabeth-may(224170)
4712776,ca.proc.d.2017-06-02.9578556,2017-06-02,eaa6694f-1e20-4aae-ad3b-e694b0e12c59,224170,"Ms. Elizabeth May (Saanich—Gulf Islands, GP)",,Routine Proceedings,Petitions,Agriculture,"Mr. Speaker, the second petition is from residents of Saanich—Gulf Islands who are looking to the government to ensure that our aid policies are allowing and encouraging small family farmers in the developing world, the global south, to save seeds. 
It is an ancient practice in agriculture for farmers to have the right to save and use seeds in the following season. It is increasingly under threat. The petitioners hope that the Government of Canada, through the work of our international aid agencies, will support family farmers, many of whom, if not most of whom, are women.",Green,Saanich—Gulf Islands,Elizabeth May,http://www.parl.gc.ca/Parliamentarians/en/members/elizabeth-may(224170)
