basepk,hid,speechdate,pid,opid,speakeroldname,speakerposition,maintopic,subtopic,subsubtopic,speechtext,speakerparty,speakerriding,speakername,speakerurl
4713700,ca.proc.d.2017-06-07.9588310,2017-06-07,cedf1659-ebb1-4f26-b723-5c7c5353988b,214948,The Assistant Deputy Speaker (Mrs. Carol Hughes),,Government Orders,Cannabis Act,,"Unfortunately, that is the time allotted for tonight. The hon. member will have about seven and a half minutes left the next time the issue is before the House.
It being midnight, this House stands adjourned until later this day, at 2 p.m., pursuant to Standing Order 24(1).
(The House adjourned at 12:00 a.m.) ",NDP,Algoma—Manitoulin—Kapuskasing,Carol Hughes,http://www.parl.gc.ca/Parliamentarians/en/members/carol-hughes(214948)
4713701,ca.proc.d.2017-06-07.9589075,2017-06-07,3176068f-62ee-4b2f-aacd-1131201c6db1,214707,The Speaker,,,,,"It being Wednesday, we will now have the singing of O Canada led by our wonderful pages.
 [Members sang the national anthem] ",Liberal,Halifax West,Geoff Regan,http://www.parl.gc.ca/Parliamentarians/en/members/geoff-regan(214707)
4713702,ca.proc.d.2017-06-07.9589088,2017-06-07,88ce81f3-c8b1-4ab9-bbdb-aa677d83b394,214062,"Mr. Michel Boudrias (Terrebonne, BQ)",,Statements By Members,Léo Major,," Mr. Speaker, Quebec has its own war heroes who deserve special recognition on the occasion of that other 150th anniversary.
One of them, Léo Major, is our only soldier to have been awarded the Distinguished Conduct Medal, the DCM, in two separate wars. He landed at Normandy and single-handedly captured almost 100 Nazi soldiers at the Battle of the Scheldt.
He refused to return home despite having lost an eye and broken his back. He had a war to finish.
In one night, he single-handedly liberated the Dutch city of Zwolle, which was occupied by 1,000 enemy troops.
During the Korean War, he and 18 soldiers recaptured a hill that an American division of 10,000 had lost. Léo Major and his men held their position for three days, repelling seven attacks by two Chinese divisions 14,000 soldiers strong.
Quebec has war heroes who fought and are still fighting for freedom, and Léo Major was one of them. Some soldiers by their actions become legend.
Léo Major, je me souviens. I remember. We will all remember.",Bloc,Terrebonne,Michel Boudrias,http://www.parl.gc.ca/Parliamentarians/en/members/michel-boudrias(214062)
4713703,ca.proc.d.2017-06-07.9589092,2017-06-07,d3ed44bf-a69d-4457-92e3-5e94157c4980,215892,"Mr. Jati Sidhu (Mission—Matsqui—Fraser Canyon, Lib.)",,Statements By Members,Clayton Cassidy,,"Mr. Speaker, I rise to celebrate the life of a courageous resident of Cache Creek.
Clayton Cassidy served his community with integrity over the last 30 years as a member of the fire department, serving as fire captain and, most recently, fire chief. While investigating water levels following the floods in Cache Creek, Chief Cassidy tragically lost his life.
In the words of his brother Patrick, Clayton was a compassionate community leader. He was a man uncomfortable with praise who devoted his life to helping others. 
Clayton Cassidy is survived by his wife Rose, his three sons, seven grandchildren and seven siblings.
On behalf of the constituents of Mission—Matsqui—Fraser Canyon, I offer my sincere condolences to the Cassidy family. Chief Cassidy's service will forever be honoured and his courage will never be forgotten.",Liberal,Mission—Matsqui—Fraser Canyon,Jati Sidhu,http://www.parl.gc.ca/Parliamentarians/en/members/jati-sidhu(215892)
4713704,ca.proc.d.2017-06-07.9589096,2017-06-07,b6e2c8aa-fc83-4d52-ad66-7910b8805f90,216461,"Mr. Arnold Viersen (Peace River—Westlock, CPC)",,Statements By Members,Finance,,"Mr. Speaker, summer is coming, and Canadians across Canada are looking forward to another fishing season, with its promise of adventure and tall tales of that monster fish that got away.
The Liberals seem to love fishing just as much as the next guy, since all their lessons on governing come from fishing.
 Lesson number one is that there is no such thing as too much equipment.
 Lesson number two is that when in doubt, exaggerate.
 Lesson number three is that even the best lines get weak after they have been used a few times.
 Lesson number four is that sometimes we really have to squirm to get off the hook.
I know the Liberals have a fishing story they do not like to brag about, but let us be honest, we are not talking about a small fry here. The Liberals said the deficit would only be this big, but we know it is really that big. That monster $28 billion deficit continues to dive deeper and run the line.
The Liberals need to stop baiting us with wild fishing stories and reel in this deficit.",Conservative,Peace River—Westlock,Arnold Viersen,http://www.parl.gc.ca/Parliamentarians/en/members/arnold-viersen(216461)
4713705,ca.proc.d.2017-06-07.9589099,2017-06-07,6025d38f-3695-4037-8221-3f4cb652936b,218940,"Mr. Bill Casey (Cumberland—Colchester, Lib.)",,Statements By Members,Cumberland-Colchester Constituency Youth Council,,"Mr. Speaker, last fall, 14 bright young people representing every corner of our riding formed the Cumberland-Colchester Constituency Youth Council. They kicked off a study on youth retention and outmigration in rural Nova Scotia. They approached it like a parliamentary committee, heard from many witnesses and held lively discussions.
Their final report calls on governments to invest in the kinds of infrastructure that rural Nova Scotia needs for economies and communities to thrive, things like broadband internet, cellphone service, small schools, support for entrepreneurs, recreational infrastructure, and tourism. Their report is now in the hands of every municipal councillor, MLA and MP in the area.
These young people showed a great thirst for knowledge about civics and politics, and I want to thank them for their report. I also want to thank my executive assistant, Joel Henderson, for organizing and monitoring the entire process. I want to thank you as well, Mr. Speaker, for allowing me to talk about it.",Liberal,Cumberland—Colchester,Bill Casey,http://www.parl.gc.ca/Parliamentarians/en/members/bill-casey(218940)
4713706,ca.proc.d.2017-06-07.9589102,2017-06-07,075456c7-3cca-483c-b4f1-85006031ca09,224982,"Mr. Robert Aubin (Trois-Rivières, NDP)",,Statements By Members,Community Support,,"Mr. Speaker, the weather has long been one of our favourite topics of casual conversation. Since the flooding that spring brought to the Mauricie, however, it has become practically all we talk about.
 I say “practically” because what we should have focused on was the incredible outpouring of support that saw perfect strangers helping each other without expecting anything in return.
 By offering my thanks I hope to promote humankind's capacity for goodwill.
 I offer my thanks to those who, even today, are still helping their neighbours. I offer my thanks to the many military personnel, police officers and firefighters for their help. I offer my thanks to the artists who held benefit concerts for the victims. I offer my thanks to the politicians who put aside their differences to respond to the emergency and alleviate the distress people were in.
 Finally, I offer my thanks to everyone whose acts of kindness, while I might not be aware of them, make me proud to be your humble representative.",NDP,Trois-Rivières,Robert Aubin,http://www.parl.gc.ca/Parliamentarians/en/members/robert-aubin(224982)
4713707,ca.proc.d.2017-06-07.9589106,2017-06-07,b4442fcd-62cf-456e-a49b-625ea35069b5,219808,"Mr. Lloyd Longfield (Guelph, Lib.)",,Statements By Members,Canada 150 Poetry Contest,,"Mr. Speaker, today I am thrilled to represent Guelph High School student Michaela McBryde's winning submission in Guelph's Canada 150 Poetry Contest, titled “150 Years of Greatness”:
  A Queen's signature Leads to the birth of a nation A nation called Canada Free to make our own choices In hopes they lead to greatness Choices that created Many ways to make life better Many mistakes to learn from Many decisions to change the world Many opportunities for greatness A strength on our own Partnering up with others To help the world In war, in politics, in humanity Peacekeepers for greatness A country of 36 and a half million people Citizens contributing thoughts, discoveries, advancements, technology, art, music, history, exports and services Canadians strive for greatness Canada is strong and unified We stand together To celebrate our history A celebration of 150 years of greatness.  
I congratulate Michaela.",Liberal,Guelph,Lloyd Longfield,http://www.parl.gc.ca/Parliamentarians/en/members/lloyd-longfield(219808)
4713708,ca.proc.d.2017-06-07.9589109,2017-06-07,b6850f16-57dc-486c-b5bb-0fd191022af4,216512,"Mr. Garnett Genuis (Sherwood Park—Fort Saskatchewan, CPC)",,Statements By Members,Religious Freedom,,"Mr. Speaker, today we remember a terrible event that took place 33 years ago and marked a horrific escalation in tensions between Sikhs and the India government.
Apparently seeking to target militants, the Indian army launched Operation Blue Star in June of 1984, attacking the Harmandir Sahib complex or Golden Temple in Amritsar. This event precipitated the assassination of Indira Gandhi and subsequent coordinated massacres against the Sikh community.
 The Golden Temple is the most sacred site to the Sikh faith. Innocent lives were lost, and the temple itself was damaged.
We cannot change the past, but it is important we learn its lessons and promote justice and reconciliation as we go forward. 
Any attacks on holy sites obviously have a profound negative impact on community relations and have a searing effect on the psyche of the faithful. They of course leave thousands of innocents vulnerable. This particular attack clearly did all of those things.
People should be able to pray without fear of violence.
Throughout the world, Canada must make human rights, religious freedom, justice, and reconciliation central foreign policy priorities.",Conservative,Sherwood Park—Fort Saskatchewan,Garnett Genuis,http://www.parl.gc.ca/Parliamentarians/en/members/garnett-genuis(216512)
4713709,ca.proc.d.2017-06-07.9589113,2017-06-07,4b18a0b6-bb17-4967-84ef-abb5a4dde893,229553,"Mr. Greg Fergus (Hull—Aylmer, Lib.)",,Statements By Members,Oral Question Period,,"Mr. Speaker, last month, one of my constituents, Ms. Houle, wrote to the local newspaper to say how deplorable she found the behaviour of parliamentarians during a recent oral question period she attended. She is not alone. Each one of us sitting in the House is extremely fortunate to be here representing our constituents. There is no greater privilege I can have than to serve the residents of Hull—Aylmer as their member of Parliament. I love my work.
I would not be truthful if I said that I entirely enjoy question period, especially of late. The catcalling, heckling, yelling, and mindless applauding leaves me cold. In private conversations with members on all sides of the House, I know my feelings are shared by many.
 I am therefore issuing a challenge to my colleagues. During oral question period from now until the summer recess, let us stop applauding our immediate colleagues and heckling those sitting across the aisle.
Let us show Madam Houle and all Canadians that we can do better.",Liberal,Hull—Aylmer,Greg Fergus,http://www.parl.gc.ca/Parliamentarians/en/members/greg-fergus(229553)
4713710,ca.proc.d.2017-06-07.9589121,2017-06-07,9d4edb74-dcdc-4751-8541-6e42405e2bc5,224988,"Ms. Julie Dzerowicz (Davenport, Lib.)",,Statements By Members,Portugal Day,,"Mr. Speaker, in honour of June 10, Portugal Day, I would like to pay tribute to nine Portuguese leaders who have been recognized in the community over the last couple of months.
They are not only Portuguese leaders but they are Canadian leaders. They have made their community proud as they have made significant contributions that have made Canada a better country.
 They are Jack Oliveira of LiUNA Local 183, business manager and community leader; Frank Alvarez, award winning broadcaster of Portuguese news and culture; FPCBP Gala winners, Nellie Pedro for business excellence, José Maria Eustáquio for community leadership, Dr. Carlos Teixeira for academic work, and Constable Peter de Quintal, as next generation leader.
Finally, the 2017 Portuguese Walk of Fame recipients are Charles Sousa, Ontario minister of finance; Pedro Gil Vieira, award winning physicist; and popular Portuguese musician Antonio Amaro.
It is said, “True leaders do not create followers they create more leaders.” All these leaders hae achieved this through their respective work.
 [Member spoke in Portuguese as follows:] 
 Parabens a todos. E obrigada pela vossa liderança e inspiração. ",Liberal,Davenport,Julie Dzerowicz,http://www.parl.gc.ca/Parliamentarians/en/members/julie-dzerowicz(224988)
4713711,ca.proc.d.2017-06-07.9589124,2017-06-07,9f0040ba-a9d7-4aa4-b2e4-f3213a4e024f,217922,"Hon. Deepak Obhrai (Calgary Forest Lawn, CPC)",,Statements By Members,BAPS Shri Swaminarayan Mandir,,"Mr. Speaker, I rise today to recognize the 10th anniversary of the magnificent BAPS Shri Swaminarayan Mandir in Toronto. It is Canada's first traditional hand-carved Hindu place of worship. 
On the 22nd of July, 2007, the Shri Swaminarayan Mandir was inaugurated and dedicated to the people of Canada by His Holiness the late Pramukh Swami Maharaj, the creator and inspirational force behind the temple.
This summer, the 10th anniversary will be celebrated in the presence of His Holiness Mahant Swami Maharaj, the current spiritual leader of the BAPS Swaminarayan organization. On the behalf of the members, I welcome His Holiness to Canada.
BAPS Shri Swaminarayan organization is a worldwide organization dedicated to promoting spiritual, social and cultural needs of millions of Hindus around the world.
I invite all members of Parliament to join me on July 22nd in Toronto to celebrate the 10th anniversary of the Mandir.",Conservative,Calgary Forest Lawn,Deepak Obhrai,http://www.parl.gc.ca/Parliamentarians/en/members/deepak-obhrai(217922)
4713712,ca.proc.d.2017-06-07.9589127,2017-06-07,343b5c4a-fb8c-4248-8183-5ab683bc9f9f,219690,"Mr. Neil Ellis (Bay of Quinte, Lib.)",,Statements By Members,Bay of Quinte Educators,,"Mr. Speaker, I offer sincere congratulations to two Bay of Quinte teachers, Sheryl Parker and Susan Sewell-Charles, who are two of the 37 recipients of the 2016-2017 Prime Minister's Award for Teaching Excellence and Excellence in Early Childhood Education. 
The Bay of Quinte has tremendously engaged educators operating from public and private institutions at all grade levels. Our educators consistently point their students ahead by creating dynamic climates of learning that allow them to test their own ideas, understand the world around them, and determine the best course of action for their own future. 
Sheryl and Susan as a team work very hard to encourage the talent, ideas, and engagement of our local students at Queen Victoria Public School in Belleville. Together they have provided a dynamic and inclusive environment for students to acquire the innovative knowledge and skills required for their long-term success in life. These two remarkable teachers, like so many others, are helping us all to take another step toward a brighter future by investing so much into our children. ",Liberal,Bay of Quinte,Neil Ellis,http://www.parl.gc.ca/Parliamentarians/en/members/neil-ellis(219690)
4713713,ca.proc.d.2017-06-07.9589131,2017-06-07,00000000-0000-0000-0000-000000000000,232370,"Ms. Mary Ng (Markham—Thornhill, Lib.)",,Statements By Members,Business in Markham—Thornhill,,"Mr. Speaker, recently I participated in round tables with the Markham Board of Trade and industry leaders from high tech, digital, automotive, clean tech, and higher education. 
 We discussed how to ensure that Markham continues to be a leader in our national economy.
I learned about GM's new autonomous and connected cars centre, about IBM's innovation space and Markham convergence centre that are helping businesses take their technology to global markets, Icon Digital's state-of-the-art production facility, and Pond Technologies' commercialization of its research to fight climate change. These multinational Canadian headquarters and SMEs located right in Markham are proud employers to tens of thousands of jobs and are leading the way in innovation. 
I am proud budget 2017 is investing in an innovative future economy that will create middle-class jobs for today and tomorrow. I look forward to continuing the work with all businesses in Markham—Thornhill.",Liberal,Markham—Thornhill,Mary Ng,http://www.parl.gc.ca/Parliamentarians/en/members/mary-ng(232370)
4713714,ca.proc.d.2017-06-07.9589139,2017-06-07,82b1ca62-34ce-4d42-a830-4475f46bd203,213919,"Hon. Michael Chong (Wellington—Halton Hills, CPC)",,Statements By Members,73rd Anniversary of D-Day,,"Mr. Speaker, 73 years ago this week, an Allied force of over 150,000 soldiers, 4,000 ships, and 11,000 airplanes began the D-Day attack to defeat Nazism and liberate the people of western Europe. The Canadians went north to the Netherlands, a distance of some 300 miles. It took them four months to get there, advancing only three miles a day. Every mile of ground was soaked in Canadian blood. 
Eleven months after D-Day, in May 1945, Canadian soldiers finally liberated the Netherlands, including my mother's family in Friesland.
More than 7,600 Canadians died in the canals, fields, and villages of the Netherlands so that my mother and her family could live, and the Dutch have never forgotten. I am here today because of the sacrifices of those Canadian so long ago. 
We will never forget. Je me souviens.",Conservative,Wellington—Halton Hills,Michael Chong,http://www.parl.gc.ca/Parliamentarians/en/members/michael-chong(213919)
4713715,ca.proc.d.2017-06-07.9589142,2017-06-07,a80d5459-3c49-4ef6-bf76-533dac6290b0,219849,"Mr. Raj Grewal (Brampton East, Lib.)",,Statements By Members,"Hockey Night in Canada, Punjabi Edition",,"Mr. Speaker, no matter where we are from or what we believe in, Canadians are all united by our love for the sport of hockey. We have all enjoyed the sport, whether it is street hockey, ball hockey, ice hockey, field hockey, or table hockey. 
That is why Hockey Night in Canada, Punjabi Edition has been a great success. Punjabi is Canada's third most spoken language after English and French, and the show has garnered thousands of fans. Perhaps the most memorable moment was when host Harnarayan Singh had the call of the year—“Bonino, Bonino, Bonino”—which went viral.
However, it is unfortunate that during this year's Stanley Cup playoffs, the show has been the target of racism and insensitive comments online. This is not who we are as Canadians. 
I am proud to proclaim that we stand in solidarity with the show, for it is the epitome of our diversity and an example of what makes our country so great. I ask my hon. colleagues to help by watching and spreading the word of Hockey Night in Canada, Punjabi Edition.",Liberal,Brampton East,Raj Grewal,http://www.parl.gc.ca/Parliamentarians/en/members/raj-grewal(219849)
4713716,ca.proc.d.2017-06-07.9589147,2017-06-07,363e30d6-e47b-4c39-91ad-667deb63009c,219399,"Ms. Sheila Malcolmson (Nanaimo—Ladysmith, NDP)",,Statements By Members,Status of Women,,"Mr. Speaker, because almost half of Canadian companies have no women on their boards, zero, Canadian women expected our self-proclaimed feminist Prime Minister to turn words into action. However, Liberals are using the failed, discredited comply and explain model of the Conservative Party in Bill C-25. The government should adopt my legislation, Bill C-220, to get gender balance. 
Quebec legislated quotas, and in five years reached parity on crown boards. The same success came with legislation in France, Norway, Finland, Iceland, and Sweden. 
Without quotas, Canadian women will wait 72 years for equity. As Caroline Codsi from La Gouvernance au Féminin said, “When we legislate, we find women. When we do not legislate, we find excuses.”
Let us no more excuses. It is time for the government to act on women's equality. ",NDP,Nanaimo—Ladysmith,Sheila Malcolmson,http://www.parl.gc.ca/Parliamentarians/en/members/sheila-malcolmson(219399)
4713717,ca.proc.d.2017-06-07.9589151,2017-06-07,ad4032f2-6bb1-497b-b146-f321cfb71ba9,216102,"Hon. Pierre Poilievre (Carleton, CPC)",,Statements By Members,Government Policies,,"Mr. Speaker, last year, two little girls started up a lemonade stand to raise money for summer camp, but they were shut down by the government because they did not have a permit. This year, the current government has produced a permit application form for these young entrepreneurs, with 10 conditions and eight additional conditions. It requires they also report all of their revenue to the federal government, supposedly so that Revenue Canada can keep a careful eye on whether they are paying their taxes. 
Of course, the government needed to prevent chaos from breaking out. We do not need kids on the street playing road hockey or roasting marshmallows over an open flame with all those greenhouse gases being emitted. Finally some order is being restored, but along with it is a $37 billion problem, which is red tape. It prevents immigrants from working in their professions, prevents builders from constructing affordable housing, and prevents businesses from working for their customers instead of the bureaucrats.
Will the government finally stand out of the way of these young entrepreneurs?",Conservative,Carleton,Pierre Poilievre,http://www.parl.gc.ca/Parliamentarians/en/members/pierre-poilievre(216102)
4713718,ca.proc.d.2017-06-07.9589154,2017-06-07,0fd242c0-71bc-4c1b-a4e4-609a396eca76,229494,"Mr. Mark Holland (Ajax, Lib.)",,Statements By Members,Terrorist Attack in Afghanistan,,"Mr. Speaker, yesterday in Afghanistan another craven act of cowardice struck. 
Walking to prayers during the holy month of Ramadan, peaceful worshippers were targeted in Herat. As they went in to pray, they were assaulted. Seven lives were stolen and many people were left injured. They came to reflect on the core message of Ramadan—peace, compassion, and empathy—but were assailed by its opposite.
The smoke and destruction that desecrated the great Jama Masjid is a testament to the depravity of this action. It is evidence of a spineless evil that targets the innocent and most vulnerable with heartless indifference.
The victims and their families, the people of Afghanistan, and Afghans across Canada should know that this House and all of Canada stand with them. Know that we will not rest until such cowards are brought to justice and until such evil is extinguished.",Liberal,Ajax,Mark Holland,http://www.parl.gc.ca/Parliamentarians/en/members/mark-holland(229494)
4713719,ca.proc.d.2017-06-07.9589159,2017-06-07,6519cfba-0080-419d-baa9-8ae6e56d032f,232946,"Mr. Andrew Scheer (Leader of the Opposition, CPC)",,Oral Questions,Government Appointments,,"Mr. Speaker, by trying to appoint a Liberal donor and activist, Madeleine Meilleur, the Prime Minister made a mockery of a process he claimed would be open and transparent, but luckily Madame Meilleur has better judgment than he does and has withdrawn herself from a process that has become tainted. 
As a provincial minister, Madame Meilleur introduced a law that required multi-party support for positions like this. Will the Prime Minister learn a lesson here and ensure that the next officer of Parliament, the Ethics Commissioner, will not be another partisan Liberal and will enjoy all-party support in the House?",Conservative,Regina—Qu'Appelle,Andrew Scheer,http://www.parl.gc.ca/Parliamentarians/en/members/andrew-scheer(232946)
4713720,ca.proc.d.2017-06-07.9589162,2017-06-07,b8c04eca-f237-48a8-8975-374ccd40d1a9,214115,"Right Hon. Justin Trudeau (Prime Minister, Lib.)",,Oral Questions,Government Appointments,,"Mr. Speaker, we know that Canadians need a strong, independent appointment process, and that is why we reformed to an open way the appointments process in this country. After 10 years of excessive partisanship by the former Conservative government, we know that picking the best people for the jobs regardless of their backgrounds, people who reflect the full diversity of this country, is what Canadians expect. That is exactly what we are delivering.",Liberal,Papineau,Justin Trudeau,http://www.parl.gc.ca/Parliamentarians/en/members/justin-trudeau(214115)
4713721,ca.proc.d.2017-06-07.9589165,2017-06-07,6519cfba-0080-419d-baa9-8ae6e56d032f,232946,"Mr. Andrew Scheer (Leader of the Opposition, CPC)",,Oral Questions,Infrastructure,,"Mr. Speaker, after misleading Canadians for weeks, the Liberals finally admitted yesterday that their infrastructure bank will put taxpayers on the hook for failed projects, while the investors get all the profits. The finance minister claimed that there will be minimal risk to taxpayers. How reassuring. The Prime Minister also claimed that his deficits would be minimal too, but we all know how that turned out. 
Just how much taxpayer money is the Prime Minister willing to put on the line so that his billionaire friends get to keep all the profits? ",Conservative,Regina—Qu'Appelle,Andrew Scheer,http://www.parl.gc.ca/Parliamentarians/en/members/andrew-scheer(232946)
